start,end,text
2212.5,2219.2200000000003,キャスト全員にピンマークつけてくれる いやそういう知っちゃかめっちゃかなっちゃうそれはなんか俺がつけたくない
2219.2200000000003,2229.1,ディスコードのじゃあこのチームのディスコードを聞いてみましょうのほうが絶対に だって40人の声バーって流れてたらさ何が何だかわからない
2230.1,2232.1,ん
2234.2999999999997,2238.02,運命ことやっとるわー
2243.2599999999998,2246.18,運命こと
2250.42,2254.8199999999997,だそこはちゃんとドラフトして選ばれますか選ばれません
2259.66,2265.98,アーカイブ残るんじゃない いうあのオープンレックの仕様がごめんわかんない俺
2280.14,2282.66,多分あるよね アジャイなんか
2282.66,2287.22,1日2回まで 無料みたいなに当たっ
2287.26,2289.7000000000003,違ったっけ
2291.86,2296.1000000000004,そんな仕様があった気がする 2動画だけ
2296.1000000000004,2298.46,可能
2303.38,2311.3,いろいろさあまあどのあれもね配信とかイベントも多分俺はあんまり出たことねーから わかんねーけど
2311.5,2319.38,技術面マジでしっかりしてるのが本当に安心だわ 何でオープンレックなのいやもう分レック以外できねえでしょだってわかりました皆さん4
2319.38,2327.98,4曲ちょうだいちょうだい作れる気がなくないあんまり ちょうだいちょうだいってドアがくれるから多分100万ぐらいしかいないです多分
2329.42,2334.1400000000003,ちょうだいちょうだいでただこれたらさぁ よしやりましょう
2334.8599999999997,2337.8199999999997,しかもただでやりましょうって言っ
2340.2999999999997,2344.7,でもそういうのはいいんだよ別に知らねえよ うるせーつった
2344.7,2348.2999999999997,うるせーつって殴ってちょうげーって出てきた
2349.2999999999997,2352.02,久しぶりみんな
2352.6,2355.14,フンレッこのイベントでうま3あんのパー
2370.18,2371.94,行ってきました
2371.94,2374.5,me
2375.2,2377.4,4個
2377.96,2381.2599999999998,分
2382.1400000000003,2385.34,でもなかったらやんなくない? だって
2385.34,2388.5800000000004,なかったらやんないよね
2395.6200000000003,2399.5800000000004,あ、そう! だから俺は思ったの
2401.5800000000004,2407.1400000000003,それでいいじゃん プロモーションっていうかさ ここまで…いやもう
2407.14,2415.14,先に与えて与えて与えて与えてからの じゃあみんなそんな頑張ってんだったらオープンレックのプレミアム
2415.14,2421.62,会になろうねとかの方が美しくない? やっぱメリットを出してからのさ
2421.62,2425.94,目先のさ なんかその
2425.94,2430.9,あれより 絶対その方がいいんだよ
2431.5,2434.2999999999997,間違いなくね
2437.74,2441.58,こっちの方がいい 俺はちなみにそうやってやってきた
2441.58,2446.06,でも今はもうそれ主流じゃないし間違ってんだろうな
2448.02,2453.3399999999997,とりあえずおしゃれしていった方がいいですか? 知らない 皆なりのおしゃれが分かんない
2453.3399999999997,2456.62,ふんどしとかで来なきゃいいんじゃない
2458.58,2465.5,新幹線の時間あるけど36日解散は26日分かんない なんだっけなぁ19時とかじゃない
2466.14,2468.94,18時かな
2476.38,2481.38,18時19時 この
2482.26,2485.38,【コメント】夜の部は全員呼ぶの? 初日のってことでしょ
2485.38,2492.38,いやでもやっぱそれは都合 それはさ無理時はできないから
2499.38,2504.38,さすがに夜の部は全員呼ぶの? 夜の部は全員呼ぶの?
2504.38,2507.38,夜の部は全員呼ぶの?
2508.38,2513.38,さすがに正式に把握してない
2513.38,2517.38,初日のイベントの後特番やるんだよね
2517.38,2520.38,"4,5時間?"
2520.38,2523.38,暇じゃんだってみんな
2528.38,2532.38,無理無理無理 特番ね普通に番組
2538.38,2543.38,だからみんなにイヤホンして見に来てねって言わないと
2543.38,2547.38,いやそれゆるじゃない普通に無料無料無料
2547.38,2550.38,イベントとリンクしてるから
2557.38,2562.38,帰りの電車みんな暇じゃん あとホテルの中
2568.38,2575.38,"【コメント】5,000円ってあれでしょ 打ち上げ配信全部終わった後でしょ"
2575.38,2578.38,手違いで出ちゃったやつでしょ
2583.38,2586.38,でも俺の口から言ってんだよ
2586.38,2590.38,どっちを手違いですって広報して 俺の口から無料ですよって言って
2590.38,2594.38,みんながそれを信じないんだったら 虚無
2594.38,2598.38,【コメント】百式感動にお金払っておいてください
2598.38,2602.38,いやいや無料だって言ってんだよ 無料だって言ってんだろうが
2602.38,2606.38,そんなに金払いたいんだったら いいよいいよ俺がもらうよ払うよ今
2606.38,2609.38,1万5千円でいいよ一人 今2万人くらいいるから
2609.38,2613.38,2万×1万5千円ちょうだい俺に 3億くらい
2618.38,2621.38,【コメント】警備員として宿ってくれ 全力でお前を守る
2621.38,2624.38,82cm 84kgいいね
2624.38,2628.38,じゃあ当日特に頼んでもいないのに スーツ着てこうやって立ってくんない?
2628.38,2632.38,なんかあった時にお前が鉄砲棚になってくんない?
2632.38,2654.38,【コメント】ジャイアンツ対ソフトバンクの試合18時だけど見ませんか?
2654.38,2657.38,見ますか見ません 最近よくかもな 寝てないんだよね
2657.38,2662.38,寝眠時間がブワーって寝れた日の次の日って 舌が回る回るなんだけど
2662.38,2664.38,洗眠なんだよね
2668.38,2671.38,毛量が増えたんじゃない 普通に髪が伸びた
2678.38,2682.38,でも今日は絶対寝る スタンドゲラは12億6千万
2687.38,2699.38,【コメント】幕張のアパホテル泊まるのかな わかんない
2699.38,2706.38,俺どこ泊まるんだろう その辺は考えてない
2709.38,2714.38,できればでも家に帰りたい でも配信が1時2時に終わったとして
2714.38,2718.38,1時6時だから家帰ってきたら死んじゃうからさすがにホテルで寝ようかな
2718.38,2721.38,アパホテルで 多分さすがに撮ってるだろう
2723.38,2727.38,でも多分なんか当日結構イベントが重なってるらしいの
2730.38,2734.38,なんだっけアイドルのコンサートと
2736.38,2742.38,なんだっけ メタルのフェスみたいなのがあるんだよね
2744.38,2750.38,歌プリ 歌プリって知ってるよ アプリでしょ
2755.38,2757.38,ちょうど隣でやってんだって
2761.38,2768.38,歌のプリンセスじゃないの 音ゲーみたいなのじゃないの 歌プリって
2769.38,2772.38,ゲームじゃないの 音ゲーだよね
2775.38,2780.38,だよね それのライブがあるんだ
2792.38,2797.38,出演者のプレゼントボックス いやいらねーだろ 気持ちだけで十分だろ
2797.38,2800.38,あいつらみんな1億によく稼いでるからいらねーよ
2800.38,2803.38,みんな1億によく稼いでるからいらねーよ
2803.38,2806.38,いつもありがとうにしよう
2807.38,2810.38,やめようぜ 大変だってみんなも
2810.38,2813.38,お気持ちだけで十分なの 本当に
2816.38,2819.38,これは受け取るのがめんどくさいからとかじゃなくて
2819.38,2823.38,お気持ちだけで十分なんです 今回のイベントは還元なんです
2825.38,2828.38,可能な限り だから春休みにやってるんです
2828.38,2831.38,高校生大学生
2832.38,2837.38,月のお小遣い5千円よ もういいの 気持ちだけで
2840.38,2842.38,お気持ち
2843.38,2847.38,打速多分欲しいよ いや打速さ
2847.38,2852.38,じゃあ打速だけ作っとくわ 打速だけ作っとくわね 入り口に
2859.38,2863.38,UUUMに送るやつや
2863.38,2867.38,ファンレターはこちらまでってあるだろ
2871.38,2876.38,あそこに送ってください それぞれのみんなのところに送ってあげてください
2878.38,2882.38,お前の顔にレーザーポイント当てにいくわ この人警察に捕まるんですけど
2882.38,2887.38,出てきたら 今すぐ出頭すれば多分1週間後に出てこれるんで
2888.38,2892.38,待ってます 戻ってきてください
2892.38,2897.38,すぐ今日捕られれば厳重注意で俺に連絡が来て いや大丈夫で許してくださいって
2900.38,2905.38,そんなんで捕まんねえ 捕まるだろ レーザーポイント当てにいくから捕まるわ
2905.38,2908.38,余裕で捕まるだろ
2908.38,2911.38,そしたら俺が連絡くるじゃん警察から いやいや許してやってくださいって
2911.38,2915.38,俺のおかげでお前許されたよ その代わりお父さんとお母さんに連絡いくからね
2915.38,2920.38,でぶん殴られて上場借りの余地あり そこまでがセットな
2925.38,2928.38,失明するんだぞレーザーポインター
2929.38,2932.38,スポーツ幹線のレーザーポインターって捕まるだろ
2932.38,2937.38,お前当てにいくぞ 東京のWBCの件で言ってみろよ
2937.38,2941.38,レーザーポインター当てにいくぞとか書いてみ すぐ捕まるよマジで
2946.38,2949.38,最近のネットって厳しいからな
2950.38,2953.38,俺が動かないから捕まらないかもしれないけど
2963.38,2967.38,今さそれどころじゃない俺は 外に出れないし
2967.38,2969.38,俺は通報したよ
2969.38,2971.38,にーちゃんのさ
2972.38,2975.38,その流れなんか久々に聞いたわ10年くらい前の
2975.38,2977.38,俺は通報したよちなみに
2977.38,2980.38,そうやって冗談だと思ってるけど俺はちなみに一応通報したよ
2980.38,2983.38,あの画面を通報画面を見せられてるんだろうな
2983.38,2985.38,通報したって
2985.38,2987.38,俺も通報しよっかな
2987.38,2989.38,俺も通報しよっかな
2989.38,2991.38,俺も通報しよっかな
2991.38,2993.38,俺も通報しよっかな
2993.38,2995.38,通報したって
2995.38,2997.38,俺も通報しよっかな
2997.38,2999.38,なんか怖くなってきたみんな
3002.38,3004.38,怖くなってきた普通に
3013.38,3015.38,怖い
3019.38,3021.38,ゲーム大会の配信何されるんですか何しようかな
3021.38,3023.38,とりあえず今日は
3023.38,3025.38,そんなイベントとかいいんだよ
3025.38,3027.38,WBCのこと考えようぜ
3029.38,3031.38,まずは
3031.38,3033.38,そっから
3035.38,3037.38,気になっちゃうからどちらのせよ
3041.38,3043.38,まずは米制
3043.38,3045.38,いや今日消化試合じゃないよ
3045.38,3047.38,イタリアがちょっとやばい
3047.38,3049.38,強いから
3049.38,3051.38,今日負けたら終わりだからね
3053.38,3055.38,同時主張する
3063.38,3065.38,強いじゃん
3065.38,3067.38,でも日本の方が強いよ
3067.38,3069.38,100回やったらマジで80回ぐらい勝つ
3069.38,3071.38,でも20回負けんだよ
3071.38,3073.38,地割れ当てられたみたいな感じだよ
3073.38,3075.38,あるでしょ
3089.38,3091.38,あー気持ちいい
3093.38,3095.38,韓国態度悪かった?
3095.38,3097.38,別に俺
3097.38,3099.38,マウンドに旗立てられないから
3099.38,3101.38,基本的に試合中は熱くなってるから
3107.38,3109.38,その
3109.38,3111.38,妄想の範疇を出ないんだよね
3111.38,3113.38,わざと狙われたとかさ
3113.38,3115.38,あれって結局本当に分かんないことだからさ
3115.38,3117.38,証明ができないんだよね
3117.38,3119.38,リリースポイントをしっかり見てれば分かるって言うけど
3119.38,3121.38,やっぱ
3121.38,3123.38,分からんよ
3123.38,3125.38,俺チェコ戦のさ
3125.38,3127.38,あれ見たけど
3127.38,3129.38,あれ見たけど
3129.38,3131.38,藤並ぐらい分かりやすくスッポ抜けてたら
3131.38,3133.38,わざとじゃないんだろうなって分かるけど
3133.38,3135.38,デッドボールって分かんねんだよな
3135.38,3137.38,で多分
3137.38,3139.38,当てたい選手っていないと思うんだよね
3139.38,3141.38,基本的には
3141.38,3143.38,だって人が死ぬかもしれないんだぜ
3151.38,3153.38,で分かりやすくさ
3153.38,3155.38,行った事実だったら分かるけど
3155.38,3157.38,妄想の域を出ないんだよな
3163.38,3165.38,いやアレックスロドレス
3165.38,3167.38,アレックスロドレスゲスは
3167.38,3169.38,当たりまくったのは
3169.38,3171.38,ステロイドを使っていたからです
3179.38,3181.38,ステロイダーだからです
3181.38,3183.38,1年間の出場禁止を
3185.38,3187.38,受けたからです
3191.38,3193.38,お前一週間も戦欲どうすんだ
3193.38,3195.38,全員一週間ぐらい我慢できるでしょ
3201.38,3203.38,全然そんなことは心配じゃない
3205.38,3207.38,えっなんで一週
3207.38,3209.38,いや一週間ぐらい我慢できるだろ
3211.38,3213.38,わしはできるよ
3213.38,3215.38,我慢できるよ
3223.38,3225.38,じゃあお前の心配はなんだろう
3231.38,3233.38,今のところ何もないかな
3233.38,3235.38,何しよっかなーって
3235.38,3237.38,なかなかなくない
3239.38,3241.38,何にも
3241.38,3243.38,予定ないんだよ
3243.38,3245.38,やばくない
3257.38,3259.38,好きな時に
3259.38,3261.38,タバコ吸いに行って
3261.38,3263.38,好きな時に
3263.38,3265.38,何も決めてない
3265.38,3267.38,ゲーム配信するかもしれないし
3267.38,3269.38,なんかするかもしれないし
3269.38,3271.38,何も決めてない
3271.38,3273.38,今頭の中WPCでいっぱい
3293.38,3295.38,何も分からん
3317.38,3319.38,いや俺
3319.38,3321.38,なんで東京オリンピック
3321.38,3323.38,俺東京オリンピックの野球
3323.38,3325.38,一試合も見てないんだよ
3325.38,3327.38,誰が出たかとか知らねーわ
3327.38,3329.38,優勝したよね日本で
3333.38,3335.38,いやマジで興味なかったんだよね
3335.38,3337.38,俺配信してたもんだって
3341.38,3343.38,メンバーはもう村上がいたんじゃないかな
3343.38,3345.38,22歳とかで
3351.38,3353.38,なんかベストオーダーじゃないじゃん
3353.38,3355.38,メンツが
3357.38,3359.38,アマチュアの祭典ってイメージがあってさ
3359.38,3361.38,昔はそうだったよね
3365.38,3367.38,シドニーくらいからなんか
3367.38,3369.38,松坂とか出たの
3369.38,3371.38,そうだよねアトランタの次だよね多分ね
3371.38,3373.38,アトランタ96でしょ
3373.38,3375.38,2000年のシドニーくらいから
3377.38,3379.38,プロ参戦みたいな
3381.38,3383.38,だった気がする
3387.38,3389.38,古田が出たのはアトランタだね
3389.38,3391.38,社会人時代の
3391.38,3393.38,チャップマンも
3411.38,3413.38,チャップマンも
3413.38,3415.38,いつだっけな
3419.38,3421.38,あそうだ古田バルセロナだ
3423.38,3425.38,昨日のピザラジどうでした
3425.38,3427.38,昨日のピザラジ
3427.38,3429.38,疲れ果ててて
3429.38,3431.38,風呂にも入らずに行って
3431.38,3433.38,何喋ったか一言も覚えてない
3435.38,3437.38,本能で本能のピザ
3437.38,3439.38,本能のピザラジやってた
3447.38,3449.38,あの声優さんめっちゃ綺麗だったわ
3449.38,3451.38,それだけは鮮明に覚えてる
3451.38,3453.38,あの声優さん鮮明に覚えてる
3455.38,3457.38,俺透明感ある子好きなんだよな
3461.38,3463.38,あの声優さん
3463.38,3465.38,俺透明感ある子好きなんだよな
3469.38,3471.38,むちゃくちゃ綺麗だったよ
3471.38,3473.38,声も綺麗だったし
3487.38,3489.38,シェンムー好きって言ってた
3489.38,3491.38,シェンムーとジュン好きって言ってた
3491.38,3493.38,どれ
3509.38,3511.38,茨城県立高校の部活動が
3511.38,3513.38,平日2時間土日4時間に
3513.38,3515.38,制限された県立でどう思いますか
3515.38,3517.38,私立との差が広がる等の批判の声がある
3517.38,3519.38,私立との差が広がる等の批判の声がある
3521.38,3523.38,私立行くしかねえよな
3531.38,3533.38,めちゃくちゃ野球脳じゃん
3535.38,3537.38,俺だったらラッキーと思っちゃったの
3537.38,3539.38,部活から早く帰れてラッキーと思ったんだけど
3539.38,3541.38,お前甲子園を後ろに描いてるだろ
3541.38,3543.38,お前甲子園を後ろに描いてるだろ
3543.38,3545.38,一個のh2みたいな物語をお前想像してないか
3545.38,3547.38,一個のh2みたいな物語をお前想像してないか
3559.38,3561.38,短い方がいいじゃん
3563.38,3565.38,勉強とかの時間も増えるし
3565.38,3567.38,勉強とかの時間も増えるし
3575.38,3577.38,やるやつは一人でやるんだよ
3577.38,3579.38,やるやつは一人でやるんだよ
3579.38,3581.38,やるやつは一人でやるんだよ
3587.38,3589.38,勝手にやるよ
3589.38,3591.38,勝手にやるよ
3591.38,3593.38,勝手にやるよ
3595.38,3597.38,勝手にやるよ
3597.38,3599.38,勝手にやるよ
3619.38,3621.38,悔しいけど実態させてもらいます
3625.38,3642.38,【コメント】WBC早く負けて発言で野球嫌い芸人ニューヨークのシマッサが炎上。 学校や職場で野球見てないと非国民扱いされる。
3642.38,3650.38,いやすげーバカが多いからさー
3650.38,3656.38,野球つまんねーなーとか本人の自由だからいいけど早く負けてってもう性格がもうちょっと歪んでるって
3656.38,3659.38,俺別にサッカー好きじゃねーけど早く負けてって思ったことないもん
3659.38,3668.38,せっかく出てんだったら日本応援するよっていうスタンスだもん俺でもサッカーが全然好きじゃないんだぜ
3668.38,3675.38,だからニューヨークのファンの前でニューヨークM1早く負けますようにってみんなで言ったらそれ言われないと分かんない奴に逃げようなんだ
3675.38,3678.38,やっぱ分からないと
3678.38,3683.38,誰も思ってなくない早く負けろ早く負けろと言わなくない
3684.38,3690.38,好きとか嫌いとかは本人たちの自由だから俺たちはサッカーが全然でもこの前のワールドカップおもろかったけどね
3690.38,3694.38,早く負けてっていうのはやっぱ日本を一応だよ
3694.38,3700.38,日の丸背負って頑張ってる奴らがいるんだよしかも自分たちよりだいぶ若い
3700.38,3702.38,20歳よ
3702.38,3705.38,高校生よほぼ
3705.38,3708.38,甲子園出てる奴に早く負けろって言わなくらい
3708.38,3710.38,20歳よ
3710.38,3715.38,その人たちの気持ちをなんで考えられないの
3715.38,3718.38,そんなこと言う必要がないじゃん普通に
3718.38,3722.38,俺は国民全員幸せになってほしい
3722.38,3724.38,マジで
3726.38,3728.38,俺はね
3728.38,3731.38,みんなが幸せになるといいなーって
3731.38,3735.38,またお金配ろうかなみんなに内緒で
3735.38,3742.38,俺だよよく養護施設とかになぜか2000万円届きましたほぼ俺だよ
3742.38,3746.38,この世の中の使って
3746.38,3751.38,俺が浮気してたりするのも浮気の回数かける100台
3751.38,3755.38,寄付するって言ってるじゃん
3755.38,3758.38,タイガーマスクだよ俺
3762.38,3765.38,早く負けろは好きな奴しか言っちゃいけない
3765.38,3767.38,俺が
3767.38,3770.38,例えば半信ファンか巨人ファンに負けろっていうのはあり
3770.38,3773.38,なぜならライバルだから
3773.38,3777.38,嫌いな奴とかは無関心でいなきゃいけない
3777.38,3779.38,若者がかわいそう
3779.38,3783.38,村上がかわいそうあんな奴が叩かれてさ
3783.38,3786.38,私負けへんつってさ
3792.38,3797.38,貧困小児施設に5000万以上寄付した中国人だお前
3805.38,3809.38,ちなみにニューヨーク早く負けろって言ってないスキジの見出しに釣られてます
3809.38,3815.38,見たよそれなんか相方が冗談で言ったみたいなことでしょ
3815.38,3817.38,これ見たぞその
3817.38,3823.38,野郎野球のことってムキになるからめちゃくちゃ調べました
3827.38,3832.38,俺松井のことで野球のことに関しては結構ムキになるから
3837.38,3841.38,日本が強すぎるみたいな
3842.38,3849.38,早く負けろって言ってたよなっていうボケに対して言ってるかみたいな感じだよね
3851.38,3855.38,いやロッチはまじでまだ許してないまじで
3855.38,3857.38,松井さん無職ですよね
3857.38,3861.38,引退して翌年の松井に無職ですよねって言って
3861.38,3863.38,あれ何年だもう9年前
3863.38,3865.38,38年に引退して今年47か
3865.38,3868.38,8年間まだ俺ロッチを許せてないのね
3869.38,3871.38,小門健太郎
3874.38,3876.38,早く許したい
3884.38,3888.38,まだちょっとギスギスしてるね
3899.38,3903.38,吉野部への記事は何吉野部への記事って
3907.38,3909.38,知らない
3910.38,3916.38,お声今年良いっぽいね14出す6腕だとこ言ってたよ
3919.38,3924.38,オープン戦じゃなくてさ本番で打ったよ
3929.38,3932.38,12試合連続アンダー
3933.38,3941.38,センター決まったじゃんやだ開幕スタメンお声だったらなんか暗黒臭がする
3941.38,3947.38,ダメだお声はいい選手だけどレギュラーじゃないんだ
3951.38,3954.38,25今年
3955.38,3959.38,一番センターお声か
3966.38,3970.38,4番中井の年は中井打ってたから
3978.38,3981.38,お声レフトか
3982.38,3985.38,最近坂本やばい
3987.38,3990.38,14出す1アンダーとか2アンダーだよね
3990.38,3993.38,坂本なんか春咲打たねーんだ
3997.38,4002.38,まだバッティングの方はちょっと大丈夫じゃないかなどうだろうな
4006.38,4009.38,35だもんな
4012.38,4015.38,お声
4022.38,4025.38,怖い
4028.38,4031.38,守備もひどい
4034.38,4039.38,まあなぁ35つったら肉体的な衰えはもうちょっととんでもないからね
4039.38,4042.38,普通引退している年だもんな
4045.38,4049.38,ベテランでさ活躍してる人がピックアップされがちだから
4050.38,4053.38,40までできるだろうって
4054.38,4058.38,当たり前に思ってるんだけどその活躍してる人も1000倍引退してるからね
4058.38,4061.38,野球選手の平均寿命は28歳までだから
4062.38,4065.38,もう7年も平均寿命を越してる
4066.38,4069.38,しかもましてやショート
4073.38,4076.38,レフトとかに行った方がいいのかな
4078.38,4081.38,和田とかね
4082.38,4085.38,バーランダーとかさ
4087.38,4090.38,青木まだ41なんだ
4090.38,4093.38,ほらもう俺も麻痺してる
4093.38,4096.38,ちょっとタバコ吸ってこよう
4096.38,4099.38,みんなちょっとママと一緒に待っててくんない?
4102.38,4105.38,ママと一緒に待っててくんない?
4105.38,4108.38,ママと一緒に待っててくんない?
4108.38,4111.38,ママと一緒に待っててくんない?
4113.38,4116.38,いいじゃん
4117.38,4120.38,やめよう面倒くさいから
4120.38,4123.38,赤のセッター
4138.38,4142.38,私たちの生きることができるのではないかと
4142.38,4144.38,私たちの生きることができるのではないかと
4144.38,4146.38,私たちの生きることができるのではないかと
4146.38,4148.38,私たちの生きることができるのではないかと
4148.38,4150.38,私たちの生きることができるのではないかと
4150.38,4152.38,私たちの生きることができるのではないかと
4152.38,4154.38,私たちの生きることができるのではないかと
4154.38,4156.38,私たちの生きることができるのではないかと
4156.38,4158.38,私たちの生きることができるのではないかと
4158.38,4160.38,私たちの生きることができるのではないかと
4160.38,4162.38,私たちの生きることができるのではないかと
4162.38,4164.38,私たちの生きることができるのではないかと
4164.38,4166.38,私たちの生きることができるのではないかと
4166.38,4168.38,私たちの生きることができるのではないかと
4168.38,4170.38,私たちの生きることができるのではないかと
4170.38,4172.38,私たちの生きることができるのではないかと
4172.38,4174.38,私たちの生きることができるのではないかと
4174.38,4176.38,私たちの生きることができるのではないかと
4176.38,4178.38,私たちの生きることができるのではないかと
4178.38,4180.38,私たちの生きることができるのではないかと
4180.38,4182.38,私たちの生きることができるのではないかと
4182.38,4184.38,私たちの生きることができるのではないかと
4184.38,4186.38,私たちの生きることができるのではないかと
4186.38,4188.38,私たちの生きることができるのではないかと
