start,end,text
0.0,2.0,次に、、、、、
30.0,32.0,こんにちは
32.0,34.0,よろしくお願いします
34.0,36.0,この時間からね
36.0,38.0,お届けしていこうかなと
38.0,40.0,思います
40.0,42.0,本当にねー
42.0,44.0,そうなんですよ
44.0,46.0,本当にねー
46.0,48.0,そういうわけない
48.0,50.0,本当にそういうわけなんですよ
50.0,52.0,咳払い
52.0,54.0,そうなんだよ
54.0,56.0,本当にねー
56.0,58.0,そういうわけない
58.0,60.0,そうなんだよ
60.0,62.0,枠取りちょっと遅くなっちまったな
62.0,64.0,できるだけねー早々にね
64.0,66.0,あれ?まだ終わってないよね?
66.0,68.0,ぐらいのね枠取りの速さを見せつけて
68.0,70.0,いこうかなと思います
70.0,72.0,うんこちゃんって
72.0,74.0,かっこいいよな
74.0,76.0,俺は別れだけど1年以上
76.0,78.0,片思いで見れんだらだら
78.0,80.0,あーまあねー
80.0,82.0,そういうもんでしょ多分
82.0,84.0,今度の土日にゲーム実況な
84.0,86.0,何お前の中で決めてんの
86.0,88.0,ゲーム実況しばらくやりません
88.0,90.0,雑談飽きるぐらいまで雑談してやろうかなと
90.0,92.0,何のゲームやればいいか
92.0,94.0,わかんないんだよなー
94.0,96.0,何のゲームをやればいいのか
96.0,98.0,なかなかね難しいとこなんだよ
98.0,100.0,ハードルが高いんだよゲーム実況っていうのは
100.0,102.0,逆再通はね絶対やらない
102.0,104.0,やらないと思う
104.0,106.0,うんこ一回動画あげれば復活しない人欲しい
106.0,108.0,いいじゃねーかよ影でこそこそやらせてください
110.0,112.0,スペランカーとかでいいよ
112.0,114.0,妥協してんじゃねーかよすでにやる前から
114.0,116.0,ちょっとさー
116.0,118.0,この時間のねこの時間の放送もしていきますよ
118.0,120.0,ちゃんと
120.0,122.0,この時間の放送もしれっとね
122.0,124.0,していければなと
124.0,126.0,朝のこの時間か夜の
126.0,128.0,8時9時ぐらいにね
128.0,130.0,主にやっていこうかなと思います
130.0,132.0,クラッシュバンディング
132.0,134.0,スーファミ系でいこうぜ
134.0,136.0,2人しかいません
136.0,138.0,すいませんでした
138.0,140.0,私含め3人になったんで
140.0,142.0,仲良くしていきましょう
142.0,144.0,3人でね
144.0,146.0,個人的にね小規模のグループとしてね
146.0,148.0,活動していければなと
148.0,150.0,心霊スポットに一人で行く企画は
150.0,152.0,なんかでもみんなやってんでしょそんなの
152.0,154.0,他の人はやってんじゃん
154.0,156.0,だからちょっとさー
156.0,158.0,まあそれはいいかなと
158.0,160.0,しかもあれじゃない
160.0,162.0,外で配信するときってさ
162.0,164.0,電波の関係とかがさー
164.0,166.0,あーだこうだしてしまってさー
166.0,168.0,ちょっとあれなんだよね
168.0,170.0,なかなか難しいんだよね
170.0,172.0,最終的にそうなってくるね絶対ね
172.0,174.0,最終的にさー
174.0,176.0,5年後とかはさー
176.0,178.0,宇宙とかになってんだろうな
178.0,180.0,ちょっと鼻水かむわ
180.0,182.0,よろしくお願いします
202.0,204.0,東京ドームで運動会まだやらんの
204.0,206.0,あーなかなかいい企画だよね
206.0,208.0,ジャニーズ
208.0,210.0,ジャニーズそんな企画でしょ
210.0,212.0,まあそういうのはねかっこいい人たちに任せます
216.0,218.0,スカイダイビングかー
218.0,220.0,あーなるほどね悪くないね
220.0,222.0,スカイダイビングは悪くねーな
222.0,224.0,うんこのおすすめデートスポットめぐり
224.0,226.0,おー
226.0,228.0,えなんかあれでしょ
228.0,230.0,俺がなんかさ
230.0,232.0,AVみたいにさ
232.0,234.0,AVみたいに
234.0,236.0,俺がみんな
236.0,238.0,みんなカメラに向かってガチでさ
238.0,240.0,彼女に喋りかけてるみたいに
240.0,242.0,感じで一人で
242.0,244.0,八景島シーパラダイスとかで行くんでしょ
244.0,246.0,いいねそれ
246.0,248.0,多分お前ら俺に惚れるぞほんとに
248.0,250.0,俺でオナニーを始めるぞほんとに
250.0,252.0,気をつけてくださいね
252.0,254.0,男性諸君はホモに目覚めるかもしれないんで
254.0,256.0,そんな配信してしまったら
256.0,258.0,クブクリンホモに目覚めるんで
258.0,260.0,まあちょっとねやっていこうかなと
260.0,262.0,まあ確かにねでも本気でやるとしたら
262.0,264.0,本気でやりますよ
264.0,266.0,本気でやりますよ
266.0,268.0,見たいでしょでもちょっと
268.0,270.0,ちょっとだけ見たいでしょ
270.0,272.0,うんこちゃんが普段どういうところでデートしてんのかなと
272.0,274.0,見たいでしょ
274.0,276.0,もうホモだから大丈夫
276.0,278.0,分かりましたよかったです
278.0,280.0,それだったらね安心して開催をしていこうかなと
280.0,282.0,本気のキス顔希望
282.0,284.0,ちゃんと最終的にCまではしっかりね
284.0,286.0,カメラとCまではね
286.0,288.0,しっかりやっぱそこまでが
288.0,290.0,ちゃんとしたデートだと思うんで
290.0,292.0,渋谷会かよ
292.0,294.0,俺でもね
294.0,296.0,昔よくあったよ
296.0,298.0,渋谷で女とデートしてて
298.0,300.0,ものすごい渋谷会館で
300.0,302.0,スト2やりたくなって
302.0,304.0,お腹痛いふりして渋谷会館のトイレちょっと行ってくるわ
304.0,306.0,スト2ワンコインだけして帰ったことあります
306.0,308.0,それをねできるだけね
308.0,310.0,彼女にバレないように
310.0,312.0,いかにその時間を使うかと
312.0,314.0,いやいややるでしょどう考えても
314.0,316.0,そういう欲しさに襲われることないの
316.0,318.0,デート中にものすごく
318.0,320.0,アニバーサリーエディションがやりたいみたいなさ
320.0,322.0,あるでしょどう考えても
322.0,324.0,やりますやります
324.0,326.0,俺ラブホテルとか知らないんだよほんとに
326.0,328.0,お金持ってなかったからさ
328.0,330.0,ホテルとか全然行かなかったんだよ
330.0,332.0,レンタルルームとかで済ませてました
332.0,334.0,レンタルちょっとさ酒飲みてぇから
334.0,336.0,レンタルルーム行こうぜつってね
336.0,338.0,そのデリジョーがよく使う
338.0,340.0,レンタルルームを
340.0,342.0,ラブホテル代わりにしてました
342.0,344.0,2000円ぐらいで行けるんでね
344.0,346.0,最近でもちょっと厳しいんだよな
346.0,348.0,風営法がさちょっとなんか厳しくなって
348.0,350.0,レンタルルーム借りれなくなっちゃったんだよね
352.0,354.0,松島来ないの
354.0,356.0,あーなんかねちょっとねそうやってね
356.0,358.0,巡っていきたいんだけどな
358.0,360.0,巡ってはいきたいんだけどね
360.0,362.0,ちょっとあれなんだよね
362.0,364.0,視聴者の家に行く企画はどうなった
364.0,366.0,別にやってもいいんだけどさ
366.0,368.0,俺放送中以外そいつと喋らないでしょ
368.0,370.0,だって
370.0,372.0,そいつはさなんか俺喋りかけてくるんでしょ
372.0,374.0,ねえねえうんこちゃんなんとかなんですかみたいな
374.0,376.0,ねえ言われるけどうんみたいな
376.0,378.0,俺すごいそういうなんていうのかな
378.0,380.0,うんこちゃんじゃない時の自分を見せたくないんで
380.0,382.0,常にしかもねマスクをかぶっていなきゃいけないんで
382.0,384.0,かなり息が持たないと
384.0,386.0,なかなか難しい話になってきてるんですよね
386.0,388.0,本当に本当に
388.0,390.0,うんこちゃんのUSJで遊ぶ配信
390.0,392.0,あーでもそういうの撮影しちゃいけないでしょ
392.0,394.0,多分
394.0,396.0,撮影しちゃいけないと
396.0,398.0,視聴者に好かれてると思うのよ
398.0,400.0,なるほどねなんか相思相愛の逆ですね私たち
400.0,402.0,俺もお前らのことそんな好きじゃないし
402.0,404.0,お前らも俺のことそんな好きじゃないと
404.0,406.0,心がけていければなと思います
406.0,408.0,いやでもさあ
408.0,410.0,なんかパートナーみたいの
410.0,412.0,欲しいんだよねなんかさあ
412.0,414.0,雑用雑用
414.0,416.0,配信中に俺が配信に
416.0,418.0,集中できるようにちょっと水買ってきて
418.0,420.0,みたいな感じでさ常に
420.0,422.0,俺がもう家で配信すると決めた時は
422.0,424.0,もうそいつがアシスタント
424.0,426.0,マイクの位置の調整パンを
426.0,428.0,買ってくるとかさそういうの欲しいんだよね
428.0,430.0,いやでもさ水ちゃん家が
430.0,432.0,遠いじゃん家が遠いじゃん
432.0,434.0,ちょっとあれなんだよね
434.0,436.0,あのー
436.0,438.0,なかなか難しい話になってるんですよ
444.0,446.0,いやでもさあ
446.0,448.0,一人で頑張っていきたいんだよ俺は
448.0,450.0,一人で頑張っていきたいそういう人を奥さんに
450.0,452.0,しようなるほどね発想の
452.0,454.0,転換ってやつだなそれは
454.0,456.0,その配信を充実させるための
456.0,458.0,奥さんをもらうと
458.0,460.0,ちょっとねそれは悲しいかなと
460.0,462.0,だってさあ
462.0,464.0,結婚式とかでさあ
464.0,466.0,挨拶するわけでしょ今後も二人で
466.0,468.0,配信頑張っていきますみたいなこと言えないでしょ
468.0,470.0,さすがにちょっとあれなんだよね
470.0,472.0,そんな痛い夫婦にはなりたくないんだよな俺
472.0,474.0,もっとさまっとうのさ
474.0,476.0,まっとうな結婚生活を送りたいんだよね
476.0,478.0,そして第二のガッチマン家
478.0,480.0,なるほどね分かりました
480.0,482.0,そのポジション私がしっかりとね
482.0,484.0,えーもらえるように仕上げていこうかなと
484.0,486.0,思いますガッチマン2世はね
486.0,488.0,もうすでにねその
488.0,490.0,この枠ガッチマンの枠をね私が
490.0,492.0,狙っていけるようにしていこうかなと
492.0,494.0,ガッチマンのガッチって
494.0,496.0,何知りません
496.0,498.0,知りません
498.0,500.0,ガッチマンのガッチって何なんだろうね
500.0,502.0,よく分かんない俺もうそんなに考えて
502.0,504.0,なかったなあそんなに考えてなかった
504.0,506.0,毎回
506.0,508.0,配信に向けて体仕上げてこいよ
508.0,510.0,最近ねその配信を
510.0,512.0,1ラウンド30分戦えるように
512.0,514.0,腹筋を始めました本当に昔はさあ
514.0,516.0,その配信でねしっかりね
516.0,518.0,気持ちが皆さんに届くように腹筋を
518.0,520.0,1日で500回してたんですけど
520.0,522.0,ちょっと配信をやめてその腹筋をねすることもなくなっちまったんですけど
522.0,524.0,最近まだちょっとね
524.0,526.0,体絞らなきゃちょっと戦えないなと
526.0,528.0,思いまして腹筋もね始めました
528.0,530.0,いやでもさあ
530.0,532.0,ガッチマンとかなんかスケベ
532.0,534.0,ドスケベっぽいなあ
534.0,536.0,でもなんかいい人っぽいよね
536.0,538.0,いい人だと思う中国地方で
538.0,540.0,中国地方でどの県が一番好き
540.0,542.0,中国だ
542.0,544.0,中国地方あんまりあれだな山口とかで
544.0,546.0,山口とかで
546.0,548.0,私山口好きですよ何もないところが好き
552.0,554.0,ロナウドは毎日3000回腹筋してんだよ
554.0,556.0,えあんなブクブクなのに
556.0,558.0,あんなブクブクなのに毎日3000回
558.0,560.0,えでもさあ1日3000回腹筋してたらさあ
560.0,562.0,たぶんさあ1日のうちの
562.0,564.0,大半が腹筋で終わらねえか
564.0,566.0,そんな人生悲しくねえかサッカーしてねえだろと
566.0,568.0,考えても1日3000回腹筋してたらさあ
568.0,570.0,サッカーできなくない
570.0,572.0,あクリスティアーノのほうね
572.0,574.0,クリスティアーノロナウドのほうね
574.0,576.0,なるほどねロナウドかと思った
576.0,578.0,あのブラジルの
578.0,580.0,ブラジルのほうかと思った
580.0,582.0,うーん
582.0,584.0,第100巻に第2シーズンとか書いてあるけど
584.0,586.0,第3じゃねえのやめてください
586.0,588.0,ボーイズBみたいにねそんなシーズンつけないでください
588.0,590.0,私は私なんで
590.0,592.0,ボーイズBみたいに私を扱わないでください
594.0,596.0,ブラジルのほうはオワカン
596.0,598.0,へえ
600.0,602.0,いやアンビシャスのほうじゃないです
602.0,604.0,エロアニメのほうです
604.0,606.0,俺の言ってるボーイズBは
606.0,608.0,今日もタクシー通勤
608.0,610.0,タクシーは絶対やめようと
610.0,612.0,そろそろ金をね
612.0,614.0,お金のほうをために
614.0,616.0,ためていかなきゃいけないなと
616.0,618.0,そういう年齢に差し掛かってきてるから
618.0,620.0,最近ちょっとね昨日も
620.0,622.0,タクシー通勤を封印して
624.0,626.0,本当に本当に
626.0,628.0,タクシー通勤を
628.0,630.0,やめて電車でちゃんと通うようになりました
630.0,632.0,センター8割取れた
632.0,634.0,おめでとうございます
634.0,636.0,ニコ動引退ニコ生爆破復帰
636.0,638.0,今ここつまり第3
638.0,640.0,なるほどね
640.0,642.0,なんかでもさあれなんだよね
642.0,644.0,あれなんだよね
644.0,646.0,次どこでさ
646.0,648.0,どこで俺はやっていけばいいのか
648.0,650.0,ユーストとかもさ
650.0,652.0,はっきり言ってあんまりやる気しないじゃん
652.0,654.0,ユーストリームとかでやってるのって
654.0,656.0,あんまりあれじゃない
656.0,658.0,どうなんだろうね
658.0,660.0,ニコ生はさ
660.0,662.0,やり尽くした感があるんだよな
662.0,664.0,俺すげえ
664.0,666.0,やり尽くした感があるんだよな
666.0,668.0,俺
668.0,670.0,いつ始まるかわからんしな
670.0,672.0,そこはもう常駐してくださいよ
672.0,674.0,常駐
674.0,676.0,そこは常駐してください
676.0,678.0,うんこってそんないい企業に勤めてるの
678.0,680.0,みんなの中で妄想がどんどん
680.0,682.0,どんどん膨らんできますね
682.0,684.0,私がいつもブラック企業で働いてる
684.0,686.0,っていうのはネタだと思ってるんですか
686.0,688.0,これガチですよ私
688.0,690.0,いい企業になんか勤めてません
690.0,692.0,昔はニコ生嫌ってたのにな
692.0,694.0,そうだよね
694.0,696.0,やっぱ経験する前に悪口言うっていうのは
696.0,698.0,あれなんだよな
698.0,700.0,エテシってそうやって自分にブーメランで返ってくるんだよね
700.0,702.0,ものすごく居心地がいいです
702.0,704.0,この30分好き放題して
704.0,706.0,もうあれです
706.0,708.0,嫌な感じになっちゃって
708.0,710.0,30分経っても終わってくれるんだ勝手に
710.0,712.0,好き放題できるんでね
712.0,714.0,ニコ生ってさ
714.0,716.0,ユーストリームとかってさ
716.0,718.0,ここだけの話ね
718.0,720.0,ニコ生ってさ
720.0,722.0,他の人のことを言っても
722.0,724.0,結構寛容じゃん
724.0,726.0,寛容じゃない
726.0,728.0,例えば
728.0,730.0,ユーストリームとあれさ
730.0,732.0,ガッチマンがさ
732.0,734.0,絶対さ
734.0,736.0,ちびっこたち発狂するでしょ
736.0,738.0,発狂するでしょ
738.0,740.0,ニコ生って結構そういうのがゆるいじゃん
740.0,742.0,本当に
742.0,744.0,全然ゆるい
744.0,746.0,だからユーストリーム面白くないんだよね
746.0,748.0,全然ゆるいよ
748.0,750.0,例えば俺がユーストリームチェッカーで
750.0,752.0,今後ユーストリームで配信していきます
752.0,754.0,みたいなことになったとしても
754.0,756.0,絶対面白くないと思う
756.0,758.0,言えないもん俺めんどくさくて
758.0,760.0,最近ガッチマン狙ってんの
760.0,762.0,狙ってません憧れてます
762.0,764.0,羨んでます主に
764.0,766.0,寝る前にいいなガッチマンは
766.0,768.0,こんな再生数伸びて
768.0,770.0,ガッチマンを羨んでます
770.0,772.0,逆じゃねえよ
772.0,774.0,見てみろよユーストリームの配信
774.0,776.0,実況者だけだけどね
776.0,778.0,実況者だけだけどね
778.0,780.0,本当にそうなんだよね
780.0,782.0,ニコ生の方が
782.0,784.0,ゆるくて好きだわすごく
784.0,786.0,ゆるくてね
786.0,788.0,かなり好きです
788.0,790.0,カムフォーか
790.0,792.0,あれも屈折してるでしょ何気に
792.0,794.0,屈折してるからね
794.0,796.0,ちょっとなかなか難しいんだよね
796.0,798.0,またスター玉にのち上がりたいの
798.0,800.0,あー
800.0,802.0,そうなんだよな
802.0,804.0,動画と生配信は両立することが
804.0,806.0,不可能だと思うんだよね
806.0,808.0,だって動画にしたらもうちょっとさ
808.0,810.0,毒気を抜かなきゃいけないでしょ
810.0,812.0,俺もう耐えらんねえよ
812.0,814.0,我慢して人の悪口言わねえの耐えられません
814.0,816.0,毒気を抜かれたくありません
816.0,818.0,だってもうちょっとさ
818.0,820.0,いい子ちゃんぶらなきゃいけないでしょ
820.0,822.0,絶対いい子ちゃんぶんなきゃいけないでしょ
822.0,824.0,こんにちはみたいな感じでさ
824.0,826.0,絶対無理だよ
826.0,828.0,めんどくせえ怒られるよまた
828.0,830.0,くだらねえ連中に
830.0,832.0,くだらねえ連中に怒られるんでやめてください
832.0,834.0,私はね一人でこうやってねオタクのような配信をしていくのが
834.0,836.0,一番好きなんで
836.0,838.0,動画は引退したから申し訳ない
838.0,840.0,うんこちゃんイロリは元気にしてる
840.0,842.0,あーわかんねえどうなんだろう
842.0,844.0,最近ガチで見ないんだけど
844.0,846.0,ガチでちょっと見なくなってねだりしづらいです
846.0,848.0,弱いものいじるみたいになっちゃうといけないんで
848.0,850.0,ガチでね荒れちゃいそうなんで
850.0,852.0,最近イロリさんのその具をちょっと知ってる人がいたらね
852.0,854.0,私に一歩遅れればなと
854.0,856.0,私は本当にイロリさん応援してるんで
856.0,858.0,うんこ秋葉とか行く
858.0,860.0,あんま行かねえなてか全然行かねえ
860.0,862.0,なんか昔先輩が秋葉の警察
862.0,864.0,刑務所に捕まってた時にジャンプを
864.0,866.0,差し入れに行って以来もう7年ぐらい行ってません
866.0,868.0,だからあんま
868.0,870.0,行くとこはわかんないんだよなあわっちゃんと行ったわ
870.0,872.0,パソコン買いに行ったわわっちゃんと行ったわ
872.0,874.0,パソコン買いに行ったこの今使ってるパソコンは秋葉で買ったわ
874.0,876.0,うんこって
876.0,878.0,全部のコメント読んでるの読んでません
878.0,880.0,結構ね目についたコメントパッパッパッパって
882.0,884.0,読んでます
884.0,886.0,冬眠した頃から聞きたかったんだけど
886.0,888.0,うんこちゃんって料理できるの
888.0,890.0,なるほどねその冬眠という
890.0,892.0,一大イベントがあったのにもかかわらず
892.0,894.0,あなたは私が料理できるかどうかっていうのを知りたかったんだ
894.0,896.0,特にできません
896.0,898.0,もうね自炊も6年ぐらいしてません
898.0,900.0,もっとねなんていうのかな
900.0,902.0,もっと他の男もっと私に興味を持ってくださいできれば
902.0,904.0,できるできないじゃなくて
904.0,906.0,しませんああでも男はそういう人多いなんだろうな
906.0,908.0,渋谷でおすすめのクラブ教えて
908.0,910.0,俺あんまクラブとか行かねえんだよな
910.0,912.0,3歳の方だったら結構
912.0,914.0,色々さ遊び行った時とかにクラブ行くべみたいな感じで
914.0,916.0,言ってたけど
916.0,918.0,なんかさ結構あれでしょ
918.0,920.0,系統が違うんだよね
920.0,922.0,みんなが勧めてくるクラブとかは
922.0,924.0,俺自分が好きな
924.0,926.0,俺今音楽語ってる感がめっちゃ心地いいわ
926.0,928.0,この話
928.0,930.0,5分ぐらいしていいですか
930.0,932.0,音楽語ってる感がめっちゃ心地いいんで
932.0,934.0,音に乗れないね俺は
934.0,936.0,やっぱり俺クラスだったらさ
936.0,938.0,しっかりと音に乗りたいタイプなんで
938.0,940.0,私はね
940.0,942.0,渋谷はちょっと
942.0,944.0,ナンセンスです私にとって
946.0,948.0,なんでね
948.0,950.0,なんかちょっとこじゃれたクラブにでも
950.0,952.0,こじゃれたクラブにでも
952.0,954.0,行ってみてください
954.0,956.0,リズム感ないの
956.0,958.0,リズム感がないんだろうな
958.0,960.0,リズム感が相当
960.0,962.0,歌は下手じゃないんだよ
962.0,964.0,ただ声が良くないんだよな
964.0,966.0,悔しいかな
966.0,968.0,声が良ければさ
968.0,970.0,俺も結構上手いと思うんだよね
970.0,972.0,最近てっぺい先生のさ
972.0,974.0,生放送でかなり音楽勉強してるから
974.0,976.0,ビオランについてかなり勉強してるんで
976.0,978.0,音楽的なセンスは
978.0,980.0,かなりついてきてると思うんだよね
980.0,982.0,本当に声が悪いんだよね
982.0,984.0,聞いてますよ
984.0,986.0,てっぺい先生
986.0,988.0,てっぺい先生の生放送を主に見てます
988.0,990.0,最近は
990.0,992.0,いけないんですか
992.0,994.0,お前が見てるとてっぺい先生がけがれるみたいな
994.0,996.0,私はてっぺい先生を見てます
996.0,998.0,許してください
998.0,1000.0,上手だよね
1000.0,1002.0,相当上手いと思う
1002.0,1004.0,なんか楽器やったことある
1004.0,1006.0,リコーダーとかはやってましたよ
1006.0,1008.0,私も人並みに
1008.0,1010.0,リコーダーとかはやってました
1010.0,1012.0,でもさ俺も一つや二つさ
1012.0,1014.0,そういう音楽の類をさ
1014.0,1016.0,習っとけばよかったなって思うんだよね
1016.0,1018.0,今になってみて
1018.0,1020.0,そうすればもうちょっと人生楽しかったのかなと
1020.0,1022.0,思います
1022.0,1024.0,うんこの配信
1024.0,1026.0,嵐いないね
1026.0,1028.0,うんこの配信嵐いないね
1028.0,1030.0,どうなんだろうね
1030.0,1032.0,それはさ多分ね
1032.0,1034.0,配信者のスタンスの違いだと思うよ
1034.0,1036.0,結構さ荒らされてる人とかってさ
1036.0,1038.0,やっぱその
1038.0,1040.0,俺の放送も同じくらい荒らされてると思うんだよ
1040.0,1042.0,例えば自分が拾わなければ
1042.0,1044.0,見てる人ってそういう感じないんだよね多分
1044.0,1046.0,だから別に
1046.0,1048.0,荒らされてますよ
1048.0,1050.0,多分皆さんの目は節穴ですか
1050.0,1052.0,さっきコメントで
1052.0,1054.0,お前なんか地面にキスしとけってコメントがありました
1054.0,1056.0,これは嵐じゃないんですか
1056.0,1058.0,私が拾わなかったから
1058.0,1060.0,平和的解決をしましたけど
1060.0,1062.0,お前なんか地面にキスしてろって言われましたさっき
1062.0,1064.0,アリーナのね
1064.0,1066.0,コメ版700くらいで
1066.0,1068.0,私は許しませんけどねそういうコメントは
1068.0,1070.0,だけどあえてやっぱりみんなのためを思って
1070.0,1072.0,私スルーしましたけど
1072.0,1074.0,そういうね嵐も多々いますよ私は
1076.0,1078.0,本当に私の放送には多々いるんですけど
1078.0,1080.0,自分の話ししてた時で
1080.0,1082.0,多々います
1082.0,1084.0,そういう方々に負けないように頑張っていこうかなと
1084.0,1086.0,思います
1086.0,1088.0,ちょっとタバコを吸わしてください
1088.0,1090.0,もう残り10分になっちゃった
1090.0,1092.0,今日この枠で終わって
1092.0,1094.0,一眠りしてね
1094.0,1096.0,女の放送見に行ったけど宗教だった
1096.0,1098.0,あーその女の放送と言われてます
1098.0,1100.0,うんこちゃんの放送見に行ったけど
1100.0,1102.0,宗教みたいだった多分言われてます
1102.0,1104.0,なので人の悪口は言わないでください
1104.0,1106.0,私以外の
1106.0,1108.0,来たら私以外の人は
1108.0,1110.0,悪口は言わないでください
1110.0,1112.0,全部ブーメランで帰ってきちゃうんで
1112.0,1114.0,全部ブーメランみたいに帰ってきちゃうんで
1114.0,1116.0,出社何時からだよ
1116.0,1118.0,15時ですよ15時
1120.0,1122.0,本当だよ
1122.0,1124.0,本当ですよ
1124.0,1126.0,だからちょっとね
1126.0,1128.0,本当にね
