start,end,text
1128.0,1130.0,全部ね生放送なんでどこも宗教みたいなもんなんですよ
1130.0,1132.0,そこの放送でしか見てないからさ
1132.0,1134.0,そこの放送しか見てない人も
1134.0,1136.0,いるから
1136.0,1138.0,他の人は面白くないよみたいなさ
1138.0,1140.0,コメントとかで荒れちゃったりするだろうけどさ
1140.0,1142.0,そういうもんじゃないんだよな
1144.0,1146.0,可愛いだけの生主って
1146.0,1148.0,面白くなくて結局見なくなる
1148.0,1150.0,あーでもさ
1150.0,1152.0,それはみんなそうだと思うよ
1152.0,1154.0,可愛いとかじゃなくて
1154.0,1156.0,その人を見る目的みたいなのがさ
1156.0,1158.0,ただそれが
1158.0,1160.0,面白いから可愛いに変わってるだけだってさ
1160.0,1162.0,多分さ
1162.0,1164.0,多分みんなもさ
1164.0,1166.0,見てくれてるたくさんの人が見てくれてるけど
1166.0,1168.0,そのうちやっぱさ飽きって絶対
1168.0,1170.0,乗車必須って言葉があることわざがあるようにさ
1170.0,1172.0,必ず
1172.0,1174.0,衰退はしていくんだよ
1174.0,1176.0,でももうね1個だけ言わせて
1176.0,1178.0,うんこちゃんって面白くなくなったなみたいなさ
1178.0,1180.0,そういうコメントも確かにあるんですけど
1180.0,1182.0,俺はだって変わるはずがないんだよ
1182.0,1184.0,だって自分は放送をしているときは100%
1184.0,1186.0,100%ですよ
1186.0,1188.0,ちなみにうんこちゃんこれ以上面白くなることはありません
1188.0,1190.0,安心してください
1190.0,1192.0,なぜなら常に100%だから
1192.0,1194.0,ただうんこちゃんは
1194.0,1196.0,これ以上つまらなくなることはないと思うんだよ
1196.0,1198.0,でも1個だけ
1198.0,1200.0,勘違いしないでほしいのは
1200.0,1202.0,君たちが私に飽きることはあると思います
1202.0,1204.0,だから俺の放送がつまらないのを
1204.0,1206.0,俺のせいにするんじゃない
1206.0,1208.0,君たちがさ私に飽きることを
1208.0,1210.0,私のせいにしないでください
1210.0,1212.0,全部なんかさ俺のせいにしやがってさ
1212.0,1214.0,君たちが私に飽きるのを
1214.0,1216.0,なんで私が責任を取らなきゃいけないんですか
1216.0,1218.0,BSPで放送しきりたがる女主
1218.0,1220.0,え?
1220.0,1222.0,BSP
1222.0,1224.0,なんだこれちょっと待ってね
1228.0,1230.0,あースルーしちゃったー
1230.0,1232.0,スルーしちゃったよちくしょう見たかった
1232.0,1234.0,今のコメント
1234.0,1236.0,あ!BSPで放送しきりたがる女生主のコテがうざすぎる
1236.0,1238.0,お前ものすごい
1238.0,1240.0,生放送見てるな
1240.0,1242.0,お前ものすごい
1242.0,1244.0,いる確かにいる
1244.0,1246.0,確かにいるけど
1246.0,1248.0,屈折した心の持ち主だな
1248.0,1250.0,許してあげてくださいそれくらいは
1250.0,1252.0,あれ何なんだろうね
1252.0,1254.0,あれ何なんだろうね
1254.0,1256.0,俺は特別みたいなさ
1256.0,1258.0,あれ何なんだろうね
1258.0,1260.0,いやでも
1260.0,1262.0,コテ班とかBSPは俺
1262.0,1264.0,ブレインさんはさ
1264.0,1266.0,別だからさ
1266.0,1268.0,あの人がいなかったら俺は生放送ができてなかったからさ
1268.0,1270.0,それはもう別格だから
1270.0,1272.0,許していただきたいんですけど
1272.0,1274.0,他でコテ班とかはつかないだろうな多分
1276.0,1278.0,初見さんいらっしゃいする放送
1278.0,1280.0,常連いいじゃねえかよ
1280.0,1282.0,あ!なるほどね
1282.0,1284.0,初見ですよろしくこれはどんな放送ですか
1284.0,1286.0,みたいなコメントに対して
1286.0,1288.0,初見さんいらっしゃいみたいな感じでさ
1288.0,1290.0,あのBSPする人でしょ
1290.0,1292.0,あ!いるよね
1292.0,1294.0,いやでもいいんじゃないですか
1294.0,1296.0,いいんじゃないですかそういうのは
1296.0,1298.0,いいんじゃないですか
1298.0,1300.0,なんかでもすごいあれだよね
1300.0,1302.0,嫌われてる人とかいるよね
1302.0,1304.0,そのBSPでさ
1304.0,1306.0,そうなんだよ
1306.0,1308.0,荒れてきたからコミュ限定にしよう
1308.0,1310.0,そういうやつもいる
1310.0,1312.0,絶対よくないよね
1312.0,1314.0,避けられるよねそんな
1314.0,1316.0,逃げたら追われるだろうと考えても
1316.0,1318.0,コテ班推奨とかもうざい
1318.0,1320.0,それは別にいいんじゃない
1320.0,1322.0,それぞれのやり方みたいなのがあるからさ
1322.0,1324.0,コテ班推奨とか別に俺はうざいとは感じないな
1324.0,1326.0,BSPはちょっとだけうざいわ
1326.0,1328.0,BSPはちょっとだけ
1328.0,1330.0,言葉だとさ
1330.0,1332.0,イントネーションが伝わんないからさ
1332.0,1334.0,なかなか難しいよね
1334.0,1336.0,昨日ここでもお茶出てなかったっけ
1336.0,1338.0,いよいよ出てますよ
1338.0,1340.0,私の放送もね何を隠そう
1340.0,1342.0,初見かなり歓迎の放送なんで
1342.0,1344.0,昔話とか一切せずにね
1344.0,1346.0,これから未来を見据えた放送してるんで
1346.0,1348.0,ここはお茶の代わりに
1348.0,1350.0,つっぱりが出る意味わかりません
1350.0,1352.0,こういう普通の配信への煽りは
1352.0,1354.0,顔が相当うまい
1354.0,1356.0,あー
1356.0,1358.0,水口さんね最近ピキってないからな
1358.0,1360.0,あんま見てないんだよな
1360.0,1362.0,私見てるんで
1362.0,1364.0,なかなか切れないほうがいいですよ
1364.0,1366.0,労力の無駄でしょ本当に
1366.0,1368.0,労力の無駄だと思います
1368.0,1370.0,なんでこの放送敬語
1370.0,1372.0,なんだこれ
1372.0,1374.0,なんでこの放送英語を使わないんですか
1374.0,1376.0,あーそういうのもありますよね
1378.0,1380.0,マリオやってる時コメントで雑談し始めたら皮切れる
1380.0,1382.0,いやでもそれは気分悪いと思うよ
1382.0,1384.0,面白くねえじゃん純粋に
1384.0,1386.0,多分そういうのってさ
1386.0,1388.0,盛り上がってる感は否めないけどさ
1388.0,1390.0,透明だけでさ周りが凄い冷ややかな目で見てるよ多分
1390.0,1392.0,ねえ
1392.0,1394.0,例えばここで
1394.0,1396.0,俺の放送とかでさ普通にさ
1396.0,1398.0,あのー
1398.0,1400.0,雑談をずーっとしてたら
1400.0,1402.0,全然面白くないと思うんだよね
1402.0,1404.0,マリオ見ててコメすることないよな
1404.0,1406.0,いやでもそれに対してはさ
1406.0,1408.0,ゲームに対してさコメントするべきなんじゃないのか
1408.0,1410.0,わかんないけど
1412.0,1414.0,多分そうなんじゃないのか
1414.0,1416.0,いやそれは人それぞれでしょ
1416.0,1418.0,マリオメロフィーみたいな人もいっぱいいると思うよ
1418.0,1420.0,じゃなきゃあったらさあんなマリオ生主たちがさ
1420.0,1422.0,ものすごいさやっぱ人を集めるってことはないと思う
1422.0,1424.0,それはねえ
1424.0,1426.0,個人のね感性の違いだと思います
1426.0,1428.0,勝手どこに向かってるのかな
1428.0,1430.0,分かれそう
1430.0,1432.0,そんなの知りません
1432.0,1434.0,うんこちゃん今日少し優しいバレましたか
1434.0,1436.0,仕事で昨日打ちししがれてて
1436.0,1438.0,仕事で昨日打ちししがれていたんで
1438.0,1440.0,今日はちょっと優しいです
1440.0,1442.0,優しいバージョンです優しいバーです
1442.0,1444.0,私は
1444.0,1446.0,そうなんだよね
1448.0,1450.0,うんこもかの放送配信見てみようよ
1450.0,1452.0,ちょあいつさあ
1452.0,1454.0,ジャスティンで最近やってんじゃん
1454.0,1456.0,ものすごいさなんか寝て
1456.0,1458.0,俺が見てるときいつも寝てるんだよね
1458.0,1460.0,だからちょっとね
1460.0,1462.0,いつ放送してるかっていうのがわかりません
1462.0,1464.0,寝てます主に水内は
1464.0,1466.0,だから
1466.0,1468.0,何してんだろうみたいなさ
1468.0,1470.0,コメント打っても誰も無視します俺が
1470.0,1472.0,あのちゃんとね
1472.0,1474.0,今何してるのってコメント打つと
1474.0,1476.0,くぶくり返信がありません
1476.0,1478.0,だからね水内はニコ生の方をね
1478.0,1480.0,見ていこうかなと
1480.0,1482.0,あいつうんこどころじゃないレベルのテクノだぞ
1482.0,1484.0,あーなるほどね
1484.0,1486.0,まあでもね
1486.0,1488.0,いろいろそれに関しては
1488.0,1490.0,私も人のことが言えないんで
1490.0,1492.0,寝落ちしてるんだ昨日見た見てない
1492.0,1494.0,寝落ちしてるんだ
1494.0,1496.0,えでもさあどうすんの
1496.0,1498.0,寝言とか言っちゃったらどうすんの寝言とか
1498.0,1500.0,寝言とか言っちゃったらどうすんの
1500.0,1502.0,すげえ怖くない
1502.0,1504.0,俺寝言とかめっちゃ言うからさ
1504.0,1506.0,すごい怖いんだよね
1506.0,1508.0,かわいいじゃん
1508.0,1510.0,あそういうことね
1510.0,1512.0,なるほどなるほど
1512.0,1514.0,寝返りは
1514.0,1516.0,誰も聞いてないんじゃない
1516.0,1518.0,なんでみんなさログインしてんの
1518.0,1520.0,なんでログインしてんの
1520.0,1522.0,うーん
1522.0,1524.0,よくわかんねえな
1524.0,1526.0,この前好きな人の名前言ってた
1526.0,1528.0,あれなんだねもうあれなんだね
1528.0,1530.0,生活垂れ流し配信
1530.0,1532.0,みたくなってんだ
1532.0,1534.0,えー
1534.0,1536.0,なるほどね
1536.0,1538.0,ん
1538.0,1540.0,生活を垂れ流してるんだな
1540.0,1542.0,じゃあわかんないみずちが今何の仕事してるのか
1542.0,1544.0,全然知らない
1544.0,1546.0,そういう話全くしない
1546.0,1548.0,てか放送以外で喋らない全然
1548.0,1550.0,放送以外で喋ったことないみずちさんと
1550.0,1552.0,気まずい二人で
1552.0,1554.0,二人で喋ると気まずいんですぐ放送しちゃうんで
1554.0,1556.0,あんまりねプライベートのプライバシーにはね
1556.0,1558.0,お互いね付け
1558.0,1560.0,踏み込まないようにしてるんで
1560.0,1562.0,ちゃんと礼儀を守ってるんで
1562.0,1564.0,営業なんだ
1564.0,1566.0,わかんない
1566.0,1568.0,よくわかんない
1568.0,1570.0,試練やって仲直りしようか
1570.0,1572.0,何その喧嘩してるみたいな理論
1572.0,1574.0,やめてください仲直りさせないでください
1574.0,1576.0,試練か
1576.0,1578.0,まあちょっとねやっていかなきゃなと
1578.0,1580.0,思うんだけど
1580.0,1582.0,てか爆破した時くらい連絡してやるよ
1582.0,1584.0,だからなんで連絡するのみずち
1584.0,1586.0,さあ今までありがとう
1586.0,1588.0,俺爆破するわ俺の分まで頑張ってね
1588.0,1590.0,みたいなこと言うの
1590.0,1592.0,イボイボが立つわ体全体に
1592.0,1594.0,そんな気持ち悪いことはしません
1594.0,1596.0,私は死ねーとね次回の爆破の時も
1596.0,1598.0,みずちさんに言いません
1598.0,1600.0,ダウンタウンとか
1600.0,1602.0,云々みたいなねそういうことじゃないんだけどね
1602.0,1604.0,言うほどお互い
1604.0,1606.0,お互いに興味がない本当に
1606.0,1608.0,みんなが思うほど仲が良くない別に
1608.0,1610.0,多分そういうことだと思うんですよ
1610.0,1612.0,言うほどみずちも俺に興味がないし
1612.0,1614.0,言うほど俺もみずちに興味がありません
1614.0,1616.0,なんでね
1616.0,1618.0,まあそういう目の出しでね
1618.0,1620.0,私たちを見守っていただければな
1620.0,1622.0,と思います
1622.0,1624.0,チュンビのさあ
1624.0,1626.0,それについてもね次回話していただければな
1626.0,1628.0,と思います
1628.0,1630.0,まあそうなんだよね
1630.0,1632.0,寒けがしね本当に
1632.0,1634.0,俺たちめっちゃ仲良しだよなみたいなさ
1634.0,1636.0,そういう
1636.0,1638.0,ねえなんかそういうのってさ
1638.0,1640.0,寒いじゃんすごい
1640.0,1642.0,8年の付き合いがあるんだったらさいいけどさ
1642.0,1644.0,寒いでしょみずち
1644.0,1646.0,今日のお前本当に面白かったよ
1646.0,1648.0,みたいなこと言ってたらさ
1648.0,1650.0,みんな怒るでしょ
1650.0,1652.0,そうなんだよねだからちょっとね
1652.0,1654.0,それぐらいが当たり前の
1654.0,1656.0,関係なんだなっていうのをね
1656.0,1658.0,皆さんがちょっと理解してご理解いただければと
1658.0,1660.0,本当だよ
1660.0,1662.0,メールが来てましたなんかねうんこちゃん
1662.0,1664.0,みずちが他の生主と
1664.0,1666.0,絡んでいてうんこちゃん
1666.0,1668.0,本格的にぼっちやでみたいなさ
1668.0,1670.0,心配のメールをいただきましたけど
1670.0,1672.0,安心してください私はねぼっちでも
1672.0,1674.0,頑張っていくんでよろしくお願いしますと
1674.0,1676.0,いいじゃないですか
1676.0,1678.0,毎回毎回同じような放送ね
1678.0,1680.0,安心するでしょ毎回毎回はずれわけ
1680.0,1682.0,いつ見てもいつ何時見ても
1682.0,1684.0,はずれわけ安心するでしょ皆さんも
1684.0,1686.0,戻ってくる場所なんです
1686.0,1688.0,ここが皆さんの
1688.0,1690.0,ぼっちでもね頑張っていこうかなと思ってます
1690.0,1692.0,11時間働いて帰ってきたぞ
1692.0,1694.0,そっかそろそろ夜勤組が帰ってきたか
1694.0,1696.0,夜勤組が
1696.0,1698.0,夜勤組が帰ってきましたかお帰りなさい
1698.0,1700.0,そうなんだよね
1700.0,1702.0,そろそろなんかちょっとねやりたいこと
1702.0,1704.0,いっぱいあるんだよねやりたいこといっぱいあるんだけどさ
1704.0,1706.0,そのーはずれわけが忙しくて
1706.0,1708.0,ちょっとできないんだよね私生活も別に今特に仕事も
1708.0,1710.0,忙しくないんだよたださ
1710.0,1712.0,いかんせんはずれわけが忙しいよ
1712.0,1714.0,本当に今日仕事休みじゃないよ
1714.0,1716.0,今日普通に仕事
1716.0,1718.0,はずれわけがいかんせん
1718.0,1720.0,ちょっとね忙しい他の人とかなもう
1720.0,1722.0,なんか俺もねこういうスタンスで
1722.0,1724.0,絡めるんだったらなんかちょっとね
1724.0,1726.0,一緒に見たい人とかいるんだけどね
1726.0,1728.0,いかんせんちょっとね自分からちょっと
1728.0,1730.0,自分からねアプローチするのは
1730.0,1732.0,苦手なんで常にね私は待ちの姿勢でね
1732.0,1734.0,頑張っていこうかなと
1734.0,1736.0,思っております
1736.0,1738.0,もはや何がどうはずれなのかわからん
1738.0,1740.0,いやこれあれですよ
1740.0,1742.0,ちなみに皆さん気づいてないかもしれないですけど
1742.0,1744.0,刻一刻と
1744.0,1746.0,ねあなたたちの細胞セルは
1746.0,1748.0,死滅していきますうんこちゃんのこの
1748.0,1750.0,中身の何にもないね雑談に付き合ってるだけで
1750.0,1752.0,あなたたちのセルはね死滅していくんで
1752.0,1754.0,それだけで十分はずれるわけと言えるでしょう
1754.0,1756.0,あこれタイムシフトで
1756.0,1758.0,やりません29分過ぎてから言うことじゃないと
1758.0,1760.0,思うんですけどちなみにこれはタイムシフトでやりません
1760.0,1762.0,生放送です生のうんこちゃんです
1762.0,1764.0,うんこちゃんの生の声です
1764.0,1766.0,ほらもう
1766.0,1768.0,30分経っちゃった
1768.0,1770.0,もう30分経っちゃいました
1770.0,1772.0,というわけでね皆さん
1772.0,1774.0,えーいろいろね
1774.0,1776.0,つらいこと
1776.0,1778.0,あると思いますけど
1778.0,1780.0,頑張っていただければなと
1780.0,1782.0,思います
1782.0,1784.0,それでは皆さん
1784.0,1786.0,さようなら
