start,end,text
1379.0,1381.0,そういうの考えなきゃいけない
1381.0,1383.0,朝の6時?
1383.0,1385.0,いいよじゃあ夜の6時にするわ
1385.0,1387.0,なんか朝の6時からゲーム実況とか
1387.0,1389.0,見たくねーだろ
1391.0,1393.0,朝の6時から
1393.0,1395.0,ここ入ってるごめんブリーチのゲームは残念ながらここ入ってないわ
1397.0,1399.0,タイトル7
1399.0,1401.0,内容3ぐらいで今のニコ生
1401.0,1403.0,結構見てんの
1403.0,1405.0,確かにクリックしちゃえばこっちの方みたいなとこあるしね
1407.0,1409.0,そういう動画も1個撮ろっかな
1409.0,1411.0,ちゃんとそういう
1411.0,1413.0,しっかり狙った
1413.0,1415.0,アブさんみたいな動画
1415.0,1417.0,でも俺分かんねーんだよな
1417.0,1419.0,どうやってゲーム選んでんだろう
1419.0,1421.0,本当に分かんないわ
1423.0,1425.0,本当に分かんないんだよね
1427.0,1429.0,面白い動画が伸びるわ
1429.0,1431.0,面白い動画が伸びるわ
1431.0,1433.0,どういう動画が伸びてんの
1433.0,1435.0,どういう動画
1435.0,1437.0,どういう動画が伸びてんの
1441.0,1443.0,面白い
1443.0,1445.0,アイドルが撮った動画
1445.0,1447.0,いよいよ腐っちゃってるってことでしょ
1447.0,1449.0,それだったらもうしょうがないじゃん
1449.0,1451.0,仕方なくない
1451.0,1453.0,自分の実力がなかっただけと
1453.0,1455.0,飲み込むしかなくない
1457.0,1459.0,タイトルとサムネでつってたらさ
1459.0,1461.0,マイリストあんなにいかないでしょ
1461.0,1463.0,それだったら自分の実力がないだけで
1463.0,1465.0,飲み込むしかないよね
1467.0,1469.0,親戚が住んでる原因が面白い動画が伸びないからだけだ
1471.0,1473.0,なんでてめえが面白い動画
1473.0,1475.0,撮って伸ばせばいいのに
1477.0,1479.0,過去の実況とか生放送のバス上げてけよ
1479.0,1481.0,いいよ
1481.0,1483.0,生放送は生放送でやりたいんだよね
1483.0,1485.0,実況者がインフレしてるからその中で面白い
1485.0,1487.0,みんな同じような感じじゃない
1491.0,1493.0,ちょっと延長するわ
1493.0,1495.0,作戦会議
1499.0,1501.0,なんかちょっとあれなんだよね
1501.0,1503.0,その辺のそういう内容的な部分は
1503.0,1505.0,こういうの撮ろっかなってのは決まってんだけど
1505.0,1507.0,なんか
1507.0,1509.0,え、でもばくまつししがあんだけ伸びてたから
1509.0,1511.0,面白い動画って伸びると思うんだよな
1515.0,1517.0,やっぱり単純に面白い動画
1517.0,1519.0,100本撮れば1本ぐらい面白い動画撮れると思うんだよね
1521.0,1523.0,声めっちゃ作るよ
1523.0,1525.0,真剣にやるもん
1525.0,1527.0,言い訳できないようにやるちゃんと
1529.0,1531.0,言い訳できないように
1531.0,1533.0,やるしっかりな
1533.0,1535.0,しばらくはちょっと忙しいね
1537.0,1539.0,しばらくは
1539.0,1541.0,しんすけランタンがパート2以降伸びない時代
1543.0,1545.0,なんかでも
1545.0,1547.0,あれじゃん
1547.0,1549.0,最近の動画なんか本腰入れて撮ってないでしょ
1549.0,1551.0,俺見たよ
1551.0,1553.0,なんだっけ
1553.0,1555.0,俺あれは伸びないなと思ったよ
1555.0,1557.0,俺は好きだけど
1557.0,1559.0,絶対伸びないなと思ったよ
1559.0,1561.0,本腰入れてないじゃん
1561.0,1563.0,本腰入れて
1563.0,1565.0,今はゲロとからこじ
1565.0,1567.0,なんで俺さ
1567.0,1569.0,他人の土俵で相撲撮らなきゃいけないの
1569.0,1571.0,やだやだ
1573.0,1575.0,アフリカは見てないな
1575.0,1577.0,アフリカ見てない
1577.0,1579.0,面白かった?
1579.0,1581.0,ゲロいたら伸びるだろうな
1581.0,1583.0,別にそれ俺じゃなくていいじゃん
1583.0,1585.0,ギガゾンビは無理だ
1587.0,1589.0,実際問題
1589.0,1591.0,アクセス数とか落ちてるってさ
1591.0,1593.0,まとめサイトとかでやってたじゃん
1593.0,1595.0,40%くらい落ちてるって
1595.0,1597.0,もうあれなんだろうね
1597.0,1599.0,固定脚がついてて
1599.0,1601.0,そいつらが
1601.0,1603.0,お馴染み例えばアブさんとかキヨとかレトルト
1603.0,1605.0,そうだよな
1605.0,1607.0,ランキングに上ってくるやつがそんぐらいしかいないもんな
1607.0,1609.0,そうだよね
1611.0,1613.0,じゃない?
1615.0,1617.0,半分くらいってことでしょ
1617.0,1619.0,一年で半減ってオワコンが過ぎる
1621.0,1623.0,現状は厳しいってことだよね
1625.0,1627.0,いいじゃねえかよ
1627.0,1629.0,この歳で挑戦家か
1631.0,1633.0,挑戦者か
1635.0,1637.0,ごめん今骨鳴らしてた
1637.0,1639.0,新しいゲームが出ればマイナーなのも
1639.0,1641.0,全然あれだよね
1643.0,1645.0,パッと出てこねえもんな
1645.0,1647.0,失格
1647.0,1649.0,寝てろみたいになっちゃいました
1651.0,1653.0,何をやったかではなく
1653.0,1655.0,誰がやったかが重要な時代
1655.0,1657.0,実際問題そうやって意識してるだろうしねみんな
1659.0,1661.0,意識してるだろうしな
1663.0,1665.0,それで死んじまった
1665.0,1667.0,でもさ別に守るもん
1667.0,1669.0,もう何にもないからさ俺
1669.0,1671.0,だから上げようと思ってるんだよね
1671.0,1673.0,守るもんだって何にもねえもん
1673.0,1675.0,ランキングない目指すの?
1675.0,1677.0,ランキング1位以外ない目指すの?
1677.0,1679.0,みんなは
1679.0,1681.0,その負け犬根性はどこから出てきてんの
1681.0,1683.0,ランキング1位以外目指したことないんだけど常に
1683.0,1685.0,やることなすこと
1685.0,1687.0,俺1位目指してんだけど
1687.0,1689.0,1位以外の何を目指すの
1689.0,1691.0,やるからには
1691.0,1693.0,全部1位だよな
1693.0,1695.0,だから中途半端に伸びたやつの動画
1695.0,1697.0,パクって上手くやってんだよな
1697.0,1699.0,なんかでも違うと思う
1699.0,1701.0,彼なりの創意工夫が見て取れるじゃん
1703.0,1705.0,彼なりの創意工夫が
1705.0,1707.0,見て取れない
1709.0,1711.0,いやでもねちょっと1本は
1711.0,1713.0,無理だ正直さ俺ね聞いてみんな
1713.0,1715.0,みんなさなんかちょっとモテ生やしてくれるけど
1715.0,1717.0,俺実況撮ってた期間8ヶ月しかないのね
1717.0,1719.0,"生放送やってた期間は4,5年あるの"
1719.0,1721.0,俺実況してたくて生主なのね
1721.0,1723.0,ちょっとやっぱねえ
1723.0,1725.0,勝手が絶対違うと思うの
1725.0,1727.0,俺なりのなんか
1727.0,1729.0,俺8ヶ月しかねえ実況撮ってないのね
1729.0,1731.0,100本ぐらいガーッと上げてみて
1731.0,1733.0,そんで無理やったら諦めるわ
1733.0,1735.0,そしたら
1735.0,1737.0,またちょっと
1737.0,1739.0,こっちに戻ってこようかなと思う
1739.0,1741.0,しばらくはやっぱねえ
1741.0,1743.0,生放送やりながらだと
1743.0,1745.0,実況の鮮度が落ちてくるのね
1745.0,1747.0,すり減ってくの俺が
1749.0,1751.0,だから企画中止にやっても雑談一切しない
1751.0,1753.0,もう
1753.0,1755.0,椎名林檎みたいな感じでいきます
1755.0,1757.0,椎名林檎中島みゆきみたいな
1757.0,1759.0,遠いうんこじゃん
1759.0,1761.0,ツイッターもやってないんだこの人って
1763.0,1765.0,遠いうんこじゃんでいきます
