start,end,text
0.0,5.0,まあ、それなりに活動した年でしたね
7.0,8.0,良かったですね
8.0,10.0,デイランさん毎年ありがとうございます
10.0,12.0,来年もここにバシバシね
13.0,17.0,中身が濃くなるように私は配信を頑張っていこうと思います
18.0,22.0,と、えー、言ったところで申し訳ないんですけど
22.0,24.0,今月ものすごい忙しくて
24.0,26.0,あと1回しか放送できません
26.0,32.0,なので、今日は皆さんと一緒に雑談しに来ました
33.0,34.0,思い出しました
35.0,37.0,ただ、うーんとね
37.0,38.0,じゃあ2回やりたいんだよね
38.0,40.0,俺ケーキ作りたいんだよね
40.0,42.0,ケーキ作る枠と
44.0,45.0,そのセルビア枠
45.0,48.0,1回ずつ儲けて
49.0,51.0,じゃあケーキ作りたいんだよね
51.0,52.0,本気で
52.0,54.0,いやバレンタインにしよっかな
54.0,56.0,バレンタインにしよっかなその日
56.0,57.0,あ、でもな
57.0,58.0,違ぇんだよ
58.0,59.0,バレンタインもあるよな
59.0,60.0,目立ちそう
60.0,62.0,女がバカな女配信者がさ
62.0,63.0,むっちゃさ
63.0,65.0,こぞってケーキ配信とか
65.0,67.0,ねえ、チョコレート配信とかすんだろ
67.0,69.0,そこに俺に俺がコクいってんで
69.0,71.0,ドカーンって
72.0,73.0,どうかなそれ
75.0,77.0,ケーキ作ろうかな
79.0,80.0,やりたい
80.0,81.0,電動だわ
81.0,82.0,いやもう
82.0,83.0,最初っからだ
83.0,85.0,一番最初っから
87.0,89.0,一番最初っから
89.0,91.0,やろうと思います
91.0,92.0,くるるかまこうとか
92.0,93.0,みやこ呼んで騙すべたべ
93.0,95.0,来てくんねえんだもん
96.0,97.0,全然俺はさ
97.0,99.0,受け入れ出してできてるのに
100.0,101.0,ニコ動の料理のレシピで
101.0,102.0,バレンタインやればいいんじゃない
102.0,104.0,ちょっとその辺は煮詰めます
105.0,106.0,一番最初っから作りますよ
106.0,107.0,俺の一番好きなケーキ
107.0,108.0,俺ね
109.0,110.0,多分ね
110.0,112.0,ものすごい甘党なの
112.0,114.0,ものすごい甘党だから
115.0,117.0,ちゃんとおいしいケーキ作りたい
119.0,121.0,お前とまことが付き合ってる動画見て
121.0,122.0,ワロタから
122.0,123.0,あいつ言ったのついに
123.0,125.0,俺と付き合ってるって
125.0,127.0,別に隠さなくてもいいけど
127.0,128.0,俺付き合ってるよほんとに
128.0,129.0,あれ冗談じゃねえぞ
129.0,131.0,リアルに付き合ってるよ
133.0,135.0,好きだよ俺はまことが
136.0,139.0,ツバつけて挿入いっちゃお
139.0,140.0,今見えなかった
141.0,142.0,見えませんでした
144.0,145.0,隠し事しない
145.0,146.0,てか俺もうさ
146.0,147.0,ゴロリと別れて
147.0,148.0,彼女できたとしても
148.0,150.0,もう絶対言わねえ配信で
150.0,151.0,もう俺
151.0,153.0,絶対お姫事としてさ
153.0,155.0,死ぬまで墓場まで撮ってくから
155.0,157.0,でも彼女にも言わねえ
158.0,159.0,ニコ動やってるってこと
159.0,161.0,家で仕事してるっつって
161.0,163.0,2週間に1回しか会わねえ
165.0,166.0,どうしてもね
166.0,167.0,その
167.0,169.0,言わざるを得ないんだよ
169.0,170.0,彼女
170.0,172.0,嘘つかなきゃいけなくなるから
172.0,173.0,それがすごいしんどかったんだけど
173.0,174.0,別にいいやと思って
174.0,175.0,嘘つけやよくねってなった
175.0,176.0,俺の中で
176.0,177.0,いい人であろうとしすぎた
177.0,179.0,別に嘘つけやよくないって思って
179.0,180.0,嘘つきます今度から
185.0,186.0,って思いました
187.0,189.0,でも結婚したら長男とたくさんできるって
189.0,191.0,昔話でほんとだよな
191.0,192.0,トントントントントンって
192.0,194.0,俺が配信してる後ろでさ
195.0,197.0,包丁の音がするような配信したかったんだけどな
200.0,201.0,ヨンコちゃんまだクラブ行ってんの?
201.0,202.0,クラブ行ってる
203.0,205.0,ゴロリには行ってねえって嘘ついてるけど
206.0,207.0,でもたまにだよ
207.0,209.0,そういうなんか誘われたときに行くぐらいだよ
210.0,212.0,誘われたときに行くぐらいです
213.0,215.0,そんな勤めて行ってるわけじゃありません
216.0,218.0,お前の理想はウナちゃん版なんだな
218.0,219.0,まあそうだね
219.0,221.0,行き着くところは
221.0,222.0,行き着くところは
223.0,224.0,そこというか
225.0,226.0,行き着くところは
227.0,228.0,そこかなと思います
229.0,231.0,クラブでナンパってむずくねえ
231.0,232.0,だからさもう違うんだって
232.0,234.0,その時点でやっぱ違えんだ
234.0,235.0,クラブって多分さ
235.0,237.0,俺はそんなお金持ってないからあれだけど
237.0,238.0,10万ぐらい持ってって
239.0,240.0,なんかねえ
240.0,242.0,いい席座らせてもらって
242.0,244.0,女つけてもらったらめっちゃモテる
244.0,246.0,てかさもう時効だから言うけどさ
246.0,247.0,もう歳変わって時効だから言うけど
247.0,249.0,年末よく坂本と
249.0,250.0,坂本よくクラブ来てたんだけど
250.0,252.0,だから菅野連れてきてたのね
252.0,254.0,ほんとやめてくんないか
254.0,256.0,巨人軍のさちょっとさ
256.0,257.0,もうお前たち
257.0,259.0,沢村と坂本は別に俺はね
259.0,261.0,許してるけど
261.0,263.0,菅野だけはほんとやめてほしいんだよ
263.0,264.0,あの人は
264.0,265.0,なんかキャラクターじゃない
265.0,267.0,菅野と笠原
267.0,269.0,キャラクターじゃねえよな絶対な
271.0,273.0,すっげえなんか真面目みたいだよみんな
273.0,275.0,すっごいなんか評判が良かった
276.0,278.0,笠原かっこいいよね
279.0,281.0,かっこいいよね
281.0,283.0,かっこいいよねめっちゃかっこよかった
283.0,284.0,あのー
284.0,286.0,性高くて
286.0,288.0,笠原案外そういうとこあるぞお前
288.0,290.0,なんで関係者なんだよ
290.0,291.0,関係者かー
291.0,292.0,俺ショック受けちゃったよ
292.0,294.0,お前菅野はやめてくれって
294.0,296.0,他の3人はどうでもいいから菅野だけは
296.0,297.0,って
297.0,299.0,あの風貌でなんかもう
299.0,301.0,ものすごいなんかさ
301.0,303.0,小学生からゴルフやってたりしてさ
303.0,305.0,おぼっちゃまじゃん
306.0,307.0,おぼっちゃまじゃん
307.0,308.0,あ血の毛多いんだ
308.0,310.0,あそっかなんか喧嘩打ったりしてたもんね
310.0,311.0,喧嘩打ったりしてたもんね
311.0,312.0,声かけれるわけねえじゃねえかよ
312.0,314.0,邪魔したくない
314.0,316.0,邪魔したくない
316.0,318.0,あバレンティーに喧嘩打ってたの笠原か
318.0,319.0,なるほどなるほど
319.0,323.0,中央線で死体持ち帰った旅客がいた
324.0,325.0,話したしてない
325.0,326.0,なにそれ
326.0,328.0,あグリエルねごめんごめん
328.0,330.0,バレンティーは流石に難しいか
331.0,333.0,なにそんなことがあったの
333.0,335.0,怖くない
335.0,337.0,死体の一部を持ってった
337.0,339.0,なにそれ
340.0,342.0,本当に
343.0,345.0,本当に
345.0,347.0,そんなことがあったの
347.0,349.0,恐ろしいね
349.0,351.0,なんかそういう騎士いっぱいいるんだな
351.0,353.0,日本人じゃねえだろ
354.0,356.0,日本人じゃねえ気がする
358.0,360.0,そんなことする
361.0,363.0,いつか人を殺すだろうね
364.0,366.0,パリのテロについて話せない
366.0,368.0,もっとちゃんとした人が話してくれるでしょ
368.0,370.0,パリのテロについては
370.0,372.0,そういうのなんだっけ
372.0,373.0,なんかさ
373.0,375.0,海外でさ人ぶっ殺してさ
375.0,377.0,なんか食ってたやつがさ
377.0,378.0,今日本のテレビ出てんじゃん
378.0,380.0,あいつなんつったっけ
380.0,382.0,そういうのなんて言うっけ
382.0,384.0,人のなんか肉を食っちゃうやつ
386.0,387.0,名前ついちゃったよ
387.0,388.0,カニバリズムだ
388.0,390.0,そうそうそうそう
390.0,392.0,あいつなんだっけ
392.0,393.0,海外で人ぶっ殺してさ
393.0,395.0,今日本のなんかジャーナリストとしてなんか
396.0,398.0,出てるやつ
398.0,400.0,佐川だそうそうそうそう
400.0,402.0,佐川みたいなそんな名前じゃなかったっけ
402.0,404.0,カニバじゃねえよ
404.0,406.0,カニバじゃねえよ
408.0,410.0,なんかイタリアかなんかでやってたよね
410.0,412.0,なんか不確かだなその辺の情報が
414.0,415.0,不確か
415.0,417.0,ちょっと恐ろしいよね
417.0,419.0,まとめサイトで俺も見た
419.0,421.0,そこまで行っていいんかい出るわ
421.0,423.0,まだ何それ俺も出たい
425.0,427.0,うんこに話しかあるけど美容液のエッセンスって何
427.0,429.0,わかんねえ俺も
429.0,431.0,ちょっとはなちゃん
431.0,433.0,戻ろっかちょっと待ってて
433.0,435.0,ラスト20分雑談体制に入る
447.0,449.0,よいしょ
469.0,471.0,すわせんすわせん
471.0,473.0,今世の中三連休でしょ
473.0,475.0,本気で恨ましいな
475.0,477.0,私は絶賛
477.0,479.0,仕事中でございます
479.0,481.0,徹夜でゲームとか
481.0,483.0,久しぶりにやるとクッソ楽しいよね
483.0,485.0,もうできねえ奴が
485.0,487.0,俺さ口ではさもう本当に体力ねえよ
487.0,489.0,って言ってたけど自覚はしてない
489.0,491.0,つもりだったんだけどさ
491.0,493.0,本格的に
493.0,495.0,体力ってなくなるんだね歳とってくると
495.0,497.0,俺びっくりしちゃったんだけど
497.0,499.0,なんかさ
499.0,501.0,前日ちょっと睡眠不足だと
501.0,503.0,二日間
503.0,505.0,寝起きくんだけど
505.0,507.0,二日間
507.0,509.0,ジム行ってない明日仕事だよ
509.0,511.0,二日間眠くなっちゃうんだよね
513.0,515.0,勇者のくせに生意気だわやるよって約束を
515.0,517.0,したら今月無理だわ
517.0,519.0,しんどい
519.0,521.0,みそ地だからな俺
521.0,523.0,女が隣にいればね
523.0,525.0,俺女たらしだから女と隣にいれば
525.0,527.0,何時間でも起きてられるんだけど
527.0,529.0,なんかさ配信とかでもさ
529.0,531.0,24時間とかやってたじゃん昔
531.0,533.0,朝の9時までとか
533.0,535.0,もう考えられないんだけど
535.0,537.0,そういうの
537.0,539.0,やってたやつFF10とかさ
539.0,541.0,白川一本も
541.0,543.0,入ってないんだよね
543.0,545.0,睡眠不足って何時間くらいやっぱ6時間
545.0,547.0,6時間だと俺はもう眠いね
547.0,549.0,次の日
549.0,551.0,7時間はやっぱ寝たい最近は
551.0,553.0,11時15分まで寝なきゃいけないから
553.0,555.0,今日やばいんだよね
555.0,557.0,早めにお風呂入って寝ないと
557.0,559.0,へこけ30時間やってる
559.0,561.0,マジで
561.0,563.0,なんでそんなスタミナあるの
565.0,567.0,なんそのスタミナあるの
567.0,569.0,おいメラトニー飲むといいぞ
569.0,571.0,おすすめの商品送ってやろうか
571.0,573.0,Gメールで教えて
573.0,575.0,そういう系の健康食品系
575.0,577.0,さっき見たビップマリオ巨伝だぞ
577.0,579.0,いやでもあれはさもう
579.0,581.0,高田健史もいたしさ
581.0,583.0,一人じゃ絶対できなかったよ
583.0,585.0,まず起きれないもん
585.0,587.0,二人して全然寝てなかったからね
587.0,589.0,あれさ3時間とか
589.0,591.0,4時間とかさ寝てるように見えてるでしょ
591.0,593.0,二人とも多分1時間半くらいしか寝てないからね
593.0,595.0,お互いの声がうるさすぎて
595.0,597.0,お互いの声が
597.0,599.0,うるさすぎて全然寝てないからね
599.0,601.0,その
601.0,603.0,枠の切れ目に
603.0,605.0,お前何時間寝たみたいに聞いたら
605.0,607.0,俺1時間50分くらいしか寝てないよ
607.0,609.0,ウンコちゃんの声が
609.0,611.0,うるさすぎて50分しか寝てなかった
611.0,613.0,1日の睡眠時間
613.0,615.0,1時間切るってとんでもないことだぞ
615.0,617.0,あの後すぐ寝てたからなあいつ
619.0,621.0,腰いかれてたからな
623.0,625.0,俺も高田の声が
625.0,627.0,うるさくて寝れなかったし
627.0,629.0,2時間くらい寝たから俺
629.0,631.0,2時間くらい
631.0,633.0,腰いわしてたわ
635.0,637.0,でも楽しかったあれ多分去年の配信の中で
637.0,639.0,あれもな
639.0,641.0,ときめも面白かったな
641.0,643.0,なんかさ
643.0,645.0,あれやったけどねれなちゃんあたりがさ
645.0,647.0,あのときめもの再放送
647.0,649.0,やって
649.0,651.0,俺も見るから
651.0,653.0,ときめも
653.0,655.0,俺が再放送するか
655.0,657.0,ちょっと待ってね
657.0,659.0,パートいくつくらいまでやるんだろう
661.0,663.0,今度やろうかな
663.0,665.0,見てえわ普通に
665.0,667.0,俺1回もまだ見てないと思うんだよ
671.0,673.0,1回も見てないんだよな
687.0,689.0,パートいくつまでやるの俺
693.0,695.0,パート数次第だね
695.0,697.0,あー結構長い
697.0,699.0,7時間半
699.0,701.0,7時間半か
701.0,703.0,7時間
703.0,705.0,7時間はつれえな
709.0,711.0,7時間はつらいな
711.0,713.0,1日つぶれちゃうな
715.0,717.0,でもパート数もいい感じだね
717.0,719.0,パート1からパート15
719.0,721.0,理想的な編集ありきだったら
721.0,723.0,パート5くらいで終わるね
723.0,725.0,それじゃあでも違うんだな
725.0,727.0,それじゃあ
727.0,729.0,それじゃあ
729.0,731.0,違うんや
731.0,733.0,7月29だって
733.0,735.0,やば
735.0,737.0,くっそ昔じゃん
739.0,741.0,7月29だってよ
741.0,743.0,これやったわく
743.0,745.0,まじで半年たってんじゃん
751.0,753.0,リアル半年前じゃねえかよこれ
757.0,759.0,FF10はちょっと
759.0,761.0,ねえなんかさ
761.0,763.0,俺FF10絡みて
763.0,765.0,もう1回やりてんだよ
765.0,767.0,10-2はつれえんだよな
767.0,769.0,10-2まじつらいんだよな
769.0,771.0,なんかさ
771.0,773.0,いい方法ないかな
773.0,775.0,じゃあもう1回やるのは
775.0,777.0,無理なのね
777.0,779.0,10-2ちょっとなんかやりたいよね
779.0,781.0,いや今別にそんな
781.0,783.0,肩肘張らずにできるから
784.0,786.0,いや縛りとか
786.0,788.0,絶対したくないんだよね
788.0,790.0,つらい男女は
790.0,792.0,編集でやっていい?
792.0,794.0,じゃあここちょっと
794.0,796.0,あとでやっときます
796.0,798.0,動画でカット入れながらやっていい?
798.0,800.0,しゃべるのつらいんだよ
802.0,804.0,で見やすく2人で見るみたいな
804.0,806.0,2人でっていうか
806.0,808.0,いや100時間かかる
808.0,810.0,俺しかも100%で
810.0,812.0,パーフェクトエンディング
812.0,814.0,見せたいからみんなに
815.0,817.0,パーフェクトエンディング見せたいじゃん
819.0,821.0,それ100時間かかるんだよね
821.0,823.0,もちろんリマスターだよやるとしたら
831.0,833.0,急速猫髪取れないんだよね
833.0,835.0,1周目で100%出そうと思ったら
836.0,838.0,急速猫髪取れないんだよね
843.0,845.0,FF10ねFF10-2みんなゴミゴミって言うじゃん
845.0,847.0,言うほどゴミじゃないよ
847.0,849.0,ちょっとはやっぱ
849.0,851.0,10が面白かったら
851.0,853.0,10の続きってこうなってたんだみたいな感じで
853.0,855.0,俺は楽しかったけどね
855.0,857.0,普通に面白いよねあれね
857.0,859.0,そこそこだよねゴミじゃないよね
861.0,863.0,その続編みたいな感じで
863.0,865.0,ちゃんと1日2時間やれば
865.0,867.0,3ヶ月で終わるぞ
867.0,869.0,お前やばくないか3ヶ月計画
870.0,872.0,お前1日2時間で3ヶ月って
874.0,876.0,言うてくれはりますな
876.0,878.0,そんな簡単に
878.0,880.0,90日だぞ
880.0,882.0,1日1時間で終わるじゃねえかよ
882.0,884.0,騙された
885.0,887.0,騙された
887.0,889.0,まぁな
889.0,891.0,10のなレベルがちょっと
892.0,894.0,高いっていうのもあるよね
895.0,897.0,うーん
898.0,900.0,90日か
900.0,902.0,まぁちょっと
902.0,904.0,考えます
904.0,906.0,お前きまりは
906.0,908.0,出なさすぎじゃなくて
908.0,910.0,ガガゼド行ってねえんだろ
910.0,912.0,おっと言いそうになっちゃった
912.0,914.0,あいつなんかあれなんだぞ出世してんだぞガガゼドで
914.0,916.0,レイホーザガガゼドで
916.0,918.0,まぁでもな
918.0,920.0,FF10面白かったな
920.0,922.0,なんかやっぱああいうゲームをやりたいんだけどね
922.0,924.0,あれはもうね
924.0,926.0,ほんと配信とかでやりたいんだよね
926.0,928.0,だらーっと
928.0,930.0,だらーっとやった分反動がでかいっていう
930.0,932.0,9はねちょっとできないわ
932.0,934.0,9はちょっとできない
938.0,940.0,今夜ときめも見返すFF10は重い
940.0,942.0,いやでもたまに見たくなんない
942.0,944.0,たまに
944.0,946.0,セブンさ俺知らねえんだよ
948.0,950.0,知らないんだよね
950.0,952.0,あと10分くらいしかないぞ
952.0,954.0,今日はもうちょっとだらーっと
954.0,956.0,俺てかさ実況上げるって言ったじゃん
956.0,958.0,その候補
958.0,960.0,候補5つ考えてきた
960.0,962.0,すごくない
962.0,964.0,5個考えてきた
964.0,966.0,で
966.0,968.0,今月中に撮ろうと思うんだよ
968.0,970.0,5個考えた
970.0,972.0,しかも中途半端なやつじゃねえ
972.0,974.0,ちゃんと考えてきた
974.0,976.0,5つ
976.0,978.0,あのさ
978.0,980.0,知りたいんだけどさ
980.0,982.0,パート1を
982.0,984.0,1本を上げつつ枝分かれしてった方がいいか
988.0,990.0,投稿のさ
990.0,992.0,あれはどうすればいいかなと思って
994.0,996.0,パート1を
996.0,998.0,ザーって一気に上げるか
998.0,1000.0,それとも1個のやつをジャーって上げて
1000.0,1002.0,完結する前にもう1個バーっと上げ始めて
1002.0,1004.0,完結する前にもう1個バーっと上げ始めるか
1008.0,1010.0,分かんないんだよね
1012.0,1014.0,1個の実況で始めるのめんどくせえんだよな
1014.0,1016.0,もったいぶってるみたいでめんどくさいんだよね
1018.0,1020.0,全部取り終えて
1020.0,1022.0,編集も終わった段階で
1022.0,1024.0,予約投稿しようかなと思った
1024.0,1026.0,気がついたら全部が繋がる姿勢にしよう
1026.0,1028.0,お前難しすぎるだろそれ
1030.0,1032.0,まさかみたいな
1032.0,1034.0,世界
1034.0,1036.0,世界線が一緒みたいな
1036.0,1038.0,それはちょっと難しいよね
1038.0,1040.0,日刊にして
1040.0,1042.0,毎日上げていこうかな
1042.0,1044.0,日刊にして
1046.0,1048.0,一気にパート1がいい
1048.0,1050.0,やっぱ袖割れるよね
1050.0,1052.0,日刊にしてあれしようかな
1052.0,1054.0,日刊にして
1056.0,1058.0,完結させてあげてみて
1058.0,1060.0,そうするとさ自然的に短いやつから上げたくなるよね
1062.0,1064.0,日刊はいいよな
1064.0,1066.0,でも
1066.0,1068.0,もう取り終えてから
1068.0,1070.0,上げ始めれば
1070.0,1072.0,しかもそんな長い
1072.0,1074.0,あれじゃないんだよね俺的に
1074.0,1076.0,30分の動画も
1076.0,1078.0,1パート
1078.0,1080.0,17分くらいの動画で
1080.0,1082.0,パート15で終わらせる予定なんだよね
1082.0,1084.0,ってことは2週間だろ
1088.0,1090.0,2週間か
1090.0,1092.0,予約投稿
1092.0,1094.0,1日丸1日かけて
1094.0,1096.0,わーって編集して
1096.0,1098.0,最後まで取り終えて
1098.0,1100.0,毎日1パートずつ上げるなんて我慢できないんだよな
1100.0,1102.0,俺な
1102.0,1104.0,一気に上げたくなっちゃうんだよな
1104.0,1106.0,それでも良くない
1106.0,1108.0,全部1日でドカーンって15上げる
1108.0,1110.0,別に良くないそれで
1110.0,1112.0,本当に面白かったらそれでも伸びんだろ
1112.0,1114.0,良くない
1114.0,1116.0,そんなさ
1116.0,1118.0,小賢しいこと考えてるからさ
1118.0,1120.0,いけねえんだよ
1120.0,1122.0,でそれでも
1122.0,1124.0,伸びるものは伸びるでしょ
1124.0,1126.0,だからね
1126.0,1128.0,そうしよう
1130.0,1132.0,もし本当に終わってて
1132.0,1134.0,しかも
1134.0,1136.0,それで2日投げていこうかな
1136.0,1138.0,5日間で
1138.0,1140.0,5日間全部上げる
1142.0,1144.0,最初ちょっとなんか
1144.0,1146.0,テスト動画上げるわ
1146.0,1148.0,なんか適当に犬と遊んでる動画
1148.0,1150.0,犬と遊んでる動画
1150.0,1152.0,エンコードとかのテストしていいし
1152.0,1154.0,見れねえよな
1154.0,1156.0,で
1156.0,1158.0,それはねぶっちゃけね
1158.0,1160.0,本当にやりたいことの巻き餌なんだけど
1162.0,1164.0,まあでも2ヶ月後だな
1164.0,1166.0,そっちの
1166.0,1168.0,本腰入れてやる方は
1168.0,1170.0,2月後
1172.0,1174.0,日課なんてお前は生放送で自らネタバレ
1174.0,1176.0,いや動画上げ始めたら
1176.0,1178.0,悪くやらない
1178.0,1180.0,ちょっとそっちに集中する
1180.0,1182.0,でなんか
1182.0,1184.0,雑談はしない
1184.0,1186.0,やりたい放送があったら
1186.0,1188.0,やっていこうかな
1188.0,1190.0,やりたい放送があったら
1190.0,1192.0,えゼロじゃないよ
1192.0,1194.0,ゼロじゃないよ
1194.0,1196.0,一気に上げるとファン増えて生きにくくない
1196.0,1198.0,なんかもう今更じゃん
1198.0,1200.0,じゃない
1200.0,1202.0,俺がさ例えば3日に1回上げますとか言ってもさ
1202.0,1204.0,俺できないの本当にそれが
1204.0,1206.0,できないの
1206.0,1208.0,終わってたら全部バーって出しちゃいたいんだよね
1210.0,1212.0,できないもんはできないんだよね
1212.0,1214.0,できない
1216.0,1218.0,お前本当にジリジリいくの
1218.0,1220.0,えでもさ面白かったら伸びるだろ
1220.0,1222.0,それで
1222.0,1224.0,俺手抜かねえぞだって作品に関しては
1226.0,1228.0,作品に関しては手抜かないんだよ一切
1230.0,1232.0,じゃない
1234.0,1236.0,だよね
1236.0,1238.0,一気に見るやつなんていない
1238.0,1240.0,ジリジリ見ればいいじゃん
1240.0,1242.0,見ればよくない
1242.0,1244.0,面白くても伸びにくくなる
1244.0,1246.0,別にそれだったらまあ
1246.0,1248.0,ちょっとしか変わんないでしょ
1248.0,1250.0,それ日刊にする
1250.0,1252.0,日刊めんどくせえな
1252.0,1254.0,予約投稿確か1週間先までしかできねえだろ
1256.0,1258.0,一気に上げると最初と最後だけしか
1258.0,1260.0,見ない人出るだろ
1260.0,1262.0,映画2みたいじゃん
1262.0,1264.0,前の公開の
1266.0,1268.0,ラスト15分から見始めて
1268.0,1270.0,その次も見るって言うよね
1270.0,1272.0,その次も見る
1272.0,1274.0,映画2はそうやって見るって言ってたよ
1276.0,1278.0,タイトルが肝心だから
1278.0,1280.0,しっかり考えろよ
1282.0,1284.0,俺そんな苦手だな
1284.0,1286.0,すっごいスタンダードな感じでいこうかな
1286.0,1288.0,最初と最後と
1288.0,1290.0,カーテンションの差が前から上げそうだよね
1290.0,1292.0,違うよな
1294.0,1296.0,スターウォーズ方式
1296.0,1298.0,それいいね
1298.0,1300.0,スターウォーズ方式
1300.0,1302.0,パート7から上げていこうかな
1302.0,1304.0,エピソード7から
1304.0,1306.0,エピソード7から
1306.0,1308.0,上げていこうかな
1308.0,1310.0,天才だなお前それ
1310.0,1312.0,んんん
1316.0,1318.0,まぁちょっと
1318.0,1320.0,考えときます
1320.0,1322.0,考えときます
1322.0,1324.0,でもあの
1324.0,1326.0,昔のテンションでは絶対できないから
1326.0,1328.0,それはもう仕方ないんだよ
1328.0,1330.0,恥ずかしいのね
1330.0,1332.0,恥ずかしいって感情が
1332.0,1334.0,一番他人にとって恥ずかしいことだから
1334.0,1336.0,他人に見られて
1337.0,1339.0,そこはちょっとなんか
1339.0,1341.0,フュージョンでいきたいと思います
1341.0,1343.0,今の配信の感じと
1343.0,1345.0,考えてるそこはもうちゃんと考えてる
1345.0,1347.0,一応俺なりのコンセプトがある
1347.0,1349.0,フュージョンで
1349.0,1351.0,テーマは
1351.0,1353.0,いこうと思います
1353.0,1355.0,お前バークレコーディー
1355.0,1357.0,入れてねぇよ
1357.0,1359.0,シューチンがあるといけないでしょ
1359.0,1361.0,単純に自分が
1361.0,1363.0,期待してていいか分かんないんだよね
1363.0,1365.0,どんな動画が伸びるかとか分かんないからさ
1366.0,1368.0,分かんないけど
1368.0,1370.0,なんか俺なりの
1370.0,1372.0,ちゃんとした実況動画
1373.0,1375.0,やろうかなと思います
1375.0,1377.0,ちゃんとした
1377.0,1379.0,6時投稿でランキング伸びる
