start,end,text
0.0,11.0,【早送り】
11.0,13.0,こんにちはー
16.0,18.0,えーこっちの方は
18.0,20.0,ねもしチャンネルの方から
20.0,22.0,視聴すればいいのか
23.0,25.0,常にもう俺を
25.0,27.0,俺自身を映す鏡となります
27.0,29.0,自分が
30.0,37.0,【早送り】
37.0,39.0,なんかね
39.0,41.0,相性が悪い時があるんだよね
41.0,43.0,うんこちゃんと申します
43.0,45.0,うんこちゃんと申す
45.0,47.0,ミラーのパソコンに
47.0,49.0,アマレコ入ってるのは
49.0,51.0,そっちでやればいいじゃん
51.0,53.0,でもそうするとまためんどくせぇんだよな
53.0,55.0,いつもと違う状況でやりたくないんだよね
55.0,57.0,常に
57.0,59.0,常に俺はいつも通り
60.0,62.0,なんか企画かー
62.0,64.0,もうゲーム自体できないよ
64.0,66.0,アマレコTVが作動しない時がある
68.0,70.0,買わねーや
70.0,72.0,裸だよ裸
72.0,74.0,裸
74.0,76.0,障害者と障害者どっちがいいか分かんない
76.0,78.0,最近の世の流れはどっちなんだろうね
78.0,80.0,別になんか別に
80.0,82.0,どっちもどっちじゃねー
82.0,84.0,そんな気にしてる奴いなそうな気がする
84.0,86.0,実際問題
86.0,88.0,ジャイアンがソフトバンクに三盾くらった話
88.0,90.0,あれほんと腐ってるよな
90.0,92.0,なんか情けんてか
92.0,94.0,撃てなすぎるんだってジャイアンツ
94.0,96.0,撃てなすぎるんだよ
96.0,98.0,ごめんごめん
100.0,102.0,申し訳
106.0,108.0,すっかりさドラクエモードだったからさ
108.0,110.0,なんか
114.0,116.0,せっかくだから
116.0,118.0,ミラーのクソどものコメントも反映させてやくか
120.0,122.0,申し訳程度に
124.0,126.0,下の方にな
128.0,130.0,申し訳程度に
132.0,134.0,申し訳程度にやっとこ
134.0,136.0,なんかにぎわってる感が出るじゃん
136.0,138.0,にぎわってる感が
138.0,140.0,やってるねきょうも
140.0,142.0,やってるねきょうも
142.0,144.0,誰だろ
144.0,146.0,やりたくねーよ
146.0,148.0,なんでしゃべんなきゃいけないの
148.0,150.0,何を
150.0,152.0,何をしゃべらなきゃいけないのか
152.0,154.0,よくわかりません
154.0,156.0,お前障害者なら24時間テレビで
156.0,158.0,松井とキャッチボールしろよ
158.0,160.0,松井キャッチボールしてくんねーだろ
160.0,162.0,そんな軽くねーよ
162.0,164.0,あいつの重さは
164.0,166.0,わかんない
166.0,168.0,特にそんな理由もないけど
168.0,170.0,なんか直そうかな
170.0,172.0,変えようかなと思って
172.0,174.0,多分つけたときに
174.0,176.0,間違えてつけちゃったんじゃない
176.0,178.0,わかんないけど
180.0,182.0,そういう
182.0,184.0,しっかりなんか
184.0,186.0,あれしてないよ決めてない
186.0,188.0,決めてません
188.0,190.0,野球やってんの
190.0,192.0,野球やってたら野球見ようかな
192.0,194.0,あでもなんかこの前見てお腹いっぱいなんだよな
196.0,198.0,2時間がっつりしゃべりながら野球って相当疲れるからさ
198.0,200.0,やってないんでよかったよかった
200.0,202.0,やってないなら俺も悪者にならず
204.0,206.0,誰も悪者にならない
206.0,208.0,ニコ生でさ野球やってる日はいつなの
210.0,212.0,横浜戦ってかジャイアント戦見てんだよ俺
212.0,214.0,ジャイアント戦
214.0,216.0,ジャイアント戦見たいんだよね
216.0,218.0,ちょっと待ってな
222.0,224.0,ミラーが場所取りすぎ
226.0,228.0,ちゃんと角差をな
230.0,232.0,角の違いを見せつけなきゃいけないから
234.0,236.0,これぐらいにしよっか
236.0,238.0,これいいじゃん
238.0,240.0,よくない
240.0,242.0,ちょうどええなこれな
246.0,248.0,この隙間をうまいこと使ってってください
248.0,250.0,なんで雑談
250.0,252.0,なんかね
252.0,254.0,あのーアマレコTVが調子悪くてさ
254.0,256.0,全然入んなくて
256.0,258.0,てかマジじゃねーだから
258.0,260.0,こっちで見ろよ普通に
260.0,262.0,こっちで見ればよくない
262.0,264.0,なんでさ強がってこっちで見てんの
264.0,266.0,こっちで見てこっちでみんな
268.0,270.0,こっちに来て本県の方でコメントして
270.0,272.0,俺なんかそういう散らされると
272.0,274.0,意識がなんか散らされるから
274.0,276.0,アマレコTVのエラー調べるから
276.0,278.0,もう一回見せてくれ
278.0,280.0,エラー出なくなっちゃった
280.0,282.0,最近地震オールどう思う
282.0,284.0,なんか物騒だよね
284.0,286.0,でも天災で死ぬ分には仕方なくない
286.0,288.0,誰も悪くねーじゃん
288.0,290.0,諦めつくよ
292.0,294.0,なんかさ暴飲暴食がたたって
294.0,296.0,糖尿病で死ぬとかだったら
296.0,298.0,なんてことしてくれたんだ
298.0,300.0,ってなるけど
300.0,302.0,そればっかりは本当に神のみとする世界じゃない
302.0,304.0,地震やら
304.0,306.0,雷やらさ
306.0,308.0,じゃない
308.0,310.0,本当にそう思うよ
310.0,312.0,本当にそう思う
312.0,314.0,あればっかりは神のみとする
314.0,316.0,世界だよね
316.0,318.0,ロレス回ってなくないよもともとこんなもんだよ
318.0,320.0,もともとこんなもんでーす
320.0,322.0,病気だって似たようなもんじゃない
322.0,324.0,いや病気はさ
324.0,326.0,なんかもう確たる理由があるじゃん
326.0,328.0,天災に至ってはさ
328.0,330.0,まだ解明されてないでしょ
330.0,332.0,科学的にね解明されてんの
332.0,334.0,でもおい
334.0,336.0,予知できるの
336.0,338.0,予知できるんだったら俺は
338.0,340.0,俺を許せないけど
340.0,342.0,俺は俺を許せないけど
342.0,344.0,おっさんは天災で死ぬやつを
344.0,346.0,自業自得って言ってたよ
346.0,348.0,いや自業自得じゃないでしょ
348.0,350.0,そんなバカだよはっきり言ってそんなの
350.0,352.0,発達障害だよおっさん
352.0,354.0,自業自得じゃねーだろ
354.0,356.0,全然自業自得じゃねーや
356.0,358.0,全くもっと違くない
358.0,360.0,こんなもんじゃない
360.0,362.0,いつもこれぐらいです
362.0,364.0,だよね
364.0,366.0,地震は予知できないんだ
366.0,368.0,でもさ
368.0,370.0,P波を感知してさ最近携帯鳴るよね
370.0,372.0,プルルルルみたいな
372.0,374.0,けたたましい音楽鳴らない
376.0,378.0,けたたましい音楽鳴るよね
378.0,380.0,あれは何予知じゃねーよな
380.0,382.0,予知じゃねーよな
382.0,384.0,でもさ
384.0,386.0,なんかそういう歪みみたいなのがあってさ
386.0,388.0,この辺で
388.0,390.0,要は死にたくなかったら日本から出てけよ
390.0,392.0,っていう話だよね
392.0,394.0,そこまで地震で絶対死にたくねーって言うんだったら
394.0,396.0,日本から出てくしかないよな
396.0,398.0,多いもんね明らかに日本は
398.0,400.0,10年単位の予知ならできない
400.0,402.0,そうなんだ
402.0,404.0,いつもと変わんなくない
404.0,406.0,下にあれか
406.0,408.0,プレートの沈み具合をGPSで
408.0,410.0,感知してるそうなんだ
410.0,412.0,そこまでしてもさ
412.0,414.0,無理なんだよな
414.0,416.0,無理なんだよね
416.0,418.0,仕方ないよね
418.0,420.0,だからもう受け止めるしかないんだよ
420.0,422.0,受け止めるしか
422.0,424.0,ないんだよね
424.0,426.0,地震速報来ても同時代俺かっこいいとか
426.0,428.0,思ってる風評どうにかして
428.0,430.0,そんな奴誰もいねーよ
430.0,432.0,お前が見えない出来と戦ってるだけでそんなこと思ってる奴
432.0,434.0,誰もいねーよ身構えてるよあんな
434.0,436.0,悪夢があったんだから
438.0,440.0,あんな悪夢があったんだからさ
440.0,442.0,受け止めるしかねーよな
442.0,444.0,直前までしか分からない予知はできない
444.0,446.0,金の無駄やっぱそうだよね
446.0,448.0,受け入れるしかないよね
448.0,450.0,あれこそうんぷてんぷだよ
450.0,452.0,だってさ福島にさ地震が起きるなんて
452.0,454.0,分かんなかったでしょ
454.0,456.0,分かんないこうやってさ
456.0,458.0,ゆっくり話している
458.0,460.0,5分後とかに関東大震災
460.0,462.0,ドーンって来たら死んでるかもしんねーじゃん
464.0,466.0,分からんよな
466.0,468.0,でかいの来ると体勝手に動くかっけー
468.0,470.0,原発について話そう
470.0,472.0,原発とか興味ねーんだよなはっきり言って
472.0,474.0,なんか必要以上に原発
474.0,476.0,反対とか言ってる奴はマジ気持ち悪いけど
476.0,478.0,あんま興味ないんだよね
478.0,480.0,結局のところ
480.0,482.0,どうなんだろうっていう
482.0,484.0,分からない理解ができない
486.0,488.0,なんか嫌いな人は
488.0,490.0,でも原発反対してる人に多いかな
490.0,492.0,山本太郎とか俺本当に死すべき人間だと思ってるから
492.0,494.0,あんな奴にさ我々の税金
494.0,496.0,突き込んでさ1000万2000万キル
496.0,498.0,張ってるとかマジ馬鹿らしいから
498.0,500.0,政治家とかマジいく分かマジだからさ
500.0,502.0,俺横の中のことなんも知らないけど
502.0,504.0,あんなバカにさあんな分かりやすいバカにさ
504.0,506.0,ちょっとね
506.0,508.0,おかしいと思うマジであいつがラストやつらは
508.0,510.0,責任取ったほうがいいと思うあいつバカだよな本当に
510.0,512.0,投票するやつもバカだけど
512.0,514.0,あいつほどバカほんと見たことねーから
514.0,516.0,もったいねーよ
516.0,518.0,本当にこの言葉届けてほしいお前みたいなバカ本当に
518.0,520.0,自らやめるべきだよと国のため思うなら
522.0,524.0,被害を受けなきゃ分からんよまあそうだよな
524.0,526.0,実際問題ね
526.0,528.0,実際問題そうだと思う
528.0,530.0,俺が福島とか住んでたら
530.0,532.0,マジ原発反対
532.0,534.0,とかなるんだろうけどやっぱ住んでないからさ
534.0,536.0,なんかだって
536.0,538.0,ねえそれにやっぱ頼って
538.0,540.0,ねえ生きてきた
540.0,542.0,っていうあれがあるからね
542.0,544.0,ドイツはもう原発稼働してないんでしょ
544.0,546.0,それはどういう風に
546.0,548.0,エネルギーを発電してんの
550.0,552.0,携帯も鳴ってる
552.0,554.0,ドイツは
554.0,556.0,買ってるんだ
556.0,558.0,でもさ周りにさあんだけ国があったらさ
558.0,560.0,いくらでもなんとかできるよね
560.0,562.0,うちらだってさ離れ小島でさ
562.0,564.0,自力でやるしかねえのにさどうすんだよって感じじゃない
564.0,566.0,フランスの原発
566.0,568.0,関係
568.0,570.0,ふざけんなよそれ結局なんかさ
570.0,572.0,自国でやってるだけじゃねえかよ
572.0,574.0,それからもう察するに
574.0,576.0,必要じゃねえかよ絶対
576.0,578.0,絶対必要じゃねえかよ
578.0,580.0,結局自国でやってるだけだろ
580.0,582.0,だから南朝鮮とかにやらして
582.0,584.0,我々は安全に
584.0,586.0,電気を発電しようっていう
586.0,588.0,それだったらまああるかな
588.0,590.0,日本人の方が多分優れてるからね
590.0,592.0,どうせ死ぬんだったら向こうの奴らが死んだほうがいいでしょ
592.0,594.0,そういうんだったら
594.0,596.0,分かるけど別にドイツ人なんてさ賢くもなんともねえじゃん
596.0,598.0,あいつら
598.0,600.0,なんで我々は人は地形ぞみたいな
600.0,602.0,おめえらなんかそんな程度引きだろうがや
602.0,604.0,日本語あんねえバカがや
604.0,606.0,なんであいつらなんか貴族気取ってんのマジ腹立つんだけそういうの
606.0,608.0,あいつらやたら日本語バカにしてんだろ
608.0,610.0,あのバカども
610.0,612.0,なんてめえ威張ってんだよ
612.0,614.0,ウンコちゃん許してねえぞ
614.0,616.0,声が広みマジで
616.0,618.0,声がしたいから枠切ってごめん
618.0,620.0,切ることはできない
620.0,622.0,46億円ものがねやりてえ
622.0,624.0,やりたいよね
624.0,626.0,ちんぽんでかそうじゃない
626.0,628.0,なんかドイツ人ってさ
628.0,630.0,なんかすごい
630.0,632.0,ねえ他国見下すってイメージがあるんだけど
636.0,638.0,そういうイメージかな
638.0,640.0,勝手なるイメージかな
640.0,642.0,ドイツ人はすごいぞ
642.0,644.0,えーなんか
644.0,646.0,何がすごいのじゃあ
646.0,648.0,何がすごいのドイツって
648.0,650.0,車?
650.0,652.0,ドイツのすごいとこ上げてみてよ
652.0,654.0,ドイツはヨーロッパの日本みたい
654.0,656.0,いやいやまあそうか
656.0,658.0,ヨーロッパ時代が程度だからなんか俺イメージ
658.0,660.0,あいつらなんか
660.0,662.0,先進国気取ってんのかなんか理由がわかんないんだけど
662.0,664.0,あいつら日本に勝ってるとことないじゃん
664.0,666.0,各国
666.0,668.0,一単位で日本に勝ってると体もデカすだけでしょ
668.0,670.0,足速いとかでしょ
672.0,674.0,サッカーとかでしょ
674.0,676.0,そういうんじゃなくてさウィンナーとかでしょ
676.0,678.0,違うじゃんだから
678.0,680.0,違うじゃん
680.0,682.0,ソーセージうまいとかさ
682.0,684.0,街並みが綺麗とかさ
684.0,686.0,野球はじゃあ日本のほうが全然強いんじゃねえかよ
688.0,690.0,なんか今気になるコメントがあった
690.0,692.0,お前
692.0,694.0,猛コヒであるドイツ人は全員だよ
694.0,696.0,猛コヒだって
698.0,700.0,ナチスの件で周りに占められてるはそうなんだ
700.0,702.0,ドイツ工業国だよね
702.0,704.0,なんかでも今もさ世界有数の工業国なの
704.0,706.0,猛コハン?
706.0,708.0,猛コハン?
708.0,710.0,今もなおさ
710.0,712.0,ドイツは世界の戦闘を
712.0,714.0,いってるの
716.0,718.0,車だよね
718.0,720.0,車でしょ
720.0,722.0,日本3位ドイツ4位
722.0,724.0,2位が中国で1位がアメリカか
724.0,726.0,まあでも中国は
726.0,728.0,うさんくせえだけだから
728.0,730.0,結局日本のほうが上じゃん
730.0,732.0,勝ちな日本の
732.0,734.0,EUではトップって言ってたけど
734.0,736.0,まあでも
736.0,738.0,じゃあ一応プライドはだけんだ
738.0,740.0,あいつらなんか見た目がさ日本人よりかっこいいからって
740.0,742.0,なんかさ調子乗ってねえか
744.0,746.0,見た目がさ
748.0,750.0,ホルクスワーゲンとかでしょ
750.0,752.0,車にうとい俺でも知ってるぜ
752.0,754.0,ワーゲン
754.0,756.0,体がでかかったりさ
756.0,758.0,白人主義だよね
760.0,762.0,いやコンプってしょうがねえだろ
762.0,764.0,見た目は向こうのほうがかっこよくない
764.0,766.0,フォルムとか景観は俺
766.0,768.0,EUってかさヨーロッパ北欧の人たちのほうが
768.0,770.0,全然美しいと思うよ
770.0,772.0,そんなのねえはっきり言って
772.0,774.0,整形とかでなんでもなっちゃうじゃん
774.0,776.0,整形とかでも顔ちっちゃいしさ
776.0,778.0,なっちゃうない
778.0,780.0,でもドイツ人のトップ女だよ
780.0,782.0,あいつはねえ唯一俺が負けを認めた女だから
782.0,784.0,もう仕方ないでしょ
784.0,786.0,あの
786.0,788.0,あいつまじくそ怖くない
788.0,790.0,あいつ
790.0,792.0,くそ怖いよねえ
792.0,794.0,なんだっけメルケル
794.0,796.0,あいつやべえよなあ
796.0,798.0,くそ怖くないメルケル
800.0,802.0,メルケル無能だろ
802.0,804.0,いやでもさ無能が一刻のトップにならねえよ
804.0,806.0,つーか
806.0,808.0,お前総理になってんだ総理
808.0,810.0,大統領になってんだぜ
812.0,814.0,メルケル
814.0,816.0,怖ええよなあ
816.0,818.0,見た目からしてこいつに逆らっちゃいけねえな
820.0,822.0,白人の方がかっこいいという価値観自体が
822.0,824.0,白人に洗脳されている
824.0,826.0,洗脳じゃなくてさ
826.0,828.0,アニメとかでもさ
828.0,830.0,白人に寄せて骨格作ったりしてんじゃん
830.0,832.0,それって自然となんか
832.0,834.0,評価がそういう風に
834.0,836.0,美しいとされてるんじゃないの
836.0,838.0,俺も全然美しいと思うけど
838.0,840.0,日本人のさ
840.0,842.0,スタイルとかよりは
842.0,844.0,普通にかっこいいよね
844.0,846.0,洗脳とかではなく事実としてかっこよくない
846.0,848.0,アニメって思いっきり
848.0,850.0,白人顔で描かれてるじゃん
850.0,852.0,あの日本人特有のさ
852.0,854.0,口が出っ張ってるようなさ
854.0,856.0,フォルムで描かれないでしょ
856.0,858.0,鼻が高くて顎がひゅって出てて
858.0,860.0,なってるよね
862.0,864.0,あれもう典型的な白人骨格で
864.0,866.0,Eラインっていうのは俺よくわかんないけど
866.0,868.0,典型的な
868.0,870.0,白人の骨格で描かれてるよね
870.0,872.0,日本人の確かに
872.0,874.0,なんか特有の骨格で描いたら
874.0,876.0,アニメなんか見ねえもんな
876.0,878.0,その風潮が洗脳だよ
878.0,880.0,それが洗脳なんだ
880.0,882.0,まあ確かに
882.0,884.0,美意識とかは測れないもんね
884.0,886.0,神秘観とかはさ
886.0,888.0,わからないもんな
888.0,890.0,数字でわからないもんね
890.0,892.0,猛コヒダがあるか
892.0,894.0,調べてお前が調べてよ
894.0,896.0,わからないわ
896.0,898.0,初めて聞いた
898.0,900.0,日本人のイケメンも白人より長そうだよね
900.0,902.0,福山マサハルとか
902.0,904.0,そういう感じだよね
904.0,906.0,福山マサハルやら
906.0,908.0,何やらの
908.0,910.0,白人が黒人をしたり見ている
910.0,912.0,そうなんだ
912.0,914.0,黒人もなんか色がさ
914.0,916.0,骨格とかを白人の骨格してんじゃないの
916.0,918.0,そういう骨格的な
918.0,920.0,意味合いだったらさ
920.0,922.0,日本人とか韓国人とか
922.0,924.0,もう本当に最底辺の
924.0,926.0,あれなんじゃないのかな
926.0,928.0,俺黒人めっちゃ好きだけど
930.0,932.0,イルカ漁を否定してくんの
932.0,934.0,ムカつかえ?誰が否定してくんの
934.0,936.0,あのさガチャガチャ言ってくれ
936.0,938.0,何なのつーか
938.0,940.0,イルカやらクジラやらのさ
940.0,942.0,いいだろ別に海を泳いで
942.0,944.0,なんで魚食っていいんだよ
944.0,946.0,俺クジラも食うからな確実に
946.0,948.0,バカバカ食うからなクジラなんて
950.0,952.0,シンシェバードって何なの
952.0,954.0,動物愛護団体
954.0,956.0,何で他の動物食って
956.0,958.0,イルカとクジラは特別食っちゃいけないの
958.0,960.0,クジラとかクソうめえじゃん
960.0,962.0,クジラ
962.0,964.0,イルカも
964.0,966.0,イルカ食ったことないけど
966.0,968.0,クジラうまいじゃん
968.0,970.0,クジラ俺大好きだったよ
970.0,972.0,イルカは食ったことないけど
972.0,974.0,韓国とかってイヌクオロ
974.0,976.0,食ってんじゃねえかよ
976.0,978.0,俺たち別に食わねえけどさ
978.0,980.0,反対してねえだろあんなバカが何食っても
980.0,982.0,関係ねえよみたいな感じでさ
982.0,984.0,自分の飼ってる犬食われたらさ
984.0,986.0,殺しに行くけどさ
986.0,988.0,なんとも思わねえんだけど
988.0,990.0,他の国の文化だろうが
990.0,992.0,全然関係ねえよ別に
992.0,994.0,韓国やら中国やらが
994.0,996.0,犬やら猫やら食おうが
996.0,998.0,イギリスはウサギ食ってる
998.0,1000.0,ウサギ食ったんじゃないの
1000.0,1002.0,ウサギはさ
1002.0,1004.0,イルカもクジラも目が優しいからな
1004.0,1006.0,所詮さそういう人間のものさしでさ
1006.0,1008.0,選んでんじゃねえかよ
1008.0,1010.0,こいつは生き残す
1010.0,1012.0,こいつは殺す
1012.0,1014.0,みたいな
1014.0,1016.0,ひどい
1016.0,1018.0,ちなみにアラスカでも減量はしている
1018.0,1020.0,へえ
1020.0,1022.0,あそっか哺乳類だからって感じ
1022.0,1024.0,えでも人間だって哺乳類食ってない
1024.0,1026.0,余裕で
1026.0,1028.0,イルカとかクジラに厳しいよね
1028.0,1030.0,あいつら
1030.0,1032.0,イルカやらさ
1032.0,1034.0,牛とか豚とかなんでふざけんなよって感じだよね
1036.0,1038.0,俺ちなみにサソリ食ったことあるよ中国行った時
1038.0,1040.0,5匹以上は食うなって言われた
1040.0,1042.0,なんか毒が回るからとか
1042.0,1044.0,そんなもん料理に出すんじゃねえよって感じだよね
1044.0,1046.0,そんなもん
1046.0,1048.0,俺クジラ
1048.0,1050.0,あのーサソリ食ったことあるよ中国行った時
1050.0,1052.0,全然
1052.0,1054.0,ハートチップスみたいな味した
1054.0,1056.0,ハートチップス
1056.0,1058.0,すげえ美味しかったハートチップスパリパリパリパリ
1058.0,1060.0,ハートチップス食べました
1060.0,1062.0,ハートチップスみたいな
1062.0,1064.0,中国ね
1064.0,1066.0,ガキの頃行ったからさまださきったねえなんか
1066.0,1068.0,感じだったけど
1068.0,1070.0,今行ったら変わるんだろうな
1070.0,1072.0,いやでも中国行きたくねえな
1072.0,1074.0,いきたくねえな
1074.0,1076.0,なんで日本いるのに中国行かなきゃいけねえの
1076.0,1078.0,全てにおいて介護官じゃん
1078.0,1080.0,わざわざ中国って何するの
1080.0,1082.0,絶対行きたくねえんだけど
1082.0,1084.0,ほら鼻もワンワン言ってる
1084.0,1086.0,大強制しまくりだよねえ
1086.0,1088.0,なんかきったねえ
1088.0,1090.0,20年前の日本のさ
1090.0,1092.0,マジでそのまんま歩んでるよね
1092.0,1094.0,20年前の
1094.0,1096.0,日本そのまんま
1096.0,1098.0,"バブル来ててさその後あと4,5年ではじけてさ"
1098.0,1100.0,クソ
1100.0,1102.0,ねえひとりっ子政策とかやってるからさ
1102.0,1104.0,ハイパー超高齢化社会になってさ
1104.0,1106.0,グズグズになってさ
1106.0,1108.0,あいつらバカだからさ
1108.0,1110.0,他国にあのー
1110.0,1112.0,絶対助けんだよ
1112.0,1114.0,日本マジで絶対手貸すんだよ
1114.0,1116.0,中国とか韓国には
1116.0,1118.0,あいつらさんざんぱらさこっちのことガチャガチャ言ってきてんだから
1118.0,1120.0,戦後の日本を地で言ってるよね
1120.0,1122.0,"てか2,30年前の日本じゃん"
1122.0,1124.0,だってさ
1124.0,1126.0,20年前さバブルが25年くらい前か
1126.0,1128.0,1990年くらいでしょバブルはじけたの
1128.0,1130.0,その前さ
1130.0,1132.0,日本の銀座でアメリカ全土が買える
1132.0,1134.0,銀座の土地の
1134.0,1136.0,値段だけでアメリカ
1136.0,1138.0,の国が全部買えちゃうくらいの
1138.0,1140.0,すごいバブルが
1140.0,1142.0,訪れたときにさ
1142.0,1144.0,日本人はこぞっとアメリカに行ってさ
1144.0,1146.0,マンションとか土地とか買ったりしてたじゃん
1146.0,1148.0,今まさに中国が同じこと
1148.0,1150.0,日本にやってるじゃん
1150.0,1152.0,あいつら今に見とけよと
1152.0,1154.0,お前らに待ち受けてるのは地獄だからだって
1154.0,1156.0,ほんと楽しみだわ
1156.0,1158.0,ほんとに楽しみ
1158.0,1160.0,"4,5年景気のいいニュースばっかだもんね"
1160.0,1162.0,中国がさ
1162.0,1164.0,フランスにさ
1164.0,1166.0,とある企業の
1166.0,1168.0,社員旅行で
1168.0,1170.0,20億円かけてフランス行って
1170.0,1172.0,1社員旅行でだよ
1172.0,1174.0,フランス行ってよ
1174.0,1176.0,バカバカ使いまくって
1176.0,1178.0,兄を馳せよ
1178.0,1180.0,みたいな
1180.0,1182.0,結構依存してるよね
1182.0,1184.0,正直な話
1184.0,1186.0,いい市場だよね
1186.0,1188.0,韓国とかは別にね
1190.0,1192.0,足引っ張られてるだけな気がするから
1192.0,1194.0,実際問題俺そんなに詳しくないけどさ
1194.0,1196.0,海外のなんか事情に
1196.0,1198.0,あいつらと手切ってもなんも
1198.0,1200.0,板出を受けない気がするんだけど
1200.0,1202.0,韓国はもういいよね
1202.0,1204.0,中国人コムデギャルソン来てんのうぜ
1204.0,1206.0,別にいいだろ来ても
1206.0,1208.0,別に良くない
1208.0,1210.0,早くベトナムやらフィリピンやらに
1210.0,1212.0,依存先変えないとまず
1212.0,1214.0,いやでもまだまだそっちのさ
1214.0,1216.0,2カ国は現地だよはっきり言って現地
1216.0,1218.0,現地だよ
1218.0,1220.0,あの中国
1220.0,1222.0,中国ですらそういうイメージあるな
1222.0,1224.0,まあ韓国はないけど
1224.0,1226.0,まあアジアでトップ3って言ったらやっぱ
1226.0,1228.0,日本
