start,end,text
1228.0,1230.0,韓国もあれシンガポールなんじゃないの
1230.0,1232.0,中国やっぱ格差あるでしょ
1232.0,1234.0,端っこの方でさ
1234.0,1236.0,ゴミみたいな暮らしやつ
1236.0,1238.0,インドの悪口なんて
1238.0,1240.0,まだ俺人として見えてないよインド人が
1240.0,1242.0,でもトップ
1242.0,1244.0,上位3億人は
1244.0,1246.0,すっげえいい暮らししてるんだよね
1246.0,1248.0,上位3億人は
1248.0,1250.0,すげえいい暮らししてるんだよね
1250.0,1252.0,シンガポールも格差やばいだろ
1252.0,1254.0,そうなんだやっぱ日本最強なんだよな結局のところ
1254.0,1256.0,日本最強なんだよね
1256.0,1258.0,で韓国が
1258.0,1260.0,あのー
1260.0,1262.0,日本の3分の2ぐらいでしょ
1262.0,1264.0,4分の3ぐらいか今そんなに差ない?
1264.0,1266.0,5分の4ぐらい
1266.0,1268.0,韓国人の月収16万ぐらいでしょ平均
1268.0,1270.0,ごめん上位3%
1272.0,1274.0,3分の2とか4分の3とかだよね
1274.0,1276.0,所詮言っても
1276.0,1278.0,韓国のサムスンも日本の資本がなきゃゴミだった
1278.0,1280.0,うーん
1280.0,1282.0,ちょっとその辺の詳しい事情は分からない
1282.0,1284.0,実際会社ないんだ
1284.0,1286.0,7万なの!?
1286.0,1288.0,お前ガシャガシャ言ってんじゃねえよ7万付税で
1288.0,1290.0,7万なの!?
1290.0,1292.0,今は日本も格差社会だぞ
1292.0,1294.0,お前日本の格差社会なんて
1294.0,1296.0,格差社会のうち入んねえだろ
1296.0,1298.0,入んねえよ
1298.0,1300.0,日本の格差社会なんて
1300.0,1302.0,まあどんどん近づいてきてるよね
1302.0,1304.0,だからうちらが上限マックスまで
1304.0,1306.0,一番上限マックスの
1306.0,1308.0,マックスの付近にいるからさ
1308.0,1310.0,あとは追いつかれるだけなんだよね
1310.0,1312.0,結局越されることなんかねえんだよ
1312.0,1314.0,結局
1314.0,1316.0,これ以上さ
1316.0,1318.0,大卒の就職率4割とかだぞ韓国
1318.0,1320.0,あんまりじゃあ景気は
1320.0,1322.0,良くないと
1322.0,1324.0,いう感じなんだ
1324.0,1326.0,7万うそ
1326.0,1328.0,17万156万っていうイメージがあるんだけど
1328.0,1330.0,日本は成長してないというか
1330.0,1332.0,これ以上さ
1332.0,1334.0,成長の余地なくない
1334.0,1336.0,人ってさ
1336.0,1338.0,イメージできるものは大体実現できるけどさ
1338.0,1340.0,イメージできなくない
1340.0,1342.0,日本がこれ以上さ
1342.0,1344.0,どのように成長していくのかって
1344.0,1346.0,アメリカだって何も大して成長してねえじゃん
1346.0,1348.0,何にもねえでしょ
1348.0,1350.0,ロボットとかそんなさ
1350.0,1352.0,その程度じゃない
1352.0,1354.0,短じゃん
1354.0,1356.0,飛ぶ車や
1356.0,1358.0,飛ぶ車なんてすぐできるだろうね
1358.0,1360.0,飛ぶ車なんてすぐできるよねたぶんね
1360.0,1362.0,成長分野
1362.0,1364.0,日本の海域にさ
1364.0,1366.0,なんかこれから未来
1366.0,1368.0,を担っていく自然エネルギーが
1368.0,1370.0,埋まっているんじゃないかっていうさ
1370.0,1372.0,そういうさあと運にかけるしかないよね
1372.0,1374.0,運に
1374.0,1376.0,メタンハイドレートあれどうなったの結局
1376.0,1378.0,韓国14万なの
1378.0,1380.0,メタンハイドレートどうなったの
1382.0,1384.0,メタンハイドレートは
1386.0,1388.0,どうなったの
1388.0,1390.0,結局なんか
1390.0,1392.0,わからないっていうのが結論なんじゃないの
1392.0,1394.0,メタンハイドレートに関しては
1394.0,1396.0,あれ石油の圧力でできないの
1396.0,1398.0,そうなんだ
1400.0,1402.0,まあだから打ち止めなんだよね結局ね
1402.0,1404.0,打ち止め
1404.0,1406.0,お前本読まなすぎや
1406.0,1408.0,俺ちなみに本なんか人生で読んだこと
1408.0,1410.0,2、3冊しかねえから
1410.0,1412.0,新聞も読まねえし
1412.0,1414.0,なんで最近かわいい声でわーって
1414.0,1416.0,言ってくれないの
1416.0,1418.0,そのチャンスがない
1418.0,1420.0,感じだね
1420.0,1422.0,本読んで何すんの
1422.0,1424.0,みんなは
1424.0,1426.0,本読んで何すんの
1428.0,1430.0,本読んで何すんの
1430.0,1432.0,本
1434.0,1436.0,本
1436.0,1438.0,教養絵って何すんのみんなは
1438.0,1440.0,わかった気になるまあそれはすごいいいことだね
1440.0,1442.0,暇つぶしか
1442.0,1444.0,本で暇つぶせたら
1444.0,1446.0,すごいいい暇つぶしだね
1446.0,1448.0,結局動画とかじゃなきゃ
1448.0,1450.0,暇をつぶせないから漢字が読めるようになって
1450.0,1452.0,エツに浸れるの
1454.0,1456.0,男子の方がいいよ
1456.0,1458.0,縦川男子って本出してんの
1458.0,1460.0,話題作りになるんだ
1462.0,1464.0,漫画読むのと同じだろただ面白く読むだけ
1464.0,1466.0,そうだよね結局自己満でしょ
1466.0,1468.0,結局自己満だよね
1468.0,1470.0,知識増えるじゃん面白い
1470.0,1472.0,知識だって別に増えるじゃねえかよ普通に生きてても
1472.0,1474.0,現場派なんだ俺
1474.0,1476.0,現場派
1476.0,1478.0,現場派
1478.0,1480.0,本読んでない人見下せる
1480.0,1482.0,そんなステータスじゃないでしょ本読んでる人って
1482.0,1484.0,俺の周りで本読んでて賢い奴ってワッチャンしかいない
1484.0,1486.0,あとバカばっかだよ
1486.0,1488.0,バカばっかだよ本読んでる奴とか
1488.0,1490.0,もったいねえって思いながら見てるけど
1490.0,1492.0,セックスしてた方がよっぽどいい気がする
1492.0,1494.0,現場
1494.0,1496.0,運軽が最近見てる
1496.0,1498.0,なんだろうなあ
1498.0,1500.0,あんまりしかもワッチャンは別に読んでねえからな
1500.0,1502.0,ワッチャンは別に大して読んでないからね
1502.0,1504.0,他に
1504.0,1506.0,延長してあるでしょ
1506.0,1508.0,延長してないっけ
1508.0,1510.0,暇つぶしはいいよね
1514.0,1516.0,1時間半ぐらい延長しとくか
1518.0,1520.0,ハンターハンター連載再開
1520.0,1522.0,へえ見よっかな
1522.0,1524.0,見よっかな
1524.0,1526.0,読書買ってレベルまで読んでる人は
1526.0,1528.0,大したことない
1528.0,1530.0,そこまで
1530.0,1532.0,いかないと
1532.0,1534.0,大したことないってこと
1534.0,1536.0,その域に達しないと
1536.0,1538.0,ってことでしょ
1538.0,1540.0,想像力豊かになるしな
1540.0,1542.0,漢字は確かに読める
1542.0,1544.0,漢字は読めるようになると思うよ
1544.0,1546.0,本読んでたら
1546.0,1548.0,触れる機会があるし
1548.0,1550.0,漢字は読めるようになるんだろうなと思うけど
1550.0,1552.0,年100冊はすごいね3日に1冊でしょ
1552.0,1554.0,相当なペースで読んでるでしょ
1554.0,1556.0,相当なペースで
1556.0,1558.0,読んでるよね
1558.0,1560.0,ネタの引き出しは増えるかもな
1560.0,1562.0,別関係ない
1562.0,1564.0,そのネタをいつ披露するのみんなは
1564.0,1566.0,そのネタをいつ披露するの
1566.0,1568.0,会話?なんかその知人との会話
1568.0,1570.0,そんな会話しなきゃ
1570.0,1572.0,そんな高度な会話しなきゃ楽しめないんだったら
1572.0,1574.0,やめたほうがいいんじゃない
1574.0,1576.0,家でネット見せたほうがよっぽど楽しいよ
1576.0,1578.0,しんすけのギガゾンビとか見てたほうが全然面白いと思うよ
1578.0,1580.0,知識披露しようみたいなさ
1582.0,1584.0,芸人じゃんそんなの
1584.0,1586.0,ゲームとかで漢字覚えると変わんねえよな
1588.0,1590.0,ナンパするときネタで走るんやけどいい
1590.0,1592.0,別にいいんじゃない
1592.0,1594.0,いいんじゃないの
1594.0,1596.0,だってさあれじゃん
1596.0,1598.0,そんな本読んでる人のネタなんてさ
1598.0,1600.0,本読んでる人しかわかんねえじゃん
1600.0,1602.0,俺みたいな本読んでない人にさ通用しなくない
1602.0,1604.0,わかんないよ
1604.0,1606.0,俺だって本なんてマジで読まねえからな
1606.0,1608.0,マジで読まないぞ
1608.0,1610.0,趣味だよね結局ね趣味だよな
1610.0,1612.0,俺ちなみにしんすけのギガゾンビこれからまた見るから
1612.0,1614.0,あのゴミの
1616.0,1618.0,俺でかさ今超やりたいんだけど
1618.0,1620.0,俺さセイケン伝説3をしんすけとやりたいんだけど
1622.0,1624.0,やろうよ一緒に
1624.0,1626.0,お互いゴミなんだし
1626.0,1628.0,やらない
1628.0,1630.0,やろうよバルナバと
1632.0,1634.0,しんすけもやる
1634.0,1636.0,いいじゃん俺唯一やりてえよ
1636.0,1638.0,今コラボしたい人が
1638.0,1640.0,二人いて
1640.0,1642.0,あいつ
1642.0,1644.0,カメゴロとカタツムシ
1644.0,1646.0,カブトムシを捕まえに行くか
1646.0,1648.0,しんすけと
1648.0,1650.0,セイケン伝説3をやりたい
1650.0,1652.0,やろうよ
1652.0,1654.0,やろう
1654.0,1656.0,その二つだったら俺
1658.0,1660.0,頑張ってやりたい
1660.0,1662.0,しんすけも言葉を知らせたらいいじゃん
1662.0,1664.0,言葉を取り戻す旅に出ようよ
1664.0,1666.0,言葉を取り戻す旅
1666.0,1668.0,よくない
1668.0,1670.0,よくない
1670.0,1672.0,セピアは暇そうだ
1672.0,1674.0,俺はセピアは遠くから眺めていたいんだよ
1674.0,1676.0,彼がのびのびと頑張って
1676.0,1678.0,ニコ生とかニコ動をやってる
1678.0,1680.0,姿をやっぱ
1680.0,1682.0,温かい目で見守っていたい
1682.0,1684.0,一緒にやりたいとかそういう気持ちはないんだよ
1684.0,1686.0,温かい目で彼のなんか
1686.0,1688.0,動向を見ていたい
1688.0,1690.0,そういう感じだね
1690.0,1692.0,セピアに至っては
1692.0,1694.0,お前いい加減幕末見ろよ
1694.0,1696.0,幕末志士俺見てるよ
1696.0,1698.0,奴が来るシリーズは全部見たよ
1698.0,1700.0,あれ本当に面白いじゃん
1700.0,1702.0,究極のなんか実況動画と思うけど
1702.0,1704.0,ああいう実況動画って本当にないよね
1704.0,1706.0,だって俺言ったじゃん
1706.0,1708.0,あの女の子から
1708.0,1710.0,ねねうんこちゃんまだニコニコ動画とかやってるって来て
1710.0,1712.0,やってるよなんでって返したら幕末志士の動画
1712.0,1714.0,見たことあるって
1714.0,1716.0,そういう一般的な会話に
1716.0,1718.0,で出てくるんだよ
1718.0,1720.0,幕末あのなんだっけ
1720.0,1722.0,パワープロじゃなくてさ
1722.0,1724.0,あれ上げたじゃん
1724.0,1726.0,スマブラスマブラ
1726.0,1728.0,俺LINE来たからね
1728.0,1730.0,女の子から
1730.0,1732.0,幕末志士のスマブラ見てるって
1732.0,1734.0,キヨとかツアーハズも出てくる
1734.0,1736.0,あそうなんだ
1736.0,1738.0,まあでも世代が違うからね
1738.0,1740.0,女子高生とかさ女子大生とかも
1740.0,1742.0,知り合いとかいないからさ
1742.0,1744.0,キングダムでどこが一番好き
1744.0,1746.0,もう好きなシーンありすぎてちょっと困っちゃうんだけど
1746.0,1748.0,ヒョウコウが
1748.0,1750.0,カイエンの腕一歩持っていくところ
1750.0,1752.0,腕は
1752.0,1754.0,ゴリゴリゴリゴリ
1754.0,1756.0,それが
1756.0,1758.0,モーヴが頭をパチーンって
1758.0,1760.0,モーヴがさ
1760.0,1762.0,頭をパチーンって潰すシーン
1762.0,1764.0,連合軍の
1768.0,1770.0,ファルファルファルファルって
1770.0,1772.0,でもさ名前が思い
1772.0,1774.0,あ見たいなもう一回
1774.0,1776.0,ニコニコ見てる女とか終わってる
1776.0,1778.0,そうかな
1778.0,1780.0,今別に当たり前なんじゃないの
1780.0,1782.0,今
1782.0,1784.0,当たり前じゃない
1784.0,1786.0,電車内でよく中学生が
1786.0,1788.0,キヨレトルド言ってる
1788.0,1790.0,中高生に人気ってやっぱ根強いよな
1790.0,1792.0,だってしばらく人気が続くじゃん
1792.0,1794.0,結構さ俺も昔はさ
1794.0,1796.0,中学生
1796.0,1798.0,高校生大学生に人気だったんだけど
1798.0,1800.0,最近さそいつらがずーっと
1800.0,1802.0,俺見てて年齢層上がってきちゃって
1802.0,1804.0,あのー
1804.0,1806.0,もうすぐその視聴者が引退していく
1806.0,1808.0,って時期が来てるじゃん
1808.0,1810.0,視聴者が
1810.0,1812.0,高校生仕入れなきゃダメだよね
1812.0,1814.0,高校生
1814.0,1816.0,高校生仕入れなきゃダメなんだよ
