start,end,text
0.0,1.34,マサイ 緊張してるのもう全然
1.34,3.08,マサイ 緊張してんだよ
4.42,5.7,マサイ 緊張
6.36,10.06,マサイ 向こうの顔笑って
10.620000000000001,11.84,シルク 誰がうるさいっつーのかよ
12.620000000000001,15.3,シルク でも別にさ、3人ともなんかいい顔してるよね
15.3,16.580000000000002,マサイ まぁでもほんまや
16.580000000000002,19.34,シルク 俺はね、自信ですよ
19.34,22.080000000000002,シルク やっぱね、うんこちゃんも、たかたさんもね、正直イケメンっすよ
22.080000000000002,23.84,シルク 身長も高いし、それに比べてね
23.84,26.48,シルク 俺はまぁ、青春時代もな!
26.48,29.14,シルク なかったしな!引きこもってたし!
29.14,32.14,そんな俺がなこんな俺に物が利用せんと
32.14,33.14,wwww
33.14,34.64,こういうとこ俺どうしていいか分かんない
34.64,36.14,双子くんからな
36.14,38.14,始まる、もこの あの
38.14,40.14,発作が始まっちゃうから
40.14,41.14,これがさ、公式だ、公式っていうか
41.14,43.14,そういう場だけじゃんこういう時だけ
43.14,45.14,普段放送やんないじゃん絶対
45.14,46.14,やらない方しかない
46.14,47.14,何なんだろうなあ
47.14,48.14,普段の放送見てるから
48.14,50.14,もう普段のノリでいいんですかね
50.14,51.14,普段のノリ
51.14,52.14,裏でいいよ
52.14,53.14,ブレークをやろうよ
53.14,54.14,いいといいと言っていただければ
54.14,55.14,俺はもう自信持って
55.14,57.14,普段のノリを出せるんですよ
57.14,58.14,いいですね
58.14,60.64,会員限定で俺が悪口を言ってるときのノリに
60.64,61.64,一回も言ったことないですよ
61.64,62.64,嘘つけよほんと
62.64,63.14,いやないっすよ
63.14,65.14,お前さ会員限定で何してんの?
65.14,66.14,雑談とか
66.14,67.14,俺悪口言ってんじゃん
67.14,69.14,どうせしょうもねえこと言ってんだろお前なんか
69.14,71.14,会員が犯人ですわみたいな
71.14,74.14,何言ってんの?会員限定で話すようなこと教えて俺に
74.14,76.14,まぁちょっと会社の愚痴とかでも
76.14,78.14,じゃあ俺この前聞いたこと聞いていい?
78.14,79.14,視聴者から聞いたこと
79.14,81.14,会員限定でモコが
81.14,83.14,高畑さんだけチャンネル持ってないですか?
84.14,86.14,言ってたって聞いたけど
86.14,87.14,なあ
88.14,90.14,あーまだ高畑さんチャンネル持ってないっすね
90.14,92.14,って聞いたよ俺は
92.14,94.14,あーあいつなんだと
95.14,96.14,俺この前聞いたそれ
96.14,97.14,一言も言ったことないっすよ
97.14,98.14,嘘つけ
98.14,99.14,お前ないです
99.14,102.14,おめえなめてんだろ俺ら
102.14,104.14,てめえちょっとなんか公式
104.14,105.14,なんかその企業チャンネル出てるからって
105.14,107.14,鼻高くなりやがってよ
107.14,108.14,天狗かお前
108.14,109.14,なってないっすよお前
109.14,110.14,あー
110.14,112.14,よし死ぬ
112.14,115.14,ちょまあもうお前一杯くらい今日は飲んでいこうよ
115.14,116.14,せっかくだから
116.14,117.14,二口くらい飲みました
117.14,118.14,身悪い
118.14,120.14,高畑はちょっと今日アレルギーだから
120.14,122.14,うわーしんどい
123.14,125.14,どういう状況なのその引き切れは
125.14,127.14,いやでもいいねたまには
127.14,129.14,俺たちがやっぱ2009年から
129.14,130.14,何年か6年か
130.14,131.14,6年か
131.14,133.14,6年間頑張ってきたっていう今日本当だから
133.14,134.14,確かに
134.14,136.14,こんなのなくない?本当に
136.14,137.14,いやもうないと思います
137.14,139.14,こんなのもう二度とないから本当に
139.14,143.14,多分俺もモコ先生も次回断る
144.14000000000001,145.14000000000001,いやでもやめよう
145.14000000000001,146.14000000000001,断るのやめよう
146.14000000000001,148.14000000000001,俺に寂しい思いをさせちゃいけない
148.14000000000001,150.14000000000001,交通費は全部俺が出すからこの会合は
150.14000000000001,151.14000000000001,絶対来ない
151.14000000000001,153.14000000000001,定期的に行っていこう
153.14000000000001,154.14000000000001,やりましょう
154.14000000000001,155.14000000000001,やりましょうよ
155.14000000000001,157.14000000000001,何の引き切れだよモコ先生
157.14000000000001,158.14000000000001,定期的にな
158.14000000000001,159.14000000000001,はい
159.14000000000001,160.14000000000001,よろしくお願いします
160.14000000000001,163.14000000000001,でもさこんだけさうんこちゃん上手に喋ってんのにさ
163.14000000000001,165.14000000000001,俺ら放送する前にちょっと電話したじゃん
165.14000000000001,166.14000000000001,電話してた
166.14000000000001,168.14000000000001,あの時なんかちょっと悩みそうだった
168.14000000000001,170.14000000000001,あれねちなみに隣に女いたから
170.14000000000001,171.14000000000001,マジで?
171.14000000000001,172.14000000000001,女いたから
172.14000000000001,173.14000000000001,そうなんすか?
173.14000000000001,174.14000000000001,そうなの?
174.14000000000001,176.14000000000001,女がいてなんかそのなんていうのかな
176.14000000000001,178.14000000000001,高田にちょっと電話する用事があったんだ
178.14000000000001,181.14000000000001,でその女と女のお股を触りながら
181.14000000000001,182.14000000000001,おまけだったから
182.14000000000001,183.14000000000001,バカじゃねえよ
183.14000000000001,184.14000000000001,俺島田新介義務だから
184.14000000000001,187.14000000000001,その影ではニコ生の業界トーク
187.14000000000001,190.14000000000001,こっちでは女のミノモンタみたいな気分
190.14000000000001,193.14000000000001,おい俺ってすげえだろみたいな感じで
193.14000000000001,194.14000000000001,女にアピールした
194.14000000000001,196.14000000000001,俺はこんな業界トークもできるんだぞ
196.14000000000001,199.14000000000001,俺はすげえ奴なんだぞってアピールしながら
199.14000000000001,200.14000000000001,女の股触ったら終わり
200.14000000000001,201.14000000000001,嘘でしょ
201.14000000000001,203.14000000000001,すべてを使っていくから自分の権力を
203.14000000000001,204.14000000000001,狂ってる
204.14000000000001,205.14000000000001,いや狂ってるよ
205.14000000000001,206.14000000000001,俺はすべてを使って
206.14000000000001,207.14000000000001,俺もう出し惜しみしないから
207.14000000000001,209.14000000000001,放送でもそうだからすべてを出していくから
209.14000000000001,211.14000000000001,バカじゃんほんと
211.14000000000001,212.14000000000001,高田憲章ちょっとあの
212.14000000000001,213.14000000000001,ちょっと信じられないです
213.14000000000001,215.14000000000001,でも女の目はキラキラしてたから
215.14000000000001,217.14000000000001,この人すごい人だみたいな
217.14000000000001,219.14000000000001,絶対すごくないもんね
219.14000000000001,222.14000000000001,そういうの使っていかなきゃいけねえんだよ
222.14000000000001,223.14000000000001,わかんない全然
223.14000000000001,224.14000000000001,使っていかなきゃ
224.14000000000001,225.14000000000001,うわー
225.14000000000001,226.14000000000001,ねむこちゃん熱くない?
226.14000000000001,227.14000000000001,ちょっとエアコンつけよっか
227.14000000000001,229.14000000000001,ちょっともこもと高田でつないでおいて
229.14000000000001,231.14000000000001,先生ちょっと水飲んでいいですか?
231.14000000000001,232.14000000000001,水水はいはいはい
232.14000000000001,233.14000000000001,いただきます
233.14000000000001,234.14000000000001,何の意気揚々なの?もこ先生
234.14000000000001,236.14000000000001,いや多分ちょっとお酒飲みて
236.14000000000001,239.14000000000001,もこ先生がさこの犬
239.14000000000001,241.14000000000001,膝を置いたらどうなるかちょっと試してよ
241.14000000000001,242.14000000000001,試しましょう今日は
242.14000000000001,243.14000000000001,ちょっと自分で
243.14000000000001,246.14000000000001,高田でほんとに懐いてんだようちの犬
246.14000000000001,247.14000000000001,マジで懐いてんの
247.14000000000001,248.14000000000001,そらちゃん
248.14000000000001,250.14000000000001,放送上のキャラとかじゃなくて
250.14000000000001,251.14000000000001,そらちゃん来てみ
251.14000000000001,252.14000000000001,そらちゃんそらちゃん
252.14000000000001,253.14000000000001,あーあー
253.14000000000001,255.14000000000001,めっちゃブルブルしてる
256.14,259.14,一目さに逃げてんじゃねーかよ
259.14,260.14,かわいそうにな
260.14,261.14,もこくさいからね
261.14,262.14,ちょっとこっち向いて
262.14,263.14,うんこくさいからもこはね
263.14,265.14,もこほんとに臭いから
265.14,267.14,だからしょうがないんだよね
268.14,269.14,かわいいわー
269.14,271.14,そらちゃんそらちゃん
271.14,273.14,熱くならないのちょっと着てみる?
273.14,275.14,最悪
275.14,276.14,唯一だからね
276.14,279.14,俺ちなみにうちの犬が吠えるのお前だけだから
279.14,280.14,どんな人が来ても
280.14,281.14,キャンキャンみたいな感じで寄ってくるの
281.14,283.14,お前だけクソ吠えてたから
283.14,284.14,噛みつく
284.14,285.14,この前めっちゃ吠えてたよね
285.14,286.14,お前なんでや
286.14,287.14,なんかやっぱあるんじゃない
287.14,288.14,潜在的に
288.14,290.14,お前なんか悪人だから
290.14,291.14,悪人って何が
291.14,293.14,性格の良し悪しよ
293.14,294.14,動物とか
294.14,296.14,そんな性格悪いのないのに
296.14,298.14,高田はやっぱ16号的なね
298.14,299.14,良さがあるから
299.14,300.14,16号
300.14,301.14,お前知らねーのドラゴンボール
301.14,302.14,ドラゴンボール知らない
302.14,303.14,高田やっぱほら
303.14,305.14,好きなんだよこいつ膝の上が
305.14,307.14,高田にすぐ寄ってくんだよ
307.14,309.14,そらちゃんちょっと俺にも
309.14,311.14,いやでも確かになんかね
311.14,312.14,動物懐かれないんですよね
312.14,313.14,なんでや
313.14,314.14,お前がだからそうやってあれだよ
314.14,316.14,心開いてねーからだよ
316.14,318.14,そらちゃんちょっと着てみ
318.14,320.14,それ最近わかんねーの
320.14,321.14,ねえあとさ
321.14,322.14,お前さ俺さ
322.14,324.14,お前のなんかギャンブーみたいと思ったんだけど
324.14,325.14,お前髪切ったほうがいい絶対
325.14,327.14,爽やかになったほうがいいよ
327.14,328.14,切りました
328.14,329.14,切っとけーの
329.14,330.14,あれから
330.14,331.14,違う違う
331.14,332.14,こいつちょっと色気づいてる
332.14,333.14,色気づいて
333.14,335.14,なんか挑発になってるお前
335.14,336.14,お前初めて会った時
336.14,337.14,クソ小坊主みたいな
337.14,339.14,どんぐりみたいな髪型してたじゃねーかよお前
339.14,340.14,何だよ結構長かった
341.14,342.14,どんぐりみたいな髪型してたよ
342.14,344.14,なんか頭ちょいみたいな
344.14,345.14,いやそんな感じじゃなかったよ
345.14,346.14,こいつなんか女にちょっとモテるから
346.14,347.14,モテ始めたからって
347.14,349.14,なんか襟足とかちょっと伸ばしてさ
349.14,351.14,違う違う違う
351.14,352.14,髪の毛ほんま切りすぎる
352.14,353.14,小学生みたいになっちゃうんすよ
353.14,354.14,いやいいじゃん
354.14,355.14,それが怖くてちょっと今回も
355.14,357.14,長さは切れなかったんですけど
357.14,359.14,でもだいぶ髪の毛量は切らせましたよこれ
359.14,360.14,どこでお前切ってんの髪の毛
360.14,361.14,教えて
361.14,362.14,なんか普通のよくわからん病院で
362.14,363.14,病院で切ってんの
363.14,364.14,お前床屋じゃねーの
364.14,365.14,いや違う病院の中にある床屋みたいな
365.14,367.14,病院と床屋タイプ選べて
367.14,369.14,床屋の方で切りました
369.14,371.14,眉毛切ってもらって
371.14,373.14,顔も切ってもらって
373.14,375.14,髪の毛はちょっと短く長すぎないように
375.14,377.14,切ってもらいました
377.14,378.14,結構気に入ってますねこれ
378.14,380.14,なんかさこんな風にさ顔出ししてさ
380.14,382.14,3人が配信するってすごい新鮮じゃない
382.14,383.14,確かに
383.14,384.14,ないよね
384.14,386.14,でもこんな日が訪れる
386.14,389.14,まさか俺もこんな日が訪れるとは思わなかった
389.14,391.14,ふっこちゃんが顔出しちゃったからね
391.14,392.14,まあそうだね
392.14,394.14,俺でも最近だからもう凛としてるから
395.14,397.14,お母さんに言いましたから俺
397.14,398.14,お母さん
398.14,400.14,俺ちなみにニコ生でチャンピオンになれば
400.14,402.14,それ何時言われたの
402.14,404.14,分かったじゅんいちゃんあなたがチャンピオンになれば
404.14,406.14,やっぱり理解があるから
406.14,408.14,うちのお母さんね仕事もできるし
408.14,410.14,頭もいいし見た目もきれいなので
410.14,413.14,唯一できないのが子育てだけできないの
413.14,415.14,子育て以外は全部できるんだけど
415.14,417.14,自分で自覚してたから
417.14,419.14,私ができないのは子育てだけだから
419.14,421.14,その結果が俺みたいなものになって
421.14,422.14,現れちゃったんだけど
422.14,423.14,唯一だけだよ
423.14,425.14,それだけできない後は全部できるから
425.14,426.14,うちのお母さんは
426.14,428.14,放送ホームページとかやってるの知ってんの?
428.14,429.14,見してよこうやって
429.14,431.14,LINEでLINE通話して
431.14,433.14,こうやって放送してるよって
433.14,434.14,お前見してないの
434.14,436.14,俺何してるかもしんないよ親
436.14,438.14,じゃあ今出前してみなよ
438.14,440.14,無理だよこんな時間に操作
440.14,441.14,言ってほしいです
441.14,442.14,僕も親に言ってるんですよ
442.14,444.14,あそうなんだお前何してんの
444.14,445.14,僕はイベントとかコミュニケーション
445.14,447.14,親に来てもらうくらいに
447.14,448.14,マジで?
448.14,449.14,はい
449.14,451.14,お前の親は何してんの
451.14,453.14,お母さんがなんか泣いてたんですよ
453.14,455.14,あ僕がこんなに大きくなってる
455.14,457.14,昔を知ってるだけに
457.14,458.14,昔はどんなのだったのお前は
458.14,460.14,昔はもう家でこうやって
460.14,461.14,あの
462.14,463.14,女にしてた
463.14,465.14,女にもしてましたし
465.14,466.14,あとお前なんかさ
466.14,467.14,あれらしいじゃん
467.14,469.14,なんかさオナホールみたいなの買って
469.14,470.14,できそうなんだ
473.14,474.14,なんか変だね
474.14,475.14,オナホールじゃなくて
476.14,477.14,なんだっけ
477.14,478.14,なんだっけ
478.14,480.14,なんとかピローみたいなの買って
480.14,481.14,それでクソいじられた
481.14,482.14,え何それ
482.14,483.14,どこだ
483.14,484.14,あのなんだっけ
484.14,485.14,オナホールじゃなくて
485.14,486.14,なんていう系あるの
486.14,487.14,あの抱き枕
487.14,488.14,抱き枕
488.14,489.14,オナニーができる抱き枕を
489.14,490.14,そんなのあんの
490.14,491.14,買ったのが
491.14,493.14,しかも自分で言ったんじゃなくて
493.14,495.14,リモってバレたみたいな
496.14,497.14,お前あれじゃねえか
497.14,498.14,てめえ性獣じゃねえか
498.14,500.14,俺なんか普通にオナニーしかしてない
500.14,501.14,てめえなんかそんなさ
501.14,502.14,なんていうの
502.14,503.14,ダッチワイフみたいな
503.14,504.14,こうやってこいつ
504.14,505.14,一人でコソコソオナニーしてんだよ
505.14,506.14,気持ち悪いだろ
506.14,507.14,だから女の視聴者
507.14,508.14,マジやめたほうがいいよ
508.14,509.14,でも性獣だよマジで
509.14,510.14,剥除しました
510.14,511.14,あれはあの
511.14,512.14,2000円くらいで買えた
512.14,513.14,ほら
513.14,514.14,そんな安いんじゃんそういうの
514.14,515.14,エンジョイしてるエンジョイしてる
515.14,516.14,オナホールは
516.14,517.14,そこの膨らまして
517.14,518.14,ポカッと入れるんですよ
518.14,519.14,なんで
519.14,520.14,お前もなんか人並みに
520.14,521.14,性欲あるもん
521.14,522.14,気持ち悪い
522.14,523.14,いやそれは性欲がもちろん
523.14,524.14,人並みにいるってこと
524.14,525.14,視聴者と出会ったりしないの
525.14,526.14,いやそうじゃないですよもちろん
526.14,527.14,でも
527.14,528.14,怖いじゃないですか
528.14,529.14,僕はもうやっぱりね
529.14,530.14,やっぱあの
530.14,531.14,女性っていうのを
531.14,532.14,怖いっていうのを
532.14,533.14,ちょっと学ばさせていただきましたので
533.14,534.14,例えば誰から学んだの
535.14,536.14,いろいろと学ばさせていただきました
536.14,537.14,いやいや別にいいよ
537.14,538.14,今日はタイムシュート消すから
538.14,539.14,大丈夫言って
539.14,540.14,誰かの
540.14,541.14,前の
541.14,542.14,前の付き合ってたことあるよって
542.14,543.14,お助けでもちょっと
543.14,544.14,え?
544.14,545.14,付き合ってたこと
545.14,546.14,なんて?
546.14,547.14,付き合ってたことがあってね
547.14,549.14,付き合ってたことが多いって
549.14,550.14,やっぱ怖いなと
550.14,551.14,その話していいの俺
551.14,552.14,え?
552.14,553.14,モコーから来たそうな話
553.14,554.14,別に良くない?
554.14,555.14,別にいいっすよもう
555.14,556.14,なんか違う
556.14,557.14,何俺
557.14,558.14,知らない
558.14,559.14,モコーがイベントに出た時に
559.14,560.14,なんかその
560.14,562.14,彼女が乗り込んできたみたいな
563.14,565.14,楽屋に乗り込んできたわ
565.14,567.14,楽屋に乗り込んできたんだよね
567.14,569.14,でこいつそういう時から
569.14,570.14,もうあれなんだ
570.14,571.14,芸能人気取りだから
571.14,573.14,いやーうちの女が迷惑かけた
573.14,574.14,俺マジでそんな
574.14,575.14,クソ気取り
575.14,576.14,てめえ兄芸能人気取りしてんだよ
576.14,577.14,みたいな
577.14,578.14,俺てめえそれ
578.14,579.14,絶対放送でバラすかんなって
579.14,581.14,そんな感じになりたかった
581.14,582.14,そうなんだよね
582.14,583.14,芸能人気取りしてんだよ
583.14,584.14,うちの女がやらかしちまったんですわ
584.14,585.14,みたいな
585.14,586.14,クソ長い
586.14,588.14,クソ長生きでしょ
588.14,589.14,そんな俺も聞きれないじゃん
589.14,590.14,放送で
590.14,591.14,絶対てめえいつか
591.14,592.14,バラしてやるかんなって
592.14,594.14,俺そんな感じになれなかったよ
594.14,595.14,だから
595.14,596.14,あの頃のバカやめようって
596.14,598.14,じゃあちょっと一曲
598.14,599.14,歌っていいですか
599.14,600.14,よかったじゃあお前が歌って
600.14,602.14,千の風になって歌えなよ
602.14,603.14,千の風
603.14,604.14,キャバクラでクソ滑った
604.14,606.14,千の風になって歌えなよ
606.14,607.14,千の風
607.14,608.14,もうお前やめましょう
608.14,610.14,あれやばかったよな
610.14,611.14,すいませんもうやめましょう
611.14,613.14,もこほ先生俺聞いたこと言っていい?
613.14,614.14,はい
614.14,616.14,なんかもこほ先生の
616.14,618.14,チャンネル会員だったんだけど
618.14,620.14,えお前チャンネル会員だったの?
620.14,621.14,違う違う違う
621.14,622.14,その視聴者が
622.14,623.14,チャンネル会員だったんだけど
623.14,624.14,ちょっともうほんとに
624.14,625.14,嫌になったって言って
625.14,626.14,辞めた人からもこほ先生の
626.14,627.14,リークバランスが
627.14,628.14,ブワーって来たの一回
628.14,629.14,全部言っていいよ
629.14,630.14,俺がやるっすから
630.14,631.14,なんかね
631.14,632.14,イベント大阪で
632.14,633.14,イベントやった時に
633.14,634.14,なんかその人は
634.14,635.14,現地にいたらしいんだけど
635.14,636.14,全部よ
636.14,637.14,女性のお客さんに
637.14,638.14,ハグをされて
638.14,639.14,顔をすりすりされて
639.14,640.14,あそれなんか
640.14,641.14,炎上一回
641.14,642.14,だから炎上
642.14,643.14,炎上ってなんか
643.14,644.14,放送で荒れたんすけど
644.14,645.14,それ全くの無実です
645.14,646.14,いややってるよ
646.14,647.14,だってこいつなんか女の
647.14,648.14,なんかその
648.14,649.14,視聴者の人妻の
649.14,650.14,母乳飲んでるって言ってたもん
650.14,651.14,俺
651.14,652.14,俺知りねえやん
652.14,653.14,えそれも視聴者の人妻?
653.14,654.14,視聴者の人妻
654.14,656.14,この前だからその
656.14,657.14,未成年の女とセックスして
657.14,658.14,卸したって言ってたやつ
658.14,659.14,お前最低だ
659.14,660.14,俺だから
660.14,661.14,違う俺は
661.14,662.14,先輩として
662.14,663.14,いや話止めすなよ
663.14,664.14,先輩として
664.14,665.14,先輩なんて一旦
665.14,666.14,飛ばしどころじゃない
666.14,667.14,話止めすなやつ
667.14,668.14,先輩として
668.14,669.14,そういうのよくねえよって
669.14,670.14,俺が社会を
670.14,671.14,教えていかなきゃいけないから
671.14,672.14,お前に
672.14,673.14,俺やっぱ後輩大事だから
674.14,676.14,いや俺あれの動画のせいで
676.14,677.14,マジで俺細振りになった
677.14,678.14,って思われてるやつからね
678.14,679.14,いやでも大丈夫
679.14,680.14,いやすごいよほんと
680.14,681.14,影響力あんこちゃんね
681.14,682.14,あの誰か
682.14,683.14,あの誰か
683.14,684.14,切り取り抜けとるから
684.14,685.14,俺そういうキャラって
685.14,686.14,すいません
686.14,687.14,俺ちなみに言っとくけど
687.14,688.14,俺2チャンネルの随所で
688.14,689.14,陣営してるから
689.14,690.14,いやあれマジだよ
690.14,691.14,みたいな感じで
691.14,692.14,俺マジで
692.14,693.14,お前の視聴者削ることに
693.14,694.14,命かいてるから
694.14,695.14,俺お前が女にモテてるの
695.14,696.14,気に食わねえから
696.14,697.14,モテねえから
697.14,698.14,俺お前の視聴者
698.14,699.14,マジほんと削ってくから
699.14,700.14,お前が女にモテてるの
700.14,701.14,マジ気に食わねえから
701.14,702.14,マジで削ってくから
702.14,703.14,俺ガチで言ってるからね
703.14,704.14,さっきもちなみに
704.14,705.14,30分言ってたから
705.14,706.14,お前の悪いこと
706.14,707.14,いやあいつマジくせえし
707.14,708.14,最悪だよって
708.14,709.14,女にも超手出してる
709.14,710.14,おかしい
710.14,711.14,おかしい
711.14,712.14,いや俺マジで随所に
712.14,713.14,俺だから2チャンネルの
713.14,714.14,まとめサイトとかで
714.14,715.14,なんかVIPのスレみたいな
715.14,716.14,モコって好きだよな
716.14,717.14,みたいな
717.14,718.14,あの
718.14,719.14,なんていうの
719.14,720.14,コメントがあったら
720.14,721.14,全部否定するから
721.14,722.14,いやあいつマジゴミだよって
722.14,723.14,全て俺アンテナ張ってるから
723.14,724.14,お前絶対人気もさせねえから
724.14,725.14,俺が
725.14,726.14,絶対それは
726.14,727.14,もう約束するよ
727.14,728.14,お前に
728.14,729.14,男と男の約束だな
729.14,730.14,絶対に許さないから
730.14,731.14,勘弁してください
732.14,733.14,モコが女にモテることだけは
733.14,734.14,許さないから
734.14,735.14,別にモテるんじゃないですけど
735.14,737.14,例えば大阪のイベントで
737.14,738.14,なんかそういう騒ぎになったら
738.14,739.14,ホンマで
739.14,740.14,あれは別になんか
740.14,741.14,プレゼントをね
741.14,742.14,なんか差し出をもらう時に
742.14,743.14,何もらったの
743.14,744.14,何もらったの
744.14,745.14,なんか
745.14,746.14,パンツとか
746.14,747.14,パンツもらったの
747.14,748.14,パンツとか
748.14,749.14,どんなパンツもらったの
749.14,750.14,じゃあそのパンツ見せてみてよ
750.14,751.14,いや別に履いてない
752.14,754.14,可愛いパンツ履いてる
754.14,755.14,じゃあもう今だから言いますよ
755.14,756.14,今ね
756.14,757.14,トランクスね
757.14,758.14,裏表反対に着てます
759.14,760.14,お前トランクス派なんだ
