start,end,text
1478.14,1480.14,自分が自分でなくなっちゃうから
1480.14,1481.14,それは確かに
1481.14,1482.14,だからお前だってそうだ
1482.14,1483.14,高谷だってそうだと思うけど
1483.14,1486.14,やっぱりそこありきの我々じゃん
1486.14,1487.14,だからお前だって本当に大事にしてると
1487.14,1488.14,俺は思ってるもん
1488.14,1489.14,ありがとうございます
1489.14,1490.14,その通りです
1490.14,1492.14,だから高谷だってさ最近すごい頑張ってんじゃん
1492.14,1494.14,だからそれは本当に大事にしていかなきゃいけない
1494.14,1496.14,これ別にただ視聴者に声を言ってるわけじゃなくて
1496.14,1500.14,でもさなんかその企業を含めたさグループラインで
1500.14,1501.14,うん
1501.14,1502.14,うんこちゃんで俺笑ったのが
1502.14,1505.14,分かりました了解です高谷が頑張ります
1505.14,1507.14,なんか向こうから要望が来て
1507.14,1508.14,じゃあ俺はだってその
1508.14,1511.14,ありがとうございますよろしくお願いします高谷に任せてください
1511.14,1512.14,違う違う
1513.14,1514.14,聞いてみんな
1514.14,1516.14,こいつすげえ
1516.14,1518.14,生放送っていうかその
1518.14,1521.14,マネージメントが上手いの本当に
1521.14,1522.14,マネージメントがクソ上手いの
1522.14,1525.14,高谷俺さお前と一緒に公式で出たいんだよって言ったら
1525.14,1526.14,二日で撮ってきたからね
1526.14,1527.14,二日で撮った
1527.14,1528.14,二日で
1528.14,1530.14,いや二日だよお前はずっと撮れたから別に
1530.14,1531.14,あそんな
1531.14,1535.14,もう本当にお前と二人でやっていきたいっていう話をしたのね
1535.14,1536.14,この8月になる前に
1536.14,1537.14,なる前にしたね
1537.14,1541.14,そのやっぱ一番面白い公式放送に出ていきたいってなった時に
1541.14,1545.14,やっぱりさ既存の公式放送ってやっぱ綺麗な感じで
1545.14,1546.14,やっぱありきたりじゃん
1546.14,1548.14,で自分の視聴者とかお前の視聴者もそうだけど
1548.14,1551.14,そういうのってさやっぱりさ求められてるものが違うじゃん
1551.14,1552.14,自分の色出していきたいじゃん
1552.14,1555.14,ってなった時にやっぱ自分のパートナーって誰だろうと思ったら高谷だったのね
1555.14,1556.14,で
1556.14,1558.14,びっくりした俺電話かけて
1558.14,1559.14,相談したの高谷の
1559.14,1561.14,俺お前と一緒に公式でたいんだけどって言ったら
1561.14,1563.14,二日で撮ってきたからね
1563.14,1565.14,でもうそのもうできてたの
1565.14,1566.14,そのあれが
1566.14,1567.14,ページ画ですか
1567.14,1570.14,ページ画っていうかもう基盤ができてた
1570.14,1572.14,俺も何もしないけどね
1572.14,1574.14,いやモコは呼ばないよ
1574.14,1577.14,モコが人気になるの気に食わねえから
1577.14,1580.14,俺こいつが女にモテるのマジ気に食わねえから
1581.14,1582.14,いやそうだよ
1582.14,1584.14,だからモコの有料放送見てるやつとか本当に
1584.14,1585.14,もう考え直したほうがいいよ
1585.14,1586.14,俺のこと見に行ったほうがいいよ
1586.14,1589.14,もう確実にそれは女視聴者は全部俺がもらってくから
1589.14,1591.14,一応ゲーム会社からこうね
1591.14,1592.14,ちゃんとやるから
1592.14,1593.14,ちゃんとやってく
1593.14,1595.14,だからモコ先生みたいな感じじゃないから
1595.14,1598.14,でもね俺ね一個ね視聴者にやっぱね申し訳ないなと思うの
1598.14,1599.14,やっぱりさ言えないこととかも出てくるじゃん
1599.14,1601.14,俺と高谷のさ売りっていうのはさ
1601.14,1603.14,やりたい放題やったじゃん
1603.14,1606.14,あのね高谷もやっぱM3000本みたいな
1606.14,1608.14,それそこまでだよ
1608.14,1609.14,目標やべえよ
1609.14,1611.14,しかもこれガチのテンションで
1611.14,1613.14,うんこちゃんそれは言っちゃいけない
1613.14,1617.14,だってさモコ先生のさ14歳のやつもやばい
1617.14,1619.14,それは言っちゃいけないうんこちゃん
1619.14,1623.14,でも俺に放送で言えないこと言っちゃいけないの
1623.14,1626.14,俺はもうさゲームできねえんだよあれのせいで
1626.14,1628.14,何にもできない
1628.14,1630.14,国会図書館だ国会図書館
1630.14,1632.14,もうさコメントがそればっかだからさ
1632.14,1634.14,国会図書館だからうちの
1634.14,1635.14,もう見とくせえよ
1635.14,1638.14,だから俺に放送で言えないことは言わないでほしい
1638.14,1640.14,だから俺的に
1640.14,1642.14,言うも何もまず何も言ってない
1642.14,1644.14,勝手に作るんじゃん
1644.14,1646.14,放送で言えないことは絶対言わないで
1646.14,1647.14,混輪剤
1647.14,1649.14,だから例えばお前がね
1649.14,1651.14,万が一生主と付き合ったとするじゃん
1651.14,1652.14,お前だったらそういうことや
1652.14,1654.14,モコでもいいことは
1654.14,1656.14,本当に女に対してクリーンなの
1656.14,1657.14,こいつ本当にね
1657.14,1658.14,この前だってさ
1658.14,1660.14,お前2人で会った時にさ
1660.14,1662.14,女とかと絡みないのみたいなこと言ったら
1662.14,1664.14,視聴者を裏切ることになるんで
1664.14,1665.14,そういうことは絶対できませんって
1665.14,1666.14,本当に言ったの
1666.14,1667.14,本当なさそうだよね
1667.14,1668.14,高田もないの
1668.14,1669.14,俺もないじゃん
1669.14,1672.14,この放送に対する姿勢みたいなのはやっぱり
1672.14,1673.14,本当に嘘じゃないよ
1673.14,1675.14,放送に対する姿勢みたいなのはやっぱり
1675.14,1676.14,共通点があるんだよ
1676.14,1679.14,そういうのはやっぱり俺もいいなと思って
1679.14,1680.14,応援したいんだよ
1680.14,1681.14,だからそういう
1681.14,1683.14,もし万が一お前が生主とかと出会って
1683.14,1684.14,付き合うことになっても
1684.14,1685.14,俺には言わないで
1685.14,1687.14,俺に言ったら100%放送に対するから
1687.14,1689.14,モコあれリオールムと付き合ってる
1689.14,1690.14,何でお前が
1690.14,1692.14,最近燃やしたゴミ女の名前を
1692.14,1693.14,あれ何なの
1693.14,1694.14,知らない
1694.14,1695.14,俺は言うよ
1695.14,1696.14,リメルンですか
1696.14,1697.14,リメルン
1697.14,1698.14,知らないっす俺は
1698.14,1699.14,知らないっすじゃねえよ
1699.14,1700.14,お前がなんかできへんなこと言って燃やしたんだろ
1700.14,1701.14,ツイッターでフォローされて
1701.14,1702.14,それに触れただけで
1702.14,1704.14,なんか勝手に辞めただけですよ
1704.14,1705.14,知らないっす俺は
1705.14,1706.14,俺も知らないっす
1706.14,1708.14,俺ちなみにその件で
1708.14,1710.14,お前の大百科でクソ荒らしてたから
1710.14,1711.14,いやモコマジ最低だな
1711.14,1713.14,うんこちゃんとかのほうが全然いいわ
1713.14,1715.14,ちなみにほんと4年寝かない
1715.14,1717.14,俺手加減しないからなはっきり言って
1717.14,1718.14,公式に出てくると
1718.14,1720.14,お前の視聴者もガッツリ食ってくるから
1720.14,1722.14,俺お前の大百科荒らしてたのは
1722.14,1723.14,主に俺だからね
1723.14,1724.14,副技作って
1724.14,1726.14,あいやうんこちゃんのほうがいいわって
1726.14,1727.14,うんこちゃんのほうがいいなって
1727.14,1728.14,俺そういう4年ないよ
1728.14,1730.14,俺手加減しないからそういうのは
1730.14,1731.14,いいから後輩だ
1731.14,1733.14,大切な後輩だってのはあるけど
1733.14,1734.14,俺手加減はしないから
1735.14,1737.14,やっぱそれ高め合う存在で
1737.14,1738.14,高め合う
1739.14,1740.14,高め合うってどうやって作ったの
1740.14,1741.14,いや高め合ってるじゃんすごい
1741.14,1743.14,相乗効果じゃん
1743.14,1744.14,相乗効果
1744.14,1745.14,でもなんかその話聞いて
1745.14,1746.14,俺もちょっと負けられないなって思い出した
1746.14,1747.14,だからそういう風にやってこいよ
1747.14,1748.14,俺たち仲良しグループじゃなくて
1748.14,1749.14,やっぱりそういう風に高め合っていく
1749.14,1750.14,ライバル
1750.14,1751.14,ライバルライバル
1751.14,1753.14,ライバル意識はやっぱ常に持ってます僕は
1753.14,1754.14,スタイルに対して
1754.14,1756.14,そういう感じでいこう
1756.14,1758.14,でもなんか困った時は
1758.14,1759.14,お互い共有し合うと
1759.14,1761.14,だってうちらなんかもう
1761.14,1762.14,差し込むじゃん
1762.14,1763.14,まあ確かに
1763.14,1765.14,お前も子供の公式になんか呼ばれねえだろ
1765.14,1766.14,呼ばれないです
1766.14,1767.14,呼ばれねえでしょ
1767.14,1768.14,企業とかの報道じゃん
1768.14,1769.14,だから高田も
1769.14,1770.14,ちなみにね
1770.14,1773.14,あの企業チャンネルから声がかかった時に
1773.14,1774.14,いや高田と一緒に出たいんですけど
1774.14,1775.14,あ、高田さんおめでとう
1775.14,1776.14,高田さんおめでとう
1777.14,1779.14,最悪じゃねえかよ
1779.14,1780.14,もうすぐ食い気味で
1780.14,1781.14,あ、高田もって言うたら
1781.14,1782.14,高田さんおめでとうって
1782.14,1783.14,もうすぐ言われた
1783.14,1784.14,最悪じゃねえかよ
1784.14,1785.14,俺逆なんだろに
1785.14,1786.14,高田さんおめでとう
1786.14,1787.14,ダメですって
1787.14,1788.14,もうすぐ言われたから
1788.14,1789.14,最悪じゃねえかよ
1789.14,1790.14,やっぱりでもそういう
1790.14,1791.14,でもそれが面白い
1791.14,1793.14,どこの企業だよそいつは
1793.14,1794.14,それが面白いんだって
1794.14,1797.14,そういうのをやっぱ話せるエピソードとして
1797.14,1798.14,1個持ってるっていうのは
1798.14,1799.14,最悪だわほんと
1799.14,1800.14,強いっていうか
1800.14,1801.14,え、なんかやったんすか高田さん
1801.14,1803.14,いや高田なんかもうしでかしてんじゃん
1803.14,1804.14,でもやっぱりね
1805.14,1806.14,お前しでかしてる
1806.14,1807.14,俺しでかしてねえよ
1807.14,1809.14,あ、俺もうちょっと燃えてきたわ
1809.14,1811.14,なんもしでかしてない俺は
1811.14,1813.14,そういう俺たちみたいなゴミが
1813.14,1814.14,いやゴミじゃない
1814.14,1815.14,求めない
1815.14,1817.14,俺たちみたいな半端者が
1817.14,1818.14,公式に出ていこうっていう
1818.14,1819.14,その意気込みをやっぱ
1819.14,1820.14,あーそうだね
1820.14,1821.14,じゃあ俺ね
1821.14,1823.14,ここだけの話言うけど
1823.14,1824.14,高田もね
1824.14,1826.14,なんかゼニゲーマンみたいな感じで
1826.14,1827.14,言われてるけど
1827.14,1828.14,俺がほんとに相談したの
1828.14,1830.14,いやけんちゃん俺たちの
1830.14,1831.14,あのなんだっけ
1831.14,1832.14,あの
1832.14,1834.14,確かに会員数稼げないし
1834.14,1836.14,俺の視聴者が会員にならないし
1836.14,1837.14,あー
1837.14,1838.14,そのなんていうの
1838.14,1839.14,俺たちの
1839.14,1840.14,全然覚えてない
1840.14,1842.14,そのチャンネルになったとしても
1842.14,1843.14,はいはい
1843.14,1845.14,うちらの手元に入るお金は
1845.14,1846.14,ほんとに少ないよと
1846.14,1847.14,あー
1847.14,1848.14,でも
1848.14,1849.14,でも俺はニコ生で
1849.14,1851.14,企業チャンネルで一番になりたいと
1851.14,1852.14,言ったときに
1852.14,1853.14,全然ええよって
1853.14,1854.14,え、だって面白いじゃん
1854.14,1855.14,そう
1855.14,1856.14,全然そんなのお金なんか
1856.14,1857.14,どうでもええよって
1857.14,1858.14,言ったんだよ高田は
1858.14,1859.14,もうだから
1859.14,1860.14,もうすぐだよ
1860.14,1861.14,即決だよ
1861.14,1862.14,じゃあほんとにだから
1862.14,1863.14,だから僕はもうなんだかんだで
1863.14,1864.14,お前もさめっちゃ
1864.14,1865.14,ほんとに金
1865.14,1866.14,ゼニーバンみたいなこと
1866.14,1867.14,言われてるけど
1867.14,1868.14,本質的にはそういうさ
1868.14,1869.14,楽しい放送したりとか
1869.14,1870.14,あるじゃん
1870.14,1871.14,ありますもちろん
1871.14,1872.14,全然あるでしょ
1872.14,1873.14,俺は会員ゲートやらなすぎて
1873.14,1874.14,ちょっともう
1874.14,1875.14,ちょっと今会員
1875.14,1876.14,掲示板あれ
1876.14,1877.14,そういうしがらみがあるけど
1877.14,1878.14,ほんとに言ったからね
1878.14,1879.14,別にうんこちゃんが
1879.14,1880.14,無料でやりたいになったら
1880.14,1881.14,分かってるよそれは
1881.14,1882.14,全然ええよって
1882.14,1883.14,高田も言ったから
1883.14,1884.14,だから俺も
1884.14,1885.14,その
1885.14,1886.14,ドワンゴさんと
1886.14,1887.14,そのね
1887.14,1888.14,いろいろあるときに
1888.14,1889.14,あー
1889.14,1890.14,だから有料で
1890.14,1891.14,無料でやらせて
1891.14,1892.14,ドワンゴさんだよ
1892.14,1893.14,もうドワンゴさんだよ
1893.14,1894.14,無料でやらせてくださいって
1894.14,1895.14,話をしたんだよ
1895.14,1896.14,ドワンゴさんが我々のチャンネルに
1896.14,1897.14,すごい行き込んでるらしい
1897.14,1898.14,そうだから
1898.14,1899.14,だから
1899.14,1900.14,だから
1900.14,1901.14,だから
1901.14,1902.14,だから
1902.14,1903.14,だから
1903.14,1904.14,だから
1904.14,1905.14,だから
1905.14,1906.14,だから
1906.14,1907.14,だから
1907.14,1908.14,だから
1908.14,1909.14,だから
1909.14,1910.14,だから
1910.14,1911.14,だから
1911.14,1912.14,だから
1912.14,1913.14,だから
1913.14,1914.14,だから
1914.14,1915.14,だから
1915.14,1916.14,だから
1916.14,1917.14,だから
1917.14,1918.14,だから
1918.14,1919.14,だから
1919.14,1920.14,だから
