start,end,text
1247.98,1251.46,入るとしたら俺学会かなぁ
1251.7,1260.5800000000002,よろしくみんなも即幹部候補6万人入れたら即幹部なのだ 6万人も入るくっ二度と来るんじゃねーよ
1260.58,1267.86,アドバンティフォン所があれってさあの実際問題 その創価学会のアレで配っての
1267.86,1276.34,気持ち悪いんだよ見たくてないですよねクラチュン オウムはダメなんで人殺ししたから物騒
1276.34,1283.1799999999998,物騒だから嫌い二度と来るんじゃねーよ あれみんなもおすすめだから見てなぁ
1283.1799999999998,1290.54,みんなもおすすめだから延長しとくでも今日疲れちゃったな俺さすがに 今日のジュンちゃんお疲れモンなんだよね
1290.86,1298.5,あと1回ぐらいしとく まあ俺が話してない話題があるのであるならば
1299.86,1302.74,考えないことも
1303.1399999999999,1306.22,ない あと10分か
1306.22,1313.3799999999999,でもあと10分となるとタバコを1本吸わなければ やってられないと
1314.86,1318.6599999999999,いいやないですねユーザー保存が別に
1319.66,1325.46,気ぃ抜いた外部的な 外部的な相撲ならしていい
1325.46,1334.0600000000002,相撲さあ今年だが10年ぶりに土地あずまだっけ 土地あずま10年前に優勝したぜ俺いつ切れてんだ情報がなんか
1334.0600000000002,1344.98,10年ぶりにあこと消極10年あいつゴミだよな顔ゴミだけど くっそいいよなあいつああいうゴミがもっと増えなきゃいけないよな
1344.98,1354.94,本当に10年ぶりに日本人の力士が優勝するかもしれないって言われてんじゃ なんか寂しいよね国技なのにさ
1354.94,1366.58,モンゴルとかさブラジルやねハワイは不当出身2番部屋とかさ そういう外人に制約外国人に制圧されているのはやっぱ悲しいね
1366.86,1374.8999999999999,春間藤とったの なんだっけ白方が多分いっぱいで追ってるけど今年は今回だけは絶対こと衝撃に優勝
1374.8999999999999,1382.8999999999999,し優勝してほしいですね 私は相撲も嫌いではないので病院流れてるさあ5時半ぐらいに何かね
1382.8999999999999,1391.54,あのちょっと余裕がある申し送りみたいな時間があるんだけど次の人にね 野球隊に申し送りみたいな時間でテレビついてることがあるんだよ
1391.54,1397.62,テレビ そこでなんかちょうど相撲をやってたりしてあーなんかいいなーって思いながら見てますね
1397.62,1409.62,相撲でめっちゃニキビあるやついる春間藤なニキビ跡な春橋のにニキビ跡本当にあれは 俺でも救えないでも別にさあんな横綱までなっちゃえば関係ねーじゃん顔なんて
1409.62,1414.34,ボコボコだろうがなんだろうが全然関係ないよ 全然関係ない
1414.34,1422.1799999999998,サンタさんって理科大知らない本人に聞いたよサンタさんってもういないでしょ 辞めちゃったんだよ5時半からが一番面白いからだちょうどな
1422.1799999999998,1429.4599999999998,西の大関東の大関がな準備し始めるというか 一応一生中いっぱいの
1429.4599999999998,1441.6599999999999,あんだけさばかりされながら版家ジョージのか際市場上とかかわいそうだよね メディアがさあ散々さあこと売り出していくぞーみたいなお前どうすんだ一生中いっぱいで
1441.66,1445.8200000000002,やー市場上 あんだけさあ
1445.8200000000002,1448.1000000000001,ねー
1448.38,1455.5800000000002,取り上げられたのにさあちょっとかわいそうすぎないか 遠藤も重量落ちエンド10両ちんの
1455.5800000000002,1464.74,ちょっともっとが遠藤は正直たっぱがねーからまあ結構厳しいというか ちょっと頑張らなきゃいけないねえずに乗っちゃうのかなぁ
1464.74,1472.02,わかんないけど ずに乗っちゃうのかなぁ相撲鳥のお尻の吹きでお尻吹きでもなったらそんな食があるの
1472.02,1475.02,楽しそうじゃん 楽しそうじゃない
1475.02,1481.3,楽しそう 相撲の話は終わり俺のねその浅い自意識であんまり相撲を語ると相撲ファンに怒ら
1481.3,1486.5,れちゃうからねよっちゃんとかクソ相撲ファンだから 市の女は今不適されてらそうなんだ
1486.5,1491.74,ちょっと頑張らなきゃいけないのでもなぁ俺のコミュニティはねあの 男性多いですから
1491.74,1501.02,相撲鳥やっぱ興味ある人いると思うんですよ大々的にサムネイルも相撲鳥のねあの ものを投影したようなサムネイルとうとう使ったこともありますのでこれから皆さんは
1501.02,1508.22,ねあの相撲鳥を応援していただければなと思いますやっぱり日本の国技だからね 和の心大事にしていこうじゃないか
1508.22,1517.66,テニスの話したちょっとタバコ吸ってくるね最後のタバコ ゲーム配信してる時はもう誓ってタバコ吸わないからあれはもうみんなに約束するわ
1517.66,1528.74,あれはもう本当に約束するでもさ雑談してるときは吸わしてお願いそれルール決めよう 最悪ライダーはね雑談してるときは吸わすお願い吸わしてじゃなきゃ乗ってこないんだよ
1528.74,1533.9,ゲームしてる時あのタバコ吸ったらマジ罰ゲームしよう
1535.5400000000002,1542.1000000000001,チッチしてくるからみんな待ってなチッチ 俺今日酒入ってるからロレンズマークだってさ
1547.66,1551.66,チッチしてくるからみんな待ってなチッチ
1551.66,1554.66,チッチしてくるからみんな待ってなチッチ
1554.66,1557.66,チッチしてくるからみんな待ってなチッチ
1557.66,1560.66,チッチしてくるからみんな待ってなチッチ
1560.66,1563.66,チッチしてくるからみんな待ってなチッチ
1563.66,1566.66,チッチしてくるからみんな待ってなチッチ
1566.66,1569.66,チッチしてくるからみんな待ってなチッチ
1569.66,1572.66,チッチしてくるからみんな待ってなチッチ
1572.66,1575.66,チッチしてくるからみんな待ってなチッチ
1575.66,1578.66,チッチしてくるからみんな待ってなチッチ
1578.66,1581.66,チッチしてくるからみんな待ってなチッチ
1581.66,1584.66,チッチしてくるからみんな待ってなチッチ
1584.66,1588.66,チッチしてくるからみんな待ってなチッチ
