start,end,text
2690.92,2695.0,からさ でもまぁあれなんだよね
2695.0,2698.88,ライムチャット起動すれば平気 なんだけどね
2698.88,2700.88,ライムチャット うん
2700.88,2703.88,この放送ページ見なくていいから さ
2703.88,2706.2,コメビューみたいなやつか そうそうそう
2706.2,2711.52,よく分かってんじゃねーか 今起動してない
2711.52,2714.36,その布団ちゃんモデレーターに しようと思ってたから起動はして
2714.36,2715.36,ないんだよね
2715.36,2733.76,どっちかにしよっか あの2画面で見せれっからさ
2733.76,2737.04,布団ちゃんの画面と俺の画面 見れるから
2737.04,2739.6800000000003,どっちでもいいよ ポケモンか
2739.6800000000003,2741.36,ワンダープロジェクトまた出て きた
2741.36,2744.04,進行勢力が出てきた え
2744.04,2745.88,ワンダープロジェクトいいじゃん ワンダープロジェクトジェイ
2745.88,2748.72,だろ 進行勢力がどんどんさ
2748.72,2751.96,テレビでやってみっかじゃあちょっと アンケート取り方が分かんないんだ
2751.96,2754.12,よね アンケートができんだ
2754.12,2756.2799999999997,分かんない俺なんかユーストリーム でアンケートできるって噂を聞いた
2756.2799999999997,2757.2799999999997,ことがあるんだよね
2757.2799999999997,2769.0,じゃあちょっとアンカーで決めて みるか久々に
2769.0,2771.56,いくよ じゃアンカーで決めるよ
2771.56,2775.88,じゃああと10秒以内に出すわ テリーだな今日は
2775.88,2779.7999999999997,待って完全にポケモンに今なって なかったよ
2779.7999999999997,2783.04,テリーになってるよ 今ポケモンになってなかった
2783.04,2785.0,多分テリーだった 流れちまったか
2785.0,2796.6,今ちょっと俺の目が正しければ ポケモンだったような気がします
2796.6,2799.48,どうしますか先生 テリーだったよね
2799.48,2803.84,テリーだった ポケモンだった本当に
2803.84,2809.6,ちょっと待ってコメ1分期限かける わだるい
2809.6,2811.52,配信ページが止まるちょっと待って ね
2811.52,2819.88,ok ok 静まりたまえ
2819.88,2822.4,テリーだったよね テリーだったテリーだった
2822.4,2825.28,普通にテリーだった今俺あれで 見てるけど
2825.28,2832.7200000000003,本当にテリーだテリーだ ゲームボーイ版か
2832.7200000000003,2836.76,そうやな プレステでもあるんだよな
2836.76,2841.1200000000003,それか俺たちが昔やったポケモン のジム1個クリアすることに対戦
2841.1200000000003,2844.6000000000004,して負けたほうが奪われる あれクリアしね
2844.6000000000004,2846.4,俺がデスチハンドだったっていう 名前の
2846.4,2849.6000000000004,あれクリアしてもいいぜ 赤と緑で
2849.6000000000004,2853.88,あれ良くない やってたな
2854.04,2857.2000000000003,それおめえとクリアしてもいい ぞ
2857.2000000000003,2862.6,お前のさ2度キング蒸し取ったけど 全然使えねえってさ
2862.6,2867.1600000000003,ジム時間にしよっか1時間に1回 戦いみたいな
2867.1600000000003,2872.88,そうしたらあまいかそれで野球 付くの配信を7時からにして
2872.88,2876.36,ちょっとやってみっか いいよいいよ
2876.36,2878.88,ちょっと準備するか ちょっとさでもさ一つだけ言って
2878.88,2881.56,いい ダグトリオだけはなしにしてほしい
2881.56,2884.48,なんで ダグトリオだけはなしにしようぜ
2884.48,2888.64,どういうことそれ あのさあそこなんだっけ
2888.64,2889.72,あんじゃん あーなるほどね
2889.72,2894.32,うん ちょっと今から準備するから
2894.32,2897.6,5時スタートね 解散
2897.6,2900.92,くたばれ早く くたばってくれ
2900.92,2901.52,解散しろ
