start,end,text
1.0,3.0,なんかでもさ、あれなんだよね
4.0,5.0,なんつーの
5.0,6.0,ロマサガはさ
7.0,8.0,知らねーやつが多そうでさ
8.0,9.0,骨が折れそう
10.0,11.0,そうかね
12.0,13.0,確かに
13.0,14.0,どう、どうだろうか
14.0,15.0,野球知らねー人と
15.0,17.0,じゃあ野球知らなくても
17.0,18.0,なんていうのある程度さ
18.0,19.0,こっちで盛り上げていこうみたいなさ
19.0,21.0,気持ちがあればできるじゃん
21.0,23.0,俺サラサラねーもんだって今からの2時間
25.0,26.0,まぁそうだね
26.0,27.0,おめーかさ俺のさ
27.0,31.0,背負ってくれるんだったらやりてーけどさ
31.0,33.0,魔王伝いったらおしまいみたいな感じになるんだしかも
33.0,34.0,まぁそうだね多分ね
35.0,36.0,だってしかも俺のことだからさ
36.0,38.0,アイテム落とさなかったらリセットすんじゃん
40.0,42.0,あれか、同家の、同家の靴みたいな
42.0,44.0,そうそうそうそう
45.0,46.0,んーじゃあ俺
46.0,47.0,個人的にはね
47.0,50.0,ロマサガ3コマンダーか
50.0,53.0,FF7のゴールド操作の面やってほしいんだよね
53.0,55.0,FF7のゴールド操作の面いくまでに
55.0,56.0,クソ時間かんじゃん
57.0,59.0,セーブデータ残ってない?奇跡的に
59.0,61.0,俺だってFF7のセーブデータがないもん
62.0,63.0,まじで?
63.0,64.0,俺あるんだけどな
64.0,66.0,俺行きたいなあるんだけどな
67.0,69.0,ゴールド操作をやったことないんだよね俺は
69.0,71.0,あほんとに?面白いぜ
71.0,72.0,すげー
74.0,76.0,まぁちょっとゆっくり決めていこうや
76.0,77.0,うん、オッケー
77.0,79.0,なんか俺さ
79.0,81.0,ここのページの放送権限をさ
81.0,83.0,おめーとよっちゃんに渡してさ
83.0,86.0,3人で使っていこうかなと思ってんだよね
86.0,87.0,あら?
87.0,89.0,ゲームをするならここでするみたいなさ
89.0,92.0,あーそうかニコ生とかじゃなくてね
92.0,93.0,あーそうそうそう
93.0,95.0,ここだとやり手放題できるんだろ長く
95.0,98.0,そうすれば別になんも文句ないでしょ
98.0,102.0,よっちゃんの18時間マリオとかここで見ると
102.0,104.0,超やりそう
107.0,109.0,超あいつやりそうまじで
109.0,111.0,似てーな
111.0,113.0,使いたい時被ったらどうすんだよ
113.0,114.0,それは喧嘩よ
114.0,116.0,やるんだよそこは
116.0,118.0,実際俺たち会えるわけだからさ
118.0,120.0,その家まで行って喧嘩して勝ったやつが
120.0,121.0,放送できる
121.0,123.0,やだなそんなことやりたくねー
123.0,125.0,だって別にこのページなんてさ
125.0,129.0,なんつーのそんなに大事にしてるわけじゃねーからさ
129.0,130.0,あー
130.0,131.0,あれなんだよな
131.0,134.0,みんなで共有できたほうがいいかなと思ってんだよ
134.0,136.0,当番みたいに曜日で決めろよ
137.0,139.0,どんなだよそれ
139.0,141.0,今日水曜日ウンコちゃんなみたい
141.0,143.0,常に悪くなくないそれ
143.0,145.0,悪くないけど悪くないけどね
145.0,147.0,ね月水は俺みたいなさ
147.0,150.0,月水カーモク俺みたいな
150.0,152.0,それいいなそれ
153.0,155.0,ほんとだよなんか義務解しそうだよほんと
155.0,157.0,ほんとでしかも休みも一定じゃねーぞ
157.0,159.0,聞いて聞いてそういう意味やらなきゃいけないとかじゃなくて
159.0,161.0,使用できるのはその日のみ
161.0,163.0,あー
163.0,165.0,いいじゃんいいじゃん
166.0,168.0,それでよくない?
168.0,169.0,いやいいよ
169.0,171.0,今あったこのすっぽかしたらペナルティー利用
171.0,173.0,それゴミの日理論
173.0,176.0,その日に出さなきゃいけないわけじゃないけどその日にしか出せないみたいなさ
176.0,178.0,なるほどなるほど
178.0,180.0,俺だけ第三金曜日帰っておけんだけど
182.0,184.0,月一のほうがさ
184.0,185.0,レア感が出るじゃん
185.0,187.0,なんかとにかくさ
187.0,190.0,みんなでゲームできるような空間にしていこうかなと思ってんだよ俺は
191.0,193.0,逆にさよっちゃんとか俺
193.0,195.0,俺はこうなんかやればいいんじゃないの?
195.0,197.0,どゆこと?
197.0,199.0,こういうストリーム
200.0,202.0,いやでもあんま人来ねえよそれ
202.0,204.0,人来たほうが面白いじゃん
204.0,206.0,あーなるほどね
208.0,210.0,うーん
210.0,212.0,何のゲームやるかとりあえずでも
212.0,214.0,もうそうだね
218.0,220.0,ドラクエ3
220.0,222.0,なんか俺的にさ
222.0,224.0,あれなんだよね
224.0,226.0,なんか試練とかはなんかもっと
226.0,228.0,他のとこでやり
228.0,230.0,形でやりたいな
230.0,232.0,試練はもうカチャンだろ
232.0,234.0,カチャンって一緒だろ
234.0,236.0,あれもう完璧に
236.0,238.0,ジャンルはやっぱRPGが
238.0,240.0,短いのってか続ける気ねえからさ
240.0,242.0,暇つぶしだからさ
242.0,244.0,俺なんかの縛りプレイしてほしいんだよな
244.0,246.0,悪くないねその発想は
246.0,248.0,ドラクエ3
248.0,250.0,遊びのみとかさ
250.0,252.0,その発想は悪くない発想だね
254.0,256.0,ザグレ中まだいるのか
256.0,258.0,ザグレって何
258.0,260.0,あれか
260.0,262.0,グレイトバトルか
262.0,264.0,ロックマンもちょっと
264.0,266.0,なんか終わらせる気がない
266.0,268.0,なんか分かったじゃん
268.0,270.0,俺とおめーでシリーズも一本やっていこうぜ
270.0,272.0,何する
272.0,274.0,だから必ず
274.0,276.0,今日始めたシリーズは
276.0,278.0,必ず完結させないといけないという縛りでさ
278.0,280.0,あーいいよ
280.0,282.0,その縛りかそっちに来たか縛りが
282.0,284.0,俺たちの中で縛る
284.0,286.0,なるほど
286.0,288.0,でもまず何のゲームするかだよな
288.0,290.0,うん
290.0,292.0,そこじゃあちょっとさ
292.0,294.0,やってこうよそこをちょっと決めてこうぜ
294.0,296.0,うーん
296.0,298.0,なんかだったらさ
298.0,300.0,もうあんまりあれだな
300.0,302.0,その視聴者動向っていうより
302.0,304.0,俺たちの中で完結できそうなシリーズを選んでいくしかねえな
304.0,306.0,そうだよね
306.0,308.0,一番モチベーション上がるゲームでしょ
308.0,310.0,てりぃのワンダーランドはね
310.0,312.0,二人でアホほどやったんだよ実は
312.0,314.0,昔はやってたよね
314.0,316.0,そうなんだよね
316.0,318.0,だいたいこの配合とかもさ
318.0,320.0,うん
320.0,322.0,分かってっかんな
322.0,324.0,うーん
324.0,326.0,クソゲーはやりたくないな
326.0,328.0,なんか王道のRPG
328.0,330.0,気分だね今は
330.0,332.0,うーん
332.0,334.0,俺さこの前さワッチャンとさ
334.0,336.0,うん
336.0,338.0,バイオハザード5やったんだけど
338.0,340.0,ああいうさFPSっていうの
340.0,342.0,うん
342.0,344.0,ああいうのをやりたいな
344.0,346.0,タイムスプリッター的なさ
346.0,348.0,お前今行ってくれみたいな
348.0,350.0,俺が今から盾になるみたいな感じでやっていきたい
350.0,352.0,なんか俺でもあれなんだよね
352.0,354.0,なんかおめえとやるゲームで盛り上がりたくねえんだよな
354.0,356.0,なんだそれ
356.0,358.0,なんかさだらだらだらだらさ
358.0,360.0,コメントもほとんどつかねえようなさ
360.0,362.0,シリーズをやっていきたいんだよね
362.0,364.0,分かったね
364.0,366.0,俺たちがやらなきゃいけないみたいなさ
366.0,368.0,はい
368.0,370.0,絶対疲れるんだって
370.0,372.0,FPSとかさ
372.0,374.0,盛り上げようと思えば結構盛り上がるじゃん
374.0,376.0,わーみたいな
376.0,378.0,そういうのがすごい疲れてさ
378.0,380.0,次にいけなそう
380.0,382.0,パートが追うごとに疲労度が増しそうじゃない
382.0,384.0,ああまあそうだね
384.0,386.0,今日も盛り上げないか
386.0,388.0,みたいなのがやなんだよ俺は
388.0,390.0,命のロウソクをさ
390.0,392.0,常にだらーっとできるみたいなさ
392.0,394.0,なるほどね
394.0,396.0,分かるかなこのニュアンス
396.0,398.0,分かるんじゃねえだろうな
398.0,400.0,分かるんじゃないかでもほんとに
400.0,402.0,寿命縮めてゲームを実況してみた感じでしょ
402.0,404.0,そうそうそう
404.0,406.0,野球つくとこが結構いいゲーじゃん
406.0,408.0,あれは俺が楽しいからいいんだけどさ
410.0,412.0,一機とかまでいくとちょっとあれなんだよね
414.0,416.0,タイムスプリッターやりてえな
416.0,418.0,だってあれだって別にグダグダできんじゃん
418.0,420.0,盛り上がらなくてもいいんでしょ
420.0,422.0,タイムスプリッターやりたくねえ
422.0,424.0,あのしべり
424.0,426.0,叩き割っちった
430.0,432.0,モンスターファームはねえ
432.0,434.0,やりたいんだよね
434.0,436.0,モンスターファーム1やりたくない
436.0,438.0,俺は2やりたいな
438.0,440.0,あれ2人でできるか
440.0,442.0,俺ちょうど買ってきたんだよね
444.0,446.0,それもじゃあ視野に入れていこう
446.0,448.0,持ってるには持ってる
448.0,450.0,500円で買った
450.0,452.0,すごい安かったよ
453.0,455.0,対戦できるか
455.0,457.0,RTSってなに
458.0,460.0,わかんねえ
462.0,464.0,戦国無双3
464.0,466.0,なかなかでも
466.0,468.0,ダラダラできない
468.0,470.0,なんだろうな
470.0,472.0,戦国無双3こそ忙しいよね
472.0,474.0,右手右手みたいな
474.0,476.0,しかもさ画質が悪すぎてぐっちゃぐちゃになりそう
478.0,480.0,あるよね
483.0,485.0,それか
485.0,487.0,モンスターファームは結構配信向きだと思うよ
489.0,491.0,モンスターファームやりたくない
491.0,493.0,色んなCDとかDVDとかでモンスター作れるでしょ
493.0,495.0,そうそう
495.0,497.0,いいなあそれ
497.0,499.0,お前いいの引きそうだな
501.0,503.0,シャイニングスコーピオンか
507.0,509.0,ゼルダか
509.0,511.0,ゼルダようやってない?
512.0,514.0,やってないシリーズもいっぱいあるじゃん
514.0,516.0,スーハミのゼルダはやり込んでるけどさ
516.0,518.0,ロクヨーのゼルダとか一回もやったことないよ
518.0,520.0,ロクヨー持ってねえだろ
520.0,522.0,買ってくれ買ってくれそしたら
522.0,524.0,5000円くらいで売ってるから近所に
524.0,526.0,すげえな
528.0,530.0,それ見たいわ俺
530.0,532.0,なにしようかなあ
532.0,534.0,まずさ今現時点で
534.0,536.0,二人でやるってのは難しいでしょ
536.0,538.0,二人でやろうと思えばできんじゃん
539.0,541.0,例えば今俺がやって
541.0,543.0,おめえと喋りながらやることもできるじゃん
547.0,549.0,それを決めてこうよ
549.0,551.0,そうだね時間もどんどんどんどん
551.0,553.0,4時3分ですが
559.0,561.0,いつもこんな感じになるよね
561.0,563.0,配信外でも
563.0,565.0,まあそうだね
565.0,567.0,何やるかって
567.0,569.0,配信つけようってなったじゃん
569.0,571.0,どうせ決まんねえんだから
571.0,573.0,9割方だいたいこの話決まんねえで
573.0,575.0,じゃあまた今度にする
575.0,577.0,大抵それで終わるからね
581.0,583.0,9割方俺たちの会議は
583.0,585.0,それで終わるからね
585.0,587.0,だいたいそうだよね
587.0,589.0,ちょっと話してて眠くなってきた
589.0,591.0,そうそうそう
591.0,593.0,だって俺今日の野球作ることしか考えてねえもん今
593.0,595.0,どういう
595.0,597.0,どういう風に料理してやろうかみたいな
599.0,601.0,まあそんな感じで
601.0,603.0,6時くらいまで暇つぶしていこうかな
603.0,605.0,いいよ
605.0,607.0,なんで6時からやる理由って
607.0,609.0,野球の開幕は6時からだから
609.0,611.0,なるほどね
611.0,613.0,そういうこだわりがあったのね
613.0,615.0,そういうのはきちっとしていきたいなみたいな
615.0,617.0,なるほど
617.0,619.0,まあでもその話はもう
619.0,621.0,始まるまではやめる
621.0,623.0,それはNGワードね
623.0,625.0,配信上で
627.0,629.0,マサイさん何のゲームあるんだっけ
633.0,635.0,でもあれなんだよね
635.0,637.0,FF9とかしかねえんだよね
639.0,641.0,買ってくるのも
641.0,643.0,だりでしょ
643.0,645.0,10分くらいで買ってこれるよ
645.0,647.0,おめえが雑談でさつないでくれるんだったら
647.0,649.0,俺買ってくるよその間に
649.0,651.0,それ決めようよ
651.0,653.0,何買ってくるか
661.0,663.0,半熟ヒーローは
663.0,665.0,やったことねえな
667.0,669.0,カービィも微妙だな
669.0,671.0,ブレイスオンファイアは一回やったけどもうだめだったよ
673.0,675.0,出てこねえな
675.0,677.0,野球
677.0,679.0,ごめんよ
679.0,681.0,野球作る話一回だけ言うよ
681.0,683.0,一回だけ俺に言わせてくれ
683.0,685.0,野球作る話だいたいつ頃終わるの
685.0,687.0,今日で終わり
687.0,689.0,今日で最後なの
689.0,691.0,今日で最終回
691.0,693.0,ごめん俺全然違う話なんだけど
693.0,695.0,次何やってくれるのかなって考えてたんだよね
695.0,697.0,次やるのは
697.0,699.0,決めてんだよねすでに
699.0,701.0,言わないけど
701.0,703.0,そうなんだ
703.0,705.0,なるほど
705.0,707.0,やりたいゲームができちゃったんだよな
709.0,711.0,ぜひロープレイであることを俺は祈ってるよ
711.0,713.0,聞いてないけどさ
713.0,715.0,しばらく時間は空くよ
715.0,717.0,明日明後日から開始みたいのはないよ
719.0,721.0,ユーストやってると声の疲労感が半端ないんだよ
721.0,723.0,ちなみにさ
723.0,725.0,どんくらいやってんの時間的には
725.0,727.0,40時間くらいじゃねえ
727.0,729.0,野球作る
729.0,731.0,ほんとに一日どんくらいやってんの
731.0,733.0,昨日は7時間やった
735.0,737.0,フルスロットルでさ
737.0,739.0,朝の5時くらいまでやった
739.0,741.0,パート今17まであって多分
741.0,743.0,16まであるのか
743.0,745.0,それぞれ3時間くらいずつやってるから
745.0,747.0,"多分4,50時間くらいやってんじゃねえ"
749.0,751.0,ハードはプレステ2がいいな
751.0,753.0,できれば
755.0,757.0,赤坂だか赤西はどうなんだ
757.0,759.0,誰だよそれ
759.0,761.0,1億5000万のさ
761.0,763.0,あいつは活躍してねえ
763.0,765.0,何しようかなって決めてるとこなんだよね
769.0,771.0,ドラクエイトは長ええな
773.0,775.0,ドラクエイト長ええな
775.0,777.0,うんこちゃんがさ
777.0,779.0,今5分後に決まりました
779.0,781.0,買ってきます
781.0,783.0,ちょっと選んで15分でしょ
783.0,785.0,4時半くらいからスタートするから
785.0,787.0,1時間半
787.0,789.0,1時間20分できるゲームなんかねえよ
789.0,791.0,なんか俺アクションやってほしいな
791.0,793.0,アラジンとかさ
793.0,795.0,ミッキーのマジカルアドベンチャー
795.0,797.0,しっかりなんだけど
797.0,799.0,1時間20分
799.0,801.0,ワンダと巨像やろうよ2人で
801.0,803.0,ワンダと巨像
803.0,805.0,ワンダと巨像やりたい
805.0,807.0,俺やったことねえからさ
807.0,809.0,俺やりたいわ
809.0,811.0,ヒリンサンダーですっげえクッソクソミスったもん
811.0,813.0,クッソクソミスった
813.0,815.0,クッソクソミスった
815.0,817.0,クソクソミスった
817.0,819.0,すっげえミスったクッソクソミスったもん俺
819.0,821.0,それ2人でやってこうよ
821.0,823.0,やりたい
823.0,825.0,あれアクションゲームなの
825.0,827.0,ええ
827.0,829.0,あれなんだろう
829.0,831.0,アクションかな一応
831.0,833.0,イコってやつは今家にあるんだよね
833.0,835.0,あそうなの
835.0,837.0,イコも面白いらしいよめっちゃくちゃ
837.0,839.0,あそうなの
839.0,841.0,いいそしたらイコやろうよ
841.0,843.0,俺見てみたいよイコ
843.0,845.0,果たしてこの読み方で合ってんのか分かんないけど
845.0,847.0,でも2人プレイはできないよ
847.0,849.0,1人プレイで
849.0,851.0,片方は見てるだけみたいな感じだよ
851.0,853.0,全然それでもいい幸せすぎるよそれ
853.0,855.0,なんかでもあれなんだよな
855.0,857.0,いまいち俺は
857.0,859.0,ワンダ巨像推しなんだよな
859.0,861.0,ワンダと巨像でもあれめっちゃ面白そうだよ
861.0,863.0,なんか
863.0,865.0,握力ゲージとかってさ
865.0,867.0,うーん
869.0,871.0,13匹ぐらいいるんでしょ巨像が
871.0,873.0,知らない知らないほんとに見たことない
873.0,875.0,でそれで全部倒して
875.0,877.0,なんかほんとに
877.0,879.0,感動できるんだって
879.0,881.0,あそうなんだ
881.0,883.0,俺さFF10のさ
883.0,885.0,エンディングを初めて見た時おめえと一緒に見たじゃん
885.0,887.0,見たね
887.0,889.0,あれくそ後悔したんだけどマジで
889.0,891.0,俺と一緒に見るんじゃなかったと思っちゃう
891.0,893.0,ほんとに帰ってほしかったもん
893.0,895.0,ジェックと倒したところでさマジで帰ってほしかった
895.0,897.0,マジでこいついらねーよ
897.0,899.0,って思ったんだよね
899.0,901.0,俺しかもネタバレしてた気がする
901.0,903.0,あれ覚えてねーけどさうわもったいねー
903.0,905.0,みたいなさ
905.0,907.0,こんないいストーリーをさ
907.0,909.0,邪魔されたよみたいなさ
909.0,911.0,でもあれあの時面白かったよね
911.0,913.0,あれ面白かった
913.0,915.0,ほんとに
915.0,917.0,なんか
917.0,919.0,ねーのかなこの二人ワンダと巨像も一応
919.0,921.0,候補に入れておこう
923.0,925.0,長いゲームやなんだよね
925.0,927.0,せっかくのんこちゃんキャップも買ったからそういう
927.0,929.0,なんかあれだよねプレステ以上のものをやりたいよね
929.0,931.0,そうだねちょっとやりたいね
931.0,933.0,俺がちょっと調べるわグーグルで
933.0,935.0,調べてくれ
935.0,937.0,PS2がいいよね
937.0,939.0,3もでもいいけどな2がいいかな
939.0,941.0,なんかみずちとかも呼んでやるか
941.0,943.0,じゃあせっかくだから
943.0,945.0,今いいんのみずちさん
945.0,947.0,じゃあやるもう決めましたってなったらさ
947.0,949.0,3人でやってくるじゃん
949.0,951.0,OKOKOK
951.0,953.0,そうすれば俺喋んなくていいし
953.0,955.0,楽をしよう楽をしようとしてるから
955.0,957.0,次の6時までに影響を養わないといけないからな
957.0,959.0,俺ほんとにちょっとね
959.0,961.0,エナジーを蓄えなきゃいけないからさ
961.0,963.0,これはもうみんなも了承してくれ
963.0,965.0,俺はやるべきことが今日あるんや
969.0,971.0,名作ね
971.0,973.0,名作で今調べてきたら
973.0,975.0,ベスト100
977.0,979.0,プレステーション2
979.0,981.0,ベスト100の1位がさ
981.0,983.0,もうすでにワンダと巨像なんだけど
983.0,985.0,あそうなんだ
985.0,987.0,へー
987.0,989.0,あと2位がメタルギアソリッド
989.0,991.0,3位がグランドセフトウォート
991.0,993.0,GTAってやつか
993.0,995.0,そうだね
995.0,997.0,4位がゴッドウォート知ってる?
997.0,999.0,白と赤の巨人みたいな
999.0,1001.0,あとはねアイコもそうだよ
1001.0,1003.0,5位に入ってる
1003.0,1005.0,6位がオオガミ
1005.0,1007.0,みんなやっぱあれなんだね
1007.0,1009.0,視聴者がコメントで書くようなやつは入ってくるんだな
1009.0,1011.0,あとキングダムハーツ
1011.0,1013.0,キングダムハーツやりたいな
1013.0,1015.0,やったことないんじゃない
1015.0,1017.0,1回もやったことない
1017.0,1019.0,あれキモいからやったことなかった
1019.0,1021.0,フジオシが超やってるみたいなイメージがあったからさ
1021.0,1023.0,これキモいわと思ってやってなかった
1023.0,1025.0,これ内緒だけど一応
1025.0,1027.0,放送で言っちゃうと荒れるから
1027.0,1029.0,マジでキモいわと思ってやってなかった
1029.0,1031.0,でも面白いと思うよレベルもあってさ
1033.0,1035.0,あれ面白いと思うけどな
1035.0,1037.0,俺もちょっとね
1037.0,1039.0,政権っぽい感じなんだよ進め方が
1041.0,1043.0,あのー
1043.0,1045.0,綺麗絵が綺麗みたいな感じ
1045.0,1047.0,まあいいんじゃないティーダーとかも出てくるし
1047.0,1049.0,マジで
1053.0,1055.0,まあそうやっていくと
1055.0,1057.0,あとデビルメイクライ
1057.0,1059.0,なんかそういうアクション系はちょっとね負担がでかいからやりたくないんだよね
1059.0,1061.0,しかもなんか画質が悪いから
1061.0,1063.0,早い系のはダメか
1063.0,1065.0,あんまり配信向きじゃないんだよね
1065.0,1067.0,ふんふんふんふん
1067.0,1069.0,あと有名どころはなんだろうな
1069.0,1071.0,鬼武者もしっかり同じか
1071.0,1073.0,まあそうだね
1073.0,1075.0,スターオーシャン3rdは?
1075.0,1077.0,あピクミンとかいいな
1077.0,1079.0,スターオーシャンすまんスルーしまったけど
1079.0,1081.0,ピクミンとかも悪くねえな
1081.0,1083.0,あいいんじゃない
1083.0,1085.0,ビブリボン
1085.0,1087.0,ちょいぼんげの挨拶じゃねえな
1087.0,1089.0,挨拶じゃねえよな
1089.0,1091.0,モンスターはしげや
1091.0,1093.0,わかるやつ多分3人くらいしかいるでしょ今の
1093.0,1095.0,いや絶対いるってビブリボン知ってるだろみんな
1097.0,1099.0,え知らないの?
1101.0,1103.0,知らないらしいビブリボン
1103.0,1105.0,あそうなんだ
1105.0,1107.0,全然知らねえ
1107.0,1109.0,あのさ
1109.0,1111.0,モンスターファンみたいな感じで
1111.0,1113.0,音ゲーなんだよ
1113.0,1115.0,へー
1115.0,1117.0,CD入れて
1117.0,1119.0,TMレボリューションのハイプレッシャーを流したら
1119.0,1121.0,それに合わせて
1121.0,1123.0,うさぎちゃんが冒険していくみたいな
1123.0,1125.0,へー
1125.0,1127.0,全然興味がねえやそれ
1127.0,1129.0,カイム
1129.0,1131.0,カイムだわそれ
1131.0,1133.0,それお金もらってもやりたくねえわ
1133.0,1135.0,仕事でもやりたくねえわ
1135.0,1137.0,断るわ俺やりたくないです
1137.0,1139.0,わかりました
1139.0,1141.0,いいんじゃないキングダムハーツとか
1141.0,1143.0,桜大戦とか
1143.0,1145.0,ちょっと微妙だな
1145.0,1147.0,多分俺ピクミンやったら面白いんだよな
1147.0,1149.0,絶対
1149.0,1151.0,引っこ抜かれての人
1151.0,1153.0,それはなんかさ
1153.0,1155.0,王道すぎてやりたくない
1155.0,1157.0,新しいものが見つからない
1157.0,1159.0,うーん
1159.0,1161.0,俺やったことねえけど
1161.0,1163.0,有名だよな
1165.0,1167.0,なんかあれなんだよね
1169.0,1171.0,さっきからチョロQ押してるやつがいるんだけどさ
1171.0,1173.0,チョロQ絶対だめだろ
1173.0,1175.0,面白いもん
1175.0,1177.0,どうなんだ
1177.0,1179.0,知らねえな
1183.0,1185.0,モンスターバーマー
1185.0,1187.0,一人でやりたいんだよな
1187.0,1189.0,二人でやるゲームじゃなさそうだな
1189.0,1191.0,でもさ
1191.0,1193.0,対戦したくねえ
1193.0,1195.0,育てたモンスターを
1195.0,1197.0,子育てマイエンジェル
1199.0,1201.0,育ってくんだよ
1201.0,1203.0,赤ちゃんから大人になってくんだよ
1203.0,1205.0,まあそうだな
1205.0,1207.0,クイズなんてお前のあれだろ
1207.0,1209.0,できるだろお前
1209.0,1211.0,いろいろ知ってんだから
1211.0,1213.0,なんかそのさ
1213.0,1215.0,一発集中型じゃなくてさ
1215.0,1217.0,株みてえにさ
1217.0,1219.0,だらだらだらだらさ
1219.0,1221.0,ゲー消えていくみたいな
1221.0,1223.0,そういうゲームやりたいんだよな
1223.0,1225.0,じゃあそしたらもう
1225.0,1227.0,だんだんそぎ落としていって
1227.0,1229.0,本当にそのゲームが好きなやつだけ残るみたいなさ
1229.0,1231.0,そういうゲームを選んでいきたいんだよな
1231.0,1233.0,そういうゲームを選んでいきたいんだよな
1233.0,1235.0,そしたらもう
1235.0,1237.0,ピクミンでいいんじゃないか
1237.0,1239.0,なんかちょっとあれ難しいね
1241.0,1243.0,まあ仕様が知らねえからな
1243.0,1245.0,オブリビオンとかも録画してねえよこんなの
1245.0,1247.0,作戦会議だよ
1249.0,1251.0,オブリビオン
1253.0,1255.0,あのゆっくりさんのやつか
1255.0,1257.0,そうそうそうそう
1257.0,1259.0,まああれは結局実況が面白いだけかもしれないしね
