start,end,text
0.0,2.0,あー、どうもー
3.0,4.0,ちょっと待ってね
31.0,33.0,どうもー
35.0,37.0,いやー、疲れたー
39.0,41.0,疲れました
43.0,44.0,最近ねー
44.0,47.0,うわ、このどの調子めっちゃよくない?今日
47.0,48.0,なんじゃこれ
49.0,51.0,しげのごろうのような今の気分ですね
52.0,54.0,は?のどの調子めっちゃよくない?
54.0,55.0,なんじゃこれ
56.0,58.0,しげのごろうの折り紙だよこれ
59.0,60.0,びっくりした今
60.0,63.0,こんなに声の調子いいの久しぶりだな
64.0,66.0,よろしくお願いしまーす
67.0,69.0,ガラガラしてないでしょ、まったく
71.0,73.0,すごくなんか小気味のいい
74.0,75.0,しゃべりができそうですね
75.0,76.0,声若くない?俺
77.0,78.0,最近ねー
79.0,81.0,ずーっとねー
81.0,82.0,あのー
82.0,84.0,ダイヤのエース見てました
85.0,87.0,あれ面白い
87.0,89.0,毎回思うんだけどさ
89.0,91.0,なんかああいうねー
92.0,94.0,あのーアニメ見てるとさー
94.0,96.0,髪の毛ピンクのだったり
97.0,100.0,そういうのだけほんとにねやめてほしいんだよね
103.0,106.0,ああいうのはほんとになんかもっとリアリティを追求してほしいっていうか
107.0,108.0,なんでさ俺さ
108.0,110.0,あ、しかも俺禁煙中なのね今
111.0,112.0,今3日目か
113.0,114.0,でもうね
114.0,116.0,なんで最近配信してなかったかっていうと
116.0,118.0,もう頭の中がもうタバコ吸いたい
118.0,121.0,タバコ吸いたいタバコ吸いたいってずーっと考えてるから
122.0,124.0,なんかイライライライラしちゃって
125.0,126.0,で俺さ
126.0,127.0,あのー
127.0,130.0,いや今回の禁煙はもう100%禁煙成功するんだけど
130.0,131.0,なんか分かるのね
131.0,134.0,成功する禁煙と成功しない禁煙があって
134.0,136.0,今回は100%禁煙成功するんだけど
136.0,138.0,イライライライラするじゃん
139.0,140.0,イライライライラ
141.0,143.0,じゃなんか俺スイッチが入ってるとき分かるのね
143.0,145.0,今までなんだかんだやめようとか言ってて
145.0,146.0,やめる気全くなかったんだけど
147.0,148.0,いや今回もうほんと
148.0,150.0,絶対成功するんだけど100%
150.0,151.0,もうこれ成功するんだけど
151.0,152.0,いつまで続くかはちょっと
153.0,154.0,今年夏に向けてね
154.0,156.0,だから喉の調子がいいのかもしんねぇな
157.0,158.0,だから
158.0,161.0,喉の調子がいいのかもしれないですね
162.0,165.0,禁煙してる配信見ながらタバコ吸うと
165.0,167.0,なんかもう馬鹿らしくなっちまってさ
167.0,168.0,なんかさ
168.0,170.0,この前なんで禁煙を決意したかっていうと
170.0,171.0,あのタバコ買いに
171.0,172.0,タバコがなくて
173.0,174.0,でなんか
174.0,175.0,あーもういいや
175.0,176.0,しけもく吸うべーと思って
176.0,177.0,しけもく吸いながらさ
177.0,178.0,パッて外
178.0,180.0,外から自分の部屋の中見たときに
180.0,182.0,あの鏡に映る自分を見て
182.0,184.0,やめようと思って
185.0,187.0,こんな気持ち悪いのやめようと思って
188.0,190.0,タバコ吸ってる自分の姿がキモくてやめました
191.0,192.0,それ以来今
193.0,195.0,どんぐらい吸ってねぇか?ママ
195.0,198.0,あのTwitterでつぶやいて以降は吸ってないね
198.0,199.0,吸ってないね
200.0,202.0,でも1時間に1回強烈に吸いたくなるけど
203.0,205.0,何もしない禁煙
205.0,206.0,なんかさなんか
206.0,208.0,禁煙するんだったらガム噛めよとかさ
208.0,209.0,あるじゃん
209.0,210.0,俺そういうの一切しないの
210.0,212.0,常に苦しみながら
214.0,216.0,禁煙するっていう禁煙方法をとってます
217.0,219.0,なので皆さんもぜひ真似してください
221.0,223.0,潔癖なのにしけもく吸うのかよ
223.0,224.0,俺だって自分は別だもん
225.0,227.0,俺潔癖じゃないんだよ
227.0,229.0,自分の部屋だけ綺麗だったら何でもいい
230.0,232.0,別に汚い部屋に遊びに行っても全く問題ないもん
235.0,238.0,汚い部屋に俺が遊びに行く分には全く問題ない
239.0,241.0,フリスカ今なんかたまたま目の前にあったから
242.0,243.0,なんか俺酒飲む時とかさ
243.0,244.0,女と遊ぶ時とかにさ
244.0,246.0,口くせぇなって思われるの嫌だから
246.0,247.0,フリスカ毎回食べてるんだよ
249.0,250.0,嫌だろそこまで
250.0,251.0,気を使ってんだよ俺は
253.0,254.0,気を使ってんだよ
254.0,255.0,気を使ってんだよ
256.0,257.0,パイプとかも吸わねぇんだよ
257.0,259.0,俺はただただ苦しみながら
259.0,261.0,1週間くらいあと1週間経っても落ち着くから
263.0,264.0,何を隠そう私ね
265.0,267.0,去年の8月終わりに
267.0,268.0,タバコ吸うまでの間
268.0,270.0,5年間禁煙してたっていう過去があるんで
272.0,273.0,経験者ですから
274.0,276.0,今回も頑張ってやろうと思います
278.0,279.0,俺Mだからさ
279.0,281.0,やっぱ気持ちいっちゃ気持ちいいんだよね
282.0,284.0,そんなしてないよマジで
284.0,286.0,25の春
286.0,288.0,違う25になる年の夏から
290.0,291.0,去年の夏まで
291.0,292.0,だから5、6年してたはず
293.0,295.0,5、6年してたはずだよ
297.0,298.0,してたよなぁ
298.0,300.0,だってさ俺がタバコ吸ってるの
300.0,302.0,リアルタイムで見てなかった人とかいるでしょ
302.0,304.0,俺昔バンバン
304.0,306.0,ゲームの最中でタバコバンバン吸いながらしてたんだよ
307.0,308.0,信用できない
308.0,309.0,ゴロリも
309.0,311.0,あのー俺がタバコ吸ってるの初めて見たって
312.0,314.0,あーそういう季節かーってなったね
315.0,317.0,ガバガバ吸ってたんだよ
317.0,319.0,昔あのポケモン録画面で上げてたとき
321.0,322.0,バコバコ吸ってたんだよ
323.0,324.0,で一回やめて
326.0,327.0,今に至ると
328.0,329.0,いうことですね
329.0,331.0,逆になんでまた吸い始めたんだよ
331.0,332.0,プレッシャーだよ
332.0,335.0,カメラの前に立つのが緊張しすぎて
335.0,337.0,何かに逃げなきゃって
337.0,338.0,自己防衛本能が働いて
339.0,341.0,タバコを吸うっていう
341.0,343.0,今思えばくだらねーよな
343.0,345.0,タバコなんか何も助けてくんねーのにさ
345.0,347.0,ハメられたね
347.0,349.0,ハメられた
349.0,351.0,ちょっと爪切っていいっすか
353.0,355.0,自分のなんか
357.0,359.0,いやほんとにあれだよ
359.0,361.0,防衛本能が働いたんだろうな
362.0,364.0,自分のなんかあれだろうね
364.0,366.0,経験にないようなストレスが
366.0,368.0,かかってたんだろうな
368.0,371.0,DNAの黒羽根も緊張ほぐすために
371.0,373.0,試合中吸ってるとそれはまた
373.0,374.0,違うわ
375.0,376.0,俺も試合中
376.0,378.0,タバコは吸わないもん
378.0,381.0,野球の試合中はタバコ吸わないもん絶対
382.0,383.0,今ミャクが放送してると
383.0,384.0,マジでなんか俺
384.0,386.0,毎回毎回タイミングずれて
386.0,388.0,いつも見れるんだよな
388.0,390.0,タイムシフト残さないじゃんみんな
390.0,391.0,なんでさあれなんだろう
391.0,393.0,タイムシフト残さない問題みたいな
393.0,394.0,俺の中だってさ
394.0,395.0,俺の好きな名前あるし
395.0,396.0,みんなタイムシフト残さないんだよ
396.0,397.0,ミャクさんもそうだし
397.0,398.0,セピアも残さねえの
398.0,400.0,残さねえことはないのか
400.0,402.0,みんな残さねえんだよな
402.0,404.0,あれ何なんだろうな
404.0,405.0,なんかやっぱ
405.0,407.0,恥ずかしい
407.0,409.0,恥ずかしいみたいのがあるのかな
412.0,414.0,残すセピアって
415.0,417.0,残す設定にしといて
417.0,419.0,出現したら消せばいいじゃんね
421.0,423.0,残す設定にしといて
423.0,425.0,見栄っぱりが
425.0,427.0,見栄とか関係ないでしょ
428.0,430.0,リアルタイムで見に来てほしい
430.0,432.0,あー
434.0,435.0,言葉狩りが嫌なんだろう
435.0,437.0,何それ言葉狩りって
438.0,439.0,事務所に禁止されてる
439.0,441.0,いやでも生放送しちゃってたら
441.0,443.0,別に変わんないじゃん
443.0,445.0,デフォルトだと多分しない
445.0,447.0,タイムシフト残さない設定になってるはず
449.0,451.0,無意識で出現してる可能性あるじゃん
451.0,453.0,あーまあね
453.0,454.0,いやでもそれは多分さ
454.0,456.0,生放送でしちゃったとしてもさ
456.0,458.0,ダメでしょ
458.0,460.0,どうせバレちゃうでしょ
461.0,463.0,自分基準で横山みどりは上下
463.0,465.0,何が生主としてってこと
466.0,468.0,なんかみんなみどりさんバカにしてるけど
468.0,470.0,あの人やっぱ視聴者数すごいよ
470.0,472.0,多分
472.0,474.0,俺最近見れてないけど
474.0,476.0,少なくとも俺よりは人いると思う
476.0,478.0,俺より人いるって時点でニコ生では
478.0,480.0,多分一番だと思う
480.0,482.0,何しゅーって
482.0,484.0,暗黒らへんが野球やってたぞ
484.0,486.0,なんかリアルタイムで見れてない
486.0,488.0,見たいなそれ
488.0,490.0,見てぇな
490.0,492.0,6月1日にやったって言ってなかったっけ
492.0,494.0,6月1日
494.0,496.0,にやったって言ってなかった
496.0,498.0,見に行きたかったなぁ
498.0,500.0,昨日やったんだ
500.0,502.0,へぇー
506.0,508.0,タイミング
508.0,510.0,最近ほんとにちょっと
510.0,512.0,見れてないね
512.0,514.0,でも横山みどりは
514.0,516.0,形にちょっと遊びを感じてるぞ
516.0,518.0,感じてないよ
518.0,520.0,感じてないと思うよ
520.0,522.0,普通だったら畑違うじゃん全然
522.0,524.0,全然畑違う
524.0,526.0,全然畑違うじゃん
526.0,528.0,全然畑違うじゃん
528.0,530.0,なんかそういう
530.0,532.0,焦りは感じて
532.0,534.0,ないんじゃない
534.0,536.0,そこまでなんか
536.0,538.0,考えてなさそう
538.0,540.0,見たかったなぁ
540.0,542.0,土俵が違うよね
542.0,544.0,ほんとにね
544.0,546.0,やっぱりなんかニコ生
546.0,548.0,喫水のみたいな
548.0,550.0,ニコ生主みたいなね
550.0,552.0,ところがありますからね
552.0,554.0,最近ほんとに見れてないなぁ
554.0,556.0,YouTubeでさ
556.0,558.0,お笑い見たりさ
558.0,560.0,ニコ生見てない
560.0,562.0,ニコ生見てない邪魔していい
562.0,564.0,最近さ
564.0,566.0,ダイヤのエースだっけ
566.0,568.0,あれマジで面白い絶対見た方がいい
568.0,570.0,フルで1000円くらいで登録できるから
570.0,572.0,120あるから
572.0,574.0,30時間くらい見れるから
574.0,576.0,あれ面白いよ
576.0,578.0,いじでも優雅な話題広がないよな
578.0,580.0,別にそんな大した意味はない
580.0,582.0,意味はない
582.0,584.0,120話くらいあるから絶対見た方がいいよ
584.0,586.0,今ねしかもちょうどいい
586.0,588.0,あのさ見てない人は
588.0,590.0,置いてくけどさあれ今あそこまで見てんだよ
590.0,592.0,第60話
592.0,594.0,天皇さんってところにして
594.0,596.0,一番いいシーンなんだよ
596.0,598.0,どっちがあれもうぶっちゃけ教えてほしいんだけどさ
598.0,600.0,俺土俵がなくて見れないんだけど
600.0,602.0,どっちが勝つのちゃんと勝つの
602.0,604.0,俺ねちゃんと
604.0,606.0,知ってからじゃないネタバレを聞いてからじゃなくて
606.0,608.0,見れないの
608.0,610.0,えマジで負けんの
610.0,612.0,マジで負けんの
612.0,614.0,あれマジで負けんの
614.0,616.0,えだとしたら
616.0,618.0,俺もう二度と見ないよ
618.0,620.0,だとしたら見ない
620.0,622.0,ほんとに
624.0,626.0,えだとしたらほんとに見ないよ
626.0,628.0,もう二度と見ないよ
630.0,632.0,マジで
632.0,634.0,いや安心して
634.0,636.0,安心して見たいんだけど
636.0,638.0,ほんとにさ教えてほしいんだけどさ
638.0,640.0,これあのダイヤのエースこれから見るよっていう人は
640.0,642.0,今から20秒ね
642.0,644.0,ちょっと音消してほしいんだけど
644.0,646.0,あれさ最後さ
646.0,648.0,あのなんだっけあそこ
648.0,650.0,稲城実業と戦うじゃん
650.0,652.0,地方大会の
652.0,654.0,東京西東京都大会の
654.0,656.0,決勝戦で
656.0,658.0,あれ勝つ
658.0,660.0,あれ勝つ
662.0,664.0,なんか空気的に負ける空気になってて
668.0,670.0,負けんのかぁ
670.0,672.0,マジで
672.0,674.0,えじゃあ三年生引退すんの
678.0,680.0,同点で追いつかれたところまで見たんだよ俺
680.0,682.0,でそっから先あもう見れないと思って
682.0,684.0,引退したの
684.0,686.0,いや引退したら意味ないでしょ
692.0,694.0,え今さてかさ
694.0,696.0,あのさあの
696.0,698.0,アニメはさ
698.0,700.0,どこまで出てんの
700.0,702.0,今さリアルタイムでさ
702.0,704.0,ダイヤのエースってやってんの
704.0,706.0,それでもう終わってんの
710.0,712.0,あまだやってるんだ
712.0,714.0,そこが完全にピークなの
714.0,716.0,俺今ピークを味わってんの
716.0,718.0,じゃあもう二度と見ない
718.0,720.0,じゃあもう見ない
722.0,724.0,だって三年生いいキャラ
724.0,726.0,揃いすぎてるじゃーん
726.0,728.0,その後も面白いの
728.0,730.0,春の選抜は
730.0,732.0,出れるってクソほど思うね
732.0,734.0,ネタバレ始まってんじゃん
734.0,736.0,秋の大会は
736.0,738.0,結局稲城があれなの
738.0,740.0,w
740.0,742.0,w
742.0,744.0,まさかキングダムのネタバレを今してんの
744.0,746.0,ケーシャって誰だったっけ
748.0,750.0,キングダム6月10日ぐらいに出るんだから
750.0,752.0,ネタバレしないでくれよ
752.0,754.0,俺でもさ漫画とかアニメはね
754.0,756.0,ネタバレしてからじゃないと
756.0,758.0,俺安心して見れないから
760.0,762.0,うわなんかやな予感したんだよな
762.0,764.0,あのデッドボール食らった時点でさ
764.0,766.0,俺なんかこれちょっとやな予感すんなー
766.0,768.0,なんだよなー
768.0,770.0,でやな予感したから
770.0,772.0,見るのやめてすぐ
772.0,774.0,ニコ生始めたというか
774.0,776.0,ケーシャって誰だっけな
776.0,778.0,名前忘れちゃったや
778.0,780.0,おっ
780.0,782.0,換気のあれか
782.0,784.0,マジで
784.0,786.0,あ違う違うあれじゃんケーシャって
786.0,788.0,敵じゃん今やってる黒妖
788.0,790.0,黒妖官のさ敵じゃん別にいいじゃん敵じゃん
790.0,792.0,敵が死ぬ分には全然
792.0,794.0,でももう半田半田見てないから
794.0,796.0,半田半田や
796.0,798.0,おいキングダムネタバレやめてくれ
798.0,800.0,別にいいじゃんあの流れは
800.0,802.0,だってケーシャ死ぬでしょ
802.0,804.0,そりゃもうあれよ
804.0,806.0,そりゃもうあれよ
806.0,808.0,稲術のキャッチャーが
808.0,810.0,プロになる稲術って分かんない
810.0,812.0,リボクの手下な
812.0,814.0,でもさ史実で言うと換気はさ
814.0,816.0,あれだよねあのー真に
816.0,818.0,打ちくびんされるよね多分ね
818.0,820.0,史実で言うと俺も調べたんだよ
820.0,822.0,なんかどっかに
822.0,824.0,亡命させられて
824.0,826.0,どっかにさ売り飛ばされてさ
826.0,828.0,そっから
828.0,830.0,真が攻めてきたところに
830.0,832.0,あのーね
832.0,834.0,換気の首を差し出して終わるみたいな
834.0,836.0,でも多分違いよね
836.0,838.0,そうだよね史実だと換気は
838.0,840.0,自ら首を差し出すらしいんだけど
840.0,842.0,キングダムの作者がどういう風に書くか
842.0,844.0,っていうのがやっぱ気になるよね
844.0,846.0,全然やっぱ史実とは別々のものじゃん
846.0,848.0,別々のものをね
848.0,850.0,書いてるわけだから
850.0,852.0,武蔵大が闇だ
852.0,854.0,最近バキとか見てねぇんだよ
854.0,856.0,一番好きなキャラは
856.0,858.0,キングダムで一番好きなキャラは
858.0,860.0,あれでしょ
860.0,862.0,誰がどう聞かれても
862.0,864.0,あいつって答えるでしょ
864.0,866.0,あのさ
866.0,868.0,武将が背中を見せるな
868.0,870.0,ってやつ
870.0,872.0,あのー韓国漢の
872.0,874.0,大きいじゃない
874.0,876.0,兵庫が2番目
876.0,878.0,チョウトウだチョウトウ
878.0,880.0,お前チョウトウめちゃめちゃかっこよくないか
880.0,882.0,換気将軍とさ
882.0,884.0,下に行ってさ
884.0,886.0,毒は違うじゃろうが
886.0,888.0,絶対あれだよ
888.0,890.0,俺声優聞いたことないけど
890.0,892.0,チョウトウの声優絶対こういう声だった
892.0,894.0,モブじゃねーよ
894.0,896.0,大将軍だろ一応
896.0,898.0,武将が背中を見せるな
898.0,900.0,ってところ
900.0,902.0,俺にやらせてくんねーかな
902.0,904.0,俺チョウトウに書ける思いは
904.0,906.0,絶対日本で一番だし
908.0,910.0,あれクソかっこよかったよね
912.0,914.0,あれは俺のキングダムシティの中では
914.0,916.0,相当上位に入る
916.0,918.0,あの毒でやられてさ
918.0,920.0,毒の煙吸っちゃってさ
920.0,922.0,あのーなんじゃなんじゃみたいな
922.0,924.0,でそいつはずーっとさ
924.0,926.0,あのー戦場で育ったから
926.0,928.0,武将の死に方みたいなの
928.0,930.0,すげーこだわりがあるんだ
930.0,932.0,いずれやっぱね
932.0,934.0,武将も死んでいくわけよ
934.0,936.0,ただやっぱ武将として死にたいと
936.0,938.0,なのにもかかわらず
938.0,940.0,卑怯な卑劣な毒でね
940.0,942.0,自分の命の灯火が消えていくことに
942.0,944.0,すごい意気取りを感じて最後
944.0,946.0,一人で突っ込んでいくんだよ
946.0,948.0,で将軍対将軍の戦いになって
948.0,950.0,そこで言ったセリフの一言が
950.0,952.0,最高なんだよ
952.0,954.0,だが毒じゃない
954.0,956.0,ってところが
956.0,958.0,キングダム知らない人は
958.0,960.0,何にも意味わかんないと思うけど
960.0,962.0,そのシーンは本当にね
962.0,964.0,ゾワゾワゾワゾワって
966.0,968.0,毒じゃなかろうが
968.0,970.0,みたいなシーンがあるんだよ
970.0,972.0,だからもっと男らしく
972.0,974.0,戦場で斬り殺されたりとかさ
974.0,976.0,弓矢で心臓を撃ち抜かれたりとか
976.0,978.0,そういうやっぱ男らしい生き様を
978.0,980.0,見せたいわけよ
980.0,982.0,部下に
982.0,984.0,なのにもかかわらず毒でじわじわ殺されていくことに
984.0,986.0,すごい意気取りを感じて発狂するっていう
986.0,988.0,超党ってキャラクターがいるんだけど
988.0,990.0,めちゃくちゃいいんだよ
990.0,992.0,超党見せてやるか
992.0,994.0,めっちゃビジュアルいいからね
994.0,996.0,わかんないから
996.0,998.0,ブリーチだったんだけど
998.0,1000.0,最近ブリーチ見てねーや
1000.0,1002.0,超党
1002.0,1004.0,キングダム
1004.0,1006.0,顔もめちゃめちゃかっこいいぜ
1010.0,1012.0,やば
1012.0,1014.0,想像の長さで上行ってた
1014.0,1016.0,超党こんなかっこよかったっけ
1016.0,1018.0,生で見る超党はちげーなやっぱ
1020.0,1022.0,これだよ
1022.0,1024.0,超党
1024.0,1026.0,めちゃめちゃかっこよくない
1026.0,1028.0,これだよ超党俺が一番好きなキャラ
1028.0,1030.0,超党
1030.0,1032.0,クソかっこいいだろ
1032.0,1034.0,ネタキャラじゃなくて本当に強い
1034.0,1036.0,ギリギリ乗ってるな
1038.0,1040.0,ここ
1040.0,1042.0,何を晒してくれるんじゃ
1042.0,1044.0,このゲスどもが
1044.0,1046.0,こういう口調なんだよ
1046.0,1048.0,あの
1048.0,1050.0,こんなものは武士の死に方ではないわ
1050.0,1052.0,って怒るんだよ
1052.0,1054.0,何を晒してくれるんじゃこのゲスどもが
1054.0,1056.0,七から帰ってくんだよ
1056.0,1058.0,七から
1058.0,1060.0,こういう風に
1062.0,1064.0,やっぱいいですね
1066.0,1068.0,俺超党が一番好きなんだよね
1068.0,1070.0,いろんなやっぱキャラクターがいる中
1074.0,1076.0,みんなもキングダムぜひ見てくださいね
1076.0,1078.0,また新しい
1078.0,1080.0,30
1080.0,1082.0,違う今43巻が
1082.0,1084.0,6月10日に
1084.0,1086.0,6月10日ぐらいに出るから
1086.0,1088.0,ぜひ見てくださいね
1088.0,1090.0,ちょっと一瞬待ってね
1092.0,1094.0,ピャッ
1100.0,1102.0,ごめんごめん
1102.0,1104.0,ごめんごめん
1108.0,1110.0,さすがに今から見れねえわ
1110.0,1112.0,なんかさアニメとかってさ
1112.0,1114.0,例えばワンピースとか読んでる人いる?
1116.0,1118.0,ワンピースとかさ
1118.0,1120.0,読んでる人いる?
1120.0,1122.0,今ワンピース何巻ぐらいまで出る?
1122.0,1124.0,読んでる人いるよね
1124.0,1126.0,70巻とか80巻とか
1128.0,1130.0,82巻まで出てんの
1130.0,1132.0,すごいね
1132.0,1134.0,やっぱりさ
1134.0,1136.0,そんだけ続編が出てればさ
1136.0,1138.0,絶対
1138.0,1140.0,山あり谷ありじゃん
1140.0,1142.0,面白いところとかあったり
1142.0,1144.0,最近ワンピース面白くねえな
1144.0,1146.0,でもまた面白くなってきた
1146.0,1148.0,面白くねえなって波があるじゃん
1148.0,1150.0,キングダムのすごいところは
1150.0,1152.0,一巻から面白くなり続けてるっていう
1152.0,1154.0,本当にどこ読んでも面白い
1154.0,1156.0,だから一巻読んでくれたら
1156.0,1158.0,ずーっと右肩上がり
1158.0,1160.0,本当に右肩上がり
1160.0,1162.0,もちろんその中にも
1162.0,1164.0,山あり谷ありはあるんだけど
1164.0,1166.0,常に面白さは右肩上がり
1166.0,1168.0,17巻が一番面白いんだけど
1168.0,1170.0,あのー
1170.0,1172.0,とある武将が死ぬみたいな
1172.0,1174.0,それぞれになんか
1174.0,1176.0,思い出に個々が思い出に残るシーンがあるんだけど
1176.0,1178.0,16巻か
1178.0,1180.0,でも本当に面白いあれは
1180.0,1182.0,ワンピースは王道で人気ありすぎやから
1182.0,1184.0,いじねも見ない
1184.0,1186.0,なにその
1186.0,1188.0,くだらないこだわりは
1188.0,1190.0,合唱群編から右肩下がり
1190.0,1192.0,まじで合唱群編から超面白いじゃん
1192.0,1194.0,俺あそこ毎回泣くぜ
1194.0,1196.0,あの
1196.0,1198.0,せいちょっとだけ捕まらせてもらって
1198.0,1200.0,いいかのところ
1200.0,1202.0,あそこ涙ちょちょ切れない
1202.0,1204.0,あれも合唱群からもう
1206.0,1208.0,あそこめっちゃいいよね
1210.0,1212.0,あのシーン
1212.0,1214.0,王がバーッと出てくるところ
1214.0,1216.0,27巻
1216.0,1218.0,そうそうそうよくわかってるね
1218.0,1220.0,だからなんかあるんだよ
1220.0,1222.0,面白い面白くないっていうのはさ
1222.0,1224.0,個人のな色々価値観が
1224.0,1226.0,違うだろうけども
1226.0,1228.0,俺の中ではやっぱキングだもん
1228.0,1230.0,常に右肩上がり
1230.0,1232.0,ワンピ嫌いとかドクターヒルルクも
1232.0,1234.0,知らないとかかわいそう
1234.0,1236.0,40巻ぐらいまではな
1236.0,1238.0,見てたんだけどな40巻ぐらいまでは
1238.0,1240.0,残り40巻
1240.0,1242.0,40巻見てないんだよな
1242.0,1244.0,まあでも完結したら絶対見ると思う
1244.0,1246.0,あんだけ長く続いたシリーズだから
1246.0,1248.0,でもまあ100巻以内には完結するんじゃないの
1248.0,1250.0,わかんないけど
1252.0,1254.0,今ワンピース80巻なんでしょ
1254.0,1256.0,あと20巻ぐらいで
1256.0,1258.0,完結していただいてすごいありがたいんだけど
1258.0,1260.0,なんでそんな長いんだろうね
1262.0,1264.0,なんでそんな長くすんだろうね
1266.0,1268.0,昔は120ぐらい
1268.0,1270.0,あそうなんだ
1270.0,1272.0,この前半分で言ってたぞ
1272.0,1274.0,ってことは150巻ぐらいってこと
1274.0,1276.0,早くさ完結して
1276.0,1278.0,俺さ完結した状態から見たいから
1280.0,1282.0,なんだかあれだな
1282.0,1284.0,延長しよう
1284.0,1286.0,すげえ漫画の話に20分押してもった
1292.0,1294.0,脅威の1410分延長
1298.0,1300.0,まあでもあれなんだよ
1300.0,1302.0,結局そういうなんか
1302.0,1304.0,くだらねえ
1304.0,1306.0,くだらねえって言ったら
1306.0,1308.0,怒られるけどさ
1308.0,1310.0,そういうなに
1310.0,1312.0,バカなのカスなの言いながらさ
1312.0,1314.0,切ったり切られたり
1314.0,1316.0,そういうのがやっぱ一番いいんだよな
1316.0,1318.0,俺的にはそういうのがな
1318.0,1320.0,一番いいんだ
1322.0,1324.0,俺デスノートとか好きじゃないの
