start,end,text
1324.0,1326.0,なんでかって言うと文字が多すぎる
1326.0,1328.0,その理由の一つとして
1328.0,1330.0,ワンピースってさ文字多くない
1330.0,1332.0,色んな文字読まなきゃいけないじゃん
1332.0,1334.0,俺文字多いの好きじゃないの
1334.0,1336.0,バキとかね
1336.0,1338.0,単行本一個4分で読み終わるの
1338.0,1340.0,ガッガッみたいな
1340.0,1342.0,ガオみたいな
1342.0,1344.0,ハンターウォンターは別にごちゃごちゃしてるけど文字少ねえんだよ
1344.0,1346.0,バキとかも
1346.0,1348.0,ダオダオ
1348.0,1350.0,レッツカイオーが出てきたらダオ
1350.0,1352.0,そういうさわかりやすい
1352.0,1354.0,なんかアニメが好き
1354.0,1356.0,アニメが好きなんだよね
1356.0,1358.0,ブリーチもくそ楽じゃん
1358.0,1360.0,読むの超楽じゃん
1360.0,1362.0,最悪文字読まなくてもパラパラパラパラパラ漫画みたいに見れるじゃん
1362.0,1364.0,こういうこと起きたんだなって
1364.0,1366.0,なんであんたとか
1366.0,1368.0,最新巻見たんだよ33巻
1368.0,1370.0,ごちゃごちゃしてて読みづらいなと思ったけど
1370.0,1372.0,最悪絵だけ読んでればいいやって
1372.0,1374.0,俺はまだ諦めてないけど
1376.0,1378.0,やっぱ漫画なんだからさ
1378.0,1380.0,コボちゃんみたいに
1380.0,1382.0,ねえ
1382.0,1384.0,わかりやすくしてほしいよね
1384.0,1386.0,わかりやすく
1388.0,1390.0,デスノート俺嫌い
1390.0,1392.0,だからいまだに
1392.0,1394.0,途中まで読むけど
1394.0,1396.0,最初の
1396.0,1398.0,エルだっけ
1398.0,1400.0,エルが死んだところで
1400.0,1402.0,読むのやめちゃうんだよな
1402.0,1404.0,デスノート面白いの多分ね
1406.0,1408.0,デスノート面白いだろうね
1408.0,1410.0,なんかすごい設定がすごいじゃん
1410.0,1412.0,読めないんだよ疲れちゃうんだよ
1414.0,1416.0,あエル
1416.0,1418.0,あそこまででいいんだ
1418.0,1420.0,ちゃんとなんか俺は楽しいところまでは網羅してるんだね
1420.0,1422.0,ダイヤのエースも
1422.0,1424.0,死ぬ負けんのかよあれ
1424.0,1426.0,ふざけんなよ
1426.0,1428.0,マジで
1428.0,1430.0,悲しいわダイヤのエース
1430.0,1432.0,本当に悲しいすげーはまってて60巻まで
1432.0,1434.0,一気に読んだのに
1434.0,1436.0,いや受け入れられないよ
1440.0,1442.0,悲しき先輩大泣きするぞ
1442.0,1444.0,めっちゃいいやつなのに
1444.0,1446.0,めっちゃいいやつなのに
1448.0,1450.0,ネタバレ聞いてから
1450.0,1452.0,安心して見たい派なんだよ俺
1452.0,1454.0,えちょっと待って
1456.0,1458.0,作者は2年目が書きたかったらしい
1458.0,1460.0,あそうなんだ
1460.0,1462.0,でもなんか
1462.0,1464.0,あんだけさ3年生にさ
1464.0,1466.0,キャラの濃くて面白いやつ揃っちゃってさ
1466.0,1468.0,しかもあんだけ引っ張ったらさ
1468.0,1470.0,なかなかだって一年入ってきた
1470.0,1472.0,一年生とかに有望なキャラいんの
1472.0,1474.0,ダイヤのエースで好きなキャラは
1474.0,1476.0,俺主人公が好きだから山本
1476.0,1478.0,山本じゃない澤村
1480.0,1482.0,あいるんだ
1482.0,1484.0,鉄の音鳴いてくんだ
1484.0,1486.0,めちゃめちゃあるじゃん
1486.0,1488.0,なんかもう
1488.0,1490.0,待ってましたかのように鉄の音
1490.0,1492.0,鳴いてくんだ
1494.0,1496.0,あそうなんだ
1496.0,1498.0,顔一緒なんだ
1500.0,1502.0,なんかでもさ後輩だけど
1502.0,1504.0,頑張ってるみたいな
1504.0,1506.0,そういうのが
1506.0,1508.0,好きだったんだけどね
1510.0,1512.0,結局3年目に頼りっぱなしじゃねえかよ
1512.0,1514.0,じゃあ
1514.0,1516.0,結局3年目に
1516.0,1518.0,3年目の劣化じゃねえか
1522.0,1524.0,なんかそれじゃねえんだよな
1524.0,1526.0,俺はブス自慢みたいにさ
1526.0,1528.0,ストレート変なストレートの
1528.0,1530.0,変化球一個だけで俺は
1530.0,1532.0,行って欲しかったんだよな
1534.0,1536.0,悲しい
1538.0,1540.0,悲しいな
1542.0,1544.0,チェンジアップ
1544.0,1546.0,カットホールは覚えてるんだ
1546.0,1548.0,俺の知ってる澤村は
1548.0,1550.0,しかも名前がいいんだよ
1550.0,1552.0,純粋の純に
1552.0,1554.0,純粋の純に
1554.0,1556.0,俺さ主人公の名前が
1556.0,1558.0,あ
1558.0,1560.0,完璧じゃねえか
1560.0,1562.0,なんでこんなに綺麗に
1562.0,1564.0,戻ってくれたんだろう
1564.0,1566.0,やばいわ俺
1566.0,1568.0,普段このタイミングで
1568.0,1570.0,いつもタバコ吸ってたのね
1570.0,1572.0,頭今おかしくなりそうになっちゃって
1572.0,1574.0,今
1574.0,1576.0,今油ほんとに
1576.0,1578.0,今
1578.0,1580.0,信じられないくらい
1580.0,1582.0,発狂したくない
1582.0,1584.0,あのね
1584.0,1586.0,いつもこのタイミングで止まったら
1586.0,1588.0,一服してくるかって
1588.0,1590.0,今ほんとにやばかったわ
