start,end,text
1184.08,1186.08,反発
1186.08,1188.08,そういう時期があるんだよ
1188.08,1190.08,スト5やりてんだけどだよ
1190.08,1192.08,ダメなんだよできねえんだよ
1192.08,1194.08,あでもマイク買ったから
1194.08,1196.08,あれか下手すりゃできるけどね
1196.08,1198.08,でもガイルなんもしあげてねえからさ
1200.08,1202.08,スト5やろっからせっかくだから
1202.08,1204.08,ただほんとなんの練習もしてねえぞ
1204.08,1206.08,ガイル
1206.08,1208.08,なんの練習もしてないよ
1208.08,1210.08,コンボもわかんないよ
1210.08,1212.08,俺ガイル以外もう使う機器全くないから
1212.08,1214.08,俺の向上心コンボG見たい?
1214.08,1216.08,じゃあ枠一回切るわ
1216.08,1218.08,なんかミラーしてあげて
1218.08,1220.08,ミラーしてあげて
1220.08,1222.08,30分だけやるわ延長できねえからどうせ
1224.08,1226.08,俺一応PS4でさ
1226.08,1228.08,あれ買ったからさ
1228.08,1230.08,マイク
1232.08,1234.08,向上心コンボG見せるわ
1234.08,1236.08,じゃあみんなで一回切るわ
1236.08,1238.08,死ねえ
1238.08,1240.08,お前らが死にますように
1240.08,1242.08,普通にネタとかじゃなくて
1248.08,1250.08,ご視聴ありがとうございました
