start,end,text
1659.82,1661.82,いいねぇ
1661.82,1663.82,最高のボールで決まったね
1663.82,1665.82,いいスライダー
1669.82,1671.82,めちゃめちゃいいスライダーなんで打たれんのこんなのが
1671.82,1673.82,打たれる道理がねえだろ
1673.82,1675.82,コントロール悪いんだろうなぁ
1677.82,1679.82,コントロール悪いんだろうねぇ
1679.82,1681.82,もう一球いくか同じ球だね
1681.82,1683.82,あったストレート
1683.82,1685.82,うわぁ危ない危ない危ない
1689.82,1691.82,あれカットボールなんだ
1691.82,1693.82,までもスライダーとカットボールのさ
1693.82,1695.82,野球じゃないから選手のこと教えて
1695.82,1697.82,俺選手解説していくわ
1697.82,1699.82,カジタネこれもうパワー系のイケルマゴリラ
1699.82,1701.82,パワー系のイケルマゴリラ
1701.82,1703.82,最強
1703.82,1705.82,アスリートっていうさ
1705.82,1707.82,ジムに通ってて筋肉もりもりマッチョマン
1707.82,1709.82,昨年の血行障害によりやや
1709.82,1711.82,それの影響もあり
1713.82,1715.82,本聴者出てないけどやっぱパワーあるね
1715.82,1717.82,一番ね
1717.82,1719.82,金本と一緒のジム通ってるパワー系のゴリラ
1719.82,1721.82,ゴリラが出席立ってると思うんだよ
1721.82,1723.82,ちょうど血液型もB型だし
1725.82,1727.82,そう思っていて間違いはない
1729.82,1731.82,もう危ないなぁ
1735.82,1737.82,危なすぎるよ
1741.82,1743.82,カジタネヒゲ剃ったほうがいいな
1743.82,1745.82,のむさん見てないことで
1745.82,1747.82,申し訳ねえけど
1749.82,1751.82,2-3これ何投げるか
1751.82,1753.82,一番やっぱ
1753.82,1755.82,スライダーでしょ
1755.82,1757.82,うわぁマジで
1757.82,1759.82,お前ニヤニヤしてんじゃねえぞ
1759.82,1761.82,俺一番ムカつくからな
1761.82,1763.82,そういうのが
1763.82,1765.82,一番腹立つパターンだよ
1765.82,1767.82,ニヤニヤしてるやつ
1767.82,1769.82,ダメだよ
1769.82,1771.82,お前映えある巨人軍のユニフォームを着て
1771.82,1773.82,あれだぜ
1773.82,1775.82,な?
1775.82,1777.82,2万人だか3万人だか投げてんだぜ
1777.82,1779.82,フォアボールだしヘラヘラするんじゃねえぞ
1781.82,1783.82,面っていうのは一番大事だから面構えっていうのは
1787.82,1789.82,やられても憎たらしい顔してほしいわ
