start,end,text
1407.0,1409.0,あーよかった今安心した
1409.0,1411.0,お前見ろ
1411.0,1413.0,こんなな
1413.0,1415.0,新参歌ってるおばさんいねえだろ
1415.0,1417.0,これだぞお前
1417.0,1419.0,聞けよこっち
1419.0,1421.0,ずっと
1421.0,1423.0,心に描く
1425.0,1427.0,未来
1427.0,1429.0,予想する
1431.0,1433.0,ほら
1433.0,1435.0,思った
1435.0,1437.0,通りに
1439.0,1441.0,叶えられてく
1441.0,1443.0,なんかうちのお母さん
1443.0,1445.0,思い出すわドリカムずっと聞いてたから
1449.0,1451.0,なんかあれなんだろうな
1451.0,1453.0,あのー
1453.0,1455.0,ゲームとかと一緒でさ
1455.0,1457.0,歌ってみたとかにも
1457.0,1459.0,流行ってる
1459.0,1461.0,今流行ってる曲みたいなのが
1461.0,1463.0,あるんだろうね
1463.0,1465.0,本当に
1465.0,1467.0,最近マジで聞いてねえわ
1467.0,1469.0,これあれ知ってるよ俺
1469.0,1471.0,タロウのこれ言うたじゃん
1471.0,1473.0,クイーンとか歌ってるでしょ
1475.0,1477.0,ゲロあったどれ
1479.0,1481.0,ゲロが歌ったとか言ってくれないと
1481.0,1483.0,分かんねえよ俺
1483.0,1485.0,分かんねえよなんかタイトルが
1485.0,1487.0,分かりづれえよ
1487.0,1489.0,ゲロ歌ってみたとかにしてくれよ
1491.0,1493.0,タロウさんって今まだニコ生
1493.0,1495.0,やってんのかなあ
1495.0,1497.0,昔やってたんだけどなあ
1497.0,1499.0,上手いよねなんかね
1499.0,1501.0,ジジイのなんか予算みたいな
1501.0,1503.0,あこれあれじゃんアンダーバーじゃん
1503.0,1505.0,アンダーバーこんなのれてんの
1505.0,1507.0,あ宝島歌ってんじゃん
1507.0,1509.0,マジかよ
1513.0,1515.0,あのさあ
1515.0,1517.0,ちゃんとこれ煽りじゃなく聞きたいんだけどさ
1517.0,1519.0,この人って一体何の人なの
1519.0,1521.0,アンダーバーって歌ってみた
1521.0,1523.0,の人
1523.0,1525.0,本当に教えてくれない
1525.0,1527.0,何の人なのこの人は
1527.0,1529.0,すごい人お笑い芸人さんなの
1529.0,1531.0,おー
1535.0,1537.0,ネタ系の歌いて
1541.0,1543.0,おなんか
1543.0,1545.0,ボイパしてんじゃんすげえ
1547.0,1549.0,なんかCDデビューとかしてんの
1551.0,1553.0,すげえ伸びてるよこれ
1553.0,1555.0,100万再生いってる
1555.0,1557.0,歌ってみたら100万再生
1559.0,1561.0,えー
1565.0,1567.0,あそういうことだったのか
1569.0,1571.0,以上アンダーバーさんでした
1573.0,1575.0,なんかすごいね
1575.0,1577.0,サムネとかもなんかもう
1577.0,1579.0,きちがいみたいになってるね
1581.0,1583.0,どう歌ってみたの
1583.0,1585.0,金梅みたいな認識でいいんでしょ
1585.0,1587.0,金梅でしょ今
1587.0,1589.0,金梅でしょ今
1589.0,1591.0,違うの
1591.0,1593.0,それ合ってるでしょ
1593.0,1595.0,金梅みたいなもんでしょ
1595.0,1597.0,あーよかったよかった
1597.0,1599.0,だから人気ってことでしょ
1599.0,1601.0,なるほどな
1601.0,1603.0,すげえ人気じゃんだってアンダーバー
1605.0,1607.0,CDとか
1607.0,1609.0,めちゃくちゃ売れてんじゃん
1609.0,1611.0,グルタミンとかどうしたのグルタミン
1611.0,1613.0,グルタミン
1613.0,1615.0,あれ辞めちゃったのもう
1615.0,1617.0,サンリオとコラボしてた
1617.0,1619.0,お前うちの香川だってコラボしてたじゃねーかよ
1619.0,1621.0,あじゃあ香川みたいなもんか
1621.0,1623.0,よかった立ち位置に分かってきたアンダーバーの
1625.0,1627.0,なるほどな
1627.0,1629.0,そういうなんかきちがい系の配信者ってことね
1629.0,1631.0,要は
1631.0,1633.0,あれでしょ
1633.0,1635.0,あの犯罪予告とか連れてくるでしょ
1635.0,1637.0,芸能わかんねえもん
1639.0,1641.0,もうガラッと変わっちまったんだよだから
1641.0,1643.0,俺が
1643.0,1645.0,あの頃はさヒャダインとかさ
1645.0,1647.0,そういうなんか
1647.0,1649.0,そういうやつだったんだよゲロとかさ
1649.0,1651.0,その二人しか知らないけど
1651.0,1653.0,あとポコタとかさ
1653.0,1655.0,ポコタの
1655.0,1657.0,ダンシングサムライとかさ
1657.0,1659.0,見てたわけよ
1659.0,1661.0,ゴムとか
1661.0,1663.0,ゴムとか死んじゃったの
1663.0,1665.0,ヨッペとかいたよな
1665.0,1667.0,ヨッペとか
1667.0,1669.0,ゴムどこ行ったの
1669.0,1671.0,あのゴミ
1671.0,1673.0,ゴムどこ行ったの
1673.0,1675.0,ゴム
1675.0,1677.0,ゴムなんかすげえ
1677.0,1679.0,なんかすごくなってんだよね
1679.0,1681.0,えゴムってルート5なってんの
1681.0,1683.0,嘘でしょ
1683.0,1685.0,ゴムってルート5入ってんの
1687.0,1689.0,え嘘でしょ
1689.0,1691.0,ちょっと待って調べさせて
1691.0,1693.0,ゴムはハニーワークス
1693.0,1695.0,ごめんわかんないハニーワークスが
1695.0,1697.0,あ
1697.0,1699.0,そう作曲化してんだよな
1701.0,1703.0,作曲してんだよね
1703.0,1705.0,俺ゴムのラブファントムずっと聞いてたわ
1705.0,1707.0,ゴムのラブファントム
1707.0,1709.0,ゲロはだってジャムプロジェクト
1709.0,1711.0,みたいなのと一緒にやってんじゃん
1711.0,1713.0,ゲロに曲提供とかしてんの
1713.0,1715.0,マジで
1715.0,1717.0,だったら友達で俺にも曲提供してくれよ
1717.0,1719.0,してくれよ
1719.0,1721.0,なんか
1721.0,1723.0,8000万くらい売れんだろ
1723.0,1725.0,気合い入れれば
1727.0,1729.0,ちょっとなんか聞かせてくれよ
1729.0,1731.0,億千万とか歌うから
1731.0,1733.0,ねーねーねーねーねーねーねーねー
1733.0,1735.0,って俺歌うから
1735.0,1737.0,あれしようぜ
1737.0,1739.0,違法ダウンロードしまくろうぜみんなで
1739.0,1741.0,ゴムに印税入るのがやだから
1741.0,1743.0,俺がオッケーらせていいでしょ
1743.0,1745.0,歌が光るなってその件で
1745.0,1747.0,揉めてたじゃんなんか勝手に許可なく
1747.0,1749.0,やりやがってみたいな感じで
1751.0,1753.0,ゴムの億千万ちょっと
1753.0,1755.0,やりたいわ
