start,end,text
0.0,4.0,なんか気に入らねえな、この円が
10.0,14.0,円が気に入らねえな
30.0,47.0,なんか気に入らねえな
47.0,51.0,悪くない…
51.0,53.0,ああああっ
53.0,56.0,こんばんは
56.0,59.0,、今は
59.0,62.4,もう今もう一つしかねーよな 話すことといったら
62.4,64.4,一個だけでしょ
66.4,69.4,今日話すことといったら一つだけ今日話しに来ました
69.4,71.4,みんなに
71.4,73.4,スピード
73.4,74.4,最高
74.4,76.4,ぜーんと今日一日中
76.4,78.4,スピード聞いてました
79.4,81.4,あの何が言いたいかというとね
82.4,84.4,当時今は同世代じゃん
85.4,87.4,知っての通り
87.80000000000001,89.80000000000001,スピードって知ってるみんな
89.80000000000001,91.80000000000001,4人組
91.80000000000001,92.80000000000001,バンド
92.80000000000001,94.80000000000001,バンドじゃねーよあいつらなんだ
94.80000000000001,96.80000000000001,知らねーけど
97.80000000000001,99.80000000000001,4人組の
99.80000000000001,101.80000000000001,なんかいるじゃんあいつら
101.80000000000001,103.80000000000001,グループ
103.80000000000001,105.80000000000001,ダンスユニットのスピードずーっと
105.80000000000001,107.80000000000001,当時はさ
107.80000000000001,109.80000000000001,夜も引っ張れとかにさ出てたわけよ
109.80000000000001,111.80000000000001,変な調子乗った
111.80000000000001,113.80000000000001,子供が小学校6年生の
113.80000000000001,115.80000000000001,子供が出てたわけよ
116.2,118.2,今やよ
118.2,120.2,自由民主党だぜ
120.2,122.2,でさなんかみんなの中でそういう人いないの
122.2,124.2,うわちっちゃい頃から
124.2,126.2,ずーっと一緒にやってたのに
126.2,128.2,すげーなーみたいな
129.2,131.2,自由民主党だぜ
131.2,133.2,おかしいよな
134.2,136.2,一人ブスがいるよな
136.2,138.2,そういうお前一人の悪口言ったら
138.2,140.2,俺許さねーからな
140.2,142.2,ちなみに免許の講師は行ってません
142.2,144.2,明日行かないと本当に俺は免許を執行することになります
146.20000000000002,148.20000000000002,ひとえちなみにあれだからな
150.20000000000002,152.20000000000002,一般人男性と結婚してるからあんまり
152.20000000000002,154.20000000000002,ガチャガチャ言うんじゃねーぞ
156.20000000000002,158.20000000000002,当時から心痛めてたんだろうな
158.20000000000002,160.20000000000002,私って人気ないのかもしれない
160.20000000000002,162.20000000000002,私って人気ないのかもしれない
162.20000000000002,164.20000000000002,俺はひとえが一番好きだったよ
164.20000000000002,166.20000000000002,タレントから政治家になるやつってゴミしかいない
168.20000000000002,170.20000000000002,優秀な人いるんじゃないの
170.20000000000002,172.20000000000002,俺は知らないだけで
172.20000000000002,174.20000000000002,あれ頑張ってたじゃん
174.60000000000002,176.60000000000002,スピードのボーカルが
176.60000000000002,178.60000000000002,自由民主党最高ですか
178.60000000000002,180.60000000000002,みたいなこと言ってたじゃん
182.60000000000002,184.60000000000002,スピード
184.60000000000002,186.60000000000002,本当に今日ずっと聞いてたわ
186.60000000000002,188.60000000000002,スピード
188.60000000000002,190.60000000000002,最近ああいうやついないよな
192.60000000000002,194.60000000000002,AKBとかじゃ違うんだよな
194.60000000000002,196.60000000000002,俺の中で
196.60000000000002,198.60000000000002,何か違う
198.60000000000002,200.60000000000002,元気の良さというかね
201.0,203.0,スピードのボーカルと
203.0,205.0,筒子どっちが凄いの
205.0,207.0,当時だったら
207.0,209.0,スピードの方が凄かったけど
209.0,211.0,今のレベルで言うと
211.0,213.0,筒子の方が若干上だね
213.0,215.0,若干上
215.0,217.0,連邦同士だ
217.0,219.0,なんでそんなに
219.0,221.0,開始5分で政治の話しなきゃいけないんだよ
221.0,223.0,なんか最近問題になってたね
223.0,225.0,二重国籍がアーダコーダー
225.0,227.0,二重国籍じゃないのか
227.0,229.0,国籍がアーダコーダーみたいな
231.0,233.0,言ってましたよね
235.0,237.0,俺はなんか
237.0,239.0,よく分かんないけど
239.0,241.0,台湾国籍だけど
241.0,243.0,なんか違いますって
243.0,245.0,言ってたってことでしょ
245.0,247.0,嘘つかなきゃいいのにね
247.0,249.0,政治家って多分嘘ついちゃダメじゃん
249.0,251.0,台湾国籍って別に悪いことじゃねえのにさ
251.0,253.0,なんで嘘ついてたんだろうっていう
253.0,255.0,まあよう分かりませんが俺は
255.0,257.0,とにかく今日は皆さんに
257.0,259.0,スピードの良さを
259.4,261.4,伝えに来ました
261.4,263.4,もっと明るい可愛い音楽聞こうぜ
263.4,265.4,お前スピードの歌弾いたことねえだろ
265.4,267.4,めちゃめちゃいい歌だぞ
267.4,269.4,台湾は国じゃないって
269.4,271.4,言った方が問題
271.4,273.4,連邦そんなに激しいこと
273.4,275.4,言うようになったの
275.4,277.4,すげえな
281.4,283.4,すげえ
283.4,285.4,台湾がキレてんの
285.4,287.4,せっかく仲良しなのにさ
287.8,289.8,東大館がさ
289.8,291.8,日本と台湾のさ
291.8,293.8,架け橋となってさ
293.8,295.8,仲良しなのにさ
295.8,297.8,みんな世界中がさ
297.8,299.8,台湾のことチャイニーズ台北って言うんだよ
299.8,301.8,俺たちはチャイニーズじゃねえ
301.8,303.8,つって
303.8,305.8,日本だけなんだよ台湾つってんの
305.8,307.8,だけってことじゃねえけどだから台湾人は
307.8,309.8,日本のことが好きっていう風に
309.8,311.8,俺は認識してます
311.8,313.8,外国人が日本の政治しきったら
313.8,315.8,日本乗っ取られるやん
316.2,318.2,ルール乗っ取ってやったら別にどうでもいいんじゃないの
318.2,320.2,嘘つかなきゃよかったのにね
320.2,322.2,そうですけど私台湾人ですけどって言えばいいのに
324.2,326.2,言えばええのに
326.2,328.2,でも日本は台湾のこと
328.2,330.2,国って認めてないぞ
330.2,332.2,台湾情勢は一体どういう風になってんの
332.2,334.2,台湾って国って認められてないの
334.2,336.2,台湾人は9割韓民族だと
336.2,338.2,まあそうだよね
338.2,340.2,要はさ逃げてきたんだよね
340.2,342.2,中国からシルクロードのなんか宝を買っ払って
342.2,344.2,逃げてきた民族って俺は
344.59999999999997,346.59999999999997,だからなんかシルクロードの終着点で
346.59999999999997,348.59999999999997,なんかいろいろ
350.59999999999997,352.59999999999997,ヨーロッパとかの宝物とかが
352.59999999999997,354.59999999999997,あったのにもかかわらず
354.59999999999997,356.59999999999997,なんか逃げてきて
356.59999999999997,358.59999999999997,古旧博物館みたいなのを建てて
358.59999999999997,360.59999999999997,あの
360.59999999999997,362.59999999999997,観光客がそれ見て
362.59999999999997,364.59999999999997,すげえって
364.59999999999997,366.59999999999997,俺台湾この前っていうか家族で旅行行った時にさ
366.59999999999997,368.59999999999997,うちのお父さん
368.59999999999997,370.59999999999997,まあ自称大工だから
370.59999999999997,372.59999999999997,そういう建築物とかに興味があって
373.0,375.0,歴史的なね
375.0,377.0,文化遺産がすごい眠っている
377.0,379.0,博物館があるから順一一緒に行くぞって言われて
379.0,381.0,一緒に行ったわけよ
381.0,383.0,やっぱそういうところって雰囲気大事にしたいじゃん
383.0,385.0,雰囲気
385.0,387.0,雰囲気大事にしたくない
387.0,389.0,すごいちょっとさ
389.0,391.0,ボロボロっていうかさ
391.0,393.0,歴史を感じたいのにもかかわらずさ
393.0,395.0,はいじゃあみなさんヘッドホンしてくださーい
395.0,397.0,つってヘッドホンしたら
397.0,399.0,右から中国語左から日本語が流れてきて
399.0,401.0,ウィーサンソインナーみたいな感じのやつが
401.0,403.0,左から流れてきて左から心た
403.0,405.0,この博物館だよなー
405.0,407.0,みたいなすごいさ
407.0,409.0,近代的な
409.0,411.0,作りになっててそれがクソなやつだわ
411.0,413.0,中川家の霊師みたいなこと
413.0,415.0,ずーっと言ってたさ右耳で
415.0,417.0,そんな古今博物館みなさん
417.0,419.0,ぜひ
419.0,421.0,お越しください
421.0,423.0,もうちょっとなんか
423.0,425.0,雰囲気大事にしてほしいよな
425.0,427.0,もう少し
427.0,429.0,なんのさ雰囲気の
429.0,431.0,かけらもねーんだよ
431.0,433.0,テレビ見てるみたいな感じで
433.0,435.0,テレビ見てる
435.0,437.0,みたいな感じだったね
437.0,439.0,甘酸っぱい思い出もあります
439.0,441.0,お台湾人も台湾来てるじゃん
441.0,443.0,バカが
443.0,445.0,バカも
445.0,447.0,見に来てないって
447.0,449.0,お前台湾支部の代表として
449.0,451.0,日本にすげー奴がいるらしいからつって
451.0,453.0,俺たちの仲間がいるにだ
453.0,455.0,つっていっぱい連れてきてくれ
455.0,457.0,7000人ぐらい水増ししていこうぜ
457.0,459.0,海外から
459.0,461.0,しかも何書いてるかどうせわかんないんだからさ
461.0,463.0,俺も何言ってるかわかんないから有効的になれるだろ
463.0,465.0,あいつらもすげー
465.0,467.0,あのヤマピとかの顔写真使ってさ
467.0,469.0,なんかその台湾から
469.0,471.0,こういう人が放送してるらしいよつって
471.0,473.0,もっとやっぱ俺はグローバルにいきたいわけよ
473.0,475.0,グローバルに
475.0,477.0,うちのコミュニティは移民も国籍問わず
477.0,479.0,受け入れていきますんで
479.0,481.0,人殺し以外の犯罪
481.0,483.0,すべて許して俺は
483.0,485.0,受け入れていこうと思ってるんで
485.0,487.0,よろしくお願いします
487.0,489.0,あいつら日本語わかるぞ
489.0,491.0,あそうなんだ
491.0,493.0,なんで?
493.0,495.0,わかんないでしょ
495.0,497.0,あの人たちで喋ってるのって
497.0,499.0,中国語でしょ
499.0,501.0,中国語と英語か
501.0,503.0,日本好きだよね
503.0,505.0,だからそのファッション
505.0,507.0,なんていうの
507.0,509.0,路上にあるセレクトショップとか回ってて
509.0,511.0,すごいやっぱ女の子とかから
511.0,513.0,あれ日本の方なんですかって声かけられるよ
513.0,515.0,日本人とかは日本語結構喋れる人いるんだよね
515.0,517.0,韓国好きの女ってどう思う?
519.0,521.0,うーん
521.0,523.0,俺がこの世で一番好きじゃないかな
523.0,525.0,いや別にさ
525.0,527.0,あの
527.0,529.0,なんかなんで
529.0,531.0,なんでかわかんないっていうか
531.0,533.0,別に
533.0,535.0,アメリカ大好きとか
535.0,537.0,レゲエマジ神みたいなやつはわかるのね
537.0,539.0,でもさ韓国人と日本人ってさ
539.0,541.0,見た目に対して
541.0,543.0,違いもねえしさ
543.0,545.0,場所も近いしさ
545.0,547.0,そんな憧れる必要があるのかな
547.0,549.0,っていう風に思っちゃうんだよな
549.0,551.0,ちなみにうちのお母さんも冬のソナタ大好きです
551.0,553.0,うちのお父さんは
553.0,555.0,韓国の歴史のドラマ
555.0,557.0,ずーっと見てるからね
557.0,559.0,家帰ると
559.0,561.0,金もねえのにさお母さんの財布から盗んだ
561.0,563.0,70万で買った
563.0,565.0,80インチくらいのテレビをさ
565.0,567.0,ドカーンと置いて森林の中で
567.0,569.0,ずーっとテレビ見てます
569.0,571.0,お母さんの財布から買っ払ったお金で買ったテレビで
573.0,575.0,朝から晩まで
575.0,577.0,韓国の
577.0,579.0,歴史のドラマ
579.0,581.0,っていうのがあるらしいんだよ
581.0,583.0,わかんねえけど俺
583.0,585.0,うちの親父も韓国の吸血のドラマ見てんだ
585.0,587.0,あれなんなんだろうね
587.0,589.0,日本のドラマ見ないで韓国のドラマ見る
589.0,591.0,あの親父
591.0,593.0,おばさんたち
593.0,595.0,あれなんなんだろうな
595.0,597.0,若者ってそんなに見ないでしょ
599.0,601.0,見る?
601.0,603.0,あれ見たけど
603.0,605.0,俺悪魔がいただっけ
605.0,607.0,E病本のさ
607.0,609.0,E病本のさ
609.0,611.0,なんか4時間くらいの
611.0,613.0,映画あれは面白かったけど
613.0,615.0,他になんか
615.0,617.0,これといって
617.0,619.0,ハマるものってなかったんだよな
619.0,621.0,なんかさ
621.0,623.0,もう演技くさくて
625.0,627.0,韓国のドラマって演技くさくて
627.0,629.0,真似できないけどさ
629.0,631.0,わかるでしょ
631.0,633.0,自然じゃなくない?
633.0,635.0,舞台見てるみたいな感じで
635.0,637.0,昔の日本のドラマ
637.0,639.0,あー
639.0,641.0,だから好きなのか
641.0,643.0,ジジイババアは
643.0,645.0,Jポップより
645.0,647.0,Kポップの方が
647.0,649.0,良いの
649.0,651.0,別になんか
651.0,653.0,俺どっちでもいいわ
653.0,655.0,どっちでもいいわ
655.0,657.0,広報新規とかってKポップっていうの
659.0,661.0,なんかあんなさ
661.0,663.0,変な日本語で歌うんだったらさ
663.0,665.0,普通に韓国で歌えばいいんだって
665.0,667.0,思っちゃうんだよな
667.0,669.0,すごい気になる
669.0,671.0,気になっちゃう
671.0,673.0,映画面白いんだだからうちの親父も
673.0,675.0,アホみたいに見てるんだ
675.0,677.0,無理して
677.0,679.0,日本語で歌ってんじゃん
679.0,681.0,無理して
681.0,683.0,カンナムスタイルとかいいなって思うけど
683.0,685.0,それアメリカ人も思ってるよ
685.0,687.0,別にだからアメリカで売れてないじゃん
687.0,689.0,日本の歌手なんて
689.0,691.0,スキヤキぐらいでしょ
691.0,693.0,オリコンチャート1位取ったの
693.0,695.0,あれめっちゃいい歌じゃん
695.0,697.0,あれって英語で歌ってないでしょ
697.0,699.0,上を向いて歩こうって
699.0,701.0,坂本球ちゃんがさ
701.0,703.0,アメリカのビルボードランキングだっけ
705.0,707.0,で唯一日本人で1位取ったことがある
707.0,709.0,人が坂本球って
709.0,711.0,飛行機事故で死んじゃった人
711.0,713.0,カバンされてんだ
713.0,715.0,でなんかあれなんだよね
715.0,717.0,いい歌だからアメリカで出しましょうって
717.0,719.0,言った時に会議
719.0,721.0,してた時にスキヤキ食べてたから
721.0,723.0,スキヤキでってなったんだよね
723.0,725.0,ふざけんなって感じだよね
725.0,727.0,どんだけ日本舐められてんだよ
727.0,729.0,日本航空123便墜落事故だっけ
731.0,733.0,あれに球ちゃん乗ってたってすげーよな
733.0,735.0,球ちゃんって言ったらまるで牧師の方じゃない
737.0,739.0,球ちゃんの
739.0,741.0,すいません
745.0,747.0,マラソンじゃねーぞ
751.0,753.0,山下達郎
753.0,755.0,マジでいいよな
759.0,761.0,みたいな歌んじゃん
761.0,763.0,あれなんだっけ
763.0,765.0,あれ山下達郎だよね
765.0,767.0,区別つかねーんだよ
767.0,769.0,井上洋水と山下達郎って
769.0,771.0,名前統一してほしいわ
771.0,773.0,わかんねーから
773.0,775.0,2人とも大抵いい歌出すんだよ
775.0,777.0,だからどっちでもいいっていう
777.0,779.0,にわか俺みたいなにわかは
779.0,781.0,別にどっちでもいいんだよ
783.0,785.0,髪型なんか
785.0,787.0,粉木ジジイみたいな方が山下達郎で
787.0,789.0,あれだよね
789.0,791.0,天然パーマの方が井上洋水だよね
791.0,793.0,俺わかんねーんだよ
793.0,795.0,2人ともなんか俺のツボを
795.0,797.0,刺激する最高の歌を出すっていう
797.0,799.0,共通点はそれしかない
799.0,801.0,竹内マリアの旦那が山下
801.0,803.0,そうなの
803.0,805.0,そうなんだ
805.0,807.0,あ旋律似てるね
807.0,809.0,旋律似てるわ
809.0,811.0,なんかそういう
813.0,815.0,CDとか最近
815.0,817.0,見かけねーな
817.0,819.0,見かけねーだけで本当は出してんだろうな
819.0,821.0,いい歌とか
821.0,823.0,売れるCDはEXILEとAKBと
825.0,827.0,嵐
827.0,829.0,嵐なんだよな
829.0,831.0,結局
831.0,833.0,悲しい時代になりました
833.0,835.0,悲しい時代に
835.0,837.0,アンテナ広げてきゃ
837.0,839.0,あんま俺歌興味ねーからさ
839.0,841.0,テレビとかのCMで聞こえてくる歌が
841.0,843.0,俺の中では全てだからさ
843.0,845.0,AKBも売上が落ちてるんだ
845.0,847.0,でも100万枚とか売ってるんでしょ
847.0,849.0,100万枚
849.0,851.0,売ってんじゃないの
851.0,853.0,売ってないの
853.0,855.0,嵐売れてるでしょ
855.0,857.0,相当だって
857.0,859.0,テレビだって
859.0,861.0,めちゃくちゃ
861.0,863.0,あれじゃん
863.0,865.0,出てるじゃんまだ
865.0,867.0,めちゃくちゃ出てるじゃん
867.0,869.0,あの人たち消えないよね
871.0,873.0,2007だってさ
873.0,875.0,俺がニコ生やり始めた時から
875.0,877.0,俺AKBの悪口言ってた気がするから
877.0,879.0,7年くらい売れてんだぜ
879.0,881.0,すごくねえか
881.0,883.0,今時CDなんて
883.0,885.0,ドルおたかアニオタしか買わないかわいそうだよ
885.0,887.0,俺も買わねえけどさ
887.0,889.0,なんかいい歌聞けてねえんじゃねえか
889.0,891.0,心配になるわ
891.0,893.0,最近の
893.0,895.0,最近の子供たち何聞いてんだろうな
895.0,897.0,歌ってみたとか聞いてんだろうな
897.0,899.0,しょうもないそんなゴミみてえな
899.0,901.0,なんかそんなさ
903.0,905.0,最近の歌ってみた
905.0,907.0,事情をちょっと俺たちで
907.0,909.0,ひも解いていこうぜ
909.0,911.0,ドリカムとか聞いてないでしょ
911.0,913.0,俺があれだよ
913.0,915.0,ドリカム聞きながら
915.0,917.0,最近の歌ってみた事情を
917.0,919.0,調べるわ
919.0,921.0,俺さ
921.0,923.0,一個さ今日みんなに聞きたいことがあったんだけどさ
923.0,925.0,あちょっとまて
925.0,927.0,それは
927.0,929.0,ある技法を聞きたいんだよね
929.0,931.0,あれ
931.0,933.0,あのさ
933.0,935.0,同じような小説をさ
935.0,937.0,何回も何回も歌って繰り返し歌うじゃん
937.0,939.0,でも最後の方だけ
939.0,941.0,なんかちょっと盛り上がるみたいな
941.0,943.0,あれなんだよ俺あれ好きなんだけど
945.0,947.0,ちょっとまて
947.0,949.0,スピードでそれをまず聞こう
949.0,951.0,てん
951.0,953.0,てんちょうっていうの
953.0,955.0,てんちょうっていうの
955.0,957.0,あれなんで最近あれしないのみんな
957.0,959.0,あれ古いのまさか
959.0,961.0,あれ古いの
961.0,963.0,そう
963.0,965.0,トゥモロネバーノートとかもそうじゃん
965.0,967.0,ダサいのあれ
967.0,969.0,あれダサいの
969.0,971.0,あの文化もっと
971.0,973.0,ちょっとまてな
973.0,975.0,聞いて
983.0,985.0,あちょっとまてこれ
985.0,987.0,あれじゃなんだっけ
987.0,989.0,俺
989.0,991.0,スピードでなんだっけな
999.0,1001.0,違うな
1007.0,1009.0,あこれこれ
1013.0,1015.0,あこれ
1015.0,1017.0,これ
1017.0,1019.0,これてんちょう
1019.0,1021.0,これてんちょう
1021.0,1023.0,これてんちょう
1023.0,1025.0,なんか違う
1025.0,1027.0,あれ前と違うみたいな
1027.0,1029.0,これてんちょうなんだ
1029.0,1031.0,また一つ
1033.0,1035.0,賢くなりました
1035.0,1037.0,ちょっとまてな
1043.0,1045.0,みんなにドリカム聞かせてやるからちゃんと
1047.0,1049.0,そう
1049.0,1051.0,ラスサビで半音上がるやつ
1053.0,1055.0,うーん
1055.0,1057.0,ドリカムといえば
1057.0,1059.0,これだな
1059.0,1061.0,これライブバージョンだからな
1065.0,1067.0,最近ドリカム何してんの
1067.0,1069.0,ニコ生とか見てんのかな
1069.0,1071.0,俺の放送見てんだろうな
1071.0,1073.0,緊張するわ多分ドリカム見てるから今
1073.0,1075.0,そういうプレッシャーもあるわけよ俺には
1075.0,1077.0,みんなはないでしょ
1077.0,1079.0,俺の放送ドリカム見てんだぜ
1079.0,1081.0,すげープレッシャーだよはっきり言って
1081.0,1083.0,絶対見てるの
1083.0,1085.0,俺言われたのね本人に見てるよって
1085.0,1087.0,これみんなには内緒にしたいけど
1087.0,1089.0,これガチだからね
1089.0,1091.0,だから俺プレッシャーなんだよね
1091.0,1093.0,ドリカム見てんだぜ俺の放送
1093.0,1095.0,ヌキさんは見てないって言ってた
1099.0,1101.0,ドリカム見てるのにヌキさんは見てないって言ってた
1101.0,1103.0,そういえば
1103.0,1105.0,ドリカム見てるんだから
1107.0,1109.0,俺これ見たわ
1109.0,1111.0,2ヶ月ぶりに鼻毛を抜いてみた
1113.0,1115.0,俺何見ようとしてんだっけ
1115.0,1117.0,ドリカムをまず流して
1123.0,1125.0,これライブバージョンだからな
1127.0,1129.0,カーバイン
1129.0,1131.0,俺ニコ生見るもんカーバインしかねーや
1133.0,1135.0,カーバイン
1137.0,1139.0,えー前回見たランキングで
1141.0,1143.0,歌ってみたとかねーのかよ
1143.0,1145.0,ララララララ
1145.0,1147.0,えー
1159.0,1161.0,いいね
1167.0,1169.0,ちょっと待ってな
1171.0,1173.0,最近歌ってみた事情
1175.0,1177.0,調べようぜみんなで
1183.0,1185.0,えー1位
1185.0,1187.0,前前前世で
1187.0,1189.0,古参高音歌い手と
1189.0,1191.0,新参低音歌い手が
1191.0,1193.0,入れ替わった結果
1193.0,1195.0,うーん
1197.0,1199.0,死者を冒涜してる最低段
1199.0,1201.0,これもうNG死者を冒涜してるから
1201.0,1203.0,こういうなんか
1203.0,1205.0,死をもてあそぶやつは
1205.0,1207.0,俺ほんと最低だと思う
1207.0,1209.0,あんなんかこういうところがダメなんだよ
1209.0,1211.0,歌ってみたの
1211.0,1213.0,あの子どこの子歌った
1215.0,1217.0,うーん
1217.0,1219.0,よわからん
1219.0,1221.0,パラディッサス
1221.0,1223.0,パラ
1223.0,1225.0,ドクサム歌ってみた
1227.0,1229.0,2位の人うまい?
1229.0,1231.0,お前ドリカム流してる俺に言えんのか
1231.0,1233.0,これ聞いてみるじゃん
1235.0,1237.0,ドリカムさん待っててください
1237.0,1239.0,お前ドリカム待たせてさ
1239.0,1241.0,お前ドリカム待たせて聞くんだからな
1241.0,1243.0,うーん
1257.0,1259.0,女の子じゃないんだ
1263.0,1265.0,えなんかさ誰かに似てない?
1265.0,1267.0,誰かに似てない?
1267.0,1269.0,誰かに似てない?
1269.0,1271.0,誰かに似てない?
1275.0,1277.0,あとアジアンカムジェネル似てない?
1287.0,1289.0,あとダソクに似てるなちょっと
1289.0,1291.0,うーん
1291.0,1293.0,なんか俺わかんねえんだよ
1293.0,1295.0,なんかさ
1295.0,1297.0,早
1297.0,1299.0,未来予想図とか歌ってくるんだよ
1303.0,1305.0,日本語に聞かれねえんだよ
1305.0,1307.0,本気で
1307.0,1309.0,ちゃんと日本の歌歌ってほしい
1309.0,1311.0,わかんねえじゃんこんなの歌れても
1311.0,1313.0,もっと俺にもわかるような
1313.0,1315.0,聞かせる気がねえんだろうな
1315.0,1317.0,最近の歌っていうのは
1317.0,1319.0,俺みたいな
1319.0,1321.0,にわかに響かせるような歌を歌わなきゃ
1321.0,1323.0,あの子どこの子ってめっちゃ流行ってんだ
1325.0,1327.0,流行ってんだねえ
1327.0,1329.0,あの子どこの子
1329.0,1331.0,流行ってるんだねえ
1333.0,1335.0,公式歌いてよ
1335.0,1337.0,今度は本当の
1339.0,1341.0,公式歌いてよ
1341.0,1343.0,今度は本当のミックスしに
1343.0,1345.0,ミックスしてもらった
1345.0,1347.0,うーんちょっとよくわかんねえな
1347.0,1349.0,これなんかあれか
1349.0,1351.0,ネタみたいな感じ
1351.0,1353.0,ネタみたいな感じ
1355.0,1357.0,うーん
1357.0,1359.0,なんか
1359.0,1361.0,わかんねえんだよ
1361.0,1363.0,こいつさ
1363.0,1365.0,難しいじゃん全部
1365.0,1367.0,わかりやすい歌ないの
1367.0,1369.0,あ
1369.0,1371.0,全然前世っていうのが流行ってんだ
1371.0,1373.0,聞いてみよう1位の人
1373.0,1375.0,全然前世で子参歌い
1375.0,1377.0,高音歌いというのと新参低音歌いというのが
1377.0,1379.0,入れ替わった結果
1385.0,1387.0,あーだめだ
1387.0,1389.0,俺これ聞けねえ
1389.0,1391.0,怪我されるやめよう
1391.0,1393.0,やめよう
1393.0,1395.0,これダメだ怪我されちゃう俺の
1395.0,1397.0,好きとか嫌い以前の問題だ
1397.0,1399.0,これダメだ俺はちょっと悪い
1399.0,1401.0,ギブ
1401.0,1403.0,これねえこの人は悪くない
1403.0,1405.0,俺の思い出を
