start,end,text
0.0,2.0,お前ら食い殺すぞっていう
2.56,7.04,ミラープレマの夏はでも夏でしょ?夏はなんか特別なんだよ 特別な俺たちの思い出
8.88,10.88,ミラープレマ相当盛り上がってるねー
11.200000000000001,14.48,俺も正直ねーあんまあんま気にしてないんだよやってる最中はね
15.200000000000001,17.36,でもねーそうなるとやっぱさすがに
18.8,21.6,テンション上がるんだよね マジだけどさ俺ね
21.92,26.400000000000002,あのモンスターファーム 正直俺今までの放送を振り返って一番自分なりによくできたなーっていうのが
26.400000000000002,29.28,モンスターファームの実況なんだけど 生放送でやった あれ何年前?
30.96,33.68,面白いゲームを面白く配信すれば可能 いやでも最近やっぱね
34.24,38.96,あのどんどんどんどん下が越えてくるから4年前か あれさ何も
39.76,41.76,ない あれをしてなくて4年前に
42.4,47.6,あれ4年前にしてなくてさ俺が今のこの状況でやって同じ展開になったらさ
48.32,50.32,すげーことになったと思わない?
50.32,52.32,あれがなかったら今の自分ではないけど
53.84,56.32,あれをさ全く真っさらな状態で
57.2,60.4,いや明日やりますちょうど土曜日今週の土曜日に
60.8,65.04,予約書くとってやりまーすみたいな感じで知らない状況で同じ流れで同じ実況できたらさ
65.6,67.6,すごいことになってたよね
71.04,73.36,まあなんかそんな過去のことを振り返っちゃよくねーけど
76.56,77.84,すごい
77.84,79.84,なんか最近うんこしながらそのこと思ったわ
80.24000000000001,83.28,うんこしながらちょうどうんこがオクレイマンみたいなボチャーンって落ちた時にさ
83.76,85.76,おなんか久々にオクレイマン
86.0,90.08000000000001,って頭によぎってさごめんなみんなとの清い思い出を俺のうんこで怪我して
90.64,95.36,完全になんかカッチカチのねるさんだったら悲鳴上げてるぐらいのでっかいうんこ出たのよこの前
95.92,97.92,カッチカチの水飲んでなかったから
98.4,100.4,ねるみたいなうんこ出たのね
100.72,104.08000000000001,本当に俺ねるさんと間違えて声かけるぐらいのねるみたいなうんこ出たの
104.72,107.84,それでなんかオクレイマンに出るのあの時あの放送なんか
108.32000000000001,110.32000000000001,今できたらよかったなーって
110.80000000000001,112.80000000000001,もっともっと面白いことしたよね
113.11999999999999,115.11999999999999,ポケゼン縛りの時もあれも
115.2,119.44,面白かったあれ業界視聴率ナンバーワンだと思ってるから自分なりにあれも面白かったよね
121.36,123.36,年に1回ぐらいはそういう放送したいなー
124.8,127.52,だって全力でやり続けないとその1個って生まれないじゃん
127.84,130.64,一生懸命やってつまんなかったって叩かれて次こそはつってやって
131.04,134.16,大した面白くできなくて次こそはってさ宣伝されていかないとさ
134.72,137.28,できないもんだから苦しいよねみんなも苦しいでしょ
137.84,139.84,でもいつか来るんじゃないかっていうさ
140.16,142.16,そういう期待感を込めてみてください俺の放送は
142.32,144.07999999999998,期待感を込めて
144.07999999999998,146.4,ちなみに次はユキンコ大戦争クラスの方あの
147.84,149.84,出番だなって思ってます
150.96,153.04,出番はそれだなって思ってます
156.07999999999998,157.76,ああいう2のな
157.76,159.76,2を2が楽しめる
160.72,161.84,放送をね
161.84,164.56,短く太い放送にしよういやーなんかそれじゃ面白くねーんだよ
165.12,167.12,太く長くやりたいじゃん
167.12,168.56,絞りを
168.56,171.76,ギューってでも最近なんかでも貯金残高が結構あるんだよな
173.12,177.35999999999999,こういう放送やりたいこういう放送やりたいっていうのが比較的あるから
180.0,182.0,なんかまあ
182.0,184.0,できてるなーっていう
184.0,186.0,そういう時ってダメなんだよね結局
186.4,188.32,俺夏個人的にね
188.32,191.04,自分の配信人生の中で一番良かったのね
191.51999999999998,193.51999999999998,こんなこと自分で言うのおかしい話なんだけど
193.6,196.8,今年の夏って正直異常だったのね俺的には人も見てくれて
197.28,199.6,内容も正直面白かったんだよ俺的には
200.07999999999998,202.07999999999998,あれ以上は出せなかったのね
203.12,207.12,だからそこの集客をなんかみんな基準にしたら
207.12,209.12,もうおかしい話になっちゃうんだよな
209.12,211.12,だってさ俺ね全部見返したんだけど
211.12,213.12,ラストオブアスとかめちゃくちゃ面白いよ
213.12,215.12,ちょもう一回見てくんないみんな
215.12,217.12,もう一回見て今日刑事番で俺のこと褒めてくんない
217.12,219.12,ちょ今日さ早めに終わるからさみんなラストアス見てくんない
219.12,221.12,マジで面白いからあれ
221.12,223.12,あの時の俺
227.12,229.12,なんかねあの
230.08,232.08,まあみんな見てっていう前提で
232.08,234.08,あの話すけどさ
234.08,236.08,テスが死んだ時に
236.08,238.08,俺なんかおかしくて別にそんな
238.08,240.08,こいつ死んでも別に悲しくねーよみたいな感じで
240.08,242.08,レンガで一人で笑ってたのね
242.08,244.08,でその時にラストオブアス好きなやつから
244.08,246.08,わーって叩かれたんだけど
246.08,248.08,俺そのコメントもうすでに見えてなくて
248.08,250.08,もう自分の中で楽しさが完結してて
250.08,252.08,ああいう時って面白いんだよな
252.08,254.08,あれちょっとさ
254.08,256.08,もう一回見返してくんない
256.08,258.08,あれほんとゾーンに入ってるし久々にね
258.08,260.08,あのーコメントってやっぱ気になるわけよ
260.08,262.08,配信してると動画あのー
262.08,264.08,実況してると
264.08,266.08,いやあの時の俺ああもう一回味わいたいわ
266.08,268.08,もううっせーバーガー野郎
268.08,270.08,デメーランガンガン勝手に見とけよバーガーつって
270.08,272.08,おめー俺のこと見れてるだけでお前
272.08,274.08,ありがたいや苦手っすねバーガーと思いながら
274.08,276.08,こんなクソオブアス死んでもっと
276.08,278.08,ワケ女がいいだろうがよ女が40超えたらゴミだろうがよ
278.08,280.08,ぐらいのスタンスでやってたから
280.08,282.08,ああいう時ってもう無敵なんだよね
282.08,284.08,何言われても別に関係ないっていう
285.08,287.08,なかなかああいう境地には
287.08,289.08,あれ寝不足かつ声がもう
289.08,291.08,限界でネタもなくて
291.08,293.08,笑おもすがる思いでやった
293.08,295.08,なんかクレイジー完全にキチガイだったね
295.08,297.08,あの時の俺はあれちょっともう一回味わいたいわ
297.08,299.08,追い込まなきゃできないね
299.08,301.08,ウォーキングデッドも面白かった9月も面白かったんだよ
301.08,303.08,ゆうなまとか正直めっちゃ面白かったし
303.08,305.08,ただなんか9月あんま雑談できなかったんだよな
305.08,307.08,なんか雑談と企画ちょっと増やしたいな
307.08,309.08,10月は
311.08,313.08,思います映画のところそんな面白いか
313.08,315.08,見てて多分みんなあんまり
315.08,317.08,何言ってんだろうなんでこの人ゲームに集中しないんだろう
317.08,319.08,っていうさ
319.08,321.08,俺の言葉で言い表すと
321.08,323.08,オブラートにちゃんと包んで言わなきゃいけないけど
323.08,325.08,キチガイバカがいるわけじゃんそういう
325.08,327.08,ゲームに熱中してる
327.08,329.08,そいつ達のことも俺は大事だと思って
329.08,331.08,大事だと思ってないんだよ別に勝手にコメントしとけよバカ
331.08,333.08,って思いながらやってんだけど俺は普段
333.08,335.08,てめえらに目線合わせなきゃいけないんだって
335.08,337.08,本心では思ってるわけよでもそれって別にみんなは
337.08,339.08,スッカッとコメントしていいから俺は
339.08,341.08,俺が拾うか拾わないかは俺に決めさせて
341.08,343.08,別にみんな好きにコメントしていいよって普段のね
343.08,345.08,あのノリじゃんそれは
347.08,349.08,でもああいうのってねやってて面白いんだよ
349.08,351.08,やってて
351.08,353.08,俺天野尺なんだろうな
353.08,355.08,うーん
355.08,357.08,でも個人的にはすごい面白かった
357.08,359.08,あれは
359.08,361.08,やっぱ気使うわけよ
361.08,363.08,人に見てほしいしさみんなに認められたい
363.08,365.08,っていうのが潜在的にすごいあるでしょ
365.08,367.08,どんなスタイルでやってるの天野氏とかでも
367.08,369.08,だからなんか
369.08,371.08,ちょっとは媚び売るわけみんなに
371.08,373.08,いやマジで面白い
373.08,375.08,みたいな感じで言うわけよ
375.08,377.08,でも俺心の中で鉄をレンガで殺したいのね
377.08,379.08,でいつもそれを我慢するわけ
379.08,381.08,いやでもこんなラスラスなんて名作だから
381.08,383.08,あんまきちがいみたいなことやるとバカが騒ぎ出すから
383.08,385.08,ちょっとそれは我慢しよう
385.08,387.08,でも俺は本当はレンガで鉄を殺したいんだ
387.08,389.08,っていう気持ちを抑えながらやってたんだけど
389.08,391.08,あの時に俺はもう出したからさ
391.08,393.08,たまにはああいう時も必要なんだよな
393.08,395.08,たまには
395.08,397.08,なんだよそのジョイロとやってみたくないみんなも
397.08,399.08,あんなにすごい名作で
399.08,401.08,ファンが付いてるのに
401.08,403.08,俺の一存で
403.08,405.08,その思いをぶっ壊してみたくなるときない?
405.08,407.08,電車のさ
407.08,409.08,黄色い線の内側に立って
409.08,411.08,あのあと10センチ
411.08,413.08,俺が前に出たら俺は死ぬんだみたいな
413.08,415.08,あるでしょ
415.08,417.08,そういう衝動に駆られるとき
417.08,419.08,そういう時期なんだ
419.08,421.08,わいわ
421.08,423.08,見てくれ
423.08,425.08,貴様らも主らも
425.08,427.08,それってサイコパスの圧倒らしいよ
427.08,429.08,でも現実世界では
429.08,431.08,出さないようにしなきゃいけないな
431.08,433.08,現実世界では
433.08,435.08,出さなきゃいけないよな
435.08,437.08,偉い人と喋ってるときに殴ったらどうなるんだろう
437.08,439.08,俺黒人さんと喋ってるときそうなんだよね
439.08,441.08,こいつ殴ったらどうなるんだろうって
441.08,443.08,俺もう心の中で黒人さんのことこいつと言ってるから
443.08,445.08,今こいつにグーパンチしたら石川と喋ってるときにさ
445.08,447.08,今なんの前振りもなく
447.08,449.08,黒人さんぶっ殴ったらどうなるんだろうみたいな
449.08,451.08,許してくれるのか
451.08,453.08,それとも発狂するのか
453.08,455.08,俺は思ってんだよ
455.08,457.08,いつも
457.08,459.08,揺れ動いてる
463.08,465.08,揺れ動く瞬間あるでしょ
465.08,467.08,みんなも
467.08,469.08,わかるでしょ
469.08,471.08,わかるでしょ
471.08,473.08,何を許すんだよ
473.08,475.08,そういう衝動を持っていることを許してくれ
475.08,477.08,この前釣り行ったときもさ
477.08,479.08,フグ釣ったんだよ
479.08,481.08,俺絶対人がいなかったら
481.08,483.08,頭こすってフグにこんじゃ焼きしてたら
483.08,485.08,おーい抹茶いい灰皿できたよ
485.08,487.08,って言って頭バチンって
487.08,489.08,放送会で俺そういう事やってるから
489.08,491.08,灰皿持ってきてねーから路上で釣っても
491.08,493.08,パーンってフグを頭で気絶さ
493.08,495.08,口ポッカーって開いたところに
495.08,497.08,そこ灰皿に
497.08,499.08,するわけ
499.08,501.08,見せらんないじゃん俺が見せたいんだよ
501.08,503.08,俺の裏の顔も裏の裏まで
505.08,507.08,燃やすじゃんみんな
507.08,509.08,別にそんなのいいじゃん人間が一番偉いんだし
509.08,511.08,俺は思ってるよ人間が一番偉いんだ
511.08,513.0799999999999,俺フグより偉いと思ってるからね
513.0799999999999,515.0799999999999,フグを殺したところで
515.0799999999999,517.0799999999999,動物愛護団体がなんかなんで動物なんだ
517.0799999999999,519.0799999999999,動物を殺すんじゃねーみたいなこと言ってきて
519.0799999999999,521.0799999999999,うるせーバカ野郎って俺は思ってるんだけど
521.0799999999999,523.0799999999999,俺はね世間体を気にして俺も大人だろ
523.0799999999999,525.0799999999999,本当は
525.0799999999999,527.0799999999999,だって俺がもし放送中にフグ殺して
527.0799999999999,529.0799999999999,それを灰皿にして歩き煙草散ったら面白いと思うんだよ
529.0799999999999,531.0799999999999,俺はそういうのが面白いと思っちゃう人間なのね
531.0799999999999,533.0799999999999,だから燃やすだろ
533.0799999999999,535.0799999999999,バカどもが
535.0799999999999,537.0799999999999,フグだってそうだよブランキと食ってんだろ
537.08,539.08,頭バチーン
539.08,541.08,ってやったときのさ
541.08,543.08,必要以上にマイシャンみたいな吐く気出すんだよフグって
543.08,545.08,びっくりしたよ
545.08,547.08,あいつらさ顎の力がクソ強くて
547.08,549.08,針噛んでおるのね
549.08,551.08,そういう憎しみをさ
551.08,553.08,コフグ
553.08,555.08,親指大のコフグにバーンって
555.08,557.08,おいまっちゃんまた灰皿釣るのよー
557.08,559.08,釣りゃいいね頭でさ
559.08,561.08,あのー
561.08,563.08,なんだっけあいつ
563.08,565.08,カメゴロウがさイノシシ殺すときと
565.08,567.08,同じみたいに頭バチーン
567.08,569.08,尻尾持って頭引っ叩くと
569.08,571.08,ベッコーンってマイシャンみたいな吐く気出すんだね
571.08,573.08,それがちょうどいい灰皿だるわけ
573.08,575.08,ジュー
575.08,577.08,びっくりしたよ
577.08,579.08,wwww
579.08,581.08,今のところ編集でカットしてくれ
581.08,583.08,ジジイマジンガー
585.08,587.08,これ以上俺の効果能力下げるわけにいかない
587.08,589.08,こいつ裏でそんなことやってんのかよ
589.08,591.08,びっくりしたよ
591.08,593.08,うんこだやめてくれ
593.08,595.08,こんにゃくこんにゃくって呼んでる俺はその現象
595.08,597.08,動物の声が
597.08,599.08,いねーだろなかなかそんな動物と
599.08,601.08,あのー目線合わせられるやつ
601.08,603.08,ジジイマジンジョーと今のところ上手いこと
603.08,605.08,なんか
609.08,611.08,俺がゴミ拾いしてるマッドとなんか
611.08,613.08,合わせといてくれオフレコでよろしく
615.08,617.08,本当なんだもん
619.08,621.08,でもいいじゃん別に
621.08,623.08,なんでやってんだもん悪いことだって認識してるんだから
623.08,625.08,じゃあ謝りますごめんなさいフグの
625.08,627.08,あの好きな方々
627.08,629.08,ニコラジでやれ
629.08,631.08,お前そんなことしちゃうね
631.08,633.08,ニコラジ押されたら
633.08,635.08,警察にそんなことやって捕まったら
635.08,637.08,超カッコ悪いぞ
637.08,639.08,フグ殺して警察に捕まったら
639.08,641.08,前代未聞だぜ俺親になんて呼べんの
641.08,643.08,なんであんた警察のせいになったの
643.08,645.08,いや俺さセリッタフグをさ虐待してたら
645.08,647.08,パクられちゃったんだよね
647.08,649.08,下手すりゃパクられるぞ映像に載せたら
649.08,651.08,それさじ加減を大事にしなきゃいけないんだよ
651.08,653.08,さじ加減をバカどもが
653.08,655.08,俺は見慣れー何年見てんだ俺の放送
655.08,657.08,"7,8年見てんだろうが"
659.08,661.08,おめえらもフグみたいにすんだあの時の
661.08,663.08,俺はもう
663.08,665.08,よく言うだろテレビのニュースとかで
665.08,667.08,この衝動が
667.08,669.08,人に向かうの絶対伝わられるぞ
669.08,671.08,俺がもし人殺した時にさ
671.08,673.08,彼はこんな供述をしており
673.08,675.08,なんかよく俺の視聴者とかがインタビュー受けてさ
675.08,677.08,この衝動が人に向けられるまでに
677.08,679.08,この時間はかからなかったみたいな
679.08,681.08,フジテレビあたりになんか
681.08,683.08,取り上げられるんだろ俺許さねーかんだ
687.08,689.08,俺は許さない
691.08,693.08,お茶の前は笑いに包まれるよ
693.08,695.08,まぁそれだったらいいんだけどなぁ
695.08,697.08,それだったら
697.08,699.08,それで笑うし
699.08,701.08,危ないし
701.08,703.08,オウム戦力をみたいな
703.08,705.08,報道のされ方すんだろうな
705.08,707.08,アナウンサーとかが
707.08,709.08,なんで彼らたちはこれで笑ってるんですか
709.08,711.08,俺がフグ殺してピチピチピチ
711.08,713.08,ハマちゃんしか笑ってくれないだろうな
713.08,715.08,ダウンタウンなうで紹介してほしいわ
715.08,717.08,ハッハッハー
717.08,719.08,うんこちゃんええな
719.08,721.08,よろしくお願いします
721.08,723.08,俺が出所した
723.08,725.08,あかつきには
725.08,727.08,よろしくお願いします
729.08,731.08,そういうなんか出方していくんでこれからは
731.08,733.08,背に腹は変えられない感じでいきます
735.08,737.08,ハッハッハ
739.08,741.08,面白いんだよ
741.08,743.08,もうここだけの話が面白いんだよ
743.08,745.08,マジで疲れたまってんじゃねーか
745.08,747.08,喋り足んなかったんだよ
747.08,749.08,喋り足らん
749.08,751.08,俺に話させろ
751.08,753.08,行き通りを
753.08,755.08,ここにぶつけることに
755.08,757.08,今日ゲームいいよゲームのノリじゃねーよ
757.08,759.08,もっとなんか
759.08,761.08,引くことを
761.08,763.08,俺の内なる今
763.08,765.08,10時が出せそうなんだよもう少しなんだって今
765.08,767.08,裏飯ゆうすけの気分
767.08,769.08,裏飯ゆうすけの気分です
769.08,771.08,動画あげてーなー
771.08,773.08,そういう気持ち高いんだけどね
775.08,777.08,動画あげてーわ
777.08,779.08,あげたいという気持ちが
779.08,781.08,前向きな気持ちがあることだけ
781.08,783.08,皆さんにお伝えしていきます
783.08,785.08,いいじゃないか今日やろうよ他のこと
785.08,787.08,なんだっけなんかいいやとりあえず10時半ぐらいまで
787.08,789.08,思いの丈をみんなでぶつけ合って
789.08,791.08,それで
791.08,793.08,そっから本腰入れよ
795.08,797.08,そっから本腰入れであります
797.08,799.08,母子家庭VS父子家庭
799.08,801.08,なんかもうちょっとなんか煮詰めたいんだよなー
801.08,803.08,煮詰めたい
805.08,807.08,妊婦前グランプリ
807.08,809.08,何を決めんの
809.08,811.08,嫁を決めんのうちのお母さんも参加してくるぞ
811.08,813.08,透析マジか今なんか
813.08,815.08,何の薬を飲んでるかみたいなので
815.08,817.08,なんか言いづらいわ
817.08,819.08,俺やっぱメント向かってさ
819.08,821.08,スカイプとかで喋っちゃうとさ
821.08,823.08,やっぱ気使うじゃんすごいやばいっすね
823.08,825.08,今頃肝臓真っ黒っすねとか言えねえじゃん
825.08,827.08,いやそうなんすよ
827.08,829.08,お前の腎臓お前のジンマジ真っ黒だぞ
829.08,831.08,血液がなんかね
831.08,833.08,届こうってお前
833.08,835.08,妊婦前のジン見たことねえだろ
835.08,837.08,自分がいざなってるけど真っ黒黒すけだぞとか言えねえじゃん
837.08,839.08,俺人体解剖さ
839.08,841.08,見たことあるから
841.08,843.08,真っ黒だぞ整理のパンツみたいになってるぞとか言えねえじゃん
843.08,845.08,絶対気づかないでしょ
845.08,847.08,いざさジュンちゃんはそういうキャラなんだってさ
847.08,849.08,トツしてきてもさお前の腎臓整理のパンツみたいになってるぞ
849.08,851.08,マッチャマッチャだろやったらさ
851.08,853.08,さすがにちょっと傷つくでしょ
853.08,855.08,別にそれを受け入れてくれるよっていう
855.08,857.08,人でトツしてくれるんだったら
857.08,859.08,俺は許すけど
859.08,861.08,そうはいかんいかんよ
861.08,863.08,危ねえ今なんか変なこと言いそうになった
863.08,865.08,なんかインプットされてるわ
865.08,867.08,俺が正解に打って出る
867.08,869.08,あれがバレるわ
869.08,871.08,正解にこいつ正解に打って出たいんじゃないかっていう
871.08,873.08,狙ってます
873.08,875.08,俺は
875.08,877.08,500年前のネタは
881.08,883.08,ギリギリのところだよ
883.08,885.08,そういうところかな
885.08,887.08,今日は不謹慎一辺倒でいこう
887.08,889.08,たまにはいいな
889.08,891.08,それでなんか取り上げられて
891.08,893.08,炎上しても俺は一切無視します
893.08,895.08,まじで
895.08,897.08,絶対俺じゃないっていう
897.08,899.08,俺が認めなかったら
899.08,901.08,絶対俺じゃないっていうルールを今
901.08,903.08,決めた
903.08,905.08,いやそれは俺じゃないっす
905.08,907.08,俺じゃないってことにしよう
907.08,909.08,そしたらなんか
911.08,913.08,そしたら俺多分逮捕されるだろうな
913.08,915.08,言葉だけで
915.08,917.08,一番かっこ悪いからね
917.08,919.08,ネット勉強でいきがって逮捕されると
919.08,921.08,長谷川豊が俺がくれるぞ
921.08,923.08,俺でもあれは許せなかったな
923.08,925.08,なんかもうちょっと言葉のチョイスあるだろうと思っちゃうわ
925.08,927.08,俺ですら言わねえよあんなこと
927.08,929.08,なんか放送で生放送とかでさ
929.08,931.08,言う分にはさ
931.08,933.08,悲しむ
933.08,935.08,人間がやっぱ出てきちゃうからね
935.08,937.08,やっぱ生理のパンツで
937.08,939.08,抹茶茶
939.08,941.08,バーサスなんか人工透析患者
941.08,943.08,殺すだったらやっぱ前者の方が
943.08,945.08,まだ笑ってくれる人いると思うんだよね
945.08,947.08,たぶん人不全患者が聞いたら
947.08,949.08,こいつふざけんなよってクレームくるだろうけど
949.08,951.08,なんかでもあれちょっと
951.08,953.08,俺ちゃんと詳細見たけど
953.08,955.08,スカンわ
955.08,957.08,あれは
957.08,959.08,あれはスカンわ
959.08,961.08,お前も似たようなこと言ってるだろ
961.08,963.08,でもあれ文字で言っちゃだめだよ
963.08,965.08,文字で言ったらあれは
965.08,967.08,俺が
967.08,969.08,放送でさ同じようなこと言うのとさ
969.08,971.08,文字に返して言うのって全然
971.08,973.08,違うじゃん
973.08,975.08,あれはでもありえないと思って
975.08,977.08,前代未聞だよね
977.08,979.08,言ってることってたぶんさ
979.08,981.08,自分の怠慢で
981.08,983.08,そういう風になってるやつに
983.08,985.08,なんで国民の欠税を払わないといけないんだ
985.08,987.08,っていう
987.08,989.08,それだったら死んじまえよ
989.08,991.08,っていう一生でしょ
991.08,993.08,ちょっとさニュアンスがさ言葉にするとずれるでしょ
993.08,995.08,透析患者なんてみんな死ねって
995.08,997.08,聞こえちゃうじゃんあれって
997.08,999.08,それ平らな生活して
999.08,1001.08,自分が悪いんだろ
1001.08,1003.08,そういう人たちは
1003.08,1005.08,健康保険を
1005.08,1007.08,1割でも2割でも3割でも
1007.08,1009.08,負担させた方がいいんじゃないのって
1009.08,1011.08,結構至極真っ当なことを言っちゃってる
1011.08,1013.08,部分もあるからなかなかさ
1013.08,1015.08,俺もなんか変なもやもやするんだけどさ
1015.08,1017.08,例えば自分がさ働きもせずにさ
1017.08,1019.08,あのーなんだろうな
1019.08,1021.08,透析って何でなる?酒の飲みすぎで
1021.08,1023.08,ならないよね透析って腎臓でしょ
1023.08,1025.08,何でなるんだろうなこれ分かんないけど
1025.08,1027.08,塩分取りすぎとか分かんないけど
1027.08,1029.08,そういうさ明らかに自分のせいで
1029.08,1031.08,なってんのにオンブンに断固だってんじゃねえぞ
1031.08,1033.08,って言うんだったら分かるけどさ
