start,end,text
1283.86,1288.82,ちょうど1000万乗るか乗らないかぐらいじゃない
1288.82,1290.94,だいたいそれぐらいだと思うよ
1290.94,1294.86,まあその寄るだろうけどね病院に
1294.86,1296.42,1000万くらいの野球選手って誰だ
1296.42,1300.18,うーんあいつ広島の今年ブレイクしたやつ
1300.18,1302.7,鈴木聖弥が1000万ぐらいじゃない
1302.7,1303.9,1500万ぐらいじゃない
1303.9,1306.3,1000万で年間120日休めたらいいと思う
1306.62,1309.34,休みなんか1日もないって本当に
1309.34,1313.02,マジで1日もないよ
1313.02,1315.98,基本月勤勤務で土曜日半日来て
1315.98,1317.94,そっから外に外勤行くのね
1317.94,1319.98,で日曜日自分の患者の様子見に来て
1319.98,1322.4199999999998,月曜日また日勤来るみたいな
1322.4199999999998,1325.3,あお声かマジだよ
1325.3,1330.46,そんで夏冬で1週間ぐらい休み取って
1330.46,1334.34,海外行くっていう感じかな
1334.34,1336.22,金使う暇ないだから女作るんだよ
1336.22,1340.42,みんな愛人作って風俗とかさ
1340.42,1343.1000000000001,キャバクラとかさ女に金落としてるよね
1343.1000000000001,1346.02,やっぱ先生たちはねそれが家庭持って
1346.02,1349.22,がっつり管理されてるか
1349.22,1350.58,なんでその激務で働けるの
1350.58,1353.06,やっぱステータスなんじゃないの
1353.06,1355.94,みんなやっぱ誇りを持ってやってんじゃない
1355.94,1357.22,先生先生って言われたら
1357.22,1359.82,やっぱ気分いいでしょ
1359.82,1362.06,それで1000万ってボーナスありで
1362.06,1364.3,ありきで考えたらマジで大したことないな
1364.34,1366.46,いやでもボーナスはもっと
1366.46,1369.62,あのすごいもらってる人はもらってるんじゃない
1369.62,1373.54,なんかその俺が働いてたところの
1373.54,1376.3,その部長さんが俺聞いたわけよ
1376.3,1377.3,先生いくらもらってるんですか
1377.3,1378.46,ぶっちゃけ言ったら
1378.46,1381.54,うーんまあ4、5000万かなって話してたの
1381.54,1382.8999999999999,部長って一番偉い人じゃん
1382.8999999999999,1386.8999999999999,その部署の顔じゃん
1386.8999999999999,1390.22,でどういう給料もらってんすかって聞いたの
1390.22,1392.62,4、5000万って2、3000万って言ってたかな
1392.62,1393.8999999999999,"4,000万ぐらいって言ってたかな"
1394.5,1396.7,どういう給料もらってんすかって聞いて
1396.7,1398.3000000000002,どういう感じでもらってんすかって言ったら
1398.3000000000002,1403.0600000000002,なんかうちの場合は意思が決められるって言ってて
1403.0600000000002,1405.18,だから俺は月100万ずつもらって
1405.18,1407.8200000000002,ボーナスで3000万もらってるって言ってた
1407.8200000000002,1410.3000000000002,意味わかんないくない
1410.3000000000002,1414.02,"2回のボーナスで1,500万ずつもらってるって言ってた"
1414.02,1418.22,あんま俺金使い荒いからさーって言って
1418.22,1423.74,そういう制度を取ってたよ
1423.74,1427.5,年報制度を取ってるとこなんていくらでもあるからね
1427.5,1428.46,年報制度
1428.46,1432.98,結構会社の役員の人とかって年報制度の人多くない?
1432.98,1435.14,退職金出ない人とか
1435.14,1438.38,研修医は200万くらいって年収がってこと?
1438.38,1439.58,あーでもそんなもんか
1439.58,1442.94,月30もらってる人少ないな
1442.94,1444.86,まあいいところは30くらいもらってる人いるけど
1444.86,1445.54,研修医でも
1445.54,1450.14,20、25くらいか
1450.14,1452.82,うちの親父も年報制度やそうだよね
1452.82,1453.38,いるよね
1453.38,1454.8200000000002,ちなみにうちの母も年報制なんだよ
1454.8200000000002,1457.0600000000002,だから退職金ねーから頑張って働かなきゃいけないって
1457.0600000000002,1463.1000000000001,え、もう25分経ったの?
1463.1000000000001,1466.46,小刻みな延長心掛けよう
1466.46,1467.98,お父さん部長だけど2000万だ
1467.98,1469.14,医師ってことは?
1469.14,1472.2600000000002,会社の部長?
1472.2600000000002,1473.7,でも会社の部長も
1473.7,1475.5400000000002,でもまあ医者の部
1475.5400000000002,1478.66,部長の方が高いか
1478.66,1479.98,うーん
1479.98,1481.3400000000001,高いよな
1481.34,1483.74,医者って外来でバイトするのが一番良くない?
1483.74,1484.58,ねー
1484.58,1485.86,いるじゃんたまにさ
1485.86,1488.54,女の女医でさ
1488.54,1489.8999999999999,月80万
1489.8999999999999,1491.1799999999998,週1勤務で
1491.1799999999998,1492.3,えんなわけわかんない
1492.3,1494.02,外来のバイトして80万もらって
1494.02,1496.5,マジでセレブですみたいなやついるじゃん
1496.5,1498.6599999999999,自分が女だったら絶対そうするよね
1498.6599999999999,1499.9399999999998,女の医師だったら
1499.9399999999998,1501.1799999999998,ただやっぱ志下げ
1501.1799999999998,1502.86,女で医者になろうってやつって
1502.86,1504.3799999999999,もうマジで
1504.3799999999999,1506.1,もうガチキツイだから
1506.1,1507.98,タダでさえ厳しいのに
1508.02,1511.54,男社会に入ってくる女って
1511.54,1512.98,ものすごいもう
1512.98,1514.66,メンタルもう強靭なのね
1514.66,1515.7,負けてたまるかみたいな
1515.7,1518.66,大抵優秀なの
1518.66,1521.14,なんかその
1521.14,1522.74,学会なんかそのなんていうの
1522.74,1524.9,研修医だけの学会みたいのがあって
1524.9,1526.5,そこで発表する人
1526.5,1528.82,発表してなんか対象決めるみたいなのあるんで
1528.82,1530.7,俺よく言ったことないからわかんないけど
1530.7,1533.14,大抵一番取るのは女だからね
1533.14,1535.26,数少ない
1535.26,1537.3,パンチがやっぱ効いてるよね
1537.3,1538.5,マジもんだよマジ吉
1538.5,1541.8999999999999,しかも大半の女の人は綺麗っていう
1541.8999999999999,1542.6599999999999,親が金持ちで
1542.6599999999999,1543.94,やっぱ医者の子供じゃん
1543.94,1546.62,医者って
1546.62,1549.02,でなんかお父さんが医者だから
1549.02,1550.26,綺麗な奥さんもらうわけよ
1550.26,1553.3,でね綺麗に生まれてきて
1553.3,1556.86,しかも再職顕微
1556.86,1558.94,西川彩子とかもそうじゃん
1558.94,1561.54,綺麗だし医者だし
1561.54,1564.7,あの人今何やってんだろうね
1564.7,1566.3,何やってんだろうね
1566.82,1568.5,ジョイト看護の女ってそんなレベルじゃ
1568.5,1571.8999999999999,全然違うよ
1571.8999999999999,1573.02,タレントなのなんか
1573.02,1574.3,自分でなんかあれしてないの
1574.3,1576.4199999999998,開業医してない
1576.4199999999998,1579.58,西川ただの爬虫類だろ
1579.58,1582.98,お前悪口言えれば誰でもいいんだろ
1582.98,1584.02,ただの爬虫類じゃねえぞ
1584.02,1586.1,あいつ医者だぞ
1586.1,1587.6599999999999,爬虫類じゃねえぞ
1587.6599999999999,1590.98,お前が間違ってるぞ
1590.98,1592.26,あ元々開業してて
1592.26,1595.18,三者も出てるよね
1595.22,1598.98,西川彩子は杉村大蔵と飲んでる
1598.98,1601.94,今はさやってないの医者
1601.94,1604.54,今は医者やってないの
1604.54,1608.22,西川先生
1608.22,1609.3400000000001,やってないの
1609.3400000000001,1611.02,やっててほしいんだけど
1611.02,1613.98,あその理事長みたいになって
1613.98,1616.3400000000001,誰かに任せてるみたいな感じか
1616.3400000000001,1619.18,あーそうだなおそらく
1619.18,1621.0600000000002,俺の推測が正しければ
1621.0600000000002,1622.3,経営だけだろうね
1622.3,1625.78,さすがにテレビで無いから無理だよな
1625.78,1628.98,頭のいいやつより今まで
1628.98,1636.46,勤務医だろ
1636.46,1640.5,俺でも西川先生顔好みなんだよな
1640.5,1643.86,顔好みなんだよね
1643.86,1646.22,なんかなんて言うんだろうな
1646.22,1648.78,いや可愛くない
1648.78,1653.06,なんか顔綺麗じゃない
1653.06,1656.94,昔の先生すげー綺麗だよ
1656.94,1658.54,昔の先生
1658.54,1662.34,なんかキリッとした人も好きなんだよな
1662.34,1663.94,わかるよねあ美人か
1663.94,1664.46,あごめんごめん
1664.46,1665.18,可愛いって言うとなんか
1665.18,1667.02,語弊がなおれいぜ
1667.02,1671.5,それはだってもう50手前でしょ
1671.5,1674.42,50手前でしょ
1674.42,1679.14,そりゃもうそれぐらいはあるでしょ
1679.14,1680.42,お前みかん好きだろ
1680.42,1687.26,みかんみかん可愛いじゃん
1687.26,1689.1000000000001,なんかみんなの中でさ
1689.1000000000001,1692.1000000000001,美人のハードル高いんじゃない
1692.1000000000001,1692.94,いやそりゃさ
1692.94,1696.3000000000002,堀北真希とか言われたらみんな可愛いじゃん
1696.3000000000002,1697.42,どこまでセーフなの
1697.42,1700.78,じゃあどこ誰見たら可愛いと可愛くないの
1700.78,1705.02,境界線教えてよ
1705.02,1705.7,可愛いとか
1705.7,1708.98,じゃあ生主で教えてよ生主で
1708.98,1710.42,生主知らねーけど
