start,end,text
0.0,4.38,【早送り】
4.38,4.98,だぁあ!
4.98,6.46,あぁぁぁぁぁぁ
6.72,6.78,あぁぁぁぁ
6.78,8.28,あぁぁぁぁぁ
8.28,9.28,あぁぁ
10.14,11.06,【早送り】
11.06,11.56,【早送り】
11.56,12.620000000000001,【早送り】
13.1,14.3,ふっ
14.3,15.200000000000001,んふん
15.200000000000001,16.7,この部族の挨拶を
16.7,20.6,【早送り】
20.6,22.16,最近この時間多いなぁ
23.62,24.26,ふっ
24.26,27.66,【早送り】
27.66,28.54,どうも
28.54,31.78,宜しくお願いします
31.78,34.66,今日もみんなに1項
34.66,36.7,押し返すか、見りゃ早っ
36.7,40.14,確実に無職だろ
40.14,43.18,どんなペースで見らしてんだ
43.18,45.58,意気込みを感じて俺は
45.58,50.94,見ることにします
50.94,52.5,意気込みを感じた、今
52.5,59.5,俺に一生ついてくるという 意気込みを感じたんで
62.78,67.3,待て待て待て
67.3,74.3,なぜ今ミラーで見る必要があるんだ
74.3,81.3,止まっちゃった
82.5,89.14,どうも
89.14,92.7,宜しくお願いします
92.7,95.9,俺は生活保護だからお前ら 働いて税金納めて俺の生活
95.9,98.7,成り立たせろよ
98.7,101.66,今日はもう皆さんにね本当に もう勘弁してほしい
101.66,103.9,本当に僕は
103.9,106.58,もう迷惑してます
106.58,108.94,すごく
108.94,110.26,もう12時
110.26,112.5,次になりますかね
112.5,116.10000000000001,あの僕の
116.10000000000001,117.54,住んでいる
117.54,119.14,マンションの
119.14,123.54,管理人から、管理人というか 管理会社から連絡が来まして
123.54,125.62,本当にですね
125.62,128.34,あの
128.34,132.26,加藤純一が殺害予告もされているので ちょっと
132.26,136.78,何とかしてくださいという通報が 入ったんですけどっていう風に
136.78,139.94,電話が来まして
139.94,142.74,あのね
142.74,147.22,このままじゃ俺本当に 追い出されちゃうからマジでレジディア
147.22,149.94,本当にレジディア 追い出されちゃうから
149.94,153.38,もうやめてくんない
153.38,156.78,あのね
156.78,160.5,なんでさ俺に
160.5,164.1,対する殺害予告の講座をなんで 俺がしなきゃいけないの
164.1,168.34,みんなにこうしてんだって言って
168.34,173.18,おかしくないか?なんで俺が そこに気づかなきゃいけないの
173.18,177.38,おかしくない?
177.38,182.14000000000001,なんで俺が追い出されるの? しかも意味わかんねえだろ
182.14000000000001,185.22,意味わかんなくねえか? なんで俺が気づかなきゃいけないの?
185.22,188.58,いや多分冗談だと思うんで 本当にちょっとあのシーンはわからないんですけど
188.58,192.58,冗談だと思うんで しかもね明らかに俺の視聴者から通報が
192.58,196.1,言ってんのね
196.14,199.5,もうやめてください
199.5,203.06,もうめんどくさいんで
203.06,205.26,もうやですもう
205.26,208.57999999999998,あのね伊東中小社ってとこなのね
208.57999999999998,212.78,あの僕の住んでいるマンションの管理会社
212.78,215.57999999999998,あのすごいねおっきいとこなの
215.57999999999998,219.38,資本金ねいくらか知ってる?
219.38,223.18,ただの管理会社じゃないんだよ
223.18,225.57999999999998,資本金2500億だよ
225.58,229.70000000000002,そんなところを手に回してもいいことひとつもないじゃん
229.70000000000002,233.94,2500億円だよ資本金
233.94,235.74,めんどくさいんだよ
235.74,239.14000000000001,任天堂相手に任天堂の持ってる
239.14000000000001,241.06,なんていうのかなあ
241.06,244.62,ものに殺害予告したらめんどくせえだろ
244.62,247.46,俺の会社300万だよ300万すごいじゃん
247.46,252.98000000000002,2500億円だよねあの資本金
252.98000000000002,254.94,三大消費者だよ
254.94,256.38,なんかさそれでさ
256.38,259.26,あのとある有名人のお母さんが
259.26,260.74,自殺しちゃった
260.74,264.46,みたいなのでそのマンションの価値ってガッと下がるじゃん
264.46,266.82,某覚醒剤やっていた
266.82,269.82,奴が入り浸っていたとか
269.82,271.46,それでうるせえんだよ
271.46,275.9,すっげえ
275.9,277.58,だからやめなさい
277.58,279.9,なんかうまいことやりなさい
279.9,283.94,うまいこと
283.94,285.7,当初一部余裕だよ
285.7,288.5,三菱三井住友伊藤中じゃないの
288.5,290.7,三大…あの
290.7,292.5,不動産業って
292.5,294.02,なんでいこぞないの
294.02,296.94,めんどくせえじゃん
296.94,302.62,一から二作りしてさあ
302.62,304.54,やめてほんと
304.54,307.94,みんながやめてめんどくさいから
307.94,309.94,お前レジニアの貸し下げてる
309.94,313.06,あげてるだろ
313.06,318.82,あげてるだろうが
318.82,321.5,物そんなにねえんだけどさ
321.5,326.66,服とかがめんどくせえじゃん服とかが
326.66,330.1,売上5兆円って嘘だからもうやめ
330.1,332.62,相手が悪いってさすがに
332.62,337.02,もっと弱いとこにしなよなんかさあるでしょいっぱい
337.14,346.74,相手が悪いじゃん明らかにさ
346.74,349.97999999999996,相手が悪くないちょっと
349.97999999999996,352.65999999999997,やめなさいもうなんか
352.65999999999997,354.14,レジニアに落書きされてなかった
354.14,355.34,それは俺のせいじゃないでしょ
355.34,357.26,なんて書いてあったか知ってる
357.26,360.82,うちのマンションに関東連合3畳って書いてあったんだよ
360.82,362.85999999999996,一番書かれたくねえだろ
362.85999999999996,366.65999999999997,なんか変な落書きとかじゃねえぞ
366.66,370.74,どでけえ玄関のさ一番目立つところ
370.74,372.1,どでけえところにさ
372.1,373.54,あのどでけえ文字でさ
373.54,381.38000000000005,関東連合3畳って書いてあったんだよ
381.38000000000005,384.3,しかもうちやっぱ芸能人の人とかも住んでるのね
384.3,388.62,それやめてくんない
388.62,393.74,僕が代表して治安を守っていきます
393.74,395.38,治安を守っていきます
395.38,396.98,監視カメラある
396.98,402.21999999999997,パクられるって普通にパクられるよ
402.21999999999997,404.74,それはでもたぶんうちの視聴者じゃなくて
404.74,406.18,なんかよくあるじゃん
406.18,411.58,あの書かれるでしょ
411.58,413.65999999999997,お前が顔と名前出して自主と出したんだ
413.65999999999997,414.9,お前が責任取る
414.9,416.94,お前それ警察の前で言ってみろよ
416.94,418.46,お前余裕でパクられるぞ
418.46,422.78,いやいやそんなあなたが悪いでしょって言われるだろう
422.78,424.1,なんで俺が責任取らなきゃいけないんだ
424.1,427.82000000000005,やるほうが悪いだろうが
427.82000000000005,431.66,やるほうが最近ガキノムはネットと現実
431.66,433.78000000000003,区別ついてないよな
433.78000000000003,436.5,ねえ分けて分けて考えるよな
436.5,441.26000000000005,分けて分けて考えるよね
441.26000000000005,444.34000000000003,めんどくせえのに行けとか絶対だ
444.34000000000003,445.90000000000003,お前にも責任はないよ
445.90000000000003,447.54,なんで俺に責任があんだ
447.54,448.3,やったほうが悪い
448.3,453.34000000000003,決まってんじゃろうが
453.38000000000005,455.1,警察は平気で放送やめろって言うぞ
455.1,456.66,仕事ですって言うじゃん
456.66,460.50000000000006,じゃあ面倒見てくださいって言うわ
460.50000000000006,463.18,そういうことがあるから普通公開しない
463.18,470.42,そういう考えもあるよね
470.42,475.62,なんかでもね自分が損するじゃん
475.62,478.86,自分が俺別に正直どうでもいいんだけど
478.86,482.14000000000004,引っ越しはいいだけだし
483.02,484.74,実生活に影響を与えるようなこと
484.74,486.26,しないほうがいいんじゃないかなって
486.26,487.78,なんでそれを放送で言おうと思ったんだ
487.78,489.82,みんなが通報するんだ
489.82,492.9,俺を守ろうとして
492.9,496.3,みんなさあ警察から連絡来たわけじゃねえのに
496.3,502.7,なんでそんな風になってんだろうっていう
502.7,504.41999999999996,どうせ捕まらないと思ったら仕方ない
504.41999999999996,505.5,しかも捕まんねえじゃん
505.5,511.5,どうせそんなの捕まんねえか
511.5,513.58,声無理に書いてねえどういうこと
513.58,519.46,かっこいい声になったってこと
519.46,520.66,捕まるんだったらさ
520.66,522.74,まあネタにもなるけどいいけどさ
522.74,526.14,そういうの多分捕まんないでしょ
526.14,527.22,そうやって視聴者助けをするの
527.22,528.5,お前がいいだろうって
528.5,530.74,なんかでもやめなーっつって
530.74,535.82,やめるんだったら言った方がいいじゃん
535.82,537.3,ガチの殺害欲だったらそうする
537.3,541.02,そしたら警察に助けてもらいます
541.02,545.3,誰逃れみてえにやめなーっつって
545.3,548.9,やめてくれるなら
548.9,553.14,管理会社への業務妨害で捕まる可能性ある
553.14,554.1,まあ可能性って言っても
554.1,560.9,音ほぼゼロでしょそんなの
560.9,564.98,なんかねやめた方がいいなって思いますよ
564.98,567.14,お前が憧れるものがレジディアに行くんだって
567.14,568.78,少し言葉落とせ
568.78,570.78,別にそんな人たちはでもあれでしょう
570.78,575.38,もっとちゃんとするでしょう
575.38,576.62,朝の光にディスられてたけど
576.62,577.38,どういう心境ですか
577.38,578.54,俺動画見たよ
578.54,579.8199999999999,対して悪口言われてなくて
579.8199999999999,582.38,なんか申し訳なくなった
582.38,584.98,すごい申し訳なくなった
584.98,586.18,なんかすごい冗談
586.18,587.18,半分で言ってたのに
587.18,591.3,なんか妄想が膨らんで
591.3,593.42,女の子相手に悪口言っちゃいました
593.42,599.4599999999999,この場を借りてもう謝罪申し上げます
599.5,602.7,35倍ぐらいに返しちゃったなと思って
602.7,606.1,しかも結構顔好みだったっていう
606.1,607.5400000000001,なんならちょっとこれを
607.5400000000001,611.0600000000001,木になんかどっかで共演できねえかなっていうぐらいの
611.0600000000001,611.82,潮れてるし
611.82,615.94,なんか1回ぐらいらしてくれんじゃねえかなって
615.94,617.34,相当傷ついてた
617.34,620.7800000000001,マジでごめんなさい
620.7800000000001,624.0600000000001,許してください
624.0600000000001,625.26,その件でじゅん知らない奴が
625.26,626.58,俺に文句言いに来たわ
626.58,628.26,なんつってきたの
628.26,631.02,俺はここに堂々といるのに
631.02,631.98,書きにくらいいいじゃねえか
631.98,634.7,俺の放送に
634.7,639.66,俺の放送に書きに来いよ
639.66,641.62,傷つけやさしくするのは洗脳のテクニックだぞ
641.62,646.78,DVのDVみたいなやつ
646.78,649.22,今度からそうやってやってきます
649.22,652.3,今度から
652.3,653.98,大声で笑ってたけど顔がガチだったよ
653.98,656.7,だからもう謝ったから許してよ
656.74,659.34,俺にだって謝ちはあるんだよ
659.34,662.74,完璧な人間はいないからね
662.74,664.4200000000001,完璧な人間は
664.4200000000001,667.3000000000001,今日のご飯は大いお茶です
667.3000000000001,669.26,あんまりなんか俺最近朝飯とか昼飯
669.26,673.1,空気しねえんだよな
673.1,676.38,空気しないの
676.38,677.94,悪口で見切らせすぎた
677.94,680.38,みんなが書くからじゃん
680.38,681.62,みんなが
681.62,683.34,ちゃんと正しい情報書いて
683.34,686.5,正しい情報
686.5,687.7,じゃないと俺はもう妄想で話
687.7,692.1,どんどんどんどん妄想で膨らんでいくからね
692.1,694.1,少しでも食べないとゼブンになるぞ
694.1,696.34,最近ちょっとあれだな
696.34,699.54,飯を食う量が減っちゃってさ
699.54,700.7,体重落ちてきちゃったんだよな
700.7,703.98,俺体重落ちるとダメなんだよな
703.98,707.22,65、6をやっぱ推移していたいね
707.22,710.46,でもやっぱ年取ってくると増えるっていうよね
710.46,712.82,年取ってくると
712.82,715.62,朝のせいで二度とか年取る話じゃないって言ってた
715.62,718.02,なんでいいじゃん別に
718.02,720.14,してくれよ
720.14,723.38,俺を晴れ者扱いしないでくれよ
723.38,725.62,頼む晴れ者扱いしないで
725.62,727.02,久々に来たけど最近どうなの
727.02,728.62,ぼちぼちですよ
728.62,729.38,ぼちぼちです
729.38,732.0600000000001,なんかかもなく不可もなく
732.0600000000001,738.22,上昇もせず下降もせずっていう感じですかね
738.22,740.34,質高は結構高くあるんだけどな
740.34,746.94,まあ上手くいかないことも多々ありますな
746.94,749.98,まあ頑張ってんじゃねえのぼちぼち
749.98,755.26,ぼちぼち頑張ってるような感じですね
755.26,757.14,明日加藤純一って人が予約してるの知ってる?
757.14,757.94,何明日って
757.94,762.26,なんか俺予定あったっけ
762.26,765.58,俺なんか予定あったっけ明日
765.58,768.1,あった?
768.1,771.4200000000001,ないよね別にね
771.4200000000001,773.1800000000001,ないよね
773.1800000000001,775.02,お前が放送しない間に入院して手術した
775.02,777.98,何の手術したの
777.98,780.7,お前的にFEの伸びはどうなんだ
780.7,785.02,FEって何
785.02,788.02,俺がついていけてねえな
788.02,789.5400000000001,ついていけてねえ
789.5400000000001,790.9,今日一日ぐったぐたに過ごさない
790.9,792.58,なんかもったいねえな
792.58,795.0600000000001,ファイヤーエンブレムか
795.0600000000001,805.34,ちょっと見てみる
805.34,807.58,どうなんだって言われても
807.58,808.5400000000001,どうなんだって言われても
808.5400000000001,812.34,パート126万7千8百
812.34,817.74,26万2千7百82だなって思うしかないんだけど
817.74,819.34,俺ってすげえなって思ったり
819.34,822.46,俺ってまだまだだなって思ったりってこと
822.46,831.6600000000001,どうなんだろうな
831.6600000000001,834.86,でもよく見てくれてんじゃねえの
834.86,841.5,よく見てくれてんじゃねえの
841.5,843.0600000000001,そのまんま動画ってさ
843.0600000000001,844.7800000000001,過大評価も過小評価もされないじゃん
844.7800000000001,846.98,生放送もそうだと思うけど
846.98,851.9000000000001,このありのままが今の実力なんじゃないの
851.9,855.8199999999999,と思います
855.8199999999999,856.74,生でやったの
856.74,857.74,お前自身があげるの
857.74,859.54,サメルはなんで別にいいじゃん
859.54,863.26,なんかそんな格好つけてても意味ねえ
863.26,864.38,ちゃんと米ありで見た方が
864.38,865.62,だって明らかに面白いじゃん
865.62,868.06,あれだってもったいねえよ
868.06,870.3,俺だけさあんだけ楽しんでてさ
870.3,871.66,あれやっててめっちゃ面白かったのね
871.66,872.66,なんでかって言うと
872.66,876.26,ああこんなこと書いてたんだって
876.26,879.34,思わなかった
879.34,880.54,こんなこと書いてあったんだ
881.54,884.86,思ったでしょ
884.86,886.78,生の霧の日動画今後もあげてほしい
886.78,888.02,まあ全部あげますと言えないけど
888.02,890.42,なんかあげたいって思ったのがあったら
890.42,891.4599999999999,あげようかな
891.4599999999999,894.6999999999999,あげたいって思ったら
894.6999999999999,896.5799999999999,最近一番ディスりたい人
896.5799999999999,897.62,誰だろうなあ
897.62,902.26,あいつあの麻薬で逮捕されたやつ
902.26,903.9399999999999,あのなんだっけ
903.9399999999999,907.98,女優元女優の麻薬で逮捕
907.98,909.78,タイマで逮捕されたやつ
909.98,911.38,名前忘れちゃったや
911.38,913.3399999999999,高木
913.3399999999999,916.3399999999999,高木沙耶
916.3399999999999,919.06,あの人さ
919.06,920.66,南暴走市に住んでたんだよ
920.66,923.4599999999999,南暴走市って立山があるとこなんだけど
923.4599999999999,926.9399999999999,てかのとある場所に住んでたの
926.9399999999999,927.9,俺家知ってんだけど
927.9,930.14,すごいいいとこなのね
930.14,931.74,でなんか女優さんが住んで
931.74,933.9399999999999,住みに来てくれたって
933.9399999999999,936.3,すごい喜んでたのにもかかわらず
936.3,937.42,あいつあそこで
937.4200000000001,940.98,タイマやるために住んでたのかと思って
940.98,943.0200000000001,悲しかったよ
943.0200000000001,945.1,裏切られたね本当に
945.1,946.5400000000001,タイマやるために来たんだって
946.5400000000001,949.5000000000001,確かにバレねえよなっていう感じなのね
949.5000000000001,951.4200000000001,まあ立山だったらやりたいことだろうな
951.4200000000001,953.7400000000001,っていう感じなのね
953.7400000000001,955.94,それが悔しかった
955.94,963.94,俺の故郷を踏み台にしやがったなっていう
964.0200000000001,969.0200000000001,踏み台にしやがったなって思ったね
969.0200000000001,972.94,なんかそれで引っ越しちゃったんだよ
972.94,977.3800000000001,引っ越しちゃったの
977.3800000000001,979.22,で沖縄かなんかに行って
979.22,980.9000000000001,パクられちゃったんだよね
980.9000000000001,983.3800000000001,まあでも言ってることおかしかったもんな
983.3800000000001,985.0200000000001,選挙に出てた時からね
985.0200000000001,987.9000000000001,なんでそこまで医療用タイマにこだわるんだろうって
987.9000000000001,988.94,もっとさ
988.94,991.3800000000001,あの認可が下りていない大事な薬なんてさ
991.38,994.82,世の中にさ5万と存在してさ
994.82,996.74,しかもタイマなんかよりさ
996.74,999.06,あからさまにその優位性がさ
999.06,1001.06,証明されてるものなんていっぱいあるのに
1001.06,1003.02,なぜそこでタイマにスポット当ててるんだろう
1003.02,1005.3,この人って確かにずっとやっぱ思うわけよ
1005.3,1008.1,なんでそこまでタイマなんだろうって
1008.1,1011.78,具体的なさこういうものに効きますって
1011.78,1016.3,あんまり証明がなされていないものじゃん
1016.3,1019.98,もっといっぱいあるでしょ
1019.98,1022.1,蓋を開けてみれば自分がやりたかったからか
1022.1,1022.86,なるほどなって
1022.86,1026.8600000000001,って別にでもその医療用タイマがさ解禁されてもさ
1026.8600000000001,1028.9,我々ができるわけじゃないもんね
1028.9,1031.34,てかオランダかなんかに金持ってんだからさ
1031.34,1032.38,オランダかなんかに住んでさ
1032.38,1035.98,堂々タイマやればいいのにね
1035.98,1037.22,当選してないよ
1037.22,1040.54,そんなん当選できるわけないでしょ
1040.54,1041.6200000000001,普通だったら当選するじゃん
1041.6200000000001,1045.1,そんだけさ女優やっててさ相棒に出ててさ
1045.1,1045.78,あんだけ好感だ
1045.78,1049.58,なんかあの人ダイバーとかもやってたよね
1049.58,1051.9399999999998,やっぱ国民はバカじゃねえなって
1051.9399999999998,1054.3,オランダってタイマ政府だよね
1054.3,1056.1,アメリカも医療用タイマある
1056.1,1059.1799999999998,タイマってさ何に効薬があるの
1059.1799999999998,1061.82,効能タイマの効能は何なの
1061.82,1065.78,俺知らないんだけど
1065.78,1067.34,タイマって何がいいの
1067.34,1068.82,クローン病に効くんだ
1068.82,1071.06,クローン病のさどういうところに効果があるの
1071.06,1076.6999999999998,痛みの目モルヒネみたいな感じ
1076.7,1079.9,リラックス知らねえよ
1079.9,1082.6200000000001,なんでそんなんさ病院がさ
1082.6200000000001,1084.02,おめえらリラックスさせるたびに
1084.02,1085.46,タイマOKしなきゃいけねえんだよ
1085.46,1087.9,勝手にやっとけよんなのよ
1087.9,1089.3400000000001,マッサージ行くなりよ
1089.3400000000001,1092.66,性感マッサージ行けよ
1092.66,1094.66,ガンも消えるって症例がある
1094.66,1096.1000000000001,そういう薬っていっぱいあるのに
1096.1000000000001,1097.6200000000001,なんでタイマだけなんだろうなっていうの
1097.6200000000001,1100.3400000000001,やっぱみんな疑問
1100.3400000000001,1101.74,タバコより害ないって言われてるよね
1101.74,1103.66,でも国がダメだよって言われてるんだから
1103.66,1106.42,もうそれまでじゃない
1106.42,1107.5800000000002,俺たちがさ
1107.5800000000002,1109.78,やべえねえダメやめろ
1109.78,1112.18,って言ってるわけじゃないじゃん
1112.18,1113.26,国がダメって言われてたら
1113.26,1117.74,もうおしまいなんだよ
1117.74,1119.66,もったいねえなと思ったなあ
1119.66,1121.7,昨日予防接種してきた痛かったインフルエンザか
1121.7,1123.94,俺もしたよ
1123.94,1126.02,なんかでもさあれってなんか
1126.02,1128.18,先生たちの話聞くとさ
1128.18,1130.98,別に予防接種ってわけじゃないみたいだね
1130.98,1133.22,やっぱねあれあらかじめから何
1133.22,1134.98,抗体こういうのが流行るだろう
1134.98,1137.58,っていうのをぶち込んでおくことによって
1137.58,1140.78,なんか大きくならない
1140.78,1143.42,重症化しないっていう感じなんだよね
1143.42,1147.9,重症化しないらしいね
1147.9,1149.6200000000001,俺もねだからさバーってさ俺も
1149.6200000000001,1152.94,結構やっぱインフルエンザなるのね
1152.94,1155.78,で予防接種受けてるの気づかないことってあるんだよね
1155.78,1157.82,38度5分ぐらいで
1157.82,1160.06,うわあ今日熱超高いけど
1160.06,1162.42,まあ体ギリギリ動くし
1162.42,1164.38,俺が休んだら面倒くせえことなるだろうし
1165.1000000000001,1166.5400000000002,"2,3日働いてて"
1166.5400000000002,1168.0600000000002,熱下がってきたところで
1168.0600000000002,1169.1000000000001,1回検査してみって言われて
1169.1000000000001,1171.5,鼻の奥にメンボ突っ込んだらインフルエンザとか
1171.5,1174.7800000000002,で大蔓延するみたいな
1174.7800000000002,1178.18,感染広がるよ
1178.18,1180.6200000000001,なんで内科の先生って風邪ひかないの
1180.6200000000001,1182.3000000000002,いや体調崩しても先生ってさ
1182.3000000000002,1185.74,変わりねえから来るんじゃない
1185.74,1188.46,結構来てるよみんな
1188.46,1191.66,病院の医者ってさ体調悪くても休まねえんだよ
1191.66,1194.5400000000002,本当に特に若い先生
1194.5400000000002,1195.8600000000001,マジで休まないからあの人
1195.8600000000001,1197.6200000000001,本当になんか入院するとか
1197.6200000000001,1200.94,インフルエンザになる以外は休まないよ
1200.94,1204.6200000000001,来て自分の患者バーって見て
1204.6200000000001,1207.9,指示出して帰るみたいな
1207.9,1214.5800000000002,上の先生が止めるまでは来てるんじゃない
1214.5800000000002,1218.18,頭おかしいなって思いながら見てるけど
1218.18,1220.42,すごいわ
1220.42,1223.26,開業日とかほんと休めないよね
1223.26,1226.22,友達の研修日半年休みねえって言ってたわ
1226.22,1228.94,ねえ自主的に来なきゃいけないらしいからね
1228.94,1232.14,自主的にね患者に迷惑じゃん
1232.14,1235.6200000000001,なんかでも来ない方が迷惑なんじゃない
1235.6200000000001,1236.98,知らねえけど
1236.98,1243.66,先生たちの意思の意識の高さというか
1243.66,1248.5800000000002,すげえなって思いながら見てるけど
1248.62,1250.74,今日はがっつりゲームするのかまあいいよ
1250.74,1252.98,なんかだらだらだらと喋るのが一番いいよ
1252.98,1257.9399999999998,こういう日は金もらえるんだから我慢しろ
1257.9399999999998,1260.6599999999999,まあねでも大してもらってないよ
1260.6599999999999,1264.9399999999998,多分勤務員なんて年収1000万を超えてるんだろうけど
1264.9399999999998,1268.74,さあ大したがもっともらっていいんじゃないのかなって
1268.74,1272.1,部長クラスでだって2、3000万だよ
1272.1,1275.1799999999998,開業日とかもっともらってんだろうけど
1275.1799999999998,1278.26,割合わんよあんな厳しい仕事でさ
1278.26,1282.5,毎日仕事きてさ1000万とかじゃない
1282.5,1283.86,俺と同い年の先生ぐらいで
