start,end,text
1334.0,1336.0,別に言うほど稲穂でもねえんだ
1336.0,1338.0,お前ら興味ねえと思っちゃうんだよな
1340.0,1342.0,素直な感情
1342.0,1344.0,俺の視聴者が荒らしてるんじゃなくて
1344.0,1346.0,これ実はみんな世論ですよって
1346.0,1348.0,俺言いたいんですよね
1348.0,1350.0,すげえ荒れててさ
1350.0,1352.0,俺の視聴者が荒らしてると思うんだよ
1352.0,1354.0,これみんな世間はこうやって思ってんだぞ
1354.0,1356.0,お前らのことっていうのを
1356.0,1358.0,心の中では俺は思ってるね
1360.0,1362.0,思うじゃん
1362.0,1364.0,俺だってそうじゃん
1364.0,1366.0,俺が例えば渋谷でさこのノリで演説したらさ
1366.0,1368.0,みんなからキモいって思われるでしょ
1368.0,1370.0,全員
1370.0,1372.0,たまたま俺のことを
1372.0,1374.0,好き嫌いとか感情を持ってる人が
1374.0,1376.0,見に来てくれてるから成り立ってるけどさ
1376.0,1378.0,みんなそうじゃん
1378.0,1380.0,シャットアウトするんだったら
1380.0,1382.0,出てこない方がいいんじゃないかな
1388.0,1390.0,俺だって言われてるしね
1392.0,1394.0,佐藤は日本人なのか分かんない
1400.0,1402.0,女が打つパチパチパチとかテンプレ
1402.0,1404.0,虫頭が走るとか別にそれもさ
1404.0,1406.0,否定しなくてもいいんじゃない
1406.0,1408.0,人口の文化なんだからさ
1408.0,1410.0,でもみんなが気持ち悪いなって思ってる分に
1410.0,1412.0,全然ありだと思う
1412.0,1414.0,それに関して気持ち悪いなって
1414.0,1416.0,コメント書くのは
1416.0,1418.0,俺ありだと思ってるから
1418.0,1420.0,そのノリを受け付けないんだったら
1420.0,1422.0,俺もうクビになるしかない
1424.0,1426.0,俺そうしたら潔くクビ切られるよ
1428.0,1430.0,それで俺
1430.0,1432.0,自分からみんなにお願いすること
1432.0,1434.0,で助長させるみんなで争うぜ
1434.0,1436.0,素直なコメントが一番俺
1436.0,1438.0,コメントしやすいだろうし
1442.0,1444.0,なんかね
1444.0,1446.0,居心地悪くなっちゃうよね
1446.0,1448.0,いやまだ全然温まってきたね
1448.0,1450.0,なんか声出てなくない
1450.0,1452.0,声出てなくない
1452.0,1454.0,だんだん出始めてきてるな
1456.0,1458.0,ジャルにいくら払ってんのいくらも払ってねーや
1458.0,1460.0,ゼロ円
1460.0,1462.0,でもクソ都合がいいわ
1462.0,1464.0,なんか色んなさ
1464.0,1466.0,わけわかんないメール来るんだけど
1466.0,1468.0,仕事は全部
1468.0,1470.0,どんなに仲いい人の
1470.0,1472.0,誘いでも全部ジャルさんに振るようにしてるから
1472.0,1474.0,ほんと仕事の話しなくなって
1474.0,1476.0,マジで気持ち楽になったわ
1476.0,1478.0,なんの
1480.0,1482.0,ノーアクシデントじゃん
1482.0,1484.0,そういうストレスなくなったらもう
1484.0,1486.0,俺だってテクサからのやつも
1486.0,1488.0,全部もう既読スレしてGメール送るもん
1488.0,1490.0,ジャルさんのGメール送って
1490.0,1492.0,こっちに送ってください
1492.0,1494.0,それでよしよしはジャルさんに決めてもらう
1496.0,1498.0,俺一個ねテクサに文句あるんだよな
1498.0,1500.0,文句っていうかこれ直したほうがいいんじゃないかっていうのがあって
1500.0,1502.0,なんか雑談公式特番見たんだよ俺
1502.0,1504.0,見たんだけどさ
1504.0,1506.0,あれさなんでさ
1506.0,1508.0,テクサがやってるっていうのをさ隠そう隠そうとしてるのか
1508.0,1510.0,マジでわかんないっていう
1510.0,1512.0,あれスポンサーついてねーんだから別にテクサがやってるでいいじゃん
1512.0,1514.0,そうやってさ臭いものに蓋しようとするから逆に
1514.0,1516.0,悪いことやってんだって俺思っちゃったんだけど
1516.0,1518.0,なんか脱税とかしてんのかなとか
1518.0,1520.0,別に言えばいいじゃん
1522.0,1524.0,隠す必要全くねーのに
1524.0,1526.0,と思って
1528.0,1530.0,脱税してないでしょ
1530.0,1532.0,なんかさ
1532.0,1534.0,隠すとか間違ってるんじゃないかなって
1534.0,1536.0,テクサが出すと
1536.0,1538.0,イメージがどんどん残るの
1538.0,1540.0,だったらもうやめたほうがいいんじゃないかな
1540.0,1542.0,そんなさ
1542.0,1544.0,それってみんな傷つくでしょ
1546.0,1548.0,俺
1548.0,1550.0,出たら絶対言うけどな
1552.0,1554.0,言っちゃえばいいのにね
1554.0,1556.0,変に隠すから余計さ後ろめたい
1556.0,1558.0,なんか絶対あるなんかあるだろうと思わない
1558.0,1560.0,じゅんやみんとか知らないだろ
1560.0,1562.0,知ってるよ
1562.0,1564.0,だって俺みどりさんの放送見てるし
1568.0,1570.0,なんか言えばいいのにって
1570.0,1572.0,あれ損しちゃってるよ
1572.0,1574.0,絶対
1574.0,1576.0,そもそもリアルに顔隠したほうがいい
1576.0,1578.0,顔隠せって感じだよね
1578.0,1580.0,あれしようぜ
1580.0,1582.0,あのー
1582.0,1584.0,マスク
1584.0,1586.0,新しい服面を
1588.0,1590.0,考えたほうがいいと思います
1590.0,1592.0,なんかね俺鼻すするの色々調べたんだけど
1592.0,1594.0,覚醒剤を鼻から吸引してるやつは
1594.0,1596.0,よく鼻すするらしいから俺もしかしたらそういう疑い
1596.0,1598.0,持たれてるかもしれない
1598.0,1600.0,公安からマークされてるかもしれない
1600.0,1602.0,アスカがいいとも出たとき鼻から
1602.0,1604.0,吸いまくってんだよ
1604.0,1606.0,え俺アスカの一緒じゃんと思って
1606.0,1608.0,俺もしかしたら鼻からシャブやってるかもしれないからよろしくな
1610.0,1612.0,否定しない
1612.0,1614.0,あえて僕は
1616.0,1618.0,飲み物買ってこよう
1620.0,1622.0,アスカの話も出たところでなんかやるか
1626.0,1628.0,アスカ最近何やってんの
1628.0,1630.0,ねえ
1630.0,1632.0,アスカ何やってんの元気してんの
1632.0,1634.0,アスカニコ生出てくんねえかな
1634.0,1636.0,俺の
1636.0,1638.0,俺アスカのモノマネめっちゃうまいから
1640.0,1642.0,唯一できるんだよ小さい頃から練習してた
1642.0,1644.0,アスカのビブラートっていう
1646.0,1648.0,飲み物買ってくるわ
1648.0,1660.0,ゲーム音楽
1666.0,1668.0,1時間かちょうど
1668.0,1670.0,俺の時間配分完璧だな
1672.0,1674.0,よっこいしょと
1674.0,1676.0,なんか音楽でもかけてくか
1676.0,1677.0,いい
1677.92,1680.4,みんなの好みでいいぞ、いいぞえ
1683.72,1685.4,え、コウヘイの声聞きたくねーよ
1685.4,1687.56,今日気分いいのに、今日機嫌めっちゃいいのにさー
1689.92,1691.72,コウヘイの声なんて聞きたくない
1698.32,1699.32,何しよっかなー
1700.84,1701.84,冬の
1702.8400000000001,1704.8400000000001,なんかテンション上がる曲がいいよね
1707.2400000000002,1709.2400000000002,サンムン歌ってみたとか
1709.8400000000001,1710.8400000000001,あ、チャゲヤス聞くわ
1711.8400000000001,1712.8400000000001,チャゲヤスで行くわ
1716.8400000000001,1718.8400000000001,ウォギンガイネ
1718.8400000000001,1720.8400000000001,ハンダネ
1720.8400000000001,1722.8400000000001,みたいな、始まりはいつも雨聞くわ
1723.8400000000001,1724.8400000000001,そんな歌なかったっけ
1728.8400000000001,1729.8400000000001,あれなんてやつ
1732.8400000000001,1734.8400000000001,始まりはいつも雨なのだっけ
1736.8400000000001,1738.8400000000001,もー動画が重すぎる
1738.8400000000001,1740.8400000000001,動画っていうかパソコンが重すぎる
1743.8400000000001,1745.8400000000001,なんだこの重さ
1750.8400000000001,1752.8400000000001,いや回線じゃない、パソコンが重い
1754.8400000000001,1756.8400000000001,買うしかねーな
1757.8400000000001,1759.8400000000001,買うしかねーな
1762.8400000000001,1764.8400000000001,自分への落とし玉で買お
1764.8400000000001,1766.8400000000001,元旦に
1770.8400000000001,1772.8400000000001,え、始まりはいつも雨なかった
1773.8400000000001,1775.8400000000001,始まりはいつも雨で検索したら
1776.8400000000001,1778.8400000000001,現場監督vs立ち中年っていうのがで
1778.8400000000001,1780.8400000000001,因縁の組手編というのが出てきたんだけど
1780.8400000000001,1781.8400000000001,これ流しとくわ
1781.8400000000001,1783.8400000000001,あ、10秒しかないからやめよう
1787.8400000000001,1789.8400000000001,ねーのかよお前
1789.8400000000001,1791.8400000000001,あった、チャゲアン出すか
1793.8400000000001,1795.8400000000001,おいチャゲアンの始まりはいつも雨ねーとか
1795.8400000000001,1797.8400000000001,ニコ動腐ってんだマジで
1798.8400000000001,1800.8400000000001,YouTubeにしよ
