start,end,text
0.0,2.0,殺した、また一人
2.0,4.0,忠実な部下が
4.0,6.0,忠実な部下も必要
6.0,8.0,いわくあれしよう
8.0,10.0,あの多分さ、延長特権
10.0,12.0,入ってない、あの延長特権とか入ってないから
12.0,14.0,枠切ったのにも関わらず
14.0,16.0,また予約しててお前金払ってきょうやってくれ
16.0,18.0,俺の身のない雑談
18.0,20.0,6時間ミラーしてくれ
20.0,22.0,よろしく
22.0,24.0,俺の夢は
24.0,26.0,ポケモン151匹ミラー建てるという夢があるんだ
26.0,28.0,まず不思議だねミラーから
28.0,30.0,始めてくれ、不思議だねミラー
30.0,32.0,不思議そうミラー、不思議バナミラーから
32.0,34.0,全部埋めていく
34.0,36.0,でそれ全部埋めにしたら何
36.0,38.0,35万人くらいだろ、いいじゃん
38.0,40.0,そんなんあれだよ
40.0,42.0,アメトーク中にニコ生しなきゃそんなん見てくんねえよ
42.0,44.0,誰も
44.0,46.0,キングラーミラーとあれはあるからな
48.0,50.0,サンマゴテンに出ながらニコ生するからそしたら
50.0,52.0,そしたら35万人くらい見てくれるだろ
52.0,54.0,よろしく
54.0,56.0,今100匹くらいいるだろ
56.0,58.0,新しいさあ
58.0,60.0,新しいポケモンってさ
60.0,62.0,ポケモン増えたの
64.0,66.0,増えた?
66.0,68.0,何匹
68.0,70.0,今さあ何匹いるのトータルで
70.0,72.0,トータル何匹
74.0,76.0,トータルで何匹
76.0,78.0,全部の
78.0,80.0,1000匹
80.0,82.0,1000匹いるんだ
84.0,86.0,歴史を感じるなあ
86.0,88.0,大木戸博士の立場とは
92.0,94.0,151匹集めるぞ
94.0,96.0,みたいなことにしたのにさ
96.0,98.0,蓋を開けてみれば
98.0,100.0,1000匹いるって
100.0,102.0,どんだけ無能なんだよ
102.0,104.0,151匹
104.0,106.0,151匹
106.0,108.0,どんだけ無能なんだよ
110.0,112.0,無能すぎるだろあいつ
112.0,114.0,博士とか言ってんのに
118.0,120.0,なんだそれ
120.0,122.0,世間知らずのゴミじゃんただの
122.0,124.0,死ねえよ
124.0,126.0,大木戸博士
128.0,130.0,ギラギラしてきた嘘つきが
130.0,132.0,クソ老害
132.0,134.0,いきなりいきなり腐りやがってや
134.0,136.0,認知症だろ確実に大木戸
138.0,140.0,8分の1しか
140.0,142.0,見つけないんじゃないかあいつ
142.0,144.0,大木戸博士とかってさ
144.0,146.0,今出てきてんの
148.0,150.0,織田巻やら
150.0,152.0,原巻やらが
152.0,154.0,出てきてるだろ今
154.0,156.0,来ないの
156.0,158.0,死んだの
158.0,160.0,大木戸博士
160.0,162.0,織田巻やら
162.0,164.0,原巻やらが出てくんだろ
166.0,168.0,黒人みたいな
168.0,170.0,大木戸が出てくる黒人ってどっちの黒人
170.0,172.0,名古屋のデブだったら俺二度とやらねえよ
172.0,174.0,会いたくねえし
174.0,176.0,ゲームの中で
176.0,178.0,あ名古屋の方か
178.0,180.0,なるほどじゃあちょっとしばらくは
180.0,182.0,敬遠する方向で
184.0,186.0,そうなんだ
186.0,188.0,次リメイク
188.0,190.0,されたら関東では
190.0,192.0,あーなるほどなるほど
192.0,194.0,うまいこと
194.0,196.0,まあでもなかなかそこで
196.0,198.0,成功性取っていくの無理だよな
198.0,200.0,だってさ
200.0,202.0,一番最初にポケモン出したときさ
202.0,204.0,まさかこんなコンテンツに成長するとは思わなかったでしょ
204.0,206.0,だって今正直
206.0,208.0,ポケモンって天下取ってるでしょ
208.0,210.0,何本売れてんの一千万本ぐらい売れてるでしょ
212.0,214.0,伝えてない全然伝えてない
214.0,216.0,100万本売れたらメガヒットでしょ
216.0,218.0,今一千万本とか売れてるでしょポケモン
218.0,220.0,いや違う違う
220.0,222.0,新しいシリーズ出したら
222.0,224.0,新しいシリーズ
224.0,226.0,サンムーンで何本売れてんの
226.0,228.0,初期出荷一千万本でしょ
228.0,230.0,そりゃあすげーな
230.0,232.0,世界最強のゲームだね
234.0,236.0,バケモノ地見てるね
236.0,238.0,今回過去最大の予約数らしいよ
238.0,240.0,わーなんかでも
240.0,242.0,やっぱりさ世代的に俺が小学校
242.0,244.0,4年生とか2年生の時にポケモンアカって出たんだよ
244.0,246.0,やっぱりさずーっと
246.0,248.0,俺自身は金銀でやめちゃったんだけど
248.0,250.0,いや俺赤緑でやめちゃったのね
250.0,252.0,金銀はなんか俺が
252.0,254.0,中学校2年生の時に多分出て
254.0,256.0,なんかその時って
256.0,258.0,中学校でポケモンやってるのって恥ずかしいよなみたいな
258.0,260.0,そういうねくだらない
260.0,262.0,田舎のヤンキーの
262.0,264.0,くだらない
264.0,266.0,そういう性質があってできなかったんだよ
266.0,268.0,で俺多分
268.0,270.0,配信で初めて金銀やったのね
270.0,272.0,配信で初めて金銀やったの
272.0,274.0,金銀やったの
274.0,276.0,やりたかったんだよ実はずーっと
276.0,278.0,小さい頃中学校の時やりたかったんだけどできなくて
278.0,280.0,だからなんか
280.0,282.0,いつまでもスタレずにいてほしいな
282.0,284.0,俺が死ぬまで
286.0,288.0,そこで息をひとめていた隠れキリシタンが今暴れてる
288.0,290.0,あー大人になってってこと
290.0,292.0,なるほどな
292.0,294.0,最初出た時はもう19歳だから一回もやったことないよ
294.0,296.0,お前相当クソジジイだな
296.0,298.0,お前歳いくつだ
298.0,300.0,お前歳いくつだ
300.0,302.0,最初出た時
302.0,304.0,ってことはもう俺の10個上ぐらいってことでしょ
304.0,306.0,39じゃねえか
306.0,308.0,クソジジイお前
308.0,310.0,横浜みどりと同じ歳だぞ
310.0,312.0,何やってんの
314.0,316.0,土曜日の昼間から
316.0,318.0,加藤純二の雑談を聞いてて
320.0,322.0,もうすぐお前寿命だぞ
322.0,324.0,40越えたらガンのリスク高くなるぞ
324.0,326.0,お前年金払わなきゃいけなくなるんだぞ
326.0,328.0,年金
330.0,332.0,払わなきゃいけないんだぞ
334.0,336.0,子供の時のワクワクもう無くなったしかないぞ
336.0,338.0,いやなんかねそれとはまた別の性質なんだよ
338.0,340.0,だからガキの頃に比べてそれはワクワクしねえよ
340.0,342.0,だって
342.0,344.0,でもさ
344.0,346.0,カイコ的な楽しさがあるじゃん
346.0,348.0,カイコ的な
348.0,350.0,うわーまだいるんだコラッターとかさ
352.0,354.0,そこはちょっとこっち側が需要していかなきゃいけないんだよな
356.0,358.0,うわコラッターまだいるんだ
358.0,360.0,俺は初代の151匹しか認めねえよ
360.0,362.0,みたいなさ
362.0,364.0,そういう楽しみ方ってあるじゃん
364.0,366.0,俺もなんか
366.0,368.0,ポケモン新作出るワクワクみたいなのは一切ないけど
368.0,370.0,なんかやっぱやってみると
370.0,372.0,面白いよ
372.0,374.0,やってみると
374.0,376.0,年金じゃなくてなんだっけ
376.0,378.0,あのー
378.0,380.0,40から払わなきゃいけない
380.0,382.0,40から払わなきゃいけないやつってなんだっけ
382.0,384.0,あれ
384.0,386.0,あカイコ系カイコ系
386.0,388.0,スタレたな俺も
388.0,390.0,カイコ系カイコ保険
392.0,394.0,そうだよな
394.0,396.0,俺もあと10年したらカイコ保険のあれ払わなきゃいけないのか
398.0,400.0,みんな歳いくつ
402.0,404.0,貴様らうぬらの歳
404.0,406.0,負担額増えてんだ
406.0,408.0,まあそうしゃーねーよな
408.0,410.0,20代前半から
410.0,412.0,まあ30代
412.0,414.0,30歳ぐらいか
416.0,418.0,うーん
418.0,420.0,まあ10代少ないねやっぱね
420.0,422.0,だからやっぱ
422.0,424.0,あのー
424.0,426.0,同じようにずーっと
426.0,428.0,歳を重ね
428.0,430.0,なんか不思議な関係性だよね
430.0,432.0,この前なんか
432.0,434.0,女の子と喋ってて
436.0,438.0,なんかそのー
440.0,442.0,なんていうの
442.0,444.0,不思議
444.0,446.0,普通さ
446.0,448.0,キヨとかレトルトとか
448.0,450.0,モコウまで俺ギリギリ入ると思うんだけど
450.0,452.0,熱狂的な女性のファンがいてさ
452.0,454.0,その人たちの支えってめっちゃ大きいじゃん
454.0,456.0,絶対さ異性のファンって
456.0,458.0,どんなに意気がって
458.0,460.0,私は別にモコウとかレトルトのことを
460.0,462.0,恋愛対象として
462.0,464.0,見てないからとか言うんだけど
464.0,466.0,そんなのってありえないのねただの生け沼なだけなの
466.0,468.0,発達障害だから気づいてないだけで
468.0,470.0,本当は付き合いたいと思ってるのね
470.0,472.0,俺の女の子の視聴者もそうなんだよ
472.0,474.0,でもさ
474.0,476.0,男性からさ
476.0,478.0,なんか俺さ束縛されるじゃんすごい
478.0,480.0,なんか俺の視聴者って俺のこと束縛するじゃん
480.0,482.0,そういうのってさ
482.0,484.0,俺周りで知らないのね
486.0,488.0,一個分かるのがカープファンが
488.0,490.0,新井を束縛してたの覚えてないけど
490.0,492.0,俺人類史上2度目の出来事なの
494.0,496.0,あと半信ファンが金本叩くみたいな感じで
496.0,498.0,兄貴兄貴みたいな
498.0,500.0,なんかすごい異質な存在だよね
500.0,502.0,って言われたわそういえば
502.0,504.0,俺が婚姻してるデレレ状に
506.0,508.0,そうだろそうだろって
508.0,510.0,出たわねって
510.0,512.0,最近の兄貴のなんかあの
512.0,514.0,言葉面白くなってるよな
514.0,516.0,なんでさ監督になるとさ
516.0,518.0,いじられキャラになっちゃうんだろうな
518.0,520.0,あんなに兄貴兄貴って慕ってたのにさ
520.0,522.0,いきなりホモ
522.0,524.0,カマホモ野郎みたいな兄貴になってんだぜ
524.0,526.0,出たわねとかさ
526.0,528.0,出たわよとか
530.0,532.0,でもよかった
532.0,534.0,晩節を怪我したとか言われててさ
534.0,536.0,俺はそういう風に思わなかったけど
536.0,538.0,あんだけね肩の怪我しててさ
538.0,540.0,なおかつ違反級
540.0,542.0,違反級じゃない統一級でさ
542.0,544.0,あんだけの
544.0,546.0,俺二桁本くらい売ってんだよ
546.0,548.0,金本
548.0,550.0,なんか俺叩かれすぎててかわいそうだなと思ったけど
550.0,552.0,やっぱねもう引退するとちゃんと
552.0,554.0,正常な評価に戻るんだね
554.0,556.0,二千五百本四百本類だって
556.0,558.0,ありえねえもんな
558.0,560.0,下等級で
564.0,566.0,一郎がさそうなったときも叩かれちゃうんだろうなと思うけど
566.0,568.0,俺は絶対にそれは
568.0,570.0,してほしくないね
570.0,572.0,してほしくねえわ
572.0,574.0,金本トリプルスリーしてるよ
574.0,576.0,二千五百本売ってんだぜ
576.0,578.0,ダイエット足りなかったみたいだわね
578.0,580.0,とかさ
580.0,582.0,思えるじゃねえかよそんなの
584.0,586.0,松井は今ニューヨークで
586.0,588.0,悠々自的に奥さんと子供と暮らしてる
590.0,592.0,悠々自的に
592.0,594.0,暮らしてます
598.0,600.0,なんかちょっとあれだな
600.0,602.0,ほんとに
602.0,604.0,今年一年早かったわマジで
604.0,606.0,ほんと一瞬だったわ
606.0,608.0,年明けて
608.0,610.0,年明けて
610.0,612.0,マジで一瞬だったねえ
614.0,616.0,何したのみんなは
616.0,618.0,なんかみんなの話教えてよたまには
618.0,620.0,俺がいつもいつも喋ったばっかりだから
620.0,622.0,毎年言ってるぞ
622.0,624.0,なんかね
624.0,626.0,その
626.0,628.0,俺分かんないよ
628.0,630.0,エビデンスがどうかっていうのは分かんないんだけど
630.0,632.0,年取ると時間経つの早いよ
632.0,634.0,ってよく言うじゃん
634.0,636.0,やっぱねその年数
636.0,638.0,その年齢っていう分母が増えていくから
638.0,640.0,そのうちの一年
640.0,642.0,分子が
642.0,644.0,その分母に対する分子の
644.0,646.0,相対的に比率が減っていくじゃん
646.0,648.0,だから
648.0,650.0,体感的に一年経つのが早くなるんだって
650.0,652.0,30分の1とさ
652.0,654.0,31分の1だったら
654.0,656.0,31分の1の方がちっちゃいじゃん
656.0,658.0,俺が60になったら
658.0,660.0,俺の60歳の時の一年って60分の1なんだって
660.0,662.0,感覚的に
662.0,664.0,だから半分になっちゃうんだって
666.0,668.0,恐ろしいよね
670.0,672.0,なんか俺どっかで見たわ
672.0,674.0,今年婚約破棄された
674.0,676.0,女ってやっぱゴミなんで婚約破棄されたの
678.0,680.0,なんで婚約破棄されたの
680.0,682.0,結婚して子供が生まれた
682.0,684.0,マジで
684.0,686.0,マジで
688.0,690.0,へー
690.0,692.0,まぁおかしくねーよな別にな
692.0,694.0,なんかさ一番悲しいのがさ
694.0,696.0,人間ってさ絶対死んでいくじゃん
696.0,698.0,絶対さ俺のことめっちゃ好きだったやつ
698.0,700.0,バタバタ死んでると思うのね
702.0,704.0,なんか
704.0,706.0,悲しいよねそれ
706.0,708.0,バタバタ死んでるはずじゃん
708.0,710.0,5000人いたとしたら
710.0,712.0,絶対1人は死ぬから
714.0,716.0,恐ろしいよなー
720.0,722.0,僕が恋愛対象って
722.0,724.0,いやでもあいつなんか
724.0,726.0,女にモテそうじゃんかわいいじゃん
728.0,730.0,ネットでモテるやつってさ
730.0,732.0,どこかちょっとそういう
732.0,734.0,頼りないやつがモテるでしょ
734.0,736.0,どこか
736.0,738.0,母性本能をくすぐられる
738.0,740.0,顔もさかわいらしい顔してんじゃんなんか
740.0,742.0,でも
742.0,744.0,エラ呼吸してはしてるけど
744.0,746.0,ハコフグみたいな顔してんじゃん
746.0,748.0,ポッポッポッポーみたいな
748.0,750.0,後輩系
752.0,754.0,まぁわから
754.0,756.0,俺はわかるけどな
756.0,758.0,モコウとかレトルとかモテるのは
760.0,762.0,本当に思ってる絶対そうだよ
762.0,764.0,だってさ
764.0,766.0,まともな顔見せしてたらさ
766.0,768.0,インターネットで恋愛しようなんて思わねえんだよ
768.0,770.0,で
770.0,772.0,そんなやつって多分さ
772.0,774.0,普通に恋愛してきてないはずなんだよ
776.0,778.0,だからさ
778.0,780.0,そうなるでしょ
782.0,784.0,器用は元気だからじゃない
784.0,786.0,元気だから
786.0,788.0,あいつ元気じゃんなんか
788.0,790.0,ゲロとかは
790.0,792.0,あんまり女にモテてないと思うんだよね
792.0,794.0,あいつ多分しゃべんなきゃもっともっと
794.0,796.0,ソラルとかにも勝てると思うんだけど
796.0,798.0,あいつさ面白いんだよ
798.0,800.0,男の人気が
800.0,802.0,邪魔してるよねあいつのもっと
802.0,804.0,ゲロってさすごい歌もめっちゃうまいし
804.0,806.0,顔もかっこいいじゃん
806.0,808.0,でモテてると思うのね
808.0,810.0,でもっとモテるはずじゃん
810.0,812.0,もっとモテない?
812.0,814.0,男の人気が
814.0,816.0,その彼の女にさ
816.0,818.0,だからさちょっとさ変なこととかも
818.0,820.0,言うじゃん
820.0,822.0,俺はそれが好きなんだけど
822.0,824.0,なんか
824.0,826.0,絶対もっとモテるんだろうなって
826.0,828.0,男性人気は多分
828.0,830.0,歌い手の中で俺一番高いと思う
830.0,832.0,だってさ男の歌い手でさ
832.0,834.0,男の人気あるやつ
834.0,836.0,なんていないでしょ一人も
836.0,838.0,いやもっとモテるよ
838.0,840.0,もっとモテると思う
842.0,844.0,恭ちゃんはだって彼女いるじゃん
844.0,846.0,恭ちゃん彼女と一緒にyoutubeやってない?
846.0,848.0,俺さ昨日恭ちゃんのさ
848.0,850.0,あのツイキャス見ててさ
850.0,852.0,あいつ150キロまで
852.0,854.0,増えてるらしくて
854.0,856.0,俺ねデブ好きじゃんデブ
856.0,858.0,さすがにデブ好きの俺も
858.0,860.0,心配になっちゃって
860.0,862.0,恭ちゃんにあと30キロちょっと落としてほしいんだよね
862.0,864.0,死ぬじゃんさすがに
868.0,870.0,死ぬじゃんもうすぐそんなの
870.0,872.0,しかも恭ちゃん俺より身長
872.0,874.0,低いと思うんだよ170キロ150キロってさ
874.0,876.0,ドラえもんじゃん
878.0,880.0,さすがにちょっとね
880.0,882.0,心配になったわ
882.0,884.0,さすがに
884.0,886.0,缶オケ入らねえよなあ
886.0,888.0,でもうちのお父さん大工だから
888.0,890.0,恭ちゃん死んだらうちのお父さんに仕事回してなちゃんと
890.0,892.0,遊戯王に書いといてくれ
894.0,896.0,加藤純一のお父さんに缶オケ作ってもらってください
896.0,898.0,特別だよ
898.0,900.0,特別
902.0,904.0,一之丞200キロは人間じゃないって自虐してた
904.0,906.0,でも一之丞ってさ
906.0,908.0,身長190くらいあるでしょ
908.0,910.0,恭ちゃんマジでもうちょっとやったほうがいいよ
910.0,912.0,120くらいになったほうがいいよ
914.0,916.0,120くらいになったほうがいいよ
916.0,918.0,それか60キロぐらいまで落として
918.0,920.0,皮ビロビロの恭ちゃんみたいな
920.0,922.0,あのさ急にダイエットするとさ
922.0,924.0,皮がビロンビロンに
924.0,926.0,伸びるじゃん
926.0,928.0,あれやってみてほしいな
928.0,930.0,俺マジそれ見たい
930.0,932.0,ビロッビロ
932.0,934.0,俺そしたらさ布団
934.0,936.0,今噛んでねえから恭ちゃんの皮で寝るから
936.0,938.0,ちょうど方形で俺皮かむりだし
940.0,942.0,そういう動画2人でコラボしようぜ
942.0,944.0,懲戒期かなんかで
944.0,946.0,恭一郎の皮で寝れるのかみたいな感じで
946.0,948.0,ビロンビロンの皮で
948.0,950.0,恭一郎の皮で
950.0,952.0,大人何人寝れるのかみたいな
952.0,954.0,絶対一戦目
954.0,956.0,PPAPなんか目じゃねえくらい
956.0,958.0,世界丸見え出れるぜ2人で
958.0,960.0,彼女が痩せたら別れないって言ったら
960.0,962.0,無理だぞ
962.0,964.0,お前恭一郎の遺産目当てじゃねえだろな
964.0,966.0,太らせて太らせて狩る気持ちじゃねえだろな
966.0,968.0,俺恭ちゃん好きなんだから
968.0,970.0,長生きさせてくれな
970.0,972.0,長生きさせてな
976.0,978.0,あのテーマ嫌いだからやめよう
978.0,980.0,みんなが嫌いな人教えてよ
980.0,982.0,みんなが嫌いな
982.0,984.0,芸能人とかわかんねえから俺
986.0,988.0,生主実況者YouTuber
990.0,992.0,あぶ嫌いなんだ
992.0,994.0,あぶはみんななんで嫌いなの
994.0,996.0,昔はちょっと
996.0,998.0,動画が伸びない頃は汚れ路線で
998.0,1000.0,行こうとしたけどそっちも失敗して
1000.0,1002.0,放送中に泣いて2ヶ月休んでたまたま
1002.0,1004.0,学園ハンサムがヒットして
1004.0,1006.0,あたかも自分はアイドルかのように振る舞って
1006.0,1008.0,大金を稼いでるから嫌いなのみんな
1008.0,1010.0,動画が面白くないとか声がキモいとか
1012.0,1014.0,そういう理由なんだやっぱ
1016.0,1018.0,なるほど
1020.0,1022.0,そういう理由なんだ
1022.0,1024.0,ジャル
1024.0,1026.0,ジャルさんはなんで嫌いなの
1026.0,1028.0,なんでジャルさん嫌いなの
1030.0,1032.0,見た目がなんかあれまさか
1032.0,1034.0,ちゃんとした場所にもスーツも着てこないで
1034.0,1036.0,短パンで来るから
1038.0,1040.0,そういう理由
1042.0,1044.0,業界人ぶってるから
1044.0,1046.0,俺それ言っとくわ
1046.0,1048.0,ジャルさん業界人ぶってるから
1048.0,1050.0,嫌いつってましたよ
1050.0,1052.0,芸能人みたいな
1052.0,1054.0,暮らししてるから
1054.0,1056.0,俺のマネージャーで
1056.0,1058.0,ジャルさんっていうのがいるんだけど
1058.0,1060.0,本当に熱い男なの
1060.0,1062.0,まじで仕事もすごいできるし
1062.0,1064.0,いろんな有名人とかと
1064.0,1066.0,一緒に仕事してるんだけど
1066.0,1068.0,本当に別にさ
1068.0,1070.0,放送に出てるわけじゃないじゃん
1070.0,1072.0,テレビに出てるわけでもないのに
1072.0,1074.0,やたら
1074.0,1076.0,もうさ
1076.0,1078.0,生活のレベルが本当に高くてさ
1078.0,1080.0,俺よく言うんだ
1080.0,1082.0,なんでそんなに
1082.0,1084.0,芸能人みたいな
1084.0,1086.0,嫌とする人があるよね
1086.0,1088.0,そこは別にさ
1088.0,1090.0,普通にやればいいじゃん
1092.0,1094.0,すごいなんかね
1094.0,1096.0,潔癖っぽくない?
1096.0,1098.0,別に普通
1098.0,1100.0,芸能人ぶってる
1100.0,1102.0,みんなから言わせれば
1102.0,1104.0,誰も
1104.0,1106.0,誰でも芸能人ぶってるだろ
1108.0,1110.0,誰でも
1110.0,1112.0,見えってもんがある
1112.0,1114.0,見えあるタイプじゃないんだよな
1118.0,1120.0,いやでもすごいありがたいよ
1120.0,1122.0,本当にありがたいよ
1122.0,1124.0,なんかさだって
1124.0,1126.0,普通にさ売れてる芸人とかと一緒に仕事してるやつは
1126.0,1128.0,金なんていっぱい手に入ってさ
1128.0,1130.0,で
1130.0,1132.0,それでさ
1132.0,1134.0,大金稼いで暮らしていけるのにさ
1134.0,1136.0,よりにも俺選んでさ
1136.0,1138.0,しかも俺に紐付いてる視聴者のさ
1138.0,1140.0,俺の視聴者ってさ
1140.0,1142.0,すごくみたいなもんじゃん
1142.0,1144.0,人生かけて罰ゲームくらってるもんだよ
1144.0,1146.0,でもやっぱ
1146.0,1148.0,楽しい
1148.0,1150.0,自分でもなんだけど楽しそうなんだよね
1150.0,1152.0,上手くいかないことってやっぱ楽しいじゃん
1152.0,1154.0,ハマるじゃん
1156.0,1158.0,なんかまあ面白そうだなって
1160.0,1162.0,悪口言われてかわいそうだなって思ってるけど
1166.0,1168.0,まあだから信頼はすごいしてる
1168.0,1170.0,本当に
1170.0,1172.0,上手くいたところで切り捨てられるということを
1174.0,1176.0,山田って三流なのにニコライスで大物切ってて嫌い?
1176.0,1178.0,お前それをニコライスで本人に言えよ
1180.0,1182.0,俺に言うんじゃねえよ
1182.0,1184.0,俺だって俺からしてみればすげえもんだって
1188.0,1190.0,血跡裁判になっちゃうじゃん血跡裁判
1192.0,1194.0,血跡裁判になっちゃうじゃん
1194.0,1196.0,なんかいないの実況者で
1198.0,1200.0,実況者でいないの
1200.0,1202.0,最近の嫌いなやつ教えてよ
1206.0,1208.0,牛沢なんで嫌いなの
1210.0,1212.0,なんで嫌いなの
1212.0,1214.0,牛沢
1214.0,1216.0,なんで嫌いなの
1218.0,1220.0,顔が嫌いなの
1222.0,1224.0,それ言われてたら何も
1224.0,1226.0,向こうも反論する余地がないじゃん
1228.0,1230.0,それってお前の生理的なものじゃん
1232.0,1234.0,すごい素直な感情じゃんそれって
1234.0,1236.0,なんかさでもさ
1236.0,1238.0,俺ありだと思うんだけどな
1238.0,1240.0,そういうのって
1240.0,1242.0,だってさ自分もさ
1242.0,1244.0,例えばさ
1244.0,1246.0,ニコライスとかもさ
1246.0,1248.0,俺思うんだけどさ
1248.0,1250.0,俺の視聴者だってさ
1250.0,1252.0,わざわざ時間使って
1252.0,1254.0,見に来てくれてんだよ
1254.0,1256.0,1時間
1256.0,1258.0,あんなにいっぱいコメントしてくれてんだよ
1258.0,1260.0,他の公式放送見てごらんよ
1260.0,1262.0,コメントなんてみんなしてねえじゃん
1264.0,1266.0,面白かったよとかかっこいいなと思ったら
1266.0,1268.0,比較的かっこいいなってコメントしてくれるじゃん
1268.0,1270.0,それでさ
1270.0,1272.0,ダメだったときに叩かれてさ
1272.0,1274.0,それをやめてくださいっていうのは
1274.0,1276.0,ありえないんだよ
1276.0,1278.0,俺からしてみれば
1278.0,1280.0,だったらコメント一切禁止にしてくださいって
1280.0,1282.0,俺は思っちゃうの
1282.0,1284.0,都合のいいコメントだけで
1284.0,1286.0,コメント1万2万してくれってのは
1286.0,1288.0,虫のいい話でさ
1288.0,1290.0,だから
1290.0,1292.0,それありきで出てきてほしいよね
1292.0,1294.0,マジで
1294.0,1296.0,だったら全部俺を共演NGにして
1296.0,1298.0,閉じこもっててほしい
1298.0,1300.0,じゃないとやっぱお互い損しかないじゃん
1300.0,1302.0,自分の欠点を
1302.0,1304.0,指摘してくれる人って本当に大事だからさ
1310.0,1312.0,本当に大事だから
1312.0,1314.0,それで何くそこの野郎って思ってさ
1314.0,1316.0,俺は出てきてほしいんだよな
1316.0,1318.0,俺の視聴者なんか
1318.0,1320.0,別にそんな大した奴らじゃねえんだからさ
1322.0,1324.0,だから
1324.0,1326.0,なんか俺はちょっと
1326.0,1328.0,でもニコ生のスタッフはすごい分かってるからいいんだけど
1328.0,1330.0,なんか悲しいなって思うときが
1330.0,1332.0,ゼロじゃない
