start,end,text
0.0,2.0,始めました
2.0,4.0,はい
4.0,6.0,始めましたよ
6.0,8.0,ラスは国すべ
8.0,10.0,そうだな
10.0,12.0,どうもおま
12.0,14.0,こんばんは
14.0,16.0,こんばんま
16.0,18.0,なに?
18.0,20.0,待っておめえの声がちっちぇ
20.0,22.0,こんばんま
26.0,28.0,もうちょっと
28.0,30.0,あーって言ってくれ
30.0,32.0,OK
34.0,36.0,タイトルがびっくりするぐらいむかつくな
36.0,38.0,どういうことだよ
38.0,40.0,アンチがいるんだよ
40.0,42.0,もうね
42.0,44.0,この前ね
44.0,46.0,酔っ払った勢いで
46.0,48.0,怒ってしまってね
48.0,50.0,思い出した
50.0,52.0,酔っ払った中
52.0,54.0,すごい
54.0,56.0,怒っちゃいました
56.0,58.0,本当に
58.0,60.0,溶けたな
60.0,62.0,本当に
62.0,64.0,本当にすいませんでした
64.0,66.0,申し訳ありません
68.0,70.0,臨時にも怒られませんでしたけど
70.0,72.0,あの時こそ
72.0,74.0,すごく
74.0,76.0,全てにおいて疑心暗鬼になってましたね
76.0,78.0,なんかね
78.0,80.0,あったんだよその日
80.0,82.0,まさかそうだそうだ
82.0,84.0,あのさ
84.0,86.0,俺同期がやめちゃったのよ
86.0,88.0,あそうなんだ
88.0,90.0,俺も結構同期がどんどんどんどん少なくなってて
90.0,92.0,唯一の男の
92.0,94.0,同期がやめてしまってね
94.0,96.0,なんで俺
96.0,98.0,引き金があったんだよ
98.0,100.0,俺なんか言ったんだよな
100.0,102.0,同期ってのは
102.0,104.0,最初で最後だぜって
104.0,106.0,あったらもう最初で最後だぜって
106.0,108.0,そいつが
108.0,110.0,あったらもう同期は同期じゃないんだぜ
110.0,112.0,みたいな話をしたんだよね
112.0,114.0,そしたらさ
114.0,116.0,うるせえよバーカみたいな
116.0,118.0,赤汁がボワーって流れた瞬間に
118.0,120.0,引き金がカチーンって
120.0,122.0,てめえこの野郎ふざけんじゃねえぞとね
122.0,124.0,なんでそれ
124.0,126.0,俺もねなんでこんなことで怒っちゃったんだろう
126.0,128.0,って思ったよ本当に
128.0,130.0,今考えると本当にクエスチョンマークだよ
130.0,132.0,なんで怒っちゃったんだろうって思ったよ
132.0,134.0,よっちに迷惑かけんな
134.0,136.0,よっちに迷惑かけんなってコメだ
136.0,138.0,あったあったあった
138.0,140.0,そうだそうだそうだ
140.0,142.0,もうあの時はもうだめだった
142.0,144.0,俺がもうね
144.0,146.0,疑心暗鬼状態だった
146.0,148.0,それ含めてなんか
148.0,150.0,面白ええよ
150.0,152.0,もうディスり込めしか見えない状態になってた
152.0,154.0,普通のさ
154.0,156.0,なんていうんだろうね
156.0,158.0,何言ってんのよみたいな感じの
158.0,160.0,コメント欄で全く見えなくてさ
160.0,162.0,うん
162.0,164.0,本当にね
164.0,166.0,危なかった
166.0,168.0,それで思い出したんだけどさ
168.0,170.0,俺とおめえって喧嘩したことなくない
170.0,172.0,今思えば
172.0,174.0,喧嘩したこと
174.0,176.0,ないね
176.0,178.0,ないね
178.0,180.0,ないね
180.0,182.0,ないっていうかなんか基本的にさ
182.0,184.0,お互い喧嘩しないんじゃね
184.0,186.0,小学校とかはまた別として
186.0,188.0,そうだね
188.0,190.0,他の人とそれそもそも
190.0,192.0,確かにさ俺がさ
192.0,194.0,おめえ超浮かむるバスに似てる
194.0,196.0,って怒んないじゃん
196.0,198.0,怒るあれがないよね多分ね
198.0,200.0,ないよ
200.0,202.0,そうなっちゃったんだな
202.0,204.0,ちょっと怒るよね
204.0,206.0,ちょっと浮かむるバスじゃねみたいな
206.0,208.0,言われたらさ
208.0,210.0,ちょっと怒るよね
210.0,212.0,どうなんだろうね
212.0,214.0,怒んねえだろ
214.0,216.0,それで怒ったらもうやべえぞ
216.0,218.0,あれだね
218.0,220.0,1年間嘘つかれたときってなんだ
220.0,222.0,なんかおめえさ俺がさ
222.0,224.0,死後の世界に行けるんだってずっと嘘ついてた
224.0,226.0,かったよね
226.0,228.0,死後の世界?
228.0,230.0,あの世の話か
230.0,232.0,あの世の話か
234.0,236.0,あんときの話しようぜ
238.0,240.0,俺がさ半年かくらいずっとおめえに嘘ついてた
240.0,242.0,毎晩毎晩さ
242.0,244.0,半年じゃねえぞお前
244.0,246.0,どれくらいだよ
246.0,248.0,もっとだっけ
248.0,250.0,ずっと嘘ついてたよね
250.0,252.0,ずっと嘘ついてたよ
252.0,254.0,なんだっけな
254.0,256.0,あれなんだっけ
256.0,258.0,ガキの頃の話だか覚えてないよね
258.0,260.0,18、19くらいでしょ
260.0,262.0,高校卒業してからの話だよ
262.0,264.0,じゃ思い出した
264.0,266.0,なんかさ
266.0,268.0,どんな話だったっけな
268.0,270.0,お前がとりあえずあの世に行ける能力を
270.0,272.0,手に入れたみたいな
272.0,274.0,はじめは信じませんよ
274.0,276.0,で何言ってんだよと
276.0,278.0,言ったらほんとだって
278.0,280.0,この前さ
280.0,282.0,よっちゃんだから
282.0,284.0,天宮に
284.0,286.0,体験したんだよみたいなこと言って
286.0,288.0,でそれでほんとかよと思って
288.0,290.0,よっちゃんと遊んだときに
290.0,292.0,ふとそういう話を振ったら
292.0,294.0,そうそうそうそう
296.0,298.0,みんなもさそのこと知ってたから
300.0,302.0,なんだっけな
302.0,304.0,なんだっけ
304.0,306.0,俺これからね
306.0,308.0,お前優待離脱できるようになったって言ったんだよな
308.0,310.0,なんかそういう話してたよね
310.0,312.0,そうそう優待離脱できるようになったって言ったから
312.0,314.0,で俺ねちょっと信じてきちゃって
314.0,316.0,みんなもなんかいけるぜいけるぜ体験してみなとか言って
316.0,318.0,言ってくるから
318.0,320.0,しかもなんかさお前がさちょっとさ
320.0,322.0,そういう知識勉強して俺に振ってきたじゃん
322.0,324.0,そうそうそうそう
324.0,326.0,でもその知識は全部予習済みだったから
326.0,328.0,そうなんだよ優待離脱について
328.0,330.0,ちょっと興味持って
330.0,332.0,なんでね優待離脱するってのがあって
332.0,334.0,そこでちょっと私見てきたんですけども
334.0,336.0,なんかねこう
336.0,338.0,寝るときになったら体が超振動を起こして
338.0,340.0,気がついたらもうふわっと
340.0,342.0,自分が見えるみたいなような
342.0,344.0,下りの話をしたらあそうそうそう
344.0,346.0,その後にこういうことがあってこうなんだみたいなことを言われて
346.0,348.0,そのさらに上を言われてさ
348.0,350.0,うわこいつマジだと思って
350.0,352.0,ちょっと待ってマジかマジかと思って
352.0,354.0,一回ガチで信じてたんだよ
354.0,356.0,信じた信じた信じた
356.0,358.0,あれさなんでネタバラシしたんだっけ
358.0,360.0,なんかすげえおめえがっかりしてたよね
360.0,362.0,俺ほんと信じてさ
362.0,364.0,あの世行けると思ってたのにみたいな
364.0,366.0,でもねそうなんだよ
366.0,368.0,半年くらい経ったらさ
368.0,370.0,あもうすごい楽しみじゃん
370.0,372.0,今度儀式すべえって
372.0,374.0,なんだっけ寝るんだよね
374.0,376.0,なんか俺とおめえが一緒に寝るんだよね
376.0,378.0,手繋いで寝なきゃいけない
378.0,380.0,そう手繋いで寝て
380.0,382.0,そうすると7時間くらいしかやらないといけないんでしょ
382.0,384.0,その儀式は
384.0,386.0,確かに長時間かかるからおめえ飯はいっぱい食っとけみたいな
386.0,388.0,そうそうそうそう
388.0,390.0,おむつはいとけとか
390.0,392.0,Uターン離脱したとき
392.0,394.0,種流しながらおむつ買っとけみたいな
394.0,396.0,懐かしい
396.0,398.0,あったな
398.0,400.0,でもねネタバラシはね
400.0,402.0,普通に会ったときに普通に言われたんだよね
402.0,404.0,おめえと遊んでるときにね
404.0,406.0,おーあれさ言うけど嘘だわ
406.0,408.0,みたいな普通にさ
408.0,410.0,多分飽きちゃったんだな俺
410.0,412.0,おめえが飽きてさあれ嘘だわごめんなよみたいな
412.0,414.0,あれはね怒りはしなかったけど
414.0,416.0,本当に残念だった
416.0,418.0,本当に
418.0,420.0,しかもなんかさうんこちゃんカルト
420.0,422.0,宗教にはまるみたいな嘘もついたよね俺
422.0,424.0,カルト宗教あ
424.0,426.0,なんかさ
426.0,428.0,違えおめえの実家に
428.0,430.0,行ったときに
430.0,432.0,おめえのさおならしちゃった
432.0,434.0,おめえの実家に行ったときに
434.0,436.0,あれなんだよねなんだっけな
436.0,438.0,キリスト教本みたいなのがあったんだよね
438.0,440.0,なんかそういう
440.0,442.0,キリスト教じゃないけどなんかそういういかがし本を
442.0,444.0,なんていうの
444.0,446.0,見えるように置いといてさ
446.0,448.0,おめえなんだよこれって
448.0,450.0,おめえがねおめえが気づいてくれたじゃん
450.0,452.0,おめえなにこれみたいな感じで
452.0,454.0,ガッツポーズして
454.0,456.0,そうなんだ
456.0,458.0,これすごい自然だと思った
458.0,460.0,すごかったよなあれ
460.0,462.0,なんだっけな
462.0,464.0,キリシタンだったんだみたいな感じで
464.0,466.0,俺なんか
466.0,468.0,当時ほらそういう宗教とか
468.0,470.0,よくわかんなかったけどもね
470.0,472.0,俺いろいろ思ったんだぜあんとき
472.0,474.0,おめえとさこう
474.0,476.0,結構ね仲良くさせてもらってんのにね
476.0,478.0,あの
478.0,480.0,今になってこういうこと言われて
480.0,482.0,俺キリスト教だったんだみたいな
482.0,484.0,ことをさ俺が見つけちゃったじゃん
484.0,486.0,だから
486.0,488.0,すごく苦い空気になっちゃって
488.0,490.0,なんか悪いことしちゃったなみたいな
490.0,492.0,こいつずっと言わなかったんだ
492.0,494.0,俺に言わなかったことはたぶん隠したかったんだろうなって
494.0,496.0,本当に誰にも言わないにしよう
496.0,498.0,と思って誰にもこれは言ってないんだけど
498.0,500.0,お前嘘つくんじゃねえ
500.0,502.0,てんぐちゃんから聞いたぞそれ
502.0,504.0,てんぐも嘘つくんじゃねえよ
504.0,506.0,てんぐからさおめえなんか
506.0,508.0,ふとんちゃんから連絡来たぞみたいなさ
508.0,510.0,あったぞお前その報告がよ
510.0,512.0,あ本当に
512.0,514.0,しかもその次の日に
514.0,516.0,じゃあ俺もうだめじゃん
516.0,518.0,別にクソ言いふらしてんじゃねえけど
518.0,520.0,じゃあだめだ俺全然覚えてねえ
522.0,524.0,いやいやいやたぶん確認したかったんだ
524.0,526.0,たぶんそのときもたぶんそんなに
526.0,528.0,俺はね
528.0,530.0,まずおだね
530.0,532.0,いやいやでも本当によかったですよ
532.0,534.0,別にいいんだけどさ
534.0,536.0,その気にしたのも全然いいんだけども
536.0,538.0,そういうくだらねえ嘘つくの流行ってたよね
538.0,540.0,流行ってた本当に
540.0,542.0,おめえあったでしょ
542.0,544.0,今日一日超嘘つくべえみたいなさ
544.0,546.0,そう
546.0,548.0,意気込む日あったでしょ
548.0,550.0,ふとんちゃん超嘘つくべえみたいな
550.0,552.0,うんあったな
552.0,554.0,その延長上にさもうすごい嘘
554.0,556.0,だからこの人あれらしいですよ
556.0,558.0,自分ちの実家の墓を荒らして
560.0,562.0,お骨を持ってきて
562.0,564.0,俺に見せようとしてたんですよ
564.0,566.0,じゃあ荒らしたんじゃなくてちょうどね
566.0,568.0,じいちゃんの墓を作ったときに
568.0,570.0,シャレ神戸が出てきて
570.0,572.0,仏壇になんか飾ろうみたいなね
574.0,576.0,そういうあれがあったから
576.0,578.0,そんぐらいまでしないと信じねえかなみたいな
580.0,582.0,それ見せられたら俺ちょっと本当に
582.0,584.0,まあてか信じたんだけども
584.0,586.0,まあ鉄板だったよな
586.0,588.0,それ見たらな
588.0,590.0,シャレ神戸ってすごいな本当にね
590.0,592.0,なんかでも今考えると
592.0,594.0,本当にバカだよね
594.0,596.0,まあ今思えばね
596.0,598.0,だけどすごいまあ面白かったよ
600.0,602.0,来てたなって思ってた本当に
602.0,604.0,暇だったんだろうな
604.0,606.0,確かにな
606.0,608.0,いやでもすごいよ
608.0,610.0,今思えば幸せですよ
610.0,612.0,そうだね
612.0,614.0,あんなこともできないもんね
614.0,616.0,まあできないね
616.0,618.0,信じてくれないしよ
618.0,620.0,誰も信じないっていうよりもさ
620.0,622.0,なんだろうあのときはね
622.0,624.0,夢に詰まった時期だったからね
624.0,626.0,高校卒業してさ
626.0,628.0,まあそうだね自分たちの未来は
628.0,630.0,華々しいものだっていう時期だったからね
630.0,632.0,なんでもできるって
632.0,634.0,俺今一人暮らしなんでもできるって
634.0,636.0,言うたりだよ
636.0,638.0,一人暮らししたら上京したら
638.0,640.0,なんかそうしたら
640.0,642.0,言うたりだとしたらさ
642.0,644.0,すごい気持ちいいセックスができるんだって
644.0,646.0,言うたりだとしたらさ
646.0,648.0,ゆうれとすごいいっぱいセックスができるんだって
648.0,650.0,もういいよそういうのは
650.0,652.0,信じてねえよそういうの全く
652.0,654.0,分かりました
656.0,658.0,すごいね
658.0,660.0,俺何が楽しみだったって
660.0,662.0,それがすごく楽しみでさ
662.0,664.0,おめえ超チンポロたちがいいからな
664.0,666.0,びっくりするぐらい
668.0,670.0,楽しかったね本当にね
672.0,674.0,まあまあまあそういう時期もありましたね
674.0,676.0,本当にね
676.0,678.0,懐かしいな
678.0,680.0,懐かしい本当に懐かしい
680.0,682.0,あれだってそう
682.0,684.0,思い出のあるよそれさ
684.0,686.0,言わなかったら結構
686.0,688.0,忘れてきたな忘れてたな本当に
688.0,690.0,あー
690.0,692.0,今思い出しといてよかった
692.0,694.0,本当に
694.0,696.0,すごい幸せなでもね嘘つかれたと言え
696.0,698.0,すごい幸せな思い出だよ
698.0,700.0,なんか毎晩2時間ぐらい
700.0,702.0,電話してたよねあの時ね
702.0,704.0,あの時やばかった俺携帯電話さ
704.0,706.0,親にちょうど月4万ぐらいってさ
706.0,708.0,大抵俺との
708.0,710.0,携帯電話2万とかだったもん
710.0,712.0,ほとんどおめえとさ
712.0,714.0,電話してさあの時会ったな
714.0,716.0,2時間3時間
716.0,718.0,ぶっつけて連絡してたよな
718.0,720.0,しかもさ
720.0,722.0,お互いの撮った自分の動画とか送りまくってた
722.0,724.0,そうそうそうそう
724.0,726.0,そういうなんかあったんだろうね
726.0,728.0,そういうのが
728.0,730.0,くだそうだなやばかったな本当にな
730.0,732.0,エドモンドホンダのモノマネとか送ってたじゃん
732.0,734.0,あったあったあった
734.0,736.0,あれなんなん
736.0,738.0,しかもあれでしょホテルでしょ
738.0,740.0,あれで彼女が
740.0,742.0,彼女の実家に遊びに行った時に
742.0,744.0,ホテルで一人暇でさ
744.0,746.0,なんかねえかなって思って
746.0,748.0,やべえ
748.0,750.0,すっ黒歴史だわあれ
750.0,752.0,あれクソ面白えったわでも本当に
752.0,754.0,パーパーパーみたいなさ
754.0,756.0,しかも無駄に編集してんだよね
756.0,758.0,無駄に編集しててさ
758.0,760.0,なんだっけパーパーパーって画面切り替わってさ
760.0,762.0,横からパーパー
762.0,764.0,前からもパーパーパーみたいなさ
764.0,766.0,あの時いろいろね
766.0,768.0,あのー
768.0,770.0,作ってたんだよそういうの
770.0,772.0,いやすごかった本当に
772.0,774.0,俺はもうめっちゃ寒いもの
774.0,776.0,どんどん送ってたけどね
776.0,778.0,おめえ本当にやばかったよね
778.0,780.0,俺だってもうさ
780.0,782.0,あれなんだろうね本当にもう
782.0,784.0,騒音問題じゃないけど
784.0,786.0,騒音問題じゃないよなんかもう一方的にさ
786.0,788.0,送ってたもんね
788.0,790.0,でもさおめえのさ
790.0,792.0,指のやつ覚えてる指
792.0,794.0,あ
794.0,796.0,指だけでさ
796.0,798.0,わかるみたいな動画
798.0,800.0,あれめっちゃ面白かったんだよね
800.0,802.0,なんかあったな俺なんだっけそれ
802.0,804.0,トントントーン
804.0,806.0,トカチカトーン
806.0,808.0,あったあった
808.0,810.0,誰にも伝わんねーから言ってくれなかったんだよ
812.0,814.0,本当にちくさ伝わんねーじゃんこれ
814.0,816.0,本当だから言いたくなかったんだよ
816.0,818.0,これ視聴者もさ
818.0,820.0,みたいなさ
820.0,822.0,ちょっと待って
822.0,824.0,おめえに伝えた
824.0,826.0,大きな声が出せない
826.0,828.0,あれは本当に
828.0,830.0,これは本当に視聴者に初めて謝るわ
830.0,832.0,あった俺
834.0,836.0,ちょっと待って一回休憩させて
838.0,840.0,あ
840.0,842.0,トカチカトカチカトカチカ
842.0,844.0,トカチカトカチカトカチカ
844.0,846.0,指が最後しみるみたいなさ
848.0,850.0,待ってあ
850.0,852.0,考えればさそういうの取っとけばよかったよね
852.0,854.0,取っとけばよかった
854.0,856.0,あれちょっと見せたかったなみんなに
860.0,862.0,あぶねちょっと待ってごめん
862.0,864.0,本当にごめんお腹痛い
864.0,866.0,俺さ
866.0,868.0,あの
868.0,870.0,同期が辞めちゃった日にさ
870.0,872.0,あの
872.0,874.0,俺すっごい男にさ
874.0,876.0,あの
876.0,878.0,4人でカラオケに行ったんだけど
878.0,880.0,男4人でカラオケに行って
880.0,882.0,2時間いて2曲しか歌わなくて
882.0,884.0,まあそうなの
884.0,886.0,で何をやってたかって言ったらさ
886.0,888.0,もうみんな全裸になってプロレスしてたの
888.0,890.0,全裸プロレス
890.0,892.0,でさ俺柔道部のやつにさ
892.0,894.0,裸締めみたいなやつさ
894.0,896.0,裸締めじゃねえか
896.0,898.0,えーとなんだっけ
898.0,900.0,肩固めみたいな
900.0,902.0,でさ俺肋骨がさ
902.0,904.0,咳しても痛いし笑うとさ
904.0,906.0,おめえそういう人だよなほんとに
906.0,908.0,ほんとに
908.0,910.0,なんか自分怪我したみたいなさ
910.0,912.0,ほんとに痛えんだってまじで
912.0,914.0,おめえさ
914.0,916.0,足の薬指が麻痺してるやつがさ
916.0,918.0,俺さ
918.0,920.0,その時もうむしずらしたんだよね
920.0,922.0,絶対なんでもねえから
922.0,924.0,みたいなさ
924.0,926.0,真鋳指がマジ麻痺してるよーみたいなさ
926.0,928.0,俺心配なんだよ
928.0,930.0,なんか俺絶対脳の病気に
930.0,932.0,かかってるよーみたいな
932.0,934.0,俺そう
934.0,936.0,心配なのしかもそれ
936.0,938.0,ずいぶん最近じゃなくない?
938.0,940.0,1ヶ月以内の
940.0,942.0,話だよねそれね
942.0,944.0,誰も心配してなかった
944.0,946.0,わっちゃんもおめえも誰も心配して
946.0,948.0,誰も
948.0,950.0,また始まったかみたいなさ
950.0,952.0,ちょっとほんとに痛い
952.0,954.0,ほんとに笑うと痛いんだけど
954.0,956.0,ほんとにでも
956.0,958.0,すんごい痛いんだ
958.0,960.0,誰もそんなことやり妄反しようぜみたいな
960.0,962.0,そうそうそうそう
962.0,964.0,でさで
964.0,966.0,その肋骨がたぶんちょっとね痛いんだけど
966.0,968.0,筋肉か骨かわかんないけど
968.0,970.0,いてんだよでプラス
970.0,972.0,俺さ
972.0,974.0,5万回しちゃってさ
974.0,976.0,何5万回って
976.0,978.0,ケツの穴にさ第二
978.0,980.0,指まで指入れられちゃった俺
980.0,982.0,笑
982.0,984.0,最悪だってさ
984.0,986.0,そのやめるやつだよ
986.0,988.0,やめるやつが
988.0,990.0,なんかこう前裸で
990.0,992.0,なんつーのあれやんじゃんお股とさ首をさ
992.0,994.0,グーってやるあの柔道の
994.0,996.0,締める技あんじゃん
996.0,998.0,ケサなんだっけあるでしょ
998.0,1000.0,そんときにグーってやるときに
1000.0,1002.0,中指が俺のケツの穴に
1002.0,1004.0,入っちゃってブルってなんつーの
1004.0,1006.0,入れるときってこうなんつーの
1006.0,1008.0,指を回すじゃん指を回して
1008.0,1010.0,グリグリグリグリグリズブって
1010.0,1012.0,入れるんじゃなくてズボンって入ってさ
1012.0,1014.0,俺のケツの穴に
1014.0,1016.0,最悪だって
1016.0,1018.0,痛くて痛くて
1018.0,1020.0,笑
1020.0,1022.0,でね
1022.0,1024.0,でねそいつが
1024.0,1026.0,そいつ別にホモとかじゃないの
1026.0,1028.0,わかるよ
1028.0,1030.0,でその後になんかそいつが
1030.0,1032.0,やべえごめんって言って
1032.0,1034.0,俺もね痛かった
1034.0,1036.0,痛かったっていうよりもちょっと心配だったのが
1036.0,1038.0,いやごめんってあのー
1038.0,1040.0,鈴木さんでいいや鈴木さん
1040.0,1042.0,あのちょっとさ中指の匂い
1042.0,1044.0,噛んでくれって今入ったぞ
1044.0,1046.0,って絶対今
1046.0,1048.0,入ったからっていや入ってない入ってない入ってない
1048.0,1050.0,って絶対入ったからって
1050.0,1052.0,噛んでみてくれって言って
1052.0,1054.0,噛んだらあ
1054.0,1056.0,うんこの匂いがするって言って
1056.0,1058.0,そいつが完全にね
1058.0,1060.0,入ってしまったんですね
1060.0,1062.0,笑
1062.0,1064.0,まああのー
1064.0,1066.0,そういう話がありました
1066.0,1068.0,そんな中ね私
1068.0,1070.0,家に帰って配信して配信したらね
1070.0,1072.0,まあ疑心ヤンキーモードですよでそれで
1072.0,1074.0,あのー怒っちゃいましたね
1074.0,1076.0,あのー
1076.0,1078.0,良くないコメントにね
1080.0,1082.0,最悪だなそれ
1082.0,1084.0,そうだ俺初めてだよ
1084.0,1086.0,女にもさ触られたことない
1086.0,1088.0,俺ケツの穴触られるの
1088.0,1090.0,あんま好きじゃねえんだよ
1090.0,1092.0,お前でもよっちゃに触られてんじゃねえかいつも
1092.0,1094.0,ああまあ
1094.0,1096.0,そういう時は我慢するよなんかやだけどなんか
1098.0,1100.0,そうそうそうそう
1100.0,1102.0,しかもさおめえらさ二人っきりの時にやるじゃん
1102.0,1104.0,何が
1104.0,1106.0,ああそうなんだよね
1106.0,1108.0,なんかさ隔離思惑みたいなことしてんじゃんなんかよく
1108.0,1110.0,二人っきりでさ
1110.0,1112.0,寝てる寝てる相手の寝てる
1112.0,1114.0,時のさ乳首をなめるみたいなさ
1114.0,1116.0,それはちょっとやめたほうがいいと思う
1116.0,1118.0,寝てるよっちゃんのちんぽをさわってさ
1118.0,1120.0,ぼっきさせるみたいなさ
1120.0,1122.0,ありますよそういうのは
1122.0,1124.0,でぼっきさせたら勝ちみたいな
1124.0,1126.0,寝てるからね
1126.0,1128.0,相手は寝てるからね
1128.0,1130.0,相手は夢見物語のさ
1130.0,1132.0,女の子とちんちんさわられてるって
1132.0,1134.0,思ってると思うんだけど
1134.0,1136.0,まあ確かにそうだな
1140.0,1142.0,まあまあまあ
1142.0,1144.0,よっちも嫌がってたって
1144.0,1146.0,よっちも嫌がってたって
1146.0,1148.0,あそう
1148.0,1150.0,それ言われたらちょっときついわ
1150.0,1152.0,それ
1152.0,1154.0,よっちも
1154.0,1156.0,おめえそういうさ
1156.0,1158.0,行き地が本当に高えよな
1158.0,1160.0,高いっていうか低いのかな
1160.0,1162.0,なんかわかんないけど
1162.0,1164.0,あの
1164.0,1166.0,なんかそういうのがさ全然平気にできちゃうみたいな感じなんだよ
1166.0,1168.0,ちんちんでしょなめれるよ
1168.0,1170.0,みたいな
1170.0,1172.0,特殊能力だよな
1172.0,1174.0,めれるよみたいなさ
1174.0,1176.0,すごいよね
1178.0,1180.0,なんかね
1180.0,1182.0,昔てんぐちゃんのおしっこで手洗ってたもん
1182.0,1184.0,だって俺
1184.0,1186.0,蛇口の真似してね
1186.0,1188.0,誰も信じてくれなくてさ俺放送で言ったの
1188.0,1190.0,誰も信じてくれなくてさ
1190.0,1192.0,俺そうだよ
1192.0,1194.0,昔こうね
1194.0,1196.0,水がもったいねえから
1196.0,1198.0,てんぐちゃんおしっこしてくれって
1198.0,1200.0,酔っ払ってるときだけどね
1200.0,1202.0,ちゃばちゃばって
1202.0,1204.0,なんだっけな
1204.0,1206.0,てんぐちゃん顔下ろすだろ多分
1206.0,1208.0,おーいいよ
1208.0,1210.0,なんか
1210.0,1212.0,マニアのAVみたいな感じだったよね
1212.0,1214.0,飲まして
1214.0,1216.0,てんぐちゃんのやつを飲まして
