start,end,text
1216.0,1218.0,普通に口の中でビャーってやってた
1218.0,1220.0,あれ本当に俺はそのとき聞いた
1220.0,1222.0,マジで
1222.0,1224.0,あったな
1224.0,1226.0,あれもだって学生の時
1226.0,1228.0,スカトローみたいな感じだったな
1228.0,1230.0,若いときだよね
1230.0,1232.0,本当にね
1232.0,1234.0,完全にクレイジー竹田でしたね
1236.0,1238.0,ありましたありました
1240.0,1242.0,俺そういうの一切ダメだからなマジで
1242.0,1244.0,うーん
1244.0,1246.0,おめえはあれだな
1246.0,1248.0,でも旗から見てこうやって
1248.0,1250.0,ははははって笑うっていうよりもさ
1250.0,1252.0,やめようよ
1252.0,1254.0,やめとけよみたいなさ
1254.0,1256.0,そういう空気になっちゃうよ
1256.0,1258.0,確かに確かに確かに
1258.0,1260.0,いやいや
1260.0,1262.0,昔の話ですよ昔の話
1262.0,1264.0,最近一切しないよね
1264.0,1266.0,一切しませんそんなもう
1266.0,1268.0,辛いですよ
1268.0,1270.0,一人暮らししてさ
1270.0,1272.0,俺なんでもできるってさ
1272.0,1274.0,親の目がないからおしっこで手洗っても
1274.0,1276.0,なんでも許されるみたいなね
1276.0,1278.0,時期だったね
1278.0,1280.0,懐かしいな
1280.0,1282.0,うん
1284.0,1286.0,最近さゲロの苦痛施術やってさ
1286.0,1288.0,でも
1288.0,1290.0,俺それ引いたわ視聴者引いて
1290.0,1292.0,最近そうだよ
1292.0,1294.0,あのよっちゃん家でね
1294.0,1296.0,あの
1296.0,1298.0,熊田とかもやってたよでも
1298.0,1300.0,あー俺そんなに行きたかったんだな仕事あったんだよね
1300.0,1302.0,そうそうそう夜中に俺が失踪しちゃって
1302.0,1304.0,なんかおめえにも電話が
1304.0,1306.0,かけた日だな
1306.0,1308.0,寝てたんだけどね
1308.0,1310.0,寝てたよほんとに
1310.0,1312.0,俺もだってやりたくなかったけどもね
1312.0,1314.0,ほんとに
1314.0,1316.0,あれはゲロの
1316.0,1318.0,ゲロっていうか口の中に
1318.0,1320.0,ビーフジャーキーとか天ぷらとか
1320.0,1322.0,刺身とかクッチャクチャクチャクチャクチャしたやつを回す
1322.0,1324.0,みたいな感じですよ
1324.0,1326.0,よくできたなほんとに
1326.0,1328.0,ほんとにみんなさ
1328.0,1330.0,やりたくないよそんなのやりたいっていう
1330.0,1332.0,やりたい奴いないじゃん
1332.0,1334.0,いないねだけどもさほら
1334.0,1336.0,そん時さ誰が笑わしたら
1336.0,1338.0,誰が一番面白かった
1338.0,1340.0,面白いか決めよう大会みたいなやつで
1340.0,1342.0,あー
1342.0,1344.0,それでその言ったやつが
1344.0,1346.0,ゲロの回しやんべみたいなことやって
1346.0,1348.0,引けないじゃんもうそんな
1348.0,1350.0,苦労になった時に
1350.0,1352.0,いやいやいややめようぜみたいなやつが
1352.0,1354.0,言い出せなくてさ
1354.0,1356.0,じゃあやろうよって
1356.0,1358.0,時計回りにさクッチャクチャしたやつが
1358.0,1360.0,どんどんどんどん回るみんなの台詞が
1360.0,1362.0,どんどん混ざり合うんですよ
1362.0,1364.0,あーなんかさ
1364.0,1366.0,ねえそういう話聞くとみんなにやっぱ
1366.0,1368.0,恋しくなるな
1368.0,1370.0,そうだね確かにねそういう流れ
1370.0,1372.0,そういう流れ多分地元でしかないからな
1372.0,1374.0,うん恋しくなった
1374.0,1376.0,多分だっておめえもだっておめえ
1376.0,1378.0,よかったよでもいなくて
1378.0,1380.0,絶対お前クチッとそういうのお前こそ
1380.0,1382.0,大っ嫌いでしょでも
1382.0,1384.0,大っ嫌いってかできねえな俺
1384.0,1386.0,でもなんかもうそういう空気だったよ
1386.0,1388.0,みんなやってたんだって
1388.0,1390.0,8人ぐらいいて8人全員回してたんだよ
1390.0,1392.0,絶対これやんなきゃ
1392.0,1394.0,絶対これやんなきゃっていうね
1394.0,1396.0,空気になるってあれ
1396.0,1398.0,いなくてよかったよほんとにお前
1398.0,1400.0,俺できねえよそれ
1400.0,1402.0,最終的にねよっちゃんが
1402.0,1404.0,あのー
1404.0,1406.0,2周ぐらいしてよっちゃんのとこにさ
1406.0,1408.0,俺よっちゃんに映したんだけど
1408.0,1410.0,右によっちゃんがいて
1410.0,1412.0,最悪よっちゃんだからよかった
1414.0,1416.0,なるほどね
1416.0,1418.0,揺れてる
1418.0,1420.0,続きますな
1420.0,1422.0,余震が
1428.0,1430.0,結構揺れるな
1430.0,1432.0,そんな感じですよ
1432.0,1434.0,なんかさ
1434.0,1436.0,俺常に揺れてるんだよな
1436.0,1438.0,最近
1438.0,1440.0,そういうあれになっちゃうよね
1440.0,1442.0,揺れたと思ったら
1442.0,1444.0,自分の心臓の動機
1444.0,1446.0,俺もそれ
1446.0,1448.0,まだあるじゃん
1448.0,1450.0,だからその
1450.0,1452.0,寝てってやっぱりなるんだよね
1452.0,1454.0,俺調べたよ
1454.0,1456.0,正式名称わかんないけど
1456.0,1458.0,地震症みたいなのがあるんだって
1460.0,1462.0,それでも別に
1462.0,1464.0,治療
1464.0,1466.0,する必要もないって言ってたよ
1466.0,1468.0,ほんとに
1470.0,1472.0,心臓の問題じゃないって言ってた
1472.0,1474.0,ほんとに
1474.0,1476.0,さっきどっかに書いてあったけど
1476.0,1478.0,耳の中の三半規管とか
1478.0,1480.0,そこら辺の問題なんだって
1482.0,1484.0,普通にみんな心臓の動機で
1484.0,1486.0,揺れてるんだけど
1486.0,1488.0,それを察知しないように
1488.0,1490.0,上手くできてるんだけど
1490.0,1492.0,そこが崩れてるらしい
1500.0,1502.0,次は寝るかい
1502.0,1504.0,任せるよ
1506.0,1508.0,ぼちぼちね
1508.0,1510.0,買ってこようかなと思って
1510.0,1512.0,まだ大丈夫だけどな
1512.0,1514.0,どちらかって言ったら寝たくないんだよ
1518.0,1520.0,昼間寝てられるように
1520.0,1522.0,できたら明日暇になっちゃうから
1524.0,1526.0,起きてようかなと思ってずっと
1526.0,1528.0,なるほどね
1528.0,1530.0,だけど配信も
1530.0,1532.0,ずっとやるのも
1532.0,1534.0,確かに
1534.0,1536.0,偽善って言われちゃしょうがないけど
1536.0,1538.0,気が引けるように
1538.0,1540.0,やるときも二人で相談しながら
1540.0,1542.0,やるかって
1550.0,1552.0,こんな感じになっちゃうよね
1552.0,1554.0,探り探り感
1554.0,1556.0,こうやって二人で雑談するのが
1556.0,1558.0,一番いいよね
1558.0,1560.0,今ポケモンとかゲームも
1560.0,1562.0,わーいってできないよね
1562.0,1564.0,楽しくね
1566.0,1568.0,怒られるからやんないとか
1568.0,1570.0,そういうのじゃなくて
1570.0,1572.0,気分的にできないよね
1572.0,1574.0,本音を言うとそうだね
1576.0,1578.0,正直自分たちが寂しいから
1578.0,1580.0,みたいなところもあるしね
1582.0,1584.0,暇なんだなって思った
1584.0,1586.0,配信こうやってできないのも
1586.0,1588.0,暇だなと思って
1588.0,1590.0,しばらくできねえんじゃねえ
1590.0,1592.0,一枠二枠やろうぜって言ったもんな
1592.0,1594.0,そうだね
1598.0,1600.0,俺考えてんだよ
1600.0,1602.0,3月は自粛しようと思って
1602.0,1604.0,マジで
1604.0,1606.0,2週間くらい
1606.0,1608.0,あと2週間くらいだしさ
1610.0,1612.0,企画も延期しようって
1612.0,1614.0,思ってんだよね
1614.0,1616.0,その方がいいと思うよ
1616.0,1618.0,停電も明日だけじゃないでしょ
1618.0,1620.0,やっぱり気が引けるな
1620.0,1622.0,ちょっとはな
1622.0,1624.0,何が気が引けるか
1624.0,1626.0,楽しくやってますよっていうのを出すのが
1626.0,1628.0,やだよね
1628.0,1630.0,心のとこから後ろめたさはすごく感じちゃうね
1630.0,1632.0,こっちとしてもすごく楽しくできないしね
1638.0,1640.0,世間体を気にしてるっていうのもあるけどさ
1640.0,1642.0,そうだね
1642.0,1644.0,本音はやっぱ
1644.0,1646.0,ちょっと後ろめたよねやっぱりね
1648.0,1650.0,そう
1650.0,1652.0,と言ってもさ
1652.0,1654.0,あのなんだろうな
1654.0,1656.0,暇ぐらい暇ぐらいがちょうどいいよな
1656.0,1658.0,でもな確かにな
1658.0,1660.0,楽しくやるんだけど
1660.0,1662.0,だから皆さんもね
1662.0,1664.0,多分いないでしょ
1664.0,1666.0,俺ら以外にさ生放送してる人たちとかも
1666.0,1668.0,多分やってないでしょ
1668.0,1670.0,どういうこと
1670.0,1672.0,今聞いてる人たちに
1672.0,1674.0,俺ら以外にさ
1674.0,1676.0,うん
1676.0,1678.0,かんさんとかやってないでしょだって
1682.0,1684.0,だからまあみんなはもうね
1684.0,1686.0,漫画家って漫画読む生活をしましょう
1686.0,1688.0,今月は
1694.0,1696.0,まあそうですな
1698.0,1700.0,おめえの声が全然聞こえねえわ
1700.0,1702.0,ほんとに今トークした
1702.0,1704.0,最近タモリみたいな持ち方してさ
1704.0,1706.0,放送してるから
1706.0,1708.0,マイク口に近づけて
1708.0,1710.0,タモリ持ちしてるからね今ね
1710.0,1712.0,そうなんだよね
1712.0,1714.0,スタイル的にさやっぱ
1714.0,1716.0,そのおめえにも言ったけどさ
1716.0,1718.0,なんていうのかな
1718.0,1720.0,ねえちょっとやっぱ気分悪くなっちゃう人
1720.0,1722.0,多いでしょ俺は特に
1722.0,1724.0,そうだね
1724.0,1726.0,言ってたね
1726.0,1728.0,それもあるんだよね
1728.0,1730.0,冗談がね
1730.0,1732.0,捉えられないような時だよね
1732.0,1734.0,確かにね
1736.0,1738.0,それはさすがに本意じゃねえんだよな
1738.0,1740.0,いいんじゃないですか
1744.0,1746.0,予約枠もあれだよ
1746.0,1748.0,今月はちょっと
1748.0,1750.0,延期
1750.0,1752.0,延期するわ
1754.0,1756.0,そうだね実際
1756.0,1758.0,これからどんな風になるか分かんないからね
1758.0,1760.0,そうだね本当にね
1760.0,1762.0,どう転ぶかも分かんないもんね
1762.0,1764.0,どういった俺たちが動きをしないといけないのかっていうのもね
1764.0,1766.0,そうそう
1766.0,1768.0,俺の方の企画も延期ですね
1772.0,1774.0,何お前ついでに言っとこみたいなさ
1774.0,1776.0,いやいや僕今聞かれたからね
1776.0,1778.0,この中で2つ今見える
1778.0,1780.0,3つか3つ見えました
1780.0,1782.0,揺れてる?揺れてない
1784.0,1786.0,次予約最後にしようか
1786.0,1788.0,うん
1790.0,1792.0,じゃあお疲れ様でした
1792.0,1794.0,GO
