start,end,text
0.0,2.0,寒い
4.0,6.0,寒い
8.0,10.0,寒い
14.0,16.0,寒い
16.0,18.0,いやもうあまりにも寒くてさ
20.0,22.0,喋りながら行かないと
24.0,26.0,孤独心すると思って
26.0,28.0,あー寒い
30.0,32.0,むっちゃ寒くない最近
34.0,36.0,あーほんと寒い
38.0,40.0,駅まで行くのにさみんなちょっと付き合ってよ
42.0,44.0,寒い
44.0,46.0,あー寒い
46.0,48.0,便利だなマジで
48.0,50.0,外で配信できると
50.0,52.0,暗いからしかも周り映ることないし
52.0,54.0,もうほんと寒い
56.0,58.0,なんかラジオしながら行こうぜ
58.0,60.0,高速道路でさ
60.0,62.0,あー寒い
64.0,66.0,高速道路でトラックの運転手が聞いてるんだろ
66.0,68.0,俺の放送
68.0,70.0,アホみてーに指くわえながら
70.0,72.0,それに向けて
72.0,74.0,駅までの旅をしようぜ
76.0,78.0,いかがお過ごしでしょうか
84.0,86.0,あー寒いマジで
86.0,88.0,今日はちょっと薄着で来ちゃってさ
90.0,92.0,お届けしておりますこんな感じでね
94.0,96.0,何分くらいあるの15分
96.0,98.0,新宿駅に着いたら終わり
100.0,102.0,いやほんとにもう
102.0,104.0,冬到来って感じですね
104.0,106.0,いかがお過ごしでしょうか
106.0,108.0,みなさんもね
108.0,110.0,人とすれ違えようと
110.0,112.0,ちょっと薄着すぎだよねこれね
112.0,114.0,薄着にも程があるよね
116.0,118.0,でもさ
118.0,120.0,あのー
120.0,122.0,寒さとかって別にもう
122.0,124.0,関係ないんだよね
126.0,128.0,造形の方が大事というか
128.0,130.0,造形がやっぱ一番大事じゃない
132.0,134.0,なんかその温かさとかではなく
134.0,136.0,造形がやはり大事だと思うんですよね
138.0,140.0,ちょっと寒くて
140.0,142.0,あーこそ
142.0,144.0,ちょっとコインランドリーでタバコ吸うわ
144.0,146.0,寒すぎる
146.0,148.0,絶対電車遅れるわ
148.0,150.0,あー寒い
150.0,152.0,あー寒い
152.0,154.0,人いねーよな
154.0,156.0,あー
156.0,158.0,ほんとに寒い
160.0,162.0,女の子見てたろ
164.0,166.0,最近ねドラクエ3のね
166.0,168.0,FF3のね
168.0,170.0,いいもんだね
170.0,172.0,いやもう今日タクシー使わないために
172.0,174.0,配信してるのにさ
174.0,176.0,意味ねーよ
176.0,178.0,最悪ライター忘れた
178.0,180.0,やっぱり禁断症状が
186.0,188.0,指でつけるか
190.0,192.0,マジでやっててもらうとなに
192.0,194.0,俺が
194.0,196.0,ケンタウロスみたいな感じなの
196.0,198.0,ケンタウロス
198.0,200.0,そこの喫煙所いいよなみんなも使うここ
200.0,202.0,いいよね
208.0,210.0,そんだけやっぱ
210.0,212.0,ネームバリューがあるってことだよ
212.0,214.0,落ち込む必要なんかねーだろ
218.0,220.0,ツイキャスなんかどうでもいいよ
220.0,222.0,完全に俺のオーナーに
222.0,224.0,俺のマスターベーションに付き合ってくれ
224.0,226.0,太ってないか
226.0,228.0,俺太ったかな
228.0,230.0,今体重60
230.0,232.0,でもちょっと太ったら
232.0,234.0,67って
234.0,236.0,身長176センチ
236.0,238.0,67キロって別に
238.0,240.0,痩せてないよね
240.0,242.0,モコがサングラスしてる
242.0,244.0,理由が
244.0,246.0,チック知らない
246.0,248.0,モコの顔とかあんま興味ないから見てねーな
250.0,252.0,あいつなんかしょうもねー動画上げてたな
252.0,254.0,昨日か今日かわかんないけど
254.0,256.0,なんだっけラーメン
256.0,258.0,どんぐらい食えるか
258.0,260.0,みたいな動画上げてなかった?
262.0,264.0,ヤングジジイがお前こう
264.0,266.0,うんこカルトやりたいって
266.0,268.0,何ヤングジジイって
268.0,270.0,誰ヤングジジイって
270.0,272.0,ラーメン大食え
272.0,274.0,身長-110が標準
274.0,276.0,67もうちょい太くらいか
276.0,278.0,ちょい太くらい
282.0,284.0,お前ヤングジジイじゃねーかほんとだよねー
284.0,286.0,だけど
286.0,288.0,いいじゃん
290.0,292.0,今までの時間を取り戻すかのように
292.0,294.0,あったけ出たくねータクシー乗りてー
296.0,298.0,あ監督ね東二郎監督ね
298.0,300.0,会いたいよなんか久々に
300.0,302.0,この前なんかちょっと
302.0,304.0,ドグマの会社行こうと思ったんだけどさ
304.0,306.0,行く予定があったんだけど
306.0,308.0,撮影見に行きたかったんだけど
308.0,310.0,ちょっとなんか都合悪くて行けなくなっちゃったんだよね
310.0,312.0,子供できたら禁煙しろよ
312.0,314.0,なんか親のような
314.0,316.0,あれだねなんでツイキャスなんや
316.0,318.0,ニコ生できねえんだもん
318.0,320.0,本当はさニコ生でやりたいんだけどさ
320.0,322.0,できねえのチャンネルでできないの
322.0,324.0,まず携帯からできないの意味わかんないよね
324.0,326.0,興味携帯電話から配信できないって
334.0,336.0,3月にイベントで共有するんでしょ
336.0,338.0,いつだよあそうなの俺知らないんだけど
338.0,340.0,知らなかった
340.0,342.0,ユーザーで
342.0,344.0,やったところでね
344.0,346.0,アリーナしか
346.0,348.0,見れないの意味わかんなくない
348.0,350.0,その仕様どうにかしてほしいな
354.0,356.0,再来週高坂部屋の
356.0,358.0,人たちと飲み会するとしゃべるから
358.0,360.0,俺も呼んでくれよ
360.0,362.0,俺もあるし相撲取りみたいなもんだろ
362.0,364.0,相撲取りみたいなもんじゃない
364.0,366.0,ツイキャスも便利だね
366.0,368.0,拡散力がないじゃん
368.0,370.0,俺ツイキャスやっても人来ないじゃん
372.0,374.0,昔のなんか
374.0,376.0,ユースト見て
376.0,378.0,昔のユーストもっとちゃんとやってたな
378.0,380.0,こんななんか寒いから
380.0,382.0,ちょっと付けようみたいなさ
382.0,384.0,そういう付け方しなかった気がする
384.0,386.0,寒いから付けようみたいな
388.0,390.0,俺ツイキャス
390.0,392.0,バンされてて
392.0,394.0,ツイキャス
394.0,396.0,ツイキャスバンされててなんでかっていうと
396.0,398.0,お風呂場で発信したじゃん
398.0,400.0,男であろうとお風呂場で発信すると
400.0,402.0,どんな理由があればバンされるらしいの
402.0,404.0,音だけでも
404.0,406.0,俺ツイキャスバンされててさ今
406.0,408.0,意味わかる
408.0,410.0,バンされてんだよね
412.0,414.0,理不尽すぎでしょ
414.0,416.0,なんか文句言って
418.0,420.0,ちんこペチペチしてねーよ
420.0,422.0,あしたわ
422.0,424.0,それだけでバンされて
424.0,426.0,あなたバンですって連絡来たもん
426.0,428.0,だけど放送はできる
428.0,430.0,解除されてない
430.0,432.0,放送はできるけどなんかその
432.0,434.0,放送してますみたいな
434.0,436.0,欄に乗らないらしい
436.0,438.0,別にいいけど乗らなくても
438.0,440.0,変にプレッシャーかかるから
444.0,446.0,いや女もダメだったよ
446.0,448.0,なんかそれバン多数らしいよ
448.0,450.0,バン多数されてるらしい
452.0,454.0,俺もツイキャス運営の自知キモすぎだろ
454.0,456.0,好きにやらさればなんかあるんじゃないの
456.0,458.0,わかんねーけど
458.0,460.0,あるんじゃないの
460.0,462.0,でもさ
462.0,464.0,すげーさ
464.0,466.0,最近ツイキャス見てんだけどちらちら
466.0,468.0,わけわかんねー
468.0,470.0,女子高生が歌歌ってるだけで
470.0,472.0,5000人とか来てて
474.0,476.0,金梅はオススメ規制される
476.0,478.0,ガチで切れるやつ
478.0,480.0,そうなんだ
482.0,484.0,すげーよ
484.0,486.0,あーちょっと頑張っていこう
488.0,490.0,22時42分の電車乗らなきゃいけないんだけどさ
490.0,492.0,とてもじゃないけど
492.0,494.0,あと10分で行ける気がしない
494.0,496.0,でも頑張ろう
498.0,500.0,なんか無職の深夜ハイカーみたいになってない?
500.0,502.0,俺
502.0,504.0,金瀬健二郎の兄者じゃねーかんな
504.0,506.0,あー寒い
506.0,508.0,間に合わねーかなー
508.0,510.0,行けるだろまだ
510.0,512.0,なんか
512.0,514.0,なんか俺ゲーセン配信とかしたいんだよな
514.0,516.0,ゲーセン貸し切って
516.0,518.0,貸し切らなくてもさ
518.0,520.0,人来てねーゲーセンって腐るほどあるでしょ
520.0,522.0,やらしくねーかなー
524.0,526.0,あーやばい寒い
526.0,528.0,寒い
530.0,532.0,いつから
532.0,534.0,でも当時を超えたから
534.0,536.0,そろそろなんかあったかくなってくんじゃねーの
536.0,538.0,わかんねーけど
538.0,540.0,お過ごしでしょうか
540.0,542.0,一人プリクラやりてー
546.0,548.0,ちょっと人が来てるから待ってな
548.0,550.0,不審者だと思いましょうか
552.0,554.0,よし
554.0,556.0,超えたまた一つ壁を超えた
558.0,560.0,ジュン何履いてるGパンダや普通に
560.0,562.0,あー
566.0,568.0,電話してるふりしてるんだけどさ
568.0,570.0,限界があるでしょさすがに
572.0,574.0,あータクシーに乗りたい
574.0,576.0,タクシーに乗りたいけど
576.0,578.0,今さ財布の中に1000円しか入ってなくて
578.0,580.0,金がねーんだよ
582.0,584.0,ここにいないと一気に貧乏になってしまって
584.0,586.0,調子乗ってたら
586.0,588.0,なんなんだろうなあれは
588.0,590.0,夢だったんじゃないかっていう
590.0,592.0,あれはなんか
592.0,594.0,現実だったんだろうかという
596.0,598.0,飼られてます
598.0,600.0,そういうなんか
600.0,602.0,あれは夢だったんじゃないかっていう
602.0,604.0,でもいいんだよな
604.0,606.0,ネコがいる
606.0,608.0,おい
608.0,610.0,あれはなんか夢だったんじゃないかという
610.0,612.0,噂に
612.0,614.0,噂が飛び交っております
614.0,616.0,いいや別に遅刻しても
616.0,618.0,向こうからも連絡きてねーし
620.0,622.0,営業の仕事いっぱい
622.0,624.0,してるのになにそれ
624.0,626.0,なに言ってんの
626.0,628.0,お前日本語喋んないから殺しに行くぞ今から
628.0,630.0,外いるから
634.0,636.0,新年会
636.0,638.0,女多いなに女って
638.0,640.0,新年会終わったよ
640.0,642.0,終わって第二の
642.0,644.0,仕事道具を持ってきたから
644.0,646.0,今日お泊りしてそのまま行こう
646.0,648.0,そういう枠手かな
650.0,652.0,日常となっております
656.0,658.0,なんかしかもさ
658.0,660.0,住んでる場所が新宿とかだからさ
660.0,662.0,こういうところがあるんだよとか
662.0,664.0,そういうあれもできねーし
664.0,666.0,みんな新宿なんか知りたくねーし
666.0,668.0,知ってるだろ
668.0,670.0,興味わかねーよな
670.0,672.0,もっと群馬の
672.0,674.0,クソ山奥とかあったらさ
674.0,676.0,いろいろなんか紹介できるんだろうけど
676.0,678.0,今度は実家から走ってみようかな
682.0,684.0,実家から
684.0,686.0,わー寒い
686.0,688.0,南口
688.0,690.0,めっちゃ固そうな
690.0,692.0,へー
692.0,694.0,知らなかった
694.0,696.0,冬休みの便利なところ
696.0,698.0,やばい
698.0,700.0,寒い体温が奪われていく
704.0,706.0,うわーてか
706.0,708.0,ニコ生やったらよかったな
708.0,710.0,なんかでもニコ生でやるときは
710.0,712.0,気合でやりたいんだよねある程度
716.0,718.0,笑ってるんだけど結構
718.0,720.0,結構ニコニコしてない?
720.0,722.0,毎回
722.0,724.0,ニコニコしてないですか
724.0,726.0,それだけが取り柄なんだけど
726.0,728.0,俺の
728.0,730.0,いつも笑顔
730.0,732.0,いつも一人いつも笑顔
732.0,734.0,あー寒い
734.0,736.0,ほんと寒い
738.0,740.0,タクシー乗ろう
740.0,742.0,ダメだみんな
742.0,744.0,もうお別れの時間だ今日は
744.0,746.0,1日15分でもう
746.0,748.0,だから俺今月結構配信してる気がするんだよな
750.0,752.0,どうなんだろ配信時間は
752.0,754.0,明確にちょっと100時間ぐらい
754.0,756.0,ちょっとやってやろうと思ってやってるけど
758.0,760.0,家でゲームやってるテンションのまま
760.0,762.0,外歩けないまあそうだね
764.0,766.0,ほんと毎朝
766.0,768.0,通勤追及しながら来てるよ通勤
768.0,770.0,俺オンとオフの切り替えが下手くそだからさ
770.0,772.0,なかなか難しいところではあるんだよな
774.0,776.0,あとなんか時間制限がないからさ
776.0,778.0,無限にやっちゃうっていう
778.0,780.0,まあニコ生もねえんだけどな時間制限
780.0,782.0,枠の区切りがあるから
782.0,784.0,ちょっとやっぱ気分が
784.0,786.0,ねえ
786.0,788.0,良くなるというか
788.0,790.0,ぼちぼちやめとくかみたいな
790.0,792.0,なんか火蓋が落とされるんだけどさ
792.0,794.0,あーもうちょっとだ
794.0,796.0,意外と間に合うかもしんねえ
800.0,802.0,意外とな
802.0,804.0,帰ったら雑談してくれ
804.0,806.0,いいやしたくねえや
806.0,808.0,なんか
808.0,810.0,またなんか
810.0,812.0,新しい人参ぶら下げてくんねえかな
812.0,814.0,そうかニコニコの上
814.0,816.0,俺になんかチャンネルの
816.0,818.0,人数増やしてくんねえかな
818.0,820.0,そしたらまたモチベーション
820.0,822.0,くそ上がるのにな
822.0,824.0,けちくさいよねなんかね
824.0,826.0,あれらしいよ
826.0,828.0,有料会員数がある一定以上じゃないと
828.0,830.0,やっぱ
830.0,832.0,許可が出ないらしくて
832.0,834.0,俺聞いたんだよ担当で
834.0,836.0,なんかすいません増やしてくれないですかみたいな
836.0,838.0,無理を生じて
838.0,840.0,やっぱり
840.0,842.0,その有料会員数がある程度ないところは
842.0,844.0,許可が降りないらしくて
846.0,848.0,やっぱそういうなんかあれがあるらしいよ
850.0,852.0,いろいろ
852.0,854.0,限定配信したところで
854.0,856.0,人なんて増えねえよ
856.0,858.0,会員なんて増えねえよ対して
858.0,860.0,一気になんか
860.0,862.0,例えばさあ
862.0,864.0,天神ずーっと
864.0,866.0,全部やってて
866.0,868.0,あのー
868.0,870.0,生放送だけ
870.0,872.0,有料でやりますといえば
872.0,874.0,わーって人入るんだろうけど
874.0,876.0,そしたらその放送に対するモチベーションが
876.0,878.0,低くなっちゃうから結局人が増えない
878.0,880.0,っていうね面白い配信ができない
882.0,884.0,あちらを立てればこちらが立たずなんだ
886.0,888.0,あちらを立てればこちらが立たず
888.0,890.0,有料会員
890.0,892.0,会員500じゃ足んないよな500人もいる?
892.0,894.0,ちょっと見てみようかな
894.0,896.0,今度配信やってるときに
896.0,898.0,今じゃ見えねえからよ
898.0,900.0,あーもうちょっとだ
900.0,902.0,頑張れ加藤天一
902.0,904.0,寒さに負けるな
906.0,908.0,今何してんの
908.0,910.0,駅に向かって歩いてるところ
910.0,912.0,あまりにも寒すぎて本当はさ
912.0,914.0,動画見ながら行こうと思ったんだけど
914.0,916.0,寒すぎてさ
916.0,918.0,これはもう
918.0,920.0,得意の
920.0,922.0,暇つぶしスイキャスしかねえなと思って
924.0,926.0,おじさんの顔をね映しながら
926.0,928.0,大変恐縮ですが
928.0,930.0,一つ皆さんこれでご勘弁願いたいですな
930.0,932.0,最近本当にね信長の野望
932.0,934.0,以降めっちゃくちゃ歴史にハマってて
936.0,938.0,あれ面白いわ
940.0,942.0,できればなんか深い知識を持った状態で生放送もしたかったな
946.0,948.0,あれもったいなかったよなちょっとな
948.0,950.0,明日の配信楽しみにしてるぞ
950.0,952.0,まあぼちぼち頑張るわ
954.0,956.0,あー寒い
956.0,958.0,ここ渡りてえな
958.0,960.0,いいや
960.0,962.0,イアンプについて教えてくれ
962.0,964.0,なんで教えなきゃいけねえんだよ
964.0,966.0,あんたっつってどこもやってるとこだろ
966.0,968.0,戦時中のなんかその
968.0,970.0,聖の励口みたいなので
970.0,972.0,日本編もやってただろうけど
972.0,974.0,多分世界中
974.0,976.0,どこの国もやってたんじゃねえか
976.0,978.0,っていう俺の中の疑惑
980.0,982.0,やっぱ負けた方はさ
982.0,984.0,負けた方というか
984.0,986.0,被害をこむった方は
986.0,988.0,ねえ
988.0,990.0,話を大きく話すんじゃないの
990.0,992.0,っていうアメリカとかもやってたでしょ余裕で
992.0,994.0,なのにも関わらず
994.0,996.0,なんかガチャガチャ言ってくんじゃねえよって感じだよな
996.0,998.0,今思えば
998.0,1000.0,頭丸めた野村議員について一言
1000.0,1002.0,俺一言だけ言って野村議員大っ嫌いなので
1002.0,1004.0,なんかあいつ
1004.0,1006.0,あんなひどいことしたにも関わらずさ
1006.0,1008.0,ちょっと可愛がられてんじゃん
1008.0,1010.0,もっとネットで叩かれて
1010.0,1012.0,もっと病むべきだと思うな
1012.0,1014.0,自殺一歩手前ぐらいまでは追い込まれて
1014.0,1016.0,叱るべき犯罪犯してると思うよ
1016.0,1018.0,なのにちょっとネットでさ
1018.0,1020.0,なんかそのネタになっちゃって
1020.0,1022.0,可愛いんじゃねえかみたいな
1022.0,1024.0,俺は嫌いだね
1026.0,1028.0,本を出版するお母さんに一言
1028.0,1030.0,女ってこえーよな
1030.0,1032.0,マジでな
1032.0,1034.0,のりぴーの食材といいさ
1034.0,1036.0,やっぱ第一に
1036.0,1038.0,男と金がやっぱつくからね
1038.0,1040.0,なんか男性ってちょっと違うところあるじゃん
1040.0,1042.0,やりがいとかさロマンとか求めるじゃん
1042.0,1044.0,女の人ってほんと現実主義だからさ
1044.0,1046.0,金男
1046.0,1048.0,がやっぱ
1048.0,1050.0,先頭につくんじゃないの
1050.0,1052.0,でも売れるだろうね
1052.0,1054.0,やはり
1054.0,1056.0,うん
1056.0,1058.0,なんかさ
1058.0,1060.0,本出すよって言ったら売れるでしょ
1060.0,1062.0,わかんないけど
1062.0,1064.0,今日でドラクエ7パート148まで
1064.0,1066.0,見たぞ
1066.0,1068.0,キモいわ
1068.0,1070.0,あでもいたよなんか
1070.0,1072.0,女の子の視聴者でさ
1072.0,1074.0,3日間でドラクエ全部見ましたって
1074.0,1076.0,スタップ細胞あるの
1076.0,1078.0,スタップ細胞あります
1078.0,1080.0,リアリスト多くない
1080.0,1082.0,お前のエビも
1082.0,1084.0,ネタになってたらだぞ
1084.0,1086.0,割れしてねえもん
1086.0,1088.0,なんで割れしてねえの
1088.0,1090.0,攻められなきゃいけないの
1090.0,1092.0,ちゃんと証拠揃えてな
1092.0,1094.0,証拠を
1094.0,1096.0,俺してねえのにみんなからさ
1096.0,1098.0,犯罪者みたいな扱いを受けて
1098.0,1100.0,ほんと悲しいわ
1100.0,1102.0,野々村議員には優しくしてるのに
1102.0,1104.0,俺に詰めたい
1104.0,1106.0,エミュレーターを使って
1106.0,1108.0,配信をしてるだけなんだ
1110.0,1112.0,あっ見えてきた
1112.0,1114.0,もうすぐゴールが近いぞ
1114.0,1116.0,みんなのおかげで
1116.0,1118.0,なんとか乗り切れそうだ
1118.0,1120.0,もうタクシー使うのやめようと思ってさ
1120.0,1122.0,使いすぎじゃん
1122.0,1124.0,使いすぎじゃない
1124.0,1126.0,男のフリした女が一番嫌い
1126.0,1128.0,別に全然なんとも思わない
1130.0,1132.0,俺もたまに寝かまするし
1132.0,1134.0,チヤホヤされた時
1134.0,1136.0,匿名でチヤホヤされるのは
1136.0,1138.0,寝かまでが一番でしょ
1138.0,1140.0,この前レジディア行ったんだけど
1140.0,1142.0,来るんじゃねえや
1142.0,1144.0,レジディアなんか政治巡礼みたいにしてんだ
1146.0,1148.0,あー寒い
1150.0,1152.0,配信してる間はマンポケ付けないから付けてよかった
1152.0,1154.0,タクシーほんと依存するからね
1154.0,1156.0,しかもさ1回の料金安いからさ
1156.0,1158.0,車持つより安上がりなんだよね
1158.0,1160.0,正直ね
1160.0,1162.0,新宿で車維持しようと思ったらさ
1162.0,1164.0,だいたい月7、8万かかるのね
1166.0,1168.0,8万くらいかかんのかな
1168.0,1170.0,みんなさ毎日タクシー乗ってても
1170.0,1172.0,8万なんか絶対いかねえから
1172.0,1174.0,結局
1174.0,1176.0,タクシー乗っちゃうんだよな
1176.0,1178.0,ただ今日は頑張った
1178.0,1180.0,自分で自分褒めてあげたいね
1182.0,1184.0,すごいね人がいっぱいいて恥ずかしいわ
1186.0,1188.0,車買ったほうが安そう
1188.0,1190.0,いやそんなことないよ
1190.0,1192.0,キチガヤがいっぱいいる
1192.0,1194.0,キチガヤがいっぱいいる
1194.0,1196.0,自軽車あるんだけどね
1196.0,1198.0,ちょっと車道の端っこ歩こう
1202.0,1204.0,44分で行っちまったか
1206.0,1208.0,山手線の内回り調べてよ
1208.0,1210.0,日暮里行かなきゃいけねえんだよ今から
1210.0,1212.0,場所言ってた
1212.0,1214.0,まあいいや
1214.0,1216.0,さみ
1220.0,1222.0,おにぎりかぶれ
1222.0,1224.0,無理だな俺はそういう
1224.0,1226.0,ゲーみたいなこと言いけねえけど
1228.0,1230.0,ゲーみたいなことは
1230.0,1232.0,ゲーってホモじゃねえぞ
1236.0,1238.0,よいしょ
1238.0,1240.0,寒い
1244.0,1246.0,どこに向かってるんだ今
1246.0,1248.0,新宿駅に向かってる
1248.0,1250.0,新宿駅に向かって
1250.0,1252.0,歩みを進めております
1252.0,1254.0,気温何度なんだろう
1254.0,1256.0,調べてくれない
1256.0,1258.0,4度くらいっぽくない
1258.0,1260.0,頭おかしい人だと思われると
1260.0,1262.0,否定できないな
1262.0,1264.0,いいんだ別に
1266.0,1268.0,20代の頃は
1268.0,1270.0,そういう
1270.0,1272.0,すげえ気にしてたけど
1272.0,1274.0,迷惑さえかけないといいや
1274.0,1276.0,迷惑さえかけないといいや
1276.0,1278.0,っていう
1280.0,1282.0,お前ツイキャストのジャビをやってるの
1282.0,1284.0,あー別に暇つぶし
1284.0,1286.0,完全に暇つぶし
1286.0,1288.0,お付き合いしていただいている
1288.0,1290.0,関係を持たせていただいている皆さんに
1290.0,1292.0,53分発
1292.0,1294.0,57分発
1294.0,1296.0,53分発目指していきますか
1296.0,1298.0,ちょっとな
1298.0,1300.0,めっちゃ寒いよ今日
1300.0,1302.0,めちゃくちゃ寒いほんと
1304.0,1306.0,6度?
1306.0,1308.0,結構あるし
1308.0,1310.0,じゃあそんな寒くないんだ
1310.0,1312.0,そんなに寒くないんだね
1316.0,1318.0,あー寒い
1318.0,1320.0,あー寒い
1324.0,1326.0,俺の住んでるとこなんて
1326.0,1328.0,1時間おきにしか電車来ねえのに
1328.0,1330.0,東京のゴミを暴いてるよな
1330.0,1332.0,田舎行ったらそんなにザラにあるよね
1332.0,1334.0,立山だってそうだぜ
1336.0,1338.0,電車1時間に1本
1338.0,1340.0,30分に1本ぐらいが
1340.0,1342.0,かなり少ないよ
1342.0,1344.0,人多いのによく喋れるね
1344.0,1346.0,離れてる
1346.0,1348.0,今俺は小児だよ小児
1350.0,1352.0,しかもみんな電話してると思うでしょ
1352.0,1354.0,さすがに
1354.0,1356.0,3時間に1本はやばいでしょ
1356.0,1358.0,島じゃんそれ
1358.0,1360.0,リアル小児じゃねえかよ
1360.0,1362.0,あ見えてきた
1362.0,1364.0,南口が
1364.0,1366.0,南口
1366.0,1368.0,南口
1368.0,1370.0,南口
1370.0,1372.0,どこだ
1372.0,1374.0,良かった
1374.0,1378.0,出遅れだこの配信
1378.0,1382.0,これからもちょくちょくこういうワークな感じ
1382.0,1384.0,冬は特に
1384.0,1386.0,寒くて駅まで歩く配信みたいな
1388.0,1390.0,今日マジやる気なかったんだけどさ
1390.0,1392.0,もうとてもじゃない けどさ
1392.0,1394.0,歩いていける気力がなくて
1394.0,1396.0,そうSAG45あるしね
1396.0,1398.0,スカイプがあるしね
1399.64,1401.64,何かみんなにおすすめの一つでも 紹介してやりたいけど
1402.82,1404.82,なんもねえな
1405.04,1407.04,半海岸まで来ちゃうとなんもないんだよな
1409.0,1411.0,俺がよく行く満喫ぐらい紹介できねえわ
1412.16,1414.16,南口のファーストキッチンの脇の
1415.7,1416.7,なんだっけな
1417.0,1419.0,なんも忘れちゃった
1420.0,1422.0,あそこみんな
1422.0,1424.0,おすすめだから行ってな
1425.0,1427.0,参考にしたいから毎日何回抜いてるか教えてくれ
1427.0,1429.0,4回ぐらい
1429.0,1431.0,朝昼
1431.0,1433.0,昼職場でオナニーしてると思われちゃうな
1433.0,1435.0,朝バンバンバンみたいな
1436.0,1438.0,オナニーとセックスは別物だから
1438.0,1439.0,あれだ
1439.0,1441.0,ムーパーだムーパー
1441.0,1443.0,行ってくるなムーパー
1443.0,1445.0,あー寒い
1445.0,1447.0,マジで寒い
1448.0,1450.0,目開けらんない
