start,end,text
1339.0,1341.0,同行みたいなさあるでしょ
1341.0,1343.0,そうなんですとかね
1343.0,1345.0,そのね
1345.0,1347.0,私の年齢になりますと周りがやっぱ
1347.0,1349.0,結婚をし始めるんですよ結婚を
1349.0,1351.0,そんでねあのある人は
1351.0,1353.0,ある人はなんかね
1353.0,1355.0,ブライダル関係の詐欺に
1355.0,1357.0,手を染めてしまいまして今ね
1357.0,1359.0,塀の中にいたりね
1359.0,1361.0,ある人は看護師になって
1361.0,1363.0,ねあのある人看護師になって
1363.0,1365.0,ねその医療の最前線で
1365.0,1367.0,ねその
1367.0,1369.0,今のね日本を支えていたりね
1369.0,1371.0,そのもうすでに結婚してしまった人
1371.0,1373.0,人とかいっぱいいるんですよ
1373.0,1375.0,どういう巡り合わせでね
1375.0,1377.0,結婚するかなんてマジで分かんないんで
1377.0,1379.0,これからね私自身も今ね
1379.0,1381.0,フリーでねまたね婚活していかなきゃいけないんで
1381.0,1383.0,ねえそろそろさ
1383.0,1385.0,ねえ25にもなって
1385.0,1387.0,もうすぐ26ですよ私
1387.0,1389.0,ニコニコ動画に初めて舞い降りた時は
1389.0,1391.0,23歳ですよ
1391.0,1393.0,ねえやっぱねえそのなんていうのかな
1393.0,1395.0,おっさんになるわなと
1395.0,1397.0,3年間ね足掛け3年間
1397.0,1399.0,ニコニコ動画をしていたことになりますんで
1399.0,1401.0,これはちょっとね
1401.0,1403.0,優遇式自体なのかなと
1403.0,1405.0,まだ焦る年じゃないかないやでもさ
1405.0,1407.0,もうでもさあれでしょ
1407.0,1409.0,どう考えてもさ
1409.0,1411.0,今日日さこの世の中に
1411.0,1413.0,こんな不況の世の中でさ
1413.0,1415.0,なんていうのゆっくりしてられないでしょ
1415.0,1417.0,この中にもね
1417.0,1419.0,おそらくね結婚してる民はね
1419.0,1421.0,多々いると思うんですけど
1421.0,1423.0,まあねその人たちに続けやと
1423.0,1425.0,埋めや増やせやじゃないですけど
1425.0,1427.0,やっぱりね子供も欲しいですしね
1427.0,1429.0,でもねもうちゃんと
1429.0,1431.0,報告しますよ私もし結婚するってなったら
1431.0,1433.0,きっちりね報告はしようと
1433.0,1435.0,思いますのでその
1435.0,1437.0,その日だけ私プチ
1437.0,1439.0,プチカンパを解説いたしまして
1439.0,1441.0,皆さんからのご衆議をねいただこうと
1441.0,1443.0,思っておりますのでその時はね叩かないで
1443.0,1445.0,いただけたらなとそれは別にね
1445.0,1447.0,そのこじきとかじゃなくてご衆議なんだよ
1447.0,1449.0,結婚式配信
1449.0,1451.0,結婚式配信はさどう考えてもできないでしょ
1451.0,1453.0,なんで俺がさドルジのマスク
1453.0,1455.0,かぶってさタキシードけなきゃいけないんですか
1455.0,1457.0,完全に顔バレ防ぐためにさ
1457.0,1459.0,ねドルジのマスクをさかぶってさ
1459.0,1461.0,あのドルジのあのさ
1461.0,1463.0,アサショウリュウの
1463.0,1465.0,奥さんのマスクが売ってたらやりますけど
1465.0,1467.0,アサショウリュウの奥さんのマスクが売ってないでしょ
1467.0,1469.0,そんなタイムリーなさ
1469.0,1471.0,極小的なさ人気を狙った
1471.0,1473.0,マスクなんか作らないでしょどう考えても
1473.0,1475.0,なんかちょっとね
1475.0,1477.0,まあねもし万が一
1477.0,1479.0,そのドルジのね奥さんのマスクが
1479.0,1481.0,開発されるようなことがありましたら
1481.0,1483.0,まあなんかね二次会的な
1483.0,1485.0,ノリでねやっていこうかなと
1485.0,1487.0,ねあの無事私みなさんのおかげで
1487.0,1489.0,みなさんのおかげじゃないんですけどまあ兄と結婚できたらね
1489.0,1491.0,兄と結婚できたら
1491.0,1493.0,その時はねみなさんの
1493.0,1495.0,おかげだと言えると思いますので
1495.0,1497.0,ちゃんとねその結婚式
1497.0,1499.0,配信で流そうかなと思うんですけど
1499.0,1501.0,なかなか難しいと思うんですよね
1501.0,1503.0,倍率が高いですから本当にカッコイイと言われる
1503.0,1505.0,方がね多々いるんで
1505.0,1507.0,倍率的な問題でねちょっとまあ私は立候補せずにね
1507.0,1509.0,その一般の
1509.0,1511.0,民をね探そうかなと思うんですけど
1511.0,1513.0,まあそうなんだよだからね
1513.0,1515.0,もう月日が経つのは早いなと
1515.0,1517.0,本当にね感じたわけですよ
1517.0,1519.0,西野は
1519.0,1521.0,知らん名前しか知らん俺
1521.0,1523.0,名前しか知らん名前からして
1523.0,1525.0,可愛いんだろうなっていうのは分かりますけどね
1525.0,1527.0,まあそうなんでだからねじゃあ延長しますか
1527.0,1529.0,じゃあ
1529.0,1531.0,業務連絡的な感じだったの本当に
1531.0,1533.0,ぜひねあの80分の動画
1533.0,1535.0,見ていただきたいんですよ
1535.0,1537.0,本当にそのさっき紹介した
1537.0,1539.0,82分の動画
1539.0,1541.0,ぜひね見ていただきたいなと
1541.0,1543.0,思います
1543.0,1545.0,再生数15万ぐらいいってんだよ15万
1545.0,1547.0,なんでさ
1547.0,1549.0,そう本当にそうなんだよ
1549.0,1551.0,配信とかもあんまりね
1551.0,1553.0,自分のその
1553.0,1555.0,個人情報みたいなさ私生活で起きた情報とか
1555.0,1557.0,あんまり出してなかったから
1557.0,1559.0,本当にね
1559.0,1561.0,そこから伸びた時代があったんですよ
1561.0,1563.0,今はね
1563.0,1565.0,動画上げたとしてもね
1565.0,1567.0,なかなかそういう動画はね需要がないと思うんですけど
1567.0,1569.0,本当にね
1569.0,1571.0,暇な方がいましたら
1571.0,1573.0,やることねえようんこちゃんと
1573.0,1575.0,そういう方がいましたら
1575.0,1577.0,ぜひねさっきの放送
1577.0,1579.0,80分一本勝負
1579.0,1581.0,見ごたえのある内容となっておりますので
1581.0,1583.0,見ていただけたらなと
1583.0,1585.0,思います
1585.0,1587.0,そこから信者が育まれたんだな
1587.0,1589.0,今ねみなさんね
1589.0,1591.0,厳しいコメントが来ますけど
1591.0,1593.0,まあかっこいいのメールで
1593.0,1595.0,まあかっこいいのメールが続きまして
1595.0,1597.0,えー
1597.0,1599.0,中学生の童貞彼女いない歴
1599.0,1601.0,15年の
1601.0,1603.0,ふざけんなと
1603.0,1605.0,なんでテメェ見てるのさクソガキにさ
1605.0,1607.0,俺は中学3年生の
1607.0,1609.0,なんていうのうんこちゃん視聴者です
1609.0,1611.0,彼女がいたことない
1611.0,1613.0,ただうんこちゃんの気持ちわかりますと
1613.0,1615.0,なんでさ童貞のさ
1615.0,1617.0,彼女もねクソガキにさ
1617.0,1619.0,俺の気持ちがわかるんだと
1619.0,1621.0,25歳くらいになってね彼女とね付き合って
1621.0,1623.0,3年くらい同棲してからね
1623.0,1625.0,俺にメール送ってこいと
1625.0,1627.0,厨房ばっかりさ送ってきやがってさ俺にメール
1627.0,1629.0,キツネみたいな顔してさ
1629.0,1631.0,厨房がさうんこちゃん
1631.0,1633.0,これを見て元気出してみたいなさ
1633.0,1635.0,自分のさ応援動画みたいなさ
1635.0,1637.0,メールでさ送ってきてね
1637.0,1639.0,それに後押しされまして
1639.0,1641.0,私はね実況動画から
1641.0,1643.0,引退することになりまして
1643.0,1645.0,3回目まだ3回しかしてないのこのおもしろい話
1645.0,1647.0,ふざけるなよ
1647.0,1649.0,損してるな
1649.0,1651.0,草40個くらい損してるな
1651.0,1653.0,向こう1ヶ月くらいはねしていこうかなと
1653.0,1655.0,その中学生も高校生か
1655.0,1657.0,ほんとだよね延長した延長した
1657.0,1659.0,ほんとだよねいるんじゃないですか
1659.0,1661.0,その時中学生だったら
1661.0,1663.0,2年経ってるわけだからさ
1663.0,1665.0,皆さんのね生活の状況とかもさ
1665.0,1667.0,ほんのり変わってるんじゃないですか
1667.0,1669.0,私自身はね
1669.0,1671.0,社会人になったらね
1671.0,1673.0,生活の凹凸がかなりなくなるんだよ
1675.0,1677.0,長期連休もないし
1677.0,1679.0,あんまり凹凸がない
1679.0,1681.0,常にフラットな生活バイオリズムが
1681.0,1683.0,常に平均化されてくるんですよ
1683.0,1685.0,たださ学生のうちはさ
1685.0,1687.0,就活とかさ恋愛とか
1687.0,1689.0,恋愛は社会人になってもそうか
1689.0,1691.0,凹凸が激しいじゃないですか夏休み
1691.0,1693.0,いるでしょお前らの中にもさ
1693.0,1695.0,夏休みだから髪染めちゃうみたいなやつ
1695.0,1697.0,そういうさ寒いやつがいるでしょ
1697.0,1699.0,俺夏休みだから
1699.0,1701.0,髪染めるしみたいなさ
1701.0,1703.0,そういう寒い連中多いでしょどうせ
1703.0,1705.0,そういうね生活のメリハリがあるじゃないですか
1705.0,1707.0,社会人になるとね
1707.0,1709.0,ほんとにね
1709.0,1711.0,そういうメリハリがなくなってね
1711.0,1713.0,うちの会社22日まで休みになった
1713.0,1715.0,地震の影響か
1715.0,1717.0,今は本当に休み多いと思うけどさ
1717.0,1719.0,2ヶ月とかの休みとかってさ
1719.0,1721.0,取れないでしょなかなか
1721.0,1723.0,2ヶ月の休みとかさなかなか取れないでしょ今
1723.0,1725.0,社会人の中で
1725.0,1727.0,取れてる人は勝ち組だと思うんですけど
1727.0,1729.0,話してください
1729.0,1731.0,取れてる人は勝ち組だと思うんだけどさ
1737.0,1739.0,まあそうなんで会社辞めるしかないけどさ
1739.0,1741.0,まあでもね
1741.0,1743.0,今の時代にさ
1743.0,1745.0,次に行く会社を
1745.0,1747.0,決めずにさ
1747.0,1749.0,仕事辞めるなんて結構さ
1749.0,1751.0,難しい話でしょどう考えても
1751.0,1753.0,ねえだからさなかなか長期連休
1753.0,1755.0,取れないわけですよ
1755.0,1757.0,取れないからこそ
1757.0,1759.0,3連休4連休のありがたみってのも
1759.0,1761.0,ひしひしとね伝わってくるんですよ
1761.0,1763.0,学生のうちのね連休3連休4連休と
1763.0,1765.0,社会人になってからの3連休4連休
1765.0,1767.0,全然違うじゃないですか
1767.0,1769.0,出かける意欲が湧くじゃないですか
1769.0,1771.0,私自身もだからね
1771.0,1773.0,それぞれね
1773.0,1775.0,26の年
1775.0,1777.0,満26歳ですよ次の誕生日迎えたら
1777.0,1779.0,だからねちょっとね
1779.0,1781.0,私生活も向上していかなきゃいけないのかなと思っております
1781.0,1783.0,ちなみにさっきの80分の動画の中で
1783.0,1785.0,全く同じこと言ってます
1785.0,1787.0,1年前にも全く同じこと言ってるんですけど
1787.0,1789.0,なかなか現状が変わってないんだよ
1789.0,1791.0,声がでかいすいません
1791.0,1793.0,なかなかね現状が変わってないんで
1793.0,1795.0,今年のね今年度のマニフェストといたしまして
1795.0,1797.0,必ずね私生活の向上
1797.0,1799.0,ここをね上げていきたいなと
1799.0,1801.0,やっぱりね私生活が向上すると
1801.0,1803.0,配信でのネタもねかなりできるんですよ
1803.0,1805.0,ねえそのアニメとかさ
1805.0,1807.0,ニコ動の話もまあ面白いですけど
1807.0,1809.0,なかなかね私生活で起きた出来事をね
1809.0,1811.0,皆さんに伝えていくっていうのも
1811.0,1813.0,かなりね配信欲にね
1813.0,1815.0,影響してくるんで
1815.0,1817.0,だからちょっとねそのいろんなね
1817.0,1819.0,経験をしていこうかなと
1819.0,1821.0,来年度は本当に4月になったらね
1821.0,1823.0,会社の中でのチームもね
1823.0,1825.0,やっぱり中堅クラスになってくるじゃないですか
1825.0,1827.0,もう4年目ですよ4年目
1827.0,1829.0,23の年4の年5の年
1829.0,1831.0,もう4年目ですよ私も
1831.0,1833.0,だからちょっとねそういうね
1833.0,1835.0,自覚を持ってね行動していこうかなと
1835.0,1837.0,ゴリラとはどうやって知り合ったの
1837.0,1839.0,先輩の彼女でした
1839.0,1841.0,前も言ったと思うんですけど
1841.0,1843.0,先輩の彼女で
1843.0,1845.0,その先輩がなんていうのかな
1845.0,1847.0,いろいろ事件を起こしてしまって
1847.0,1849.0,刑務所に入っているうちに
1849.0,1851.0,私が慰めつつ付き合いました
1851.0,1853.0,なのでそういうね
1853.0,1855.0,付き合い方からして悪かったんだよね
1855.0,1857.0,ちゃんとしたそれってしっかりとした出会いじゃないじゃないですか
1857.0,1859.0,しっかりとした出会いじゃないじゃないですか
1859.0,1861.0,だからねやっぱりなんていうのかな
1861.0,1863.0,友達ねえ友達から
1863.0,1865.0,ねえなんかさメールとかするんですよ
1865.0,1867.0,みんなだからメールをしてさ
1867.0,1869.0,ねえ
1869.0,1871.0,なんて送ろうみたいなさ
1871.0,1873.0,絵文字使ってくれないねみたいなさ
1873.0,1875.0,そういうさやり取りをして
1875.0,1877.0,初めて手をつないでね
1877.0,1879.0,ディズニーランドとか行ってさ
1879.0,1881.0,ホーンテッドマンションとか乗ってさ
1881.0,1883.0,そういうね恋愛をしていこうかなと
1883.0,1885.0,次彼女できたらね
1885.0,1887.0,絶対もう
1887.0,1889.0,放送に視聴者に伝えると
1889.0,1891.0,なんかちょっとね
1891.0,1893.0,私自身の中でネタにしてしまう部分があるんで
1893.0,1895.0,こんな出来事があったぜみたいなさ
1895.0,1897.0,そういうのになっちゃうんで
1897.0,1899.0,ちょっとねもう皆さんにはちょっと
1899.0,1901.0,本当に申し訳ないんですけど内緒にしてね
1901.0,1903.0,芸能人ぶっちゃって申し訳ないんですけど
1903.0,1905.0,ちゃんとね視聴者さんにはやっぱりね
1905.0,1907.0,不調子もいるわけですから
1907.0,1909.0,そういう夢を壊さないようにね
1909.0,1911.0,今度付き合った彼女は本当にね
1911.0,1913.0,内緒にしていこうかなと
1913.0,1915.0,もういっそニコ生一緒にやるよ
1915.0,1917.0,そうなんだよ本当にさ
1917.0,1919.0,俺の趣味をわかってくれればさ
1919.0,1921.0,わかってくれればさ
1921.0,1923.0,本当にいいんだけどね
1923.0,1925.0,なかなかね彼女の目を気にしてたらさ
1925.0,1927.0,こんな話できないじゃないですか
1927.0,1929.0,なかなか難しいんですよ
1929.0,1931.0,配信してる人の悩みだと思いますよ
1931.0,1933.0,配信生活と
1933.0,1935.0,私生活の
1935.0,1937.0,両立みたいなさ
1937.0,1939.0,なかなか難しいんですよね
1939.0,1941.0,タチミエイビーのうんこちゃんに会いに行きます
1941.0,1943.0,お前出会うなよ出会うか俺が
1943.0,1945.0,出会うわけねえだろか本当に
1945.0,1947.0,ベリアルしかいないんだようちのおぞわ
1947.0,1949.0,知ってるんだよ顔のシャメ
1949.0,1951.0,可愛い女の子からシャメ来たら
1951.0,1953.0,大抵は男なんだよ知ってんだよ俺は
1953.0,1955.0,一度騙されかけてんだよ俺は
1955.0,1957.0,包もたせられてんだよ俺は
1957.0,1959.0,タチミエイビーのうんこちゃんこんにちは
1959.0,1961.0,タチミエイビーのうんこちゃん
1961.0,1963.0,すみません遅くなってすみませんでした
1963.0,1965.0,リオン実験はやりすぎ
1965.0,1967.0,しっかり言うが妥当じゃないから
1967.0,1969.0,なんで今その話なの
1969.0,1971.0,せっかくさなんつーの
1971.0,1973.0,あんまりさ暗い話にならないようにさ
1973.0,1975.0,してたのにさ
1975.0,1977.0,なんで今リオンの話するんですか
1977.0,1979.0,リオンの友人
1979.0,1981.0,放送で言わないでくださいって言われたんで
1981.0,1983.0,私自身オブラートに包んで話しますけど
1983.0,1985.0,リオンの友人の友人から
1985.0,1987.0,メールが来まして本当ですよこれ
1987.0,1989.0,これね放送であんまり泣かさないでくださいみたいなこと言われたんですけど
1989.0,1991.0,リオンめっちゃいいやつだよ
1991.0,1993.0,みたいなねそのあのさ俺がさ
1993.0,1995.0,リオンのシャメールをさ
1995.0,1997.0,皆さん放送で映してたじゃないですか
1997.0,1999.0,そのシャメールを
1999.0,2001.0,リオン自身も持っててネタにしてると
2001.0,2003.0,うんこちゃんあんまりリオンをネタにしない
2003.0,2005.0,方がええでてんてんてんと
2005.0,2007.0,そういうメールをいただいたんで
2007.0,2009.0,胸のねメールをいただいたんで
2009.0,2011.0,ちょっとねそう本当に
2011.0,2013.0,友達の友達はアルカイダじゃないけど
2013.0,2015.0,ちょっとね私自身も
2015.0,2017.0,あのねだから今日のリオンのコーナー
2017.0,2019.0,大人気コーナーね
2019.0,2021.0,オールナイトウッポン写真枠
2021.0,2023.0,色々ね
2023.0,2025.0,人気コーナーあるんですけど
2025.0,2027.0,今日のリオンのコーナーもね
2027.0,2029.0,まあ人気があったんですけど
2029.0,2031.0,ちょっとね外部からの圧力により
2031.0,2033.0,中止になったんでその辺はね皆さんが空気を読むところだと思います
2033.0,2035.0,なので
2035.0,2037.0,その今後ねリオンはね
2037.0,2039.0,初のNGワードに登録していこうかなと
2039.0,2041.0,人気がちょっと高すぎたな確かに
2041.0,2043.0,今日のリオンのコーナーは人気が高すぎた
2043.0,2045.0,まさにそうだと思う
2045.0,2047.0,求められすぎたな本当に与えすぎた
2047.0,2049.0,求められすぎたし与えすぎた俺が
2049.0,2051.0,そういうね反省を
2051.0,2053.0,反省を生かしまして
2053.0,2055.0,今後ね放送していこうかなと
2055.0,2057.0,思います
2057.0,2059.0,でもね確か実験はちょっとねやりすぎなのかなと思いますけど
2059.0,2061.0,まあ色々ね事件が事件だったから大きくなっちゃったからね
2061.0,2063.0,本当にね
2063.0,2065.0,リオンさんもね
2065.0,2067.0,さんづけですよリオンさんも
2067.0,2069.0,ちょっとね大きくなってね帰ってきていただきたいな
2069.0,2071.0,ただなと思います
2071.0,2073.0,まあちょっとねそうしたらね出てきたらね
2073.0,2075.0,なんていうのゲスト的な
2075.0,2077.0,まあこれはちょっとオブラートに隠しますけど
2077.0,2079.0,ゲスト的な感じでね
2079.0,2081.0,この放送にも出ていただけるかもしれないんで
2081.0,2083.0,かもしれないんでね
2083.0,2085.0,その可能性をやっぱ潰していくのは
2085.0,2087.0,配信者としてねちょっと失格なんじゃないのかなと思いますので
2087.0,2089.0,ねオールナイトウッポン
2089.0,2091.0,初のゲストはリオンって決めてるんでね
2091.0,2093.0,友人のリオンの友人の友人にね
2093.0,2095.0,ちょっと出ていただけないですかと
2095.0,2097.0,そういうねお誘えのメールも
2097.0,2099.0,まあリオンだったらみなさん許してくれると思うんで
2099.0,2101.0,リオンだったら許していただけると思うんでね
2101.0,2103.0,ちょっと
2103.0,2105.0,もういいでしょ
2105.0,2107.0,俺ぶっちゃけもうやばいんだよ
2107.0,2109.0,喋り体力が本当に今日やばくて
2109.0,2111.0,喋りたすぎてさ本当におかしくなりそうでさ
2111.0,2113.0,俺今日もさチャリンコも
2113.0,2115.0,なんかね最近ちょっとあんまり放送もできなくてさ
2115.0,2117.0,本当にね喋り体力が半端ないから
2117.0,2119.0,ちょっとなんか今日やろうかなと思ってるんですけど
2119.0,2121.0,何をやるのがいいのかなと
2121.0,2123.0,まあいろいろあるじゃないですかヤフーの知恵袋
2123.0,2125.0,オールナイトウッポンは3月もやったんで
2125.0,2127.0,まあ写真もやったねヤフーの知恵袋もあるし
2127.0,2129.0,まあアンカリダさんもやってもいいでしょ今日は
2129.0,2131.0,アンカリダさんも
2131.0,2133.0,もう歌い手のチャリキーについて話しました
2133.0,2135.0,話したえすいません
2135.0,2137.0,本当に歌い手のことをなんていうのかな
2137.0,2139.0,私ちょっとネタにしてるじゃないですか
2139.0,2141.0,だから
2141.0,2143.0,タイムリーにね
2143.0,2145.0,わかりました正しい
2145.0,2147.0,うんこちゃんの正しい歌い手の叩き方講座
2147.0,2149.0,今からちょっと1分間やります
2149.0,2151.0,こういうタイムリーに事件起こしたときっていうのは
2151.0,2153.0,そっとしておいてください
2153.0,2155.0,なぜならタイムリーにこういう事件が起きたときは
2155.0,2157.0,そっとしておくのが一番ベストです
2157.0,2159.0,今はね歌い手さんたちも
2159.0,2161.0,みんなが叩いてて埋もれます
2161.0,2163.0,1ヶ月後2ヶ月後にちょっとネタ半分で
2163.0,2165.0,ふざけんじゃねーよと
2165.0,2167.0,あの時ああいうことあったんだろみたいな
2167.0,2169.0,そういうね1ヶ月
2169.0,2171.0,歌い手叩きっていうのはワインみたいなもんです
2171.0,2173.0,若干寝かせた方が
2173.0,2175.0,美味しく熟成しますんで
2175.0,2177.0,1ヶ月後2ヶ月後くらいに
2177.0,2179.0,1ヶ月後2ヶ月後くらいに
2179.0,2181.0,ちょっとこの話もしていこうかなと思います
2181.0,2183.0,いやホントですホントです
2183.0,2185.0,でもね私自身もね
2185.0,2187.0,いつもネタにさせていただいてますので
2187.0,2189.0,ホントね心の底から嫌いなわけじゃないんです
2189.0,2191.0,ホントね
2191.0,2193.0,心の底から嫌いなわけじゃなくて
2193.0,2195.0,どこかね心のどこかでは
2195.0,2197.0,公的種は応援するじゃないですか
2197.0,2199.0,一郎と松井じゃないですけど
2199.0,2201.0,公的種っていうのは応援するじゃないですか
2201.0,2203.0,私自身もね頑張っていただきたいんですけど
2203.0,2205.0,あまりにもタイムリーすぎて
2205.0,2207.0,歌い手さん達の信者がね
2207.0,2209.0,竹刃持って突っ込んでくる可能性も
2209.0,2211.0,否めませんので
2211.0,2213.0,ちょっとね今多分
2213.0,2215.0,うんこちゃんの信者達が私を囲っていただいてますんで
2215.0,2217.0,信者ガードを使ってますんで
2217.0,2219.0,この放送には入れてないと思います
2219.0,2221.0,入れてない
2221.0,2223.0,いないと思うんですけど
2223.0,2225.0,そういう炎上回避の方法もあるのかなと思います
2225.0,2227.0,だからちょっとね
2227.0,2229.0,頑張っていただきたいですよね
2229.0,2231.0,ああいうのはね
2231.0,2233.0,こういうことをさ
2233.0,2235.0,行動を起こす時っていうのはね
2235.0,2237.0,考えてからやったほうがいいんじゃないのかなと
2237.0,2239.0,私自身もあの行動ね
2239.0,2241.0,なりかねないからね自分も
2241.0,2243.0,なりかねないから
2243.0,2245.0,あれを反面教師にしてね
2245.0,2247.0,今後気を付けていこうかなと思います
2247.0,2249.0,俺は絶対に許さないけどな
2249.0,2251.0,でもさあれなんだよね
2251.0,2253.0,なんていうの
2253.0,2255.0,叩きたいだけみたいなさ
2255.0,2257.0,絶対愉快犯だらけだよね
2257.0,2259.0,たぶん95%はさ
2259.0,2261.0,愉快犯だと思うんだよね
2261.0,2263.0,本気でなんつーの
2263.0,2265.0,今までファンだったけどもうやめますみたいなさ
2265.0,2267.0,そういうやつってさ
2267.0,2269.0,5%くらいだと思うんだよ
2269.0,2271.0,たぶんねこの中にもたた参加してる人いるので
2271.0,2273.0,デモにさ
2273.0,2275.0,その歌い手デモにさ
2275.0,2277.0,参加してる人もいると思うんだけどさ
2277.0,2279.0,まあちょっとね
2279.0,2281.0,1ヶ月後くらいにねまた再練したほうがいいんじゃないでしょうか
2281.0,2283.0,一生懸命アリーナでコメしてたじゃん
2283.0,2285.0,まあそうだね
2285.0,2287.0,だからちょっとね気を付けてくださいね
2287.0,2289.0,まあでもね
2289.0,2291.0,たまにはいいじゃないかと
2291.0,2293.0,おれだってガクトと共演して
2293.0,2295.0,おれだってね
2295.0,2297.0,なんかさうまいことさ
2297.0,2299.0,ガクトと共演したいけどさ
2299.0,2301.0,できないわけだけどさ
2301.0,2303.0,そういうね旨味を吸ってるわけだからさ
2303.0,2305.0,こういうさ悪いことしたときくらいはさ
2305.0,2307.0,たまにはさ叩かれていただきたいですよね
2307.0,2309.0,ほんとにね
2309.0,2311.0,いいじゃないですかね
