start,end,text
2311.0,2313.0,ガクトとうんこちゃんとかさ
2313.0,2315.0,俺自身も想像がつかないですけど
2315.0,2317.0,ちょっとね嵐誘導は番大将だから
2317.0,2319.0,オブラートにすいません
2319.0,2321.0,別に誘導してるわけじゃないですよ
2321.0,2323.0,今の現状はこうだよねっていうね
2323.0,2325.0,そういうなんていうのかな
2325.0,2327.0,話題の共有です
2327.0,2329.0,今の現状はこうだよねっていうね
2329.0,2331.0,最近のニコニコって怖いよねみたいなさ
2331.0,2333.0,そういうあれですよ
2333.0,2335.0,そういうことですよ
2335.0,2337.0,気を付けなきゃいけないですよ
2337.0,2339.0,敵が多すぎるんだよな
2339.0,2341.0,隣人もさ
2341.0,2343.0,ちょっと大きい声出してわーわー言うと
2343.0,2345.0,気を付けて放送していかなきゃいけない
2345.0,2347.0,っていうのはわかってます
2347.0,2349.0,ただね自分自身もね
2349.0,2351.0,久々の雑談枠というわけで
2351.0,2353.0,そうなんだよ
2353.0,2355.0,話題が一つに厳拠されるっていうのは
2355.0,2357.0,かなり雑談する上でデメリットなんですよ
2357.0,2359.0,そんなずーっと同じ話で
2359.0,2361.0,なかなか30分1時間もさ
2361.0,2363.0,喋り続けることって不可能じゃないですか
2363.0,2365.0,ゲームやってくれ
2365.0,2367.0,もう20分しかないの?
2367.0,2369.0,まじかちょっとね暇だったらね
2369.0,2371.0,この後やろうかなっていう考えあるんでね
2371.0,2373.0,お付き合っていただければなと
2373.0,2375.0,失恋の80分話なんだろう
2375.0,2377.0,あの時は別次元の問題じゃん
2377.0,2379.0,あの時は別次元の話なんで
2379.0,2381.0,そういう時もたたあるんでね
2381.0,2383.0,皆さんが温かく見守っていただければなと思います
2383.0,2385.0,そうなんだよ
2385.0,2387.0,いろいろあったんだよね
2387.0,2389.0,この1年間ちょっと待ってください
2397.0,2399.0,うなちゃんまん復活
2399.0,2401.0,1ヶ月間
2401.0,2403.0,金玉出しちゃっただけ
2403.0,2405.0,原因はちょっとね
2405.0,2407.0,わかんないんだけど
2407.0,2409.0,でもね
2409.0,2411.0,いいですよね
2411.0,2413.0,やっぱああいうね
2413.0,2415.0,すごいさ
2415.0,2417.0,人が集まる放送っていうのは
2417.0,2419.0,見ちゃいますからね
2419.0,2421.0,私自身のコミュニティでも
2421.0,2423.0,友人の金玉が
2423.0,2425.0,映ってしまったことがあるんですけど
2425.0,2427.0,その説は皆さんの信者ガードによりまして
2427.0,2429.0,通報されなかったので
2429.0,2431.0,ガチでね金玉が出ちゃったんですよ
2431.0,2433.0,トランクスの脇から
2433.0,2435.0,金玉が出ちゃったんですけど
2435.0,2437.0,その時はね無事に何とか
2437.0,2439.0,バンされなかったんで私自身も
2439.0,2441.0,ちょっとね今になったら今更ちょっとバンになってさ
2441.0,2443.0,なんかねまたやり直すっていうのは
2443.0,2445.0,ちょっとね厳しいものがあるからね
2445.0,2447.0,そういうあれには気をつけていこうかなと
2447.0,2449.0,思います
2449.0,2451.0,そうそうそうゴミ屋敷配信
2451.0,2453.0,なんかちょっとさそうだよね
2453.0,2455.0,そういう放送してみたいよね
2455.0,2457.0,以前はさ
2457.0,2459.0,友人の家がね
2459.0,2461.0,見てない人も多々いると思うんで言いますけど
2461.0,2463.0,友人の家がねまあゴミ屋敷でして
2463.0,2465.0,それをねみんなに言ったら全然信じくれなかったんだよ
2465.0,2467.0,本当に
2467.0,2469.0,ゴミ屋敷
2469.0,2471.0,人知を超えたゴミ屋敷なわけよ
2471.0,2473.0,足の運ばんもないし1年半前の
2473.0,2475.0,なっちゃんもあるし
2475.0,2477.0,部屋っていうかゴミ箱の中に住んでるね
2477.0,2479.0,友人がいるんですけど
2479.0,2481.0,その話をしたらみんな信じくれなくて嘘だろうんこちゃん
2481.0,2483.0,嘘だろうんこちゃんみたいなねそういうコメントがあったんで
2483.0,2485.0,その放送してそういう外配信
2485.0,2487.0,したわけなんですよ
2487.0,2489.0,外配信1年
2489.0,2491.0,こんだけね長いこと
2491.0,2493.0,1年半って言ったら長いと思うんですけど
2493.0,2495.0,1回しかね外配信的なものをしてないんでね
2495.0,2497.0,1回ちょっとしてみたいなと
2497.0,2499.0,でもねやることがないんだよね
2499.0,2501.0,そういうのって降格するからネタが降格していってさ
2501.0,2503.0,やっぱ求められるものがどんどん高くなっていくからさ
2503.0,2505.0,なかなかしづらいなっていう部分はある
2505.0,2507.0,富士山はだってさ外配信って動画じゃんあれは
2507.0,2509.0,動画じゃん
2509.0,2511.0,動画だからねまたそれとはね
2511.0,2513.0,趣旨が違うじゃん全然
2513.0,2515.0,カラオケ配信
2515.0,2517.0,カラオケ配信
2517.0,2519.0,覚えてました?あの黒歴史
2519.0,2521.0,まぁちょっとねあれはね
2521.0,2523.0,なんていうのかな
2523.0,2525.0,カラオケ配信をね
2525.0,2527.0,したんですけどまぁちょっと滑りまして
2527.0,2529.0,ポケモン安価でカラオケ配信したんですよ
2529.0,2531.0,そしたらねポケモン
2531.0,2533.0,ゲットだぜみたいなねそういうね
2533.0,2535.0,あのスナイパーが
2535.0,2537.0,叩いましてちょっとその時はね
2537.0,2539.0,あの黒歴史になり得る
2539.0,2541.0,人類スポットやってないやってない
2541.0,2543.0,それで多分誰かのね間違えてる
2543.0,2545.0,俺はねちょっとねもう二度とやらないと思う
2545.0,2547.0,カラオケはね二度とやらないと思う
2547.0,2549.0,だからねそういうねその歌い手さんの
2549.0,2551.0,ねその放送とかで歌は聞けますんで
2551.0,2553.0,その歌はね彼達に任せて
2553.0,2555.0,私はねなんか適当に他のことやっていこうかなと
2555.0,2557.0,思います
2557.0,2559.0,そうなんだよな色々やってきたっていうかね
2559.0,2561.0,そんな言うほどやってきてないけどさ
2561.0,2563.0,色々ね挑戦してた時期もあったんですよ
2563.0,2565.0,挑戦してた時期もあったんですよ私も
2565.0,2567.0,だからねちょっと皆さんもね
2567.0,2569.0,その動向にね
2569.0,2571.0,気をつけて頂ければなと思います
2571.0,2573.0,次枠何やるか今考えてんだよな
2573.0,2575.0,ヤフーの知恵袋
2575.0,2577.0,今なんかさ地震の話題ばっかでさ
2577.0,2579.0,多分そういうのさあんまり喋りづらいからさ
2579.0,2581.0,なんか他のなんかね
2581.0,2583.0,ゲームはちょっとやりたくないな
2583.0,2585.0,ゲームはやりたくないな
2585.0,2587.0,ゲームはやりたくない企画考え
2587.0,2589.0,企画考えてもどうするさ
2589.0,2591.0,俺自分で考えたやつしかやる気しねーからさ
2591.0,2593.0,自分で
2593.0,2595.0,考えたやつしかやる気
2595.0,2597.0,何回戦しますか?残り15分
2597.0,2599.0,久々だからちょっと私自身もね
2599.0,2601.0,緊張しております
2601.0,2603.0,残り15分やっていこうかなと思います
2603.0,2605.0,タチンピー5面版2755
2605.0,2607.0,あーホワイトでね
2607.0,2609.0,その話また今度するわあとでするわ
2609.0,2611.0,2755でいきます
2613.0,2615.0,なんで絡む時他のコミ行くの
2615.0,2617.0,うーん
2617.0,2619.0,なんかその人が荒れて可哀想だから
2621.0,2623.0,絶対叩くじゃないですか
2623.0,2625.0,絶対叩くじゃないですか
2625.0,2627.0,2755秋田県
2627.0,2629.0,あーなるほどね
2629.0,2631.0,秋田県か
2631.0,2633.0,私自身もね
2633.0,2635.0,仙台にね昔お姉ちゃんが住んでいて
2635.0,2637.0,よくね東北地方に遊びに行ってたんですよ
2637.0,2639.0,で秋田県も行ったことあるんですけど
2639.0,2641.0,で秋田県も行ったことあるんですけど
2641.0,2643.0,その時はね
2643.0,2645.0,まだね今はどうなってるかちょっとわからないんですけど
2645.0,2647.0,まあね
2647.0,2649.0,田舎だったんですよほんとに
2649.0,2651.0,秋田駅っていうのがあって
2651.0,2653.0,まあもう
2653.0,2655.0,なんていうの
2655.0,2657.0,東京で行った
2657.0,2659.0,県庁所在地
2659.0,2661.0,ね
2661.0,2663.0,それで行ったんですけどまあ田舎でね
2663.0,2665.0,ただね秋田っていうのは
2665.0,2667.0,米の産地でしょ
2667.0,2669.0,ただね都会にすればいいってもんじゃなくて
2669.0,2671.0,ただね都会にすればいいってもんじゃなくて
2671.0,2673.0,昔からの文化みたいなのも
2673.0,2675.0,大事にしていかなきゃいけないのかなと
2675.0,2677.0,今も変わらない
2677.0,2679.0,そうなんだね
2679.0,2681.0,そういう田舎ってさやっぱ変わってほしくないんだよね
2681.0,2683.0,俺自身の田舎もね電車が最終
2683.0,2685.0,これねみんな言っても信じくれないんだけど
2685.0,2687.0,あの
2687.0,2689.0,終電が
2689.0,2691.0,うちの実家ね8時50分なんだよ
2691.0,2693.0,電車の終電が8時50分なの
2693.0,2695.0,そんで電車が
2695.0,2697.0,1時間半に1本しかないんだよ
2697.0,2699.0,そういうねくそ
2699.0,2701.0,嘘じゃない嘘じゃない電車すらない
2701.0,2703.0,電車すら通ってないとかあるよほんとに
2703.0,2705.0,だからねほんとにね
2705.0,2707.0,そういうねたださ文明を発展させればいい
2707.0,2709.0,ってわけじゃないんだよそういう昔からの文化みたいなのもさ
2709.0,2711.0,守っていっていただきたいですよね
2711.0,2713.0,こういうさ
2713.0,2715.0,災害とかあったときはさ
2715.0,2717.0,外国からのさそういう
2717.0,2719.0,食品とかに頼ることになるけどさやっぱりさ
2719.0,2721.0,国産でさそういうなんていうの
2721.0,2723.0,食料品をさ作ってる国って強いじゃないですか
2723.0,2725.0,そういう国になっていっていただけたら
2725.0,2727.0,農業をね活発に
2727.0,2729.0,活発にしていっていただけたらなと思います
2729.0,2731.0,アリーナゴメンバー
2731.0,2733.0,2900でいきましょう
2733.0,2735.0,何その特定されそうな情報
2735.0,2737.0,ちょっとだけ嘘を交えてるので安心してください
2737.0,2739.0,ちょっとだけね
2739.0,2741.0,2900アリーナ
2741.0,2743.0,そんな田舎住めないわ
2743.0,2745.0,いやでもね意外に住めば
2745.0,2747.0,住めば都っていう言葉があって
2747.0,2749.0,住めば都って言葉があって
2749.0,2751.0,すごくね今思えばね
2751.0,2753.0,あの田舎暮らしはね幸せだった俺は
2753.0,2755.0,アリーナゴメンバー2900
2755.0,2757.0,買い占められて牛乳が買えなかった
2757.0,2759.0,あーまあそうだよねでもさ俺思ったんだけどさ
2759.0,2761.0,あれってさ
2761.0,2763.0,物資が少ない
2763.0,2765.0,買い占めちゃう人とかっているのかな
2765.0,2767.0,うちもね今コンビニってさ
2767.0,2769.0,全然さ
2769.0,2771.0,食品が並んでないじゃん
2771.0,2773.0,食品がマジで並んでないじゃん
2773.0,2775.0,カップラーメンもさ
2775.0,2777.0,全然売ってなくてさ
2777.0,2779.0,ババアが買い占める
2779.0,2781.0,そういう気持ちはわかるけどさ
2781.0,2783.0,なんかさ買い占めってやっぱよくないよね
2783.0,2785.0,それってさコンビニ側でさ
2785.0,2787.0,なんとかうまくね
2787.0,2789.0,張り紙でもいいから規制するのって難しいじゃん
2789.0,2791.0,やっぱ張り紙一つでさ
2791.0,2793.0,後ろめたい気持ちが強いと思うから
2793.0,2795.0,あんまりできれば
2795.0,2797.0,カップラーメン一人一個にしてくださいとかさ
2797.0,2799.0,一食につき一個にしてくださいとかさ
2799.0,2801.0,してほしいよね
2801.0,2803.0,だからそうそう俺もさ食事がさ
2803.0,2805.0,待ち屋ですらやってないんだよ今
2805.0,2807.0,張り紙あるとこもある
2807.0,2809.0,東京の人たちよりさ一番悲しい
2809.0,2811.0,東北の民とかさ
2811.0,2813.0,直接被害を受けた人はさ
2813.0,2815.0,飯も食えずにさ頑張ってるわけだからね
2815.0,2817.0,ちょっとねそういう意味で協力していただきたいですよね
2817.0,2819.0,本当に
2819.0,2821.0,やばいやばいやばいちょっと待ってね
2821.0,2823.0,これちょっと怒られたわ多分ごめんなさい
2823.0,2825.0,ありがとうございました
2825.0,2850.0,皆さん本当にねやっぱね
2850.0,2852.0,人に迷惑をかけちゃいけないと思うんですよ
2852.0,2854.0,人にね迷惑をかけちゃいけないんで
2854.0,2856.0,まあね
2856.0,2858.0,今日はね以上で終わりにしようかなと
2858.0,2860.0,これからねお昼の顔としてね
2860.0,2862.0,頑張っていこうと思います
2862.0,2864.0,さよなら
