start,end,text
0.0,2.0,【コメント】やりたくなったらやるわ
2.0,4.0,やりたくなったらやるわ
4.0,6.0,まぁボケかはなんかめんどくせぇな
6.0,8.0,【コメント】簡易数教えてくれ
8.0,10.0,何人ぐらいだろう?なんかこの前見せなかったっけ?
10.0,12.0,550人ぐらいじゃなかった?
12.0,14.0,あんま変わってねぇだろ
16.0,18.0,500人から600人の間ぐらいじゃない?
18.0,20.0,それぐらいだよね
22.0,24.0,そんな変わってないと思うよ
24.0,26.0,【コメント】DMLからエロゲー実況の依頼来たらやるか
26.0,28.0,うーん
28.0,30.0,なんか
30.0,32.0,ゲームの依頼は全部断ってんだよな
32.0,34.0,なんかここだけの話さ俺さゲームショーもさ
34.0,36.0,なんか一個
36.0,38.0,すごい
38.0,40.0,いいお話あったんだけどなんか
40.0,42.0,ゲームはちげぇなつって
42.0,44.0,断っちゃったなあれ出とけばよかったな
46.0,48.0,全然ね俺と
48.0,50.0,関係ないところだったのね
50.0,52.0,だから俺が出ても浮いちゃうなと思って
52.0,54.0,配信もできねぇし
54.0,56.0,あれ出とけばよかったな
56.0,58.0,もったいないよね今思えば
58.0,60.0,当会議出ろって言われても俺誘われてねぇもん
62.0,64.0,ネトゲの依頼はあんま来ない
64.0,66.0,アプリの依頼は結構来るかも
66.0,68.0,なんか違わない?
68.0,70.0,配信
70.0,72.0,うーん
72.0,74.0,でもかと思えば変な仕事も受けてるしな
74.0,76.0,何されてるかだ
76.0,78.0,AV男優
78.0,80.0,これから
80.0,82.0,現場の今壁白いだろ
82.0,84.0,今俺下裸なのね
90.0,92.0,出るって言って黙って関係ある
92.0,94.0,ゲーム配信でやればいいじゃん
94.0,96.0,なんか別に隠してやる必要ないじゃん
98.0,100.0,初見が信じるくらい
100.0,102.0,なんでお前だけ今色変わってたんだ
102.0,104.0,なんでこの人だけ色変わってんの
108.0,110.0,謎だ
110.0,112.0,謎だ
112.0,114.0,同性愛者だよ
116.0,118.0,なんで初見なのに分かるの
120.0,122.0,リプみたいな感じなんだ
130.0,132.0,リプライだと変わるんだ
132.0,134.0,知らなかった
136.0,138.0,そんな機能があるんだ
138.0,140.0,コメに返すと
140.0,142.0,うーん
142.0,144.0,気にしなくていいってことか俺は
146.0,148.0,俺だって今みんなに黙ってるけどさ
148.0,150.0,初見の人気づいてないかもしれないけど
150.0,152.0,俺FC2アダルトでチンチン出してるからね
152.0,154.0,加藤純一スペースFC2アダルトで
154.0,156.0,みんな俺のAV買ってな
158.0,160.0,仕事でやってんだこれ
160.0,162.0,マジだよ
162.0,164.0,それから1分100円課金して
164.0,166.0,AV女優と同じ値段でやってるから
166.0,168.0,そっちの方も応援してねみんな
180.0,182.0,ニコ生でいいだろ
182.0,184.0,なんでツイキャスでも頑張らなきゃいけないんだよ
184.0,186.0,パンクしちまうよ
188.0,190.0,適当でいいんだよ
190.0,192.0,ツイキャスなんて俺が
192.0,194.0,1000等行くとき
194.0,196.0,髪切ったとき
196.0,198.0,それ以外やらん
200.0,202.0,ニコ生で見いらしてくれ
204.0,206.0,モリコンでなる国風
206.0,208.0,1000枚ぐらいは売れる自信あるんだけどな
208.0,210.0,俺がCD出すよって言ったら
210.0,212.0,ただ
212.0,214.0,1000枚だとな
216.0,218.0,モリコン80位ぐらいだろうしな
218.0,220.0,何かサシハラみたいに熱心な信者が
220.0,222.0,買いそうじゃない
222.0,224.0,10枚とか
224.0,226.0,ツイキャス見らん俺は全然オッケーだよ
226.0,228.0,どこでも見らしてくれ
230.0,232.0,コメント見れねえけどな
236.0,238.0,1000枚でも20位に入るんだ
238.0,240.0,へー
240.0,242.0,マジで
242.0,244.0,マジで
244.0,246.0,マジで
246.0,248.0,へー
248.0,250.0,そうやって考えると
250.0,252.0,オリコンってクソほど役に立たなくない
252.0,254.0,だって
254.0,256.0,工作できちゃうじゃん
260.0,262.0,工作できちゃうじゃん
264.0,266.0,何の意味もねえじゃんオリコン
266.0,268.0,チャート
272.0,274.0,へー
274.0,276.0,コラボさせてもらえば良くないか
278.0,280.0,それって何の意味もなくない
282.0,284.0,よく言うんだよ
284.0,286.0,ゲロちゃんに頼めゲロちゃんに頼め
286.0,288.0,それってもうね
288.0,290.0,人が減ってく
290.0,292.0,第一条件じゃない
292.0,294.0,誰かに頼んで
296.0,298.0,みたいな
298.0,300.0,俺たちの中で完結させないと面白くないんだよ
300.0,302.0,今暗黒やってるぞみたいなのが
302.0,304.0,だらだらツイキャスして
308.0,310.0,行こうと思います
312.0,314.0,正論だろ
316.0,318.0,上手い人いるんだけどね
320.0,322.0,俺そういうキャラじゃねえんだよな多分
322.0,324.0,楽なんだけどさ
324.0,326.0,ゴミ
330.0,332.0,生主同士の仲いい感じだゴミ
332.0,334.0,あれ面白くねえよな
334.0,336.0,あれ面白くねえわ
336.0,338.0,ほんとに
338.0,340.0,自力でやってくのが一番面白いじゃん
342.0,344.0,気持ち悪いアニマルがいっぱいいる
346.0,348.0,同族嫌悪っていう言葉が
348.0,350.0,ゴミキャスを変えてくるなんて
350.0,352.0,別になんかツイキャス変える必要ないじゃん
352.0,354.0,勝手にやっておけばいいと思うんだけど
356.0,358.0,各々なんかあれが一番悪いだろ
362.0,364.0,住む世界が
364.0,366.0,俺ツイキャスなんか
366.0,368.0,もう頑張るけどさらさらねえし
368.0,370.0,俺の心の隙間を
370.0,372.0,可愛い女込めしねえかなくらいの
374.0,376.0,俺のツイキャスのモチベーション
376.0,378.0,俺のツイキャスのモチベーション
378.0,380.0,なんかサムネ可愛い女いねえからぐらいしかねえから
380.0,382.0,みんなよろしくな
382.0,384.0,来たらなんかもう定調に
384.0,386.0,ヤマタのオロチに献上するつもりで
386.0,388.0,褒めたたえてくれ
388.0,390.0,あーおめでとう
390.0,392.0,うんこちゃんに見染められた
394.0,396.0,ピル飲みながら俺の放送見ろ
396.0,398.0,ピル飲みながら
400.0,402.0,さっきから可愛い女のコメしか読んでねえんだ
402.0,404.0,意識してなかった
406.0,408.0,なんか
408.0,410.0,そうやって言ったらコメントするハードル上がるよね
410.0,412.0,多分ね
412.0,414.0,コメントするハードル上がるよね
420.0,422.0,我こそはみたいなやつ頼むぞ
422.0,424.0,我こそはみたいな
426.0,428.0,よろしく
430.0,432.0,ツイキャス見てる女がいいのか別になんか冗談です
436.0,438.0,冗談や
442.0,444.0,一応ルールがあってさ
444.0,446.0,コンドームをするっていう
448.0,450.0,コンドームしたらなんでもあり
452.0,454.0,うちのルール
454.0,456.0,みんなもそれだけは守ろうぜ
458.0,460.0,子供作るとめんどくせえだろ
462.0,464.0,モコとモトカの出会いはツイキャスだぞ
464.0,466.0,マジで
466.0,468.0,嘘でしょ
468.0,470.0,あいつツイキャスで彼女作ったの
472.0,474.0,絶対嘘だろそれ
476.0,478.0,絶対嘘だから
478.0,480.0,絶対嘘だから
480.0,482.0,なんかそうやってどんどん
482.0,484.0,わけわかんねえ噂が
484.0,486.0,広がってくんだろ
486.0,488.0,俺らってツイキャスで恋愛してえよ
488.0,490.0,ニコ生で頑張ってツイキャスで女食う映画して
490.0,492.0,食い散らかすぞバカども
492.0,494.0,俺自分の視聴者には手出したくない
494.0,496.0,俺あれしようかな
496.0,498.0,サイオレとかの視聴者に手出していこうかな
498.0,500.0,それよくない
500.0,502.0,自分の視聴者ってやっぱ手出しちゃいけないじゃん
502.0,504.0,他の実況者の視聴者に手出していこう
504.0,506.0,そうしよう
506.0,508.0,あのコミュの
508.0,510.0,プロフィールに書いておくね
510.0,512.0,僕は他の視聴者
512.0,514.0,他の配信者の視聴者は
514.0,516.0,狙っていきます
516.0,518.0,狙っていきます
520.0,522.0,体で
524.0,526.0,じゅんちゃんのチンポじゃなきゃいけない
526.0,528.0,ってそういう感じにしとくわ
530.0,532.0,洗脳もしとくわ
534.0,536.0,洗脳していきます
538.0,540.0,本当だよ元カノキャスでごめん
540.0,542.0,モコがそれに触れたのが最初
542.0,544.0,お前モコンと関係者だよ
544.0,546.0,モコンの元カノ知ってるけど
546.0,548.0,絶対違うよそれ
548.0,550.0,一人歩きしてんだろ
552.0,554.0,そういうの見ると俺ナリミアが
556.0,558.0,覚醒座やってたみたいなのも
558.0,560.0,信じられねえんだよな
562.0,564.0,ネットの情報って
564.0,566.0,信じられねえんだよな
566.0,568.0,マリファナかマリファナじゃなきゃ
568.0,570.0,よくわかんないけど
570.0,572.0,俺も信じられない
572.0,574.0,そうだよな
578.0,580.0,マユツバモンよ
580.0,582.0,否定できなければ
582.0,584.0,ひだやかずるからな
584.0,586.0,じゅんちゃんが知ってるのは
586.0,588.0,絵師と付き合ってる頃のモコンじゃないの
588.0,590.0,絵師とも付き合ってたの
590.0,592.0,そんな陰で
592.0,594.0,食い散らかしてんだモコン
594.0,596.0,あいつ俺の前だと女に対してすげえ
596.0,598.0,清純なんだけどモコンはコンパしようぜ
598.0,600.0,自分は視聴者の女の子に手出したら
600.0,602.0,ダメだと思います
602.0,604.0,説教してたのにさ
606.0,608.0,あいつマジかよ
610.0,612.0,今度放送で問い詰めるわ
612.0,614.0,お前絵師と付き合ってたなつって
616.0,618.0,しかもなんでそれがバレてんの
618.0,620.0,なんかすげえな
632.0,634.0,そういうことなんだ
638.0,640.0,女が自慢したクズね一番
640.0,642.0,俺ホリエモン嫌いだったんだけどさ
642.0,644.0,あのさ
644.0,646.0,最近さ
646.0,648.0,ニューハーフの女とエッチして
648.0,650.0,アダコーダみたいなのがさ
650.0,652.0,文章に上げられてさ
652.0,654.0,それでさ
656.0,658.0,3Pしようって言われました
658.0,660.0,ってツイートしてた女
660.0,662.0,知ってる?
662.0,664.0,あいつもあれしようぜ
664.0,666.0,特定しようぜ
666.0,668.0,あれさ本当リベンジボルノじゃない
670.0,672.0,ひどくね?
672.0,674.0,実は
674.0,676.0,あんな許されちゃいけねえや
676.0,678.0,違う違う
678.0,680.0,大島カオルとホリエモンが
680.0,682.0,そういう関係だったんじゃないか
682.0,684.0,って文章に書かれて
684.0,686.0,実は大島カオルくんに
686.0,688.0,私ホリエモンと3Pしようって
688.0,690.0,言われたんですみたいなのを
690.0,692.0,わけわかんない第三者がツイートして
692.0,694.0,それリツイートバーって広がってて
694.0,696.0,ツイーター消した女がいるんだ
696.0,698.0,クソ女だよマジそういうやつ
698.0,700.0,てめえ俺でやりやがったら
700.0,702.0,ナイフでぶっ刺していくからなマジで
704.0,706.0,あれだめだろ
710.0,712.0,あれ絶対だめだよ
712.0,714.0,そんなことやりやがったら
714.0,716.0,本当俺許さねえかんな
718.0,720.0,いやだめじゃん
724.0,726.0,なんのメリットもねえよな
726.0,728.0,しかもホリエモンクラスでもさ
728.0,730.0,特定してリベンジボルノ仕返すからな
730.0,732.0,あいつの商品シーンは
732.0,734.0,これだよって写真であげるからな
734.0,736.0,2チャンネルの加藤純一スレに
736.0,738.0,トリップ付きで
740.0,742.0,絶対あげるからな
746.0,748.0,カメラリップもごまんねってください
748.0,750.0,そういう仕事します
750.0,752.0,あれだめだよ本気で
754.0,756.0,あんなのしたらさ
756.0,758.0,世の中狂っちまうよな
762.0,764.0,加藤純一スレに
764.0,766.0,被害者意識高すぎだよ
766.0,768.0,関係ねえ話に入ってくんじゃねえよ
768.0,770.0,って本当に思うんだよな
770.0,772.0,あいつら
772.0,774.0,もうあの
774.0,776.0,匿名性がないから今女の子
776.0,778.0,すっげえコメントしづらいだろうけど
778.0,780.0,女の子コメントしてよ
780.0,782.0,俺の意見が間違ってるかどうか今から討論しようぜ
782.0,784.0,加藤純一と討論番組しようぜ
784.0,786.0,そういう女選んだ
786.0,788.0,自分の責任ってまあそうやって思うしかない
792.0,794.0,加藤純一くんの
794.0,796.0,女子部
796.0,798.0,喜び組
798.0,800.0,喜び組
800.0,802.0,一人もいねえのかよ
802.0,804.0,ゼロかよ
804.0,806.0,許さねえ
812.0,814.0,許さん
816.0,818.0,ホリエモンに賛否しようと言われたら自慢したいだろ
818.0,820.0,いや
820.0,822.0,なんかさ
822.0,824.0,言った段階で価値なくなっちゃうじゃん
824.0,826.0,それだって影でこそこそ
826.0,828.0,持ってるからこそ価値があるのにさ
828.0,830.0,言った段階で価値なくなっちゃうない
834.0,836.0,内緒姫ごとにしてたほうが
836.0,838.0,全然価値あるよね
842.0,844.0,じゃない
844.0,846.0,だって
846.0,848.0,世間からそういう風に見られないじゃん
848.0,850.0,イーフラスの三流だよな
852.0,854.0,もったいねえと思って
856.0,858.0,バンギャがバンドのやつとネタリの
858.0,860.0,なんかさ
860.0,862.0,あれでしょ
862.0,864.0,あのバンギャの
864.0,866.0,2チャンネルみたいなの知ってるみんな
866.0,868.0,俺知らなかったんだけど最近聞いたんだけど
868.0,870.0,10話何ピーまでしたことあるんだ
870.0,872.0,これ内緒話5ピーまでしたことあるわ
872.0,874.0,渋谷のあの
874.0,876.0,カラオケで
876.0,878.0,18歳の頃
878.0,880.0,チンポ全然立たなかったわ
880.0,882.0,なんかね
882.0,884.0,昔よく女遊びしたときに
884.0,886.0,俺の役割があって
886.0,888.0,10歳ぐらい年上の人とナンパしたんだけど
888.0,890.0,お前はとりあえずチンコ出せって言われてたの
892.0,894.0,困ったらチンコ出す係になってて
896.0,898.0,困ったら俺がまずチンコ出して
898.0,900.0,ウーボー
900.0,902.0,ウーボーだったらウーボー
902.0,904.0,まず俺がチンコ出して相手のガードを崩す
908.0,910.0,最悪だったよ
910.0,912.0,モテねーし
914.0,916.0,みんなに嫌われるし
916.0,918.0,俺バイナグラ飲みながら
918.0,920.0,ナンパしてたんだよだから
920.0,922.0,ほんと最悪だよ
922.0,924.0,あれ
924.0,926.0,今の若者ほんとに生塗り
926.0,928.0,ナンパとかしてんだろうなと思って
928.0,930.0,ツイッターとかでさ
930.0,932.0,俺マジで
932.0,934.0,チンコ係だったからね
936.0,938.0,とりあえずチンコ出せって
938.0,940.0,11はとりあえずチンコ出せって言われてたんだよ
944.0,946.0,バイナグラって心臓に負担かからないのか
946.0,948.0,あれ元々ね
948.0,950.0,脳梗塞の
950.0,952.0,薬なんだよな
952.0,954.0,血流を下半身に集める
954.0,956.0,海綿体に血流を集める働きがあるんだよな
958.0,960.0,だったら勃起薬でも
960.0,962.0,いいじゃねーかって
968.0,970.0,心臓病だっけ
970.0,972.0,なんかあれだよな
974.0,976.0,あれいい
976.0,978.0,いい薬だよ
980.0,982.0,いい薬
982.0,984.0,今は絶対できないわ
986.0,988.0,今は絶対できない
988.0,990.0,あんな
990.0,992.0,恐ろしいことは
992.0,994.0,できないわ
994.0,996.0,時代が違ったらネットとか
996.0,998.0,なかったからさ
1000.0,1002.0,性欲落ちてないけど
1002.0,1004.0,女の子はちゃんと
1004.0,1006.0,関係を持たせていただく女の子は
1006.0,1008.0,しっかり選ぶようになったわ
1008.0,1010.0,この子は信用できる
1010.0,1012.0,ことしか
1012.0,1014.0,連絡来てないからまだ行かなくていいや
1024.0,1026.0,その時代
1026.0,1028.0,やってたらツイッターで炎上してるだろうね
1028.0,1030.0,昔話だからできるっていうだけでさ
1032.0,1034.0,今なんか
1034.0,1036.0,やってたら痛いじゃん
1036.0,1038.0,10代だったから別に
1038.0,1040.0,やろうって言う
1044.0,1046.0,あれに実況者の擦れが立つらしくて
1046.0,1048.0,俺知らなかったんだけど
1048.0,1050.0,だから
1050.0,1052.0,視聴者と関係を持ってると
1052.0,1054.0,みんなのきなみ晒されるっていう
1056.0,1058.0,俺のせいで絶対立ってねーやん
1058.0,1060.0,絶対立ってねー
1062.0,1064.0,明日から
1064.0,1066.0,また働かないといけない
1066.0,1068.0,行ってらっしゃい
1068.0,1070.0,何の仕事してんの
1070.0,1072.0,女とやるより放送の方が気持ちよくない
1072.0,1074.0,同じくらいだよな
1074.0,1076.0,ちょうど今同じくらい
1078.0,1080.0,トントンや
1080.0,1082.0,なんかコラボ参加のリクエストが
1082.0,1084.0,めっちゃ届くんだけど俺の放送でコラボしても
1084.0,1086.0,血祭りにあげられるだけだぞ
1086.0,1088.0,それを覚悟の上だったらいいけど
1088.0,1090.0,俺ならいけるって勘違いしてくると
1090.0,1092.0,本当にひどい目になるぞ
1092.0,1094.0,次
1094.0,1096.0,次したらコラボ受け付けるからな
1096.0,1098.0,さっき同じやつがずーっと
1098.0,1100.0,突してくるんだけどさ
1106.0,1108.0,めちゃくちゃにされるぜ
1108.0,1110.0,めちゃくちゃに
1112.0,1114.0,ボロ雑巾のように
1116.0,1118.0,最近最俺のスレ見たら
1118.0,1120.0,平川BKBKで笑った
1120.0,1122.0,BKBKって
1124.0,1126.0,BKBKって
1126.0,1128.0,トツマチとかしねーや
1130.0,1132.0,コラボ可能の設定になっちゃってるんだって
1134.0,1136.0,ボコボコか
1136.0,1138.0,なんでボコボコなの
1140.0,1142.0,バイク川崎バイクなの
1142.0,1144.0,川崎バイクなの
1148.0,1150.0,家族友人に迷惑かかるからやめとけ
1152.0,1154.0,その覚悟が上だろ
1154.0,1156.0,家族と友人に迷惑かかってもええで
1160.0,1162.0,いいだろ別に
1162.0,1164.0,生放送やるってそのくらいの覚悟あるだろうが
1166.0,1168.0,途端にかかってこなくなっちまった
1168.0,1170.0,せっかくあれだろ
1170.0,1172.0,もう一回かけてきてくれよ
1172.0,1174.0,俺とコラボしてくれ
1174.0,1176.0,今のやつ
1176.0,1178.0,頼む
1178.0,1180.0,俺を捨てねーでくれ
1184.0,1186.0,俺を捨てねーでくれ
1190.0,1192.0,よろしく
1196.0,1198.0,俺を一人にするな
1200.0,1202.0,なんかニコ生も
1202.0,1204.0,こんぐらいお手軽にできたらいいんだけどな
1208.0,1210.0,これぐらいお手軽に
1210.0,1212.0,まあでも色分けしてったほうがいいか
1214.0,1216.0,別にしょっちゅうツイキャスやるわけじゃねーからさ
1218.0,1220.0,なんかちょっとパーソナルな
1222.0,1224.0,あれするときはこっちみたいな
1224.0,1226.0,あんまりやる気ねーんだよな
1226.0,1228.0,ネッチョリやりたいっていうかニコ生は
1230.0,1232.0,もうサクッと見れてサクッとやるみたいなね
1234.0,1236.0,ニコ生するときは別に気荒れてやってないよ
1236.0,1238.0,なんかでも気分が違う全然
1240.0,1242.0,女の家に行くで
1242.0,1244.0,あの連絡待ち
1244.0,1246.0,連絡待ちでーす
1252.0,1254.0,妖粒ライブも忘れられなかった
1256.0,1258.0,女の家大事にしてくれやだよ
1258.0,1260.0,やです
