start,end,text
1380.98,1382.98,pdrさんみたいにやってくれ
1382.98,1384.98,見たわこの前pdrさん
1384.98,1386.98,あの歯がガチャガチャしてるゴミ
1388.98,1390.98,上げといてyoutubeに
1392.98,1394.98,うんよろしく
1394.98,1396.98,で俺がなんかはじめしゃちょーの悪口
1396.98,1398.98,一方的に言ってるのはちょっと悪いから
1398.98,1400.98,俺のなんかチブあんだろ
1400.98,1402.98,なんかあの一方通行逆走したみたいな
1402.98,1404.98,あれも書いとけそしたらどんどんだろ
1404.98,1406.98,お互い痛み分け一方的な暴力だめなんだよ
1406.98,1408.98,こいつもやってるよみたいな
1408.98,1410.98,このネコじゃんみたいなさ
1410.98,1412.98,それとちょっと抱き合わせで打っていこうぜ
1412.98,1414.98,よろしく
1416.98,1418.98,その方向で
1418.98,1420.98,一つよろしくお願いします
1422.98,1424.98,はじめのファンパコったぐらいで
1424.98,1426.98,騒ぎすぎだろ
1428.98,1430.98,なんかあれなんじゃない
1430.98,1432.98,企業からクレーム言われちゃったのが
1432.98,1434.98,一番やばいよな
1434.98,1436.98,だってあの人たちそういうのを
1436.98,1438.98,相手に商売してんじゃねーの知らねーけど
1440.98,1442.98,でも昔からそういう思い方
1442.98,1444.98,よくしてるよね
1444.98,1446.98,ニベアを
1446.98,1448.98,やってみた
1448.98,1450.98,俺どうでもいいと思うけど
1452.98,1454.98,どうでもいいと思ってますけど
1456.98,1458.98,俺
1458.98,1460.98,きついもん自分だったらさ
1460.98,1462.98,そういうふざけてやったやつが
1462.98,1464.98,その企業から
1464.98,1466.98,怒られたんだったらまだすいません
1466.98,1468.98,って謝ればいいけど
1468.98,1470.98,なんかあれなんでしょ
1472.98,1474.98,信者が荒らしちゃったみたいな
1474.98,1476.98,そういう立ち悪い感じだったんでしょ
1478.98,1480.98,あれちょっとかわいそうだわ
