start,end,text
1265.0,1267.0,そういうコンプレックス持ってるやつはいなかった
1270.0,1272.0,ね、ちょ、ねもんすチャンネルBは送っといてね、後で
1276.0,1278.0,そういうのやめねえか、もうやってねえよ
1278.0,1281.0,お前、12年前の話だからいいじゃねえかよ
1281.0,1283.0,12年前やぞ
1284.0,1286.0,宮助って美人?
1286.0,1288.0,うーん
1291.0,1292.0,どうなんだろうな
1293.0,1295.0,俺、生で見たことあるからさ
1296.0,1298.0,え、宮助って美人って言われてんの?
1298.0,1300.0,みんな、宮助って知ってる?
1300.0,1302.0,放送中の、あのー、実況の
1302.0,1304.0,実況で有名な宮助
1307.0,1309.0,知らないか
1309.0,1311.0,なんか、かわいいって言われてたんだよな
1311.0,1313.0,かわいい、かわいい、つって
1314.0,1316.0,めっちゃ普通じゃね?って思った、俺は
1316.0,1318.0,会った時、めっちゃブスだとも思わなかったし
1318.0,1320.0,すげえ美人だとも思わなかった
1321.0,1323.0,今日落ち着いてると思えばいいだろう
1323.0,1325.0,今日落ち着いてると思えばいいだろう
1325.0,1327.0,大人の色気出てるんだろう
1327.0,1329.0,今日気分がいいんだ
1329.0,1331.0,機嫌やよし
1331.0,1333.0,最近機嫌がいい時しかやらないからな、俺は
1333.0,1335.0,あの話すげえ、めっちゃやらせてくれる
1335.0,1337.0,お前らそういうの信用できねえや
1339.0,1341.0,信用できねえ
1343.0,1345.0,サトウキビの欠点はー
1345.0,1347.0,俺一回しか会ったことねえんだよ
1347.0,1349.0,しかも俺なんか、どっかで会ったんだよ
1349.0,1351.0,テクサかなんかの番組出てた時に
1351.0,1353.0,会って、俺知らなくて
1353.0,1355.0,その人がサトウキビだって
1355.0,1357.0,ああーっつって、でもメコさんの友達だって
1357.0,1359.0,知ってたから
1359.0,1361.0,自己紹介されたらわかったけど
1361.0,1363.0,あなたがサトウキビさんなんですか、つって
1365.0,1367.0,ウキオチはなんかね、今日さ俺
1367.0,1369.0,生放送開始したの遅れたでしょ
1369.0,1371.0,なんかね、10時からウキオチが生放送やってて
1371.0,1373.0,あいつの声聞いたらほんと気持ち悪くなっちゃってて
1373.0,1375.0,それで1時間遅れたんで
1377.0,1379.0,この場を借りて謝罪申し上げます
1379.0,1381.0,最近マジダメなんだよ、ほんとに
1381.0,1383.0,アナフィラキシーショックみたいな感じで
1383.0,1385.0,あいつの放送見ると、ほんとに具合悪くなっちゃって
1387.0,1389.0,じゃああれなんだよ
1389.0,1391.0,あのさ、自分の金玉の裏の匂い嗅ぐのと一緒でさ
1391.0,1393.0,あいつ大っ嫌いなんだけど俺
1393.0,1395.0,なんかやってたらさ、ちょっとなんか
1395.0,1397.0,適情視察じゃねえと、なんかみちまんだよ
1397.0,1399.0,はーいみなさーい!ってね
1399.0,1401.0,で、声にショック当たりしてすぐ消す
1401.0,1403.0,1人で機嫌悪くなる
1403.0,1405.0,なんだよこいつ、つって
1405.0,1407.0,やめちゃうな、結構頑張った声だから
1409.0,1411.0,じゃあ俺さ、マジでさ
1411.0,1413.0,俺悪口じゃない
1413.0,1415.0,悪口じゃなく聞いてほしいんだけどさ
1419.0,1421.0,絶対的なブスじゃん!
1421.0,1423.0,ウキョチって多分
1423.0,1425.0,なんかね、俺
1425.0,1427.0,なんか、コミの掲示板かなんか
1427.0,1429.0,暗黒掲示板かなんか見せたらウキョチが顔出ししたよー
1429.0,1431.0,っていうのがあって
1431.0,1433.0,俺何回も見たことないよ
1433.0,1435.0,そんで、顔出ししたんだと思ってパッて見たんだよ
1435.0,1437.0,そしたら、スノーっていうアプリ
1437.0,1439.0,可愛く映れるということで有名な
1439.0,1441.0,スノーっていうアプリでウキョチが顔出してて
1441.0,1443.0,ものすげーブスだったのね
1443.0,1445.0,えーーーって
1445.0,1447.0,スノーであんだけブスに撮れる奴ってなかなかいないの
1449.0,1451.0,ババゾのクラスのブスだったの
1451.0,1453.0,ほんとに
1453.0,1455.0,マジで
1455.0,1457.0,スノーでブスになるのって相当難しいじゃん
1463.0,1465.0,だけどさ
1465.0,1467.0,ウキョチめっちゃ可愛いんでしょ
1467.0,1469.0,正直普通に言う訳ない
1469.0,1471.0,でもガノンちゃんそれで言ってる訳じゃないじゃん
1471.0,1473.0,あれババゾのイーモだっけ
1473.0,1475.0,あ、スミタか
1475.0,1477.0,こうやって可愛いじゃん多分
1477.0,1479.0,なんで顔出ししちゃうんだろう
1479.0,1481.0,もったいねーよな人気なくなっちまうよな
1481.0,1483.0,メッキがどんどん剥がれていってしまうよな
1487.0,1489.0,それみんなに言ったところでさ
1489.0,1491.0,あのーいや可愛いよねとはならないんだろうけど
1491.0,1493.0,癒されてるわけじゃん
1493.0,1495.0,人気リスナーは
1499.0,1501.0,いやーでもあれ顔出ししないほうがいいよな
1501.0,1503.0,ごめんな俺は顔出してよかったな
1503.0,1505.0,みたいなのさ
1505.0,1507.0,遠回しに言っちゃって
1507.0,1509.0,ほんとに俺そういう見栄っ張りじゃなくてよかった
1509.0,1511.0,いるだろなんかさ
1511.0,1513.0,見栄っ張り
1513.0,1515.0,お前もう絶対出せねーぞ
1515.0,1517.0,俺エレンに似てるよとか絶対顔出せねーからな
1517.0,1519.0,俺そういう見栄っ張り
1519.0,1521.0,全然ねーから
1521.0,1523.0,マジで
1523.0,1525.0,もう容姿に
1525.0,1527.0,あのー
1527.0,1529.0,ツイッターの
1531.0,1533.0,サムネとかさ
1533.0,1535.0,ちくわちゃんランキング
1535.0,1537.0,コミュのサムネとか
1537.0,1539.0,あれ可愛くしてるやつ
1539.0,1541.0,マジでやめたほうがいいと思うよ
1541.0,1543.0,あとAVのパケ詐欺
1543.0,1545.0,俺今度イベントで言うわ
1545.0,1547.0,あれもうやめませんか
1547.0,1549.0,全員一斉にやめたらハードルみんな一緒じゃん
1549.0,1551.0,だってあれ男はマジでほんとに求めてないよ
1553.0,1555.0,男はマジで求めてねーから
