start,end,text
0.0,29.0,なんか噂によるとね、その会員人数が多分ね、3000人とか5000人くらいいねえと、あのー、あれなんだよ、たまにあるだろ、チャンネルなのにさ、個人がやってるチャンネル放送なのに、なんか立ち見20、20個くらい開放されてる、幕末志士とかあんだろ。やっぱ会員が多いと特別待遇、らしいぜ。知らんが。その辺のなんか、いい塩梅は知らない。何人からいいんだよみたいなのは知らない。
29.0,49.0,あるんだよ。そういうのって言えば意外と検討してくれるよ、なんかめんどくせえじゃん。めんどくさくねえか。立ち見オウムとか、いやだからさ、一回やってみてんだよなー、あ、みんな立ち見Zのみんなー、みたいなさ。
50.0,67.0,26部屋ってことは、13000人だろ。たまーにさ、そんくらい見てくれるときあるじゃん。そういうときのやっぱ脳汁、溢れ出す脳汁。味わってみてんだけどなー。味わってみたいや。
68.0,85.0,プレミアム会員なのに満員で入れないのほんとやめてほしい。なんかもったいねえよなー。二重課金させようとしてるよね。てかさ、俺こんなこと言うのもあれなんだけど、あのチャンネル持ってるやつでさ、プレミアムで満員になるやつなんかいねえじゃん。絶対プレミアムやめてチャンネル会員になってたほうがいいよな。他のところは。
85.0,102.0,絶対そうだよね。だまされてるよみんな。二重課金を。有料4000人くらいのチャンネルでもS解放されてないから、有料1万人がボーダーレイン。あ、そうなんだ。えー。
102.0,116.0,いやでもね座席制っていうのはねすごいいいんだよ。なんかいい区切りがあるじゃん。ここまでいったらとりあえず満員みたいなさ。俺的にもモチベーション上がるわけよ。お、満員だなみたいなさ。
116.0,126.0,それ区切りがあったほうがいいんだが、それをなんかじわじわと広げていくような、そういうシステムにしていただけたら、これ幸い。でございます。
127.0,140.0,階が少ないからこそ成り立ってる。あ、そういうもんなのかな。座席はね、別にいいんだよ。もうちょっと部屋広くしてくれたら、モチベーションが上がるというもんじゃ。
141.0,156.0,わしは。たちびの後ろの方を一緒に送ったりするのやめろ。なんかでも、コメントビューアーだとさ、最近対応したけどさ、映らねえわけよ。映らねえわけ。いくつなの?みたいな。
157.0,172.0,でも、ミラーでいいよ。むしろミラーで見たいし。なんかうまいこと積み上げてきてるよな。いじでもプレミアムにならないやつら。だからさ、あのー、もとからこっちに入る気ねえやつとかいるんだよ。ほんとに。
172.0,182.0,いるだろう。このミラーの三国ミラーで今見てるやつとかさ。最初っからこっち入ればいいやみたいな。ってことはさ、ミラーが立ってないときはさ、俺の放送も見る気がねえっていうか。
183.0,189.0,いるんだよ。そういうやつが。居心地の良さを求めて。
198.0,208.0,うまいこと積み分けられてんの。そしてこことは別になんか最近YouTubeでもミラーしてるからこんなんそっちの派閥も今、出現しつつある。
208.0,211.0,てかやべえ、俺延長してるか?やべえ。
211.0,213.0,あぶねえ。
216.0,219.0,あるんだよ。そういうなんか派閥みてえなのが。
221.0,230.0,俺別にだってどっちでもいいもん。毎回ミラー立ててくれるしさ。俺コメビュー起動すれば端から端まで全部見れるし。
230.0,235.0,俺最近知ったんだけど、自分のアカウントじゃねえとね、この立見Eまでしか見れねえんだよ。
235.0,246.0,で、要は他の今、アリーナにいる人とかがコメビュー開いてこの放送のURLクリックしても、この白枠のコメントって見れねえんだよ。
247.0,251.0,それクソみてえな差別を今。迫害を受けてるらしい。
252.0,256.0,あれ意味わかんねえよな。本格的に。
257.0,263.0,意味がわからんなあと思いながら俺は。そっとして。そっとしておいてるけど。
265.0,270.0,今度またYouTubeで生放送してえなあ。セイキンビュアーのあれを見てんだよなあ。手応えみたいなの。
271.0,277.0,だって俺生放送はさあ、最近すげえくるんだよ。ツイキャスでやりましょうとかオープンレックでやりましょうみたいな。
278.0,283.0,多分もう全くモチベーションが上がんなくてさあ。ツイキャスとオープンレックじゃ。
284.0,291.0,なんかちげえんだよなあ。居心地悪いんだよなあ。居心地の良さ重視なんだよ。俺自身の。
293.0,298.0,なんでオープンレック進めんの。画質がいいぐらいでしょ。チャンネル持ってたらこっちのほうがいいだろ。
299.0,306.0,オープンレックスのみどりさんのやつ。あれしかもさあ、タイムシフト一回しか見れないんでしょ。俺あれクソほどイライラすんだよね。
308.0,310.0,あれめちゃくちゃイライラすんだよね。
313.0,322.0,でね、あれなんだって、やっぱり延長バグってどこのチャンネルにもあるんだって。この前なんか、誰かの放送見てたら、それに対してクレーム言ってたわ。
323.0,325.0,いい加減32分バグなくしてくれって言って。
328.0,337.0,それはもう、あのー、俺の放送が止まって、ぬし込みに俺がコメントしたときは、もうバリ雑言をかき殴ってください。夏の絵の。
338.0,342.0,音沙汰ないときはレジディアへのクレームをよろしくお願いします。
344.0,346.0,レジディア、レジディアへの。
347.0,352.0,今日回線女子いいだろ。なんかあるんだよ。月曜日はなんかみんな早く寝てんじゃねえの。
353.0,358.0,俺やっぱり月曜日はなんか生放送したくなるんだよな。なんとなく。元気なんじゃねえかって疑惑があるから。
359.0,363.0,ちなみに俺今日風邪ひいてます。なぜか。最近裸で。
364.0,366.0,なんか女の子ばっかり遊んでたんだよ最近。
368.0,372.0,ごめんね土日。みんなのそばにいてあげれなくて。
374.0,380.0,エロ本の裏の、なんていうのかな。あのー、男みたいな感じだったわ。
381.0,383.0,エロ本の裏の男。
384.0,386.0,シチニクリンをくらってました。
387.0,389.0,引くほど。
390.0,392.0,引くほど抱いてました。
393.0,398.0,この場を借りて謝罪します。世の女性の皆さんに。食い散らかしてごめんなさいって言って。
399.0,401.0,さつたま風呂そうそうそうそう。
402.0,404.0,なんか最近ちょこちょこ忙しいんだよね。
405.0,408.0,まあでも1月も終わるし、まあ2月からまたちょっと新規行って、
409.0,411.0,なんかやっていこうかなと。
412.0,416.0,じゃあ、一個ね、撮りたい動画があって、さっきそれでなんかあれだわ、ゲームの話になっちゃったんだけど、
416.0,420.0,あのさ、カメナシのさ、ゴーイングのさ、カメナシのさ、140キロ企画が終わったんだよ。
421.0,423.0,昨日か一昨日。で、120キロに挑戦しようって言ってダメだったじゃん。
424.0,427.0,あれ俺が引き継ぐわ。勝手に。タイトルぴったし一緒で。
431.0,433.0,あれもうどうしてもやりてんだよ。マジで。
434.0,440.0,120ってマジで、あのー、超頑張った現実的な数字なのね。
441.0,443.0,超頑張った。今だったら絶対出ない。
443.0,447.0,今だったら絶対出ない。ちゃんとトレーニング積まなきゃ絶対出ないんだけど、
448.0,450.0,120って相当早いの。
451.0,453.0,相当早いのね。
454.0,459.0,多分ガチでトレーニングすれば、言ってジャニーズじゃん。あいつ体鍛えられねえじゃん。
460.0,462.0,体鍛えられねえじゃん。
463.0,466.0,夏測ったら110くらいだった。多分俺100は出ると思うんだけど今。
467.0,473.0,あれ勝手に俺が引き継いで。カメラは借りてくるんで。用意できるんで。
474.0,476.0,やっていきたいなって。
477.0,479.0,思ってます。
480.0,482.0,最近なんかそうなんだよ。動画作るモチベーションあるんだけどさ。
483.0,488.0,なんかこう、生放送で対抗心燃やしたくてさ。
489.0,492.0,誰かいてえと俺のあいつ倒そうぜみたいな。
493.0,497.0,去年は横山みどり倒そうぜみたいなモチベーションあったんだよ。
498.0,501.0,最近そういうモチベーション、誰か対抗意識みたいなの燃やしたくてさ。
504.0,508.0,なんかいねえの?すげえ。脅迫みたいなやつ。
509.0,510.0,脅迫。
511.0,513.0,正気になって生放送してねえじゃん。
516.0,518.0,生放送してねえじゃん。あいつ。
519.0,524.0,"ツベで同時接続26,000人の音じゃ。"
530.0,533.0,なんかこれこれとかもな。ニコ生以外でやんなきゃいけねえんだもん。
534.0,537.0,他の配信サイト潰れてみんなニコ生でやればいいのに。
538.0,539.0,なんでYouTubeでやんの。
540.0,543.0,俺システムを取れよみんなも。ニコ生でやっぱり生放送やってよ。
544.0,545.0,それでYouTubeで見ればそれはいいのによ。
545.0,548.0,なんかみんな生放送嫌いになっちゃったよな。
549.0,550.0,本気で。
554.0,555.0,よくわからん。
556.0,558.0,これこれが拡散した動画がテレビに取り上げられた話した。
559.0,562.0,まあ見たけどなんか俺はあんま好きじゃねえんだよな。
563.0,565.0,でもこれこれが好きじゃねえから何やっても好きじゃねえ。
567.0,570.0,あいつが善行をいくら重ねていこうと俺は認めない。
571.0,573.0,あれやらせたらやらせ。はめられんなお前ら。
573.0,574.0,あれ作りだよ作り。
575.0,576.0,作り。
578.0,581.0,ニコ生は資金が高いとかみんな言ってるよな。そうなんだ。
582.0,583.0,えー。
587.0,589.0,なんかでもYouTube主体でやりたくねえんだよな生放送は。
590.0,591.0,なんか誰か決めるわ勝手に。
592.0,594.0,なんか公式放送とかを目の敵にしていこうかな。
595.0,596.0,アニメとか。
597.0,600.0,なんか幕末志士ってあんまりなんかあれなんだよな。
601.0,602.0,嫌いになれねえんだよな。
603.0,604.0,なんか憎たらしくねえじゃん。
605.0,606.0,憎たらしい。
606.0,608.0,いやキヨとかやってたときはマジでモジュメル高かったんだよ。
609.0,611.0,あいつには絶対負けねえみたいなさ。
612.0,615.0,みんななんかいいやつばっかりなんかさ。
616.0,617.0,いいやつばっかりなっちゃったじゃん。
617.0,618.0,なんかちげえんだよ。
621.0,622.0,違う。
624.0,627.0,サラマンダマージでゴミだったその幕末志士のやつ。
628.0,629.0,いやそりゃさ。
629.0,633.0,同じようなさテンプレでずーっと動画上げてたらさすがにそれ飽きもくるじゃん。
634.0,637.0,なんかもう一段階ぐらい進化を残してんじゃねえの分かんねえけど。
637.0,638.0,二人でやってたらまだなんか。
639.0,641.0,なんかもう一段階ぐらい進化を残してんじゃねえの分かんねえけど。
642.0,644.0,なんかもう一段階ぐらい進化を残してんじゃねえの分かんねえけど。
644.0,646.0,なんかもう一段階ぐらい進化を残してんじゃねえの分かんねえけど。
646.0,648.0,二人でやってたらまだなんかいろいろあんじゃねえ。
649.0,650.0,俺最近見てねえよ幕末志士。
651.0,653.0,うまいことシフトチェンジしたよね。
653.0,654.0,ほんとに。
655.0,659.0,みやこ2月1日水曜日23時59分から24時54分放送。
659.0,661.0,日本テレビ系全国ネットJRJrさんの司会。
661.0,662.0,落とせに出演します。
662.0,663.0,見てね。
663.0,664.0,まじかよ。
664.0,665.0,なんだ落とせって。
665.0,666.0,どういう番組なの。
670.0,671.0,どういう番組なの。
672.0,673.0,なにそれ。
675.0,676.0,どういう番組なの。
679.0,680.0,どういう番組なのそれ。
684.0,685.0,どういう番組なの。
687.0,688.0,え、ダウンタウンじゃないの。
689.0,690.0,ダウンタウン。
692.0,694.0,ダウンタウンって言ってやがった。
695.0,697.0,千原ジュニアとやるの。
697.0,698.0,とやるの。
699.0,700.0,あ。
701.0,702.0,レポーターみたいな感じなんだ。
702.0,703.0,え、見よう。
703.0,704.0,2月1日ね。
704.0,705.0,OK。
705.0,706.0,見るわ。
707.0,708.0,今カレンダーに入れとこう。
708.0,709.0,2月1日。
711.0,712.0,みやびって入れとこう。
713.0,714.0,こんだけ見て誰も知らねえ。
715.0,716.0,ほんとだよ。
716.0,718.0,コツコツコツコツやっていかなきゃいけねえんだよ。
718.0,719.0,コツコツコツコツ。
720.0,721.0,やっていかなきゃいけねえんだよ。
722.0,723.0,仕方ねえんだよ。
724.0,728.0,後ろで歩いてる債務者に1000万円もらう番組だよ。
729.0,730.0,なかなか下水。
731.0,732.0,もうお前みやかり興味ないじゃん。
732.0,733.0,そんなことねえよ。
735.0,736.0,そんなことねえけどよ。
738.0,740.0,なんか今一番油が乗ってる時期だから
740.0,742.0,あんまり名前出さないほうがいいかなと思って。
743.0,744.0,もっとなんかゴミみたいなさ。
747.0,749.0,名前出しやしい女いねえかなと思って。
749.0,750.0,最近いねえんだよ。
750.0,751.0,朝の光ぐらいしかいねえんだよ。
751.0,756.0,俺の心の渇きは満たされない。
757.0,758.0,なんならNGにしたい。
759.0,761.0,NGコメに入れときたい。
761.0,762.0,俺は。
764.0,766.0,今日ゲームするかしないかだけ教えてくれ。
766.0,767.0,もう11時半でしょ。
768.0,770.0,いいよなんかダラダラダラダラ喋って
770.0,771.0,あと1時間ぐらい喋って
771.0,773.0,あと30分ぐらいしたらなんか
774.0,776.0,なんか変なことしよう。
777.0,778.0,最近よくやるだろ変なこと。
779.0,781.0,タイトル変なことする枠にすればよかった。
786.0,788.0,朝野先生正直かわいくない?
788.0,789.0,かわいいんじゃない?綺麗なんじゃない?
789.0,790.0,知らねえけど。
790.0,792.0,俺が好みじゃねえだけで。
794.0,795.0,あんまりなんかさ
795.0,798.0,直接的な用紙に関してディスるとさ
798.0,799.0,女ってすげえマジでさ
799.0,800.0,影ではすげえへこむじゃん。
800.0,801.0,だから言いづれえんだよね。
802.0,804.0,俺あの人の豚っ腹がマジで好きじゃなくてさ
804.0,806.0,本人の前で言ってろかなと思ったんだけど
806.0,808.0,やっぱなんかでも女の子だし
808.0,810.0,あんまりネットで言うのもよくねえなと思って。
812.0,813.0,俺ダメなんだよ。
813.0,815.0,それさ女の子の
815.0,817.0,なんか見た目の弱点みたいなのを
817.0,818.0,見つけるのがうまいの。
818.0,819.0,だからポッて言ってみ。
819.0,821.0,俺すぐ一瞬で出てくるから。
821.0,824.0,悪いとこばっか出てきちゃうんだよ。
826.0,827.0,宮里愛あのー
827.0,829.0,いしみたい。なんか。
830.0,832.0,あ、みゃこさんか。
833.0,835.0,みゃこさんはねえな。
835.0,836.0,なんだろうなあ。
841.0,843.0,え、ど、え、ないんじゃないマジで。
844.0,846.0,今パッと出てこなかったの。
846.0,848.0,だから、だからあの上位に。
848.0,850.0,いやその美人だって
850.0,852.0,佐々木臨宮とか言われたらさ出てこないじゃん。
852.0,854.0,いるじゃん。もっとえぐいやつ。
854.0,857.0,えぐいやつ。くれよえぐいやつ。
857.0,859.0,かわいいやつじゃあんな
859.0,860.0,あれになっちゃうじゃん。
860.0,861.0,負け惜しみになっちゃうじゃん。
861.0,862.0,男でもいいぞ。
862.0,864.0,俺人の中容姿の欠点
864.0,866.0,おこってたらあでの、あ、あごがねえとかさ。
866.0,868.0,大久保かよこほうれいせん。
868.0,870.0,俺すぐ出てくるからマジで。
871.0,872.0,大久保かよこほうれいせん。
872.0,874.0,が、ウィークポイントだと思う。
875.0,877.0,ユカチは乾燥肌。
877.0,878.0,あの隠しきれない。
878.0,880.0,だからファンデーション相当高いやつ使ってんだよ。
880.0,881.0,乾燥肌。
883.0,885.0,平林美希は前歯。
886.0,887.0,口閉じて。
887.0,889.0,もちろん俺しかわかんねえだろ。
889.0,891.0,あれすげえかわいいんだよなゴロちゃんがさ。
891.0,893.0,あのゲームスプラトゥーンとかやってるときに
893.0,894.0,口閉じてんだけどさ。
894.0,896.0,左の前歯だけちょっと出てんのかさ。
897.0,899.0,俺たまらなく愛しかったわ。
901.0,903.0,そこが好きだったといっても過言ではない。
905.0,907.0,そこを愛せるかどうかなんだよな結局。
908.0,910.0,男の子の器量というか。
912.0,914.0,そこなんだよな結局。
917.0,919.0,良さが出てくるのは。
919.0,921.0,小動物みたいなのマジでかわいいよなあ。
921.0,923.0,小動物みたいで。
923.0,925.0,世界のお客さん顔知らねえわ。
925.0,927.0,多分デブだよあいつ。
927.0,929.0,デブ。
929.0,931.0,今日あんまりエンジンかかってないな。
931.0,933.0,たまにはいいじゃん。
933.0,935.0,無理してテンション上げてもしょうがねえや。
937.0,939.0,松本ひとしはなんか溶けてない?
939.0,941.0,なんか顔が。
941.0,943.0,なんか溶けてない?
943.0,945.0,焼けただれてない?
945.0,947.0,めちゃめちゃ。
947.0,949.0,あれ溶けてるよな。
949.0,951.0,めちゃめちゃの顔。
951.0,953.0,昔はキリッとしてたのに溶けかけてきてない?
957.0,959.0,人の容姿の弱点すぐ分かるんだよ。
959.0,961.0,俺は好みの顔してるけどな。
963.0,965.0,好みの顔してる。
965.0,967.0,このように俺は見ちゃうんだよ。
967.0,969.0,すぐさま。
969.0,971.0,飲み物持ってくるわ。
971.0,973.0,お茶。
973.0,975.0,山田さんなんだろうな。
975.0,977.0,考えておくわ。
979.0,981.0,ご視聴ありがとうございました。
981.0,983.0,チャンネル登録よろしくお願いします。
983.0,985.0,チャンネル登録よろしくお願いします。
985.0,987.0,チャンネル登録よろしくお願いします。
987.0,989.0,チャンネル登録よろしくお願いします。
989.0,991.0,チャンネル登録よろしくお願いします。
991.0,993.0,チャンネル登録よろしくお願いします。
993.0,995.0,チャンネル登録よろしくお願いします。
995.0,997.0,チャンネル登録よろしくお願いします。
997.0,999.0,チャンネル登録よろしくお願いします。
999.0,1001.0,チャンネル登録よろしくお願いします。
1001.0,1003.0,チャンネル登録よろしくお願いします。
1003.0,1005.0,チャンネル登録よろしくお願いします。
1005.0,1007.0,チャンネル登録よろしくお願いします。
1007.0,1009.0,チャンネル登録よろしくお願いします。
1009.0,1011.0,チャンネル登録よろしくお願いします。
1011.0,1013.0,チャンネル登録よろしくお願いします。
1013.0,1015.0,チャンネル登録よろしくお願いします。
1015.0,1017.0,チャンネル登録よろしくお願いします。
1017.0,1019.0,チャンネル登録よろしくお願いします。
1019.0,1021.0,チャンネル登録よろしくお願いします。
1021.0,1023.0,チャンネル登録よろしくお願いします。
1023.0,1025.0,チャンネル登録よろしくお願いします。
1025.0,1027.0,チャンネル登録よろしくお願いします。
1027.0,1029.0,チャンネル登録よろしくお願いします。
1029.0,1031.0,チャンネル登録よろしくお願いします。
1031.0,1033.0,チャンネル登録よろしくお願いします。
1033.0,1035.0,チャンネル登録よろしくお願いします。
1035.0,1038.5,え、ちょっと待って、そんな久しぶり?
1038.5,1040.5,え、俺5日ぶりに生放送するの?
1040.5,1042.5,絶対ないだろそれ
1044.0,1045.5,え?久しぶり?
1045.5,1047.5,あ、違うわ、枠消したんだ、そうだそうだ
1047.5,1049.5,消したんだ、消したんだ
1052.5,1055.5,あれ、いつだっけ?タイムシフト消した日
1059.5,1061.5,2、3日前じゃない?
1065.0,1067.0,木曜日?金曜日?
1067.0,1069.0,26?
1069.0,1071.0,1、2、3、へー
1071.0,1073.0,なるほどな
1073.0,1075.0,時系列がぐっちゃぐちゃになってるわ
1078.0,1080.0,あー
1080.0,1082.0,ニコラジの後か
1082.0,1085.0,なんかニコラジの後放送しちゃうんだよなー
1085.0,1087.0,う、うずくんだよな
1087.0,1089.0,自分がやっぱ
1089.0,1091.0,主になって喋りたい願望があるんだろうな
1091.0,1093.0,話したらねーってなっちまう
1095.0,1097.0,コリッ
1097.0,1099.0,コリッ
1099.0,1101.0,コリッ
1103.0,1105.0,おめえ最悪だよ、マジこの
1105.0,1107.0,この時間帯で寝れなくなったら別にそんな
1107.0,1109.0,今日夜遅くまで寝そう、わかんねぇけどな
1109.0,1111.0,比較的今日体力あるから
1113.0,1115.0,比較的な
1117.0,1119.0,あ、セピアに会った日だ!そうそうそうそう
1119.0,1121.0,思い出した
1121.0,1123.0,向かいおさむの欠点
1123.0,1129.0,俺マロン、生主の女のさ、マロンとムカイオサムと
1129.0,1132.0,あのー、韓国のさ、12年前にやったグウェムルの
1132.0,1135.0,グウェムルって映画に出てくる化け物、違いがわかんないわ
1135.0,1137.0,なんか生図顔だよな、あの辺ってみんな
1138.0,1139.0,生図みてぇな顔してない?
1139.0,1141.0,俺ムカイオサムすげぇ好きだけど
1142.0,1144.0,綺麗な生図みたいな
1144.0,1145.0,わかるだろ
1147.0,1150.0,佐藤武雄のゲッテンなんかゴツゴツしてんじゃん
1151.0,1152.0,あいつすげぇゴツゴツしてねぇ顔
1153.0,1155.0,歳とってから生えてきそう
1155.0,1156.0,うめぇだろフォローも
1156.0,1158.0,俺日常的に言ってるから、ちゃんと
1159.0,1160.0,なんかね、俺言われたんだよ
1160.0,1162.0,35歳のギャル鬼
1162.0,1163.0,ちゃんと
1164.0,1166.0,あのー、女の悪口は
1166.0,1168.0,本人に言ってあげなきゃいけねぇつって
1169.0,1172.0,女の悪口言う担当だったの、コンパとかで
1173.0,1176.0,え、でも言うほどお前ら可愛くねぇよなぁつって
1176.0,1177.0,その、なんていうの
1177.0,1178.0,あのー
1180.0,1181.0,自分が
1181.0,1183.0,ちょ、やっぱ若い頃ちょっとモテたのね、俺
1183.0,1185.0,で、その時
1185.0,1187.0,そのー、おっさんと女遊びしてたから
1187.0,1189.0,ちょっと自分をとして
1189.0,1192.0,あの、おっさんたちの評価上げなきゃいけないみたいな
1192.0,1193.0,役回りがあったわけよ
1193.0,1196.0,そりゃさ、30歳の男と20歳の男だったら
1196.0,1198.0,20歳の男の方がモテるん決まってんじゃん
1199.0,1200.0,それを教え込まれて
1202.0,1204.0,女の悪口言う担当だったわ
1204.0,1205.0,俺
1206.0,1210.0,可愛い女の悪口言う担当だった
1211.0,1213.0,今思い出したわ、今、急に
1217.0,1219.0,で、頭悪い演技っていうかストレートに言ってたわ
1222.0,1223.0,すげー、なんか
1223.0,1224.0,なんかさ、大学の
1224.0,1227.0,あれさ、女ってそういうさ、学歴とかのプライベート高いやついんじゃん
1227.0,1229.0,その、なんていうの、だから
1229.0,1231.0,え、どこなの?とか言って
1231.0,1232.0,私、城内だよ、とか言って
1232.0,1234.0,あー、なんだ、別にあれなんだね、みたいな
1234.0,1235.0,で、そういう
1235.0,1237.0,えぐい悪口言ってたわ
1237.0,1239.0,あ、別にそんなあれなんだね、って
1239.0,1240.0,あー、そうなんだ、って
1240.0,1241.0,へー、みたいな
1242.0,1244.0,バカでも入れんじゃん、ぐらいのは入れねえよ
1244.0,1245.0,入れねえけど
1245.0,1247.0,あー、そうなんだ、そうなんだ、って
1247.0,1249.0,嘘って言ってた、俺は
1251.0,1253.0,学歴根本ってやつ
1253.0,1255.0,別に学歴根本持ってる人なんか一人もいなかったよ
1255.0,1256.0,みんな頭良かったし
1256.0,1258.0,遊んでたおっさん達が
1260.0,1261.0,みんな、なんか
1261.0,1263.0,すごいいいとこの大学出てたからさ
