start,end,text
0.0,2.0,続きまして
3.0,5.0,た、たちびAまで行ったっけ?
7.0,9.0,たちび、たちびAまで行ったよね?たちびB
9.0,11.0,続きまして
13.0,15.0,酔っ払ってるあいつ多分今
16.0,19.0,絶対酔っちゃ馬鹿げてくれもう携帯電源切っとこ
19.0,21.0,酔き話がややこしくなる
25.0,27.0,立つ俺は
31.0,33.0,はい、どうぞ
34.0,36.0,メモ帳ペーストしておけ、お前な
37.0,39.0,メモ帳ペーストしたら消える
39.0,41.0,じゃあそのうううう
41.0,43.0,そういうなんかうまいことやってくれよ
43.0,45.0,なんかこのコメントのところにもう書いて
45.0,47.0,あと押すだけにしてくれ
47.0,49.0,それをコピーしときゃいいだろ
52.0,54.0,俺が一番込む掲示板を書き込んでる
54.0,56.0,俺が一番込む掲示板を書き込んでる
62.0,64.0,それがなんか正しいのかどうか
64.0,66.0,わからんけど
66.0,68.0,どうぞ
68.0,70.0,真っ赤だけど
77.0,79.0,今回の企画にお前はどこまで噛んでいるのか
79.0,81.0,写真企画をお前が率先したとはどうしても
81.0,83.0,いや、あれはね
83.0,85.0,あのーなんかこういうものを使って
85.0,87.0,なんかやりたいんですけど
87.0,89.0,っていうのは俺がちゃんと言ったよ
89.0,91.0,もちろん
91.0,93.0,詳細まで全部詰めたのは
93.0,95.0,全部自分の力でやってないけど
97.0,99.0,裏があるんだって
99.0,101.0,なんの裏があるんだよ
103.0,105.0,なんかそのー
107.0,109.0,こういうのやったら面白いんじゃないかなって
113.0,115.0,正気正気
115.0,117.0,いや俺はそうやって
117.0,119.0,本当に思ってやった
121.0,123.0,じゃあ次
123.0,125.0,続いて
127.0,129.0,作家さんもいっぱいいるよ
129.0,131.0,アドバイス聞いて
133.0,135.0,え?
137.0,139.0,止まっちゃった?
139.0,141.0,え?
141.0,143.0,続きあった?
143.0,145.0,今の人もう一回
157.0,159.0,あれどいつだっけ
161.0,163.0,あれどれだっけ
165.0,167.0,どれだっけ
169.0,171.0,真っ赤なやつだそうだ
173.0,175.0,たちみAじゃねえな
175.0,177.0,たちみBだっけ
177.0,179.0,こいつか?
181.0,183.0,こいつちょっとまた別口で取っておこう
183.0,185.0,たちみBかOK
191.0,193.0,Bの真っ赤なやつ
193.0,195.0,これか俺が一番
195.0,197.0,あ、これねはいはい
197.0,199.0,芸人にならないと言い切ってほしい
199.0,201.0,ジャル周辺に流される声を代理しています
201.0,203.0,僕は芸人には
203.0,205.0,絶対なりません
205.0,207.0,あのー
207.0,209.0,これまじでこれ
209.0,211.0,これはみんなが本当になんか勘違いしてるんだけど
211.0,213.0,あのー
213.0,215.0,俺がさ
215.0,217.0,芸人を目指してると思ってるの
217.0,219.0,今日さ
219.0,221.0,それ
221.0,223.0,俺が芸人になりたいと思ってるってこと?
227.0,229.0,そう見えるってこと?
229.0,231.0,それはもう絶対ないよ
231.0,233.0,だって例えば
235.0,237.0,こういうさ公式とか出てるとさ
237.0,239.0,絡みって不可欠じゃん
239.0,241.0,あの人たち面白いじゃん
241.0,243.0,だからキャスティングとかされるわけよ
243.0,245.0,そういうところで絡むのは俺すげー好きだよ
249.0,251.0,俺は好きなので
251.0,253.0,だけど俺自身がそこの土俵立ってやるっていうのは
253.0,255.0,絶対ないかな
257.0,259.0,本気でない
261.0,263.0,本心
263.0,265.0,違うならいい
265.0,267.0,もういいの
267.0,269.0,コミュ掲示板に
271.0,273.0,お前は人前でしゃべる才能ないし
273.0,275.0,訓練でどうにかなると思わない
275.0,277.0,理由、課金帳、表情禁止ある
277.0,279.0,菅仏
279.0,281.0,いやでもねやっぱりね
281.0,283.0,あのー公式放送とか
283.0,285.0,やっぱ俺もね出てさ
285.0,287.0,なんかバーって上げたいわけよ
289.0,291.0,本当にユーザーだけだとやっぱり
291.0,293.0,注目されないの
295.0,297.0,でなんか周りからさ
297.0,299.0,バカにされさ
299.0,301.0,そういうのはやっぱ本気で悔しいし
301.0,303.0,今に見てろと思ってるわけよ
303.0,305.0,でね
305.0,307.0,あのーイベントは何回やったんだ
307.0,309.0,3回か
309.0,311.0,3回やったんだっけ俺
311.0,313.0,3回やってる?
313.0,315.0,今回3回見たよね
315.0,317.0,いや
319.0,321.0,やっぱ悔しいんだよ本当に
321.0,323.0,あいつは絶対
323.0,325.0,公式とかにも呼ばれねーし
325.0,327.0,別に俺たちに
327.0,329.0,言われてるわけねすげー
329.0,331.0,それもうめちゃくちゃ
331.0,333.0,本当に悔しいの
333.0,335.0,本当に悔しいのねマジで
337.0,339.0,てめーこの野郎見てろよと思うわけよ
339.0,341.0,それは本当に確かな気持ちであるの
343.0,345.0,いや悔しくないんだよ
345.0,347.0,俺は悔しいのね
347.0,349.0,悔しいんだよ
349.0,351.0,明らかに今日
351.0,353.0,今日本で一番ごちゃごちゃしてる
353.0,355.0,日本一じゃんたぶん今ここが
355.0,357.0,俺はそうと思ってるから
357.0,359.0,このノリのままいきたいわけよ
359.0,361.0,わーっつって
361.0,363.0,あのー
363.0,365.0,アイドルが来ようが
365.0,367.0,大御所来ようが
367.0,369.0,叩くときは叩く
369.0,371.0,っていうこのノリでいきたいわけよ
371.0,373.0,いや無理じゃない
373.0,375.0,俺がもっともっと人増やしていけば
375.0,377.0,見ざるを得ないじゃん
381.0,383.0,いやー俺は無理じゃないと思うな
383.0,385.0,広げていけばね
385.0,387.0,ずーっとさなんかこの
387.0,389.0,下の方でさ
389.0,391.0,くすぶってるのって楽しい
391.0,393.0,胃の中のかわずって最強だから
393.0,395.0,それじゃやっぱ人って増えねーなと思って
397.0,399.0,だからYouTubeとかから
399.0,401.0,ニコ生にも引っ張っていきたいし
401.0,403.0,公式とか出てガンガン
403.0,405.0,物を言えるようになりたいしっていう気持ちは本気である
405.0,407.0,だから露出もしていくし
407.0,409.0,めんどくせーじゃんだってさ変なのにさ
409.0,411.0,チャンネルのお金もらって
411.0,413.0,公式出てる分にも
413.0,415.0,俺事務所と完全接班してるってことじゃん
415.0,417.0,要は戻り半分になってるわけよ
417.0,419.0,だけどジャルさん見つけて
419.0,421.0,お願いしますっつって頭下げて
421.0,423.0,分かったじゅんちゃん一緒にやっていこうってなって
423.0,425.0,それでなんかニコラジとかに呼んでもらえて
425.0,427.0,ちょっとずつちょっとずつ
427.0,429.0,一年前に比べたら
429.0,431.0,物が言えるようになってるんだよ
431.0,433.0,俺的には
435.0,437.0,間違いなく
439.0,441.0,これをどんどん
441.0,443.0,でかくしていったらなるんじゃないか
443.0,445.0,それでダメだったら諦めるわ
445.0,447.0,いやもう無理だわみんなもう多分
447.0,449.0,本当に無理だわって
449.0,451.0,人も増えねーし
451.0,453.0,もう完全に無理だわってなったら
453.0,455.0,確実に諦める
455.0,457.0,パッと諦めてニコ生やめて
457.0,459.0,ユーストリームが死んじゃうと本当にやる
459.0,461.0,それはもうマジで俺もう明言してるじゃん
461.0,463.0,結婚して適当な女見つけて結婚して
463.0,465.0,いや俺昔マジ凄かったんだってなるわ
467.0,469.0,でなんかまぁ40とかになって
469.0,471.0,なんか適当に娘がたまにキャーみたいな
471.0,473.0,それは
473.0,475.0,やる確実に
477.0,479.0,それも約束します
479.0,481.0,よろしいでしょうか
485.0,487.0,もうよろしいですか
487.0,489.0,もう
489.0,491.0,はい
491.0,493.0,じゃあ続きまして
493.0,495.0,たちみc
495.0,497.0,あれb
497.0,499.0,あれbまだ終わってないっけ
503.0,505.0,たちみbまだ終わってないっけ
505.0,507.0,あbじゃあたちみbはい
507.0,509.0,テキストの民に一言言わせるよ
509.0,511.0,お前かテキストの民
513.0,515.0,連当してるやつはちょっとあんまり
515.0,517.0,俺信用できねえんだけど
519.0,521.0,どうぞ
523.0,525.0,こいつじゃないの
529.0,531.0,この人消していいの
531.0,533.0,テキストの民って誰
533.0,535.0,そんな民ができてんの
535.0,537.0,あこいつか
539.0,541.0,えドイツ
541.0,543.0,テキストの民って誰
545.0,547.0,あこいつか分かった分かった
549.0,551.0,テキストの民はこいつね
553.0,555.0,これこの人ってことね
557.0,559.0,この人ってことね
565.0,567.0,ふとんちゃんあいつは今冗談通じないぐらい
567.0,569.0,言えない状況
569.0,571.0,おめえだよ
571.0,573.0,おめえのことかばってんだよバカが
575.0,577.0,おめえのことかばってんだよバカたれが
579.0,581.0,それすらお前も
581.0,583.0,まあいいや続いて
595.0,597.0,はい続きまして
599.0,601.0,えこの人は
607.0,609.0,いや俺今日視聴者を全く意識してなかった
611.0,613.0,いや全く生放送のことなんて全く考えてなかったよ
615.0,617.0,全く考えてなかったよ全く
621.0,623.0,生放送のことは全く考えてなかったよ
625.0,627.0,イベントやると
627.0,629.0,お前は客しか見れない実力
629.0,631.0,いや元々見る気なかったよ全く
631.0,633.0,じゃあ放送すな
633.0,635.0,いやでもそういうところ
635.0,637.0,そういうところでも
637.0,639.0,ちゃんと全部放送したほうが
639.0,641.0,なんかいいかなと思って
643.0,645.0,俺は生放送のことなんか全く考えてなかったよ
645.0,647.0,だから放送止まったのも気づいてなかった本気で
647.0,649.0,自分は客に対して頑張っていたと思うし
649.0,651.0,いやそういうんじゃないんだよ別にその
655.0,657.0,でもそれ本当だよ
657.0,659.0,生放送のことは全く考えてなかった
659.0,661.0,あのたまには
661.0,663.0,どうかなって思ってたけど
663.0,665.0,そっちには全然
665.0,667.0,それと今後もこういうイベントやるのか
667.0,669.0,やるとしたらニコ生コメント
669.0,671.0,やるとしたらニコ生コメント
671.0,673.0,やるとしたらニコ生コメント
673.0,675.0,やるとしたらニコ生コメント
675.0,677.0,やるとしたらニコ生コメント
679.0,681.0,俺一人で完全にやって
683.0,685.0,やるとしたらね
685.0,687.0,ニコ生のコメント入れて
687.0,689.0,ニコ生コメントしたいでやります
689.0,691.0,みたいな感じだったら全然広いでしょ
695.0,697.0,それはそうだよ
699.0,701.0,生放送のコメント
701.0,703.0,ありきでみんなでやります
703.0,705.0,ハウザーでやりたいかなどっちかっていうと
707.0,709.0,意味わかんないよね
713.0,715.0,でも全く生放送のことは意識してなかった
715.0,717.0,全く
725.0,727.0,次でよろしいですか
729.0,731.0,ただそういうところですら
731.0,733.0,生放送に乗っけたいなとは思ったね
733.0,735.0,だから毎回生放送乗っけてるし
741.0,743.0,ゼロじゃないよ
743.0,745.0,ゼロじゃないけどそこまで全然意識はしてなかった
749.0,751.0,動画でいいんだったら動画の方が俺的にもすげえありがたいんだけど
751.0,753.0,生放送で
753.0,755.0,見たいかなと思って
755.0,757.0,それはちょっとみんなのことを配慮してみたんだけど
757.0,759.0,動画だったらもちろん
759.0,761.0,生放送で動画であげれるよ
765.0,767.0,それだったら翌日に
767.0,769.0,動画であげれるよ完全
771.0,773.0,生放送で
773.0,775.0,見たいよっていう人が
775.0,777.0,1回目の配信が
777.0,779.0,1回目のイベントの時に
779.0,781.0,動画で全部あげますよって言ったけど
781.0,783.0,生放送でやれよみたいな声を
783.0,785.0,いただいたから
785.0,787.0,それだったら俺別にどっちでもよかったから
787.0,789.0,言ったよって
793.0,795.0,完全にそういう本当に
795.0,797.0,いらない配慮だったまさか
801.0,803.0,これは本心
803.0,805.0,いやそれ
805.0,807.0,例えばさ全部
807.0,809.0,例えばそこで変な事故とか起きちゃってさ
809.0,811.0,顔とかバーンって映っちゃったらまずいから
811.0,813.0,その辺はカットするよもちろん
813.0,815.0,そういうのはカットするけど
815.0,817.0,全然ノーカットだよもちろん
821.0,823.0,しかも生放送で止まったりしたらさ
823.0,825.0,トラブルに対応できないじゃん
825.0,827.0,トラブルが起きた時にさ
827.0,829.0,いやちょっと今生放送止まってるから
829.0,831.0,イベント待ってくださいとは言えないからさ
837.0,839.0,全然
839.0,841.0,動画でもうフルで
841.0,843.0,なんかさどこだっけ
843.0,845.0,お家かなんかでやったイベントってさ
845.0,847.0,完全ノーカット版を
847.0,849.0,動画かなんかで上げたっけ
855.0,857.0,そういう形でやったよね
857.0,859.0,そういうのでも全然俺は
859.0,861.0,全く問題ない
861.0,863.0,こういう形ならニコ生
863.0,865.0,いらないんじゃないか
865.0,867.0,万が一やるってなったら
867.0,869.0,全所するわ
869.0,871.0,続きまして
871.0,873.0,ちょっと出るか
877.0,879.0,なんか言いたいことが
879.0,881.0,友人視点からでもちょっと
883.0,885.0,なんで
885.0,887.0,なんでこんな所に組みつくのよく
891.0,893.0,もしもーし
893.0,895.0,もし?
895.0,897.0,まーちゃん酔っ払ってる
897.0,899.0,酔っ払ってないよ
899.0,901.0,酔っ払ってんじゃねーかよ
903.0,905.0,お前から掛けていたから出たんだよ
907.0,909.0,さっきさ
909.0,911.0,あれしてたさ
915.0,917.0,電話してしまったんだけどさ
917.0,919.0,いいよ
919.0,921.0,言っていいよ
921.0,923.0,じゃあさ
923.0,925.0,さっき
925.0,927.0,ちらーっと放送してたんだ
927.0,929.0,うん
929.0,931.0,今日なんかあれだったんだって
933.0,935.0,よく寝たんだって
935.0,937.0,そうだな
937.0,939.0,それでさ
939.0,941.0,俺言ったんだよ
941.0,943.0,聞いてる奴らもさ
943.0,945.0,おめーの放送
945.0,947.0,来た奴もさ金払って来た奴だけじゃん
947.0,949.0,放送ってかイベントね
949.0,951.0,イベントね
951.0,953.0,反応してる奴らも
953.0,955.0,大半は行ってない奴らでさ
955.0,957.0,あいつがさ
957.0,959.0,やるって
959.0,961.0,こういういくらで
961.0,963.0,くっちゃめやるって
963.0,965.0,行く奴がいる以上さ
965.0,967.0,それがブランドなんだから
967.0,969.0,聞いてねー奴らがさ
969.0,971.0,とにかくさ
971.0,973.0,反応するおめーら
973.0,975.0,金払ってねー以上さ別に
975.0,977.0,言う限りないじゃんってさ
977.0,979.0,っていう話をしたらさ
979.0,981.0,なんかね
981.0,983.0,よく分かんないけど
983.0,985.0,向こうが
985.0,987.0,向こうがなんだ
987.0,989.0,あーなるほどなーみたいなことがあってさ
989.0,991.0,それで
991.0,993.0,そういうのがとりあえず
993.0,995.0,やべーぞあいつやべーぞ
995.0,997.0,おせっかいで電話しちゃった
997.0,999.0,俺ね
999.0,1001.0,まっちゃんがそうだろうなと思って
1001.0,1003.0,さっき切っちゃったね
1003.0,1005.0,おめーがまた
1005.0,1007.0,おめーに飛び火するかなと思って
1007.0,1009.0,でもいいよ殺すぜよ
1009.0,1011.0,酔っちゃうので殺すに行くべ
1011.0,1013.0,酔っちゃうからさ
1013.0,1015.0,あーもういいもうめんどくさいからもう切る
1015.0,1017.0,聞いてくれ
1017.0,1019.0,分かった分かった聞くわ
1019.0,1021.0,せめえさあのさ
1021.0,1023.0,俺ねこれやったんだけどね
1023.0,1025.0,放送して何年経つ?
1025.0,1027.0,放送して何年経つ?
1029.0,1031.0,8年ぐらいか
1031.0,1033.0,8年目だな
1033.0,1035.0,8年ぐらいでしょ
1035.0,1037.0,もうすぐ江戸川一周するぐらい
1037.0,1039.0,だって今日もね
1039.0,1041.0,今日も中学校3年生から見てて
1041.0,1043.0,今年から働き始めますってやつが来てて
1045.0,1047.0,歴史を感じて
1047.0,1049.0,7年半だよ
1049.0,1051.0,そのぐらいさ
1051.0,1053.0,アイデンティティーが確立されてから
1053.0,1055.0,青年期になるまで至るやつらをさ
1055.0,1057.0,笑わしてきたとかさ
1057.0,1059.0,本当に笑わしてきたと思うんだよ
1059.0,1061.0,何よりも
1061.0,1063.0,そんなさ
1063.0,1065.0,今までお世話になったのに
1065.0,1067.0,一回のくっちゃべってのがさ
1067.0,1069.0,放送見てたやつからしたらさ
1069.0,1071.0,いいにそどらなかったかもしんないから
1071.0,1073.0,まっちゃん3回や
1073.0,1075.0,3回
1075.0,1077.0,ああ3回じゃダメ
1077.0,1079.0,笑
1079.0,1081.0,おいちゃんとあれしよう
1081.0,1083.0,終わった後にまたかけるからよ
1083.0,1085.0,あ分かった
1085.0,1087.0,放送中だからあれしようぜ
1087.0,1089.0,カメラつけて飲むべえよ2人で
1089.0,1091.0,もう言っといてくれ
1091.0,1093.0,おめでとしに顔出し配信
1093.0,1095.0,それはもうやめとけ
1095.0,1097.0,あのほらニコニココメントピュアのさ
1097.0,1099.0,あのやつね
1099.0,1101.0,住所調べたんだよね
1101.0,1103.0,まあよくわからない
1103.0,1105.0,それでも終わったらかけるからいいよ
1105.0,1107.0,おめえがやってくるのめんどくせえんだよ
1107.0,1109.0,本当に
1109.0,1111.0,じゃあ終わったらかけるわ
1111.0,1113.0,プリシンボンね
1113.0,1115.0,あれして?なんだっけ
1115.0,1117.0,お酒用意しといてくれ
1117.0,1119.0,お前明日休みだろ
1119.0,1121.0,休みじゃねえか仕事だけど
1121.0,1123.0,じゃあいいや誰か見つけるわ
1123.0,1125.0,誰でもいいじゃん別に
1125.0,1127.0,やろうよ
1127.0,1129.0,分かった
1133.0,1135.0,次
1141.0,1143.0,テキストのために言わせろ
1143.0,1145.0,テキストのために言わせろ
1145.0,1147.0,テキストゴミだったな
1147.0,1149.0,てめえの紹介だろうが
1149.0,1151.0,次
1153.0,1155.0,もう時間ないからあれだな
1155.0,1157.0,一周だけねもう
1159.0,1161.0,あとかぶってるやつ終わりね
1161.0,1163.0,かぶってるやつ終わり
1163.0,1165.0,おい11メモしてるから出てくれ
1165.0,1167.0,いいよはい
1171.0,1173.0,一周な
1177.0,1179.0,もうB終わるから
1179.0,1181.0,B3周くらいしただろ
1181.0,1183.0,B終わるからB3周くらいしただろ
1183.0,1185.0,次次
1189.0,1191.0,なんだこの時折入る
1191.0,1193.0,ぬし込めは
1193.0,1195.0,まさか見えてなかったか俺今まで
1199.0,1201.0,飛ばされちゃったの
1207.0,1209.0,なにこれ
1211.0,1213.0,なにこれ
1215.0,1217.0,次だ
1221.0,1223.0,次
1225.0,1227.0,たちみAじゃないAはもういい
1229.0,1231.0,あーたちみCこいつだ
1231.0,1233.0,はい
1237.0,1239.0,同じ意見なしねもう
1239.0,1241.0,同じ意見なし
1245.0,1247.0,なんか普通にコメントで書いてるやつ
1247.0,1249.0,俺はMCを取り入れるところは良かったと思うが
1249.0,1251.0,一緒に写真見せ合ってた芸人は
1251.0,1253.0,いらなかったMCの12人
1253.0,1255.0,まあごちゃごちゃしてるのはいらねえだろ
1255.0,1257.0,ってことか
1259.0,1261.0,メモあるあなた
1263.0,1265.0,参考にさせていただきます
1265.0,1267.0,次
1269.0,1271.0,もうだいたい意見で揃ってたらもう
1273.0,1275.0,終わり
1277.0,1279.0,まだ何か言い足りないことがある人
1279.0,1281.0,あなただよたちみCのあなただよ
1281.0,1283.0,たちみCのあなた
1287.0,1289.0,この枠の
1289.0,1291.0,タイトルほんとに取れない
1291.0,1293.0,ほんと取り直したいわー
1295.0,1297.0,反映されないどういうこと
1299.0,1301.0,投げんじゃねえの文が
1307.0,1309.0,投げんじゃねえの文が
1313.0,1315.0,長い
1315.0,1317.0,もうなんか
1317.0,1319.0,次じゃあ
1321.0,1323.0,たちみBはもういいんだよな
1323.0,1325.0,Cだよな
1325.0,1327.0,あー
1327.0,1329.0,おいさっき
1329.0,1331.0,当てられてからコメ打ってたぞ
1333.0,1335.0,なんだこの別口の裏口入学は
1335.0,1337.0,裏口入学は許さない
1337.0,1339.0,一言で決めてやる
1339.0,1341.0,期待に
1343.0,1345.0,添えないけど
1345.0,1347.0,あれ一言で
1347.0,1349.0,あれ
1351.0,1353.0,一言でとどめをさせてやるよ
1355.0,1357.0,はいどうぞ
1361.0,1363.0,お前なんか
1363.0,1365.0,10の外れ枠に1の当たり枠なんだから
1365.0,1367.0,イベント向きじゃねえんだ
1367.0,1369.0,歌い手みたいに歌を披露できるわけでもなく
1369.0,1371.0,芸人みたいにネタがあるわけでもなく
1371.0,1373.0,踊ってみたみたいに
1373.0,1375.0,ダンスが踊れるわけでもなく
1375.0,1377.0,ってこと
1377.0,1379.0,俺自分で言ってるもんね
1379.0,1381.0,10の外れ枠に1の当たり枠
1381.0,1383.0,これ黄金比率
1383.0,1385.0,これ俺は自信があって
1385.0,1387.0,他の生主ってそこまで出せないから
1387.0,1389.0,俺が価値があるんだよって言ってるのを
1389.0,1391.0,だからそこの
1391.0,1393.0,万が一一発当たったとしても
1393.0,1395.0,残り9回は外れなんだよってことでしょ
1397.0,1399.0,いいこと言うね
1401.0,1403.0,言い訳すんな
1403.0,1405.0,言い訳じゃねえだろ
1405.0,1407.0,ていうことって聞いただけなんだけど
1409.0,1411.0,受け止めるわとか言いながら
1411.0,1413.0,何が染みたんだ
1413.0,1415.0,思い返せるのかよ
1415.0,1417.0,今日の枠で言われたことは
1417.0,1419.0,しっかり噛み砕いて咀嚼して
1435.0,1437.0,やりますよ
1437.0,1439.0,まずは
1439.0,1441.0,俺
1443.0,1445.0,俺ニコ生で一番聞いた
1445.0,1447.0,なんで俺がこんな
1447.0,1449.0,親父に怒られてる時みたいに
1449.0,1451.0,やんなきゃいけないんだ
1451.0,1453.0,殺すぞ
1453.0,1455.0,なんで
1455.0,1457.0,どこが分かってんだ
1457.0,1459.0,お前親父かよ
1459.0,1461.0,分かったんか
1461.0,1463.0,って言われたら
1463.0,1465.0,何が分かったか言ってみろってことだろ
1465.0,1467.0,言ってやるよ
1467.0,1469.0,一人でやれよと
1469.0,1471.0,あと
1471.0,1473.0,ユーザー放送より面白くないイベント
1473.0,1475.0,やんじゃねえよってことと
1475.0,1477.0,お前中学に外れ学1個なんだから
1477.0,1479.0,イベント向きじゃねえんだよ
1479.0,1481.0,そもそも
1481.0,1483.0,おいおい
1483.0,1485.0,ジャルみたいな小物の
1485.0,1487.0,博多浜田丸だ
1487.0,1489.0,陣内智則だの
1489.0,1491.0,ガチャガチャ金魚の云に
1491.0,1493.0,お前
1493.0,1495.0,腰一本打って
1495.0,1497.0,お前しっかりしろこの野郎ってことだろ
1497.0,1499.0,まとえてるだろ
1501.0,1503.0,どうよ
1503.0,1505.0,消えてないってことでしょ
1507.0,1509.0,よし
1513.0,1515.0,あのねえ
1515.0,1517.0,正直に言ってんだけど
1517.0,1519.0,頭では分かってんだけど
1519.0,1521.0,体で行動できないってことあるじゃん
1521.0,1523.0,俺だってねやりたいんだけどできない
1523.0,1525.0,本当なんだよこれは
1525.0,1527.0,本当にそうだろ
1527.0,1529.0,てめえこの野郎
1529.0,1531.0,山田ひたちの頭
1531.0,1533.0,掴んでてめえこの野郎
1533.0,1535.0,おめえ俺頭下げろ
1535.0,1537.0,お前俺の来場チャンス
1537.0,1539.0,見てみろこの野郎って
1539.0,1541.0,言えたらいいけどできないんじゃん
1541.0,1543.0,できるやつ
1543.0,1545.0,おいちょっと待って
1545.0,1547.0,見本がいねえんだよ見本が
1547.0,1549.0,俺がやっていかなきゃいけねえとかさ
1549.0,1551.0,見本があったらできるわけよ
1551.0,1553.0,見本があったら
1555.0,1557.0,ちょっとずつ切り開いていくしかないじゃん
1559.0,1561.0,見本があったら
1563.0,1565.0,パイオニアにならなきゃいけない
1565.0,1567.0,そんなことそういうパフォーマンスしてるやついっぱいいるんだけど
1569.0,1571.0,ピクピクンにならなきゃいけないことになるの
1571.0,1573.0,下ネタ言わないで
1573.0,1575.0,痛いこと下ネタ言わないで
1575.0,1577.0,言わないピクピクンなの
1577.0,1579.0,本当に
1579.0,1581.0,なんでそうじゃんふざけてるわけじゃなくて
1583.0,1585.0,何言われても別に関係ねえ
1585.0,1587.0,俺は
1587.0,1589.0,俺の道を行くみたいな
1591.0,1593.0,あれって
1593.0,1595.0,実際やって寒いノリになったとしても
1595.0,1597.0,まだみんな納得いくってことでしょ
1597.0,1599.0,いや確かに滑った
1599.0,1601.0,もう二度と呼ばれない
1601.0,1603.0,ただお前のことよくやったって
1603.0,1605.0,お前のこと言ってくれんだなじゃん
