start,end,text
0.0,9.72,【早送り中】
9.72,11.72,この尋常じゃない時間に
11.72,16.16,【早送り中】
16.16,18.16,最近さぁ
18.16,20.16,ほんとおじいちゃんみたいな
20.16,22.16,暮らしをしてて
22.16,24.16,今起きました
24.16,27.560000000000002,【早送り中】
27.560000000000002,29.560000000000002,おじいちゃんになっちゃいました
29.560000000000002,31.560000000000002,完全に
31.560000000000002,33.56,11時に寝て4時に起きるっていう
33.56,35.56,とんでもない
35.56,37.56,生活スタイルで
37.56,39.56,寝起きの声ではない
39.56,41.56,マジで寝起きだよ
41.56,43.56,なんか
43.56,45.56,7年くらい前にさぁ
45.56,47.56,ゼルダの伝説をさぁ寝起きでやった時の
47.56,49.56,なんかことを思い出してなんか久々に
49.56,51.56,朝にこのままやるかって
51.56,53.56,俺の中で4時はもう朝にカテゴライズされてるから
53.56,57.56,【早送り中】
57.56,59.56,お肌のゴールデンタイムは
61.56,63.56,しっかり寝て過ごしました
65.56,67.56,人間のこの体内時計っていうのは
67.56,69.56,【咳払い】
69.56,71.56,恐ろしいもんだね
71.56,73.56,しかもね俺今大変なことに気づいたわ
73.56,75.56,スケジュール見てさぁ
75.56,77.56,あ今日まぁ
77.56,79.56,金曜日の夜だからまぁみんな起きてんだろうと思ったら
79.56,81.56,よくよく考えたら金曜日の朝だわ
81.56,83.56,今激しく後悔が
83.56,85.56,今激しく後悔が訪れております
85.56,87.56,今俺の中に
89.56,91.56,よくよく考えたらまだ金曜日の朝最低の
91.56,93.56,ただでさえ金曜日
93.56,95.56,なんかみんな忙しくて
95.56,97.56,どうせ見ねえだろうと思って
97.56,99.56,金曜日はやる気が起きなかったのに
99.56,101.56,とんでもない時間にやっちゃいました
103.56,105.56,俺あと15分で出社だよ
105.56,107.56,お前からしていれば
107.56,109.56,良いタイミングで俺が
109.56,111.56,始めたというわけだな
111.56,113.56,YouTubeなんかしなくていいだろ
117.56,119.56,本物の店員しか集まってない
119.56,121.56,まぁいいじゃん
121.56,123.56,なんか
123.56,125.56,最近さぁ
125.56,127.56,俺を通じて就職をするやつが
127.56,129.56,すげぇ増えてきて
129.56,131.56,あのー俺が出てるさ
131.56,133.56,あのAVの番組見て
133.56,135.56,その会社で働きたい
135.56,137.56,っつって働いてるやつもいて
137.56,139.56,なんかとんでもないところから
141.56,143.56,就職を決めたやつがいて
143.56,145.56,なんかその
145.56,147.56,テレビ関連の仕事に就きたい
147.56,149.56,とか言ってて
149.56,151.56,俺別にコネクションもなんもないじゃん
151.56,153.56,俺のマネージャーと仲良くなって
153.56,155.56,そこに製作会社の社長
155.56,157.56,紹介してもらって
157.56,159.56,就職決めたやつがいたわ
159.56,161.56,とんでもねえ
161.56,163.56,とんでもねえところのコネ使ってくんだと思って
163.56,165.56,リクルート11で
165.56,167.56,今お届けしております
167.56,169.56,よく知ってる
169.56,171.56,報告受けたらなんか
171.56,173.56,じゅんちゃんの視聴者が
173.56,175.56,なんか
175.56,177.56,俺が知らないとこでなんか連絡取って
177.56,179.56,何してたんですかって聞いたら
179.56,181.56,じゅんちゃんの視聴者の面接行ってきたよ
181.56,183.56,なんの面接ですかって
183.56,185.56,そういうところで働きたいからって
185.56,187.56,最近なんか
187.56,189.56,いい感じにみんなを世に出してます
193.56,195.56,採用する方も採用する
195.56,197.56,かとうじゅうじです
199.56,201.56,俺応援していこうと思う
201.56,203.56,そいつを
203.56,205.56,社長さんが
205.56,207.56,こういう業界で働きたいってことは
207.56,209.56,好きな芸能人とかいるの?
209.56,211.56,かとうじゅうじです
211.56,213.56,俺もその子知ってんだけど
213.56,215.56,口ごもっててなんかなよなよしてるのに
215.56,217.56,そこだけはなんかものすごいハキハキ
217.56,219.56,答えてほしいかとうじゅうじです
221.56,223.56,でっかくなってほしいわ
225.56,227.56,でっかくなってほしい
227.56,229.56,俺は
231.56,233.56,期待しとくわ
233.56,235.56,多分20年かかるから
235.56,237.56,俺じゃあ50くらいまでになんとか
237.56,239.56,仕上げとくわ体を
239.56,241.56,仕上げときます
241.56,243.56,新社会人にアドバイスくれ
243.56,245.56,あーもうそういう時期なんだ
245.56,247.56,すげー憂鬱でしょ
247.56,249.56,今一番憂鬱な時期だったでしょ
249.56,251.56,全然俺の知り合いじゃないよ
251.56,253.56,全く知り合いじゃないけど
253.56,255.56,ニコラジとか見に来てくれて
255.56,257.56,毎回見に来てくれるなと思ってたんだよ
257.56,259.56,高青年がいるなと思って
259.56,261.56,なぜか俺に
261.56,263.56,なんで俺に話しかけてこないんだろう
263.56,265.56,と思ったら
265.56,267.56,そういうことだったんだなって
271.56,273.56,前月仕事辞めたらまあ
273.56,275.56,終わりだよもうお前は
275.56,277.56,復帰できねーからしんしろ
277.56,279.56,そんな甘くねーから多分
279.56,281.56,いやなんか本当に
281.56,283.56,おじいちゃんになっちゃってさ
283.56,285.56,あの夜起きてるとさ
285.56,287.56,何もすることがないじゃん
287.56,289.56,それと一緒で朝起きて
289.56,291.56,こっからさ8時くらいまで
291.56,293.56,何もすることがねーんだよ
293.56,295.56,何もすることに
295.56,297.56,動画も大した面白くないし
297.56,299.56,何か何しようかなと思った時
299.56,301.56,ニコ生すっかーと思って
301.56,303.56,久々に
303.56,305.56,お前ら
305.56,307.56,お前ら
307.56,309.56,お前ら
309.56,311.56,韓国放送待ってんだろ待ってねーよ
311.56,313.56,なんで俺そんな
313.56,315.56,みどりさん中心の生活しなきゃいけないんだ
315.56,317.56,え何か
317.56,319.56,今日放送してなくていまだに待ってるってこと
321.56,323.56,バカなんじゃねえの寝ろよもういい加減
325.56,327.56,あみどりさんの視聴者待ってるんだいまだに
327.56,329.56,ほーん
333.56,335.56,なるほどないい視聴者を
335.56,337.56,でもあの人本当にさ
337.56,339.56,深夜やってもそんな視聴者数落ちないからな
339.56,341.56,どんな視聴者層なんだろうな
341.56,343.56,前みたいに新社会人に向けたら
343.56,345.56,こうされてくれじゃわかった
345.56,347.56,今日は今俺気分がいいから
347.56,349.56,寝起きで肌も綺麗で
349.56,351.56,でお前ら唯一
353.56,355.56,一人だけコメント拾うわ
355.56,357.56,お前のなんか一番の悩みを
357.56,359.56,俺が的確に
359.56,361.56,的確に解いていくわ
361.56,363.56,なんでもいいよ
363.56,365.56,どんな
365.56,367.56,社会では聞けない
367.56,369.56,学校では聞けない
369.56,371.56,新社会人講座俺が今からやってやる
371.56,373.56,お前だけ特別に
373.56,375.56,えぐいの頼むわ
375.56,377.56,こんなに早く起きるとかやばいぞ
377.56,379.56,なんかもうね体内時計がぐちゃぐちゃなんだよ
381.56,383.56,新社会人に俺にアドバイスくれ
383.56,385.56,新社会人にアドバイスくれ
385.56,387.56,開始3分で
387.56,389.56,開始1分でこんなに
389.56,391.56,強い気持ちがあるんだろう
391.56,393.56,俺が聞いてやろう
395.56,397.56,まずは
397.56,399.56,一個だけお前にアドバイスするわ
399.56,401.56,まずは
401.56,403.56,じゃブラックとかそういうんじゃない
403.56,405.56,まずはプレミアム会議になるっていう
405.56,407.56,そこから始めよう
407.56,409.56,初めての給料何に使う
409.56,411.56,親孝行
411.56,413.56,自分へのご褒美
413.56,415.56,いや違う
415.56,417.56,そこからだよまず俺に
417.56,419.56,目を垂れるところから始めよう
419.56,421.56,まずその覚悟がない
421.56,423.56,月500円俺という
423.56,425.56,娯楽に払う覚悟がない
425.56,427.56,そんなんじゃやっていけねえよ社会じゃ
427.56,429.56,なかなか素直じゃねえか
429.56,431.56,そういう素直な謙虚さみたいなのが
431.56,433.56,社会において必要だぞ
433.56,435.56,こいつはあれしよう
435.56,437.56,なかなか見込みがあるからこいつはミラー主にしよう
437.56,439.56,お前は社会じゃなくていいややめろ仕事なんで
439.56,441.56,お前三国連太郎の
441.56,443.56,次の三国がどうやら来年から
443.56,445.56,高校生らしいから
447.56,449.56,お前次のミラー主な
449.56,451.56,よろしく
451.56,453.56,あと俺に敬語使え
453.56,455.56,今アドバイスもらったから
455.56,457.56,その借りができたということで
457.56,459.56,分かったじゃなくてはいな
459.56,461.56,俺こう見えても32になるから
461.56,463.56,社会で言ったら年齢とか大事だろ
463.56,465.56,年齢っていうのは
465.56,467.56,コミュニケーション取る上で一番大事なんだよ
467.56,469.56,まず俺への敬語から始めてくれ
469.56,471.56,よろしく
471.56,473.56,かしこまりましたって言ってくれ
473.56,475.56,かしこまりましたって言ってくれ
477.56,479.56,かしこまりましたって
479.56,481.56,よろしく
481.56,483.56,タイピングが著しく遅いから
483.56,485.56,お前の無能さが伺えるわ
485.56,487.56,おめーのなんか今
487.56,489.56,ここ1
489.56,491.56,向こう1年の未来を想像してるわ
491.56,493.56,仕事もできずに
493.56,495.56,ただインターネットでプレミアムアカウント
495.56,497.56,でもなる
497.56,499.56,お前普段放送とか荒らしてんだろ
499.56,501.56,お前普段放送とか荒らしてんだろ
501.56,503.56,プレアカになるわけでもなく
503.56,505.56,貢献するわけでもなく
505.56,507.56,代替案があるわけでもないのにも関わらず
507.56,509.56,無意味にニコニコ動画を叩き
509.56,511.56,なんかその俺の視聴者である
511.56,513.56,というだけで力を持った気になり
513.56,515.56,いろいろ
515.56,517.56,なんかそうやって悪を尽くしてるんだろ
517.56,519.56,そうやって通用してねぇからな
519.56,521.56,社会で言ったらお前に全部返ってくるからな
521.56,523.56,お前のその性格が
523.56,525.56,だからあれなんだいい大学にも入れずに
525.56,527.56,大した企業にも勤められずに
527.56,529.56,それでいて覚悟がない
529.5600000000001,531.5600000000001,覚悟がないからお前は
531.5600000000001,533.5600000000001,自分の人生は自分でしか血を拭けるんだ
533.5600000000001,535.5600000000001,覚悟を決めてくれ
539.5600000000001,541.5600000000001,覚悟
543.5600000000001,545.5600000000001,それくらいの覚悟がないと
545.5600000000001,547.5600000000001,社会に渡っていけない
553.5600000000001,555.5600000000001,分かったか
555.5600000000001,557.5600000000001,お前の無効一年の
557.5600000000001,559.5600000000001,意識ということだ
559.5600000000001,561.5600000000001,ありがたく思えよ
561.5600000000001,563.5600000000001,優しい言葉をかけてくれるんだよ
563.5600000000001,565.5600000000001,この時期の
565.5600000000001,567.5600000000001,この時期の大学生に向けて
567.5600000000001,569.5600000000001,なんだかんだで社会はいいところだよな
569.5600000000001,571.5600000000001,そういうんじゃねぇからな
571.5600000000001,573.5600000000001,戦争だからホントに
573.5600000000001,575.5600000000001,高校受験
575.5600000000001,577.5600000000001,大学受験
577.5600000000001,579.5600000000001,よりも厳しいさらなる戦争が
579.5600000000001,581.5600000000001,競争が待ってるからね
581.5600000000001,583.5600000000001,出世戦争という
583.5600000000001,585.5600000000001,追い出されてたなんて知らんわ
585.5600000000001,587.5600000000001,そういうとこだよお前の
587.5600000000001,589.5600000000001,お前の無能加減が今
589.5600000000001,591.5600000000001,まずは俺の言葉に耳を傾ける
591.5600000000001,593.5600000000001,という意味でも月500円払って
593.5600000000001,595.5600000000001,プレイヤーになってせめてその場にいる
595.5600000000001,597.5600000000001,ということだけは心がいてくれ
597.5600000000001,599.5600000000001,その場にいるただ
599.5600000000001,601.5600000000001,ただ佇む
601.5600000000001,603.5600000000001,なんで朝から現実をつけてくんだよ
603.5600000000001,605.5600000000001,なんか寝起き
605.5600000000001,607.5600000000001,寝起きめちゃめちゃいいってもうあれじゃん
607.5600000000001,609.5600000000001,有名じゃん
609.5600000000001,611.5600000000001,4時20分くらいに起きて
611.5600000000001,613.5600000000001,なんか今日元気だなと思って
613.5600000000001,615.5600000000001,なんかトリコ取ろうかなと思ったんだけど
615.5600000000001,617.5600000000001,バカらしくてなんで朝の
617.5600000000001,619.5600000000001,4時20分から俺トリコ取らなきゃいけないんだよ
619.5600000000001,621.5600000000001,と思ってやめた
621.5600000000001,623.5600000000001,スーッと
623.5600000000001,625.5600000000001,血の気が引いていくの分かったよ
625.5600000000001,627.5600000000001,スーッと
627.5600000000001,629.5600000000001,俺まで寝てないぞいいじゃん
629.5600000000001,631.5600000000001,なんか
631.5600000000001,633.5600000000001,この時間に見てる人達ってさ何歳ぐらい
633.5600000000001,635.5600000000001,なの歳は
637.5600000000001,639.5600000000001,うぬら
639.5600000000001,641.5600000000001,うーん
641.5600000000001,643.5600000000001,やっぱ
643.5600000000001,645.5600000000001,若干年齢層が下がるのかね
645.5600000000001,647.5600000000001,そんなことねぇな
647.5600000000001,649.5600000000001,俺の人生歳とったな
649.5600000000001,651.5600000000001,平均年齢やっぱ
651.5600000000001,653.5600000000001,25、6なのかね
653.5600000000001,655.5600000000001,歳とったよね明らかにね
657.5600000000001,659.5600000000001,10代マジで少なくなったよな
659.5600000000001,661.5600000000001,なんか10代どっかで補充してぇな
665.5600000000001,667.5600000000001,いや普通さ
667.5600000000001,669.5600000000001,これぐらいだったらさ
669.5600000000001,671.5600000000001,大学生が春休みか
677.5600000000001,679.5600000000001,たださ俺32じゃん
679.5600000000001,681.5600000000001,17、18の男とさ
681.5600000000001,683.5600000000001,会話がね成り立たないんだよ
683.5600000000001,685.5600000000001,絶対
685.5600000000001,687.5600000000001,30歳の気持ちってさ
687.5600000000001,689.5600000000001,10代には絶対分かんないじゃん
689.5600000000001,691.5600000000001,働いてて思ったけど
691.5600000000001,693.5600000000001,あのー
693.5600000000001,695.5600000000001,22、23の時ってさ
695.5600000000001,697.5600000000001,そんなに頑張ってるのになんで
697.5600000000001,699.5600000000001,世の中認めてくれねえんだみたいなのをさ
699.5600000000001,701.5600000000001,吠えたくなる時期なんだよ
701.5600000000001,703.5600000000001,たださ30歳になってきて
703.5600000000001,705.5600000000001,30歳ぐらいの上司の人たちは
705.5600000000001,707.5600000000001,そういう気持ちで俺に言葉を掛けてたんだってのは
707.5600000000001,709.5600000000001,分かってくるんだよ現実を見せつけられるんだよ
711.5600000000001,713.5600000000001,25、6ぐらいのやつが一番話し合うんだよな
715.5600000000001,717.5600000000001,俺よりちょっと若いから
717.5600000000001,719.5600000000001,多少尊敬の眼差しで見てくれるし
719.5600000000001,721.5600000000001,かつ大人の気持ちが分かる
721.5600000000001,723.5600000000001,10代なんてほんとゴミだぞはっきり言って
723.5600000000001,725.5600000000001,なんにも分かんねえぞ
725.5600000000001,727.5600000000001,あああああいたずら電話
727.5600000000001,729.5600000000001,面白いとかそういう系でしょ
729.5600000000001,731.5600000000001,マジで架空請求の
731.5600000000001,733.5600000000001,業者に突したあいつ
733.5600000000001,735.5600000000001,マジで最強みたいな
735.5600000000001,737.5600000000001,俺そういうの小中学校で卒業してるから
737.5600000000001,739.5600000000001,俺おめえらがそういうの
739.5600000000001,741.5600000000001,今楽しんでるじゃん俺言っとくけど
741.5600000000001,743.5600000000001,中学校の時に命の電話にいたてにかけまくってたからね
743.5600000000001,745.5600000000001,命の電話
745.5600000000001,747.5600000000001,あれ最も大事にされる
747.5600000000001,749.5600000000001,自殺をしたい若者とかが
749.5600000000001,751.5600000000001,最も最後に駆け込むと言われてる
751.5600000000001,753.5600000000001,そんな大事なところを
753.5600000000001,755.5600000000001,俺たち荒らしてたからね
755.5600000000001,757.5600000000001,友達10人ぐらいで
757.5600000000001,759.5600000000001,今度そういう放送します
759.5600000000001,761.5600000000001,命の電話に突するみたいな
763.5600000000001,765.5600000000001,なんかお姉ちゃん悩みねえの
765.5600000000001,767.5600000000001,逆に中学校がため口で悩み聞いてた
767.5600000000001,769.5600000000001,今度そういう放送します
769.5600000000001,771.5600000000001,でさあ
771.5600000000001,773.5600000000001,ネットがなかったんだよマジで
773.5600000000001,775.5600000000001,インターネットがなかったんだよ想像できる
775.5600000000001,777.5600000000001,携帯電話がなかったんだよ
777.5600000000001,779.5600000000001,俺が中学校の時
779.5600000000001,781.5600000000001,本当に携帯電話を持ったのは
781.5600000000001,783.5600000000001,高校1年生だよ
783.5600000000001,785.5600000000001,ドコモのN503i
787.5600000000001,789.5600000000001,いやポケベル持ってる奴いたけど
789.5600000000001,791.5600000000001,そんなの1人2人だよ
793.5600000000001,795.5600000000001,だから本当にそういうのしかなかったんだよ
797.5600000000001,799.5600000000001,ドッジボールやったりさ
801.5600000000001,803.5600000000001,なかったんだよ嘘じゃねえんだよ
803.5600000000001,805.5600000000001,本当になかったんだよ
805.5600000000001,807.5600000000001,今もう
807.5600000000001,809.5600000000001,中学生って当たり前のように携帯電話
809.5600000000001,811.5600000000001,持ってるでしょ
811.5600000000001,813.5600000000001,中学生の子供を持つ親ってさ
813.5600000000001,815.5600000000001,俺たちより
815.5600000000001,817.5600000000001,絶対そういう文化に対して疎いじゃん
817.5600000000001,819.5600000000001,子供がさ中学生でさ
819.5600000000001,821.5600000000001,スマホ持ちたいんだけどって言われた時
821.5600000000001,823.5600000000001,どうしてんの親いるだろ
823.5600000000001,825.5600000000001,アホみてえによ
825.5600000000001,827.5600000000001,子育てとか仕事せずにニコ生聞いてる
827.5600000000001,829.5600000000001,ゴミみてえな親
829.5600000000001,831.5600000000001,みどりさんの奥さんに聞きたいわこれ
831.5600000000001,833.5600000000001,どうするんすかつって
835.5600000000001,837.5600000000001,渡さないの
837.5600000000001,839.5600000000001,え何パー持ってんの今
843.5600000000001,845.5600000000001,俺今そういうので卒論書いてるよ
845.5600000000001,847.5600000000001,えちょっと待て
847.5600000000001,849.5600000000001,聞こうこいつに
849.5600000000001,851.5600000000001,まずお前の学歴を教えてくれ
851.5600000000001,853.5600000000001,偏差値
853.5600000000001,855.5600000000001,俺がその卒論に偏差つけたやろ
857.5600000000001,859.5600000000001,ちなみにその
859.5600000000001,861.5600000000001,なんだっけ
861.5600000000001,863.5600000000001,65
863.5600000000001,865.5600000000001,65
865.5600000000001,867.5600000000001,結構高えじゃねえか大学の偏差値65って
867.5600000000001,869.5600000000001,医学部だったら入れるぐらい
869.5600000000001,871.5600000000001,ちょっと低い医学部だったら
871.5600000000001,873.5600000000001,入れるぐらいだぞお前
873.5600000000001,875.5600000000001,大学部に教えてくれ
875.5600000000001,877.5600000000001,エリート中のエリートじゃねえかよ
877.5600000000001,879.5600000000001,お前とはなかなか
879.5600000000001,881.5600000000001,なかなかいい
881.5600000000001,883.5600000000001,論議を交わさそうだな
885.5600000000001,887.5600000000001,え何どこそれ
887.5600000000001,889.5600000000001,南山大学ってどこ
889.5600000000001,891.5600000000001,関西
893.5600000000001,895.5600000000001,関西だっけ
897.5600000000001,899.5600000000001,名古屋のバカな大学
899.5600000000001,901.5600000000001,おめえあれだな
901.5600000000001,903.5600000000001,このさネットでさ
903.5600000000001,905.5600000000001,あの俺が言うなら
905.5600000000001,907.5600000000001,俺が嘘つくならまだしもさ
907.5600000000001,909.5600000000001,一視聴者のお前が
909.5600000000001,911.5600000000001,たかたかここで
911.5600000000001,913.5600000000001,目を張りたいがために偏差値に嘘つくのやめてくれないか
913.5600000000001,915.5600000000001,本当のこと教えてくれ
919.5600000000001,921.5600000000001,でも聞いた
921.5600000000001,923.5600000000001,関東に住む俺が聞いたことあるってことは
923.5600000000001,925.5600000000001,偏差値別に低くないと思うわ
925.5600000000001,927.5600000000001,55って高ぇじゃん
927.5600000000001,929.5600000000001,普通に
929.5600000000001,931.5600000000001,青角ぐらいってことでしょ
931.5600000000001,933.5600000000001,青角ぐらいってことでしょ
935.5600000000001,937.5600000000001,じゃないの
937.5600000000001,939.5600000000001,頭いいよね
939.5600000000001,941.5600000000001,それでなんか
941.5600000000001,943.5600000000001,青角の
943.5600000000001,945.5600000000001,で
945.5600000000001,947.5600000000001,その何について
947.5600000000001,949.5600000000001,今の時期
949.5600000000001,951.5600000000001,卒論って
951.5600000000001,953.5600000000001,いつから書き始めるっけ
955.5600000000001,957.5600000000001,卒論っていつから書き始めるっけ
957.5600000000001,959.5600000000001,青角60ぐらい
959.5600000000001,961.5600000000001,こいつロックしておこう
961.5600000000001,963.5600000000001,たぶんこいつ
963.5600000000001,965.5600000000001,青角60ぐらい
965.5600000000001,967.5600000000001,後でお前に説教があるから
967.5600000000001,969.5600000000001,一応な
969.5600000000001,971.5600000000001,こいつトックはためとかなきゃいけない
973.5600000000001,975.5600000000001,あ、なるほど
975.5600000000001,977.5600000000001,今から書き始めたんだ
977.5600000000001,979.5600000000001,えー
979.5600000000001,981.5600000000001,何について書き始めるの
983.5600000000001,985.5600000000001,何について書き始め
985.5600000000001,987.5600000000001,何について書き始めるの
987.5600000000001,989.5600000000001,その世代ジェネレーションギャップによる
989.5600000000001,991.5600000000001,スマートフォン
991.5600000000001,993.5600000000001,文化みたいな
993.5600000000001,995.5600000000001,俺さ一応さ
995.5600000000001,997.5600000000001,医療系だったから
997.5600000000001,999.5600000000001,そこにしか特化できなかったわけよ
999.5600000000001,1001.5600000000001,ゲーム依存症
1001.5600000000001,1003.5600000000001,なるほど
1003.5600000000001,1005.5600000000001,すごいしっくりくるわ
1005.5600000000001,1007.5600000000001,ゲーム依存症について
1007.5600000000001,1009.5600000000001,書くことについては
1013.5600000000001,1015.5600000000001,すごくしっくりくる
1015.5600000000001,1017.5600000000001,インターネットゲーム依存症
1017.5600000000001,1019.5600000000001,どういう観点から書くの
1019.5600000000001,1021.5600000000001,何あなたが思う
1021.5600000000001,1023.5600000000001,インターネットゲーム依存症の
1023.5600000000001,1025.56,とは
1025.56,1027.56,書き出し教えてよ
1027.56,1029.56,俺について書いてくれ
1029.56,1031.56,俺について
1031.56,1033.56,俺について卒論書きましたってバカいなぞ
1033.56,1035.56,専門学校行ってるやつでさ
1035.56,1037.56,加藤純一さんについて卒論書いてるんで
1037.56,1039.56,何かアドバイスください
1039.56,1041.56,って言って
1041.56,1043.56,嘘じゃないからな
