start,end,text
1043.56,1045.56,加藤さんがよければ学校に来て講義してください
1047.56,1049.56,そこまで言わしめた男が
1049.56,1051.56,インターネットゲーム依存症について
1051.56,1053.56,ゲーム2時間やると
1053.56,1055.56,覚醒剤打ってから出るドーパミンが一番
1055.56,1057.56,ゲーム26時間やったら
1057.56,1059.56,覚醒剤打ってから出るドーパミン
1059.56,1061.56,どれくらいの比率なの
1061.56,1063.56,私の知人で
1063.56,1065.56,私の知人ではゲームを26時間一気に
1065.56,1067.56,ぶっ続けてやったやつがいる
1067.56,1069.56,ゲームとインターネットを
1069.56,1071.56,さらに両立した上での26時間だぞ
1071.56,1073.56,俺なんかね
1073.56,1075.56,強逸至極なんだけど俺はやっぱ依存症のうちに
1075.56,1077.56,入るのはない
1083.56,1085.56,貴様の専門的な
1085.56,1087.56,お前専門家でもない
1087.56,1089.56,こいつ専門家でもなんでもないからいいや
1089.56,1091.56,やめよう
1091.56,1093.56,あー閉めた
1093.56,1095.56,青額のやつ消えちゃった
1095.56,1097.56,あのー
1097.56,1099.56,マーチの中でも青額抜けてるよなっていう
1099.56,1101.56,スタイルでいるやつ大っ嫌い
1101.56,1103.56,っていう俺の
1103.56,1105.56,いねえか?女とかでさ
1105.56,1107.56,やたら青額を
1107.56,1109.56,青額の
1109.56,1111.56,ふんどしで土俵取る
1111.56,1113.56,青額のふんどしで相撲取るやつ
1113.56,1115.56,抜けてるの違うだろ
1115.56,1117.56,それはもう論外
1117.56,1119.56,論知
1119.56,1121.56,論ずりなあたしね
1125.56,1127.56,人くくりにされてるんだから横並びでいいじゃねえか
1129.56,1131.56,高卒だから大学にされてもわかんねえ
1131.56,1133.56,じゃあなんか
1133.56,1135.56,たまにはじゃあおめえら
1137.56,1139.56,出してくれ
1139.56,1141.56,高卒ならではの
1141.56,1143.56,おい高卒ならではの話しようぜ
1143.56,1145.56,じゃあ
1145.56,1147.56,高卒ならではの話
1147.56,1149.56,悪くねえな朝っ端から
1149.56,1151.56,まずおめえのなんか
1151.56,1153.56,なんで今日こんなに
1153.56,1155.56,おめえらと話さなきゃいけねえんだよ
1155.56,1157.56,朝っ端からよ
1157.56,1159.56,高卒ならではの
1159.56,1161.56,お前らまずあれを教えてくれ
1161.56,1163.56,俺に興味を持たせるように自分をプレゼンしてくれ
1163.56,1165.56,まずお前は一体何者なんだ
1167.56,1169.56,この朝方からニコ生見てるやつを
1169.56,1171.56,説教してちょっとでもいい世の中にしていかなきゃいけないからな
1171.56,1173.56,俺は
1175.56,1177.56,まず自分
1177.56,1179.56,自分の老いたち
1179.56,1181.56,リアルニートの27歳
1183.56,1185.56,積みかけてるじゃねえかよ
1185.56,1187.56,おい
1187.56,1189.56,積みかけてるじゃねえかよ
1189.56,1191.56,くそ
1191.56,1193.56,もっと寝かせてからコメント広げばよかった
1193.56,1195.56,27歳無職がさ
1195.56,1197.56,面白いってこの時何話してたか教えて
1197.56,1199.56,ねえ俺がさ
1199.56,1201.56,8分くらいの時にさ
1201.56,1203.56,何がこいつの心に刺さったか
1205.56,1207.56,なんかあれを撮りたいわ
1207.56,1209.56,集計したいわ
1209.56,1211.56,27歳無職の心に刺さる俺のトークを
1211.56,1213.56,面白いってすごいじゃねえかよ
1213.56,1215.56,ゴジラ現れた時みたいな感想じゃねえかよ
1217.56,1219.56,気に入った
1219.56,1221.56,リアルニートの27歳
1221.56,1223.56,まずお前の悩みを聞いてやろう
1223.56,1225.56,本音で書いてくれ
1225.56,1227.56,本音で
1227.56,1229.56,まず
1229.56,1231.56,なんかその
1231.56,1233.56,ぶつけてくれ俺に
1233.56,1235.56,俺にまずぶつけてみてくれ
1235.56,1237.56,貴様の
1237.56,1239.56,一番の悩みを
1239.56,1241.56,えぐいやつな
1241.56,1243.56,今あぶねえ
1243.56,1245.56,ひでえこと言いそうだったけど
1245.56,1247.56,ギリギリのところで
1247.56,1249.56,今その医療従事者としての心がまだ残ってたわ
1249.56,1251.56,俺のソウルジェムは曇ってなかった
1251.56,1253.56,俺のソウルジェムは曇ってなかった
1253.56,1255.56,あ、えぐいこと言ってくれ
1255.56,1257.56,親がALSとかよ
1257.56,1259.56,それはやめとこうと思って
1259.56,1261.56,難病で苦しんでる人もいるのだった
1261.56,1263.56,俺瞬時にそこまで頭悪いんだぞ
1263.56,1265.56,そんな俺の起点の聞き
1265.56,1267.56,俺に色々相談してたろ
1267.56,1269.56,早寝早起きしたいけど
1269.56,1271.56,この時間まで起きちゃってるのではない
1271.56,1273.56,まず一個言わしてくれ
1273.56,1275.56,お前27歳の悩みが早寝早起きしたい
1275.56,1277.56,っていう時点で
1277.56,1279.56,お前の人生はもう半分積んでいるから
1279.56,1281.56,考えなくていいぞ
1281.56,1283.56,普通そういうのは小中学生の悩みだね
1283.56,1285.56,早寝早起きしたい
1285.56,1287.56,それを目標に掲げている時点で
1287.56,1289.56,もうちょっとやばい
1291.56,1293.56,悩むところが違う
1293.56,1295.56,お前が今一番悩まなきゃいけないのは
1295.56,1297.56,食がないことだ
1297.56,1299.56,普通そこでまず
1299.56,1301.56,あ、お前なんだろうな
1301.56,1303.56,食がないから
1303.56,1305.56,日案とかで調べてさ
1305.56,1307.56,無職の集まるスレみたいなのを見て
1307.56,1309.56,それに感化されて
1309.56,1311.56,早寝早起きマジでいいぞ
1311.56,1313.56,生活サイクルが戻ると
1313.56,1315.56,頭が働くみたいな
1315.56,1317.56,まずはそこから頑張れとかいう情報だろ
1317.56,1319.56,終わってるぞ
1319.56,1321.56,そんなの
1321.56,1323.56,教えてくれ
1323.56,1325.56,本音を絶対見てるだろ
1325.56,1327.56,それでインターネットの情報を鵜呑みにしてさ
1327.56,1329.56,早寝早起きすれば俺も変われるんだ
1329.56,1331.56,みたいなところから
1331.56,1333.56,すげー働いてる奴って早寝早起きしてねーんだぞ
1333.56,1335.56,夜友達と
1335.56,1337.56,飲みすぎちゃったーって2時間睡眠とかで
1337.56,1339.56,言ってたぞみんな
1341.56,1343.56,知ってたか
1345.56,1347.56,だって働き
1347.56,1349.56,無職の集まるスレで
1349.56,1351.56,その就職に関すること聞いても
1351.56,1353.56,多分意味ねぇだろ
1353.56,1355.56,働いてる人のスレとかでやったほうがいいんじゃないか
1357.56,1359.56,多分
1359.56,1361.56,俺確信をついてしまった
1361.56,1363.56,日常の仕組みが難しい
1363.56,1365.56,見方がわからない
1365.56,1367.56,低能
1367.56,1369.56,お前何
1369.56,1371.56,日々何を楽しんでる
1371.56,1373.56,気に入ったこいつ
1373.56,1375.56,可愛さを
1375.56,1377.56,なかなか20代後半でこんな可愛さ持ち合わせてる奴いねぇぞ
1377.56,1379.56,なんか
1379.56,1381.56,どうなの
1381.56,1383.56,何を楽しみに生きてるの
1387.56,1389.56,いじってるわけじゃない
1389.56,1391.56,可愛いなんかすごい素直だよ
1391.56,1393.56,なんか素直じゃねぇか
1393.56,1395.56,掲示板で卒論全部書いてくれって
1395.56,1397.56,高卒が言ってんだぞちゃんと
1397.56,1399.56,こうやってその
1399.56,1401.56,言うや否や高卒だから大学の話されても分かんねぇよ
1401.56,1403.56,素直じゃん
1403.56,1405.56,こういうやつ好きなんだよ
1405.56,1407.56,見込みがある男を見つけた
1407.56,1409.56,かまたの代わりに
1409.56,1411.56,お前かまたの代わりに
1411.56,1413.56,俺YouTube見るやんしねぇか
1413.56,1415.56,そこでパソコンに関する技術を
1415.56,1417.56,学んで世に羽ばたいていけばいいじゃん
1417.56,1419.56,そうよくねぇおめぇ
1421.56,1423.56,どうよ
1423.56,1425.56,俺がなんか雇ってやるよお前
1427.56,1429.56,最近は毎日筋トレをするようになった
1431.56,1433.56,原始時代とかだったらなぁ
1433.56,1435.56,光輝く場所もあったろうに
1435.56,1437.56,残念今西暦もう2017年だ
1437.56,1439.56,お前生まれてくるのが
1439.56,1441.56,4000年遅かったな
1441.56,1443.56,北京原人とかの中に混ざってれば体鍛えるとかさ
1443.56,1445.56,早寝早起きするみたいな
1445.56,1447.56,そういうことが重宝される時代に
1447.56,1449.56,生まれてきてほしかったなお前は
1449.56,1451.56,4000年遅かった
1451.56,1453.56,うん
1453.56,1455.56,親を
1455.56,1457.56,親を恨んでくれ
1457.56,1459.56,そして俺に感謝してくれ現実を教えてくれた
1459.56,1461.56,加藤純一ありがとう
1463.56,1465.56,これ何の流れなの分かんない別に
1465.56,1467.56,適当
1467.56,1469.56,なんでこうなったか分かんない
1469.56,1471.56,29歳ニートン
1471.56,1473.56,筋トレしてるぞ
1473.56,1475.56,だってみんなでyoutubeとか動画上げないじゃん
1475.56,1477.56,無職の筋トレ動画
1477.56,1479.56,みたいな感じでさ
1479.56,1481.56,時間は
1481.56,1483.56,オールドボーイみたいにさ
1483.56,1485.56,毎回終わり際
1485.56,1487.56,ただ時間は無限にあった
1487.56,1489.56,オールドボーイ見てるやつは
1489.56,1491.56,今のとたんまじで面白いからちゃんとオールドボーイ見ろよ
1491.56,1493.56,刑務所みたいなとこに
1493.56,1495.56,捕まって体鍛える以外は
1495.56,1497.56,何にも楽しいのがないんだよ
1497.56,1499.56,ただ時間だけは無限にあった
1499.56,1501.56,って体鍛えてるやつがいて
1501.56,1503.56,20年間同じ部屋に監禁されて
1503.56,1505.56,出てきてその20年間
1505.56,1507.56,ただひたすらに体を鍛えて復讐をする
1507.56,1509.56,っていう面白い漫画があるから
1509.56,1511.56,お前らそれを体現してくれ
1511.56,1513.56,47くらいまでyoutubeの収益で細々と暮らして
1517.56,1519.56,頼むわ
1521.56,1523.56,あれ映画面白くなかったよなオールドボーイ
1525.56,1527.56,無職の筋トレ
1527.56,1529.56,伸びたらお前俺に感謝しろよ
1529.56,1531.56,うんこちゃんが
1531.56,1533.56,うんこちゃんがいたおかげで俺は救われました
1533.56,1535.56,つって
1537.56,1539.56,今からゲームしても絶対やだわ
1539.56,1541.56,朝っ端からゲームしなきゃいけないんだよ
1541.56,1543.56,二度寝すんだよ
1543.56,1545.56,夜7時くらいに寝ちまうよ
1545.56,1547.56,このままじゃん
1547.56,1549.56,でまた朝4時に起きるみたいな暮らしになっちゃう
1549.56,1551.56,いや
1551.56,1553.56,そんなのはいや
1553.56,1555.56,なんか企画立ててくれ
1555.56,1557.56,別にそんなのは
1557.56,1559.56,話すとにかく今は
1561.56,1563.56,最近プライベートでゲームしてないの
1563.56,1565.56,何してんだっけな
1565.56,1567.56,モンハン熱も冷めちゃったし
1567.56,1569.56,まあ今一番やりたいゲームは
1569.56,1571.56,トリコなんだよ
1571.56,1573.56,トリコはやっぱ初見で動画撮りたいんだよ
1573.56,1575.56,なんかライフウィズストレンジみたいに毎日バーって
1575.56,1577.56,垂れ流してんだよ
1577.56,1579.56,ポケモンやってねーな
1579.56,1581.56,ミクニンあれ返してねーよ3DS
1581.56,1583.56,あぶな
1583.56,1585.56,梱包してまだ家の奥にはまってるわ
1585.56,1587.56,なんか
1587.56,1589.56,ライフウィズストレンジみたいに
1589.56,1591.56,あのーきらびやかな編集せずにボンボン上げてくわ
1591.56,1593.56,あれさぶっちゃけさ何時間くらいで終わる
1593.56,1595.56,多分早いだろ
1595.56,1597.56,いや生放送でやるのは
1597.56,1599.56,嫌だ
1599.56,1601.56,なんかあれ結構俺ライフウィズストレンジ系のゲームだと思ってんだよな
1601.56,1603.56,俺の中で
1605.56,1607.56,あれ何時間くらい
1607.56,1609.56,あ10時間くらいなんだ
1609.56,1611.56,えー時間もいいじゃん
1611.56,1613.56,時間も良いじゃないか
1613.56,1615.56,10時間だったら別に
1615.56,1617.56,バーって上げれるな
1617.56,1619.56,いやでもさ
1619.56,1621.56,俺さ前さタメ撮りしてさ
1621.56,1623.56,なんか
1623.56,1625.56,それ違ったんだよな
1625.56,1627.56,撮って上げて
1627.56,1629.56,それ見てあなるほどつって
1629.56,1631.56,その前のコメントとかを
1631.56,1633.56,なんていうの
1633.56,1635.56,その実況に入れながら
1635.56,1637.56,やっていきたいんだよね
1637.56,1639.56,ロックポケ方式でやってみようかな今度
1639.56,1641.56,できらびやかな編集しなければ
1641.56,1643.56,俺さ
1643.56,1645.56,エンコードすげー時間かかってるって言ったじゃん
1645.56,1647.56,あれなんか変なフィルターかかってたみたいで
1647.56,1649.56,エンコードの速度が6倍になったから
1649.56,1651.56,動画上げた瞬間も半端ないんだよな
1653.56,1655.56,エンコードの速度が6倍になったわ
1657.56,1659.56,マジで
1659.56,1661.56,なんか変なフィルターかかってたらしくて
1665.56,1667.56,恐ろしい
1667.56,1669.56,ニーヤはでも
1669.56,1671.56,やりてーけど配信じゃない
1671.56,1673.56,この前あれだわ新宿ルミネでやってる
1673.56,1675.56,ニーヤ
1675.56,1677.56,オートマタの
1677.56,1679.56,なんかあの絵の祭典みたいなの
1679.56,1681.56,行ってきたわ
1681.56,1683.56,俺それ写真上げたっけ
1683.56,1685.56,みんなに見せようと思ってツイッターで上げようと思って写真撮ってきたんだよな
1687.56,1689.56,すごく良かった
1689.56,1691.56,俺ニーヤ大好きだから
1693.56,1695.56,あれ撮ってなかったっけ
1695.56,1697.56,絶対
1701.56,1703.56,すごく良かったよ
1707.56,1709.56,上げてなかった
1711.56,1713.56,今作のニーヤクッソ面白かったぞ
1713.56,1715.56,噂では聞いてんだよ
1715.56,1717.56,暗いんでしょ
1717.56,1719.56,ワンも暗かったからな
1719.56,1721.56,なんかあの世界観が好きだわ
1721.56,1723.56,暗くてじとっとしてる世界観
1725.56,1727.56,出てくるぞ
1727.56,1729.56,絡んでくるの本筋に
1729.56,1731.56,AからZまでルートあるんだ
1731.56,1733.56,なんか増えたね
1733.56,1735.56,1だとDまでだったっけ
