start,end,text
1174.8,1176.8,さすが三振しなかったのがやっぱデカい
1176.8,1178.8,ここで3番アオキが生きてくるんだよね
1178.8,1180.8,オッケーオッケー
1180.8,1182.8,オッケーオッケー
1182.8,1184.8,まあツツゴは甘えたまえ1球も来ないでしょ
1184.8,1186.8,なんだかんだで中田選手ツツゴが怖いって
1186.8,1188.8,わかるだろ
1190.8,1192.8,よくやったよくやった今の1点この1点デカいね
1192.8,1194.8,頼りになるのやっぱね
1196.8,1198.8,いや三振しないってデカいんだな
1200.8,1202.8,うわ中田翔太とんでもねえ素振りしてる
1204.8,1206.8,ツツゴを歩かせたらどうなるかわかってんだろうな
1206.8,1208.8,これあれだろね
1208.8,1210.8,戦線布告だぞたぶんこれ
1210.8,1212.8,チキューバーに対する
1212.8,1214.8,これキューバ政府見てたら
1214.8,1216.8,確実に戦争になってるぞ今のスイングは
1216.8,1218.8,テポドンだテポドン
1218.8,1220.8,今あれネクストバターンサークルでの
1220.8,1222.8,中田のスイング見たか
1224.8,1226.8,人殺してるやつのスイングだぞあれ
1232.8,1234.8,ひげもじゃ
1236.8,1238.8,いや変えないでしょ
1238.8,1240.8,こんだけいいピッチングしてんのに変えなくねえか
1240.8,1242.8,まあ歩かせるか勝負するかっていう
1244.8,1246.8,え変えてくんの
1248.8,1250.8,マジで
1250.8,1252.8,なんで
1252.8,1254.8,このピッチは変えてくれて嬉しくない
1256.8,1258.8,今すげえいいピッチングしてたよねこの人ね
1268.8,1270.8,なるほどね
1270.8,1272.8,もう全部
1272.8,1274.8,集大成みたいな感じで来てるんだ
1274.8,1276.8,変えねえよな
1276.8,1278.8,ここ勝負するか勝負じゃないかだよね
1278.8,1280.8,まあ甘い弾一球も
1280.8,1282.8,投げずにフォアボールでもいいよつって
1282.8,1284.8,次の中田でピッチはこうだね
1284.8,1286.8,そしてそれを
1286.8,1288.8,見越した中田のあの宣戦布告スイング
1290.8,1292.8,あれ気合が入ってるときしか
1292.8,1294.8,中田やらねえから
1294.8,1296.8,スコアリングポジション
1296.8,1298.8,あ違うネクストバッターンサークルのほうが
1298.8,1300.8,いいスイングしてる中田
1302.8,1304.8,いけすご
1304.8,1306.8,甘い弾来たら撃てよ
1306.8,1308.8,まあでも全部もう外
1308.8,1310.8,いっぺん投でしょ1球も
1310.8,1312.8,いやえボール今
1312.8,1314.8,おお
1314.8,1316.8,いやこれありがてえな正直
1316.8,1318.8,筒子勝負してくれんの
1318.8,1320.8,筒子って左ピッチャー弱くないよね別にね
1322.8,1324.8,弱くないよね
1324.8,1326.8,撃ってる結構強いよね
1326.8,1328.8,よう撃たれてるイメージあるわ
1328.8,1330.8,山口当たりが
1330.8,1332.8,ちょっと高めに
1332.8,1334.8,抜けてくんねえかな
1334.8,1336.8,あーそこは撃てないんだよ
1336.8,1338.8,もう全部その球じゃねえってか
1338.8,1340.8,あーあれしてた
1340.8,1342.8,ニヤーってニチャーってしてた
1342.8,1344.8,おい何だ筒子おめえは
1344.8,1346.8,ヒゲなんか生やしちゃったよ
1346.8,1348.8,ヒゲそれヒゲ
1348.8,1350.8,中畑も言ってただろうが
1350.8,1352.8,お前筒子中畑に感謝しろよ
1352.8,1354.8,ずーっと
1354.8,1356.8,来たー
1356.8,1358.8,ショーさん
1358.8,1360.8,唯一年下で敬語喋る男ショーさん
1364.8,1366.8,てかこいつらみんな俺より年下かよ
1366.8,1368.8,やべえな
1368.8,1370.8,ねえ筒子撃とうぜ
1370.8,1372.8,今の
1372.8,1374.8,衝撃なんだけど俺さまさかさ
1374.8,1376.8,WBC選ばれたら俺もうすでにベテランの息子じゃない
1376.8,1378.8,32歳
1378.8,1380.8,俺上から2番目ぐらいじゃない
1380.8,1382.8,それにびっくりするんだけどあんなに
1382.8,1384.8,ちっちゃい頃この人たちみたいになりたい
1384.8,1386.8,って思ったけど
1386.8,1388.8,おまえや筒子に
1388.8,1390.8,筒子ですら7個下っていう
1392.8,1394.8,絶対筒子にあったら敬語使わせよ
1394.8,1396.8,だって俺より7個下なんだから
1396.8,1398.8,年収俺の100倍
1398.8,1400.8,ジャスト100倍
1400.8,1402.8,さあ
1402.8,1404.8,ここで4億の男示せ
1404.8,1406.8,いけえええええええ
1408.8,1410.8,いいね筒子
1410.8,1412.8,ケイダーもいけるね
1412.8,1417.8,さあ、こうなったら中田将覚えてくるでしょ
1417.8,1421.8,ピッチャー変えてくるかな
1421.8,1426.8,今日ツツゴ3打なんだ、すご
1426.8,1433.8,いやーこうなってくれれば青木のセカンドホールでかかったなーほんと
1433.8,1437.8,うーまいねー
1437.8,1440.8,もう
1441.8,1445.8,言ってたもんね、ツツゴ自分でね、なんか入団当初
1445.8,1449.8,僕はヒット打つ方がうまいんですよって
1449.8,1454.8,ホームランを狙わなければ結構打率残す自信ありますって自分で言ってたもんね、考察時代
1454.8,1457.8,なんかその
1457.8,1461.8,うわー今日3つ、しかも2本タイムリーなんだ
1465.8,1469.8,いけ、いやーもう将さん
1469.8,1472.8,落ちろ落ちろ
1472.8,1478.8,もう将さん差し込まれちゃってる変化球狙ってたのかな
1478.8,1484.8,やっぱ146だな、山田ツツゴ坂本だな
1484.8,1492.8,平野また行くの?平野って垣間滝どうなの?いける口なの?
1492.8,1496.8,いける口?無理なの?
1496.8,1501.8,おいふざけんなお前らだけ平野いけるいけるって言ってたじゃねーかよ
1501.8,1507.8,乗り物もそうだよな、ニーニング娘に打たれるよな
1507.8,1509.8,オランダイスラエルキューバー
1509.8,1513.8,いやでも頭一つ抜けてんだろ日本が正直このメンバーだったら
1513.8,1516.8,ベネズエラプエルトリコアメリカぐらいじゃないやっぱ
1516.8,1522.8,4強なんだ今世界は、ベネズエラプエルトリコアメリカ日本だと思う
1522.8,1527.8,お!いいねー
1527.8,1534.8,なんかもうジャパンのユニホームが似合い始めてくるといよいよスーパースターだよねみんな
1534.8,1543.8,かーまじかこれさーみんなこれリアルタイムで見たやつやばかったでしょ脳じれ出たでしょ今の
1543.8,1546.8,だってエトウのホームランじゃんあれ
1546.8,1553.8,あんなホームラン打つのこんなちっちゃいやつが180ぐらいしかねーだろ
1553.8,1556.8,あー真ん中だね
1556.8,1561.8,抜けてんだスライダーが全部
1561.8,1566.8,まあでもスガノ、結局スガノしかいないからスガノ打たれたらいないからさ
1566.8,1569.8,スガノ以上にいいピッチャー今たぶん代表にいないから
1569.8,1575.8,うわーそこ打つんだ坂本みてぇだなこいつ
1575.8,1582.8,うおーいいねーなるほどなるほど
1582.8,1584.8,そして
1584.8,1589.8,あ、あの前回のいいねー
1589.8,1593.8,あ、なんか一応ツッツコシフト敷いてきてるんだね
1593.8,1597.8,なんかやっぱ中国とかはさシフト敷くの大好きじゃん
1597.8,1601.8,キューバとかも意外とやっぱちゃんとスコアラーがいるんだな
1601.8,1605.8,馬鹿みてぇによぼっきり振り回してるだけかと思ってた俺
1605.8,1613.8,全部たけぇよスガノ球が
1613.8,1617.8,うーん甘い
1617.8,1620.8,これよく刺した
1620.8,1627.8,これよく刺した
1627.8,1630.8,これよかったね青木
1630.8,1632.8,粘って粘って
1632.8,1636.8,これよかったわー
1636.8,1640.8,よかった
1640.8,1642.8,そしてツッツのこのセンター前を
1642.8,1646.8,もうホームラン打つ気なんかさらさらないもんね今の打ち方
1646.8,1650.8,もうさらさらないもんねもう
1650.8,1652.8,いいねー
1652.8,1654.8,安倍晋之助とはほんとに被るわ
1654.8,1658.8,あのタンダ打ちたい時の安倍の打ち方だよね
1658.8,1660.8,繋がりはあるのだろうかツツゴと安倍
1660.8,1662.8,おっ
1662.8,1663.8,お辞儀してる
1663.8,1664.8,なに
1664.8,1665.8,誰今の
1665.8,1668.8,えっツツゴそんなことできるようになったの
1668.8,1672.8,あの高速でブクブク太ることしか脳がなかったただの豚のツツゴが
1672.8,1677.8,観客に深々と敬礼ができるの
1677.8,1681.8,キューバと戦争になっても日本は安泰だなこれ
1681.8,1683.8,あいつがいる限り
1683.8,1686.8,あーマスイはまぁでもいけるだろフォークボールあるだろ
1686.8,1697.8,ただよ日本みたいによストレートでグーグー押してったらやっぱ打たれるぞ
1697.8,1700.8,それマジ気をつけなきゃいけない特にデスパイでなんてよ
1700.8,1704.8,あーよー売ってんな
1704.8,1714.8,まっすぐで押していこうみたいなのやめような
1714.8,1715.8,マスだ
1715.8,1718.8,俺の一個上だっけなこいつ
1718.8,1721.8,こいつとか完全に家で野球見てる時のノリ
1721.8,1725.8,配信のノリじゃねえこのバカとか俺よく言ってるから
1725.8,1728.8,死ねえマスイとか言ってるから
1728.8,1730.8,もう甘いよ弾が
1730.8,1738.8,いけキクチいいねナイス
1738.8,1743.8,そうやって考えるとマスイのグラブに当たったのがでかいわ
1743.8,1749.8,ナイスフォローアップ
1749.8,1755.8,うわーセンター前抜けてたなこれ
1755.8,1758.8,いいねほんとセカンドキクチがいるってでかいな
1758.8,1761.8,何個助けられてる日本は
1761.8,1767.8,まぁこれデスパイだからまぁ余裕あったけど
1767.8,1771.8,あのダシャのバットにボールが当たってから
1771.8,1774.8,一流に到達するまで4秒弱なのね
1774.8,1775.8,まぁ4秒ぐらいか
1775.8,1781.8,だからさ打球を取ってから投げてファーストベースで行くまで4秒って考えると恐ろしくない
1781.8,1786.8,俺とかだったらボールに追いつくまでに4秒かかるのね
1786.8,1789.8,だからグラウンドに野球見に行って一番すげえなって思うのって
1789.8,1793.8,多分みんな共通して守備だと思うんだよ
1793.8,1801.8,何をやってるんだショウさん
1801.8,1805.8,顔で止めろ顔で
1805.8,1810.8,ちょ今のファースト守備もう一回見せてよ
1810.8,1814.8,ちょファースト守備見して今の
1814.8,1817.8,ちょっと雑じゃなかったか今
1817.8,1820.8,あーちょっとまぁしゃーねーかしゃーねーじゃしゃーねーか
1820.8,1824.8,ファーストだったら行くか
1824.8,1827.8,まぁ打球が速かったらしょうがねーか
