start,end,text
0.0,2.0,リアルタイムの視聴者数で
2.0,4.0,ユーザー同士が争ってるみたいな
4.0,6.0,見てる、ファン同士が
8.0,10.0,だって俺モコとめちゃめちゃ仲いいから
10.0,12.0,別になんも喧嘩してねえもん
12.0,14.0,しょっちゅう連絡載ってるぞ
14.0,16.0,なんだっけな
16.0,18.0,なんかこの前も来たもん
20.0,22.0,別におめえたちが喧嘩してる分じゃ
22.0,24.0,なんも関係ねえし
26.0,28.0,えー
28.0,30.0,えー
30.0,32.0,そういう
32.0,34.0,情勢にも目を向けないといけねえな
34.0,36.0,ニコ生で一番アンチが多い
36.0,38.0,視聴者数が多い人
38.0,40.0,だと思うよ
40.0,42.0,視聴者二人しかいねえのに
42.0,44.0,アンチもクソもねえじゃん
44.0,46.0,分かんねえけど
46.0,48.0,仲いいから信者同士で喧嘩しやすい
48.0,50.0,別にでも配信とかにあれじゃん
50.0,52.0,お互いなんも干渉してねえじゃん
52.0,54.0,全然必要じゃねえじゃんお互い
54.0,56.0,必要ない必要ない
58.0,60.0,喧嘩してるんじゃなくて
60.0,62.0,コミュ掲示板でぼやいて
62.0,64.0,あーなるほどねそうだよな
64.0,66.0,確かに今言ってピンとこない人もいっぱいいるってことはさ
66.0,68.0,そういう表に出てくる言葉
68.0,70.0,あの文章とかで
70.0,72.0,載るやつっていうのは
72.0,74.0,まあそういうの目立つよ
74.0,76.0,ってことなんだろうね
76.0,78.0,その他の3000人とか4000人は
78.0,80.0,何言ってんだろうなーって別にそんなこと思ってないよ
80.0,82.0,って
82.0,84.0,よかった
84.0,86.0,そうなんだ
90.0,92.0,そういうことなんだな
94.0,96.0,なんか別にバカにされてていいじゃん
96.0,98.0,なんかそんな
98.0,100.0,なんでそこでマウント取り合ってんだ
100.0,102.0,多分俺たちの方が若干
102.0,104.0,年齢層高いんだよ折れてあげればいいのに
104.0,106.0,そうだよなーって
106.0,108.0,あいつもすげえ頑張ってるよなーっていいのにさ
108.0,110.0,ほんとに
110.0,112.0,理由がないよなお前らって
112.0,114.0,折れてやればいいのに
114.0,116.0,なんでそこで肩
116.0,118.0,てめえ肩ぶつけてんじゃねえぞこんな野郎
118.0,120.0,全部折れてやればいいのに
120.0,122.0,謝ったら勝ちって言葉知らねえのか
122.0,124.0,赤髪のシャンクスだって
124.0,126.0,あのなんだっけ絡まれたけど
126.0,128.0,謝っただろうが
132.0,134.0,そこで負けず嫌いが発動するんだろうなー
134.0,136.0,なんかの競技だと思ってるんじゃないか
136.0,138.0,まあ俺は別にそういう報告受けるの楽しいから
138.0,140.0,別にどっちもいいけど
144.0,146.0,お前がわざと統率取らないんだから仕方ないじゃん
146.0,148.0,いや別に
148.0,150.0,大変だぜーそうやってさ
150.0,152.0,みんなの気持ちを一つにしてさ
152.0,154.0,やってくやつなんていないぜ
154.0,156.0,向き合わないのが一番ちゃんとしてると思うぜ
158.0,160.0,一人一人に向き合ってたら死んじまうぜ
160.0,162.0,おそらく
162.0,164.0,適当でいいだろうが
164.0,166.0,各々
166.0,168.0,こういう感じで
172.0,174.0,適当が一番
178.0,180.0,これギューリックに早く月時問題解決しないと
180.0,182.0,ジージーが戻ってこない
182.0,184.0,実際で
184.0,186.0,それすごいな重いな
186.0,188.0,もうあと17分で終わるよ
190.0,192.0,17分
192.0,194.0,みんな好きなように
196.0,198.0,お前が配信で高田の名前出すなって言ったから
198.0,200.0,○○とか名前出せられるようになったぞ
202.0,204.0,みんなの拒絶反応はやばいじゃん
204.0,206.0,俺だけもう別に
206.0,208.0,完全に過去の人だから
208.0,210.0,名前出そうか出さないか全然OKだもん
214.0,216.0,センチなんだもんみんなが
222.0,224.0,だってもう完全に
224.0,226.0,お前らだってもう過去の人だろうが
226.0,228.0,名前なんか出ねえじゃねえかよ
232.0,234.0,いやそうだ元カドみてえだもんだろ
236.0,238.0,出ねえだろ
242.0,244.0,出すなとは言ってるけどみんなが合意したから出さない
244.0,246.0,あなるほど
246.0,248.0,そういう会議があったんだよな
248.0,250.0,会議があったんだよな
250.0,252.0,どうでもいいけど出すとあっちがぐちゃぐちゃうるさいから
252.0,254.0,別にぐちゃぐちゃ言わせとけばいいじゃねえかよ
254.0,256.0,何がいけねえんだよ
258.0,260.0,ごめんねって言われちゃうその時は
260.0,262.0,ごめんねごめんね
264.0,266.0,みんな向き合うの好きだよな
266.0,268.0,楽しんでるんだろうな
272.0,274.0,みどりはお前と高田の関係を
274.0,276.0,ガチで心配したら安心してやってくれるのか
276.0,278.0,別に
278.0,280.0,向こうが死にそうで
280.0,282.0,病院のベッドで
282.0,284.0,うわごとのない俺の名前呼んでるんだったら
284.0,286.0,みま一回くらい言ってやるけど
286.0,288.0,何の感情もないんだもん別に
288.0,290.0,仲直りもクソもねえんだって
290.0,292.0,お前道端にいる通行人に
292.0,294.0,お前あの人と仲良くなれって言われるのと一緒だからな
294.0,296.0,いやそんなこと言われても
296.0,298.0,無なんだって
298.0,300.0,嫌いでもないし好きでもないんだって
304.0,306.0,だから別に
306.0,308.0,好きな人応援すればいいじゃん
310.0,312.0,これは何の枠なのか教えてくれ
312.0,314.0,なんか普段あんまり話さないこと
314.0,316.0,話そうかい
316.0,318.0,さっきなんかチャンネルの男女非とかを
320.0,322.0,話してました
326.0,328.0,仲直りしろとかいうゴミが出てくるから名前出すなって
328.0,330.0,そうなんだ別に無視すればいいじゃん
336.0,338.0,んー
340.0,342.0,夜寝てるよ
342.0,344.0,もう寝るよ
346.0,348.0,夜寝る夜寝る
352.0,354.0,あーなんか色々
354.0,356.0,考えがあるんだなみんな
358.0,360.0,考えがあるんだろうな
360.0,362.0,新しいパソコンいつから使おうかな
362.0,364.0,なんか次の
364.0,366.0,あれで使おうかな
368.0,370.0,次の
376.0,378.0,だって俺あいつからの電話出て
378.0,380.0,一緒に配信したことあるよ
382.0,384.0,見た目が気持ち悪いし会うと親が悲しむから
384.0,386.0,俺が避けてるだけで
386.0,388.0,一緒の現場に行ったら俺出ませんって絶対ないよ
390.0,392.0,気持ち悪いじゃんなんかやってること
392.0,394.0,つまんねえんだもん
394.0,396.0,一緒にやってても
400.0,402.0,で別に番組一緒になったら一緒に出るよ
402.0,404.0,公式放送とかで
404.0,406.0,それが共演NGなんじゃないの
406.0,408.0,俺の放送には絶対呼ばないっていう
408.0,410.0,邪魔なだけだからっていう
412.0,414.0,確かにあと彼女がダメって言ってたわ
414.0,416.0,昔は
416.0,418.0,暗黒放送とヨッサンには絶対絡まないでください
418.0,420.0,絡まないでくださいって
422.0,424.0,俺何回も言ってる別に共演NGじゃなくて
424.0,426.0,ただ興味がないだけだよって
426.0,428.0,言ってるだけ
430.0,432.0,出ればいいじゃねえかよ
432.0,434.0,なんでなんでセーブしてんの
434.0,436.0,別に出れるんだったら出ればいいじゃねえかよ
438.0,440.0,俺別にそんなキャスティングの権限ないもん
442.0,444.0,キャスティングの権限なんかないよ
444.0,446.0,俺なんか下っ端だし
446.0,448.0,寝るはお前がガチでヨッサンNG
448.0,450.0,仲間作りたがってんじゃねえの
450.0,452.0,みんな聞いたこと一文ねえんだろ
454.0,456.0,ねえだろうが
458.0,460.0,おひれって背ひれがついていくんだよこうやってネットの
462.0,464.0,ネットのさあ
464.0,466.0,悪いとこだよな本当に
468.0,470.0,ネットのおひれとか背びれが
470.0,472.0,悪いとこ
476.0,478.0,ねるがツイッターでニコニコ運営
478.0,480.0,批判してんのしまくってんのまじできつい
480.0,482.0,今いいんじゃねえか
484.0,486.0,いいんじゃねえの
486.0,488.0,知らんが
494.0,496.0,お前がヨッサンと共演NG
496.0,498.0,って言ってたら
498.0,500.0,あーまあまあ受け取り側の問題だもんな
500.0,502.0,それは俺に責任があるな
502.0,504.0,それを冗談だから
504.0,506.0,間に受けんなよってやつ嫌いだから
506.0,508.0,それは俺に責任があるかもしれない
510.0,512.0,なるほどな
514.0,516.0,でも自分のさユーザーに伝わればいいじゃん
518.0,520.0,自分のユーザーに
520.0,522.0,自分の視聴者に
522.0,524.0,伝わればええんやねえのか
528.0,530.0,自分の言ったことに責任持て
530.0,532.0,まあそれはいいじゃん
532.0,534.0,それは
538.0,540.0,まあ面白いんじゃないのそういうのが
540.0,542.0,おひれせみれついてな
542.0,544.0,グダグダしてるときって面白ええよなんかな
546.0,548.0,そんなことあるわけ
548.0,550.0,なんだっけあのさ女の視聴者大胆じゃねえかみたいな話
550.0,552.0,あれなんだっけそういう話していこうぜ
552.0,554.0,普段あんまりさゴールデンタイムに
554.0,556.0,俺そういうのつまんないから話さないようにしてんだけど
556.0,558.0,なんだっけあいつ名前なんて言ったっけ
558.0,560.0,あいつ名前なんだっけ
560.0,562.0,メグミルクだあれってさ
562.0,564.0,俺もう一回聞くけどさ
564.0,566.0,あれなんだったのちゃんと教えてくんない
566.0,568.0,あれなんだったの
568.0,570.0,マジで
572.0,574.0,モグミルクはドラクエジョーカーだよな
574.0,576.0,あれなんであれたんだっけ
578.0,580.0,あいつ結婚してるぞ
580.0,582.0,なんか俺が
582.0,584.0,あいつにピクミン3をやれって言われて
584.0,586.0,それでやってるみたいな
588.0,590.0,それでみんなは思ったってこと
590.0,592.0,その情報はどこなの
592.0,594.0,その情報は
596.0,598.0,フェラーの達人
598.0,600.0,骨抜きにされてやったってこと
602.0,604.0,フェラーの達人だから
604.0,606.0,俺が骨抜きにされて
608.0,610.0,やられたみたいな
610.0,612.0,ツイキャスで女に言われたゲーム
612.0,614.0,やってるって言ってて
614.0,616.0,それでメグミルクが私が
616.0,618.0,ピクミン3やってって言ったから
618.0,620.0,加藤純一さんやってくれたみたいな
620.0,622.0,風に思ったから
622.0,624.0,それを視聴者が勘違いして
624.0,626.0,お前らきっしょ
628.0,630.0,きっしょ
630.0,632.0,それでなんか
632.0,634.0,ふざけんなよ女の言うこと聞きやがってよ
634.0,636.0,みたいなこと
636.0,638.0,なるほどな
638.0,640.0,わり
640.0,642.0,俺がなんか彼氏であるお前らに
642.0,644.0,配慮が足らなかった
644.0,646.0,俺あれでしょ
646.0,648.0,それで年明けにやるよ
648.0,650.0,って放送中にも
650.0,652.0,言ってたじゃん
652.0,654.0,そういう対応取ったのに彼女が勘違いして
654.0,656.0,それで
656.0,658.0,みんな喧嘩して
658.0,660.0,名前まで特定されてガチャガチャしてた
660.0,662.0,ってこと
664.0,666.0,チョコレートで揉めなかったっけ
666.0,668.0,チョコレート
668.0,670.0,それとはまた別なの
670.0,672.0,チョコレートは
674.0,676.0,視聴者に差をつけたら怒るだろう
676.0,678.0,なんで
678.0,680.0,なんだそのお前
680.0,682.0,炊き出しにただで飯食ってるのにもかかわらず
682.0,684.0,メニューに文句言うみたいな
684.0,686.0,それは別なんだ
686.0,688.0,炊き出しに切れてる
688.0,690.0,ホームレスみたいなこと言ってんじゃねえぞ
690.0,692.0,お前この野郎
698.0,700.0,それが
700.0,702.0,燃料になってるってことなんだ
702.0,704.0,へー
704.0,706.0,俺とは関係ないで揉めてたってこと
706.0,708.0,簡単に言うと
712.0,714.0,だって
714.0,716.0,あのチョコレートって俺女の子からもらった
716.0,718.0,あれ男の子からもらった
718.0,720.0,気がするんだけど
720.0,722.0,俺女の子からチョコもらいましたって言ったっけ
722.0,724.0,あのチョコって俺男の子からもらった気がするんだけど
728.0,730.0,なんかこういうチロルチョコなんだよ
730.0,732.0,あれチロルチョコ
734.0,736.0,チロルチョコがそういうのあるんですよ
736.0,738.0,って言って
738.0,740.0,俺倍砂糖からもらったし
740.0,742.0,俺チョコレート倍砂糖からもらった話だっけ
746.0,748.0,チロルチョコあげてんじゃねえぞって
748.0,750.0,めぐみがツイッターでさ
750.0,752.0,そんなガチャガチャ俺のいねえところで楽しそうなことやってんだよ
754.0,756.0,逐一報告しろ俺に
756.0,758.0,そういうのは
760.0,762.0,いつも俺だけ置いてけぼり
768.0,770.0,あとさ
770.0,772.0,俺の
772.0,774.0,俺が解決
774.0,776.0,ピクミン3を9時間でクリアした
776.0,778.0,先輩が9時間でクリアした
778.0,780.0,っていう流れも燃料になった
780.0,782.0,めぐみるくがピクミン3を9時間でクリアした
782.0,784.0,って言って俺が
784.0,786.0,先輩が9時間でクリアしたって流れも
786.0,788.0,燃料になったってこと
788.0,790.0,先輩が9時間でクリアしたっていうのは
790.0,792.0,ネットで見たんだよ
792.0,794.0,調べてみろピクミン3スペース時間で
798.0,800.0,なんかたまたま
800.0,802.0,偶然が重なっちゃったんだな
802.0,804.0,たまたま
804.0,806.0,偶然が重なったんだな
808.0,810.0,えー
810.0,812.0,よかったー話さなくて
812.0,814.0,その時相当掲示板のコメ面白いこと
814.0,816.0,なってたんだろうな
818.0,820.0,見ればよかった
820.0,822.0,見ればよかった
822.0,824.0,お前ほんとそういう小さい嘘ぽんぽんつくな
824.0,826.0,嘘じゃないよなんかそれさ
826.0,828.0,ネットで調べてやったって言ったら
828.0,830.0,見てるほうが会えないみんなのために嘘ついてんだよ
830.0,832.0,それは
832.0,834.0,気づけいい加減優しさだって
834.0,836.0,いやこれさネットで調べたら9時間で終わるから
836.0,838.0,ってなったらつまんなくない
838.0,840.0,それ
842.0,844.0,配慮だぞ完全に
844.0,846.0,あなたたちに対する
846.0,848.0,オススメされてたーって言われたら
850.0,852.0,配慮配慮
858.0,860.0,数少ない女性視聴者からいきなりチョコもらった
860.0,862.0,チョコは女の子がもらったんだ
862.0,864.0,メグミルクじゃなかった気がする
864.0,866.0,てかもうはっきり言うとマスクしたブスだってか
866.0,868.0,わかんねーんだよ
868.0,870.0,こいつ男か女かわかんねーと思ったんだよ
870.0,872.0,絶対そうだよ
872.0,874.0,これ
874.0,876.0,言わせんじゃねーや
880.0,882.0,チロルチョコだよねあれね
886.0,888.0,覚えてねーわ
888.0,890.0,でもその辺がなんかごちゃごちゃになってたんだよな
890.0,892.0,なんでメグミルク燃えてんだろうってずーっと
892.0,894.0,誰かいろんな人に聞いて
894.0,896.0,情報収集して
896.0,898.0,なるほど
898.0,900.0,メグミルク加藤純一でググりは
900.0,902.0,ヤフー知恵袋に詳しく説明されてるぞ
902.0,904.0,わあいつの調べるぞ
906.0,908.0,まだ未だに俺は真相はわからない
910.0,912.0,この真相を
912.0,914.0,確かめに行くしかない
918.0,920.0,なかなか楽しそうなことになってんじゃねーかよ
922.0,924.0,どんだけ
924.0,926.0,うんこちゃんこと加藤純一さんと
926.0,928.0,関係について教えてください
928.0,930.0,よしちょっと見よう
932.0,934.0,俺自身もまだわかっていないところがあるからな
934.0,936.0,じゃあちょっと延長しとくか
936.0,938.0,なんでこんなくだらないことで延長しなきゃいけねーんだよ
940.0,942.0,パンコでかさ増ししてるみたいなのが
942.0,944.0,わくじゃねーかよ今回
944.0,946.0,なかなか面白そうだからでも
946.0,948.0,深々まで
948.0,950.0,深夜だからいいだろ別に
950.0,952.0,ガチャガチャうるせーこと言ったら
952.0,954.0,てめー深夜のノリにガチャガチャ言ってんじゃねーぞ
954.0,956.0,いつもの優しい
956.0,958.0,お前シンデレラですら12時過ぎたら
958.0,960.0,優しくなるつーのに貧乏なるつーのに
960.0,962.0,うんこちゃんに何求めてんだKSつーのに
962.0,964.0,そういえばKS系の
964.0,966.0,売ってるパソコン詐欺らしいなみたいなところから
966.0,968.0,話し取らせてくれ
968.0,970.0,うんこちゃんこと加藤純一さんとめぐみーるくさんの関係について教えてください
972.0,974.0,2月17日
974.0,976.0,2月20日
976.0,978.0,ネタで付き合っているとささやかれることありますが
978.0,980.0,実はないと思います
980.0,982.0,少し詳しく説明するとめぐみーるくちゃんがうんこちゃんのアシスタントととめる番組
982.0,984.0,その際に電話中して今度ピクミンスリーやってくださいと言った内容
984.0,986.0,うんこちゃんが伝えたのが一番のホットな
986.0,988.0,俺のせいにされてんじゃねーかよ
988.0,990.0,後になんとなくピクミンスリーをやろうかなと思い立った
990.0,992.0,うんこちゃんが実況を始めた際
992.0,994.0,ニコラジーの時ピクミンスリーやってくれたって言ったらやってくれたと
994.0,996.0,言った内容のツイートしたせいで
996.0,998.0,女性プラスツイーエモンといった男尊女卑的な
998.0,1000.0,本質を持つ信者エモンにとって
1000.0,1002.0,ユータ中のユータであったため延長しました
1002.0,1004.0,探偵のための登場などにより
1005.0,1007.0,なるほどね
1017.0,1018.0,すげーわかりやすいな
1018.0,1020.0,なるほどありがとう
1024.0,1026.0,へー
1026.0,1028.0,ちゃんと俺の中で消化できたわ
1028.0,1030.0,今
1030.0,1032.0,すごくちゃんと消化した
1035.0,1037.0,良い解説だったな
1042.0,1044.0,うんこちゃんこと加藤純一さんの
1044.0,1046.0,信者ファンの方はどうしてあんなにマナーが悪いんでしょうか
1046.0,1048.0,口も頭も悪いんでしょうか
1048.0,1050.0,私は暗示でもなんでもありません
1050.0,1052.0,ただ人間的に興味がある
1052.0,1054.0,お前俺のこと好きになってんじゃねーかよ
1056.0,1058.0,ただ私の目にはマナーの悪いように見えたので
1058.0,1060.0,今後一切関わりたくはないですけどね
1060.0,1062.0,存在する
1062.0,1064.0,存在する
1064.0,1066.0,えーと関わりたくない
1066.0,1068.0,ベストアンサー
1068.0,1070.0,関わりたくないと言っているところ申し訳ありませんが
1070.0,1072.0,よく加藤純一さんの放送を見ている私から回答をさせていただきます
1072.0,1074.0,加藤純一さんの信者は信者エモンと呼ばれる方ですね
1074.0,1076.0,マナーの良し悪しは
1076.0,1078.0,よくマナーが悪いと言われる
1078.0,1080.0,向こうの信者より少し良いくらいです
1080.0,1082.0,お前なんでちょっと見え張ったんだよ
1082.0,1084.0,向こうの信者より悪いだろ
1084.0,1086.0,なんで見え張ったの
1086.0,1088.0,おめーやっぱ戦争してんじゃねーかよ
1088.0,1090.0,早めに向こうの信者潰しとこうぜ
1090.0,1092.0,やっぱバチバチしてっから
1092.0,1094.0,左の元だろが
1094.0,1096.0,今月よりぶっ殺してほいよ
1096.0,1098.0,2、3人
1098.0,1100.0,バチバチしてんじゃねーかよ
1100.0,1102.0,ここで俺たち抜きにして
1102.0,1104.0,完全に
1104.0,1106.0,水面下で上放送寝回ししてんじゃねーかよ
1106.0,1108.0,視聴者等は
1108.0,1110.0,男女比9対1
1110.0,1112.0,加藤純一さんがよく女性の悪口を言うのが主な原因です
1112.0,1114.0,そしてその男性視聴者の半数が
1114.0,1116.0,童貞です
1116.0,1118.0,ちゃんと放送内でしたアンケートの結果
1118.0,1120.0,最近みんなに見せるか
1122.0,1124.0,最近みんな調子乗ってんじゃねーのか
1124.0,1126.0,もっと俺みたいに謙虚になってくれよ
1126.0,1128.0,なんでそんな調子に乗れるんだよ
1128.0,1130.0,おめーらは
1130.0,1132.0,羨ましいよほんと
1136.0,1138.0,見えてる?
1138.0,1140.0,しかし視聴者の中には
1140.0,1142.0,当たり前のように大殺自衛隊、元万引地位名
1142.0,1144.0,音楽の先生等がいたり
1144.0,1146.0,うんこちゃん窓の岩石の高さなどから
1146.0,1148.0,全員を一手くくりに頭が悪いとも言えません
1148.0,1150.0,あってるね
1150.0,1152.0,おそらくあなたはニコラジオを見てそのように感じたのでしょうか
1152.0,1154.0,あのようなコメントが荒れた中簡単に言うと
1154.0,1156.0,ゲストとの相性が悪さのせいですね
1156.0,1158.0,慎二愛門は加藤純一さんから強く影響を受けており
1158.0,1160.0,口が悪く思ったことをよく正直に言います
1160.0,1162.0,加藤純一さんの放送によると全く違うゲストの方が来て
1162.0,1164.0,ゲストの方が慎二愛門からは
1164.0,1166.0,あまりにも寒くて
1166.0,1168.0,は?寒だのコメントを打ったのでしょう
1168.0,1170.0,ゲストの方が慎二愛門から見て
1170.0,1172.0,もっと面白く感じていれば
1172.0,1174.0,お前が嫌いなだけなのかよ
1174.0,1176.0,なんでちょいちょいあいつディスるの
1176.0,1178.0,俺をあげるだけでなく
1178.0,1180.0,どっかしらで
1180.0,1182.0,向こうを間接的にディスっていくみたいな
1182.0,1184.0,印象操作していくみたいな
1184.0,1186.0,慎二愛門は自分たちがゴミだという自覚はありますが
1186.0,1188.0,言いたいことをはっきり言います
1188.0,1190.0,おーいいじゃん
1190.0,1192.0,これいいじゃん
1192.0,1194.0,お前が嫌いなだけなのかよ
1194.0,1196.0,なんでちょいちょいあいつディスるの
1196.0,1198.0,なんか
1198.0,1200.0,俺をあげるだけでなく
1200.0,1202.0,これいいじゃん
1202.0,1204.0,我々は自分たちがゴミだという自覚はありますが
1204.0,1206.0,言いたいことをはっきり言います
1206.0,1208.0,これいいじゃん
1208.0,1210.0,うちのゴミのいいコンセプトだな
1210.0,1212.0,調子に乗っちゃダメってことだよな
1212.0,1214.0,俺含め
1214.0,1216.0,いい
1216.0,1218.0,これはちゃんともう一回肝に命じようぜ
1218.0,1220.0,なんか
1220.0,1222.0,俺今日見て思ったのが
1222.0,1224.0,今日ねニコラジー
1224.0,1226.0,俺が公式
1226.0,1228.0,レギュラー出てる公式の
1228.0,1230.0,女の子のタネントちゃんが来たの
1230.0,1232.0,で
1232.0,1234.0,その子ため口で話すよみたいな
1234.0,1236.0,その
1236.0,1238.0,キャラなのか本心なのかちょっと伏せておくけど
1238.0,1240.0,人が来て
1240.0,1242.0,放送開始前に
1242.0,1244.0,女は敬語使えよ
1244.0,1246.0,っていうコメントがあったのね
1246.0,1248.0,そこだけでいやいやゲスト敬語使えよ
1248.0,1250.0,だけだったら
1250.0,1252.0,いやお前も使えよってなるけど女は
1252.0,1254.0,っていうところで自分が完全に
1254.0,1256.0,もう男尊女卑
1256.0,1258.0,思考を押し付けてるじゃん
1258.0,1260.0,それって整合性取れてるじゃん
1260.0,1262.0,俺は男お前は女
1262.0,1264.0,俺は男の方が偉いと思ってるから
1264.0,1266.0,お前敬語使えよってさあるし
1266.0,1268.0,間違ってはいるけど
1268.0,1270.0,筋は通ってるじゃん筋は
1270.0,1272.0,まぁそういう
1272.0,1274.0,ことなんだろうなって今ふと思ったわ
1276.0,1278.0,逆だけのものです
1280.0,1282.0,信者エモンってニコ生のガンじゃないですか
1282.0,1284.0,だよなとかいうコメも正直寒い
1284.0,1286.0,加藤純一さん全くない
1286.0,1288.0,おいてめえなんで女は敬語使ってねえんだよ
1288.0,1290.0,おいこの野郎てめえおい
1290.0,1292.0,ふざけんじゃねえ
1292.0,1294.0,俺のこと加藤純一さんと呼べバカこの野郎
1298.0,1300.0,ふざけんなよ
1300.0,1302.0,くそしゃらくせえわ
1302.0,1304.0,いい俺について褒めてるやつ
1304.0,1306.0,見よう
1306.0,1308.0,俺について褒めてるやつ
1310.0,1312.0,最近加藤純一さんの放送見始めた女です
1312.0,1314.0,加藤純一はかっこいい
1314.0,1316.0,なんでてめえ敬語使わねえんだよおい
1318.0,1320.0,加藤純一さんだろうがよ
1320.0,1322.0,一行前まではリスペクトにあふれてたのに
