start,end,text
0.0,9.5,【早送り】
9.5,10.0,【咳払い】
10.5,11.5,飯食おうや
13.5,14.5,飯を食わんと
15.5,16.5,飯を食わんことには
17.0,18.5,全てが始まらないと
21.5,23.5,ただなんか今日あんまり食いてる気分じゃねえんだよな
24.5,25.5,ホットドッグ食べちゃった
27.5,29.0,枠取って気付いたけどさ
29.0,31.0,ニコ生で雑談するの久々じゃねえ
32.0,33.0,今日のご飯のコーナー
33.0,35.0,明太子ときのこの和風パスタ
36.0,38.0,最近のニュース教えてくれよ
43.0,45.0,やべ酒買ってくれよかった
48.0,49.0,最近のニュースを
51.0,53.0,北朝鮮に横浜見てアイスを
53.0,54.0,負けたの?
55.0,56.0,俺たちの英雄が
56.0,57.0,俺たちの英雄が
59.0,60.0,みんなハイストしちゃったの
61.0,62.0,嘘だろ
65.0,67.0,罰金20万万額
70.0,73.0,これから民事でさらにガッツリいかれるんじゃねえの
74.0,75.0,かわいそうに
76.0,77.0,本当は全然思ってねえけど
82.0,83.0,負けちゃったんだ
83.0,84.0,まあ負けると思ってたけど
84.0,86.0,悪い全然感情込められない
86.0,87.0,どうでもいいから
89.0,90.0,もっとなんか
91.0,93.0,初めて人殺したときの感覚みてえな
93.0,94.0,もっと悲しむと思ったんだけどなって
95.0,97.0,インターネット上の生放送番組の配信で
97.0,99.0,政権を立てる男39歳
100.0,102.0,自面に表すとやっぱ俺たちっていてえな
103.0,104.0,痛さ100倍
108.0,110.0,俺兼ねてから言ってるけど
111.0,113.0,起こしていい犯罪と起こしていけない犯罪ってあると思うんだよ
114.0,116.0,例えばレイプとか殺人とかって
116.0,117.0,どう考えてもアウトじゃん
118.0,119.0,なんかさあ
120.0,122.0,美顔期に陰謀入ってて有罪になるって
122.0,123.0,なんか
123.0,125.0,なんか攻めらんねえんだよなあ
125.0,127.0,攻め所が少ねえんだよなあ
127.0,128.0,受けちまう
130.0,131.0,受けちまわねえ
132.0,134.0,だせえつけ面白くない?
135.0,136.0,いただきます
138.0,139.0,うーん
140.0,142.0,でもそんなに善かつくって最悪だよね
151.0,152.0,なんかしょうもねえわ
153.0,154.0,しょうもねえなって
155.0,156.0,よく
156.0,158.0,そこまでなんか争うってことは
158.0,159.0,人生終わらせたいんだろうね
161.0,162.0,だってたかなかさあ
163.0,165.0,言っても影響力なんか別にそんなないでしょ
166.0,168.0,俺だって暗黒放送10年やってるから
168.0,170.0,俺だって暗黒放送全部見てるけどさあ
171.0,173.0,どこの会社の美顔期かなんて
173.0,174.0,それでなんか美顔期
174.0,176.0,そこの会社の美顔期変わんねえなんて思わない
176.0,178.0,いいじゃん大半の人間は
179.0,181.0,完全に人生つませに来てるよね
187.0,188.0,そこがウケるわ
191.0,193.0,そうまず美顔期って何って感じだよね
199.0,201.0,弁護士煽ったから
201.0,203.0,えーいろんな
203.0,205.0,違うよ裏にマゼがいるから
205.0,207.0,お金いくら使ってもよいんだよネタになる
207.0,209.0,俺ねそれ聞いたのねえ
210.0,213.0,そのマゼってやつ何なんすかって聞いたら
213.0,216.0,なんかあの人本当に金もらってないらしいの
216.0,219.0,で言えばいいじゃん放送でつって
220.0,222.0,別にさ金もらってねえんだったらさあ
222.0,224.0,言えばいいじゃん俺もらってないよつって
224.0,226.0,加藤でもなあ俺が言ってもみんな信じてくれねえんだよ
226.0,228.0,浮気しちゃったしつって
228.0,230.0,浮気が大引いてるらしい
230.0,232.0,浮気してしまったから
232.0,235.0,その社会的な信用が落ちてるっていう自覚があるらしい
235.0,237.0,俺本人がちゃんと聞いたもん
238.0,240.0,マジでもらってないっすよね多分つって
240.0,242.0,あの人そういう知恵回んねえから
242.0,244.0,知恵遅れだから知恵回んねえのね
244.0,246.0,別にさうまいこと裏でもらってんのかなと思ったら
246.0,248.0,本当にもらってないらしくて
248.0,250.0,ただ信じてもらえないつってんだ
252.0,254.0,お前も騙されてるぞ
254.0,256.0,いやなんかそう
256.0,258.0,俺もねそう思ってたんだよ
258.0,260.0,違うんだよマジで
260.0,262.0,マジでIQ低いんだよ
262.0,264.0,LINEとかしてて分かるの
264.0,266.0,本当に日本語通用しないの
266.0,269.0,先輩が喋れないんじゃなくて親の横山みどりが喋れないんだよ
271.0,273.0,不倫した時はすぐバレてたじゃん
275.0,277.0,バレるだろ
278.0,280.0,なんかよく分かんねえけど
280.0,282.0,多分本人少なくとも自覚はないんじゃない
282.0,284.0,自覚はないっぽいよ
287.0,289.0,らしい
289.0,291.0,裁判官とも会話できてなかったらしい
292.0,294.0,そうだよな
294.0,296.0,俺とも会話が成り立たないってことはさ
296.0,298.0,裁判官になるのってもっと難しい
298.0,300.0,頭いい人じゃん
300.0,301.0,余計噛み合わないんだよ
301.0,302.0,こいつは何を言ってるんだよ
302.0,304.0,ふざけてるのかって
304.0,306.0,思ってるんだろうな
306.0,308.0,思われてるんだろうな
309.0,311.0,船越栄一郎バイアグラ100ミリグラムの剣について
311.0,313.0,なんか松井和夫が
313.0,315.0,なんか気狂っちゃったんでしょ
315.0,317.0,俺まだその動画見てないんだけど
317.0,319.0,やばい動画を出したんじゃないの
324.0,326.0,youtubeに上げたの
328.0,330.0,見てまじでやばいでしょ
332.0,334.0,でもあの人なんかちょっと前からそういう
335.0,337.0,ケアっていうか
337.0,339.0,ケアったよね
343.0,345.0,そういうキス金備えてない?
349.0,351.0,いやだからさ
351.0,353.0,わかんないその問題何もわかんないけど
355.0,357.0,結婚する女っつーは本当に
357.0,359.0,本当に選ばなきゃいけないよな
359.0,361.0,結婚する女って
361.0,363.0,みんな独身でしょ
363.0,365.0,この中の結婚してる人いる?
365.0,367.0,みんな
367.0,369.0,本当に結婚する女って選ばなきゃいけないよね
369.0,371.0,人生めちゃくちゃにされるじゃん
373.0,375.0,本気で
377.0,379.0,ヒステリックな歓励のボバ
379.0,381.0,いや女って
381.0,383.0,ああいうところまじであるからね
383.0,385.0,7割
387.0,389.0,7割ぐらいの女性が
389.0,391.0,ああいう側面持ってるからね
391.0,393.0,本気で
393.0,395.0,ヒステリック里田舞は持ってない
395.0,397.0,唯一だな
397.0,399.0,いやでも里田舞も貧乏
399.0,401.0,まーくんがこのままクビになって借金抱えたらああなるだろうな
401.0,403.0,男ってさあんまヒス的な要素なくない?
407.0,409.0,だから
409.0,411.0,俺が結婚を相手に求める条件
411.0,413.0,別に俺美人じゃなくてもいいんだよ本当に
415.0,417.0,性的な欲求は風俗で俺ごまかせれるから
417.0,419.0,生活と情緒が安定している
419.0,421.0,女の子じゃないと
421.0,423.0,俺結婚したくないってよく言うじゃん
423.0,425.0,だから生主とかは嫌だって
425.0,427.0,エッチするだけだったらいいけど
427.0,429.0,生主同士で結婚とかさ
429.0,431.0,両方とも生活と情緒
431.0,433.0,安定してるじゃん
433.0,435.0,俺今狙ってんの伊藤朝子
435.0,437.0,伊藤朝子と大久保香子
437.0,439.0,この二人だな
439.0,441.0,今俺が一番結婚したい女
441.0,443.0,でそのーまあ
445.0,447.0,頑張って稼いで
447.0,449.0,いやでも下手じゃないああいう女と結婚しろって
449.0,451.0,俺親父に言われてんだって
451.0,453.0,本当に
455.0,457.0,なんかね
457.0,459.0,生活と情緒が
459.0,461.0,いるか周りに情緒が
461.0,463.0,安定してる女って
463.0,465.0,いなくない
465.0,467.0,誰かいるじゃあ生主誰かいる
467.0,469.0,この子情緒すっげえ安定していつも見ても
469.0,471.0,なんか
471.0,473.0,凛としてるなって本当にいなくない
473.0,475.0,ネタじゃなくて
475.0,477.0,誰一人いなくない俺今まで一人も見たことないんだけど
477.0,479.0,朝の光が一番
479.0,481.0,情緒安定してるわ
481.0,483.0,あの人は
483.0,485.0,情緒安定してる
485.0,487.0,もうてか34、5で
487.0,489.0,もうねいろいろ諦めなきゃいけない年齢だから
489.0,491.0,いやまだ
491.0,493.0,情緒安定してる方だよ年齢的な要素も高いけど
493.0,495.0,あの人は安定してるまだ
495.0,497.0,まだあれで安定してる方だよ
497.0,499.0,で他のさ若いやつらってさ
501.0,503.0,もうきちがいでしょ
503.0,505.0,みんな
505.0,507.0,高橋マーサーも好き
507.0,509.0,生主じゃねえだろ
511.0,513.0,生主じゃねえだろ
515.0,517.0,まだ一番
517.0,519.0,まだ安定してる方だな誰も知らねえわ
519.0,521.0,この人生活と情緒安定してるな
521.0,523.0,っていう人
525.0,527.0,だから俺は生主と恋愛は絶対できない
529.0,531.0,他人の秘密暴露しまくってるやつが
531.0,533.0,安定してるとかまだ安定してんじゃない
533.0,535.0,なんかそんな
535.0,537.0,なんていうのかな
537.0,539.0,なんかちょっとね
539.0,541.0,あの自分が
541.0,543.0,なんかかわいいって言ってほしくて
545.0,547.0,なんかちょっといい角度でカメラ設置して
547.0,549.0,みんなの
549.0,551.0,なんかあのコメントで
551.0,553.0,シャワー浴びて気持ちよくなってる
553.0,555.0,顔出し生主に比べたら
555.0,557.0,俺まだ安定してると思うわ
557.0,559.0,じゃなかったらあんな花ぼらおっぴろげて配信できねえだろ
559.0,561.0,はははは
561.0,563.0,吸い込まれそうなんだろあれ
563.0,565.0,あれでポケモンの歌作ろうぜ
565.0,567.0,なんだかんだとあーだこーだで朝の光で
569.0,571.0,あれロケット団登場するとき
571.0,573.0,朝の光の花ぼらから登場させようぜ
575.0,577.0,安定してる方だよまだ
583.0,585.0,まあなんか男いたれ
585.0,587.0,結局さあまああいつ美人じゃん
587.0,589.0,もう正直に言うと
589.0,591.0,だから
591.0,593.0,最悪結婚すればいいなっていう
593.0,595.0,女のなんかそういう考えがあるからだよ
595.0,597.0,タチ悪いのはやっぱ
597.0,599.0,誰だろうな
599.0,601.0,あんま女の名前知らねえからな
603.0,605.0,あれウキョチも安定してる
605.0,607.0,なんでかって言うとあいつ絶望的なブズだから
607.0,609.0,結婚とか男にモテようと考えてないじゃん
609.0,611.0,だから
611.0,613.0,そういうの捨ててるでしょ
613.0,615.0,だから
615.0,617.0,安定してるんだよ
617.0,619.0,あいつもう
619.0,621.0,情緒揺さぶるじゃん
621.0,623.0,あいつ恋愛できないじゃんもう一生
623.0,625.0,インターネット建てて香川のしょんべん飲んだって
625.0,627.0,俺が広げちゃってるし
627.0,629.0,あの子は安定してるわ
629.0,631.0,ゲーム実況者だったら一番安定してる
633.0,635.0,うん
637.0,639.0,好きとかじゃなくて安定してるでしょ
639.0,641.0,安定してねえか
641.0,643.0,安定してるわ
647.0,649.0,ディスって言うんじゃなくて安定してるじゃん
649.0,651.0,いつもまあ
651.0,653.0,あれで
653.0,655.0,普通できねえよ
655.0,657.0,裸とか晒されてお前
657.0,659.0,はいみなさんこんにちは
659.0,661.0,みたいなことできねえよ
661.0,663.0,普通だったら俺があいつだったら自殺してるもん
663.0,665.0,あのー
665.0,667.0,沖縄行って自殺の名所で
667.0,669.0,できねえぞ
673.0,675.0,言っとくけどお前も情緒
675.0,677.0,いや俺意外と情緒安定してる
677.0,679.0,なんでかっていうと俺って
679.0,681.0,結局戻れる病院があるから
681.0,683.0,っていうのがかなりでかい
683.0,685.0,そういうのがない人たちって
685.0,687.0,例えばモコウとかってちょっと揺らぐときあるでしょ
687.0,689.0,完全に
689.0,691.0,そういう
691.0,693.0,なんていうのかなやっぱ戻れる場所があるっていうのは
693.0,695.0,たぶんね人生においてね
695.0,697.0,人生においてね全然違うんだよ
697.0,699.0,だってこれでさ俺さ
699.0,701.0,もうネットでしか生きていけないってなったら
701.0,703.0,やっぱ多少
703.0,705.0,情緒不安定になるもん
705.0,707.0,だってこの暮らし
707.0,709.0,40年してからいけるんだよモコウ
709.0,711.0,あと40年
711.0,713.0,あいつYouTuberにだけいけないんだよ
715.0,717.0,やばいだろそうやって考えると
717.0,719.0,きつくない
719.0,721.0,って
721.0,723.0,ふとしたときに
723.0,725.0,思ったときにやっぱ人間って病むんだよ
729.0,731.0,俺なんだかんだでやっぱ
731.0,733.0,つながりまだ全然あるし
733.0,735.0,最悪親の子にも
735.0,737.0,入れるし
737.0,739.0,それは俺が15歳の時から
739.0,741.0,考えてた人生設計通りだから
741.0,743.0,それはもう俺がしてやったり
743.0,745.0,っていうだけだよ
745.0,747.0,俺なんか自分で起業したいなって思ったときに
747.0,749.0,復職できる仕事ないかなって
749.0,751.0,お母さんに聞いて
751.0,753.0,病院じゃないって言われて
753.0,755.0,俺一応30までは
755.0,757.0,やってきたからさ
757.0,759.0,未だにちゃんとバイトもしてるし
759.0,761.0,いや
761.0,763.0,態度立てない
763.0,765.0,今のご時世そういうのって
765.0,767.0,ナンセンスだと思うわ
767.0,769.0,綺麗事だけじゃ飯って
769.0,771.0,食っていけねえじゃん
771.0,773.0,多分
773.0,775.0,そういう意味ではまだ
775.0,777.0,本当だと思うよ
777.0,779.0,あんまり不協の煽りも受けないし
783.0,785.0,ちゃんとバイトしてます
787.0,789.0,病院でバイトしてるよ
789.0,791.0,まあ趣味だけどな
791.0,793.0,本当に
793.0,795.0,普通に通常勤務に戻る気はないのか
795.0,797.0,まあ
797.0,799.0,戻ろうと思えば戻れるんだけどね
799.0,801.0,定期的に帰ってくればっていう
801.0,803.0,連絡が来るし
803.0,805.0,椅子は今濁してるんだよな
805.0,807.0,体調的な問題
807.0,809.0,俺夜勤できねえから本気で
809.0,811.0,夜勤禁止されてるから
811.0,813.0,居場所がねえんだよ
813.0,815.0,居心地悪いのね
815.0,817.0,ガッツリ管理職ついたら
817.0,819.0,もう配信とか絶対できないし
819.0,821.0,死ぬから
821.0,823.0,リアルに
823.0,825.0,そこはもう宿命だよね
827.0,829.0,どうやって生きていくかな
829.0,831.0,日勤だけで
831.0,833.0,まあ手取り
833.0,835.0,なんか家族が暮らせる分くらい
835.0,837.0,もらえればいいかなと
837.0,839.0,お前管理職
839.0,841.0,俺言っとくけど27で主任やってたんだぞ
841.0,843.0,27から28まで
843.0,845.0,1年間
845.0,847.0,手当500円でやってたんだぞ月々
847.0,849.0,消費報酬に
851.0,853.0,マジでやってたんだぞ
855.0,857.0,いくら?2500円だけど月々
857.0,859.0,クソみてえな
859.0,861.0,手当てで
861.0,863.0,主任ってどんなの
863.0,865.0,通常の企業で言うと
865.0,867.0,なんだろうな
867.0,869.0,係長の1個下
869.0,871.0,係長の1個下って何
871.0,873.0,係長
873.0,875.0,課長部長
875.0,877.0,班長?
877.0,879.0,なんか
879.0,881.0,一般企業の
881.0,883.0,主任ってポストないの?
883.0,885.0,主任ってポストないの?
885.0,887.0,でもすごくないよ
887.0,889.0,管理職
889.0,891.0,ザ中間管理職
891.0,893.0,すごくもなんともない
893.0,895.0,本当に
895.0,897.0,俺以外の奴らが全員やめたから
897.0,899.0,俺になすりつけられただけで
899.0,901.0,えらくもなんともない
901.0,903.0,能力あったわけじゃなくて人一倍根性があっただけ
903.0,905.0,全員やめたんだよ
905.0,907.0,俺より上
907.0,909.0,全員やめたんだよ
909.0,911.0,俺より上が全員病んでやめてって
911.0,913.0,俺が主任だったんだよ
913.0,915.0,能力あったわけじゃなくて生き残っただけ
915.0,917.0,根性だけ
917.0,919.0,研修みたいのあったね
923.0,925.0,とんでもねえ職場だったわ
925.0,927.0,俺いじってもやめなかったからクソいじめられてたけど
927.0,929.0,無視して
929.0,931.0,配信したかったから
931.0,933.0,付き合いとかも全部なくしたかったから
933.0,935.0,誘われねえし
935.0,937.0,仕事中しごする奴俺大っ嫌いだから
937.0,939.0,雑談とかしたくなかったのね
939.0,941.0,だからその
941.0,943.0,俺主任だったのに
943.0,945.0,仲が悪くて
945.0,947.0,それで
947.0,949.0,係長経由で俺に
949.0,951.0,仕事が
951.0,953.0,任命され
953.0,955.0,連絡が来てたから
955.0,957.0,上司との
957.0,959.0,関係性がすごく希薄だったのね
959.0,961.0,変な付き合いもなかったし
961.0,963.0,ただ俺その話したよね
963.0,965.0,なんかさ
965.0,967.0,今思うけどよくニコ生続けてたんだ
967.0,969.0,配信してなかったもん週2くらいだったもん
969.0,971.0,やめるとき
971.0,973.0,本当にやめる
973.0,975.0,1ヶ月2ヶ月くらい前に
975.0,977.0,飲みに行こうって言われて
977.0,979.0,5年間
979.0,981.0,俺を無視し続けた課長に
981.0,983.0,飲みに行こうって言われて
983.0,985.0,グループで飲みに行ったわけよ
985.0,987.0,加藤君は
987.0,989.0,私のこと嫌ってるから
989.0,991.0,みたいな
991.0,993.0,話をしたから
993.0,995.0,そんなことないです僕は
995.0,997.0,性格は好きじゃないけど
997.0,999.0,仕事してる
999.0,1001.0,あなたが尊敬してますよ
1001.0,1003.0,だから別に僕は仕事中
1003.0,1005.0,逆らったことは一度もないでしょって
1005.0,1007.0,だってもう
1007.0,1009.0,明らかにお互い
1009.0,1011.0,そこで嘘つくのって
1011.0,1013.0,余計ダメだと思ったんだよ
1013.0,1015.0,明らかにお互い避けてるんだから
1015.0,1017.0,そこ腹減って喋ろうと思って
1017.0,1019.0,仕事してるあなたがすごいかっこいいですよ
1019.0,1021.0,今だって委員長やってるからねその人
1021.0,1023.0,副委員長やってるからねとある場所で
1024.0,1026.0,www
1027.0,1029.0,明らかに訌けたわ
1029.0,1031.0,今日裁判負けたわまた飯お食いに行くぞ
1031.0,1033.0,みたいな
1035.0,1037.0,一応これ
1039.0,1041.0,なんで上から
1041.0,1043.0,むせるの
1043.0,1045.0,また飯食いにいこうよ
1045.0,1047.0,とかじゃなくてまた飯食いに
1047.0,1049.0,チューチューから行くぞみたいな
1049.0,1051.0,コミュニケーション取れてんだよ
1053.0,1055.0,「飯食いに行くぞ!」
1055.0,1056.5,wwww
1056.5,1058.5,負けたから行くぞ!みたいな
1058.5,1060.0,なんか、わかるだろ!
1065.0,1066.5,怒ってやるべ、じゃあ
1066.5,1068.0,シュガ行くぞ!みたいな
1070.5,1072.5,中国人の方が喋れるからな、今
1077.0,1078.5,で、あれなんだよね
1079.5,1081.0,30くらいになってくるとさ
1081.0,1084.0,うわ、こういう理由で怒ってたのか、とかさ
1086.5,1088.0,なんかそういうのが
1088.5,1090.0,出てくんだよな
1091.5,1093.0,やっぱ環境が変わるからね
1095.0,1097.0,優しいのってすごいさ
1097.5,1098.5,ずるいじゃん
1098.5,1100.0,会社のためにならないじゃん
1101.0,1103.0,会社のためにならねえだろ
1103.5,1105.0,コメ部更新するわ
1105.5,1107.0,ねえ、ちょっとだから
1107.0,1108.5,名前だけの主人だったけど
1108.5,1110.0,あれは勉強になったわ
1111.0,1112.5,で、次行ったところは
1112.5,1114.0,めっちゃホワイト企業で
1114.0,1115.0,手取り36万
1115.0,1116.5,日金だけで
1116.5,1119.5,くじごじで手取り36くらいもらってたんだけど
1120.5,1121.5,なんかね
1121.5,1124.0,役職つけられそうになってやめたわ
1124.0,1126.0,ほんとに病院で役職つくことって
1126.0,1127.5,マイナスしかないのね
1128.5,1130.5,出世もできないし
1131.5,1133.0,労働時間増えるし
1134.5,1137.0,残業ももちろん無料だし
1137.0,1138.0,会議出なきゃいけないし
1138.0,1139.0,出張も増えるし
1140.0,1141.0,うわーちょっと
1141.0,1143.0,厳しいなーっつって
1143.0,1144.0,やめたわ
1144.5,1146.0,あと不正名が出てきた
1146.5,1148.0,役職出世しないよ基本
1148.5,1150.5,よっぽどコメ売れば話は別だけどね
1152.5,1153.5,給料変わんねえし
1154.0,1155.0,あれ、コメ部消えちゃった?
1157.0,1159.0,だから一般社会で言う
1159.0,1161.5,なんかその役職とはほんとに違う
1161.5,1163.0,あれ、なすりつけ合いだから
1163.5,1165.0,年齢30越えてて
1165.5,1167.0,言うこと聞くやつ
1167.0,1168.0,ほんとにあと
1168.0,1170.5,あと精神に異常がないやつ
1172.0,1175.0,あの情緒がある程度保たれてるやつだったら
1175.0,1176.5,能力関係なし
1177.5,1178.0,マジで
1182.0,1183.0,マジで関係ない
1186.5,1187.0,ほんとに関係ない
1187.0,1188.5,これもう声を大事にしているわ
1188.5,1190.5,だからその額がないやつは
1191.5,1192.5,病院で働いた方がいいんだよ
1192.5,1193.5,どうやったら出世するの
1193.5,1195.0,ほんとに上にコメ売れるしかない
1195.5,1197.0,気に入られたやつ
1198.5,1199.5,気に入られたやつ
1199.5,1201.0,なんかその
1202.0,1203.5,数字で評価できないじゃん
1204.0,1206.5,社会ってさほとんどが
1207.0,1208.0,その対外的な評価ってさ
1208.0,1210.0,全部数字で評価されるでしょ会社って
1210.5,1211.5,病院ってそこがしづらいんだよ
1211.5,1212.0,上の人たち
1212.5,1215.5,あの経営者とかはもう数字しか考えてないんだけど
1217.0,1220.0,いざさ数値化しづらい部分だから
1220.0,1222.0,やっぱ人間性なんだよな
1223.5,1225.0,公務員だって結局数字じゃん
1226.0,1228.0,うん、学校の先生しかあり
1229.0,1230.0,あ、でもあれか
1232.0,1233.0,そう、だから
1234.0,1235.0,あれなんだよな
1235.0,1236.0,気に入られるか
1236.0,1237.0,それか
1237.0,1239.0,圧倒的ななんか人間性
1240.0,1241.0,人間性、まあそうだ
1241.0,1242.0,どこもそうだよね
1244.0,1245.0,そう
1245.0,1247.0,誰とやりやすいかで決められちゃうんだよな
1247.0,1249.0,病院の人事ってクソ無能だよ
1250.0,1251.0,ゴミ無能だよ
1252.0,1252.5,スッ
1254.0,1257.0,俺ね、職場ではめちゃめちゃ上手く立ち回ってたかな
1257.0,1258.0,あのー
1258.0,1261.0,俺社交辞令すごい得意なのね
1262.0,1263.0,例えば飲み会行った時も
1263.0,1265.0,ただ断るんじゃなくて
1265.0,1267.0,ごめんなさいちょっと用事があるんで
1267.0,1269.0,でもぜひ皆さんと乾杯だけしたいんで
1269.0,1271.0,ちょっと10分だけ出ますねって言って
1271.0,1273.0,無理やり言ってる勘出して
1273.0,1275.0,本当は帰ってすぐタクシー帰って配信するとか
1275.0,1277.0,あのちょっと予定があるんで
1277.0,1278.0,あの絶対
1278.0,1280.0,気悪くはさせてなかった
1281.0,1284.0,あと挨拶とかもちゃんとしたし
1285.0,1286.0,いや大事大事
1286.0,1288.0,ジジイとかババアとかって結構大事だから
1293.0,1294.0,え、なんで10分くるやつ
1294.0,1296.0,なんで金払ってさ乾杯だけして
1296.0,1297.0,すいませんって
1297.0,1298.0,しかも10分って言いながら
1298.0,1300.0,10分ちょうどで帰るわけじゃないよ
1300.0,1301.0,30分とかで
1301.0,1303.0,ごめんなさいちょっとこの後予定があるんですよ
1304.0,1307.0,そういう気遣いみたいなのってやっぱ
1307.0,1308.0,やられて
1309.0,1311.0,嫌じゃないしね
1311.0,1312.0,だってさ
1312.0,1313.0,みんなさ
1313.0,1314.0,今歳X25
1314.0,1316.0,まぁ30くらいのやつも見てると思うんだけどさ
1317.0,1319.0,後輩とかを誘ってさ
1319.0,1321.0,いやちょっとすいません行けないっす
1321.0,1322.0,って言われるよりは
1322.0,1324.0,あーかつのちょっと予定あるんですけど
1324.0,1326.0,ちょっとだけ来ませんって言われると
1326.0,1327.0,すっげー嬉しくない?
1328.0,1330.0,そういうのが多分
1330.0,1331.0,なんか
1331.0,1332.0,仕事のやりやすさに
1334.0,1335.0,繋がっていくんじゃないかなって
1335.0,1336.0,俺は思うけどね
1338.0,1340.0,それすげー嬉しくない?
1340.0,1341.0,嬉しいよね
1341.0,1343.0,俺すげー嬉しいんだよな
1344.0,1345.0,ちょっと行きましょう
1345.0,1346.0,ちょっとご飯食べ
1346.0,1347.0,飲めないんですけど
1347.0,1348.0,ちょっと飯一緒に食いたいっすわ
1348.0,1349.0,みたいなのが
1351.0,1353.0,可愛い後輩だなって
1354.0,1355.0,だから
