start,end,text
1355.0,1357.0,そういうのが大事なんじゃないかなと
1358.0,1360.0,次誘いたいなって
1360.0,1362.0,金はいくら払うのか
1362.0,1364.0,それはちゃんと払わなきゃダメでしょ
1365.0,1367.0,ちゃんと払わなきゃダメでしょ
1368.0,1369.0,使ったほうがいいよ
1371.0,1372.0,先輩にはやっぱ
1372.0,1373.0,多少媚び売ってたほうがいいわ
1375.0,1376.0,先輩には
1376.0,1378.0,上司に飯を送るよって言われるから
1378.0,1379.0,そこまで言えたら
1379.0,1381.0,クソ可愛がられるだろうね
1381.0,1383.0,えーちょっと飯食い行きましょうよ
1383.0,1385.0,みたいなやつって可愛がられるじゃん
1385.0,1386.0,そんなのって言えないくらい?
1387.0,1389.0,非常識なやつって可愛がられない
1390.0,1391.0,非常識なやつって
1392.0,1394.0,だから一応
1394.0,1396.0,やめずに
1396.0,1398.0,逃げるまではやめずに
1398.0,1400.0,一応管理職だったからな
1400.0,1402.0,ある一定の評価はもらってたんじゃない
1406.0,1408.0,飲み会の頻度によれば収断もないでしょ
1408.0,1410.0,月一とかでしょ
1410.0,1411.0,たまには出なきゃダメじゃん
1411.0,1413.0,あと勉強会には全部参加したし
1413.0,1415.0,なんなら
1415.0,1417.0,本来出なくてもいいのに
1417.0,1419.0,勉強会に出なきゃダメじゃん
1419.0,1421.0,だから
1421.0,1423.0,本来出なくてもいいであろう勉強会に
1423.0,1425.0,休みの日に
1425.0,1427.0,教育係って
1427.0,1429.0,来年から働くやつのために
1429.0,1431.0,これ極意
1431.0,1433.0,教育係って絶対いるじゃん
1433.0,1435.0,その会社の
1435.0,1437.0,肝を握ってる人材が多いのね
1437.0,1439.0,絶対中枢人物が
1439.0,1441.0,関わってるから
1441.0,1443.0,自分の休みの日にあえて出て
1443.0,1445.0,二年目とか三年目で
1445.0,1447.0,一年生の勉強会に出て
1447.0,1449.0,手を挙げて
1449.0,1451.0,勉強会の雰囲気を和ますって役を
1451.0,1453.0,ずっとやってたのね
1453.0,1455.0,それで上の人たちが
1455.0,1457.0,あいつ何なのって
1457.0,1459.0,次の勉強会も来てくんないって
1459.0,1461.0,委員長に名前覚えてもらって
1461.0,1463.0,飲み会に参加して
1463.0,1465.0,それすごかったな
1465.0,1467.0,一番効果があった
1467.0,1469.0,勉強会に出ることによって
1469.0,1471.0,自分の勉強にもなるじゃん
1471.0,1473.0,何か質問のある人って言われて
1473.0,1475.0,俺も講師とかやったことあるんだけど
1475.0,1477.0,何か質問のある人いますかとか
1477.0,1479.0,こういうところでどう思いますかって
1479.0,1481.0,手挙げてくれるやつって
1481.0,1483.0,マジ神様なのね
1483.0,1485.0,絶対誰も挙げないのね
1485.0,1487.0,次行きましょうってなるんだけど
1487.0,1489.0,そこではいありますって一人言うと
1489.0,1491.0,じゃあ加藤さんって言われて
1491.0,1493.0,これこういうことなんですかって聞いて
1493.0,1495.0,じゃあ他にありますかって言うと
1495.0,1497.0,絶対挙げてくるの
1497.0,1499.0,そうするとその勉強会の雰囲気って
1499.0,1501.0,めっちゃいい雰囲気になるのね
1501.0,1503.0,そんなやつやってるやつ一人もいないから
1503.0,1505.0,加藤くんちょっと
1505.0,1507.0,この勉強会ちょっと出てくんない?
1507.0,1509.0,みたいな感じで先生とかから
1509.0,1511.0,声かかるようになるわけよ
1511.0,1513.0,そうするとなんか
1513.0,1515.0,名前覚えてもらって
1515.0,1517.0,これマジで
1517.0,1519.0,本当に使った方がいいよ
1519.0,1521.0,本当に出世したいっていう人は
1521.0,1523.0,俺はそういう
1523.0,1525.0,気もいて使ってたわ
1527.0,1529.0,いやでもやりすぎるぐらいはちょうどいいと思う
1529.0,1531.0,別にだって本当に質問したい内容があったら
1531.0,1533.0,どういうわけなんですかって
1533.0,1535.0,そういうな得意用の歌もあっただろ
1535.0,1537.0,そんなことできない
1537.0,1539.0,俺もすっげえ人見知りだけど
1539.0,1541.0,でもやったら給料増えるんだよ
1541.0,1543.0,やったら給料バンバン上がってくんだよ
1543.0,1545.0,やったほうがいいだろ
1551.0,1553.0,その時は俺
1553.0,1555.0,母親に男は出室しなかったら
1555.0,1557.0,働いてる意味ないって言われてたからさ
1557.0,1559.0,色々試行錯誤してやってたんだよ
1559.0,1561.0,でもこれできるからやったほうがいい
1561.0,1563.0,ほんとおすすめだよだって無能でもできるじゃん
1563.0,1565.0,俺別に賢くなかったけど
1565.0,1567.0,それでなんか
1567.0,1569.0,やっぱ上の人の名前覚えてもらうのすごい
1571.0,1573.0,そうまとめた質問じゃなきゃだめだから
1573.0,1575.0,ちゃんとこっちも用意していくわけじゃん
1575.0,1577.0,こいつ勉強してきてるなってなってもう
1577.0,1579.0,いいことづくめなんだよ
1583.0,1585.0,いやどんな質問じゃそんなだめだよ
1585.0,1587.0,ちゃんと考えていかなきゃいけないけど
1587.0,1589.0,なんで10分考えたらちゃんと
1589.0,1591.0,1個真面目なのだってネットで調べてさ
1591.0,1593.0,なんかいや考えればいいじゃん
1593.0,1595.0,そんな上手いことやればいいじゃん
1595.0,1597.0,そう
1597.0,1599.0,最初に質問するやつはマジで
1599.0,1601.0,もう最強
1601.0,1603.0,最強
1605.0,1607.0,最強だよ
1607.0,1609.0,これ一番評価される
1609.0,1611.0,ただ真面目に抗議受けてるだけじゃ
1611.0,1613.0,良くない最強じゃない
1613.0,1615.0,あれ気持ちいいんだよな
1615.0,1617.0,俺が一番最初にしてやったじゃん
1617.0,1619.0,一番だよだってあれ
1619.0,1621.0,一番ってすげえかっこよくない
1621.0,1623.0,はい俺一番俺一番
1623.0,1625.0,あのしかもね
1625.0,1627.0,みんな俺より年下だからさ
1627.0,1629.0,負けたくねえわけじゃん
1629.0,1631.0,おめえらも一番とっていいぞ
1633.0,1635.0,一番とっていいよ
1635.0,1637.0,何回も質問してて
1637.0,1639.0,申し訳なくて関係ねえやんな
1639.0,1641.0,質問して内容があるんだからしょうがねえだろ
1641.0,1643.0,やってたわ
1643.0,1645.0,やってたやってた
1651.0,1653.0,勉強会でも評価もクソもなかった
1653.0,1655.0,いやでもね
1655.0,1657.0,同じ才能だったら
1657.0,1659.0,そういうところでさ
1659.0,1661.0,差つけられちゃうんだよ
1661.0,1663.0,同じ評価で全く成績一緒だったらさ
1663.0,1665.0,好きなやつ選ばない
1665.0,1667.0,人間に差なんてねえんだよ
1667.0,1669.0,対して多分
1669.0,1671.0,暴力的な差を感じることってあんまねえだろ
1671.0,1673.0,プロ野球選手とかさ
1673.0,1675.0,イチローとか見たらそりゃきりねえけどさ
1675.0,1677.0,流行ったところだったらみんな慣れそうに消すんだろ
1677.0,1679.0,そういうもんなんだ
1679.0,1681.0,意外と人間って差ねえんだよ
1681.0,1683.0,そういうちょっとしたところでな
1683.0,1685.0,評価変わってくるわけよ
1685.0,1687.0,間違いねえから
1689.0,1691.0,同じやつだったらかわいい方選ぶよね
1691.0,1693.0,そうだよね女の子だったらそうじゃん
1693.0,1695.0,全く同じくらい好きでさ
1695.0,1697.0,性格もよくてコミュレベルも一緒で
1697.0,1699.0,トーク一緒コミュレベル一緒
1699.0,1701.0,ねえ性格一緒ってなって
1701.0,1703.0,財布どこで見るかって言ったらやっぱ顔じゃん
1703.0,1705.0,うきおちとみやこさんと
1705.0,1707.0,みやこさん選ぶじゃん
1709.0,1711.0,そういうこと
1713.0,1715.0,お前は自分に自信あるか
1715.0,1717.0,俺別に自信があるってか俺自分が好きなだけだよ
1717.0,1719.0,最近あれだもん
1719.0,1721.0,ちくわちゃんランキング見て
1721.0,1723.0,なんか面白そうなんねえなって言ったら自分の時給ばっか見てもん
1723.0,1725.0,用紙も大事
1725.0,1727.0,すごい7割くらいは占めてんじゃない
1727.0,1729.0,でもなんかかっこいいやつなんてさ
1729.0,1731.0,世の中ほんと一握りじゃん
1731.0,1733.0,何割くらいなの
1735.0,1737.0,何割いるのそういう見た目だけで
1737.0,1739.0,人生勝ち組みのやつって
1741.0,1743.0,誰よ
1743.0,1745.0,逆に分かりやすくて芸能人抜きな
1749.0,1751.0,いやみやこさんも食っていけねえと思うな
1751.0,1753.0,見た目だけじゃ
1753.0,1755.0,みやこさんは
1755.0,1757.0,脱足
1757.0,1759.0,食っていけねえだろ
1759.0,1761.0,歌ってんじゃねえかよ一生懸命
1763.0,1765.0,クリスティアンのロナウトだって
1765.0,1767.0,サッカー上手いからでしょ
1769.0,1771.0,確かに超かっこいいけど
1771.0,1773.0,いないよねそんなねえ
1777.0,1779.0,いないよいない
1779.0,1781.0,ササキノドミとかだったよね
1781.0,1783.0,伊勢谷だって学芸大でしょ
1785.0,1787.0,みやこで無理なら1パーいない
1787.0,1789.0,だから俺たちにもチャンスがあるだろ
1791.0,1793.0,さあ出るぞ
1793.0,1795.0,お前のかっこいいって誰
1795.0,1797.0,誰だろ
1797.0,1799.0,なんか微妙なとこ行って
1799.0,1801.0,俺でも男のかっこいいの定義めっちゃ低いよ
1803.0,1805.0,男のかっこいいの定義
1805.0,1807.0,めちゃめちゃ低いよ
1807.0,1809.0,誰だろな
1809.0,1811.0,ゲロかっこいい
1811.0,1813.0,尾巻も味方によっては
1813.0,1815.0,スーツ着たらなんかかっこいい
1815.0,1817.0,あのみどりさんだって別に
1817.0,1819.0,いい顔してると思う
1819.0,1821.0,菅野だって球掘ってるときはかっこいいだろ
1825.0,1827.0,ツアハスブスだな
