start,end,text
0.0,2.0,あ、あ、あ、あ、あ、あ、あ
2.0,4.0,せっかくホモとよ
4.0,6.0,デートしてって話だよ
8.0,10.0,最近俺のホモに対する
10.0,12.0,執着心異常なんだよね
12.0,14.0,夏さ、ホモとさ、ドライブデートしようぜ
14.0,16.0,なぁ、よくね?
16.0,18.0,あの、あの、ホモ
18.0,20.0,二人で俺を取り合わせよう
20.0,22.0,よくねか、マジ最、
22.0,24.0,最後、あの告白タイム
24.0,26.0,みたいなの作って
26.0,28.0,それで、ちゃんと俺もしかしたらホモと付き合うことになるかもしんないけど
28.0,30.0,合コンしよう
32.0,34.0,ホモとドライバー合コン
34.0,36.0,よくない?タイトルめっちゃくない?
36.0,38.0,ホモとドライバー合コン
38.0,40.0,俺全国のホモを救いに行こうかなぁ
40.0,42.0,いや、最近俺さ
42.0,44.0,マジホモとデートしたらいかんもん
44.0,46.0,俺をちゃんとエスコートしてくれるんじゃねぇかっていう
46.0,48.0,よくない?
48.0,50.0,ホモとドライバー合コン
50.0,52.0,マジでさぁ、ちゃんとしたホモでいいから
52.0,54.0,ちゃんとしたホモでいいから
54.0,56.0,いや、ほんとのホモ
56.0,58.0,いる?
58.0,60.0,ちゃんとしたホモ
60.0,62.0,相乗りみたいにさぁ、エスコートされたい
62.0,64.0,うんこちゃんのためになんか
64.0,66.0,プレゼントとかもらってさぁ
68.0,70.0,いや、俺ホモとデートしたいわぁ
72.0,74.0,あの、もしかしたら男が好きなんじゃないかとかじゃなくて
74.0,76.0,別に俺の放送見てなくてもいいけど
76.0,78.0,こういう企画があるらしいって書き付けてきて
78.0,80.0,ホモが来てほしいわ
80.0,82.0,一泊二日でよう
82.0,84.0,いや、ホモと絶対デートしよう
88.0,90.0,マジでもう約束するわ
92.0,94.0,どっかで募集するわ
94.0,96.0,ホモ
96.0,98.0,一泊で一泊で
98.0,100.0,だから面接枠取って
100.0,102.0,夏に
102.0,104.0,ホモとドライバー合コンっていうのを
104.0,106.0,やるんですけど来てくれませんか
106.0,108.0,っつって面接枠取って
108.0,110.0,ネタとかマジいらねえからな
110.0,112.0,ちゃんと顔も
112.0,114.0,俺だけに顔映して
114.0,116.0,ホモである証を
116.0,118.0,ケツの穴にアナルビーズ入れられなかったら
118.0,120.0,ホモじゃねえからな
120.0,122.0,募集して絶対やろう
122.0,124.0,決めた
126.0,128.0,マジでやるよ俺
128.0,130.0,面白そうじゃん
130.0,132.0,ホモってさぁ
132.0,134.0,テレビに出てるさぁ
134.0,136.0,なんていうの
136.0,138.0,ゲイタレント
138.0,140.0,ワングローブとかさぁ
140.0,142.0,松子デラックスって話は面白いけどなんか綺麗じゃん
142.0,144.0,俺汚ねえホモがいいんだよね
144.0,146.0,ほんと汚ねえホモ
146.0,148.0,ヒゲもじゃあ
148.0,150.0,デブチビ
150.0,152.0,面白さとかいらねえんだよ
152.0,154.0,汚さ
154.0,156.0,うん
156.0,158.0,それぐらいが
158.0,160.0,俺は
160.0,162.0,好きかもしれない
162.0,164.0,いや松子とか綺麗じゃん
164.0,166.0,明らかに
166.0,168.0,綺麗じゃねえか
170.0,172.0,綺麗じゃない
172.0,174.0,汚いホモとデートしてみたいわ
176.0,178.0,どういう風に
178.0,180.0,マジで俺のことを狙ってるっていう人は
180.0,182.0,理想たけえだろ
182.0,184.0,ミワキヒロが来たら
184.0,186.0,気使っちゃうな
186.0,188.0,ミワさんってホモなんですかって聞けねえわ
188.0,190.0,あれだってなんか
190.0,192.0,すごい高尚な得の高い人間じゃん多分
192.0,194.0,得の高い人間じゃなくて
194.0,196.0,もっと汚わしい
196.0,198.0,ホモ
198.0,200.0,こいつエイズじゃねえかっていうホモ
200.0,202.0,がいい俺はな
202.0,204.0,募集してるんで
204.0,206.0,よろしくお願いします
210.0,212.0,いいじゃん一個できたわ
212.0,214.0,まず放送タイトルが
214.0,216.0,ウケる
216.0,218.0,おそらくバンになるだろうな
218.0,220.0,ホモとドライバーゴーゴーって
220.0,222.0,タイトルでバンになりたいわ
224.0,226.0,タイトルでバンになる恐れあり
226.0,228.0,よろしくお願いします
230.0,232.0,外人のゲーはかっこいいね
232.0,234.0,俺かっこいいやつとか求めてねえんだ
234.0,236.0,汚えホモ
236.0,238.0,もう差別だよなホモっていっても
238.0,240.0,いろんな種類だからちゃんと
240.0,242.0,ちゃんとした男が
242.0,244.0,俺でもホモにあんまモテねえんだ
244.0,246.0,ホモにモテるのって誰だろセラミカルとかさ
246.0,248.0,そういうちょっともこうとかさ
248.0,250.0,そういうちょっと
250.0,252.0,なよっとしてる人が
252.0,254.0,モテそうじゃない俺あんまモテないんだよな
254.0,256.0,逆かなあ
258.0,260.0,かわいい系
260.0,262.0,っていうの
262.0,264.0,どういうやつがホモにモテんの
264.0,266.0,黒人さんとかめっちゃモテそう
266.0,268.0,黒人さんホモなんじゃねえの
268.0,270.0,なあ
270.0,272.0,今度聞くわ
272.0,274.0,あれホモだろ確実に
274.0,276.0,黒人さんは
276.0,278.0,ホモにモテるなあ
278.0,280.0,ってホモだろ多分なあ
280.0,282.0,佐々木ケンスケとか黒人さんとか
282.0,284.0,いや黒人さん
284.0,286.0,ホモでしょ絶対
286.0,288.0,ああいう
288.0,290.0,見た目がモテるよね
290.0,292.0,ケンコバとかさ
292.0,294.0,T岡田とか
294.0,296.0,そうそうそういう系
296.0,298.0,T岡田とか
298.0,300.0,T岡田とかさ
300.0,302.0,T岡田
302.0,304.0,超ホモにモテそう
306.0,308.0,T岡田めっちゃホモにモテそう
308.0,310.0,筒子とかな野球選手ホモにモテそうだな
310.0,312.0,坂本ハヤトとかは
312.0,314.0,モテないんだよなあんまりな
314.0,316.0,坂本ハヤトとか
316.0,318.0,なんなんだろうなあ
318.0,320.0,目細くて
322.0,324.0,ちょっとがっしりしてて目細くて
324.0,326.0,中田翔太まあそうだな
328.0,330.0,俺あんまりホモ受けしねえんだよ
330.0,332.0,マジで
332.0,334.0,ホモ受けしねえんだよ
334.0,336.0,で鳥谷とかはかっこよすぎる
336.0,338.0,私イケメン好きじゃないのとか
338.0,340.0,どの面か避けて言ってんだよ
340.0,342.0,言うたら汚いジジイとか
342.0,344.0,汚いホモのジジイとか
344.0,346.0,私イケメン好きじゃないのとか
346.0,348.0,そのジャンルに入るな
350.0,352.0,ホモ受けなんかしたくないだろ
352.0,354.0,まあしたくないけど別にさ
354.0,356.0,男性女性ホモノンケ問わず
356.0,358.0,人から好かれるっていうのってさ
358.0,360.0,俺ホモだろうが別に
360.0,362.0,女だろうが男だろうが
362.0,364.0,ウンコちゃんのこと好きなんだよって言われたら
364.0,366.0,やっぱ嬉しいもん
366.0,368.0,そういう恋愛感情抜きにして
370.0,372.0,嬉しくない
372.0,374.0,人から好かれるってさ
374.0,376.0,最高の関東連合でも全然いいよ
376.0,378.0,好きだよって言われたらやっぱ
378.0,380.0,嬉しいじゃん
380.0,382.0,俺はそう思うぜ
382.0,384.0,わしは
384.0,386.0,嘘でもたまらなく
386.0,388.0,嬉しいよねやっぱね
388.0,390.0,だって野原ひろしが言ってたよ
390.0,392.0,人間っていうのは
392.0,394.0,なんだっけ
396.0,398.0,社会あのー
398.0,400.0,家から一歩出たら
400.0,402.0,4分の3の
402.0,404.0,75%の人間は
404.0,406.0,他人から好意を
406.0,408.0,他人から好意を
408.0,410.0,他人から好意を
410.0,412.0,他人から同意を
412.0,414.0,求め
414.0,416.0,同調してあげると
416.0,418.0,75%の人間は味方になるって
418.0,420.0,そうですよねって
420.0,422.0,分かりますあなたの気持ちは分かりますって
422.0,424.0,いうスタンスで生きていけば
424.0,426.0,75%の人間が仲間になるって
426.0,428.0,言ってたよね
428.0,430.0,オカマがゴローマルは
430.0,432.0,ゲイの生み出した勢力のゴンゲだって
432.0,434.0,言ってた
434.0,436.0,あそうなの
436.0,438.0,そんなあれなんだ
438.0,440.0,歩く
440.0,442.0,生機なんだゴローマルは
442.0,444.0,うーん
444.0,446.0,あコメペコしてるの忘れた
446.0,448.0,ホモに夢中で
448.0,450.0,次回の家庭ホモはホモな
450.0,452.0,やろうぜ
452.0,454.0,ホモ限定の
454.0,456.0,トツマチっていうか
456.0,458.0,それはもう
458.0,460.0,間違いなく開催するわだから今
460.0,462.0,ホモはオナキにして待っててくれ
462.0,464.0,頼むなそれか俺でオナにしててくれ
464.0,466.0,24時間365日
466.0,468.0,ずっと発情してる動物は人間だけ
468.0,470.0,あー確かにそうだね犬とかだったら
470.0,472.0,発情期っていうものがまあ半年に1回とかきて
472.0,474.0,そこで成功して
474.0,476.0,子供を産むもんね
476.0,478.0,猿とかも
478.0,480.0,結構年から年中発情してるイメージあるけど
482.0,484.0,オナにするじゃんイルカとか猿って
488.0,490.0,いやー興味深いわ
490.0,492.0,興味深い
494.0,496.0,順で抜いたから
496.0,498.0,ホモ楽しいよ
498.0,500.0,なんでこんな6時のさ
500.0,502.0,6時台の浅い時間からさ
502.0,504.0,俺たちホモについて熱く語んなきゃいけないんだよ
504.0,506.0,気持ち悪いだろ
506.0,508.0,女の子がホモの話とかレズの話
508.0,510.0,してるんだけどさ
510.0,512.0,男性95%のコミュニティで
512.0,514.0,ホモの話してたら
514.0,516.0,こいつらマジかってなるぞ
516.0,518.0,こいつらマジじゃねーか
518.0,520.0,ってなるじゃねーか
520.0,522.0,俺たちだって女の子にモテたいんだっていうのを
522.0,524.0,アピールしていこうぜ
526.0,528.0,全面的に
528.0,530.0,ホモに寛容すぎないか
532.0,534.0,男95%もいたら絶対汚いホモいるわ
534.0,536.0,それに期待して
536.0,538.0,申し訳ないけど顔出しして
538.0,540.0,カメラマン兼
540.0,542.0,俺の話し相手役で
542.0,544.0,どっかホモの聖地に
544.0,546.0,ホモとドライバーGOGO
546.0,548.0,やりに行こうぜ
548.0,550.0,一泊目で日帰りいいや
550.0,552.0,ちょっといつもより
552.0,554.0,いいレンタカー借りて迎えに行くから
554.0,556.0,BMとかオープンカーで
556.0,558.0,ホモと二人ずつするわ
558.0,560.0,やります
560.0,562.0,もう以上でホモの話終わり
562.0,564.0,もう絶対やるからな
564.0,566.0,最後夜景見に行って告白させるわ
570.0,572.0,8月の
572.0,574.0,普通にドライバーGO
574.0,576.0,やだよ普通にはもうやったじゃん
576.0,578.0,俺もホモと絶対
578.0,580.0,決めてる
582.0,584.0,最近のニュースのこと
584.0,586.0,ここ一週間くらい
586.0,588.0,世間と隔たれた環境で生きていて
588.0,590.0,何にも分かんないんだよね
590.0,592.0,ニコ生でどういう人が放送してたとか
592.0,594.0,動画で何が流行ったとか
594.0,596.0,世間のニュースも
596.0,598.0,松井和夫がギリで止まってるから
598.0,600.0,松井和夫でギリギリ止まってるわ
600.0,602.0,交流されてた
604.0,606.0,捕虜になってた
606.0,608.0,捕虜も好きなんだよね
608.0,610.0,捕虜も
610.0,612.0,うちの爺ちゃん南京で捕虜にされてたから
612.0,614.0,2年間
614.0,616.0,26で戦争行って
616.0,618.0,2年間捕虜になって
618.0,620.0,南京で
620.0,622.0,ぶっ殺してたから中国人
622.0,624.0,飛行機乗ってたから
624.0,626.0,2年間くらい
626.0,628.0,捕虜になってて帰ってきてから働いてねーんだよ
628.0,630.0,仕事がなくなって
630.0,632.0,年金いっぱいもらってたけど
632.0,634.0,戦争年金みて
634.0,636.0,40年間無職を貫いたからね
636.0,638.0,うちのおじいさん
638.0,640.0,畑仕事してる
640.0,642.0,おじいちゃんが働いてるところ
642.0,644.0,俺見たことねーんだよ
644.0,646.0,おばあちゃんがせっせと内職してる記憶はあるんだけど
646.0,648.0,おじいちゃんが働いてるところ
648.0,650.0,一回見たことない
650.0,652.0,ちなみにお父さんが働いてるところも
652.0,654.0,物心ついてから数回しか見たことない
658.0,660.0,俺はな
660.0,662.0,代々うちの父親の家系っていうのは
662.0,664.0,男家系はクズって
664.0,666.0,もう相場決まってんだよ
666.0,668.0,母親の
668.0,670.0,女の方がすげー頑張ってんだよ
670.0,672.0,おばあちゃんはめちゃめちゃ働きもんだし
672.0,674.0,お母さんもめちゃめちゃキャリアウーマンなのね
674.0,676.0,姉ちゃんもキャリアウーマンなの
676.0,678.0,すごく
680.0,682.0,なんかね男が
682.0,684.0,ダメなんだよなぁ
684.0,686.0,男性人が
686.0,688.0,息子は生主になっちゃったし
688.0,690.0,俺おばあちゃんに育てられた
690.0,692.0,おばあちゃんに育てられた
692.0,694.0,男がダメな家系に
694.0,696.0,生まれちゃうんだよ
696.0,698.0,生まれちゃったんだよ
698.0,700.0,だからいい嫁さん見つけてるってことなんだよな
700.0,702.0,逆説を唱えると
702.0,704.0,そういう風に捉えられないか
706.0,708.0,そういう風に
708.0,710.0,解消のあるさ
710.0,712.0,だってうちの母親お父さんに
712.0,714.0,働かなくていいよって言ってんだよ
714.0,716.0,そんな母親いなくない
716.0,718.0,私の年金と私の宅配で
718.0,720.0,なんとか二人だったら暮らしていけるから
720.0,722.0,別にお父さん働かなくていいよって
722.0,724.0,そんなお母さんいなくねーか
726.0,728.0,うちの母親
728.0,730.0,お姉ちゃんは牛乳屋の息子と結婚して
730.0,732.0,離婚した
732.0,734.0,その後すっごいちゃんとした
734.0,736.0,いいところのいい大学出ていい仕事してる
736.0,738.0,俺より年下の
738.0,740.0,かっこいい男と結婚したわ
740.0,742.0,で今もう子供も育ててる
742.0,744.0,この前懲戒儀で
744.0,746.0,見に来たから
746.0,748.0,任天堂DSプレゼントしたわ
748.0,750.0,俺もちょっと
750.0,752.0,おじさんらしいことしてやりたくてよ
752.0,754.0,大人になった時にさ
754.0,756.0,じゅんちゃんは
756.0,758.0,じゅんちゃんがなんていうの
758.0,760.0,あいつ覚えてるじゃん
760.0,762.0,ゲーム機買ってくれたっていうのってさ
762.0,764.0,すごい
764.0,766.0,あ3DSね3DS
766.0,768.0,ゲーム機買ってくれたこととかって
768.0,770.0,めっちゃ覚えてない
770.0,772.0,めっちゃくちゃ覚えてない
772.0,774.0,3DSと
774.0,776.0,あれあげたわ
776.0,778.0,妖怪ウォッチ
778.0,780.0,妖怪ウォッチあげた
780.0,782.0,下の
782.0,784.0,2人兄弟なんだけど
784.0,786.0,下のガキはまだ
786.0,788.0,1歳になってない
788.0,790.0,てかすげーな
790.0,792.0,もうあいつ歩いてたからな
792.0,794.0,てかみどりさん家の子供どんだけしゃべってんだよ
794.0,796.0,お前俺の1個2歳で結構
796.0,798.0,ペラペラしゃべってたぞ
798.0,800.0,今思えば
800.0,802.0,お兄ちゃんとかさ
802.0,804.0,お兄ちゃんとか抱っことかめっちゃしゃべってたよ
804.0,806.0,今思えば
808.0,810.0,そんなに
810.0,812.0,差があるんだな
814.0,816.0,めちゃめちゃ差があるね
816.0,818.0,もうみどりのことじゃないぞ
818.0,820.0,DNAは
820.0,822.0,そうでしょ
822.0,824.0,DNAは
824.0,826.0,先輩知れる
826.0,828.0,しゃべらないっていうのがあるらしい
828.0,830.0,バグってしゃべってんじゃん
830.0,832.0,この前なんか放送で先輩知れてたの
832.0,834.0,見たよ俺
836.0,838.0,なんかでもしゃべりそうだけどな
838.0,840.0,もうすぐ
840.0,842.0,もうすぐしゃべりそうな感じ受けたけどね
842.0,844.0,しゃべりそうな感じ受けたけどね
844.0,846.0,あと一息っていうか
846.0,848.0,あれね絶対
848.0,850.0,障害児じゃない絶対
850.0,852.0,単純にIQが低いだけで絶対障害児じゃない
852.0,854.0,俺もう保証するわ
854.0,856.0,そのうちしゃべりだけ
856.0,858.0,絶対障害児じゃない
858.0,860.0,俺もみどりさんに絶対今度会った時言う
860.0,862.0,健常児だけど単純なバカだよ
862.0,864.0,本当に
864.0,866.0,可愛いじゃん単純なバカって
868.0,870.0,単純にIQが低いだけで
870.0,872.0,絶対障害児じゃないよ
872.0,874.0,俺自信あるわ
876.0,878.0,そうそうみどりさんがあれじゃん
878.0,880.0,そんな感じじゃん
880.0,882.0,絶対しゃべるよそのうち
882.0,884.0,絶対しゃべる
884.0,886.0,著しくIQ低いのは
886.0,888.0,一般的にさ
888.0,890.0,なんていうのかな
890.0,892.0,知的障害者って
892.0,894.0,IQ70以下を指すんだっけ
894.0,896.0,それは絶対ない
896.0,898.0,80くらいだと思う
898.0,900.0,80くらいだと思う
900.0,902.0,それしょうがないやんでもさ
902.0,904.0,本人悪くねえじゃん
904.0,906.0,親が両方バカなんだから
906.0,908.0,そんなさいきなり子供が歳児生まれるわけねえだろうが
908.0,910.0,80くらいだと思うよ
910.0,912.0,絶対俺障害児じゃないと思う
912.0,914.0,俺自信あるわ
916.0,918.0,分かるもんだってちょっとさ
920.0,922.0,現状時点で特別が嫌いだらどうすんだ
924.0,926.0,その中でヒーローになればいいじゃん別に
926.0,928.0,そんなさ別にさ
928.0,930.0,みんな誰しもさ
930.0,932.0,なんていうのかな
932.0,934.0,総理大臣になれるわけないじゃん
934.0,936.0,別にその自分が
936.0,938.0,自分が
938.0,940.0,所属する場所で英雄になればいいんだよ
944.0,946.0,頭の良さはやっぱ遺伝あるんじゃない
946.0,948.0,環境によるものが多いよね
948.0,950.0,だってさお父さんがさ
950.0,952.0,いい大学出ていい企業に勤めてたら
952.0,954.0,たぶん家でもしっかり努力したりさ
954.0,956.0,なんていうのかなそういう
956.0,958.0,自己啓発の時間を設けてるはずなんだよ
958.0,960.0,子供と触れ合う時間とか
960.0,962.0,時間の使い方絶対うまいから
962.0,964.0,そしたらそれを見て子供を育つかだってさ
964.0,966.0,マスクしてさニコ生でさ
966.0,968.0,なんていうの美顔器に芋が入ってた
968.0,970.0,みたいなのを見て育った
970.0,972.0,息子が賢いわけがないじゃん
972.0,974.0,それで賢い子供生まれてきたら
974.0,976.0,もういらないじゃんそういう小学校とかって
976.0,978.0,なるべくしてなってるから
978.0,980.0,しょうがないんだよ別に
980.0,982.0,絶対に障害児じゃない
982.0,984.0,単純にIQが低いだけで
984.0,986.0,俺もう自信あるわそのうち喋り始める
988.0,990.0,で最悪
990.0,992.0,俺が紹介してる阿波水産高校ってところ
992.0,994.0,誰でも入れるからそれで両親にさせてもらえばいいよ
994.0,996.0,俺が面倒見るよ
996.0,998.0,やっぱ俺の大事な先輩だから
998.0,1000.0,で
1000.0,1002.0,ミノリさんの裁判で負けて
1002.0,1004.0,優査判決になっちゃったけど精神観点しよう
1004.0,1006.0,多分おそらくそうしたら責任能力ないから
1006.0,1008.0,それで何とか俺がうまいことやる
1008.0,1010.0,しょうがねえだろうがよ
1010.0,1012.0,関わっちまったんだ俺いい病院紹介するって
1012.0,1014.0,確実に責任能力もないし
1014.0,1016.0,子供の面倒俺が見るって阿波水産高校入れて
1016.0,1018.0,漁業組合の会長と
1018.0,1020.0,うちの立山氏の俺仲良い知り合いだから
1020.0,1022.0,そこで何とか中卒で雇ってもらうやん
1024.0,1026.0,もう仕方ねえだろうが
1032.0,1034.0,あいつ結局どんな裁判所なんだ
1034.0,1036.0,ほんと精神観点してみてほしいわ
1038.0,1040.0,これで責任能力ありませんって言われたら
1040.0,1042.0,ほんとウケるわ
1042.0,1044.0,ほんと笑うわ俺
1044.0,1046.0,マジかよってマジじゃんって
1046.0,1048.0,冗談じゃなかったんじゃんって
1048.0,1050.0,俺すげえ悪者になるだろう
1052.0,1054.0,悪者になっちまう
1056.0,1058.0,阿波水産高校入ったら中卒
1058.0,1060.0,俺でも阿波水産高校入れるかな
1062.0,1064.0,でもなんか俺ちゃんと
1064.0,1066.0,普通に育っていくと思うけどな
1066.0,1068.0,そんな心配する必要ないと思うわ
1070.0,1072.0,周りからなんかとやかく言うほど
1072.0,1074.0,なんか危機感持たなくていいと思う
1074.0,1076.0,バラ色の将来は待ってないと思うけど
1076.0,1078.0,それ仕方なくない
1078.0,1080.0,もうそれしょうがないじゃん
1080.0,1082.0,それはだってねえ
1082.0,1084.0,全人類そうでしょ
1084.0,1086.0,人生バラ色の人はいないじゃん
1088.0,1090.0,頭が悪いなり
1090.0,1092.0,なんかねえ運命事やればいいと思うけどな
1092.0,1094.0,俺
1094.0,1096.0,面はいいじゃん顔可愛らしい顔してるから
1096.0,1098.0,なんかそれを武器に
1098.0,1100.0,やっていけんじゃねえかな
1100.0,1102.0,生命力受け継いそう
1102.0,1104.0,すげえ長生きしそうあの人たち
1104.0,1106.0,すげえ長生きしそう
1108.0,1110.0,でもまあ子供のこと考えたら
1110.0,1112.0,離婚してよかったよな
1112.0,1114.0,みどりさんの生き様を見せながら
1114.0,1116.0,育ったらほんとモンスターになってたよな
1116.0,1118.0,俺その地区入れねえよ
1118.0,1120.0,マジで
1120.0,1122.0,その地区入れねえよ俺
1124.0,1126.0,入れねえよ
1128.0,1130.0,怖えよ
1130.0,1132.0,うわあ最悪
1132.0,1134.0,お茶もっと買ってくればよかった
1138.0,1140.0,お茶もっと買ってくればよかった
1142.0,1144.0,いやでもあれだよな
1144.0,1146.0,子供育ててんだもんな
1146.0,1148.0,いやまあ厳密に言うけどもう育ててねえけど
1150.0,1152.0,俺たち自信持ってっていいよな
1152.0,1154.0,俺たちも多分家庭持っても大丈夫だぜ
1156.0,1158.0,家庭持っても大丈夫じゃねえ
1158.0,1160.0,うちらでも
1160.0,1162.0,俺自信満々に子供を育てていこうと思います
1170.0,1172.0,知能低いやつほど性欲が強い傾向にある
1174.0,1176.0,猫はもう結婚した絶対そう
1176.0,1178.0,まああれだろどうせ
1178.0,1180.0,左手に指輪がしてただけで
1180.0,1182.0,こいつ結婚してんだろみたいなさ
1182.0,1184.0,さすがに結婚してたら結婚しましたって言うわ
1184.0,1186.0,俺自信あるわ
1190.0,1192.0,俺は自信あるぞ
1194.0,1196.0,俺意外とでもなあ
1196.0,1198.0,女にあんまりさあ
1198.0,1200.0,束縛とかほんとしないのね
1204.0,1206.0,だからそういう女と付き合ったほうがいいよね
1206.0,1208.0,お互い干渉あんまりしないっていうさ
1210.0,1212.0,お互いあんまり夏の企画一個考えたらホモとドライバーGOGO
1212.0,1214.0,お前見てなかっただろ
