start,end,text
0.0,2.0,あ!あ!
4.0,6.0,あ!あ!あ!
10.0,12.0,録音デバイスー、録音ー
12.0,14.0,プロパティー
14.0,16.0,弾く
22.0,24.0,え、わかんねぇ
27.0,29.0,や!メール来てない!
30.0,34.0,【コメント】音響専門にしているものです。お電話ください。
34.0,38.0,オッケー。音響の専門家が来た。
38.0,42.0,え、でもさ、違う。
42.0,46.0,そしたらまた全部入れ直さなきゃいけないからさ。
46.0,50.0,ちょっと聞かせたら。それがダメなんだよな。
50.0,54.0,ちょっと待ってな。音響の専門家が
54.0,58.0,俺に助け具を出してきた。
58.0,62.0,【音響の専門家】
62.0,66.0,【音響の専門家】
66.0,70.0,【音響の専門家】
70.0,74.0,【音響の専門家】
74.0,78.0,ちょっと待ってね。
78.0,82.0,【音響の専門家】
82.0,86.0,もしもし。はい。無頭に詳しいですか?
86.0,90.0,えっとですね。まず、自分はソース1本のメーカーで
90.0,94.0,ラグがあると思うんですけど、まず
94.0,98.0,音響のサウンドのところをもう一度お見せしていただきたいと。
98.0,102.0,サウンド、はい。はい、開きました。
102.0,106.0,見えますか?
106.0,110.0,ちょっと待ってください。ありがとうございます。録音のカバーを
110.0,114.0,押しました。
114.0,118.0,はい、えっと、今LINEのエリア
118.0,122.0,が電話のマークになっていると思うんですけど
122.0,126.0,まずこれを下のアナログ22というところ、その前にですね
126.0,130.0,加藤さんのマイクのMODが刺さっているところが左か右かって
130.0,134.0,教えて欲しいんですけど。ごめんなさい、今ちょっと聞き取れなかったんですけど、もう一回教えてください。
134.0,138.0,マイクが刺さっているところが
138.0,142.0,左か右かっていうのが
142.0,146.0,左側に刺さっています。
146.0,150.0,左から12なので、それをまず規制のデバイスにしていただければと。
150.0,154.0,はい、知りました。
154.0,158.0,あ、あ、知りました。
158.0,162.0,えっと、それで、上のLINEのエリア、SBを
162.0,166.0,向こうに。はい、知りました。
166.0,170.0,あ、あ。はい、ありがとうございます。
170.0,174.0,リアルテックスタッフマイクのほうを
174.0,178.0,向こうに。ここのリアルテックス向こうでいいですか?
178.0,180.0,はい。
200.0,202.0,リアルテックスタッフマイクのほうを向こうに。はい、知りました。
230.0,232.0,ご視聴ありがとうございました。
260.0,262.0,ご視聴ありがとうございました。
290.0,294.0,ご視聴ありがとうございました。
294.0,298.0,ご視聴ありがとうございました。
298.0,302.0,ご視聴ありがとうございました。
302.0,306.0,ご視聴ありがとうございました。
306.0,310.0,ご視聴ありがとうございました。
310.0,314.0,ご視聴ありがとうございました。
314.0,318.0,ご視聴ありがとうございました。
318.0,322.0,ご視聴ありがとうございました。
322.0,326.0,ご視聴ありがとうございました。
326.0,330.0,ご視聴ありがとうございました。
330.0,334.0,ご視聴ありがとうございました。
334.0,338.0,ご視聴ありがとうございました。
338.0,342.0,ご視聴ありがとうございました。
342.0,346.0,ご視聴ありがとうございました。
346.0,350.0,ご視聴ありがとうございました。
350.0,354.0,ご視聴ありがとうございました。
354.0,358.0,ご視聴ありがとうございました。
358.0,362.0,ご視聴ありがとうございました。
362.0,366.0,ご視聴ありがとうございました。
366.0,370.0,ご視聴ありがとうございました。
370.0,374.0,ご視聴ありがとうございました。
374.0,378.0,ご視聴ありがとうございました。
378.0,382.0,ご視聴ありがとうございました。
382.0,386.0,ご視聴ありがとうございました。
386.0,390.0,ご視聴ありがとうございました。
390.0,394.0,ご視聴ありがとうございました。
394.0,398.0,ご視聴ありがとうございました。
398.0,402.0,ご視聴ありがとうございました。
402.0,406.0,ご視聴ありがとうございました。
432.0,436.0,ご視聴ありがとうございました。
436.0,440.0,ご視聴ありがとうございました。
440.0,444.0,ご視聴ありがとうございました。
444.0,448.0,ご視聴ありがとうございました。
448.0,452.0,ご視聴ありがとうございました。
452.0,456.0,ご視聴ありがとうございました。
456.0,460.0,ご視聴ありがとうございました。
460.0,464.0,ご視聴ありがとうございました。
464.0,468.0,ご視聴ありがとうございました。
468.0,472.0,ご視聴ありがとうございました。
472.0,476.0,ご視聴ありがとうございました。
476.0,480.0,ご視聴ありがとうございました。
480.0,484.0,ご視聴ありがとうございました。
484.0,488.0,ご視聴ありがとうございました。
488.0,492.0,ご視聴ありがとうございました。
492.0,496.0,ご視聴ありがとうございました。
496.0,500.0,ご視聴ありがとうございました。
500.0,504.0,ご視聴ありがとうございました。
504.0,508.0,ご視聴ありがとうございました。
508.0,512.0,ご視聴ありがとうございました。
512.0,516.0,ご視聴ありがとうございました。
516.0,520.0,ご視聴ありがとうございました。
520.0,524.0,ご視聴ありがとうございました。
524.0,528.0,ご視聴ありがとうございました。
528.0,532.0,ご視聴ありがとうございました。
532.0,536.0,ご視聴ありがとうございました。
536.0,540.0,ご視聴ありがとうございました。
540.0,544.0,ご視聴ありがとうございました。
544.0,548.0,ご視聴ありがとうございました。
548.0,552.0,ご視聴ありがとうございました。
552.0,556.0,ご視聴ありがとうございました。
556.0,560.0,ご視聴ありがとうございました。
560.0,564.0,ご視聴ありがとうございました。
564.0,568.0,ご視聴ありがとうございました。
568.0,571.0,ヘッドフォンがついてるからピン差しマイクだと絶対つくから
577.0,579.0,フルウィンドウでいいからサウンドバスター余ってない?
579.0,581.0,なにサウンドバスターって
583.0,586.0,ウィンドウ10で8番使える
591.0,594.0,じゃマイクすぐ変えるから下手すぎてコンビニ変えるからあんなの
595.0,597.0,サウンドブラスターってなに
598.0,600.0,え?プツプツしてる?
604.0,606.0,プツプツしてる?
606.0,608.0,あまりこのバージョンは最新のやつを
608.0,610.0,え?ずっとしてる?声が
610.0,612.0,あ、声がプツプツしてるのはあれだ
612.0,614.0,ヘッドフォンマイクだから
614.0,616.0,ヘッドフォンだから全然オッケー
616.0,618.0,配信がプツプツしてるわけじゃないでしょ
618.0,620.0,配信は多分いいはず
623.0,625.0,オッケーオッケーオッケー
625.0,627.0,音は絶対直ると思うんだよね
628.0,630.0,キャプチャーボード新しくしたのは導入したとき
632.0,634.0,古いキャプチャーボードじゃなくて新しいキャプチャーボードにして
635.0,639.0,PS4の配信ができるように設定したんだよ
641.0,643.0,ウィンドウズ10版のアマレココがあるの?
643.0,645.0,ウィンドウズ10版のアマレココ
646.0,648.0,あーAVのあれがいっぱいある
651.0,653.0,ウィンドウズ
654.0,655.0,10
656.0,658.0,アマレココ
660.0,662.0,これでいいの?
667.0,669.0,これでいいの?
675.0,677.0,ウィンドウズ10でアマレココTVが使えるのか
677.0,679.0,これで見ればいいの?
686.0,688.0,音出てない
689.0,691.0,音出てなくね?
691.0,693.0,これみんなに聞こえてるの?
694.0,696.0,音出てなくね?
698.0,700.0,え?
700.0,702.0,元からないぞこれ
705.0,707.0,ん?
707.0,709.0,あ、聞こえてる?オッケーオッケー
715.0,717.0,あれ?また聞こえなくなっちゃった
717.0,719.0,音が
725.0,727.0,動画の音聞こえてねぇ
727.0,729.0,ちょっと待って待って待って待って待って
733.0,735.0,なんだこれ
745.0,747.0,うわぁ
747.0,749.0,音聞こえなくなっちゃった
755.0,757.0,聞こえてる?
757.0,759.0,なんで俺聞こえてないの?
760.0,762.0,俺聞こえてないんだけど
768.0,770.0,マイクとイヤホン同じだからか
772.0,774.0,ちょっと待って
775.0,777.0,音聞こえてない
781.0,783.0,あ、ちょっと待って
783.0,785.0,え、なんでさ
785.0,787.0,え、ちょっと待って
787.0,789.0,スピーカーから音が出なくなってる
791.0,793.0,いやぁ、なんかぐちゃぐちゃになっちゃってるなぁ
795.0,797.0,同じウィンドウズ10で
797.0,799.0,同じアマレココを使ってるけど
799.0,801.0,使えてるからデバイス関係の問題
801.0,803.0,いやぁ、これ使えなくなってる
803.0,805.0,やべぇ
813.0,815.0,やべぇ、ぐちゃぐちゃになってる
817.0,819.0,お前言ったからなぁ
819.0,821.0,モツで飯食ってます
821.0,823.0,ってやつから来たんだけど
823.0,825.0,本当だなぁ、お前
825.0,827.0,モツで飯食ってるやつから連絡来たんだけど
827.0,829.0,ご覧のユーザーの皆様が応援しています
831.0,833.0,絶対だな、お前
833.0,835.0,モツで飯食ってんだ
837.0,839.0,とんでもないことだぞ
847.0,849.0,レコーディングスタジオで
849.0,851.0,モツ使って飯食ってます
851.0,853.0,最強じゃないか
853.0,855.0,こいつで決まるだな
857.0,859.0,うわぁ、もうクッソ
859.0,861.0,ぐちゃぐちゃになっちゃった
875.0,877.0,やばいやばい
879.0,881.0,何がこんなきっかけで
881.0,883.0,こうなっちゃったんだろう
883.0,885.0,お前
885.0,887.0,モツで飯食ってるのに
887.0,889.0,全然連絡来てくんねん
895.0,897.0,お前モツで飯食ってるけど
897.0,899.0,連絡取れねえじゃねえかよ
899.0,901.0,だめだ
901.0,903.0,モツで飯食ってるやつ連絡くれねえ
913.0,915.0,やばいやばいやばい
915.0,917.0,俺今何しようとしたんだっけ
917.0,919.0,あ、炎上だ
919.0,921.0,なんでこんないきなり
921.0,923.0,ぐっちゃぐちゃになったの
923.0,925.0,昨日までちゃんと設定できてたのに
935.0,937.0,あ、あ、あ
943.0,945.0,いや、あのね
945.0,947.0,AVは見てねえんだよ
947.0,949.0,あのー
949.0,951.0,Google Chrome入れたときに
951.0,953.0,アカウントと同期して
953.0,955.0,俺パソコン3台使ってるんだよね
955.0,957.0,2階で使ってるやつと
957.0,959.0,寝室で俺が寝るときに使ってるやつと
959.0,961.0,で、配信用のパソコンなんだけど
961.0,963.0,俺寝室でAV見る
963.0,965.0,パソコンがあるので
965.0,967.0,そのアカウントで同期しちゃったから
967.0,969.0,ブックマークが
969.0,971.0,そのエロサイトマンフィレなの
971.0,973.0,開いてないのこのパソコンじゃ絶対
977.0,979.0,だからウイルスじゃないんだよ
979.0,981.0,絶対
981.0,983.0,あるだろあるあるだろ
983.0,985.0,あるあるだろ絶対
985.0,987.0,間違いねえだろこれ
987.0,989.0,AV専用パソコンが
989.0,991.0,あるんだよだから
991.0,993.0,でっけえモニターでAV見てんだよ
995.0,997.0,どうすればいいのどうすればいいのこれ
997.0,999.0,俺今何しようとしたんだっけ
1001.0,1003.0,俺の常識あるある
1003.0,1005.0,何しようとしたんだっけ
1005.0,1007.0,ステレオミキサーが電話のマーク
1007.0,1009.0,違うあれだ
1009.0,1011.0,キャプチャーボード探そう
1011.0,1013.0,キャプチャーボード
1015.0,1017.0,電話のマークなってないってか
1017.0,1019.0,向こうにしてるだけじゃねえか
1019.0,1021.0,思いっきり電話のマークだよ
1023.0,1025.0,もうキャプも探そう
1025.0,1027.0,バンディカムって
1027.0,1029.0,録画録画録画
1029.0,1031.0,有料のやつ持ってるバンディカム
1033.0,1035.0,アマリコトDBのバージョン3.1にしてみないか
1035.0,1037.0,俺前それ使ってたからな
1037.0,1039.0,Windows8で
1039.0,1041.0,モッツの野郎が電話してこねえ
1049.0,1051.0,一旦これ消して
1051.0,1053.0,アマリコトDB一択なのかな
1063.0,1065.0,バージョン3.1
1065.0,1067.0,とりあえずうっきりは何でもいいんだよな
1067.0,1069.0,アマリコトDB4じゃなくて
1079.0,1081.0,これだ
1081.0,1083.0,これだ
1083.0,1085.0,これだ
1085.0,1087.0,これだ
1087.0,1089.0,これだ
1089.0,1091.0,これだ
1091.0,1093.0,これだ
1093.0,1095.0,これだ
1095.0,1097.0,これだ
1097.0,1099.0,これだ
1099.0,1101.0,これだ
1101.0,1103.0,これだ
1103.0,1120.0,アマレコTV4じゃなくて4相性悪いんだ でもアマレコTV9バージョンこれね
1120.0,1122.0,アマレコTVライブ
1124.0,1126.0,アマレコTVこれか
1134.0,1136.0,じゃ俺モンスター
1138.0,1140.0,なんだっけ
1140.0,1142.0,キャブもいっぺん買ってきてさ
1144.0,1148.0,ラグのグラバー
1151.0,1154.0,意味わかんないだろ
1154.0,1156.0,バージョン3.1ってどこだ
1172.0,1174.0,俺のパソコンもちろん64bit
1180.0,1182.0,え?
1184.0,1186.0,アマレコ
1188.0,1190.0,アマレコTV
1192.0,1194.0,3.1
1194.0,1196.0,あこれ出てきた
1196.0,1198.0,予測変換出てきた
1202.0,1204.0,ダウンロード
1211.0,1213.0,アマレコTV
1213.0,1215.0,これこれこれ
1215.0,1217.0,ダウンロード
1219.0,1221.0,今の本題はなんなの
1221.0,1223.0,とりあえずデス
1223.0,1225.0,キャプチャー
1225.0,1227.0,いらねーよ
1227.0,1229.0,なんで俺キャプチャーボード探してんだ
1229.0,1231.0,だってさ
1231.0,1233.0,アウトラスト2ってさ
1233.0,1235.0,スチームじゃね
1237.0,1239.0,普通に出るじゃん
1239.0,1241.0,あと音だけじゃん
1247.0,1249.0,マイクがあればできんじゃんあと
1249.0,1251.0,あーよかった
1251.0,1253.0,くっそー
1253.0,1255.0,マイク買ってくるんだ
1257.0,1259.0,マイク買ってくるわ
1261.0,1263.0,行ってきます
1263.0,1265.0,あのー
1265.0,1267.0,あれはまた教えて
1267.0,1269.0,今日ちょっとさ
1269.0,1271.0,夜聞くわ
1275.0,1277.0,行ってくるわ
1277.0,1279.0,マイク買ってくるマイク
1279.0,1281.0,さよなら
1283.0,1285.0,アマレコ使いたいから
1285.0,1287.0,次からゲーム全部割れでやるわ
1287.0,1289.0,流星界みたいな
1289.0,1291.0,魚談みたいでいいわ
1291.0,1293.0,行ってきます
