start,end,text
0.0,2.0,なにウイルスアイドルって
5.0,7.0,なにウイルスアイドルって
7.0,9.0,そんなのやったっけ俺
9.0,11.0,あ、生放送に付随したやつでしょ
11.0,13.0,それはなんかその
13.0,15.0,YouTubeの案件じゃないからね
15.0,17.0,ユーザー記者
17.0,19.0,でしょ
19.0,21.0,ユーザー記者
21.0,23.0,ま、あれも
23.0,25.0,そういう風に入るのか
26.0,28.0,それも入るのかもしんないね
30.0,32.0,ニコニコの
32.0,34.0,公式のっていう
34.0,36.0,感じだよね多分ね
40.0,42.0,ユーザー記者あれなんでなくなったのか分かんない
42.0,44.0,ほんとに分かんない
44.0,46.0,なんかあんまりだからその
46.0,48.0,続かないんだよ
48.0,50.0,基本的に番組ってばんばん終わるじゃん
50.0,52.0,基本的には終わるんだよ
52.0,54.0,終わるものなんだよ
54.0,56.0,めちゃイケですら終わるんだよ
56.0,58.0,ユーザー顧客満足度が
58.0,60.0,満足度が低かったら番組って終わるじゃん
60.0,62.0,知らねーけど俺
62.0,64.0,その裏事情は
68.0,70.0,あれほんとに面白くなかった
70.0,72.0,マジで
72.0,74.0,音楽があるとどれくらいあるのか分かんない
74.0,76.0,それは視聴率とかが下がってきたらさ
76.0,78.0,終わらさざるを得ないじゃん
82.0,84.0,マシンにあるようでないもの
84.0,86.0,その
86.0,88.0,3つだけあるけど
88.0,90.0,仕事受けましょうみたいなときは
94.0,96.0,あの
96.0,98.0,LINEみたいなのが
98.0,100.0,でもまあ
100.0,102.0,あれだろうな
108.0,110.0,野となる山となる
114.0,116.0,髪いじんだよ
116.0,118.0,野となる山となる
118.0,120.0,野となる山となる
120.0,122.0,野となる山となる
122.0,124.0,野となる山となる
124.0,126.0,髪いじんだよ
126.0,128.0,風呂入ってねーから
128.0,130.0,頭が痒いんだよ
130.0,132.0,頭が痒いんだよ
132.0,134.0,ほんとにそういう理由です
134.0,136.0,俺かっこいいかなーって
136.0,138.0,言ってるわけじゃなくて頭が痒いんだよ
138.0,140.0,普通に
140.0,142.0,今日まだ風呂入ってねーんだよ
146.0,148.0,最近続きはそういうね
154.0,156.0,髪を決めようとしてると思ってた
156.0,158.0,ワックスつけてないよ俺今
158.0,160.0,つけてないよ
160.0,162.0,入らずに行く
162.0,164.0,このまま行く
172.0,174.0,ベトベトです
176.0,178.0,明日メイクしてもらわない
178.0,180.0,なんで
180.0,182.0,なんか
182.0,184.0,なんで
184.0,186.0,そんな
188.0,190.0,ありするようなあれじゃなくない
196.0,198.0,髪型とか別に自分でセットする
200.0,202.0,していかない
202.0,204.0,髪の毛だけ自分でセットして
206.0,208.0,別に俺アーティストじゃねーから
208.0,210.0,加藤純一出てなきゃ意味ないじゃん
212.0,214.0,大きさとかやってくんじゃない
214.0,216.0,手抜いてるわけじゃなくて
216.0,218.0,そこであれしても
218.0,220.0,おかしくなっちゃうな
220.0,222.0,道欄とか俺塗ったことない
226.0,228.0,塗ったことないわ
228.0,230.0,別に今塗ってなくても
230.0,232.0,この辺の
232.0,234.0,でかいほくろぐらいしか
236.0,238.0,可愛い女の子に会うときはワックスつける
242.0,244.0,もちろん
246.0,248.0,頬骨にチーク塗ってこかな
250.0,252.0,頬骨にチークだけ塗ってこ
256.0,258.0,ふざけんなよ
258.0,260.0,あの野郎マジで
260.0,262.0,ふざけんなよ
266.0,268.0,そんなあれしてんのかよ
268.0,270.0,着飾ってんのかよ
272.0,274.0,知らなかった
284.0,286.0,色気ついてやがんな
286.0,288.0,なんかさ
288.0,290.0,あーちょっと
290.0,292.0,しちゃだめだなと思ったきっかけは
292.0,294.0,なんだっけあのさ
294.0,296.0,あのー
296.0,298.0,あの人セキシンゴ
298.0,300.0,がニコライス来たときに
300.0,302.0,俺はしないにしようと思ったんだよね
302.0,304.0,特に意味はない
308.0,310.0,ああいうのって芸能人とかがやるもんなんだって思って
314.0,316.0,キモいキモくないとかじゃなくて俺の中でなかったんだよな
320.0,322.0,なかったんだよね俺の中で
322.0,324.0,ザリだと思えば
324.0,326.0,塗ればいいんじゃない
326.0,328.0,メイクしてくださいって
328.0,330.0,求められるんだったらさ
330.0,332.0,言ってくるでしょ周りが別に
332.0,334.0,言ってこないってことはさ
334.0,336.0,音楽部のスタッフとかもカトジンさんメイクしてくださいとか
336.0,338.0,髪の毛セットしてくださいとか言わないもん
340.0,342.0,逆に俺なんか緊張したと思うわ
342.0,344.0,すごい
344.0,346.0,普段通りで
346.0,348.0,今ライバル視してる生主は誰
348.0,350.0,うーんマジで言うと橋本カンナ
350.0,352.0,あいつがなんかLINEライブとかやってて
352.0,354.0,えげつないニーズ集めてるから
354.0,356.0,とりあえず橋本カンナには勝ちたいなと思ってるわ今
356.0,358.0,意識してるのそれくらいかな生主で
358.0,360.0,最近ガチで意識してるよ
360.0,362.0,橋カン
362.0,364.0,あいつすげーから負けたくねーなと思う
368.0,370.0,あいつすごいよ
370.0,372.0,実力ある
374.0,376.0,なんでなんで
376.0,378.0,生放送してたら生主だろうが
378.0,380.0,関係ねーだろうが芸能人だろうが
380.0,382.0,犬だろうが
382.0,384.0,橋本カンナ何人集めるの
384.0,386.0,この野郎
386.0,388.0,イラーってしたわ
388.0,390.0,ローラーが60万人集めてた時は
390.0,392.0,まあローラーだしなと思って
392.0,394.0,諦めたんだけど
394.0,396.0,橋本カンナが40万人くらい集めてたら
396.0,398.0,絶対負けねーと思ったわ
402.0,404.0,あいつなんか弱い
404.0,406.0,まだ18ぐらいだろう
414.0,416.0,インスタライブやらなきゃいけない
416.0,418.0,まじかよ
422.0,424.0,お前のライバルマックスもらった
424.0,426.0,マックスもらったらすごいんじゃないの
426.0,428.0,あいつなんかチャンネル登録者数250万人くらい
430.0,432.0,知らねーが
438.0,440.0,ようわからんが
440.0,442.0,再生数落ちちゃったんだ
444.0,446.0,みんなそうじゃない
446.0,448.0,全員なんかその道を辿るんじゃない
448.0,450.0,よう頑張っただろ
456.0,458.0,過去の遺産
458.0,460.0,みたいな感じなんだ
462.0,464.0,ライブしたら3000人集まんない
466.0,468.0,そんなもんじゃないみんな
470.0,472.0,わかんねーけど
472.0,474.0,だって俺なんかちくわちゃんランキング見ててさ
474.0,476.0,5000人集めてたらオーってなるよ
476.0,478.0,ライバ実施するよ
480.0,482.0,今でいうと石川のりゆき
486.0,488.0,スタイリッシュヌーヴ
490.0,492.0,ぐらいかな
492.0,494.0,あの右のほうにさ
494.0,496.0,リアルタイム
496.0,498.0,リアルタイム
498.0,500.0,バーって出るじゃん
500.0,502.0,でようやく
502.0,504.0,こいつ
504.0,506.0,この野郎
506.0,508.0,ってなるわ
510.0,512.0,たまにいる
512.0,514.0,歌いて
514.0,516.0,あと
516.0,518.0,浦島さかたせん
518.0,520.0,あいつらなんか
520.0,522.0,1万人くらい集めてる
522.0,524.0,ぐらいかな
524.0,526.0,あんまりそんな
526.0,528.0,他人を見ないようにしてるからな
528.0,530.0,キリがねえから
536.0,538.0,幕末時とかで
538.0,540.0,生放送してる今
540.0,542.0,あんましてなくない
542.0,544.0,動画も上げてなくない
548.0,550.0,あんましてない
550.0,552.0,あ
552.0,554.0,もこうも
554.0,556.0,1万人くらい集めてたわ
556.0,558.0,なんだっけな
558.0,560.0,あ公野行動だ
560.0,562.0,週2で
562.0,564.0,なんもやってんの
564.0,566.0,今幕末時
566.0,568.0,まじで
568.0,570.0,週2でやってんの
576.0,578.0,へえ
578.0,580.0,見よ今度
582.0,584.0,あ京ちゃんも最近5000人超えてるな
586.0,588.0,京ちゃんとシャカキンTV
590.0,592.0,いやまだまだ
592.0,594.0,上なんていっぱいいるよ
594.0,596.0,やってねえだけでさ
596.0,598.0,なんかそのUUUMの上のほうのやつらがいたら
598.0,600.0,ちゃんと企画組んでたら
600.0,602.0,10万人くらい絶対集めるから
602.0,604.0,自信あるわ他人のことながら
604.0,606.0,自信あるわ
606.0,608.0,自信ある自信ある
610.0,612.0,バーチャルYouTuberって
612.0,614.0,見たことないんだよな
614.0,616.0,この前生放送やってんの見たけど
616.0,618.0,なんだっけな
618.0,620.0,男
620.0,622.0,昨日だ
622.0,624.0,昨日さなんかかっこいい
624.0,626.0,あのザソクさんのアイコン
626.0,628.0,みたいな
628.0,630.0,やつが
630.0,632.0,なんだっけな
632.0,634.0,ホラーゲームかなんかやってんの見たわ
636.0,638.0,シャカマダフクジャスBGBジャルジャルやろうぜ
638.0,640.0,やりたいやりたい俺も
640.0,642.0,落ち着いてやろうぜ
642.0,644.0,やりたい
644.0,646.0,マグマ頭脂肪
648.0,650.0,坂本が頑固だからツービー進出しないらしい
650.0,652.0,えでもYouTubeのチャンネルあるよね
652.0,654.0,やればいいのに
654.0,656.0,いやこれ寝るよ寝るよ
656.0,658.0,寝れねえんだ
658.0,660.0,寝れない寝れない
660.0,662.0,寝れない寝れない
666.0,668.0,あんまライブ見ない奴もバーチャル
668.0,670.0,見てて悲しくなるでもまあ強いんだよね
670.0,672.0,多分ね
672.0,674.0,やたらめにしない
674.0,676.0,なんだっけあいつ
676.0,678.0,あのー
680.0,682.0,なんとかうさぎ
682.0,684.0,なんだっけ
684.0,686.0,ニコニコちょうがいにモデル
686.0,688.0,なんとかうさぎちゃん
688.0,690.0,なんだっけ
690.0,692.0,キズナアイ
692.0,694.0,キズナアイ
694.0,696.0,なんだかうさぎちゃんだと思ってた
700.0,702.0,間違えたキズナアイちゃん
702.0,704.0,あのーセーラームーンと間違えた
704.0,706.0,お前この前バーチャルYouTuberバカにした
706.0,708.0,俺バーチャルYouTuber超バカにしてるよ
708.0,710.0,心の中でこんなの見て何が面白いんだよ
710.0,712.0,って思ってるけど
712.0,714.0,口に出してないだけ
714.0,716.0,心の底から俺に向け出してるよ
716.0,718.0,内緒にしてて
718.0,720.0,俺ゴミだと思ってるから
722.0,724.0,なんかあのー
726.0,728.0,ゴミだと思ってるっていうか
728.0,730.0,オナペットでしょ要は
730.0,732.0,オナペットでしょ
732.0,734.0,オナペットじゃないの
734.0,736.0,初音ミクとは違うでしょ
746.0,748.0,意味が多いってことは面白いんじゃない
748.0,750.0,理解できないっていう
750.0,752.0,そりゃそうでしょ
752.0,754.0,あれが違う
754.0,756.0,ジャンルが違うじゃん
756.0,758.0,好きなジャンルが
758.0,760.0,中身と外見とのギャップがいい
764.0,766.0,モコもズリネタにしてる
766.0,768.0,あいつなんかよく
768.0,770.0,生放送でバーチャルYouTuber
770.0,772.0,語ってるけどさ
772.0,774.0,ズリネタにしてるってことでしょ
774.0,776.0,今度問い詰めるよ
776.0,778.0,お前さバーチャルYouTuber好きとか言ってるけど
778.0,780.0,てめえオナにしてんだろ
780.0,782.0,お前バーチャルYouTuberでオナにしてるから
782.0,784.0,応援してんだろ
784.0,786.0,今度詰めよう
786.0,788.0,あいつ同時に
788.0,790.0,叱ってる
790.0,792.0,ほら正解じゃん
792.0,794.0,ズリネタにしてんじゃん
794.0,796.0,だって本当に応援してたら別にズリネタにしねーだろ
796.0,798.0,しなくねーか
798.0,800.0,男の浅ましい性欲だろうが
800.0,802.0,今俺
802.0,804.0,好きになるだろ
808.0,810.0,俺同じ理由で女の子もさ
810.0,812.0,好きになれないからさ
812.0,814.0,でもすごい人いたよ
814.0,816.0,その男の子
816.0,818.0,2万人くらいいたよ
818.0,820.0,ラムさんとは連絡取れてない
820.0,822.0,連絡した気もしらないんだけど
822.0,824.0,ものすごい事務的な挨拶しか交わしてないよ
824.0,826.0,今日お疲れ様でした
826.0,828.0,1回しか会ったことないし
828.0,830.0,酔っ払ってない
830.0,832.0,全然
832.0,834.0,3時には寝るよ
836.0,838.0,今日直前で
838.0,840.0,ギター配信とか多分できねーな
842.0,844.0,でもしょうがない
844.0,846.0,男の俺目線から言ってさ
846.0,848.0,それ褒めるやつ
848.0,850.0,あんまいねーだろ
850.0,852.0,AKBってあんな曲売れてんじゃん
852.0,854.0,俺AKB好きだけどAKBの曲
856.0,858.0,え何だっけ
858.0,860.0,恋するフォーチュン
860.0,862.0,あなたのことが
862.0,864.0,ルンルンルンルン
864.0,866.0,俺応援してるやつは
866.0,868.0,正直見下してるし
868.0,870.0,何がいいのって思っちゃうし
870.0,872.0,アホみたいに金かけてさ
872.0,874.0,10万20万払ってCD買ってさ
876.0,878.0,っていう目線で俺見てるだけ
884.0,886.0,正直俺さしはらは面白いと思う
886.0,888.0,テレビ映ってたら
888.0,890.0,ピって止まるわ
894.0,896.0,レギュラーテープ番組持ってきた
896.0,898.0,紹介したゲームの社長が激怒して
898.0,900.0,それは別にしょうがなくない
902.0,904.0,あんなのファンとかゴミしかいねー
904.0,906.0,向こうも言ってるわ同じこと
908.0,910.0,風俗にAKBクラスの女いるぞ
910.0,912.0,テレビで出るような女いるぞ
912.0,914.0,ほんとに
916.0,918.0,好きなアイドル誰だろうな
918.0,920.0,最近
920.0,922.0,好きなアイドル誰だろうな
926.0,928.0,好きなアイドル
928.0,930.0,誰だろうな
930.0,932.0,たてひしみやび
932.0,934.0,アイドルに入る
934.0,936.0,アイドルに入る
940.0,942.0,かな
942.0,944.0,すごい人気なんだよね
944.0,946.0,今ね
946.0,948.0,バーチャルyoutuber
948.0,950.0,俺が知ってるってすごいよ
950.0,952.0,キズナアイ
952.0,954.0,ものすごい人気らしいよ
954.0,956.0,チャンネル登録者数
956.0,958.0,なんか200万人とかいるんでしょ
958.0,960.0,生放送とかしたら10万人とか
960.0,962.0,集めるらしいので
962.0,964.0,すげーなと思うわ
964.0,966.0,熱量が
972.0,974.0,チャンネルが170万人で
974.0,976.0,サブチャンネルが70万人らしいよ
984.0,986.0,俺は最近またユイが見てる
986.0,988.0,最近ニコ生やってるよね
996.0,998.0,そうそうそう
998.0,1000.0,それと一緒
1002.0,1004.0,お互いが交わることってないじゃん
1006.0,1008.0,お互いが
1008.0,1010.0,交わることってなくない
1010.0,1012.0,雑談をキャスでやるメリットってあるの
1012.0,1014.0,手軽
1014.0,1016.0,俺よくねホテル泊まってるときは
1016.0,1018.0,追キャスやるんだよ
1018.0,1020.0,本当に
1020.0,1022.0,ちょうどいいんだよね
1022.0,1024.0,寝れないからどうせ今日とか
1024.0,1026.0,一人で考えてたらさ
1026.0,1028.0,ギター大丈夫かな歌大丈夫かな
1028.0,1030.0,ってなってさ
1030.0,1032.0,やっぱり始めるじゃん
1032.0,1034.0,大丈夫かなってオーナーに始めるじゃん
1034.0,1036.0,オーナーに対して
1036.0,1038.0,不本意なオーナーにするじゃん
1038.0,1040.0,義務的なオーナーに
1040.0,1042.0,ダメだなーって
1044.0,1046.0,無心になることが大事
1046.0,1048.0,ギターいい感じ
1048.0,1050.0,いい感じっていうか
1050.0,1052.0,今弾いてもいいけど本番のほうが良くない
1056.0,1058.0,失敗したときにオー弾きそうでさ
1060.0,1062.0,失敗したときに
1066.0,1068.0,本番まで待ったほうがいいでしょ
1068.0,1070.0,寝る前に一回だけ聞くけど
1076.0,1078.0,おっさんと二次元の女の子で
1078.0,1080.0,ドッコイドッコイな気がするけど
1080.0,1082.0,二次元の女の子ってさ絵だぜ絵
1082.0,1084.0,どんなにこっちが好きになってもさ
1086.0,1088.0,存在しないんだよだって
1088.0,1090.0,そんで次行くのは
1090.0,1092.0,中身の声優さんどんな人だってなるじゃん
1092.0,1094.0,かわいそうじゃんそんなの
1096.0,1098.0,声優の人とかかわいそうだと思うもん
1106.0,1108.0,でも気持ちわからなくもない
1108.0,1110.0,声力に直結してるんだったら
1110.0,1112.0,俺がたまにペンギンクラブでオーナーに
1112.0,1114.0,してえなっていう
1114.0,1116.0,気持ちと
1116.0,1118.0,それが
1118.0,1120.0,オーナーにしてるんだったら俺は理解できる
1120.0,1122.0,純粋に応援してるんだったらまじで理解できなくなっちゃう
1124.0,1126.0,これってもうジェネレーションギャップだからしょうがねえんだよ
1126.0,1128.0,俺も33になるからさ
1128.0,1130.0,それでさ俺がもしさ
1130.0,1132.0,いやバーチャルユーバーいいよなかわいいよな
1132.0,1134.0,って言ってる方が問題だと思うから
1134.0,1136.0,俺なんか健全でいたいもん
1136.0,1138.0,気持ち悪いだろ30に戻ってさ
1138.0,1140.0,彼女も作らずバーチャルユーチューバーに
1140.0,1142.0,依存してたら
1142.0,1144.0,キメだろ
1144.0,1146.0,20歳くらいだったらまだかわいいけど
1150.0,1152.0,そう
1154.0,1156.0,この前声優の
1156.0,1158.0,さくらあやねが声優の服装が高いやすい
1158.0,1160.0,かで
1160.0,1162.0,叩かれてばかりされたり
1162.0,1164.0,してること起こってた
1164.0,1166.0,なんで
1166.0,1168.0,どういうこと
1168.0,1170.0,神坂すみれ
1170.0,1172.0,っていう声優
1172.0,1174.0,肝太におかずにされたツイッターやめたらしいぞ
1178.0,1180.0,女性のさ
1180.0,1182.0,スペシャルな部分なんじゃないの
1182.0,1184.0,男性に性的な目で見られる
1184.0,1186.0,っていうの
1186.0,1188.0,彼氏できたんじゃないかな彼氏いると思うよ
1188.0,1190.0,彼氏いると思うよ
1190.0,1192.0,ちゃんと
1194.0,1196.0,さっき電話来たわ明日長会議頑張ってね
1196.0,1198.0,上坂って読むんだ
1198.0,1200.0,おっぱいでかい子でしょ
1200.0,1202.0,知ってる
1208.0,1210.0,同性の女の子が応援してるんだったら
1210.0,1212.0,多少理解できる
1212.0,1214.0,女ってバカだからそういうの好きそうじゃん
1216.0,1218.0,リアルな自分よりちょっとかわいいやつは
1218.0,1220.0,応援できないじゃん
1220.0,1222.0,自分のランクが下がるから
1222.0,1224.0,だけどA応援してたら
1224.0,1226.0,自分の地位は下がらないじゃん
1228.0,1230.0,そういう
1230.0,1232.0,ところあるかなっていう
1234.0,1236.0,ふうに思います
1238.0,1240.0,だからいいんだよ別に
1240.0,1242.0,好きなやつ応援しろよ
1244.0,1246.0,俺に認められる必要なくないか
1246.0,1248.0,なぜ俺が認めなきゃいけないの
1250.0,1252.0,嘘ついて好きだよって言わなきゃいけないの
1254.0,1256.0,なんなら上坂すみれは別に好きじゃないわ
1258.0,1260.0,嫌いでもないし好きでもない
1264.0,1266.0,上坂すみれは自撮り写真の眼球に映った
1266.0,1268.0,部屋の内装まで買いすぎてる
1274.0,1276.0,ジャニオタが山口の被害者探して
1276.0,1278.0,ブサイクさんのマウント撮ってた
1278.0,1280.0,えー
1280.0,1282.0,そうなんだ
1282.0,1284.0,怖いよね
1284.0,1286.0,よかった男に生まれて
1290.0,1292.0,男に生まれてよかったなって
1292.0,1294.0,思いました
1296.0,1298.0,俺は
1298.0,1300.0,ストーカーだな
1302.0,1304.0,ストーカー
1304.0,1306.0,だからもう結論を言うとな
1306.0,1308.0,俺たちみたいなもんなんだ
1308.0,1310.0,どこも
1310.0,1312.0,変わんねえの
1312.0,1314.0,堂々と生きていこうぜ
1314.0,1316.0,堂々と
1316.0,1318.0,堂々と
1320.0,1322.0,お互いバカにしあって生きていこうぜ
1322.0,1324.0,それがもう世の常でしょ
1326.0,1328.0,これは別にね
1328.0,1330.0,憎しみ合ってるわけじゃなくて
1330.0,1332.0,ある種のエイルだから
1332.0,1334.0,な
1334.0,1336.0,エイル
1338.0,1340.0,花ちゃんね面倒見てくれてる
1342.0,1344.0,花ちゃん
1344.0,1346.0,キングダムの50巻
1346.0,1348.0,買ったけど読んでないわまだ
1348.0,1350.0,読む気になれなかった
1354.0,1356.0,ギター弾きながら読んでたんだけど
1356.0,1358.0,いまいち頭入ってこなかった
1360.0,1362.0,いまいちピュって入ってきませんでした
1364.0,1366.0,で
1366.0,1368.0,49巻忘れちゃってて
1370.0,1372.0,声優の竹立あやなは
1372.0,1374.0,東大生に青春期予測されて
1374.0,1376.0,論文で発表されてた
1376.0,1378.0,かわいそうだね
1378.0,1380.0,気の毒になっちゃうわ
1380.0,1382.0,気の毒になっちゃう
1382.0,1384.0,女がさそんな風にされてんの
1384.0,1386.0,自分の女だったらそいつ殺したくなるわ
1388.0,1390.0,竹立
1390.0,1392.0,自分の彼女が
1392.0,1394.0,されてたら
1394.0,1396.0,かわいそうだな
1396.0,1398.0,なんで声優だけそのターゲットされてんだ
1400.0,1402.0,幻想を抱きがちなんじゃない
1404.0,1406.0,アニメのキャラクターとかってさ
1408.0,1410.0,無償の愛を提供してくれるじゃん
1410.0,1412.0,だから中身の人も
1412.0,1414.0,そうだと思ってんじゃない
1414.0,1416.0,俺たちと同じ人間なのに
1416.0,1418.0,うんこもするし
1418.0,1420.0,ケツからコンペート出てこないじゃん
1420.0,1422.0,うんこ垂れるじゃん
1422.0,1424.0,それが信じられないんじゃないかな
1432.0,1434.0,信じられないんじゃないかな
1440.0,1442.0,かわいそうだな
1444.0,1446.0,アイドルだから本音も言えないんだ
1450.0,1452.0,童貞が一番多いコンテンツ
1452.0,1454.0,声優さんに恋をするっていうのも
1454.0,1456.0,俺の中で分かんないんだよな
1458.0,1460.0,あってかわいいなとか
1460.0,1462.0,そういうのはもちろんあるけど
1462.0,1464.0,綺麗な子だなとか
1464.0,1466.0,声かわいいなとか思うけど
1466.0,1468.0,アニメのキャラから恋愛に発展するみたいなのはないんだよな
1470.0,1472.0,本当に
1472.0,1474.0,いのちなんかおなりできるのは
1474.0,1476.0,2、3回やろうと思えば
1476.0,1478.0,です
1482.0,1484.0,声優野沢雅子みたいなやつが
1484.0,1486.0,俺アイデンティティの動画ずっと見てたわ
1486.0,1488.0,オラ野沢雅子ってやつ
1490.0,1492.0,カタクナに悟空って言わねえなって思いながら
1498.0,1500.0,あれクソおもろいわ
1500.0,1502.0,あれ最高だわ
1502.0,1504.0,寝る気あるよ
1504.0,1506.0,寝る気あるよ
1508.0,1510.0,おもろいわ
1512.0,1514.0,オタクはそういう気持ち悪いことするのが
1514.0,1516.0,面白いと思ってるんだよね
1518.0,1520.0,恋愛感情の表現の仕方が
1520.0,1522.0,不器用なだけなんじゃない
1522.0,1524.0,俺キモいとは思わない
1524.0,1526.0,普通に彼女とかできたらさ
1526.0,1528.0,多分冷めるでしょ
1528.0,1530.0,キズナアイ萌えみたいな
1530.0,1532.0,冷めんじゃないの
1536.0,1538.0,冷めないの
1538.0,1540.0,それはそれ
1540.0,1542.0,これはこれ
1542.0,1544.0,ジャニーズとかアイドルだったらまだ理解できるんだよ
1546.0,1548.0,あと6時間30分で
1548.0,1550.0,今日寝ますか
1550.0,1552.0,多分今日すぐ寝れればスッと
1552.0,1554.0,お風呂入って寝ます
1554.0,1556.0,明日お会いしましょう
1556.0,1558.0,さよなら
1558.0,1560.0,バイバイ
