start,end,text
0.0,2.6,だと思うぞ
4.08,7.36,ガチじゃなきゃあんなこと言えない
12.200000000000001,18.92,なんか言ってたじゃん誰かがそのツイッターのフォロワーとか youtube のチャンネル登録者でもツイッターのフォローも多分増えてるの
18.92,23.0,俺最近何いる 10万人ぐらいいるよ
23.0,28.240000000000002,11万3769人 だって
28.240000000000002,36.68,なんかその自分の ところをするなかす通っていった人間の数だからそんなに参考にスハマ
36.68,42.040000000000006,振ってなきゃハマちゃんの息子が言ってたんだっけ ハマちゃんの息子が
42.040000000000006,45.6,そんなに気にしすぎちゃダメだよ
45.8,48.400000000000006,言ってたよな
52.08,57.44,浜岡本そうそうそうそう浜岡本言ってだよ
58.36,61.68,浜岡本が言ってました
63.440000000000005,72.04,ツイッターのフォローファーストが気にしないので待ってほんとそれこそマジで1ミリも 気にしてねツイッターで今気にしてるのは俺霧島桜のツイートだけだから
72.04,77.32000000000001,それ以外のことを追ってツイッター活用してないマジで今俺がツイッター使ってる 理由の第1
77.32000000000001,83.4,99.9%は俺霧島桜のエロい写真見てる 常に
83.4,90.48,俺がツイッター開くと俺のページじゃなくて霧島桜のページ開くもん なんだこれって
92.0,95.44000000000001,そこで何か固定されてる
99.52000000000001,101.92,俺はな
103.56,109.88000000000001,まさにそういう使い方を させていただいておりますわ
110.88,118.88,お前がジュース買って言ってる間に霧島桜見てきたけどよかったぞいいだろ ためになっただろ
118.88,125.44,ために もうちょっとこうやってなんかねそぎ落とされて
125.44,130.0,演技臭さがなくなってきたらもう一流よ
131.44,138.44,みんなで岡野ライブ配信にそんなやつより自分を見に行こいってコメントしに行こう
138.48,149.16,おい冷静なれ東海オンエアの視聴者こいつより順の方が面白いから順の放送見に行こう いいねいいね行こう行こうってなるわけねえだろうが馬鹿が
149.48,152.2,池沼が
152.48,160.88,いいねえ順見に行こうぜみんな行こう行こうってなるんだったら俺はよしじゃあ行こう ぜってなるけどなるわけねえだろうが
160.88,163.44,バカか
163.76,173.6,順行こうぜやって こんな奴らより
173.96,176.96,順位かねえって言って
178.28,187.16,なる人もいるかもしれない発想でそんな俺なんでそんなさ ニコニコでバカ集めるのいいけど youtube はまともなやつ集めたいのにさ
187.16,195.48,なんでそう言ったってそれで順見に行こうぜそういくべきってやつって絶対知恵をくるじゃん またそういう奴らを集めて俺はの仕上がっていくの
195.48,198.6,そういう池沼を
198.72,211.07999999999998,で他の奴らはそういうゴミどもが抜けてちゃんとしたや集まりになってそういうところから 抜け落ちたクズどもを集めて俺はまたの仕上がっていかなきゃいけないの
212.0,214.92,そういうクズども
218.16,220.16,ん
221.2,226.24,ゴミ処理所 のむさん時代の阪神見てることしなきゃいけねえんだ
226.24,231.44,野村阪神野村再生工場加藤順一再生工場
232.72,240.96,まあでも悪くはないなぁそれもおもろそうだな なんか無理やりだからこじ開けるのは良くないけどもうダメだ
240.96,246.92000000000002,俺に居場所はないんだ俺みたいなクズは youtube にいちゃいけないんだ 俺は殺害予告したいんだ
246.92000000000002,251.92000000000002,みたいな奴を集めていこう ダメな奴
252.44,258.92,なんとかして俺が再生させやるって 何とかしてやるって
259.04,266.96000000000004,僕はもう殺害予告をしたいんだ俺はもうダメなんだ そういう奴だな
267.28,271.44,加藤順一 厚生施設
271.44,276.71999999999997,なんか順チャンネルって名前変えようかな加藤順一厚生施設にしようかな
278.64,282.0,加藤順一厚生施設
286.32,292.08,言い得てみようじゃねえか そういうノリ
297.84,304.08,順チャンネルってちょっと分かりづれえよな
305.28,310.24,名前分かりづらくねえ ちょっと
310.64,314.64,加藤順一クリニック ああ
315.52,319.76,個性がねえよな 順チャンネル
319.76,323.67999999999995,漢字がいい漢字って使えんの
327.91999999999996,335.35999999999996,漢字 チャンネルいらねえな加藤順一にしちゃいな加藤順一
335.71999999999997,338.32,使えるんだ
338.32,342.4,加藤順一いいな加藤順一
343.91999999999996,346.47999999999996,ストレート
347.24,355.56,加藤順一漢字だと海外取り込めないぞなんで海外に名付けなきゃいけねえんだ 漢字にしたら中国取り込めんじゃねえかよ
355.56,361.72,加藤順一って中国語でなんて発音するんだ そこを意識していこうぜ
362.44,367.56,13億人いるんだぞおい 英語圏?クズ
367.56,371.8,チャイニーズよやっぱ チャイニーズ
372.64,377.36,なんで順チャンネルにしたんだ別になんか当時は何も考えてなかった
377.96,381.28,何にも考えてなかった
381.32000000000005,387.92,加藤順一って中国語でなんて発音すんの 教えてくれマジで
391.16,394.24,あ 今なんかあった
394.24,400.48,あーもう流れが早すぎて追えねえちっくしょー クズか
400.48,403.28000000000003,おいこれ
403.48,406.6,なんだこのクズは
407.6,412.32000000000005,クズのツールか
413.16,415.8,クズール
419.04,424.88,視聴者追いアピやめろな 厳に追えてねえだろうが厳に
425.36,430.28000000000003,右クリック あーなるほど
430.52000000000004,435.00000000000006,中間チュイニーってらしい
435.00000000000006,439.00000000000006,加藤順一は中間チュイニーってらしい
439.36,442.88000000000005,順一ちゃんにぃはん
443.8,449.20000000000005,中間チュイニー いいじゃん中間チュイニー
449.44000000000005,454.36,中間チュイニー 発音良くねえか
455.36,461.76,ちょっとなんかねえ 順ちゃんねる
461.76,467.76,違うなぁと思いながら俺は 生きてるんだよね
468.92,474.52000000000004,違うなぁつって 生きてます
474.64,477.16,僕は
477.8,481.84000000000003,google翻訳使いいいね確かに
482.36,488.08000000000004,と google 翻訳
488.08000000000004,490.28000000000003,で
490.76000000000005,496.32000000000005,英語じゃない ここを日本語にして
499.24,504.8,とここ日本語にして ここを中国語にして
504.8,510.08000000000004,やっぱ俺もなぁ世間を 世界を
511.88000000000005,513.88,ん
513.88,518.52,加藤 順一
520.76,524.2,中に入った 中に入った
524.2,527.88,っていうらしい俺は 中に入った
527.88,533.0400000000001,中に入った 中に入った
534.5600000000001,540.52,加藤順一です 家族に全然違うじゃねーかよ
540.56,545.48,し家藤純一 これも加藤順一ですっていうらしい
545.48,550.4,し家藤純一 し家藤純一
550.4,555.88,これが加藤順一ってらしい ちょっと音声で行ってみるか
556.76,562.4399999999999,皆さんこんにちは 僕の名前は加藤順一です
563.44,569.24,皆さんこんにちは 僕の名前は加藤順一です
569.24,576.6,こうして俺は語学を習得したいんだ 水ちゃん海藤にーって聞き取れたよなお前今
576.6,583.08,皆さんこんにちは 僕の名前は加藤順一です
583.08,587.0,水ちゃん海藤にーって 加藤順一って
587.0,593.92,皆さんこんにちは 僕の名前は加藤順一です すっご
596.64,599.12,やば
599.6,603.08,こうやって覚えていくんだなぁ
606.36,608.96,やば
609.36,612.84,でもこれさぁ これあったらさぁ
612.84,616.24,語学なんていらないじゃん
617.48,623.04,全部やってくれるんだよ見てこれ すごくない
624.72,629.32,見えてるかなぁ 喋るだけでいいんだぞ
631.0,634.72,見てて どうも皆さんはじめまして
634.72,641.44,今日はですねロックマン x 2をやっていきたいとおもいますよろしくお願いします
644.32,646.84,ってやるじゃん
648.0,656.52,みんな始まったよ 今日はロックマン x 2をやっていきたいとおもいます
656.52,659.28,やばくね
661.4,664.44,英語とかにすればさぁ
664.56,669.32,みんな始まったよ 今日はロックマン x 2をやっていきたいとおもいます
669.32,672.92,ほら 要らねーじゃん
673.0,679.92,みんな始まったよ 今日はロックマン x 2をやっていきたいとおもいます
679.92,684.8,みんな始まったよ 今日はロックマン x 2をやっていきたいとおもいます
684.8,688.16,なんだこれ めちゃくちゃじゃねーか
688.4,692.9599999999999,めちゃくちゃだけど もうさ無敵なわけよ
694.88,699.24,再翻訳してみようか これを
700.24,703.24,コピー
703.24,706.6800000000001,貼り付け英語 日本語
706.6800000000001,715.44,誰もが始まった今日はそれがロックマン x をしたいと思う私は願いたい まあでもそうだね英語って逆になっちゃうもんな
715.76,721.76,その辺の知能はないんだろうな もっと進化してほしい
721.76,726.16,もっともっと 無敵じゃん
726.24,734.76,つべで字幕つければ勝手にそれが えっちょっと待って俺じゃあさぁもう日本に居ながらして世界とも戦えるってこと
737.4,740.68,もうこんなすぐできちゃうよ
749.8,753.8,翻訳雇わなきゃいけない あー
753.84,760.0400000000001,いやいやこの程度だしって言うけどこの速度でさぁ 俺今普通に喋っただけなんだぜ
760.0400000000001,768.5600000000001,それでこの速度で同時通訳してくれたらニュアンス絶対伝わるから 海外行った時にそうだって俺今ソフトバンク使ってるんだけど雨放題持ってるからアメリカに
768.5600000000001,773.96,スマホ一台持ってって google 翻訳でここ行きたいですってさこれ聞かせればいいってことでしょ
773.96,776.9200000000001,なんでもいけんじゃん
777.2800000000001,784.9200000000001,ニュアンス伝わればいいじゃん単語とか 通訳いらねーじゃん
790.2800000000001,794.48,この前外国人がそれ使って道聞いてきたよ
797.6,801.3600000000001,って技術の進歩って恐ろしいねー
802.36,808.52,技術の進歩ってなんか俺の知らない間にどんどんどんどん
808.52,811.6800000000001,進化していくんだろうなぁ
812.4,818.28,発達障害で参加後空語を話す女がいたらそいつアドベーツとぜひとも
819.28,826.28,通訳はもうなくなる職業ランキングに入ってきてるよまでも全く持ってなくなることは ないだろうけど
826.9599999999999,833.9599999999999,でも こっちのほうが楽だもんねー
836.0799999999999,841.04,すごい なんかびっくりしちゃう
841.64,848.9599999999999,横浜みどりがそれ使って全く伝わったら大切だって日本喋れねーじゃねーか 日本語喋れねーので無理だろうがいい
848.9599999999999,853.68,日本語を理解できてないじゃん機械が
856.3199999999999,858.3199999999999,ん
859.88,866.28,いやなんか恐ろしいわー ゲームとか多分一瞬だろうなぁ
872.24,878.8399999999999,信じられない 常に有志にツイッチビリビリでミラーさせたら確実に人質されていく術とやってよ
878.8399999999999,884.76,昔あったんだけどなツイッチミラーとビリビリミラーてビリビリミラーと大変そうなんだもん なんか
884.8,894.24,なんかビリビリちょっと枠開いてビリビリの中国人と絡もうぜおい見てるやつって 俺が来たからにはお前らもう俺の虜になれよつってさ
894.24,898.36,公式ビリビリアカウントみたいなかったっけ俺
898.8,901.92,だってそのほうがいいだろう
903.84,911.68,なんかその俺っぽい中国人を雇ってきてそこで加藤順一名前で活動させて ビリビリミラーしてくれよビリビリミラー
911.6800000000001,915.9200000000001,お前の愛し常にビリビリミラーされてるぞ今は
918.6,922.6800000000001,昨日脱走が降りるためで英訳ミラーしへ
926.6800000000001,929.2,やりたい
929.2,936.9200000000001,前ビリビリで5万人集めずの中国人の5万人で日本換算したら10分の1だから5000人 ぐらいな
938.2,940.96,5000人ぐらい
942.36,944.36,ん
944.5600000000001,947.5200000000001,やってほしいなぁ
947.96,950.7600000000001,そうなんだよ
951.0400000000001,954.4000000000001,ほんとは同時配信したいんだけどねぇ
954.9200000000001,961.36,ビリビリ伸びそうな予想がないゲームで中国人と直接絡むしかねー なんか止まったなぁ
961.36,969.44,あみんなこれ動いてるおっなんか変なタイミング止まったね俺回線落ちてねーぞ 今これ聞こえてる人いる
969.48,971.48,を
971.48,974.44,多分聞こえてる人いるよねー
974.44,980.84,なんだそれ なんだこれ俺もこの動画は再生できませんなってるよ
981.24,984.44,見てるけど そのうちなるのかな
984.44,987.5600000000001,更新してみていいかはい
990.12,992.9200000000001,これ何なんだろうねぇ
993.6800000000001,998.48,たまにあるよなぁ たまにあのとのとのと
998.52,1004.04,これ多分つべ川のなんかアレだと思うよ つべ川の
1005.48,1008.72,昨日もあったんだへ
1009.28,1013.2,意味がわからん更新したら俺もなおったわ
1017.5600000000001,1021.0,爆走の時もあったんだふー
1022.76,1025.92,なんかねあるらしいは
1026.92,1036.64,ヘイトでバン今日の俺のどこにヘイト的要素があったんだ ブライアンを獣だと表現したところか
1036.64,1044.48,それに関してはもう誠心誠意謝罪申し上げます ブライアンさん本当にすいませんでした
1045.88,1050.72,おしっこしてくるわ ブライアンバカにしてごめん
1050.72,1053.5600000000002,おしっこしてきます
1055.92,1057.92,おしっこしてくるわ
1057.92,1059.92,おしっこしてくるわ
1059.92,1061.92,おしっこしてくるわ
1061.92,1063.92,おしっこしてくるわ
1063.92,1065.92,おしっこしてくるわ
1065.92,1067.92,おしっこしてくるわ
1067.92,1069.92,おしっこしてくるわ
1069.92,1071.92,おしっこしてくるわ
1071.92,1073.92,おしっこしてくるわ
1073.92,1075.92,おしっこしてくるわ
1075.92,1077.92,おしっこしてくるわ
1077.92,1079.92,おしっこしてくるわ
1079.92,1081.92,おしっこしてくるわ
1081.92,1083.92,おしっこしてくるわ
1083.92,1085.92,おしっこしてくるわ
1085.92,1087.92,おしっこしてくるわ
1087.92,1089.92,おしっこしてくるわ
1089.92,1091.92,おしっこしてくるわ
1091.92,1093.92,おしっこしてくるわ
1093.92,1095.92,おしっこしてくるわ
1095.92,1097.92,おしっこしてくるわ
1097.92,1099.92,おしっこしてくるわ
1099.92,1101.92,おしっこしてくるわ
1101.92,1103.92,おしっこしてくるわ
1103.92,1105.92,おしっこしてくるわ
1105.92,1107.92,おしっこしてくるわ
1107.92,1109.92,おしっこしてくるわ
1109.92,1111.92,おしっこしてくるわ
1111.92,1113.92,おしっこしてくるわ
1113.92,1115.92,おしっこしてくるわ
1115.92,1117.92,おしっこしてくるわ
1117.92,1119.92,おしっこしてくるわ
1119.92,1121.92,おしっこしてくるわ
1121.92,1123.92,おしっこしてくるわ
1123.92,1125.92,おしっこしてくるわ
1125.92,1127.92,おしっこしてくるわ
1127.92,1129.92,おしっこしてくるわ
1129.92,1131.92,おしっこしてくるわ
1131.92,1133.92,おしっこしてくるわ
1133.92,1135.92,おしっこしてくるわ
1135.92,1137.92,おしっこしてくるわ
1137.92,1139.92,おしっこしてくるわ
1139.92,1142.92,思うけどさ、俺らって暇よね、ほんとに。
1144.3200000000002,1145.52,俺らって暇よね。
1147.72,1148.8200000000002,すぐと思うよ。
1149.8200000000002,1151.6200000000001,俺らって暇よねーって。
1152.42,1154.6200000000001,こんなさ、今日何曜日?日曜日だろ?
1156.42,1158.52,8月最初の日曜日よ。
1158.92,1159.72,何してんの?
1160.42,1163.1200000000001,8月最初の日曜日何して過ごしたか教えてくんねえか?
1163.52,1166.8200000000002,俺は、松井のしきるしき見て、寝て起きて配信に止まったわ。
1170.92,1172.92,ほんとに暇よね。
1173.92,1178.92,なんか、同世代の奴らは多分さ、家族とさ、子供いたりしてさ、
1179.92,1183.92,家族と過ごしたりしてんだろうなあ。
1184.42,1185.42,だるっ!
1187.92,1189.92,寝て起きて配信しろよ、みんな。
1190.92,1192.92,おい、仕事やめろ、俺と同世代。
1193.92,1195.92,寝て起きて配信しろ、お前らも。
1196.92,1197.92,だるいから。
1198.92,1200.92,週一、たまの休みでよ。
1201.92,1203.92,一生懸命、生きずに。
1204.92,1206.92,寝て起きて配信しよう、みんなで。
1207.92,1209.92,子供がどうなの。
1210.92,1212.92,なあ、嫁がどうなのじゃなくて。
1214.92,1216.92,クワガタとか取り行け。
1217.42,1218.92,一人で、パソコン持って。
1219.92,1221.92,僕はもう、切に願いますよ。
1222.92,1223.92,なんか残り、
1224.92,1227.92,今日が変わる2時間の間に、俺たちがなんかすごくな、なそうぜじゃん、おい。
1228.92,1232.92,8月最初の日曜日だから、俺たち力合わせてすごいことなす枠。
1236.92,1241.92,今日のあのコンセプト、この2時間で、すごいことをなします。
1242.92,1244.92,なんとかなそうぜ。
1244.92,1246.92,2時間で、すごいことをなします。
1247.92,1249.92,なんとかなそうとする。
1250.92,1252.92,なそうとしよう、みんなで。
1255.92,1260.92,うわあ、今年の8月1日、初日の日曜日、すごかったね。
1261.92,1264.92,すごいことしたね、世間のためになったね、みたいな。
1271.92,1273.92,腰を据えてな、まず。
1275.92,1277.92,ツイッターのトレンド1位取るぞ。
1278.92,1279.92,全然嬉しくない。
1280.92,1281.92,全然嬉しくないわ。
1283.92,1284.92,そんなの。
1294.92,1295.92,嬉しくない。
1305.92,1307.92,Yahoo!トップページに乗る。
1308.92,1310.92,ああ、いいね、なんかいいことして乗るんだったらいいな。
1311.92,1312.92,いいことして。
1314.92,1316.92,いいことして乗るんだったら全然アリだけど、ちょっと。
1317.92,1319.92,やっぱいいことってなかなかさ、パッてできないじゃん。
1320.92,1321.92,何かなしたいね。
1323.92,1324.92,何か。
1325.92,1327.92,うん、撮つとか面白くないわ。聞きたくない。
1328.92,1330.92,俺、視聴者の声よりもっと聞きたくないの。配信者の声。
1331.92,1332.92,マジで。
1332.92,1333.92,マジで。
1334.92,1335.92,1位。
1336.92,1338.92,視聴者の声とか別に正直どうでもいいのよ。無。
1339.92,1341.92,配信者の声はマジで害。
1342.92,1343.92,害役。
1344.92,1345.92,いらねえ。
1346.92,1347.92,自分以外の声乗せたくない。
1350.92,1351.92,明確にコラボする。
1352.92,1355.92,向こうと一緒にパワープロやるとかの時以外はもう本当に無。
1358.92,1359.92,害です、それは。
1362.92,1363.92,お前、今見てるよ。
1364.92,1365.92,今、え。
1366.92,1371.92,お前の今見てる視聴者が100円ずつ募金したら1500万でもなんかもったいなくない?100円募金するの。
1372.92,1373.92,もったいないからやめようぜ。
1374.92,1376.92,それ俺たちに害がないやつにしようぜ。
1377.92,1378.92,ジュース買ったほうがいいわ。
1382.92,1383.92,もったいなくないことやりてえ。
1385.92,1386.92,もったいなくないこと。
1386.92,1387.92,もったいなくないこと。
1391.92,1392.92,なんかいいことねえかなあ。
1396.92,1397.92,今から1分呼吸止めよう。
1398.92,1399.92,絶対やだわ。
1400.92,1401.92,そんなの。
1401.92,1402.92,恐怖患者に実習させる。
1402.92,1403.92,あ、いいね。
1404.92,1406.92,なんかさ、俺もさ、やっぱ手柄取りにいいじゃん。
1407.92,1408.92,お前らの中に犯罪者絶対いるじゃん。
1409.92,1411.92,そいつを出頭させて俺の手柄にしよう。
1412.92,1413.92,それどうよ、みんな。
1414.92,1415.92,そしたら俺は一役時のヒーローじゃん。
1416.92,1418.92,人生壊れるだけでさ、俺の株上がるわけじゃん。
1420.92,1421.92,そうしようぜ。
1425.92,1426.92,そうしよう。
1428.92,1429.92,俺の手柄じゃん。
1430.92,1431.92,それ。
1432.92,1433.92,絶対いるじゃん。
1434.92,1435.92,実習させようぜ。
1441.92,1442.92,そうしよう。
1442.92,1443.92,視聴者1人いるぞ。
1443.92,1444.92,でもその功績により
1444.92,1445.92,色んな所から
1445.92,1446.92,わ、この人って凄いんだ。
1446.92,1447.92,ヒーローなんだ。
1448.92,1449.92,つって
1450.92,1451.92,俺の善行が轟いて
1455.92,1456.92,いいじゃん。
1456.92,1457.92,一人、夏休み一人ずつ
1458.92,1459.92,毎日毎日何か終わった後に寝る前に
1460.92,1461.92,はいじゃあ今日も今日実習してくれる人
1462.92,1463.92,つって30人捕まえたら
1464.92,1465.92,もう俺時のヒーローだろ。
1466.92,1467.92,8月だけで30人
1468.92,1469.92,凶悪犯罪者をパクらせました。つって。
1471.92,1472.92,凄いことじゃない?
1475.92,1476.92,30人くらい絶対いるから。
1479.92,1480.92,そういうクズ。
1484.92,1485.92,俺はそれに
1485.92,1486.92,かけてみようと思う。
1487.92,1488.92,なんかまた配信止まっちゃったな。
