start,end,text
0.0,2.0,マジかよ 早いですね
2.0,3.0,やだよ
3.0,4.0,じゃあ行きましょうか
4.0,6.0,こちらでございまーす
8.0,11.0,ニコニコのゲーム実況はどうすれば盛り上がるのか
13.0,14.0,なるほど
14.0,15.0,先ほどYouTubeの話いっぱい出ましたけど
15.0,17.0,今度はじゃあニコニコ
17.0,19.0,ニコニコのゲーム実況は
19.0,20.0,皆さんから見て
20.0,22.0,こうすればいいんじゃないかという
22.0,24.0,アイディアも議論ぜひ展開していただきたい
24.0,27.0,あー
28.0,29.0,これ
29.0,30.0,簡単じゃない
30.0,32.0,みんな同じ答えかなって
32.0,33.0,すごい簡単
33.0,34.0,はい
34.0,36.0,超簡単じゃないですか
36.0,38.0,もう皆さんには答えが見えている
38.0,42.0,なんかみんな同じ答えを持ってると思ってるんですけど
42.0,45.0,ピンときてないから発言して
45.0,47.0,最初に言っちゃっていいですか
47.0,48.0,お金
48.0,49.0,そうそうそう
49.0,51.0,そしたらみんな戻ってきますよ
51.0,53.0,YouTubeにいってる人たちも
53.0,55.0,ニコノーの方がお金もらえるよって言われたら
55.0,56.0,全員戻ってきますよ
56.0,57.0,そう
57.0,59.0,あれ違うのみんなは
59.0,60.0,いやまぁ
60.0,61.0,割と正解
61.0,62.0,だよね多分
62.0,64.0,そういうのってやっぱあるんじゃないですか
64.0,67.0,ここにいる人たちは誰かとかじゃなくて
67.0,68.0,ね
68.0,70.0,それが一番簡単ですよね
70.0,72.0,ここではっきりしておきたいのはやっぱり
72.0,74.0,YouTubeに行きたい人っていうのは
74.0,76.0,そういう人なんだろうなっていうのは
76.0,77.0,トゲあるなー
77.0,78.0,間違いない
78.0,79.0,トゲあるなー
79.0,81.0,攻撃しませんか
82.0,84.0,聞きましょ聞きましょ
84.0,88.0,それは人間である限り否定はしない
88.0,90.0,だって俺たちだってさ
90.0,92.0,金がないと生きていけないわけだ
92.0,95.0,もっと持っていたら今できることより
95.0,97.0,できることが増えるわけだ
97.0,98.0,だからそこは否定はしない
98.0,100.0,だけどやっぱその
100.0,103.0,それで失ってるものの方が多いかもしれない
103.0,104.0,ありますね
104.0,106.0,そこを追求することによって
106.0,110.0,で俺は自分があんまりそうなりたくなくてっていう
110.0,112.0,そのまず思いがあって
112.0,114.0,じゃあってことを考えたときに
114.0,117.0,そのニコニコ動画がどうすれば盛り上がるのか
117.0,119.0,YouTubeの人オープンレックの人
119.0,122.0,Twitchキャストの人戻すっていう意味で
122.0,123.0,盛り上がるっていうんだったら
123.0,127.0,今のお金っていうのは大きな要素だと思う
127.0,129.0,ごめん長くなってぐるっと一周しただけ
129.0,133.0,熱量はあるのでぜひ聞きたい
133.0,137.0,一応つみやさんにちょっと語弊がないように言っておくと
137.0,138.0,お金もそうなんだけど
138.0,140.0,もう一個実はでっかいのがあって
140.0,143.0,他サイトのやっぱ作った作品って
143.0,147.0,一人でも多くに見てもらいたいっていう思いがあります
147.0,151.0,俺僕それYouTubeで生放送してるんですけど
151.0,153.0,本当にでかいところで
153.0,157.0,単純に規模がでかいところでやりたくなるんですよ
157.0,159.0,5000人満員のところと
159.0,163.0,1万人2万人くるところ両方箱持ってたら
163.0,166.0,どうしてもそっちでやりたいっていう気持ちって生まれるじゃないですか
166.0,168.0,大きいステージやりたいっていうのがあって
168.0,170.0,今もこのメインのステージで
170.0,172.0,しゃべれてすごく気持ちいい
172.0,174.0,いいですよね
174.0,176.0,だから素直なところで僕のモチベーションが
176.0,178.0,YouTubeとか今やってる理由は
178.0,180.0,すごいありますね
180.0,182.0,YouTubeが今2つ持っちゃってるんですよ
182.0,184.0,いっぱい見てもらえるっていうのと
184.0,187.0,しかも儲かるっていうのがあるので
187.0,190.0,いっぱい見てもらえるを
190.0,192.0,今からすぐ叶えられるかニコニコは
192.0,195.0,それはたぶん少しずつ上がっていくものだと思ってます
195.0,198.0,今すぐできる力技は何だって言ったら
198.0,200.0,儲かるっていうことかな
200.0,203.0,動画投稿の機能が洗練されてて
203.0,207.0,投稿者にとって裏のツール使ってると
207.0,211.0,なんかニコニコにYouTubeの方が便利だなって感じちゃうときがあって
211.0,214.0,それが最後の人気になるところだと思うんで
214.0,217.0,俺はぜひそこを今改善してもらってると思うけど
217.0,219.0,ちゃんと力を入れて
219.0,221.0,投稿者向けの機能を改善してほしいと
221.0,223.0,いいこと言った
223.0,226.0,確かにいろんな投稿者向けの機能が不便だったり
226.0,228.0,って言われますからねニコニコは
228.0,230.0,時代変わらずと
230.0,234.0,毎日動画投稿してるんですけど
234.0,237.0,結構まとめて15個ぐらいの動画を
237.0,239.0,1日で上げるときとかあるんですよ
239.0,241.0,すごい
241.0,246.0,15日後の予約投稿で
246.0,249.0,15日の動画をよいしょって上げるので
249.0,252.0,YouTubeだとだいたい10分で終わるんですよね
252.0,255.0,あとはアップロードの放置するだけ
255.0,257.0,ニコニコでその作業すると
257.0,260.0,1時間くらいかかりますね
260.0,262.0,早くて1時間
262.0,265.0,遅くて2時間くらいかかる
265.0,269.0,そんなことする人あんまりいないだろって思う人いるかもしれないけど
269.0,273.0,人気であれば人気であるほどそういうことする人多いから
273.0,275.0,俺も結構やるし
275.0,277.0,同時に投稿ができるんですよね
277.0,280.0,20個一気に投稿っていうのがYouTubeできるんですけど
280.0,282.0,なんかニコニコでそれやろうとすると
282.0,284.0,前の動画がまだ投稿してないから
284.0,286.0,待ってっていう風になるんですよ
286.0,290.0,すなざめさんは20個一気に投稿することもあるし
290.0,293.0,じゃあ今結構宮助ちゃんの話も聞きたいという方もいるので
293.0,296.0,宮助ちゃんはそんな同時投稿を最大何本したことある?
296.0,297.0,ないないない
297.0,299.0,最近でもよく動画上げてるよね
299.0,300.0,上げてる
300.0,302.0,なんかね動画上げた方がいいよって言われて
304.0,306.0,ちょっと男に言われたかなみたいな
306.0,309.0,なんか今けだるいOL空気出してるよね
309.0,311.0,上げたほうがいいよって
311.0,312.0,ファンの方にってことでしょ?
312.0,313.0,皆さんに
313.0,314.0,違う違う運営さんに
314.0,315.0,運営に?
315.0,316.0,あらあら
316.0,318.0,しかもニコニコじゃなくて
318.0,320.0,YouTubeにも上げたほうがいいよって言われてるの
320.0,322.0,ニコニコの運営さんにだよ
322.0,325.0,それくらい多分ニコニコに人が減ってるってことだから
325.0,328.0,でもねそれはね間違いだなと思った最近
331.0,333.0,いつもYouTubeでやってるっていうか
333.0,337.0,僕ニコニコとYouTube同時配信してるんですよ
337.0,340.0,YouTubeで最近人すごいいっぱい見てくれるようになって
341.0,343.0,気分が乗った時に
343.0,345.0,僕ニコ動だけでやる時あるんですけど
345.0,348.0,その時やっぱYouTubeで見てたやつが
348.0,350.0,なんだ今日はニコ動でやるんだって言って
350.0,352.0,結構見に来てくれることあったんですよ
352.0,354.0,この前多分すごい見に来てくれて
354.0,356.0,それでニコ動だけでやった時
356.0,358.0,なんかね最近あるパターン逆輸入とか
358.0,359.0,そう逆輸入
359.0,360.0,言われることが結構あって
360.0,361.0,全然いける
361.0,363.0,結構あるパターンですよね色んなところで
363.0,364.0,そうですね
364.0,366.0,結構会場とかで来てくれた時に
366.0,368.0,何きっかけで知ってくれたんですかって聞くと
368.0,370.0,YouTubeですっていう人が結構
370.0,371.0,多いね
371.0,373.0,それがニコニコの懲戒とかって
373.0,376.0,なんで逆に今までニコニコで見なかったんですかって時に
376.0,379.0,友達にやっぱり進めにくいらしくて
379.0,382.0,友達にこの動画見てた時に
382.0,384.0,アカウント取ってねっていうのが
384.0,385.0,ハードル高かったらしくて
385.0,386.0,あるわ
386.0,390.0,でもYouTubeだとURLをLINEで送るだけで見れるんで
390.0,393.0,だからなんかすごいそういうところで広がって
393.0,397.0,もっと深入りしたらニコニコ動画の
397.0,400.0,動画にたどり着きましたみたいなのは
400.0,401.0,なるほどね
401.0,402.0,確かにそうだな
402.0,405.0,入り口が狭いっていうねニコニコの今のところ
405.0,406.0,狭いわ
406.0,408.0,なんかコラボすればいいじゃないですか
408.0,410.0,あー
410.0,411.0,なんでそんな
411.0,412.0,やってるじゃんみんな
412.0,413.0,そう
413.0,414.0,コラボしてるよ
414.0,415.0,実況動画のコラボ
415.0,416.0,捨ててこと見ねぇんだよあんまり
416.0,418.0,まぁまぁたまにすることは
418.0,420.0,俺リクエストあるんだよね
420.0,421.0,リクエスト
421.0,423.0,セピアさんとテラゾーさんが
423.0,425.0,ゼルダやってるの見たいんですよね
425.0,426.0,おー
426.0,428.0,2人といったら僕ゼルダの伝説ってイメージがあるんで
428.0,430.0,あげてたじゃないですか2人とも
430.0,432.0,1回ねスイッチが発売される当日に
432.0,434.0,公式でこの2人で
434.0,435.0,そう1年前に
435.0,436.0,見たんですよ
436.0,437.0,そうですね
437.0,439.0,個人的な実況見たいなと思って
439.0,440.0,だからそういう楽器が出てくればね
440.0,442.0,もっと盛り上がるんじゃないですか
442.0,444.0,あのねセピアさんと実況するのね
444.0,446.0,難しい
446.0,447.0,なんでなんでなんで
447.0,449.0,なんで教えてなんでなんで
449.0,451.0,自覚はあります
451.0,452.0,なんでですか
452.0,454.0,人がやっぱり隣にいて
455.0,459.0,すごい消しちゃってるんだろうなって思うシーンとか
459.0,461.0,絶対こう生きるはずなのに
461.0,463.0,ダメにしちゃってるんだろうなって思うことが
463.0,465.0,もう多すぎて
465.0,466.0,申し訳なくなってきちゃうんですよ
466.0,468.0,小島さんとの相性はバッチリなんだよ
468.0,469.0,ピクミン見てるんですよ
469.0,470.0,へー
470.0,472.0,でもねそれでもやっぱり
472.0,474.0,消しちゃってて
474.0,475.0,あるんですね
475.0,477.0,頭抱えながら編集してます
477.0,479.0,俺のせいでみたいな
479.0,481.0,へー
481.0,483.0,コラボ見たいわ
483.0,485.0,いろんな人のコラボね
485.0,487.0,最近だとゲーム動画だけじゃなくて
487.0,489.0,バンドを叱り
489.0,491.0,いろんな方々もやってますし
491.0,493.0,そういう方面のコラボとかも
495.0,497.0,ウンボちゃんはしたいコラボとかないんですか
497.0,499.0,いや僕セピアさんとコラボしたいですよ
499.0,501.0,おー
501.0,505.0,そこに発展すればもうこのステージは成功です
505.0,507.0,セピアさんとコラボしたいですよ
507.0,509.0,なんかねどこかで12時間ぐらいぶっ続けられたいですよね
509.0,511.0,へー
511.0,513.0,公式とかでなんかのゲーム
513.0,515.0,生放送で
515.0,517.0,だから編集頭かかる必要もない
517.0,519.0,生放送の方が良さそう
519.0,521.0,2人でお酒飲みながら
521.0,523.0,それは面白い
523.0,525.0,ねえセピアさんとか言いながらやりたいですよ
525.0,527.0,もう一度言っておきます
527.0,529.0,セピアさんとの実況は難しい
529.0,531.0,それはうまいことね
531.0,533.0,セピアさんお酒飲むと暴れますよ
533.0,535.0,2人でなんか
535.0,537.0,噛まれたときの対処が難しい
537.0,539.0,セピアさん確かに酔うと大変
539.0,541.0,ねえなんかやりたいですけどね
541.0,543.0,ワイン
543.0,545.0,ワインとステーキ片手になんか
545.0,547.0,ガウン来て
547.0,549.0,セピアさん今日どうですかみたいな
549.0,551.0,さっきゲーム実況好奇なすべきものするじゃないって言ったのに
551.0,553.0,自分でもう好奇なものになっちゃって
553.0,555.0,どんどん
555.0,557.0,やっぱイメージ的にはね
557.0,559.0,実際セピアさんはウンボちゃんとやりたいときはどんなゲームやりたいとか
559.0,561.0,アクションゲームとかRPGとか
561.0,563.0,ゲーム
563.0,565.0,ゲームだったらなんですか
565.0,567.0,あの
567.0,569.0,俺もロック画面でやってみたい
569.0,571.0,あーなるほど
571.0,573.0,2つの画面で
573.0,575.0,共同プレイしたいんですよ僕セピアさんに
575.0,577.0,共同プレイ
577.0,579.0,PUBGとか
579.0,581.0,じゃなくてそんな難しいゲームじゃなくて
581.0,583.0,昔のレトロゲーム
583.0,585.0,みたいなのを
585.0,587.0,やらせてもらいたいんですよね
587.0,589.0,1画面で同じ画面見ながらみたいな
589.0,591.0,そうそうそうそう
591.0,593.0,セピアさんはABボタン
593.0,595.0,ウンボちゃんは十字キー
595.0,597.0,ゴエモンやりたい
597.0,599.0,セピアさんゴエモンやりたい
599.0,601.0,ゴエモン面白い
601.0,603.0,実機で隣に並んでる絵を
603.0,605.0,ゴエモンやりたい
605.0,607.0,ちょっとやりたいな
607.0,609.0,見てみたいですね
609.0,611.0,今回この討論がきっかけで
611.0,613.0,その話になったら
613.0,615.0,見てみたいですけども
615.0,617.0,コラボが増えていけばまた
617.0,619.0,そうなんかそういうね
619.0,621.0,活気が出てくるといいですよね
621.0,623.0,みんなもっとこの話題について
623.0,625.0,ちなみになんだけど
625.0,627.0,自分たちはお金ですって結論出しちゃいましたと
627.0,629.0,お金も
629.0,631.0,セピアさんはどうしたら盛り上がる
631.0,633.0,どうしたら盛り上がるっていう
633.0,635.0,具体的に本当に自分もバカなんで
635.0,637.0,自分のことしか考えてないんですよ
637.0,639.0,ぜひそれでもいいです
639.0,641.0,だけど最近思うのが
641.0,643.0,演者側もね
643.0,645.0,見てる側もニコニコについて
645.0,647.0,ネガティブに言いすぎだと
647.0,649.0,これ言ってください
649.0,651.0,多分我々って
651.0,653.0,みんな今巨大な
653.0,655.0,催眠術にかかってる状態だと思うんですけど
655.0,657.0,セピアさんめっちゃ怒りやすい
657.0,659.0,難しい難しいです
659.0,661.0,ニコニコはダメだよ
661.0,663.0,生放送
663.0,665.0,何にもできないよって言って
665.0,667.0,誰かから言われてるような
667.0,669.0,気がしてる状態なんですよ
669.0,671.0,洗脳されてたかもしれない
671.0,673.0,いいもんだってことだよね
674.0,676.0,ちょっとした仕様変更とかで
676.0,678.0,同時コメント数が絶対来なくなるとか
678.0,680.0,ニコニコくんがなくなってるとか
680.0,682.0,そういうちょっとした仕様変更はあると思うんですけど
682.0,684.0,俺ら10年前に始めたニコニコ動画だと
684.0,686.0,大して変わってないやん
686.0,689.0,だから何が悪くなったのって言ったら
689.0,691.0,お前説明できるか
691.0,693.0,ニコニコ動画で何が悪くなったか
693.0,695.0,熱いぞやっぱいいね
695.0,697.0,書いた時に
697.0,699.0,あれおかしいんじゃないかと
699.0,701.0,言うことにまず
701.0,703.0,多分何か気づかずで
703.0,705.0,さらに悪い悪いって言ったら
705.0,707.0,本当に悪くなるから
707.0,709.0,確かに
709.0,711.0,だから俺たちはいる人間は
711.0,713.0,ニコニコが悪いだなんて
713.0,715.0,口にしてはいかない
715.0,717.0,素晴らしい
717.0,719.0,泣きそう
719.0,721.0,ムカつく演者とかいるかもしれない
721.0,723.0,運営に対して言いたいこともあるかもしれない
723.0,725.0,俺だって言いたいこといっぱいあるんだよ
725.0,727.0,はい
727.0,729.0,だけど
729.0,731.0,言うことは言うけど
731.0,733.0,なんとなくネガティブな雰囲気を
733.0,735.0,漂わせるような
735.0,737.0,気取った第三者視点みたいな
737.0,739.0,気取ったようなことを
739.0,741.0,言うな!
741.0,743.0,僕も今すごい心に刺さりました
743.0,745.0,一回ちょっと自分がネガティブなことを
745.0,747.0,ツイッターで言った時に
747.0,749.0,先輩さんにダメだよっていうのを
749.0,751.0,優しく悟してもらった時が
751.0,753.0,そういうのが好きなんですよ
753.0,755.0,言えるところっていうか
755.0,757.0,パッてダメだよ
757.0,759.0,そういう風に言うと
759.0,761.0,あいつは現状を世の中を見えられてない
761.0,763.0,分かってないって言われるよ
763.0,765.0,分かってなくて結構だよ
765.0,767.0,分かってなくて結構だよ
767.0,769.0,すごいそうですよね
769.0,771.0,周りなんて関係ないですよね
771.0,773.0,俺たちでニコニコ盛り上げていきましょう
773.0,775.0,やんなきゃいけない
775.0,777.0,大事なものを思い出した気がします
777.0,779.0,すごいよ
779.0,781.0,ちゃんと聞かせた方がいいみたいに
781.0,783.0,もうカッケーがネタコメントじゃなくなってるから
783.0,785.0,今の素晴らしいコメントですよ
785.0,787.0,みんな感想カッケーだよ
787.0,789.0,目が覚めました僕も
789.0,791.0,僕も来てよかった
791.0,793.0,その通りだよ本当に
793.0,795.0,でも本当にそんな立派なものでも
795.0,797.0,本当にただバカなだけなんで
797.0,799.0,本当その通りですよ
799.0,801.0,マジで
801.0,803.0,セピアさんが
803.0,805.0,例えばニコニコは舞台で
805.0,807.0,我々は演者で
807.0,809.0,視聴者は観客だ
809.0,811.0,みたいな例えを昔してくれて
811.0,813.0,演者が
813.0,815.0,不安になると
815.0,817.0,それが観客に伝わるからいけないよ
817.0,819.0,って言われて
819.0,821.0,すなさんって結構やっぱりいろんなところを見てて
821.0,823.0,結構理性的な男だから
823.0,825.0,言うんですよね
825.0,827.0,そういう客観視点みたいな
827.0,829.0,だけど
829.0,831.0,当事者意識が足りないのかもしれない
831.0,833.0,自分は
833.0,835.0,あれですよスポットライトを浴びる人なんですよ
835.0,837.0,それ以降
837.0,839.0,ちょっと反省して
839.0,841.0,俺も
841.0,843.0,言ってしまったことをちょっと反省した
843.0,845.0,あれで意識は変わったので
845.0,847.0,あんまりやっぱり
847.0,849.0,仮にネガティブなことを言うとしても
849.0,851.0,言った後に自分なりの
851.0,853.0,改善後セットだなと思った
853.0,855.0,こういうところはいけないけど
855.0,857.0,自分だったらこうしたらいいと思うから
857.0,859.0,みんな頑張ろうと
859.0,861.0,ポジティブな語尾で終わりたい
861.0,863.0,どうすればニコニコの
863.0,865.0,ゲーム実況だけじゃなくて全体に言えることで
865.0,867.0,しかも僕らがすぐ
867.0,869.0,実行できる
869.0,871.0,ニコニコを悪く言わない
871.0,873.0,むしろいいものだと
873.0,875.0,改めて再認識する
875.0,877.0,ポジティブな発言をしていくと
877.0,879.0,ポジティブなものだと
879.0,881.0,これはすごくいい
881.0,883.0,アイディアだと思う
883.0,885.0,本当に再認識にかかっている
885.0,887.0,一時的な状態だと思います
887.0,889.0,今
889.0,891.0,ちょうどいいタイミングのゴングが
891.0,893.0,始まりました
893.0,895.0,悪口は言わせてくれってね
895.0,897.0,それは大事
897.0,899.0,悪いと言わなきゃ
899.0,901.0,そこで飲む人に伝わらないから
901.0,903.0,でもさ
903.0,905.0,僕とセピアさんの共通の人で
905.0,907.0,五月病マリオさんっていう人がいるんだけど
907.0,909.0,マリオさんがセピアさんと飲まれてるときに
909.0,911.0,僕人の悪口言いながら
911.0,913.0,飲む酒が一番うまいんですよね
913.0,915.0,そしたらセピアさんがちゃんと
915.0,917.0,そんな無駄なことに時間を使うんじゃない
917.0,919.0,セピア!
919.0,921.0,男セピア!
921.0,923.0,余計なことじゃない
923.0,925.0,マリオさんと飲むとき
925.0,927.0,僕にも聞かせてください
927.0,929.0,余計なこと言わないでください
929.0,931.0,無駄なことに時間を使うんじゃない
931.0,933.0,セピアさんの表情がどんどん真っ赤になってしまいます
933.0,935.0,いいタイミングをやってまいりました
935.0,937.0,なんとですね
937.0,939.0,お時間の方がやってきてしまいました
939.0,941.0,早いものが1時間
941.0,943.0,皆さん立ち上がっていただいてよろしいでしょうか
943.0,945.0,全然喋りたくないよ
945.0,947.0,もっとやっていきたいですけど
947.0,949.0,では改めて本日のこの時間の感想を
949.0,951.0,一人ずつ聞いていきたいと思います
951.0,953.0,じゃあ順にセピアさんからね
953.0,955.0,はい
955.0,957.0,皆さんの喋る時間を
957.0,959.0,奪っちゃったような感じがして
959.0,961.0,申し訳ない気持ちでいっぱいなんですけど
961.0,963.0,なんかすごい予想以上に
963.0,965.0,叫んじゃって声が
965.0,967.0,ガラガラですみません
967.0,969.0,まず何より
969.0,971.0,今日ご来場の皆さんありがとうございました
971.0,973.0,やっぱりこれだけの
973.0,975.0,大きなステージで喋れるってことは
975.0,977.0,単純に
977.0,979.0,1位演者としてとっても気持ちのいいことです
979.0,981.0,ここに立つってことは
981.0,983.0,やっぱり皆さんがいてくれるからこそ
983.0,985.0,できることで
985.0,987.0,なので
987.0,989.0,やっぱりみんなの応援が必要だ
989.0,991.0,これからも
991.0,993.0,なのでみんなこれからも変わらず
993.0,995.0,応援よろしくお願いします
995.0,997.0,カメラの向こうの放送のみんなも
997.0,999.0,ありがとうございました
999.0,1001.0,セピアさんは結構
1001.0,1003.0,うんこちゃんの視聴者の方に
1003.0,1005.0,自分が話題に上がっている
1005.0,1007.0,っていうのは結構
1007.0,1009.0,自覚はしてたの
1009.0,1011.0,やっぱりさすがに
1011.0,1013.0,さすがに漏れて
1013.0,1015.0,漏れが伝わってくるわ
1015.0,1017.0,さすがに
1017.0,1019.0,さすがにくるわ
1019.0,1021.0,確かにそうですね
1021.0,1023.0,素晴らしい発言でございましたセピアさんありがとうございました
1023.0,1025.0,ありがとうございました
1025.0,1027.0,続きまして船爪さん
1027.0,1029.0,本当になんか
1029.0,1031.0,あっという間の1時間だったし
1031.0,1033.0,いろいろ
1033.0,1035.0,卑怯な話が聞けて
1035.0,1037.0,やっぱりどうしても
1037.0,1039.0,小ずるいこと考えたり
1039.0,1041.0,なんか小技小技ばっか
1041.0,1043.0,使ってしまう自分の性格なので
1043.0,1045.0,やっぱりこう正論で
1045.0,1047.0,ドーンってくるセピアさんの
1047.0,1049.0,しゃべりみたいなことは
1049.0,1051.0,だいぶ響くものが
1051.0,1053.0,ありました
1053.0,1055.0,ブーメランが今
1055.0,1057.0,ちょっと視界に入りすぎた
1057.0,1059.0,ブーメランが視界に入りすぎた
1059.0,1061.0,ブーメランってなんだろうな
1061.0,1063.0,そうなんですよね
1063.0,1065.0,まあまあまあ
1065.0,1067.0,まあまあまあ
1067.0,1069.0,何言おうとしたんだっけな
1069.0,1071.0,本当にもちろん第2回第3回があれば
1071.0,1073.0,ぜひぜひ呼ばれて
1073.0,1075.0,呼ばれるよう頑張っていきたいと思いました
1075.0,1077.0,今日はありがとうございました
1077.0,1079.0,船爪さんありがとうございます
1079.0,1081.0,じゃあ続きまして
1081.0,1083.0,テラドさん
1083.0,1085.0,いや本当に面白い話でしたよね
1085.0,1087.0,すごいなんかこのステージに一緒に
1087.0,1089.0,居合わせることができたことを
1089.0,1091.0,僕をここに呼んでくれたスタッフさんに
1091.0,1093.0,すげえ感謝したいです
1093.0,1095.0,ステージの名前は
1095.0,1097.0,ゲーム実況論っていう
1097.0,1099.0,実況論ってあんまり
1099.0,1101.0,実況論語ってるみたいな感じで
1101.0,1103.0,ポジティブな感じでは使われない
