start,end,text
1103.0,1105.0,割となんか実況論語っちゃってて
1105.0,1107.0,かっこ悪いよなみたいな印象がある
1107.0,1109.0,言葉だと
1109.0,1111.0,このステージに誘われたときに
1111.0,1113.0,そこは嫌だなって思ったんですけど
1113.0,1115.0,セピアさんの話聞いて実況論って
1115.0,1117.0,かっこいいなって思いました
1117.0,1119.0,ありがとうございました
1119.0,1121.0,テラドさんありがとうございます
1121.0,1123.0,続きまして宮助ちゃん
1123.0,1125.0,なんか呼ばれた意味が分かってないし
1125.0,1127.0,なんか本当に
1127.0,1129.0,私がこのメンバーを決めるなら
1129.0,1131.0,女性実況者は入れない
1131.0,1133.0,って思うし
1133.0,1135.0,そんなことは楽しかったよ
1135.0,1137.0,たぶん私のこと知らない人の方が
1137.0,1139.0,多いと思うので
1139.0,1141.0,名前だけでも覚えてください
1141.0,1143.0,お願いしますありがとうございました
1143.0,1145.0,宮助ちゃん素晴らしいありがとうございます
1145.0,1147.0,さあそして
1147.0,1149.0,うんこちゃん
1149.0,1151.0,僕もなんだかんだ
1151.0,1153.0,人の悪口ばっかり言ってますが
1153.0,1155.0,ニコニコ動画大好きなんで
1155.0,1157.0,またこういう舞台に立てるように
1157.0,1159.0,ニコニコ動画でもしっかり
1159.0,1161.0,活動して皆さんが楽しいと思っていただけるような
1161.0,1163.0,動画と生放送を
1163.0,1165.0,していきたいなと思います
1165.0,1167.0,あと個人的に
1167.0,1169.0,セピアさんのハイパーメディアクリエイターが聞けただけで
1169.0,1171.0,僕今日もうギャラいらないくらい
1171.0,1173.0,テンション上がってるんで
1173.0,1175.0,本当によかったです
1175.0,1177.0,楽しい1時間でした
1177.0,1179.0,ありがとうございました
1179.0,1181.0,僕はうんこちゃんと共演したときに
1181.0,1183.0,いつも聞いてくれっていう
1183.0,1185.0,あれがあるんで今日は配信するんですか
1185.0,1187.0,今日は配信はしませんこの後ディズニーランド行きます僕
1187.0,1189.0,なんで
1189.0,1191.0,見つけても声かけないでください
1191.0,1193.0,合宿もりました
1193.0,1195.0,改めましてこの時間を盛り上げてくださった
1195.0,1197.0,実況者の皆さんに大きな拍手を
1197.0,1199.0,お送りください
1199.0,1201.0,素晴らしいお時間でしたありがとうございました
1201.0,1203.0,ありがとうございました
1203.0,1205.0,では撤収
1205.0,1207.0,マイクをそのままにおいて
1207.0,1209.0,みなさん紙でからの退場になりますありがとうございました
