start,end,text
0.0,2.0,ん
4.2,6.2,ん
7.36,9.96,家じゃん
11.44,17.240000000000002,ん ちょっと花がまた体調崩しちゃったよ
19.96,22.84,お花ちゃんが
24.16,26.16,ん
30.84,34.36,心配と配信できなかった
40.6,42.6,ん
43.16,46.92,今度は目をやられてしまいました
48.28,51.36,うちのお花某が
51.36,53.36,ん
59.32,64.03999999999999,明日ちょっと精密検査に行ってきます
66.72,69.8,今花何歳だっけ
70.28,72.96000000000001,10歳
73.4,75.4,ん
77.92,84.76,ながー 花顔が違うなぁと思ったんだよ2日ぐらい前から
84.76,93.80000000000001,でなんかも明らかにあの目をずっとシュパシュパしてて この前のさあ福幕園になった時もなんかもうずーっと目シュパシュパしてたからもう絶対これ
93.80000000000001,96.56,やばいと思って
97.36,99.36,ん
102.04,104.8,心配でした
106.68,111.64,ん 長生きしてほしい
113.56,122.88,なしたからさ俺24時間配信するからさ夜花ちゃんを映してるねー 花ちゃんに何かあったら僕に電話して起こしてください
123.88,130.35999999999999,ん まあ取り出した精密検査行ってくる中で飯食ってるしさぁ
131.24,134.35999999999999,大丈夫だと思うんだけど
140.44,147.56,お前 av のピロートークで出演したんだけど見たわ 加藤人一で配信して私よく見てる見てるんだけどみたいなでしょ
147.56,156.84,あれどっちあれあれが a あの子が av 女優なのそれともなんか 街灯のインタビューみたいなやつで移ってて俺そのポイントだけしか見てないんだけど
157.48,168.4,加藤人一も言ってたんだけどだからもう俺の出演作品に流れなのを追加しといてね一応は 俺代表作になってるんで
174.84,177.12,だめ
177.84,179.84,ん
184.96,191.16,ちゃんと今日かおりたのが別に言葉だけだったら今日かもくそなもうないでしょ
194.2,201.16,あるの名前だしたらダメなの wikipedia に何か書いてください
201.16,203.16,ん
205.4,208.76,一応俺も出演したんで
208.92,216.35999999999999,俺ね将来的には 俳優になりたいんで足がかり
216.35999999999999,222.84,これを足がかりに やっていきたいとおもいます
223.64000000000001,225.64000000000001,ん
228.32,237.36,一応名前だけでも勝手に使ったらダメだろ村下に金払ってるのが違うそんな硬いの くだらなあの使っていいです
237.36,244.96,なんかたまにさああるんだよテレビで加藤さんのお名前出してもいいですかみたいなだけ そのあれ来るのね
244.96,252.8,なんかの時に来て愛ですよって言ったけど結局そうしカットされてるの毎回 なのでもう僕
253.8,259.28000000000003,無許可で全部出していいです 一日だるいんで
264.24,269.16,なんか写真使う使わせてもらっていいですかとか
274.48,277.16,あるんですよ
277.56,282.88000000000005,ん いや俺は将来俳優になりたいから大きくなったら
286.44,291.76000000000005,大人になった俳優なりたいねー その足がかりとして
292.56,297.76000000000005,やります そういうそういうところからいきます
298.76,306.59999999999997,ん お前殺したい女アビーと桜だけどあと一人選ぶな誰あのライブアライブのあいつ
306.59999999999997,312.52,ヒロインの女 ぶっちぎりその3人かな
315.92,321.0,名前なんてさっきアイツアリシア あの3人は
321.0,325.2,でも俺の手で謝めなきゃいけないと思ってる
328.48,330.48,ん
333.12,336.28,アリシアうざくない
337.32,348.44,高島知沙子はどうですか俺高島知沙子好きだよ 高島知沙子嫌われてるよね俺高島知沙子めっちゃ好きだよ
348.44,355.24,ああいう何か歯に絹着せる感じちょっと頭のネジ飛んでるけど俺 オレスめちゃくちゃ好きだよ
355.24,360.64,知沙子 ちょっとうちのお母さんに出るなんか
363.68,369.12,よくない 前も好きですよ高島知沙子好き
369.8,373.48,なんかね嫌いじゃない
374.48,377.40000000000003,バイオリンの人
377.84000000000003,386.52000000000004,ds 割ってやっぱりやっぱり似てんだよ どこかうちのお母さんと同じ匂いを感じるんだよね
386.52000000000004,389.12000000000006,美人だし
390.72,394.16,なんかね感じるんだよなぁ
396.64000000000004,405.96000000000004,高島知沙子は子供の3dsマップ立ちにしたから嫌われてる 3dsをマップ立ちにするにはとは何たらなんたらことだみたいな
405.96000000000004,417.28000000000003,秘宝27時間テレビエンディングダイヤン津田のゴイゴイス締めるも微妙な感じになるあとじゃ 27時間テレビ終わっちゃったらもう俺津田さん出るから見たかったのに
417.96000000000004,420.72,見たかったのに
421.56000000000006,427.00000000000006,どうだったのおもろかったしぶっちゃけあの3組だったらおもろそうじゃない
427.28,429.28,ん
432.96,437.4,だって 釜井たちとさぁ
437.56,443.96,なんだっけダイヤンと後一組だっけ下振りだっけ 違う釜井たちダイヤン
443.96,450.68,千鳥だ一番なんか一番の大腰を忘れてた その3組がしたらなんかおもろそう
450.68,456.12,24時間テレビって俺あんまり好きじゃねーしなんか面白いから見てなかったけど
458.0,461.76,面白そう
461.88,464.88,あの3組だったら
468.36,474.68,深夜帯に広瀬玲子出てたんだえー お前はのんきりフィファかなんかしてた
474.68,478.0,本当に最近の話なんだなぁ
478.48,485.56,うーん 深夜はさんまと未だが出てきてモブなってしてたんじゃない
485.56,489.12,バンユンが妊娠したことを知ってる
489.36,492.24,ツイッターで流れてきた
498.88,504.52,バンダが言うんだかが 妊娠したよねどっちか未だにわかんねーんだ俺
504.52,507.48,そろそろ教えてくれない
508.32,512.68,バンちゃん ゆんちゃん
512.92,515.8,どっちかわかんねーんだ
525.84,532.24,ゆふなが炎上した件なんか俺 なんだっけなゆふなのツイッター見て
532.28,538.32,女の子を言うのその本乗ってんだみたいな感じで調べたんだけど調べても理由が わかんなかった
538.32,542.16,apex でハイドして炎上したらしい
542.6800000000001,548.32,ざまあと思ったらたまにはさあ言わせますわ 炎上さなきゃダメでしょ
548.32,555.36,ざまあと思った正直言うなごめんな 一発ぐらいパソロハイドした際ダメだよ
555.36,561.4,さすがに俺もキレてるふざけんな奴ってあいつハイドしたんでしょ
561.4399999999999,566.8,呼び出して食ったおそっか 味一発分なくてはいいか
567.36,572.1999999999999,に3発分なぐんねーと言うこと聞かねーだろう
572.48,576.84,さすがに俺も許せないハイドは
580.28,583.4,殴っちまうかもしんねー
583.56,586.3199999999999,今あったら
586.96,590.04,ライン超えてる俺の
592.4,594.4,ん
595.52,600.36,単独効果してるから戦いが別にいいじゃん
600.48,606.0799999999999,だめだろ単独講師効果でもしちゃいけないの
608.04,613.28,ダメなの 理解に苦しむんだけど
616.0,618.96,やばよくはないんだ
622.4,626.8,別に何か悪くないよね正直ね
627.8,632.88,だってゲームの機能としてさあるんだから別にいいんじゃないの
634.8,640.64,悪くないなら何で配信会で名前変えてやったの江戸みんなみたいなキモい奴らが いるからだろ
640.64,646.1999999999999,いうのは悪くないでしょ正解じゃんそんなキモいことで炎上してるって言うこの日本が 悪いじゃん
646.2,654.48,めちゃくちゃキモいじゃそんなゲームで単独効果というシステム使ってガチャが出てくる 馬鹿相手ですのだるいから
654.48,660.24,配信外で行ったほうがいいんじゃない 俺で俺でもそうする
664.8000000000001,671.12,今度でもら配信中単独効果しようかな うせーし
677.0400000000001,684.1600000000001,後ろの死刑目捨ててるハイザーの中見してください 対して捨てないよ3日間で400本くらいだよ
684.1600000000001,690.2,パンパンにしてみんなにあげたいのよ ビルの上からね配りたいの
690.2,693.88,1時1時はポンクシュってないから
694.24,696.76,少ないよ
706.76,712.5200000000001,これプレゼントしたいんだよね
712.88,720.88,気づいてないんだけどそのヘアバンド世界で一番ダサい 世界で一番ダサいけど世界で一番ピッタリ俺の頭にハマるので
720.88,726.08,俺の頭と同化してないパチッと たまんねーんだこれ
726.08,733.36,サイズもさすっごいタイトなのでビチーって あのユージローがさ壁乗り越える時みたいにビチーってほら
733.36,737.28,ビチーとなるでしょ ここ一番いいの
737.28,741.6800000000001,これがもう 最強
748.16,751.24,最強なんですよね
752.76,758.96,桜見切ると同じようなことしてる フォイの事務所にタヌカが入ったんだ
759.0,763.8000000000001,あのーレペゼンの新しいチームみたいな
766.1600000000001,768.52,ってこと
777.12,782.4000000000001,フォイのゲーミングチーム名強化した話 何ゲーミングチーム名って
782.4000000000001,785.4000000000001,名前なんだっけ
789.52,794.08,【コメント】ノーイージーフォックス
794.08,797.6,ノーイージーフォックス
802.12,805.8000000000001,かどさんのノーイージーフォックス 結構前から聞いてたんだよね
805.8000000000001,809.64,なんか作るんですよみたいな おーいいねーって
809.64,814.76,やっぱさ俺的にはレペゼンってめちゃくちゃ人気だけど やっぱ汚れだから
814.76,818.4399999999999,そういう奴がさどんどん入ってきたほうが居心地いいじゃん もう是非
818.4399999999999,822.36,ほい早く作んなよ早く作んなよ
825.52,830.2,ちょっとずつやっぱ内側から腐らしていこうかなと思った 日本の
831.2,835.0400000000001,日本のゲーム業界を 居心地のいい
835.0400000000001,838.1600000000001,空気にしていこうかなって
840.96,845.2,でもガチで応援してる ほい好きだし
850.2,853.2,【コメント】ネタバレなの?
853.2,857.2,ネタバレなの? ネタバレなの?
858.2,861.2,【コメント】ムラゲのバロは?
861.2,867.2,ムラゲのバロはおとといかな? 俺話し合いしたよ みんな集めてーっつって
867.2,872.2,なんかいろいろ話した 1時間ぐらい
880.2,886.2,あまあ1人決まって なんかちょっとやっぱそのビザアラミで今まだ揉めてるって感じ
887.2,890.2,【コメント】正直ムラゲと当たったらどっち応援する? いやムラゲに決まってんだろそりゃ
890.2,895.2,いやいやムラゲなんかどうでもいいからさ ノイジ応援しようなんてならないだろ
895.2,900.2,戦いたいねやっぱなんかその 大会で戦いたいね
903.2,906.2,大会で戦いたいっすね
906.2,908.2,是非とも
916.2,921.2,えサダ結婚したんだ えちょっと俺の知らない間にいろんなニュースが
927.2,929.2,今日本で
934.2,939.2,あーなんか言ってたなフォーイが
939.2,942.2,いいじゃんいい名前じゃん
943.2,951.2,【コメント】でもノイジより加藤純一の方がいいから やめて加藤純一フォックスにしよう
951.2,954.2,どうかなそれ
960.2,966.2,そっちにしよっか 圧力かけて この野郎っつって
973.2,977.2,【コメント】石川の隆起が堂々に炎上した もういいよ
977.2,981.2,そういうなんかそのニコ生のなんか 古来からある炎上はもう俺いいよ
981.2,986.2,お腹いっぱいだよ なんなら俺の一番中に生主あるで3人おろしてる
986.2,990.2,俺になんかそのあれ聞くな意見を
990.2,993.2,もう完全個人の問題だから知らねえよ
993.2,996.2,俺に求めるな
999.2,1001.2,知らん
1002.2,1004.2,知らん
1008.2,1012.2,てかお前もおろしてるのか 俺はちょっと皆さんの期待してるかわからないけど
1012.2,1015.2,僕はおろしたことないですね
1015.2,1018.2,そのなんか度胸もないんで
1024.2,1027.2,ないんですよね
1027.2,1030.2,子供もできねえし
1033.2,1038.2,【コメント】外国人なんとか解決方法を見つけていろ 去年メインステージ進出したチーム全員外国人
1038.2,1041.2,あーなんか聞いてみようかな
1044.2,1047.2,でも2年ぐらいかかるんだよね
1055.2,1058.2,言語は英語
1062.2,1065.2,英語でいきますその時は
1065.2,1068.2,一応狙ってる選手はルカク
1070.2,1073.2,今俺が一番狙ってる選手はね言っとくけど
1085.2,1087.2,いやハーランドは高い
1087.2,1091.2,ルカクだったら多分月収40ぐらいで来てくれるはずだから
1093.2,1096.2,ちょっと高いんだよねハーランドは
1096.2,1099.2,40で狙ってる
1099.2,1102.2,それ以上やったら内側感じになっちゃうから
1106.2,1110.2,あいつのフィジカルやっぱあいつ腕の筋肉も相当あるから
1110.2,1113.2,バラとかでもリコイルうまそうじゃん
1117.2,1126.2,【コメント】お前よくこの速度のコメ見れるようだね 止めてるいちいち
1128.2,1133.2,【コメント】そんちゃんがキャバ城に100万見つけたのにラインブロックされたらしいけど ブロックなんかされること…
1133.2,1136.2,いや俺分かんないブロックなんかされたことないから分かんねえ
1140.2,1143.2,想像を絶することしたんだろうね
1147.2,1150.2,打退してもブロックされるぞ
1150.2,1152.2,マジで
1152.2,1155.2,何したんだろうね聞いてみるから今度かけてこそ
1160.2,1162.2,理由が分からん
1162.2,1177.2,【コメント】お前ってツイッターでブロックしてるアカウントない? ツイッターのブロックの仕方が分かんない
1177.2,1179.2,ミュートしてるアカウントいっぱいあるけど
1181.2,1185.2,で男のツイッターほどのミュートしてる
1185.2,1187.2,相互フォローの
1187.2,1189.2,男のツイッターから見たらしょうがねえじゃん
1189.2,1194.2,おっぱい見るためのツールなのにさ男はミュートしてるからほとんどマジで
1198.2,1199.2,ガチでね
1200.2,1203.2,女の子のツイートしか流れてこないだから俺
1205.2,1208.2,ブロックってなんか簡単にできるのそんな
1216.2,1218.2,逆にミュートしてない男がいるんですか
1218.2,1220.2,大石さんとか
1220.2,1222.2,かの
1223.2,1225.2,まもこうもミュートしてないね
1227.2,1229.2,みんなすげえツイートすんだもん
1229.2,1231.2,ツイートすんなよじゃあ
1234.2,1237.2,めちゃくちゃツイートするじゃんみんな
1238.2,1240.2,ほどほどにしてくれよ
1240.2,1242.2,コウスケなんか大ミュートよ
1242.2,1246.2,一番最初にミュートの機能を試す
1246.2,1248.2,人柱でコウスケ俺ミュートしたよ
1250.2,1252.2,一番最初にミュートしたぞ
1261.2,1264.2,リストもなんか一回作ったけど見たい俺のリスト
1269.2,1272.2,リストの見方が結局分かんなくて使ってねえわ
1272.2,1274.2,携帯からリストって見れんの
1277.2,1281.2,一応俺のツイッターのリストには
1281.2,1284.2,好きな女っていう3人のメンバーがいるんだけど
1284.2,1286.2,ピザラジと
1286.2,1289.2,桐島さくらあとみやこさんが入ってる
1290.2,1292.2,これ内緒なんで絶対読まないでください
1296.2,1298.2,俺のなんか秘密のリストなんで
1298.2,1300.2,秘密のリストなんで
1305.2,1306.2,内緒
1317.2,1318.2,加藤さんはインスタできないで
1318.2,1320.2,ストーリーっていう機能を使って連投してるカスがいる
1320.2,1322.2,なんだそれ
1323.2,1326.2,まあイオリ萌えも入れとくわリストに
1328.2,1335.2,リスト入りするわ
1341.2,1344.2,じゃあオッパイっていう専用のアカウント作れ確かに
1344.2,1345.2,賢いね
1345.2,1348.2,俺結構そういうのはこうし混同しちゃってさ
1348.2,1351.2,本当にツイッターで絶対見ちゃいけないような
1351.2,1353.2,ツイートばっか見てんのね
1354.2,1359.2,無習性の女の素人もののやつとか
1359.2,1363.2,あれ間違って誤操作でいいねとかおっしゃったらとんでもねえじゃん
1364.2,1366.2,それがマジで怖いの
1368.2,1370.2,あれ本当にビキビキじゃなってるいつも
1373.2,1375.2,裏赤女子のやつ見ちゃうのよ
1376.2,1379.2,でもさ2個ツイッターのアカウント持ってる人ってさ
1379.2,1381.2,毎回毎回ログインログアウト繰り返してんの
1384.2,1387.2,クソ大変じゃない
1389.2,1391.2,だって俺さあれだぜ
1392.2,1394.2,切り替え機能があんの
1396.2,1398.2,切り替え機能あんの
1401.2,1404.2,でもさ何かそれで間違ってさそのさ
1405.2,1409.2,あのオッパイで一回女しかフォローしてない方で
1409.2,1412.2,今日21時からピザらしいとかツイートしちゃったらさ
1412.2,1415.2,まずくない?そっちだったらまだしもう
1416.2,1418.2,あの本明けの方でやっちゃったらまずいじゃん
1422.2,1424.2,俺できないのそれが
1425.2,1427.2,だからリスクを犯して俺は
1429.2,1431.2,オッパイを見てるいつも
1439.2,1441.2,怖いんだよね
1445.2,1447.2,巨乳専用のスマホ持て
1449.2,1451.2,雑誌でデバイスごと
1451.2,1452.2,あそうするわ
1452.2,1455.2,俺巨乳専用のスマホ持つの分かった
1455.2,1457.2,そうやったらねそっち
1459.2,1462.2,見てる時は絶対に安全っていうね
1462.2,1465.2,あーそうするわそれだったらいいわ
1465.2,1467.2,初めからそうすればよかった
1467.2,1469.2,でペンギンクラブとかも
1469.2,1471.2,そっちであれすればいいってことでしょ
1474.2,1476.2,怖いんだよだからなんか
1480.2,1482.2,荷台持ちするわ
1489.2,1491.2,でラサール石井のツイートばっか見てくからさ
1491.2,1493.2,何かそれでいいねとか間違えておっしゃったらさ
1493.2,1496.2,こいつそういう思想持ってんのかよつって
1497.2,1500.2,そういうなんかあんまり公に言っちゃいけないような
1500.2,1502.2,ツイートばっか見てんのね
1503.2,1505.2,あとパラノーマルなんとかみてぇな
1505.2,1507.2,ちょっと怪奇現象とか
1509.2,1511.2,そういう系ばっかなんですよね僕
1512.2,1514.2,ツイッター見てんの
1520.2,1522.2,ツイッター動画保存ランキングっていうサイトだと
1522.2,1524.2,いいね押す心配もない上に人気順になる
1524.2,1526.2,へー
1527.2,1529.2,あそうなんだそういうのがあるんだな
1532.2,1537.2,竹内涼麻が無習性エロ動画リツイートして乗っ取られたって乗り切ったことある
1537.2,1539.2,うーん
1540.2,1542.2,ま別にしょうがねーよな
1546.2,1548.2,なんか男ってそういうエロの
1551.2,1553.2,エロに弱いもんだ
1558.2,1560.2,乗っ取られること
1560.2,1562.2,ジポのツイートいいねした俳優も昔だ
1562.2,1564.2,いやそれは結構致命的だな
1565.2,1567.2,俺結構ジポにはうるさいよ
1570.2,1572.2,普通のなんかね
1573.2,1576.2,なんか裏赤のなんかさ
1576.2,1578.2,女子とかだったらさ
1580.2,1582.2,天月も風俗話してくれば今日は配信無しのツイッター
1582.2,1584.2,いやあれは
1584.2,1586.2,ガチで乗っ取られた
1586.2,1588.2,クソ笑ったわ俺
1588.2,1590.2,天月のツイッターがさ乗っ取られるとさ
1590.2,1592.2,クソおもろくなかった
1592.2,1594.2,俺あれマジで
1594.2,1596.2,俺ほんとリツイート仕掛けなんだけどあれ
1596.2,1598.2,あれクソ笑ったわ俺
1598.2,1600.2,天月のさ全く別のさ人格
1602.2,1604.2,あれクソ笑ったマジで
1604.2,1606.2,YouTubeも乗っ取られて
1606.2,1608.2,ツイッターも乗っ取られて
1608.2,1610.2,あれクソ笑ったわ俺
1610.2,1612.2,あれクソ笑ったわ俺
1614.2,1616.2,あれちょっとセンスある
1616.2,1618.2,乗っ取られかたちだね
1620.2,1622.2,風俗噛ましてくれば
1622.2,1624.2,配信だけするかよ
1626.2,1628.2,間違ったアカウントでのツイッターだとしても
1628.2,1630.2,そんなこと絶対言わねえじゃん
1632.2,1634.2,あれ笑ったなマジで
1640.2,1642.2,クソ笑ったな
1648.2,1650.2,クソ笑ったな
1654.2,1656.2,ついに法書を表したんかと思った
1656.2,1658.2,天月さん配信
1658.2,1660.2,みんなもなんか
1660.2,1662.2,やあやあ言ってるけどさ
1662.2,1664.2,あいつなんかどうせいいやつなんだろうな
1664.2,1666.2,って思わない天月
1666.2,1668.2,天月裏であってもマジでいいやつだろ
1668.2,1670.2,あいつ配信外のほうがいいやつだもんね
1674.2,1676.2,天月いいやつなんだよな
1676.2,1678.2,なんか
1678.2,1680.2,好きになっちゃうんだよな
1682.2,1684.2,ちょっとバカな感じも
1684.2,1686.2,よくない
1692.2,1694.2,熱い男だよね
1694.2,1696.2,逆に裏で悪いやつっていますか
1696.2,1698.2,マジで
1700.2,1702.2,こういう関係がある人だったら
1702.2,1704.2,裏で悪いやつまだ本書表してないだけかもしれないけど
1704.2,1706.2,いないと思う
1706.2,1708.2,俺引いちゃうから
1710.2,1712.2,あんま変わんない
1712.2,1714.2,実態は
1714.2,1716.2,りなりないぐらい
1716.2,1718.2,だから俺もう縁切ってるから
1718.2,1720.2,俺それほんとに
1720.2,1722.2,言えるじゃん
1722.2,1724.2,ほんとに嫌だったらもう二度と会わなくていい
1724.2,1726.2,実は
1728.2,1730.2,悪いやつかどうか知らないけど
1730.2,1732.2,俺好きじゃないから
1732.2,1734.2,好きじゃないよって
1744.2,1746.2,誰だろうね
1746.2,1748.2,マジでいないんじゃないかな
1748.2,1750.2,緑さんも別に
1750.2,1752.2,著しくバカなだけで
1752.2,1754.2,根は悪いやつじゃないんじゃない
1754.2,1756.2,コンドームの付け方が分かんないから
1756.2,1758.2,でもそれ俺の責任なのね
1758.2,1760.2,やっぱね
1760.2,1762.2,コンドーム付け方を教えてあげてないからまだ俺が
1762.2,1764.2,あいつほんとバカだから
1764.2,1766.2,今度教えるよ
1766.2,1768.2,教えるよ
1776.2,1778.2,本気で嫌いなやつは
1778.2,1780.2,名前出さないって毎日言ってたけど
1780.2,1782.2,ほんとにちゃんと嫌いで
1782.2,1784.2,連絡もしかとしてるし
1784.2,1786.2,この前ヘズマの結婚式で声かけられた時も
1786.2,1788.2,聞こえないふりしてしかとしてたし
1788.2,1790.2,俺露骨に避けてるよマジで
1790.2,1792.2,正式に俺は配信でも言ってるもん
1792.2,1794.2,ほんとに関わらないでくれよなって
1794.2,1796.2,俺もうアピールしてんじゃん今
1796.2,1798.2,露骨にちゃんと嫌いだよ
1798.2,1800.2,ほんとにちゃんと嫌い
1812.2,1814.2,そんぐれかな
1816.2,1818.2,緑の配信で無視してた
1818.2,1820.2,なんか関わんなほうがいいのかなって
1820.2,1822.2,思っちゃって
1822.2,1824.2,何がそんな嫌いなの?
1824.2,1826.2,いろいろ
1834.2,1836.2,いろいろかな
1840.2,1842.2,なんかあの
1846.2,1848.2,生き様が好きじゃない
1848.2,1850.2,生き様が好きじゃない
1852.2,1854.2,もう生き様が好きじゃない
1854.2,1856.2,しょうがないじゃん
1856.2,1858.2,もうそれ以上それ以外もないんだ
1858.2,1860.2,もう仕方ないだろ
1864.2,1866.2,もう仕方なくない
1866.2,1868.2,これ以上の理由ってなくない
1868.2,1870.2,フフ
1878.2,1880.2,いや別に
1880.2,1882.2,同じ場所にいるとかもどうでもいいんだけど
1882.2,1884.2,ただ嫌いなだけで
1886.2,1888.2,フフ
1888.2,1890.2,かなぁ
1898.2,1900.2,"サイン付きTシャツ6,000円"
1900.2,1902.2,"ポルノグラフィーのパーカー6,800円"
1902.2,1904.2,"モコのパーカー9,000円"
1904.2,1906.2,それは素材によらないか
1906.2,1908.2,俺のパーカー2万ぐらいしなかった?
1908.2,1910.2,売ってないんだっけ俺パーカー
1910.2,1912.2,"18,000円ぐらいしなかった?"
1912.2,1914.2,素材によらない?
1916.2,1918.2,最近よく遊んでる配信者
1918.2,1920.2,誰だろ
1920.2,1922.2,俺外出てねーよ
1922.2,1924.2,誰だろ
1924.2,1926.2,一番最後になった配信者
1926.2,1928.2,誰だろ
1936.2,1938.2,ピザラジのモコだよ
1938.2,1940.2,ピザの
1942.2,1944.2,麻雀
1944.2,1946.2,ハハハ良かったヘズマじゃなくて
1946.2,1948.2,フフフ
1948.2,1950.2,良かったヘズマだよって言わなくて
1950.2,1952.2,良かったヘズマあるんだよね
1952.2,1954.2,ピザラジのピザラジャンは
1954.2,1956.2,良かったー
1956.2,1958.2,口が裂けても言いたくなかった今
