start,end,text
3286.6600000000003,3289.46,全部入れておこうかな
3289.46,3293.06,眉毛って超だるくない自分でやんの
3293.06,3295.96,女にシャンプーしてもらいたい
3295.96,3296.6600000000003,それは分かる
3296.6600000000003,3300.1600000000003,俺のカットは多分全員男の人すると思う
3300.1600000000003,3306.46,なんとなくね
3306.46,3309.26,まあまあまあまあ先の話よ
3309.36,3316.6600000000003,物件が決めて今もう多分審査がもうすぐ
3316.6600000000003,3319.46,しかも内装にも俺いっぱい使えるのが超いいぜ
3319.46,3321.36,マジで俺の顔まみれにしよう
3321.36,3323.36,宗教じみた美容室にしよう
3323.36,3325.96,一元さんが入ってきて
3325.96,3327.26,やばいとこに来てしまったかもしれない
3327.36,3333.5600000000004,空気かもし出すわ
3333.5600000000004,3343.76,ちょっとカルトジミタ
3343.76,3346.5600000000004,どこにしようかなって思います
3346.5600000000004,3347.5600000000004,すぐ潰れるだろう
3347.5600000000004,3349.26,なんとか3年頑張りたいです
3349.36,3356.6600000000003,3年
3356.6600000000003,3358.5600000000004,3年やったらもう一人前だよね
3358.5600000000004,3360.76,ほんであの大阪にも出店する
3360.76,3362.96,2店舗やりたい
3362.96,3365.36,カット順
3365.36,3367.5600000000004,透明版でやりたい
3367.5600000000004,3371.0600000000004,日本中の男俺がイケメンにしていく
3371.0600000000004,3371.86,飽きたらやめる
3371.86,3393.6600000000003,飽きたらなんか任せる
3393.6600000000003,3396.96,いいじゃんね大阪には
3396.96,3399.46,お前店出すと炎上した時のリスク上がる
3399.46,3400.76,関係ないじゃん
3400.86,3403.76,自分だってバック後ろで何もないんだよ
3403.76,3406.36,俺なんだよ
3406.36,3407.86,俺炎上したらその時は
3407.86,3411.86,赤色の髪だけは50%オフにするわ
3411.86,3415.6600000000003,そういうサービスも考えていきましょう
3415.6600000000003,3418.5600000000004,炎系の割引
3418.5600000000004,3420.26,世間の皆さん申し訳ありません
3420.26,3423.36,炎上してしまったんでカラーの赤色だけ
3423.36,3424.26,全部半額にします
3424.26,3429.26,炎上割
3429.26,3431.86,にしようかな
3431.86,3433.26,だって全部自分で金出して
3433.26,3434.36,全部自分でやってんだから
3434.36,3440.5600000000004,別に何にもないじゃん
3440.5600000000004,3447.5600000000004,炎上割はつけますよ
3447.5600000000004,3448.46,ついでに服も売れ
3448.46,3450.26,服のファッションセンスがないんで無理です
3450.26,3451.6600000000003,あと興味がないからさ俺
3451.6600000000003,3454.26,ファッションにそもそもなんで美容師なんだ
3454.26,3457.26,いや33ぐらいまで
3457.26,3459.1600000000003,俺も美容院なんか全く興味なかったんだけど
3459.16,3462.96,婚活の案件の時に
3462.96,3464.7599999999998,すっごいうまい人に切ってもらったのね
3464.7599999999998,3466.16,めっちゃくちゃうまい人
3466.16,3468.7599999999998,で美容師さんってこんなに
3468.7599999999998,3470.66,騒げるんだと思ったの
3470.66,3472.96,ビクゾーとかももちろんかっこよくしてくれたんだけど
3472.96,3475.66,やっぱさ達人っているわけよ
3475.66,3478.2599999999998,その道のめっちゃよかったのね
3478.2599999999998,3479.96,その時のさ写真
3479.96,3481.16,たぶん上がってるから見てほしいんだけど
3481.16,3484.46,めっちゃかっこよかったのほんとに
3484.46,3488.56,で今切ってもらってる人も
3488.56,3490.36,あのスタイリストの人に紹介してもらった
3490.36,3493.56,動画で出てくれた人に切ってもらってるんだけど
3493.56,3496.96,すごい上手なのね
3496.96,3503.2599999999998,だからなるほどと髪型で人間かっこよくなると思って
3503.2599999999998,3513.2599999999998,みんなって全然興味ないでしょ
3513.2599999999998,3515.56,あんま興味ないじゃん
3515.56,3519.86,ってことはあの普通におしゃれしてる奴が切って
3519.86,3522.7599999999998,ちょっとかっこよくなるよりめちゃめちゃブスな奴が
3522.7599999999998,3527.2599999999998,髪切って伸びしろがすごいあるじゃん
3527.2599999999998,3533.06,伸びしろすごくない
3533.06,3534.06,元からやりたかったし
3534.06,3535.66,これ美容室はまじで
3535.66,3537.36,イクイノックスがあったら本気でやろうと思ってたの
3537.36,3541.56,本気でやろうと思ってたの
3541.56,3545.56,でその2200万ぐらいバーンと当たって
3545.56,3551.7599999999998,いやもうこれは天命だもうやろうと思って
3551.7599999999998,3554.06,始めました
3554.06,3556.86,やっぱね女だけじゃなくてさ
3556.86,3563.7599999999998,仕事とかでもさやっぱ多少清潔感あった方がさ
3563.7599999999998,3569.7599999999998,いいじゃん
3569.76,3578.86,っていう理論です
3578.86,3581.36,これから仕事していく上でね学割いいね
3581.36,3587.76,学割聞かせよう
3587.76,3594.76,病院と病院と洋服屋と結婚相談時も同じビールしてください
3594.76,3596.96,うちの1階2階にあるんだけど
3596.96,3599.5600000000004,1階あれやドラッグソアや
3599.56,3601.7599999999998,コンドーム買って帰れそこで髪型キャック
3601.7599999999998,3604.36,かっこよくなってコンドーム買って帰ればよくない
3604.36,3605.66,緑はなんでできんかって言うと
3605.66,3607.06,あいつコンドームの仕方わかんないから
3607.06,3610.96,かっこよくなってもあのね世の中の女を下ろすじゃん
3610.96,3612.36,俺よくないって思ってるんで
3612.36,3615.56,皆さんはコンドームの仕方知ってますよね
3615.56,3619.7599999999998,ちゃんと家で髪切ってコンドーム買って帰ってください
3619.86,3623.96,どうですかその先その先方
3623.96,3638.46,理にかなってるでしょ
3638.46,3643.6600000000003,髪切るやつはちゃんと加藤純一語れるやつにして
3643.6600000000003,3645.86,そうだよね加藤純一語れるやつ以外に
3645.86,3648.6600000000003,髪なんて触ったしかねーよなぁ
3648.7599999999998,3653.66,美容院もう美容師免許のさ取得条件に加藤純一語れるやつ
3653.66,3659.96,入れてほしくない
3659.96,3671.96,こいつ加藤純一語れねえねえ髪の毛語ってんのかよ
3671.96,3674.66,なんとかトントンぐらいで回していけるように
3674.66,3678.46,僕もしっかり宣伝しますよ
3678.46,3691.26,お財布に余裕のある方はねぜひご卑怯に
3691.26,3692.96,なんか配信でだからあれしようかな
3692.96,3696.16,配信者のお庭とか繁盛に頭下げて
3696.16,3699.86,俺の配信のネタになってくださいって家で髪切らして
3699.86,3703.16,繁盛だってね俺だって繁盛の店とかにもね
3703.16,3706.86,あの提供してるからあいつに貸しがあるから
3706.86,3710.56,そこはもうね猫削ぎ行くでしょ
3710.56,3714.36,裏毛のやつらも買ったいいじゃん
3714.36,3717.86,レオだってなぁバロしてる場合じゃねえだろう
3717.86,3720.26,あいつは昔吉田栄作みたいな書き方似合うじゃん
3720.26,3724.76,あいつこういうさ昔のレオはもう吉田栄作だよ
3724.76,3736.76,次顔出すときマジであいつもカットモデルやらせる
3736.76,3748.5600000000004,甘草白それか甘草白似合うかな
3748.5600000000004,3757.5600000000004,あいつカニ鍋みたいなやつに髪切ってほしいんだよ
3757.5600000000004,3761.96,うちでちょっとあのダイヤの原石ちくのぼとかさ
3761.96,3764.6600000000003,あいつらつらいのになんかさちょっとあれじゃん
3764.7599999999998,3771.7599999999998,あんまおしゃれに興味ねえよみたいなさ
3771.7599999999998,3778.56,いいと思うんですよね
3778.56,3788.2599999999998,カニ鍋は髪の毛伸ばさせるよ
3788.2599999999998,3790.16,今から髪伸ばしとけって
3790.16,3794.66,マジで11月12月には絶対オープンさせるから
3794.66,3800.8599999999997,今のうちにみんな髪の毛伸ばしといてくるね
3800.8599999999997,3804.06,1年かかっちゃいましたなんだかんだで
3804.06,3805.8599999999997,釈迦とかもさ髪の毛クソ長いからさ
3805.8599999999997,3807.46,後で切りなさい
3807.46,3810.3599999999997,お前らがちょっと短い方がいいよって
3810.3599999999997,3814.3599999999997,クソ短くするの短髪するの
3814.3599999999997,3817.8599999999997,決めた切り替えがあるわ
3817.96,3826.06,あいつなんかあんなふわっさーってなってるけどさ
3826.06,3828.36,月に一回人柱みたいな山田信一みたいな感じでさ
3828.36,3835.46,そこに人柱これでイケニオさん
3835.46,3839.36,でも美容師さんはマジで腕のいい人を
3839.36,3844.46,本当に腕で決める腕だけで決める
3844.46,3846.1600000000003,決めてる本当にかっこよくしてくれる人
3846.2599999999998,3850.96,だって50006000取るってことは
3850.96,3853.06,いい値段するんだから
3853.06,3858.8599999999997,いやお給料めっちゃあげるその代わり
3858.8599999999997,3864.06,お給料いっぱいあげる
3864.06,3865.2599999999998,やりがい搾取はしません
3865.5600000000004,3882.6600000000003,俺自身が6000円で切ってるからさ
3882.6600000000003,3887.1600000000003,病院って感覚じゃない
3887.1600000000003,3888.36,7000円は絶対やだ
3888.36,3896.56,採算はトントンだったらいいかなって感じ
3896.56,3898.76,赤字垂れ流しながらやるのさ
3898.76,3905.96,衛生的に良くないから
3905.96,3909.1600000000003,税理士に止められるからやめましょう
3909.1600000000003,3909.96,場所もいいとこ
3909.96,3916.06,いいあのぼちぼち駅から徒歩5分ぐらいのところ
3916.06,3918.06,よくないその駅がちょっとマイナー
3918.06,3920.2599999999998,マイナーてか行きづらい駅ではあるけど
3920.2599999999998,3927.66,駅から徒歩5分
3927.66,3935.36,にょとないとないとないとない
3935.36,3941.66,やん駅ぐらいってあの青山1丁目
3941.66,3944.96,青山1丁目駅から徒歩5分のところよくない
3945.06,3950.86,青山1丁目ってあんまり駅が通ってねーんだよ
3950.86,3955.86,電車が通ってねーんだよ
3955.86,3958.76,一等地じゃねーかよみたいな感じだけど
3958.76,3965.56,そんなにあれだよおしゃれすぎるよ
3965.56,3968.86,みたいな感じで全然違う道路のところ
3968.86,3971.86,表参道じゃんとかじゃない
3971.86,3973.56,わかんないそこをもしかしたら
3973.56,3974.56,バラすかもしれないけど
3974.66,3979.06,一応そこを候補に入れてます僕は
3979.06,3982.56,僕みたいなもんが青山歩いていいんですか
3982.56,3983.56,だからいいじゃんそこ
3983.56,3984.96,髪切ってかっこよくなって
3984.96,3991.96,コンドーム買って帰ればよくない
3991.96,3999.16,街路樹はもうもしかしたら枯れてるかもしんない
3999.1600000000003,4009.76,うちの目の前にある街路樹は
4009.76,4012.0600000000004,あと今ちょっとね
4012.0600000000004,4015.1600000000003,ビッグモーターが世間を逃げはしてるじゃん
4015.1600000000003,4016.86,これでもピンチはチャンスじゃん
4016.86,4020.36,自動車産業俺と言ったら自動車じゃないですか
4020.36,4036.26,カットカットモーターを作ろうかなと思ってる
4036.26,4046.6600000000003,チャンスかなと思って
4046.6600000000003,4066.36,俺の会員1台だけ売る撤退いくらですかいいね
4066.36,4069.6600000000003,オニアが免許取ったら取られちゃうから
4069.6600000000003,4071.4600000000005,あの会員でもなぁ
4071.4600000000005,4075.26,大石さんとの思い出がやっぱ詰まってるからね
4075.36,4079.0600000000004,その売りには出せないので
4079.0600000000004,4080.46,一生俺が乗り潰すか
4080.46,4082.5600000000004,オニアにあげるかの選択肢しかないの
4082.5600000000004,4084.86,あいつ免許取らないんだもん
4084.86,4086.6600000000003,継承していきたい
4086.6600000000003,4087.6600000000003,味が出てくるじゃん
4087.76,4103.16,ずっと持ってたら
4103.16,4109.06,味が出てくるじゃん
4109.06,4110.46,分かりやすく調子に乗るから
4110.46,4113.06,いい車とか乗ると
4113.160000000001,4115.76,おもろいな
4115.76,4117.860000000001,俺がマルチェラカなんかの財布あげたのに
4117.860000000001,4119.660000000001,あいつが財布なくしたって言うから
4119.660000000001,4125.06,だからあいつすっごい高いわけじゃないよ
4125.06,4127.76,高いけどみんなが
4127.76,4129.660000000001,すっごい高いわけじゃないの
4129.660000000001,4131.96,大学生とかが頑張ったら買える
4131.96,4133.26,1月頑張ったら買える
4133.26,4135.96,全然買えるぐらいのやつなんだけど
4135.96,4137.96,あいつ財布出すとき
4137.96,4140.660000000001,こうやって出すのね
4140.660000000001,4142.160000000001,5万円ぐらいのね
4142.16,4145.26,こうやって出すの
4145.26,4147.86,俺が払います
4147.86,4150.0599999999995,貝あげたらおもろそうだなと思って
4150.0599999999995,4155.16,窓からこうやって顔出してくれるかなと思って
4155.16,4157.96,そういうやつに継承していきたいじゃん
4157.96,4161.5599999999995,やはり
4161.5599999999995,4162.86,で全くお揃いの財布を
4162.86,4164.5599999999995,ゆーたに誕生日プレゼントして買ったんだけど
4164.5599999999995,4169.16,まだ忘れてない
4169.26,4173.5599999999995,ぴったし同じやつ
4173.5599999999995,4179.26,あってない全く
4179.26,4180.86,1回もあってない
4180.86,4193.26,それ以来
4193.26,4194.36,誕生日自分の財布買ってたのに
4195.36,4203.86,誕生日だいぶ過ぎちゃってたんだもん
4203.86,4206.66,そのタイミングで渡したじゃん
4206.66,4214.259999999999,おめでとうって
4214.259999999999,4218.5599999999995,わかりやすくない
4218.5599999999995,4222.16,財布って一番嬉しくないもらうと
4222.26,4224.66,垂れ流し配信は明日から
4224.66,4225.96,ちょっとでも本当はね
4225.96,4227.76,今日の12時からやる予定だったんだけど
4227.76,4230.0599999999995,今日6時からやって24時から配信
4230.0599999999995,4231.5599999999995,もう下も全部準備できてんだけど
4231.5599999999995,4233.0599999999995,花ちゃんがちょっと体調悪いのよ
4233.0599999999995,4234.46,明日ちょっと昼間
4234.46,4236.0599999999995,花ちゃん病院連れて行きたいから
4236.0599999999995,4239.16,帰ってきて夕方からかな
4239.16,4241.0599999999995,ガチで花ちゃん調子悪くて今
4241.0599999999995,4242.36,目がなんかもうずっとこうやって
4242.36,4247.46,しぱしぱしてるから
4247.46,4250.5599999999995,一旦病院に連れて行く
4250.56,4260.46,花ちょろりんを
4260.46,4261.660000000001,垂れ流し中に死んだらどうなるの
4261.660000000001,4263.860000000001,でもやっぱ俺の犬だから
4263.860000000001,4266.160000000001,俺の魂が宿ってるはずじゃん
4266.160000000001,4268.160000000001,配信中に死ねたら本望だと思う
4268.160000000001,4270.860000000001,花も最後見とってあげてほしい
4270.860000000001,4274.360000000001,死なないけどね
4274.360000000001,4276.96,でもなんか本当によぎった
4276.96,4279.46,やべえ花死ぬかもしんねえと思って
4279.46,4281.86,ずっとこうやって今日マジでだから
4281.86,4283.36,5時ぐらいに家にいて
4283.36,4284.86,もう暇だったんだけど
4284.86,4286.36,やべえワンチャン花が
4286.36,4296.06,死ぬかもしんねえと思って
4296.06,4299.56,でもまあ食欲もあるし
4299.56,4301.46,大丈夫だと思うんだけどね
4301.46,4303.16,まあでも10歳だしな
4303.16,4305.56,何があってもおかしくねえよな
4305.56,4307.16,熱中症とかでも絶対ないのね
4307.16,4309.0599999999995,うち24時間クーラーつけまして
4309.0599999999995,4313.0599999999995,24度ぐらいに設定してるから
4313.0599999999995,4314.5599999999995,花が死んだらどこに見えるの
4314.5599999999995,4316.0599999999995,死んだらタンパク質の塊だよね
4316.0599999999995,4317.16,燃えるゴミじゃないの
4317.16,4319.0599999999995,あの泉くんがそうやって来たよ
4319.0599999999995,4321.0599999999995,こいつはもう何を言ってるんだい
4321.0599999999995,4324.26,さとここれはもう生き物じゃない
4324.26,4326.76,ただのタンパク質の塊だって言いながら
4326.76,4335.5599999999995,コンビニのあれに
4335.56,4337.46,佐藤が悲しむかな
4337.46,4346.56,佐藤が悲しむんだったらやめるけど
4346.56,4360.860000000001,寄生樹徴用見て公園のゴミ箱がこうやって
4360.860000000001,4363.46,8月ゲーム部でやるゲームはもう1個は決まってる
4363.46,4366.86,なんだっけあのロマンスボルト
4366.86,4369.16,あのためだけに2日の枠とってんだよ
4369.16,4371.76,それ以外のゲーム全く決めてないよね
4371.76,4375.16,変態ワールド絶対面白くないじゃん
4375.16,4376.56,ピンチだよね
4376.56,4381.16,そこはもうやっぱ長年のこの実況者の力を見せるしかないよね
4381.16,4387.56,変態なんちゃら1個だけ見てる
4387.660000000001,4388.76,まあみんなで決めようや
4388.76,4397.96,なんかあのAKBの詳細不明すぎる
4397.96,4400.160000000001,ロマンスボルトは5分で終わるだろうね
4400.160000000001,4410.160000000001,間違いなく匂うよ一気やりてーな
4410.26,4417.76,あれおもろくなかった
4417.76,4421.86,ビクミンもやりたいんだよね
4421.86,4422.86,陣内さん聞いてみようかな
4422.86,4425.5599999999995,あれって巨額どうやって取ったんですか
4425.5599999999995,4427.86,でもどうするなんかその芸能人パワー見せられたら
4427.86,4431.36,秋元康さんに普通に言ったよって言われたら
4431.36,4434.36,そうっすかってなっちゃうじゃん
4434.36,4436.0599999999995,秋元さんに聞いたんですよ
4436.0599999999995,4438.36,タモさんと秋元さんに聞いたんですよって言われたら
4438.36,4445.16,ぐーの音も出ないじゃん
4445.16,4458.0599999999995,シュンってなっちゃうじゃん
4458.0599999999995,4461.16,明日さあホラーゲーやろうと思ってんだけど
4461.16,4463.5599999999995,当初の予定を変更して
4463.5599999999995,4466.16,俺カゲロウのDLCやりたいなと思ってんだけど
4466.16,4469.66,本当はカゲロウ2やる予定だったんだけど
4469.66,4474.5599999999995,なんか候補のゲームみんなもいっぱい送ってくれて
4474.5599999999995,4478.86,カゲロウの2のために
4478.86,4481.36,ダウンロードコンテンツやろうかなと思ってる
4481.36,4502.36,今は今はね
4502.36,4508.0599999999995,カゲロウ2の動画正直見てない
4508.0599999999995,4511.16,FIFA1000時間はまだ980時間残ってる
4511.16,4513.96,俺20時間もやったんだ
4513.96,4516.0599999999995,俺20時間もやったの
4516.0599999999995,4517.96,でもちょっとデータ見て
4517.96,4521.46,俺昨日のFIFAマジですごかったんだから
4521.46,4525.76,俺データ見てマジでビビったんだけど
4525.76,4528.26,めちゃくちゃ強くなってる俺
4528.26,4532.26,これ見てくんない?
4532.26,4535.36,昨日めちゃくちゃ強くない俺
4535.36,4539.16,これ赤いところが勝ちで
4539.16,4541.46,オレンジ引き分けなのね
4541.46,4544.86,見て真っ赤じゃない昨日
4544.86,4550.26,うわ今日1日開いたのがマジで心配
4550.26,4551.86,ドイツに4勝6敗
4551.86,4554.66,コスタリカに4勝4敗2分け
4554.66,4558.66,スペインは1勝1、2、3、4
4558.66,4562.0599999999995,1勝4敗2分け
4562.0599999999995,4567.46,ドイツ3連勝したんだよ
4567.56,4570.56,昨日マジ上手かったよね
4570.56,4572.96,でもやっぱさ顕著に出る
4572.96,4577.26,これおとといの配信開始
4577.26,4581.06,ポンポンって勝って集中力なくなるとこうなるのね
4581.06,4585.66,昨日の配信開始もパンパンパンって勝ったの
4585.66,4587.86,でもう今日絶対くらいできるってなって
4587.86,4590.56,集中力切れてガーッと落ちて
4590.56,4597.26,最後魂絞って勝ったの
4597.26,4599.96,で毎回ベルギーにボコられてる
4599.96,4601.56,ベルギー1対6
4601.56,4602.66,ベルギー1対3
4602.66,4603.96,ベルギー0対3
4603.96,4605.16,ベルギー1対4
4605.16,4611.16,ベルギー1対2
4611.16,4612.16,問題はここなんだ
4612.16,4616.860000000001,ただこのベルギー1対2は
4616.860000000001,4620.96,ペナルティキックで2点取られてるんですよ
4620.96,4629.36,実質1対0なの
4629.36,4632.56,クロアチアでそのね
4632.56,4637.56,この人がデータをいろいろ送ってくれるんだけど
4637.56,4639.56,データを見ると昨日はドイツに4勝6敗
4639.56,4642.16,コスタリカに4勝2分け4敗と5分5分です
4642.16,4645.66,また得失点もドイツ戦は15得点20失点
4645.66,4648.96,コスタリカ戦に関しては15得点13失点
4648.96,4651.56,もう総合能力で完全に勝ち越してるのね
4651.56,4653.16,目に見えて勝ち星が増えてます
4653.16,4655.66,あとはドーアンの得点がかなり増えています
4655.66,4657.16,昨日だけで7得点
4657.16,4664.16,ドーアン確かにめっちゃ点取ってたよね
4664.16,4669.66,うちにいいアナリストがいるんだよね
4669.66,4674.46,で今就任に今までで一番強くない俺
4674.46,4678.46,7ヶ月前の俺を超えてるの多分今だったら
4678.46,4684.66,あとはこのベルギーにさえ勝てたら
4684.66,4687.26,あるいはって感じなんだけど
4687.26,4690.16,ブラジルに化け物がいるらしいの
4690.16,4697.06,ブラジルマジでやばいっすって
4697.06,4698.56,心折られるぐらい強いらしく
4698.56,4702.46,ブラジル足クソ速らしくて
4702.46,4706.16,足超速らしくてさ
4706.16,4711.46,フランスとブラジルはマジでとんでもないっすって
4711.46,4715.86,ドイツの両サイドとブラジルとフランスの
4715.86,4719.26,あのフィジカルゴリ押しはクッソやばいっす
4719.26,4720.26,加藤さんって
4720.26,4722.66,ベルギーのルカクなんて話にならないっす
4722.66,4724.96,ベルギーのルカクってさ真ん中にいるから
4724.96,4726.76,比較的ボランチ寄せて
4726.76,4729.0599999999995,ファイブアックでガッツリ守ってれば
4729.0599999999995,4732.86,まあすげー理不尽に点取られることあるけど
4732.86,4735.46,組織的に守ればさ抑えられるところあるじゃん
4735.46,4737.16,もうそういうの効かないらしい
4737.16,4740.16,もうサネのさ俺言ってねーけどさ
4740.16,4742.66,サネのサイド突破ぶっ飛ばしたくなんない
4742.66,4746.06,マジあれ
4746.06,4747.46,あれマジでイラつかねえ
4747.46,4750.66,あんな簡単にスーッて抜けてってさ
4750.66,4754.36,毎回あれでピンチ作られんじゃん
4754.36,4761.16,あれを上位互換でやられるらしい
4761.26,4767.0599999999995,サネの上位互換がやるらしい
4767.0599999999995,4769.26,で一生懸命守ってさ
4769.26,4775.36,なんとか0点抑えてんじゃん
4775.36,4776.96,まだ俺フランスともブラジルとも
4776.96,4778.86,やったことないんだよね
4778.86,4783.5599999999995,メッシともやったことない
4783.5599999999995,4784.66,ムーバッペやりたいね
4784.66,4787.0599999999995,ムーバッペってセンターフォワード?
4787.0599999999995,4789.76,真ん中?どうせ真ん中だろうな
4789.76,4794.96,いわゆる角伸ばすでしょ
4794.96,4797.16,左なんだ終わりじゃん
4797.16,4819.56,ちょっと待ってムーバッペ左から突破してくる
4819.56,4822.96,ポルシェぐらい速い
4822.96,4826.660000000001,あいつ100m10秒ちょいぐらいらしいよ
4826.660000000001,4828.860000000001,100m10秒ちょっとぐらいで走るらしいよ
4828.860000000001,4833.06,あいつクッソ速いらしい足
4833.06,4837.76,ムーバッペのスピード97です
4837.76,4842.160000000001,ムーバッペスピード97あるらしい
4842.160000000001,4847.76,聞いたことないんだけど俺97って
4847.76,4854.16,ゲンツキじゃん
4854.16,4860.76,戦いたいね決勝で
4860.76,4862.16,左サイドムーバッペがいて
4862.16,4863.56,中央にジルーがいて
4863.56,4866.16,右デンベレがいる
4866.16,4867.96,全員知って俺が詳しくない
4867.96,4869.26,俺が知ってるってことは
4869.26,4871.76,相当有名な人たちだね
4871.76,4877.66,楽しみだ
4877.66,4879.860000000001,デンベレたのはスラッとした
