start,end,text
1958.2,1960.2,最後になった配信者誰ですかって
1960.2,1962.2,ヘズマだよ
1962.2,1964.2,しんやっちょだよって言われて良かったマジで
1964.2,1966.2,良かったモコで
1968.2,1970.2,助かった
1970.2,1972.2,ギリギリのところで
1972.2,1974.2,踏み留まりました
1974.2,1976.2,今僕が
1984.2,1986.2,モコのパーカーの素材の表記がない
1986.2,1988.2,しかも通販サイトに問い合わせても返答がないじゃん
1988.2,1990.2,買わなきゃいいじゃん
1990.2,1992.2,騙された後だったら
1992.2,1994.2,買わなきゃよくない
1994.2,1996.2,モコのパーカー買わなきゃいいじゃん
1998.2,2000.2,買うなじゃん
2000.2,2002.2,不買運動しよう買うな買うな
2004.2,2006.2,買ったやつがさ
2006.2,2008.2,文句言ってんの分かるけどさ
2008.2,2010.2,あいつがさTシャツとかパーカー売ってたって
2010.2,2012.2,"もう10年ぐらい12,3年経ってない"
2012.2,2014.2,なんならもう
2014.2,2016.2,アパレルの走りみたいな
2022.2,2024.2,イメージあるけどな
2038.2,2040.2,じゃないですかね
2040.2,2042.2,リリーが1000万から400万ぐらいになりました
2042.2,2044.2,保持
2044.2,2046.2,保持で
2046.2,2048.2,保持しましょう
2048.2,2050.2,一旦
2050.2,2052.2,グッと来ないと保持しない
2052.2,2054.2,ここは
2054.2,2056.2,ここで耐えられるやつが
2056.2,2058.2,真の財を築くんじゃないの
2058.2,2060.2,ガチ保あと20年
2066.2,2068.2,20年
2070.2,2072.2,保持
2072.2,2074.2,ロレックスのバブルも崩壊した
2074.2,2076.2,俺ロレックス無くしてるから
2076.2,2078.2,嬉しいです
2078.2,2080.2,このままどんどんバブル崩壊して
2080.2,2082.2,あの
2082.2,2084.2,喧嘩割ってください
2086.2,2088.2,なんとかしてみんな
2088.2,2090.2,喧嘩割らせよう
2100.2,2102.2,みんなで
2102.2,2104.2,買うんじゃねえぞ
2106.2,2108.2,俺今日さ
2108.2,2110.2,ついにさ肩こりやばすぎて
2110.2,2112.2,肩にボトックス打ってきたわ
2112.2,2114.2,痛かったビューって打たれて
2114.2,2116.2,もんじゃだめよって言われた
2116.2,2118.2,これどれくらい効果あるかな
2122.2,2124.2,でさ
2124.2,2126.2,俺のカードの迷彩って
2126.2,2128.2,お姉ちゃんに全部届くから
2128.2,2130.2,あ
2130.2,2132.2,こいつ美容外科行ってるって
2132.2,2134.2,何したのって
2134.2,2136.2,ボトックス打ったんだよって
2136.2,2138.2,普通さ
2138.2,2140.2,どこで打ったのって聞くじゃん
2140.2,2142.2,おでこのシワやばいし
2142.2,2144.2,気になってたんだ
2144.2,2146.2,俺おでこに打ってないんだけど
2146.2,2148.2,おでこそんなにシワシワかな
2148.2,2150.2,勝手に俺おでこだし
2150.2,2152.2,この前やったとき
2152.2,2154.2,すっごい私も思ってて
2154.2,2156.2,いいと思う全然いいと思う
2156.2,2158.2,肩こりで肩にボトックス打ったんだけど
2160.2,2162.2,いきなりそんな
2162.2,2164.2,ハードパンチ食らったんだけど
2166.2,2168.2,確かにこの前やったときおでこでしょ
2168.2,2170.2,確かにこの前やったときやばいと思ったんだよね
2170.2,2172.2,って言われたのね
2172.2,2174.2,ひどくない
2174.2,2176.2,あの肩こりに
2176.2,2178.2,打ったんですけどって電話したのね
2178.2,2180.2,もうふざけんな俺肩こりに打ったんだけどさ
2182.2,2184.2,猿山の大将みたいな声で
2184.2,2186.2,ギャギャギャギャギャギャギャー
2188.2,2190.2,前世紀の孔明くらい笑ってた
2192.2,2194.2,でもおでこにも打ったほうがいいよって言われてぶちつけられた
2196.2,2198.2,おでこにも打ったほうがいいよって
2198.2,2200.2,俺しゅんとしちゃった
2200.2,2202.2,すごい
2202.2,2204.2,俺おでこにも打ったほうがいいんだ
2208.2,2210.2,どうせ俺のおでこからシワがなくなったら
2210.2000000000003,2212.2000000000003,🌵姉に言われた一言を
2212.2000000000003,2214.2000000000003,🌵おねこみ
2214.2000000000003,2216.2000000000003,🌵わかんねーよな
2216.2000000000003,2218.2000000000003,🌵この光が当たんねーから
2218.2000000000003,2220.2000000000003,🌵光が当たんねーからわかんねーよ
2220.2000000000003,2222.2000000000003,🌵こうやって
2222.2000000000003,2224.2000000000003,🌵こうやったらみんな島できるでしょ
2226.2000000000003,2228.2000000000003,🌵ぐーって目あげたら
2228.2000000000003,2230.2000000000003,🌵誰だって島できるでしょ
2230.2000000000003,2232.2000000000003,🌵そりゃそうだよね
2232.2000000000003,2234.2000000000003,🌵そりゃそうだよな
2241.2000000000003,2243.2000000000003,🌵あいつの前で俺もう笑えないよ
2246.2000000000003,2248.2000000000003,🌵あいつの前で
2248.2000000000003,2250.2000000000003,🌵笑えない
2260.2000000000003,2262.2000000000003,🌵肩と歯ぎしりやばいから
2262.2000000000003,2264.2000000000003,🌵先生俺歯ぎしりもやばいんだけど
2264.2000000000003,2266.2000000000003,🌵って言って
2266.2000000000003,2268.2000000000003,🌵こうやってやられてぐーって噛み締めてくださいって言われて
2268.2000000000003,2270.2000000000003,🌵噛み締めたら角さん
2270.2000000000003,2272.2000000000003,🌵これは倍打ちましょうって言って
2272.2000000000003,2274.2000000000003,🌵俺人の倍打ってきたんだけどここだけ
2274.2000000000003,2276.2000000000003,🌵どうしようここがげっそり
2276.2000000000003,2278.2000000000003,🌵こけちゃったら
2278.2000000000003,2280.2000000000003,🌵やばい俺ここがげっそり
2280.2000000000003,2282.2000000000003,🌵こけちゃったらさただれさえさ
2282.2000000000003,2284.2000000000003,🌵パンパンの方向に余計目立っちゃうんだけど
2286.2000000000003,2288.2000000000003,🌵改造人間になっちゃう
2288.2000000000003,2290.2000000000003,🌵整形依存症になっちゃうと
2290.2000000000003,2292.2000000000003,🌵どうしようこれをきっかけに
2292.2000000000003,2294.2000000000003,🌵おでこにも打って目尻にも打って
2294.2000000000003,2296.2000000000003,🌵俺もうサイボーグじゃん
2298.2000000000003,2300.2000000000003,🌵止めてねみんな
2300.2000000000003,2302.2000000000003,🌵俺が整形いっぱいし始めたら
2302.2000000000003,2304.2000000000003,🌵鼻にプロテーゼ入れて
2304.2000000000003,2306.2000000000003,🌵ねえ
2306.2000000000003,2308.2000000000003,🌵骨削って
2314.2000000000003,2316.2000000000003,🌵怖い
2316.2000000000003,2318.2000000000003,🌵一回ネジに言われたんだよね
2318.2000000000003,2320.2000000000003,🌵企画会議の時に
2320.2000000000003,2322.2000000000003,🌵加藤さんお願いがあります
2322.2000000000003,2324.2000000000003,🌵プチ整形してくれませんかって言われて
2324.2000000000003,2326.2000000000003,🌵ネジそれはできない
2326.2000000000003,2328.2000000000003,🌵ネジそれはできないって言われて
2328.2000000000003,2330.2000000000003,🌵ネジそれはできないって言われて
2330.2000000000003,2332.2000000000003,🌵俺プチ整形させられそうになったんだけど
2332.2000000000003,2334.2000000000003,🌵動画のネタ一発のためだけに
2334.2000000000003,2336.2000000000003,🌵それはちょっと勘弁してくれ
2336.2000000000003,2338.2000000000003,🌵親からもらった体に
2338.2000000000003,2340.2000000000003,🌵傷入れらんねえって言って
2340.2000000000003,2342.2000000000003,🌵なんとかして
2342.2000000000003,2344.2000000000003,🌵プチ整形してくれませんかって
2346.2000000000003,2348.2000000000003,🌵言われたことがあります
2356.2000000000003,2358.2000000000003,🌵www
2358.2000000000003,2360.2000000000003,🌵あそうだ
2360.2000000000003,2362.2000000000003,🌵なんか色々発表してって
2362.2000000000003,2364.2000000000003,🌵俺なんか美容院の物件決めてきたわ
2364.2000000000003,2366.2000000000003,🌵11月くらいにオープンするから
2366.2000000000003,2368.2000000000003,🌵ちょっとみんなに来てね
2370.2000000000003,2372.2000000000003,🌵決めてきましたわ
2372.2000000000003,2374.2000000000003,🌵一年かかりましたね
2374.2000000000003,2376.2000000000003,🌵いやガチガチ
2376.2000000000003,2378.2000000000003,🌵俺でも夢だっつってんじゃん
2378.2000000000003,2380.2000000000003,🌵冴えない男たちを
2380.2000000000003,2382.2000000000003,🌵モテをに変身させたいっていう夢があるから
2382.2000000000003,2392.0000000000005,今着実に…ちょ名前決めてくんねえマジで
2392.0000000000005,2393.0000000000005,名前決めてくんねえ
2393.0000000000005,2399.2000000000003,イクイノックス
2399.2000000000003,2409.26,バーバージュンでもいいんだけどさ
2409.26,2417.0600000000004,バーバージュンじゃないじゃん
2417.0600000000004,2419.1600000000003,カットジュンにしよカットジュンにしよ
2419.1600000000003,2420.36,いやもう決めた
2420.36,2422.76,カットジュンにしよカットジュン
2422.76,2423.76,カトジュンみたいにいいしね
2423.76,2425.76,もう決めたじゃあもう
2425.76,2427.5600000000004,ほんとやなバーバー豊か
2427.5600000000004,2431.76,あんたバーバー豊かにしたんだけどね俺マジで
2431.76,2433.36,それはもうそしたら美容院じゃなくて
2433.36,2436.26,利用室やってた俺マジで
2436.26,2437.76,いやバーバー豊かマジでよくない?
2437.76,2443.26,あいつにやらせようぜ
2443.26,2448.36,いいよね
2448.36,2452.36,隣でやろうぜ
2452.36,2453.5600000000004,視点作って僕を雇う
2453.5600000000004,2454.76,あいいね
2454.76,2465.76,じゃあ大阪視点が作る時はバーバー豊かにします
2465.76,2469.26,続報待て
2469.26,2470.96,なんか腕のいい美容院
2470.96,2472.76,あの俺ガチでいけてない
2472.76,2475.5600000000004,でも正直さ俺のメインの視聴者ってさ
2475.5600000000004,2479.86,まあぶっちゃけ男の子94%ぐらいなのね
2479.86,2481.86,ほんで
2481.86,2482.76,でちょっとおしゃれ
2482.76,2485.46,場所はちょっとおしゃれな場所になっちゃったんだけど
2485.46,2487.0600000000004,まあおいおい言うけど
2487.0600000000004,2488.86,でも内装はちょっと俺っぽい
2488.86,2489.86,犬着のところだったね
2489.86,2493.5600000000004,そんないっぱいお金持ってるわけないから
2493.56,2497.06,で
2497.06,2499.06,なんていうの
2499.06,2502.86,まだ駆け出しの美容院雇って美容師さん雇って
2502.86,2506.06,なんかねそれっぽくやるのやで
2506.06,2512.46,ガチでちゃんとかっこよくしたいから
2512.46,2516.56,腕のいい美容院を高級で雇おうかな
2516.56,2522.2599999999998,って思ってます
2522.36,2524.26,カットいくらにする予定
2524.26,2527.76,そこの街の相場が6700円だったので
2527.76,2529.86,そこまで高くはしない
2529.86,2531.1600000000003,さすがに
2531.1600000000003,2533.96,調べたら6700円ぐらいの相場だったの
2533.96,2535.86,高いじゃん正直
2535.86,2537.36,1000円だったらやらない無理
2537.36,2543.26,あの普通に成り立たない
2543.26,2547.6600000000003,これでもさ美容院にかける思いの感覚
2547.6600000000003,2550.86,俺が今6000円で切ってるのね
2550.86,2554.26,6000円で切ってるの
2554.26,2557.46,俺が今ね
2557.46,2561.76,今は値段は決めてない
2561.76,2566.6600000000003,2000円で頼む
2566.6600000000003,2569.26,夢からじゃあなんかの
2569.26,2572.46,クーポンと抱き合わせでなんとかする俺が
2572.46,2575.06,初回になんとかするわじゃあ
2575.06,2577.26,そういう時も作る
2577.26,2578.46,知らない人フラっと来たら
2578.46,2580.56,キモい逆ばっかりいいじゃん別に
2580.56,2588.2599999999998,そういうコンセプトなんだもん
2588.2599999999998,2589.2599999999998,モテない男たちを
2589.2599999999998,2590.46,やっぱねイケてる男たちに
2590.46,2592.16,変身させてる動画あるじゃん
2592.16,2593.36,こうやってなんかこうやって
2593.36,2595.16,俺もこれやりたいこれ
2595.16,2596.46,こうやって
2596.46,2598.96,あいつらって結局キモくないじゃん
2598.96,2599.7599999999998,思わない?
2599.7599999999998,2600.7599999999998,あのモデルになってる奴ら
2600.7599999999998,2601.86,あいつらキモくないじゃん
2601.86,2602.96,本当にキモいじゃんみんな
2602.96,2606.66,だからそのこうやってやったらなんか
2606.66,2609.36,ピッてやったらかっこよくなってるみたいな
2609.46,2611.46,大してみんな変わんないと思うんだけど
2611.46,2613.6600000000003,やっぱ見た髪型とか眉毛って
2613.6600000000003,2614.96,俺すごい大事だと思う
2614.96,2617.36,俺がそんなとんちゃくあるわけじゃないから
2617.36,2619.56,毎月11日は11の日で安くしろいいね
2619.56,2625.96,そういうのやろう
2625.96,2627.1600000000003,なんかちょっと考えてますわ
2627.1600000000003,2628.76,俺でも正直それだけは
2628.76,2630.96,実業本当にやらないと決めてるんだけど
2630.96,2633.76,絶対
2633.76,2637.96,美容院だけちょっとやりたいなと思って
2637.96,2639.76,やろうかなって思ってます
2639.76,2643.76,僕は
2643.76,2645.06,でも髪に気を使ってない奴が
2645.06,2646.56,そもそも1000円カット以上の金出せる
2646.56,2649.06,いやまぁそうなんだよな
2649.06,2652.26,でもやっぱかっこよくなったらさ
2652.26,2656.16,モテるんだよ男にも女にも
2656.16,2657.56,ゆーたしかり繁盛しかりお前しかり
2657.56,2659.36,なんで有名人がそんなに店立ち上げようとするんだ
2659.36,2660.76,いやゆーたはわかんないけど
2660.76,2662.76,まぁ繁盛と俺は一緒なんじゃん
2662.76,2664.16,やっぱ
2664.16,2665.66,これやりたいなっていうのは
2666.06,2669.8599999999997,やっちゃうっていう
2669.8599999999997,2671.56,やりたいんだよね
2671.56,2677.2599999999998,かっこよくなったらいいじゃん
2677.2599999999998,2678.8599999999997,みんなもやると思うよ
2678.8599999999997,2682.2599999999998,叶えられるってなったらあるでしょ
2682.2599999999998,2685.8599999999997,みんなにもそういう夢が
2685.8599999999997,2689.56,やりたいこととか人間に通しちゃうんだよな
2689.56,2691.06,だってやらねえで配信だけしてた方が
2691.06,2693.96,金は稼げんじゃん正直
2693.96,2695.46,そういうことなんですよね
2696.26,2697.46,まぁでもトントンぐらいでは
2697.46,2698.86,増したいなと思ってる
2698.86,2701.66,俺はな
2701.66,2703.66,美容室はほんとやりたかったんだよね
2703.66,2709.66,リアルに
2709.66,2711.76,モコウは店開くなら喫茶店がいい
2711.76,2713.66,お年寄りに来てほしい
2713.66,2714.86,彼は何言ってるかよくわかんないんで
2714.86,2715.76,一旦置いておきましょう
2715.76,2717.46,彼は朝方ニコ生で喧嘩しすぎて
2717.46,2718.86,今おかしくなってるんで
2718.86,2720.66,ちょっとだけそっとしておいてあげてください
2720.66,2722.46,パーカーを売って揉めてるんで
2722.46,2732.26,モコウとユフナはちょっとそっとしておいてください
2732.26,2734.56,駄菓子屋とかさあやりたくない?
2734.56,2741.86,ぶっちゃけ
2741.86,2744.76,鬼屋の銭湯とか
2744.76,2745.96,あいつ調べてたの
2745.96,2748.46,あいつサウナマジ好きじゃん
2748.46,2750.06,ほんと銭湯やりたいとか言ってて
2750.06,2753.2599999999998,調べて10をかかるつつで
2753.2599999999998,2757.36,もっと身近なところでやればと思った
2757.36,2761.86,なんとか50でできないですかねって言って
2761.86,2767.06,鬼屋11億からだよ
2767.06,2782.06,50万でなんとかやりたいんですよね
2782.06,2785.06,なんでyoutubeはみんなアパレルやるんですか
2785.06,2787.2599999999998,わかりやすく金儲けできるんだよな
2787.2599999999998,2791.46,アパレルが
2791.46,2793.16,多分ね
2793.16,2795.46,だってリスクしかなくない
2795.46,2802.16,他の事業ってお金になるからじゃないか
2802.16,2806.06,それかマジでやりたいから
2806.06,2808.36,でもマジでアパレルやりてーって思ってる奴が
2808.36,2813.46,youtuberやらないと思うんだよね
2813.46,2818.26,どうだろう
2818.26,2820.06,お前自分の店オープンしてもそこで紙切る
2820.06,2821.06,いや一応俺も切る
2821.46,2825.46,本来そういうところを増やしたかったのよ
2825.46,2829.2599999999998,俺は
2829.2599999999998,2830.2599999999998,でも恥ずかしくない
2830.2599999999998,2841.86,俺紙切ってる時に周りに視聴者がくそ恥ずかしいんだけど
2841.86,2844.06,でも来店イベントあるよ設定6入れる
2844.06,2853.06,普通に設定6俺が来た日だけは
2853.06,2854.86,でもそこあんまり設定入れてるよって言っちゃいけないから
2854.86,2865.06,今美容院は逆にある程度根を張ってると嫌な気がして
2865.06,2867.36,それね別れるんだよ
2867.36,2869.66,マジで安すぎる美容院ってさ
2869.66,2871.7599999999998,その大衆向けというかさ
2872.5600000000004,2874.0600000000004,正直さ紙なんて切れりゃいいじゃん
2874.0600000000004,2878.1600000000003,曲の言っちゃえばてなんだらボーズでいいじゃん
2878.1600000000003,2885.1600000000003,でも腕のいい美容師さんは本当に違うわけよ
2885.1600000000003,2887.76,高すぎるのは嫌なの俺が今6000円で切ってるから
2887.76,2891.5600000000004,まあそれぐらいそうそれぐらいになると思う
2891.5600000000004,2899.5600000000004,俺価格6000円ぐらいかな月に1回6000円安くはないけど
2899.5600000000004,2901.0600000000004,でも俺も若い頃は3500円
2901.06,2906.46,新宿のたぶん今でもある3500円ぐらいのとこで切ってたから
2906.46,2907.56,いや分かんないまだ決めてない
2907.56,2915.36,値段はまだ決めてないその家賃とか人件費とかとすり合わして
2915.36,2918.66,なんかうまく回る値段を設定する
2918.66,2921.46,高校生だったら4000円だな
2921.46,2923.06,学割じゃあ学割しようかな
2923.06,2925.86,学割しないじゃん頭いい
2925.86,2929.36,お前ら学生ばっかでさ単価安い企業ばっか来んじゃん
2929.36,2931.36,どうせあるでしょパーマとかも当てないでしょ
2931.36,2932.86,カラーとかもしないでしょ
2932.86,2937.1600000000003,15分で帰れよ
2937.1600000000003,2939.56,すぐ帰れよ
2939.56,2948.06,学生はビーガン割りもする
2948.06,2950.76,でも中学生とかにも来てほしいじゃん
2950.76,2955.46,できれば中学生にも来てほしくない
2956.06,2961.96,うわすげーかっこよくなってるっていう
2961.96,2963.56,値段は正直まだ決めてません
2963.56,2968.06,なんかみんなとすり合わして決めていく
2968.06,2969.86,ブサイク割り
2969.86,2972.36,でも俺さ前さエステ行った時にさ
2972.36,2976.66,加藤さん頭大きいんでパックの値段1.5倍取らせてくださいって言われた時と同じ気持ちにならない
2976.66,2979.86,いやあなたすごいブスなんで特別に安くしますって
2979.86,2983.06,良かれと思って言われてもさ
2983.06,2983.86,結構傷つかない
2984.6600000000003,2985.86,ザクってきたんだけど俺
2985.86,2987.6600000000003,あ分かりました
2987.6600000000003,2989.6600000000003,とびきりのやつ使うんで
2989.6600000000003,2995.86,ただちょっと1人頭大きいんで1.5倍の値段取りますねって
2995.86,2998.46,かわいそう割りみたいな
2998.46,3000.86,カットモデルはマジで全部俺やる
3000.86,3002.46,なんかあの髪
3002.46,3004.1600000000003,そういう雑誌作ろう俺が
3004.1600000000003,3006.96,オリジナルの全部俺がモデル
3006.96,3009.46,だってさ面が良くてさ
3009.46,3012.76,スタイル良いやつのファッションなんて参考にならねえだろ
3012.76,3016.1600000000003,あんなのさ俺が似合う髪型ってみんな似合うのね
3016.1600000000003,3019.26,だって俺頭でっかくてスタイル超悪いじゃん
3019.26,3021.46,でごくごく一般的な顔してるのね
3021.46,3024.36,だから俺とかコウスケがねカットの
3024.36,3026.5600000000004,いや廃止者にやらせろ
3026.5600000000004,3027.96,そうしよう
3027.96,3035.6600000000003,そういう遊び心をちょっと入れていこうかなって思ってます
3035.6600000000003,3036.6600000000003,そうしよう
3036.6600000000003,3037.86,やっぱみんなに相談しよかった
3037.86,3044.46,いい案が今出ました
3044.46,3045.36,来てくれるよね
3045.36,3048.26,で俺は天草志郎
3048.26,3053.26,最近俺やっぱ天草志郎が一番ハマってるから
3053.26,3056.76,これかけると俺天草志郎なのね
3056.76,3060.56,流行ってんのこれ
3060.56,3063.56,これ見て天草志郎ってパッと出てきたやついいね
3063.56,3065.1600000000003,確かに似てんだと思ったんだよ
3065.1600000000003,3067.56,俺今日はちょっと似てないけど
3067.56,3071.66,逆に天草志郎どうやってあんなセンター分けにしてたんだろうな
3071.66,3075.16,あんな400年前のあの時代に500年前のあの時代にさ
3075.16,3076.86,あんなにピッチリセンター分けにしてた
3076.86,3083.86,天草志郎の髪の毛のさセットの秘訣知りたいよね
3083.86,3094.56,ワックスつけてたのかな
3095.06,3096.16,当時からあったんだ
3096.16,3099.46,噛みつけ油みたいな
3099.46,3103.96,お相撲取りみたいな
3103.96,3109.66,バー言うとかで
3109.66,3116.7599999999998,てこと?
3116.7599999999998,3119.06,いや緑さんはできん
3119.06,3121.56,あのあいつが来るって言ったらできん
3121.56,3126.36,もうすでにオープニングできん緑さん
3126.36,3130.36,申し訳ないけど
3130.36,3135.56,N国は全部一応NGで
3135.56,3145.46,あと緑さん汚いんでなんか嫌です
3145.46,3147.2599999999998,黒川さんですか
3147.2599999999998,3151.06,あの人緑さんよりやばい気がするまじで
3151.16,3155.86,黒川さん緑さんよりやばい気がするんだよね
3155.86,3157.2599999999998,別に配信もしてもいいけどね
3157.2599999999998,3161.2599999999998,そのカットしてる最中に自分の顔写してるぐらい
3161.2599999999998,3163.96,俺もやりていいし
3163.96,3166.16,なんか白髪も出てきたしさ
3166.16,3168.86,なんかもう40じゃん俺も
3168.86,3171.46,逆に髪とか染められんじゃん
3171.46,3174.36,30代前半で染めてるとガチ感出るけどさ
3174.36,3175.96,40ぐらいだったら髪染めてもいけない
3175.96,3177.7599999999998,いや白髪すげー増えてきたよ
3177.76,3183.0600000000004,わかんねーだろうけどさ
3183.0600000000004,3188.36,ちょっとわかんないよね
3188.36,3195.6600000000003,でもそんな真っ白にするほどあるわけじゃないよね
3195.6600000000003,3196.96,逆に染めれるなと思って
3196.96,3199.26,俺最後に髪染めたの22なのね
3199.26,3208.96,16年髪染めしてないの
3208.96,3211.26,なんかSNS宣伝してもらうってことで
3211.26,3213.36,ツイッターでフォロワーが多ければ多いほど割引とか
3213.36,3214.5600000000004,なんか俺もそれよく言われるけど
3214.5600000000004,3216.1600000000003,絶対嫌だからそれしません
3216.1600000000003,3218.0600000000004,別になんかみんな平等なんで
3218.0600000000004,3222.26,そのシステム俺身の毛を出すこと嫌いなんで
3222.26,3227.1600000000003,嫌です
3227.16,3229.06,SNSのフォロワーなんかどうでもいいです
3229.06,3231.7599999999998,僕は皆さんみたいな汚い汚い
3231.7599999999998,3233.56,モテない奴にメインで来てほしいんで
3233.56,3236.8599999999997,本来これ嘘でないガチのコンセプトとして
3236.8599999999997,3238.66,スタッフの募集そのうちする
3238.66,3240.3599999999997,それか俺がどっから引き抜いてくる
3240.3599999999997,3242.56,うちの方が条件いいぞって
3242.56,3244.16,受付はめちゃくちゃ可愛い女です
3244.16,3248.96,俺好みのなんかそのオーナー特権で
3248.96,3251.3599999999997,年頃な関係になれるかもしんねぇじゃん
3251.36,3258.1600000000003,それも全部言ってきます
3258.1600000000003,3259.06,俺のお前てめー
3259.06,3261.26,なんかアレアレすんじゃねーぞ
3261.26,3262.1600000000003,失礼なこと言ったら
3262.1600000000003,3277.56,ほんとぶっ飛ばすからな
3277.56,3279.86,マユカットもつけよっかな
3279.96,3283.36,ヘッドスパとか
3283.36,3286.6600000000003,自分がなんかして欲しいことを
