start,end,text
1496.8400000000001,1502.3600000000001,まあおめえあれかいろいろと忙しいってのもあんのか そんなことないよ別に
1502.3600000000001,1507.0,そんなこともないけど なんかちょっとさタイミングがね
1507.04,1510.12,合わなくなっちゃってんだよね
1510.12,1513.16,なるほどな
1514.2,1516.56,休みは
1516.56,1519.68,まっちゃんあれだっけ
1519.8,1523.24,まあ俺とは合わないかな 合わない
1528.88,1534.32,あれだね あれ1年もたってないよな数ヶ月前だよな
1534.32,1537.96,最後にみんなで遊んだのって 4ヶ月くらい前か
1537.96,1540.84,キャバクラ行ったとき?
1541.04,1544.32,あれ温かかったの確かな そんぐらいじゃない?
1544.32,1550.08,11月とか? うんいやもっと前じゃない? もっと前か9月とかか?
1550.08,1555.08,なんかまたちょっとあれだよね みんなで旅行とか行きたいよな そうなんだよそれなんだよな
1555.08,1560.24,ちょっと思ってたんだよね そのおめえさんがさスノボ買いようみたいなのが
1560.24,1567.44,話もしたからね スノボ行きたかったけどちょっと無理っぽいしね
1567.44,1571.92,でも大体3月ぐらいまではあれすべれるん じゃないの?
1571.92,1578.0,まあそうだね多分ね3月いっぱいぐらいは 滑れるんじゃない?
1581.0,1586.4,旅行になんだかんだ行くっつってなぁ じゃあふとんちゃんがさあいつ本当にさデブ症じゃん
1586.4,1593.68,出ないじゃん家から あいつさ嫌いでしょなんか外にあのみんなで出かけるのとか
1593.68,1599.8400000000001,実はそうかもしれない なんかねアクティブのようでアクティブじゃねえんだよなあいつ
1599.8400000000001,1605.48,おめえもさ結構さなんか いや俺はかなりねデブ症
1605.48,1613.0400000000002,俺ね家の中でずーっとなんかゴロゴロしてたよ 俺かなりのデブ症だよ
1613.72,1618.76,そうか いやーやっぱりあれかみんなで普通に
1618.76,1624.36,家でなんかゴロゴロして 遊ぶのが一番楽なのかな
1624.36,1630.44,で時々ニコ生やってみたいな 若い頃はさそれでゲームとかやってたじゃん
1630.44,1635.04,最近やることないんだよねそうやってやっててもさ
1636.1599999999999,1640.3999999999999,やっぱりでもさゲームってあれだよな みんなでやるとクソ面白いな
1640.4,1645.2800000000002,あの布団ちゃん家に行った時さお前らずーっとロックマンやってたじゃん あれクッソ面白かった
1645.2800000000002,1652.8000000000002,あれクッソ面白かったでしょ俺もさ寝ててさ途中からちょっとやったんだけどさ なんかすっげー面白かったもん
1652.8000000000002,1656.8000000000002,あれじゃなくて最終的に布団ちゃんがなんかゼンクリしたって そうそうそうそうそう
1656.8000000000002,1663.0800000000002,あのあの テングちゃんがさ超下手くそでさおめえがさおめえ下手くそなの
1663.08,1668.3999999999999,あれ久しぶり10年ぶりぐらいじゃないあんな無邪気にゲームしたのって
1668.3999999999999,1673.96,やっぱりみんなでやれば何でも面白いってことがねあの時わかった俺は
1674.4399999999998,1677.84,なんでも面白いんだと思うよ
1677.84,1680.12,だからなんか
1680.12,1683.08,メンチそばにでもいいし布団ちゃんにしにもいいから
1683.08,1688.6399999999999,行った時はなんかあれだな 決めてなんかゲームやりてえな
1688.76,1694.5200000000002,そうだね 昔みたいにさ家が近くねって言ってたのがちょっとネックだよなぁ
1695.0400000000002,1700.4,それが本当にめんどくせえよ なかなか合わせらんねえからなぁ
1700.4,1705.0800000000002,しかも長期の休みとかはねえじゃん1週間ぐらいおめえんちにさ
1705.0800000000002,1709.0,いたじゃん いたなーいやもっといた1ヶ月間ぐらいいたよ
1709.0,1712.64,だってさおめえと布団ちゃんあれだよな
1712.64,1718.3600000000001,なんだっけ 2ヶ月間ぐらい同棲してたよね
1718.4,1724.48,絶対同棲しなあかんな バイト行ってくるわみたいなさ
1724.48,1729.2800000000002,喧嘩もクソしたからな その間ドカポンとかで
1729.2800000000002,1732.3600000000001,俺絶対無理なんだけど
1737.8000000000002,1744.1200000000001,よく喧嘩ばっかしたなあの時からなぁ 普通に二人で歩いてたりしてもさすぐコロンになってさ
1745.1200000000001,1747.5200000000002,二人で歩いてさ
1747.5200000000002,1753.92,俺がなんだったっけなすげえ記憶にあるのがねえ 俺飲みに来てんだよってなってさ
1753.92,1760.48,でもあいつはなんかさいや俺はさそれ悪いよって いやでもそれはさ俺が金を払うから別にいいじゃん
1760.48,1765.7600000000002,いやでもそれはダメなんだよみたいなそういうのずーっと1時間ぐらいずーっと喧嘩したわ
1765.7600000000002,1768.68,それは布団ちゃん金ないときってこと? そう金ないとき
1768.68,1772.76,金なくて俺らが奢ってやるって言ってんのになんか嫌だって言ってさ
1772.76,1775.52,それどういう意味がわからねえみたいな
1775.52,1779.6000000000001,なんかあいつなりになんかあるのかなぁみたいなさ
1780.72,1784.44,プライドかそういうのか
1785.5600000000002,1789.88,そうだねここのね あいつもベジータみたいな野郎だからな
1789.88,1794.0800000000002,なんか枠の最後必ず悪口で終わるな
