start,end,text
0.0,2.0,ま、適当にくっちゃべって寝るか、最後に
24.0,26.0,寝るさんめちゃくちゃ久しぶり…
26.0,28.0,久しぶりに寝てる
28.0,30.0,寝るさんめちゃくちゃ久々に
30.0,32.0,今ちくわちゃんランキング見たら
34.0,36.0,めちゃめちゃ久しぶりだよな
36.0,38.0,心配だったんだよ、俺も
38.0,40.0,大丈夫かなと思って、やめちまったのかみたいな
48.0,50.0,おーし
50.0,52.0,転職は縛るの?
52.0,54.0,うーん
54.0,56.0,いや別に縛らないでいこうかなと思ってんだよね
56.0,58.0,別に縛る必要なくない?転職は
58.0,60.0,その代わり、みずちは25
60.0,62.0,ぽことはレベル28で遊び人に
62.0,64.0,転職させるけどね、強制的に
66.0,68.0,うーん、それはちょっとあれだな
68.0,70.0,あのー
70.0,72.0,俺の、なんていうのかな
72.0,74.0,歩みだね
74.0,76.0,あ、まあそう、俺もそうだね、俺も26で
76.0,78.0,転職だな、そういうちょっと
78.0,80.0,ちゃんとなぞらっていくわ
80.0,82.0,総領二人はあれだしな、来る
82.0,84.0,兄はずっともう生涯
84.0,86.0,そこまで総領でいてほしいね
86.0,88.0,あのー、成人としてのさ
88.0,90.0,なんか人生を全うしてほしいな
90.0,92.0,で、なんか27
92.0,94.0,"あいつ7,8ぐらいだろ、27,8ぐらいでなんかちょっと"
94.0,96.0,変なきたね、かんだた当たりと結婚させて
96.0,98.0,炎上させよう
98.0,100.0,それちょっとなぞらっていこう、ちゃんとな
100.0,102.0,あのー、やっぱ旦那選びはしっかりしろよみたいなさ
102.0,104.0,あとな、小笠原
104.0,106.0,小笠原ってやつ作って、そいつとペア組まして
106.0,108.0,二人とも殺そう
108.0,110.0,悪くないな、その選択肢
110.0,112.0,かんだたに殺されよう
112.0,114.0,うん、彼らももうあれだ
114.0,116.0,命を大事にしていかねえと
116.0,118.0,もう二度とよみがえることできねえからさ
120.0,122.0,5文字入んねえのか
122.0,124.0,あー
124.0,126.0,厳しい、それは、なんかうまく
126.0,128.0,うまくしていくわ
130.0,132.0,もうでもかんだた出てこねえだろ、ちょっと
132.0,134.0,この
134.0,136.0,あのスタイルも、横になって脱亡するわ
142.0,144.0,いやー、疲れた
144.0,146.0,マジで
146.0,148.0,うわー、体がカッチカチ
148.0,150.0,なっちゃった
150.0,152.0,うんこちゃんの
152.0,154.0,自動雑談ホームページ公開していいですか
154.0,156.0,なにそれ
156.0,158.0,うんこちゃんの自動雑談ホームページ
158.0,160.0,お前のホームページにその代わり
160.0,162.0,あれだぜ、なんだっけ
162.0,164.0,アフィとか貼ってあってそこに誘導するような考えだと
164.0,166.0,俺はお前許さねえぞ、許すけど
166.0,168.0,貼ることは許すけど、お前の存在許さないぞ
168.0,170.0,許す
172.0,174.0,うん
176.0,178.0,スンヨプオープン戦
178.0,180.0,5試合3ホーマー、許す
180.0,182.0,韓国人でも
182.0,184.0,リーシャウロンとスンヨプだけは許す
184.0,186.0,同胞だな、同じ釜の飯を
186.0,188.0,食った仲間じゃねえか
188.0,190.0,いいデフォを無視すんな
190.0,192.0,俺、いいデフォが世界で一番嫌いだわ
192.0,194.0,マジで
194.0,196.0,これ今まで黙ってたけど、俺そんなに人のこと嫌いにならないんだけど
196.0,198.0,あの2009年の
198.0,200.0,マウンドに刺した犯人だから
200.0,202.0,俺は許さねえぞ、いいデフォだけは
202.0,204.0,絶対に巨人戦でも
204.0,206.0,交流戦でも撃たれたくないな
206.0,208.0,まあ撃てねえだろ
208.0,210.0,バックがでかいやつは
210.0,212.0,変化球に対応できねえんだ
212.0,214.0,お前日本のプロ野球とさ、韓国のプロ野球の
214.0,216.0,一番の違いってやっぱ変化球だろ
216.0,218.0,違うね
218.0,220.0,ノリさんより嫌い?俺ノリさん嫌いじゃねえよ
220.0,222.0,別に、あいつ
222.0,224.0,嫌いじゃねえよ別に、どっちでもいい、普通
224.0,226.0,普通です
226.0,228.0,あ、アベは
228.0,230.0,いいデフォにビビらなくて、えー知らなかったわ
230.0,232.0,そういう事態が起きてたんだ
232.0,234.0,巨人の
234.0,236.0,高額契約金って俺なんか
236.0,238.0,それ知らねえんだよなうまく
238.0,240.0,実際のところどうなんだよみたいなさ
240.0,242.0,わかんないじゃん
242.0,244.0,わかんなくねえか
244.0,246.0,リーシャウロンと
246.0,248.0,ヨッチャン似てるって言ってたけど
248.0,250.0,あー違うな、あのー
250.0,252.0,本当にあいつうめえんだよ
252.0,254.0,遊白のさ、主題歌をさ
254.0,256.0,歌わせたら
256.0,258.0,右に出る者がいないね
258.0,260.0,右に出る者がいない
260.0,262.0,巨人がベイスターズに
262.0,264.0,一番の勘弁負けについて
264.0,266.0,いやそんな百何十試合もやってたら
266.0,268.0,一試合ぐらいそういう試合あるだろ普通に
268.0,270.0,ビビるな
270.0,272.0,一試合程度そんな負けを、しかもオープン戦だろ
272.0,274.0,練習だぞオープン戦なんて
274.0,276.0,なんの参考にもならないと思う
276.0,278.0,はっきり言ってオープン戦なんで
278.0,280.0,8月9月だろ
280.0,282.0,一騎一遊するのは
282.0,284.0,一騎一遊するな
284.0,286.0,巨人ガチメンバーだ
286.0,288.0,調整だって調整ほんとに
288.0,290.0,野球やったら分かるだろ
290.0,292.0,全然違うんだよ
292.0,294.0,ピッチャーもまああのなんていうの
294.0,296.0,本気じゃねえだろ向こうも
296.0,298.0,開幕1週間前1週間あるんじゃねえかよ
298.0,300.0,ガラリと変わるぞ1週間あれば
300.0,302.0,全然違う
302.0,304.0,ソフトバンクが860億で福岡ドーム買収した件
304.0,306.0,景気がいいなほんとに
306.0,308.0,そんな860億払うぐらい
308.0,310.0,だめだよ
310.0,312.0,そんな860億払うぐらい
312.0,314.0,懐が深いんだったら俺の番も解除してくれ
314.0,316.0,二刀流でいきたい
316.0,318.0,二刀流でいきたい
318.0,320.0,うんこ最近何してんの
320.0,322.0,彼女今日さすげえ幸せだったよ
322.0,324.0,彼女来たにも関わらず
324.0,326.0,7時間昼寝しちゃった
326.0,328.0,ほんと幸せだったわ
328.0,330.0,ほんとに幸せだったそういう
330.0,332.0,1日
332.0,334.0,隣で寝るわー
334.0,336.0,彼女が隣でブリーチ見てる
336.0,338.0,横でゴロゴロしてる最高だったわ
338.0,340.0,だから俺今日機嫌良くない
340.0,342.0,めちゃくちゃ機嫌良くないか
342.0,344.0,彼女がさ
344.0,346.0,違法ダウンロード
346.0,348.0,警察に突き出すわあいつ
348.0,350.0,違法サイトでブリーチ見てたからさ
350.0,352.0,俺を止めたんだよ
352.0,354.0,そういう行為
354.0,356.0,本当に許さねえかなみたいなこと言ったんだけどさ
356.0,358.0,だめだったわ
358.0,360.0,情弱だった
360.0,362.0,情報弱者は捕まるからな
362.0,364.0,俺絶対警察に言うから
364.0,366.0,お前らも許すなよそういうやつは
366.0,368.0,トレンドしてね
368.0,370.0,違法サイトで見せたわ
370.0,372.0,ジンとかも
372.0,374.0,そこで寝ちまった俺
374.0,376.0,ねねうんこちゃんジン見よーって言われたからさ
376.0,378.0,いいよーって
378.0,380.0,いいよーって言うふりして寝てた俺は
380.0,382.0,すごい死ぬ
382.0,384.0,女なんてちょっとさおだてりゃさ
384.0,386.0,ほんと俺あれだわ
386.0,388.0,猫科の動物がさ安心した奴にしか腹出して寝ないみたいに
388.0,390.0,俺もかなりおめえと一緒にいると安心するから
390.0,392.0,腹出して寝るわって寝たわ
392.0,394.0,裸で
394.0,396.0,エッチ断られたから
396.0,398.0,見せしめに寝てやった
400.0,402.0,そしたら上機嫌になっちまったよ
404.0,406.0,嬉しいみたいな
406.0,408.0,帰ってったわ9時半頃に
410.0,412.0,すごいちょっとあれだったね
412.0,414.0,いい一日を過ごしたなっていう
414.0,416.0,すごいなんかね幸せな
416.0,418.0,一日だった今日は
418.0,420.0,で女をさ追い出した後は
420.0,422.0,個人のさ
424.0,426.0,遊びにこうずると
426.0,428.0,本当に
428.0,430.0,今年で一番幸せな一日だった
430.0,432.0,本当に朝早く起きて
432.0,434.0,ちょっと朝配信して
434.0,436.0,昼から彼女が来て
436.0,438.0,夜帰らして
438.0,440.0,深夜に配信するみたいな
440.0,442.0,しかもまだ3日休みが残ってるんだ
444.0,446.0,神だね
446.0,448.0,神
450.0,452.0,神だな
454.0,456.0,じゃあ明日もお通じくれ
456.0,458.0,あーそういうのもあれだね
458.0,460.0,気分次第だな
460.0,462.0,明日何しようかな皮膚科行くわ明日
462.0,464.0,前向きに
464.0,466.0,皮膚科行って排斥休みなんだよな
466.0,468.0,日曜日だから
468.0,470.0,明日は皮膚科行ってジム行って
470.0,472.0,暇だったら
472.0,474.0,やろうかな
474.0,476.0,ニキビ消しすぎたら
476.0,478.0,ニキビなんか一個もねーやん
478.0,480.0,完全に体質改善により
480.0,482.0,治ったわ
482.0,484.0,真っ白にしたじゃん
484.0,486.0,キレイにしたじゃん
486.0,488.0,サイレントヒルか
488.0,490.0,うーん
490.0,492.0,悪くないねそういうのも
492.0,494.0,布団が12時間配信してるけん
494.0,496.0,気が狂ったんじゃないか
496.0,498.0,今日本当は遊ぶ予定だったんだよな
498.0,500.0,なんかでも雨だからやめようぜつって
500.0,502.0,お互いのなんかそういう結論のもと
502.0,504.0,遊ばなかった
508.0,510.0,昼2時前か
510.0,512.0,うーん
512.0,514.0,最近自分の動画見てるの
514.0,516.0,うーんあんまり
516.0,518.0,見てないね
518.0,520.0,最近ニコニコ動画をちょっとさ
520.0,522.0,見てないなあんまりな
522.0,524.0,あんまりニコニコ動画
524.0,526.0,見てないんだよな
526.0,528.0,面白い動画はさ
528.0,530.0,あんまり自分の中でないんだよな
534.0,536.0,レイシックについて
536.0,538.0,俺目
538.0,540.0,頭部のパーツで
540.0,542.0,目もいいし鼻もいいし
542.0,544.0,鼻水すすっちゃうぐらいで
544.0,546.0,口も別に臭くねーし歯もキレイだから
546.0,548.0,比較的
548.0,550.0,レイシックってあれだろ
550.0,552.0,面玉の表面のガラスのところ削って
552.0,554.0,焦点合わせるっていうオペだろ
554.0,556.0,頭でかいぐらいだな
558.0,560.0,視力は俺ほんと両目とも2.0あるぞ
560.0,562.0,ぶっちゃけニコ生いつやろうかな
562.0,564.0,うーん
564.0,566.0,そうやって考えてる時点でニコ生できねーだろ
566.0,568.0,しばらくは
568.0,570.0,いつやろうかなじゃなくてもう
570.0,572.0,湧き出るんだよやろうっつって
574.0,576.0,湧き出るんだよな
578.0,580.0,うんこちゃんおすすめの自分の動画は
580.0,582.0,ありすぎて困るな
582.0,584.0,選べねえよ1個なんて
584.0,586.0,選べねえ
586.0,588.0,40個ぐらいでまとめてお前に梱包して送るわ
588.0,590.0,お前と
590.0,592.0,発展途上国に
592.0,594.0,発展途上国に俺のあれ送ろうぜ
594.0,596.0,雑談CD
596.0,598.0,送ろう
598.0,600.0,少しでも幸せになってもらいたいみたいな感じで
600.0,602.0,そういう計画しようぜ
602.0,604.0,途上国に送ろう
604.0,606.0,100枚ほど
606.0,608.0,新しくできた学校に送ろう
608.0,610.0,いいね
610.0,612.0,再生できないとか関係ない幸せになってほしい
612.0,614.0,俺は
614.0,616.0,翻訳とかいらねえ
616.0,618.0,うまい刺身には醤油つけないでくるだろ
618.0,620.0,そういう理論
620.0,622.0,俺を味わう
622.0,624.0,言語とかじゃない気持ちで伝わるだろ
624.0,626.0,こいつ盛り上がってんだなみたいな
626.0,628.0,そういうイマジネーション膨らませるよ
630.0,632.0,魂で聞かせる魂に響かせる
632.0,634.0,なんでエッチ断られるの
634.0,636.0,お前お前彼女ってエッチ断るぞびっくりするだろ
636.0,638.0,彼女ってエッチ断るんだよ
638.0,640.0,ほんと生意気だよな
640.0,642.0,なんでお前彼女なのに
642.0,644.0,俺彼女にエッチ断られてんのみたいな
644.0,646.0,すぐあれかな
646.0,648.0,そういう風に求めてしまうからな
648.0,650.0,そういう気分じゃないみたいな
650.0,652.0,言われちった
652.0,654.0,今日は
654.0,656.0,しょうがねえなつって
656.0,658.0,全然俺厳しくねえしそんなこと言われてもみたいな
660.0,662.0,体だけだと思われたくないんだろ
662.0,664.0,出たそういうクソ理論
664.0,666.0,体だってそんなさ
666.0,668.0,なんか分かれよって感じじゃないの
668.0,670.0,なんかさ
670.0,672.0,よっぽど見る目がねえんだと思うはっきり言って
672.0,674.0,だってさ
674.0,676.0,分かるじゃんそういう男と
676.0,678.0,そういうことしない男の違い
680.0,682.0,なんか俺分かんねえわそういうのって
682.0,684.0,なんか自分の彼氏にそんな自信がねえのかみたいなさ
686.0,688.0,そんな風に思ってるわけない
688.0,690.0,なんかほんとに気分が乗って
690.0,692.0,なんかあれなのかな俺さエッチするときに
692.0,694.0,なんつーのエッチの誘い方が下手くそなんだろうな
694.0,696.0,すっごい
696.0,698.0,すっごい多分なんか
698.0,700.0,自然な感じでエッチするの嫌いだからさ俺
700.0,702.0,ずーっとなんつーの
702.0,704.0,布団の上で甘え
704.0,706.0,布団の上で甘え倒してそのままなんつーの
706.0,708.0,おっぱい吸いに行くみたいなさ
708.0,710.0,そっからしちゃうからいけないんだろうな
710.0,712.0,なんかさあれでしょ
712.0,714.0,髪の毛撫でながらさ綺麗だよみたいなこと言えねえからさ俺
716.0,718.0,ずーっと俺甘えてるから
718.0,720.0,四六時中おっぱい吸ってるからさ
720.0,722.0,それがちょっと悩むんだろうな
726.0,728.0,ちゃんとなんかそういう
728.0,730.0,ムードをね
730.0,732.0,作んないといけねえんだろうな
734.0,736.0,だからちょっと寝させてもらった
736.0,738.0,ふてくされて
738.0,740.0,悪いっつって
740.0,742.0,寝るわっつって
744.0,746.0,ヤフミがポコダの嵐にうんこのせいにしてたよ
746.0,748.0,いや俺の俺たちの視聴者だろ
748.0,750.0,そういう結論に至ったんだよな
750.0,752.0,どう考えても犯人はあれだろ
752.0,754.0,黒幕がここにいるだろ
756.0,758.0,どう考えても
758.0,760.0,正しいってか正常な判断的に
760.0,762.0,正常に考えるとそうじゃない
764.0,766.0,しょうがねえや
768.0,770.0,ポコダの案件は全てうちがちょっと
770.0,772.0,俺とポコダは一心同体なんだよ
772.0,774.0,光の部分がポコダで
774.0,776.0,闇の部分が俺だから悪いことは全部俺のせんしろ
776.0,778.0,ポコダに関しての
778.0,780.0,そういうな十字架を背負って配信していこう
780.0,782.0,太陽
782.0,784.0,太陽と月みたいな関係なんだよ
786.0,788.0,ポコダの闇の部分が俺
788.0,790.0,神様とピッコロの関係
790.0,792.0,みたいな感じだよ
792.0,794.0,神様とピッコロの関係な
794.0,796.0,どっちかが死んだら片方も死ぬみたいな
796.0,798.0,一心同体なんだよ
800.0,802.0,でも悪いとは思ってないだろ
802.0,804.0,自殺したらさすがにちょっとは心が悲しむけど
804.0,806.0,別に思わないかな
806.0,808.0,何が起きようが
810.0,812.0,そういうスタンスだな
812.0,814.0,最近の
814.0,816.0,しょうがないな
816.0,818.0,自殺下手したらするだろ
818.0,820.0,人生かかってんだからさ
820.0,822.0,ニコニコ動画の人気に
822.0,824.0,だからさ
824.0,826.0,タレントの人とかってさ
826.0,828.0,めんへら多いじゃん
828.0,830.0,8割くらいめんへらじゃん
830.0,832.0,他人と競争することでしか商品価値がない
832.0,834.0,自分に置き換えて考えてみ
834.0,836.0,めちゃめちゃ苦しいぞ
836.0,838.0,はっきり言って
838.0,840.0,めちゃめちゃ苦しいよ
840.0,842.0,マジでマジで
842.0,844.0,周りのさ
844.0,846.0,評価を気にしながら
846.0,848.0,だから2チャンネルの中で
848.0,850.0,生きてるようなもんだよ
850.0,852.0,絶対罵声とか浴びせられるじゃん
854.0,856.0,だからある種の挑戦
856.0,858.0,苦しいからね
858.0,860.0,みんな排除すればいいのにそういうわけじゃない
860.0,862.0,職場で悪口言われるもん
862.0,864.0,そんなもんじゃねえだろ
864.0,866.0,職場なんてさ家帰ってきてもさ
866.0,868.0,金だけもらってさ
868.0,870.0,普通に過ごすことできるじゃん
870.0,872.0,仕事がなくなっちゃうんだぜ悪口言われたら
872.0,874.0,俺別に悪口言われても仕事なくなんねえもん
874.0,876.0,結果さえ出してれば別にさ
876.0,878.0,悪口言われてようが何されようが別に関係ないから
880.0,882.0,ツイッターとかで悪口言われるんだよ
882.0,884.0,最悪だろ
884.0,886.0,でキレるんだろ芸人みてえに
888.0,890.0,だからちょっとやべえだよな
890.0,892.0,身の回りの人に言われるほうがきついだろ
892.0,894.0,いやでも結構耐性つくぞ
894.0,896.0,諦められるよほんとに
896.0,898.0,それはねみんなもね
898.0,900.0,社会に出て最初に苦労すると思うんだよ
900.0,902.0,周りの人の目を気にしながら生きなきゃいけない
902.0,904.0,どうしてもそうなるとしょうがないと思うんだけど
904.0,906.0,そんなの慣れるから
906.0,908.0,2ヶ月で慣れたな
908.0,910.0,2ヶ月で慣れた
912.0,914.0,君えらいことばっか抜かしとるけど
914.0,916.0,うんこちゃんも自炊しない
916.0,918.0,俺自炊なんか全然しねえよ
918.0,920.0,10年くらいしてねえよ自炊なんで
920.0,922.0,時間がもったいない
922.0,924.0,でもなんかあれが汚れる
924.0,926.0,台所が汚れるのがめんどくさい
928.0,930.0,その2ヶ月が怖い
930.0,932.0,ああまあそうだなしょうがないな
932.0,934.0,俺だって風呂入れなくなったって言ってんだよだから
934.0,936.0,その2ヶ月
936.0,938.0,これ嘘じゃねえからなお風呂入れなくなるのが第一信号だから
938.0,940.0,もうほんとにだめだ
940.0,942.0,ってなっちゃって
942.0,944.0,それを乗り越えたらもう何にも怖くなくなるほんとに
944.0,946.0,何にも怖くなくなるから
946.0,948.0,よく言うだろ
948.0,950.0,試練乗り越えたら人間は強くなるって
950.0,952.0,俺結構最近
952.0,954.0,1年2年前くらいにそういう事態が起きて
954.0,956.0,実際乗り越えたら強くなったからこれ信じていいぞ
956.0,958.0,そういう試練乗り越えた時はほんとに強いぞ
958.0,960.0,で負けてさダラダラニートとかして
960.0,962.0,親とかのすねかじるようになっちゃうと
962.0,964.0,もう泥沼だよね
964.0,966.0,一度そういうところでくじけた人間はもう立ち直れないから
966.0,968.0,ほんとに
968.0,970.0,いかにしても病気になっても
970.0,972.0,病気になる覚悟で挑むしかないんだよな
972.0,974.0,誰も助けてくれないぞ
974.0,976.0,親は先に死ぬからな下手すら60で死ぬぞ親は
976.0,978.0,その後さね親の葬式
978.0,980.0,やる金がありませんってさ
980.0,982.0,親戚頼ることになるんだよ
982.0,984.0,絶対やめたほうがいいな
984.0,986.0,それは
986.0,988.0,やめたほうがいい
988.0,990.0,そういう人生はやめたほうがいいよ
990.0,992.0,間違いなく
992.0,994.0,逃げをしたらダメなの
994.0,996.0,学生のうちは全然いくらでもいいと思うんだけどね
996.0,998.0,学生のうちは
1000.0,1002.0,ニートは憲法違反って言ってたんだ
1002.0,1004.0,そうそうそう
1004.0,1006.0,義務を果たしてないじゃんだって
1006.0,1008.0,教育
1008.0,1010.0,勤労納税だっけ
1010.0,1012.0,国民の三大義務
1012.0,1014.0,義務を果たしてない人間が権利を支障しなきゃいけないんだよ
1014.0,1016.0,人としての権利を俺は持ってないって言われても
1016.0,1018.0,しょうがないと思ってるよ
1018.0,1020.0,学生のときいくら貯金してたか
1020.0,1022.0,そんな貯金してないと思う
1022.0,1024.0,努力義務か
1024.0,1026.0,でも最終的には
1026.0,1028.0,そう言われちゃったらしょうがない
1028.0,1030.0,ギリシアみたいに国が破綻されたら
1030.0,1032.0,それ国に洗脳されて
1032.0,1034.0,実際問題は
1034.0,1036.0,権利を支障してほしくないんだよ
1036.0,1038.0,納税とかしてない人は
1038.0,1040.0,当たり前のことなんだよ
1040.0,1042.0,誉めてくれないんだよ
1042.0,1044.0,働いて納税しても
1044.0,1046.0,働いてなくてできない人は
1048.0,1050.0,だから国はホームレスを助けない
1050.0,1052.0,ホームレス助けてるって
1052.0,1054.0,俺の医者の
1054.0,1056.0,元カノが言ってた
1056.0,1058.0,本当に理不尽だよって
1058.0,1060.0,ホームレスでも
1060.0,1062.0,病院に運ばれてきちゃったら治療しなきゃいけないんだよ
1062.0,1064.0,その治療費はどこから出る
1064.0,1066.0,国から出るんだぜ
1066.0,1068.0,その国ってどこから年出してるかって
1068.0,1070.0,税金から年出してるだろ
1070.0,1072.0,その税金を納めてるってのは国民なんだぜ
1072.0,1074.0,俺も助けないべきだと思うんだよ
1074.0,1076.0,本当に前向きに
1076.0,1078.0,助けないべきだと思うんだよな
1080.0,1082.0,拒否できないんだよ
1082.0,1084.0,助けなきゃいけないんだよ
1084.0,1086.0,おかしいと思っちゃうんだよ
1086.0,1088.0,医者が思ってんだからさ
1088.0,1090.0,精神的にも
1090.0,1092.0,人を助けたいっていう心はどっかにあるでしょ
1092.0,1094.0,金がいいとかステータスとかもあるだろうけど
1094.0,1096.0,そういう人たちが
1096.0,1098.0,思ってんだからさ
1098.0,1100.0,やっぱり現場に行ったらもっとそういう不条理なことって
1100.0,1102.0,一番腹立つのが
1102.0,1104.0,30代とか40代の無職が
1104.0,1106.0,政府もらって
1106.0,1108.0,病院に入院してきたときに
1108.0,1110.0,本当に社会の不条理を感じるらしいよ
1110.0,1112.0,これはよく言ってる
1112.0,1114.0,みんな
1114.0,1116.0,看護師の友達とかがよく言ってるな
1116.0,1118.0,うん
1118.0,1120.0,本当に理不尽だよ
1120.0,1122.0,そんな人のために働くなんて
1124.0,1126.0,全部無料なんだぜ
1126.0,1128.0,俺たちだって
1128.0,1130.0,国庫を受けるにもさ
1132.0,1134.0,国民医療保険とか入ってないんだ
1134.0,1136.0,国庫入ってないんだぜ
1136.0,1138.0,払ってないんだよ月々1万なんぼのお金も
1138.0,1140.0,だからそうならないように
1140.0,1142.0,働こうぜっていう俺の意思表示だな
1142.0,1144.0,なんで後で請求とかされないの
1144.0,1146.0,されない
1146.0,1148.0,国が払うから
1148.0,1150.0,なんでかって分かんないんだよね
1150.0,1152.0,国が払うんだよ
1152.0,1154.0,国庫が払えないんだろ
1154.0,1156.0,払えるように若いうちから考えていかなきゃいけないよな
1156.0,1158.0,それ自体がさ
1158.0,1160.0,起きてるっていう現実がいっぱいあるのにさ
1160.0,1162.0,それに対して
1162.0,1164.0,回避しようとしないっていう俺精神が分かんない
1164.0,1166.0,だから俺好きじゃないんだよニートは
1166.0,1168.0,働いてほしいな
1168.0,1170.0,頑張って
1170.0,1172.0,エッチしよう
1172.0,1174.0,それならみんな言えないって
1174.0,1176.0,本当だよな
1176.0,1178.0,厳しいこと言うようで申し訳ないけどさ
1178.0,1180.0,こんな深夜1時30分にさ
1180.0,1182.0,横になりながら配信してる男が
1182.0,1184.0,言っても説得力ないだろ
1184.0,1186.0,そういう話聞くとやっぱ腹が立つね
1194.0,1196.0,俺の兄はバイトから心潰れてニートしてるよ
1196.0,1198.0,まぁそうなんだけどな
1198.0,1200.0,立ち直った方がいいと思うぜ
1200.0,1202.0,自分のためにも
1202.0,1204.0,楽しい話しましょう
1204.0,1206.0,今の俺すごく楽しかった今
1206.0,1208.0,石川に行ってやるよ
1208.0,1210.0,別にあれなんだろ
1210.0,1212.0,変な配信業として成り立ってるでしょ今は
1212.0,1214.0,なんか経験しとけってバイトある?
1214.0,1216.0,バイトなんか俺したことない
1218.0,1220.0,バイトなんかしたことない
1222.0,1224.0,まぁもちろんね本人たちも
