start,end,text
3726.88,3729.88,普通にだってまだ俺全クリできてないし、100時間くらいやっても
3729.88,3732.88,3DSのソフトではかなり売れたほうが
3732.88,3735.88,他のなんか、でもあれでしょ
3736.88,3739.88,任天堂DSだったら偽トロキャプチャーってあるだろ
3739.88,3742.88,偽トロキャプチャー
3742.88,3745.88,それか鉄王方式でテーブルの上に乗せて
3745.88,3748.88,カメラ起動っていう手もあるのか
3748.88,3751.88,3DSってちょっとあれだよね
3751.88,3754.88,鉄王の時間通り噛みかかってんだろ
3754.88,3757.88,噛みかかってないか、俺
3757.88,3760.88,気づかなかったよ、途中まで
3760.88,3763.88,鉄王荒らしてた頃の
3763.88,3766.88,俺じゃ気づかなかった
3766.88,3769.88,寄り添ってから気づいた、良さに
3769.88,3772.88,相当いいカメラ使ってるんじゃね
3772.88,3775.88,相当いいカメラ使ってるでしょ
3775.88,3778.88,マジでマジで
3778.88,3781.88,鉄王とあれ時間通りやばくね
3781.88,3784.88,そういうなんか、真似して生きてるような
3784.88,3787.88,荒らすような配信じゃねえだろ
3787.88,3790.88,俺の心が病んでいた、あれは
3791.88,3794.88,ちょっとあれだよね
3794.88,3797.88,フェニックスみたいに、あれゴミ画質じゃなかった?
3797.88,3800.88,小学校の時のプール思い出したわ
3800.88,3803.88,あいつの動画ちょっと見たことあるけど
3803.88,3806.88,ゴミ画質だよね、あれは
3806.88,3809.88,フェニックスとかだけ何やってんの
3809.88,3812.88,フェニックス、不死鳥
3812.88,3815.88,不死鳥は何やってんの
3815.88,3818.88,やめちゃったのか、もう
3819.88,3822.88,考えうる最悪の行為をしてるんだ今
3822.88,3825.88,世の中でしたくないワン・ツーだな
3825.88,3828.88,ランキングポケモンとパチンコ
3828.88,3831.88,子供にしてほしくないことナンバーワンとツー
3831.88,3834.88,雑談ばっかりしてる
3834.88,3837.88,いいことじゃねえか
3837.88,3840.88,雑談生主の人とかが悲しいんだよな
3840.88,3843.88,最近ゲーム配信が主流だからよ
3843.88,3846.88,許しつつある稽古
3846.88,3849.88,雑談頑張ってほしいな
3849.88,3852.88,外配信とかで
3852.88,3855.88,家の中で単気で喋ってる配信が
3855.88,3858.88,一番好きだから
3858.88,3861.88,最近レオモンにハマってしまったわ
3861.88,3864.88,認めれば良さも見えてくるだろ
3864.88,3867.88,雑談生主なのか?
3867.88,3870.88,俺は違う、ゲーム生主だから
3870.88,3873.88,そんなカテゴリーするのやめてくれ
3873.88,3876.88,ニコ生でも雑談してるんだけどな
3876.88,3879.88,うーんって感じなんだよな
3879.88,3882.88,やり尽くした感が舐めないんだよな
3882.88,3885.88,何かしようって思うんだけどな
3885.88,3888.88,何かしようと思ってやってる時って
3888.88,3891.88,大体上手くいかないからやらない方がいいんだよな
3891.88,3894.88,無にしてほしい
3894.88,3897.88,やろうと思った時にやると思う
3897.88,3900.88,鉄を見たり野球実況やらないの?
3900.88,3903.88,どうやって野球実況したの?
3903.88,3906.88,鉄道ってどうやって野球実況したの?
3906.88,3909.88,俺もやりたいんだけど
3909.88,3912.88,公式放送ミラー?
3912.88,3915.88,おー
3915.88,3918.88,ニコニコの公式ミラー
3918.88,3921.88,それは許されてるの?
3921.88,3924.88,俺でもはっきり言って
3924.88,3927.88,野球見てる時に口めちゃくちゃ悪いぞ
3927.88,3930.88,清水の肩が悪すぎてチャブ台ひっくり返したことあるよ
3930.88,3933.88,そういう配信になるぞ
3933.88,3936.88,あまりにも弱犬すぎて
3936.88,3939.88,チャブ台ひっくり返して親に切られたことあるからね
3939.88,3942.88,清水の肩が悪すぎて
3942.88,3945.88,そういう配信になるぞ
3945.88,3948.88,公安から俺潰されない?
3948.88,3951.88,マジで
3951.88,3954.88,切れるよ俺
3955.88,3958.88,あいつも野球やるんじゃねーよみたいな
3958.88,3961.88,そんな生ぬるくねーよ
3961.88,3964.88,そんな生ぬるくねーよ
3964.88,3967.88,俺もう入っちゃうから野球見てる時は
3967.88,3970.88,感情が移入しちゃうから
3970.88,3973.88,切れちゃうと思う
3973.88,3976.88,だから俺彼女の前でもテレビで野球見れないんだよな
3976.88,3979.88,テレビはテレビで見るから実況だけしてくれ
3979.88,3982.88,それだと趣がなくない?
3983.88,3986.88,解説に鉄を呼んで
3986.88,3989.88,実況俺がするわ
3989.88,3992.88,革頭張りの精神論を
3992.88,3995.88,俺のリスペクトと革頭張りの根性論で実況していきたい
3995.88,3998.88,解説は
3998.88,4001.88,話振ってくれそうじゃん
4001.88,4004.88,回すのうまそうじゃん
4004.88,4007.88,副音声でモコに実況させればいいだろ
4007.88,4010.88,裏側でモコとフェニックスに
4010.88,4013.88,その4人でコラボしよう
4013.88,4016.88,よくねーか
4019.88,4022.88,テレビっぽくするためには副音声も必要だろ
4022.88,4025.88,鉄王は多球弾も詳しいけどうんこじゃなくて全球弾いける
4025.88,4028.88,勉強すればいけるでしょ
4028.88,4031.88,しかるべき対処
4031.88,4034.88,準備をするよ
4035.88,4038.88,それなりに予備知識も備えて
4038.88,4041.88,解説者たちのあれを見て
4041.88,4044.88,やるぜ
4046.88,4049.88,ぜひ
4049.88,4052.88,鉄王忙しいから邪魔したくねーんだよ
4052.88,4055.88,本格的に帰ってきて
4055.88,4058.88,一緒にやりませんか
4058.88,4061.88,声かけるわ
4061.88,4064.88,バトルの戦術
4067.88,4070.88,ポコ太の悪いことがあったら全部俺に成しつける
4070.88,4073.88,俺の悪いことがあったらバトルに成しつける
4073.88,4076.88,受け流すわ
4076.88,4079.88,俺だって生きてるんだよ
4079.88,4082.88,人権の主張するね
4082.88,4085.88,どこにいるの
4091.88,4094.88,誰のサッカーの香川
4094.88,4097.88,サッカーといえば香川みたいな感じだろ
4097.88,4100.88,象徴だね
4105.88,4108.88,ドルトムントいいね
4108.88,4111.88,ドヤクエで出てきそうだね
4111.88,4113.88,ラスボスマジカだね
4113.88,4115.88,めっちゃゴール決める
4115.88,4117.88,へー
4117.88,4119.88,ティロフィナーレ香川
4119.88,4121.88,めっちゃかっこよくない
4121.88,4123.88,帰国始終なんだ香川さんって
4123.88,4125.88,最近よく言うのは香川やべーよみたいな感じで
4125.88,4127.88,ティロフィナーレ香川
4127.88,4129.88,いいねーあのーオレイモのあいつみたいだな
4129.88,4131.88,イザベラヨシカワみたいなやつ
4131.88,4133.88,なんだっけ
4133.88,4135.88,マキクロードみたいなやつなんだっけ
4135.88,4137.88,オレイモのマキクロードといえば誰
4137.88,4139.88,サオリバジーナみたいな感じか
4139.88,4141.88,メインマッチだね多分
4141.88,4143.88,ティロフィナーレ香川対サオリバジーナ
4143.88,4145.88,あれなんじゃないか12月31日とかだったら
4145.88,4147.88,メインマッチ
4147.88,4149.88,メインマッチ組めるぐらいのメンツじゃない
4149.88,4151.88,プライドあたりで戦ってほしいね
4151.88,4153.88,ダイナマイトで
4153.88,4155.88,ボブサップの次あたりで出てきてほしいね
4155.88,4157.88,ティロフィナーレ香川対サオリバジーナ
4157.88,4159.88,その
4159.88,4161.88,マッチメイク頼むわ
4161.88,4163.88,オレ夢にレオンが出てきて
4163.88,4165.88,レオモンとオレは友達で
4165.88,4167.88,レオモンは動画あげたくなってないって言ってた
4167.88,4169.88,それもオレは慰めてた
4169.88,4171.88,マサイ夢になりそうだよな
4173.88,4175.88,バジーナがガンダムのキャラって知らねえだろ
4175.88,4177.88,知らねえなにそれ
4177.88,4179.88,あ、え、あだ名なの?
4179.88,4181.88,サオリバジーナって
4181.88,4183.88,え、だとしたらオレ裏切られたんだけど
4185.88,4187.88,あだ名なの?
4187.88,4189.88,本名じゃねえのサオリバジーナって
4191.88,4193.88,マジかよ
4193.88,4195.88,ハンドルネームなんだ
4195.88,4197.88,ニックでうんこちゃうみたいな感じ
4197.88,4199.88,あ、そうなんだ本名は何なのあいつの
4199.88,4201.88,騙された捕まされたわ
4201.88,4203.88,本名は何なの
4203.88,4205.88,本名
4205.88,4207.88,サオリ?
4207.88,4209.88,サが苗字でオリが名前か
4209.88,4211.88,昔懐かしいなあれの名前だね
4211.88,4213.88,二文字がもう
4213.88,4215.88,最小のあれだから
4215.88,4217.88,サノトモオリかマジか
4217.88,4219.88,聞き覚えのあるあれだね
4219.88,4221.88,親近感が湧いたわ
4221.88,4223.88,余計好きになったオレ今
4223.88,4225.88,あのOC名前してるな
4225.88,4227.88,女っぽい名前してるのかと思ってた
4229.88,4231.88,ソウシハンケイスケ
4231.88,4233.88,元嫁の名前だった
4233.88,4235.88,離婚してたのか
4235.88,4237.88,オレ顔でけえから応援してんのに
4237.88,4239.88,あの顔のでかさはちょっとなんかね
4239.88,4241.88,あれだよな
4241.88,4243.88,なんか上手く
4243.88,4245.88,知名度が上がってって顔がでかいやつの
4245.88,4247.88,なんかシンボルになってほしいね
4247.88,4249.88,うん
4251.88,4253.88,経営好きはいろいろあるんだよ
4253.88,4255.88,なんかでもそういうのを経験してるからこそ
4255.88,4257.88,ああいう強さがあるんだろうね
4257.88,4259.88,オレわかんない
4259.88,4261.88,ぶっちゃけそのさ
4261.88,4263.88,梅原周辺の事情は知らねえけどさ
4263.88,4265.88,福島
4265.88,4267.88,牧島
4267.88,4269.88,牧島サオリへー
4269.88,4271.88,経営してた
4271.88,4273.88,ゲーセンが倒産して離婚した
4273.88,4275.88,笑いをこらえようと必死だというのがバレたな今
4275.88,4277.88,オレは悲しいんだぜ今
4277.88,4279.88,笑ってねえからな
4279.88,4281.88,笑ってねえぞ
4281.88,4283.88,そういうのをオレは結構大事にするタイプだから
4283.88,4285.88,応援するタイプだから
4287.88,4289.88,応援するタイプだったよ
4289.88,4291.88,タイプだった
4291.88,4293.88,ちょっとあれだな
4293.88,4295.88,頑張ってほしいな
4295.88,4297.88,ケースケー
4297.88,4299.88,加速
4299.88,4301.88,加速さん
4301.88,4303.88,なんか結構こういう関係広いよね
4303.88,4305.88,人と知り合いだよね
4305.88,4307.88,孫ってハンターハンターの誰かに似てる
4307.88,4309.88,あれ似てるなボマーに似てるよな
4309.88,4311.88,オレも前は思ってた
4311.88,4313.88,ボマー似てるよな
4315.88,4317.88,ゲンスルーか
4317.88,4319.88,そうそうそう
4319.88,4321.88,ゲンスルー
4321.88,4323.88,あれ似てるよなでも孫かっこよくない
4323.88,4325.88,顔
4325.88,4327.88,なんかあれだななんか一個できることがある
4327.88,4329.88,ねえ孫がだってスパ方できなかったらちょっとさ
4329.88,4331.88,やべえけどさやっぱスパ方できるってだけで
4331.88,4333.88,孫かっけえもんな
4333.88,4335.88,なんかちょっと天狗な感じがいいよね
4335.88,4337.88,あのねキャラクターっていうかさ
4337.88,4339.88,なんか結構
4339.88,4341.88,でかいこと言う人間オレ嫌いじゃないから
4341.88,4343.88,ああいうなんか
4343.88,4345.88,人好きだわああいうキャラ
4345.88,4347.88,ビッグマウス
4347.88,4349.88,そうそうそう
4349.88,4351.88,梅原に対して
4351.88,4353.88,有名どころしか知らねえんだよな
4353.88,4355.88,セントスの顔は別にセントスの顔普通じゃねえ
4355.88,4357.88,イソギンチャクみたいな顔して
4357.88,4359.88,至って普通の日本人って感じで別に
4359.88,4361.88,俺好印象だよ顔出しても全然
4361.88,4363.88,ありだなって思うわあのイソギンチャク
4363.88,4365.88,まあ海で泳いでたらオレイソギンチャクの
4365.88,4367.88,区別つかねえけどな
4367.88,4369.88,それはしょうがなくねえかオレ悪くねえよな悪口でもなんでもねえ
4369.88,4371.88,実際問題事実オレ言ってるだけで
4371.88,4373.88,海水浴一緒に行かなければ
4373.88,4375.88,オレ別にセントスはすごい好きだわ
4375.88,4377.88,モコの顔はそれには触れない
4379.88,4381.88,モコの顔には触れない
4383.88,4385.88,今ゲロが生音してるけど
4385.88,4387.88,荒らさなくていいんすか一人で行け
4387.88,4389.88,勝手にオレを巻き込むんじゃねえ
4389.88,4391.88,オレを巻き込むな
4393.88,4395.88,モコ顔出してないでしょ
4395.88,4397.88,なんかそのチラッと見えちゃっただけでしょ
4397.88,4399.88,正直そんなんじゃ分かんねえじゃん
4399.88,4401.88,分かんなくない
4401.88,4403.88,水池の顔は別に普通
4403.88,4405.88,カメラになんかあれでしょ
4405.88,4407.88,画面8割唇みたいな感じだろ
4407.88,4409.88,最近水池生きてんのか頑張ってんのかアイツは
4411.88,4413.88,水池さん
4413.88,4415.88,頑張ってんの
4417.88,4419.88,水池さん
4421.88,4423.88,めっちゃ放送してるんだ
4423.88,4425.88,じゃあ頑張ってんだ
4429.88,4431.88,生きてればいいか
4431.88,4433.88,しょうがねえな
4433.88,4435.88,ニコ生やんなくてもいいからさ
4435.88,4437.88,ユーストあればいいのになアイツも
4437.88,4439.88,ユースト
4439.88,4441.88,思わないユースト
4441.88,4443.88,ねえ
4443.88,4445.88,むしろ放送してるから
4445.88,4447.88,頑張ってないかもしれない
4447.88,4449.88,逆に考えてさ
4449.88,4451.88,仕事のような疲れを癒してんじゃねえか
4453.88,4455.88,俺iPhone持ってるから分かるけどアプリあるぜ
4455.88,4457.88,ユーストリームで放送するアプリ
4461.88,4463.88,あるぜ本当に
4463.88,4465.88,なんでユーストよりニコ生が流行ってんの
4465.88,4467.88,なんか裾野の違いじゃないやっぱ
4467.88,4469.88,いろんなやついるじゃん
4469.88,4471.88,やっぱそういうのって魅力じゃない
4471.88,4473.88,いろんな人がいるっていうかさ
4473.88,4475.88,ユーストリームってやっぱ本当にね
4475.88,4477.88,信者だけっていうイメージやっぱ俺もあるからさ
4479.88,4481.88,どうしてもやっぱニコ生見ちゃうよな
4481.88,4483.88,人が多い
4483.88,4485.88,まあそうだね
4487.88,4489.88,水地は囲われたいんだろ
4489.88,4491.88,これが多いだろ
4491.88,4493.88,それとは違うんだやっぱ飽きちゃったんじゃない
4493.88,4495.88,ユーストリームなかなかいねえもんな
4495.88,4497.88,弾かれるもんね
4497.88,4499.88,水地15万持ってる話
4499.88,4501.88,多いじゃねえか
4501.88,4503.88,ユーストは英語っぽいから子供見ない
4503.88,4505.88,それとはちょっと違う気がするけどね
4505.88,4507.88,うんこちゃんなんでそんなに嫌われてるの
4507.88,4509.88,別に普通ぐらいじゃない
4509.88,4511.88,必要以上に人から好かれようとすることはないぞ別に
4511.88,4513.88,それがなんかさ
4513.88,4515.88,いろんなしがらみを増やしていくんだよ
4515.88,4517.88,例えばだよ
4517.88,4519.88,俺がポコ太と仲良くなったらポコ太の悪口言えなくなるんだよ
4519.88,4521.88,そんな面白くもなんともねえじゃん
4521.88,4523.88,本末転倒って感じだよ
4523.88,4525.88,俺別に人との繋がりを作りたいわけでもなく
4525.88,4527.88,女と出会いたいわけでもなく
4527.88,4529.88,お金が欲しいわけでもなく
4529.88,4531.88,自分が楽しみたいから
4531.88,4533.88,人との横の繋がりは必要ないんだよな正直
4533.88,4535.88,そうそうそう
4535.88,4537.88,必要とあれば自分が楽しむためであれば別に絡むけど
4537.88,4539.88,だからなんかさ
4539.88,4541.88,一匹狼を別に歌ってるわけじゃなくて
4541.88,4543.88,楽しそうだったら絡むよ全然
4543.88,4545.88,そうそうそう
4545.88,4547.88,なんかそういう横の繋がりは
4547.88,4549.88,ただ悪にしか俺は見えないからね
4549.88,4551.88,うん
4551.88,4553.88,うんこちゃんには関わりたくない
4553.88,4555.88,なんかそういう団体作って
4555.88,4557.88,リーダーをバトラーにやらせよう
4557.88,4559.88,ちょっと
4559.88,4561.88,そういうなんか影の団体も
4561.88,4563.88,俺が牛耳っていくわ
4565.88,4567.88,俺だけ牛耳っていくわ
4575.88,4577.88,スタッフに言うか使おう
4577.88,4579.88,お前でも実際絡まれたら超めんどくせーぞ絶対
4583.88,4585.88,バトラーはお前の何なんだ知らねー
4585.88,4587.88,飯屋
4587.88,4589.88,うんこって必要以上に
4589.88,4591.88,敵を生かすのなんだよ
4591.88,4593.88,仮想敵がいたほうが面白いじゃん
4593.88,4595.88,仲間だらけのお前争いなくして
4595.88,4597.88,お前何も生まれないぞ
4597.88,4599.88,負けたくない
4599.88,4601.88,視聴者もだってあれでしょ
4601.88,4603.88,あいつらに負けたくないみたいなさ
4603.88,4605.88,なんもほんとなんもない
4605.88,4607.88,日常みたいなさ朝歯磨きしてねー
4607.88,4609.88,飯食って仕事して飯食って寝るみたいな
4609.88,4611.88,恥になっちゃう
4611.88,4613.88,違うなそんなのは
4613.88,4615.88,俺の配信だから俺の気持ちが一番大事なんだよ
4621.88,4623.88,敵を作ってない
4623.88,4625.88,いるのは好敵種のみ
4625.88,4627.88,いいこと言ったね
4627.88,4629.88,ライバルだな
4629.88,4631.88,友
4631.88,4633.88,俺はもうその
4633.88,4635.88,武力を介したコミュニケーションでしか
4635.88,4637.88,測れないんだよな
4637.88,4639.88,友好関係を築けないんだよ
4639.88,4641.88,俺の愛のムチだなこれ
4641.88,4643.88,そろそろ女リースだと思う
4643.88,4645.88,面白そうだな
4645.88,4647.88,俺優しくしねえぞ今までみたいに
4647.88,4649.88,っていう
4649.88,4651.88,あれがあるんだったら全然いいよ
4651.88,4653.88,俺本気で叩くぜ
4653.88,4655.88,優しくできないぜ
4655.88,4657.88,今の自分は
4657.88,4659.88,必要以上に
4659.88,4661.88,言葉の暴力浴びせようとは思わないけど
4661.88,4663.88,本当に優しくできないぜ
4667.88,4669.88,泣かすとかじゃないけど
4669.88,4671.88,自分が考えうる
4671.88,4673.88,自分の感情とかじゃなくて
4673.88,4675.88,正論をできるだけ言うようにするぞ
4675.88,4677.88,そしたら
4677.88,4679.88,できるだけ
4679.88,4681.88,考えうる最大の正論を吐くぞ
4685.88,4687.88,キャバクラみたいに
4687.88,4689.88,一対一だろ
4689.88,4691.88,そこは
4691.88,4693.88,俺のこと嫌いな女と喋りたいな
4693.88,4695.88,自分のこと好きな女を悪口言って
4695.88,4697.88,それで悲しませるのはやじゃん
4697.88,4699.88,俺のこと嫌いな女集めたいな
4701.88,4703.88,まじで生主でもいいや
4703.88,4705.88,まこといいね
4705.88,4707.88,巨悪と書いてある巨悪
4707.88,4709.88,スーシーかもうスーシー殺されてるだろ
4709.88,4711.88,無理だ
4711.88,4713.88,メグミルクは俺言えねえよ悪口
4713.88,4715.88,俺好きだもんだってメグミルクのこと
4715.88,4717.88,好きな奴に悪口言えねえよ
4719.88,4721.88,自分が
4721.88,4723.88,俺も嫌いで向こう向けながら
4723.88,4725.88,相思相愛みたいなやつがいいんだよな
4725.88,4727.88,クルルと絡むんだったら
4727.88,4729.88,俺夜の深夜の3時にギルガメしてないと
4729.88,4731.88,みたいな感じでやりたいんだよ
4731.88,4733.88,あいつをスポンサーじゃなくて
4733.88,4735.88,隣に置いてさ
4735.88,4737.88,メグミルクは
4737.88,4739.88,コミツ用されたから潰してくれ
4739.88,4741.88,何をしたんだよ
4741.88,4743.88,ハンサムとアダコーダみたいなこと書きまくったんだろ
4743.88,4745.88,正解だろむしろ
4745.88,4747.88,こういうゴミの中で
4747.88,4749.88,流星街にしか住めない人間なんだ
4749.88,4751.88,お前みたいなクズが他のコミで
4751.88,4753.88,生き延びれると思うな
4755.88,4757.88,あれだね
4757.88,4759.88,正しい選択だね
4759.88,4761.88,ウェルカムだよ拾う
4763.88,4765.88,ちげえよ
4765.88,4767.88,コメツ掲示板でうんこの名前出したら
4767.88,4769.88,通報されたんだよ
4769.88,4771.88,お前それ俺が悲しいじゃねえかよそれ
4771.88,4773.88,言うんじゃねえよそれ俺に
4773.88,4775.88,そういうのは俺の気持ちを考えて
4775.88,4777.88,言われるのがベストなんだよ
4777.88,4779.88,俺でもお前通報するわじゃあ
4779.88,4781.88,久々に心が今傷ついたわ
4781.88,4783.88,俺の
4783.88,4785.88,俺のせいでそんな
4785.88,4787.88,死人が出てたぞ
4787.88,4789.88,ひどすぎる
4789.88,4791.88,それほどの巨悪だな俺も
4791.88,4793.88,悪を倒せるのは
4793.88,4795.88,巨悪のみだよ
4795.88,4797.88,名前NG
4797.88,4799.88,ひどいなちょっと
4799.88,4801.88,お前が出さなければ俺たちも有効環境さ
4801.88,4803.88,日米和親条約
4803.88,4805.88,結べていたのに
4805.88,4807.88,うーん
4809.88,4811.88,何であんなに
4811.88,4813.88,コメツ掲示板
4823.88,4827.88,戦争だろうがいや俺我が我が我が我が我が我が我が我が我が我が我が我が我が我が我が
4827.88,4831.88,我が
4831.88,4835.08,武器を収めることにより一つの戦争が終わるんだったらもうそれでいいよ
4836.26,4837.26,やめた
4840.4400000000005,4841.92,ちょっとそれはもう飲み込んだ
4841.92,4843.62,自分の吐いた唾は自分で飲み込んだ
4845.04,4846.96,陣内も管理を怠ってるわけねえや
4846.96,4848.3,もう管理なんてする人ないだろ
4848.3,4849.68,なんかそれ各々のさ
4849.68,4851.9400000000005,好き勝手やるのがもうあれだよ
4851.9400000000005,4854.38,自由という名の不自由を強いてるんだろうな
4855.08,4856.0,自主性
4856.0,4856.88,だからこれで俺がね
4856.88,4858.4400000000005,これやっちゃダメこれやっちゃダメって言い始めたら
4858.4400000000005,4860.0,もうとんでもないことになるぞ
4860.0,4861.56,ニコ生がほんとにやばい
4861.64,4863.64,ニコ生がちょっと
4864.240000000001,4865.4400000000005,傾くぞ多分
4865.4400000000005,4866.96,俺がちょっとやめようみんなマジで
4866.96,4868.96,こういうコメントすんのやめようみたいな
4868.96,4871.8,ポコさんの動画荒らさないでとか言ったらもう傾くぞ半分
4874.240000000001,4876.54,あえてこの自由にして
4876.54,4877.92,藤井良いって言うんだよ
4883.120000000001,4884.120000000001,だからあえて
4884.8,4886.8,これが一番のバランスを保ってるな
4887.96,4888.96,バランスを
4888.96,4889.46,もう
4890.64,4892.64,保ってるんだギリギリ天秤にかけて
4898.0,4899.6,俺らって最強だよな
4899.6,4901.6,弱いやつが優勢だなそれ
4901.6,4902.72,見事に
4902.72,4904.08,見事なまでに弱者の
4904.08,4906.08,あの白セリフだな
4911.4800000000005,4913.32,暗黒コートでうんこの名前出しまくってるけど
4913.32,4914.96,一回しか呼ばれなかった
4914.96,4916.6,ほんとお前お前みたいなやつがいるおかげで
4916.6,4917.6,俺の巣はなんていうのかな
4918.6,4919.6,道が
4919.6,4921.6,獣道になるありがたいわ
4921.6,4923.6,そういう
4923.6,4927.6,50メートル走を走ろうとして障害物レースに出てるみたいな
4932.6,4935.6,今のうんこちゃんも面白いけど昔のうんこちゃんの方が面白いななんて
4935.6,4937.6,それに対して答えは出てるぞやっぱりね
4938.6,4940.6,フレッシュっていうのはすごいさ
4940.6,4942.6,大事なことなんだよ
4942.6,4944.6,恋人とかでもそうだろ
4944.6,4946.6,付き合い立ての1ヶ月2ヶ月の方が
4946.6,4947.6,なんていうの
4947.6,4948.6,それはさいろんなことにさ
4948.6,4949.6,感情が揺るが
4949.6,4950.6,あのーね
4950.6,4952.6,揺らされるんだよ
4952.6,4953.6,マジで
4953.6,4954.6,どうしてもね
4954.6,4956.6,同じことずーっとやっていると
4956.6,4957.6,飽きてくるんだよ
4957.6,4958.6,そうそうマンネリか
4958.6,4959.6,いいこと言った
4959.6,4960.6,それはもうしょうがないことなんだよな
4960.6,4962.6,どこで折り合いをつけていくかなんだよな
4962.6,4963.6,もう自分自身もそう
4963.6,4964.6,配信に対するさ
4964.6,4965.6,そのなんていうの
4965.6,4966.6,フレッシュさみたいなのはもうないだろ
4966.6,4967.6,だってこんなムケしてたら
