start,end,text
2474.6,2479.6,っていう風なドラマがあるわけよ
2479.6,2480.6,いいあれだろ?
2480.6,2481.6,いい歌だったぞ
2481.6,2482.6,Go to the way
2483.6,2484.6,こういうなんか
2484.6,2487.6,心に残る思い出の一曲みたいな
2487.6,2490.6,そういうのがあるアニメって強ぇよなやっぱな
2492.6,2493.6,Go to the way
2494.6,2495.6,かなりね
2495.6,2496.6,おすすめだから
2497.6,2499.6,で、本当にね物語、ストーリーもいいんだよめちゃくちゃ
2500.6,2501.6,パラレル最悠季
2501.6,2502.6,是非見て
2504.6,2505.6,是非見てくれ
2505.6,2506.6,パラレル最悠季
2507.6,2508.6,マジで
2509.6,2511.6,明日見てくれ
2511.6,2514.6,ちょっとドラえもんのステルスマーケットみたいなのしちゃって申し訳ないけど
2515.6,2516.6,明日見てくれ
2516.6,2517.6,是非
2517.6,2519.6,いい歌流れるんだよな
2519.6,2520.6,ネタバレになっちゃうから言わないけどさ
2520.6,2521.6,のび太がなんつーの
2522.6,2523.6,うるせぇ行こうみたいなときに
2523.6,2525.6,チュルルルルルルみたいな
2525.6,2527.6,ベストマッチングなんだよね
2529.6,2530.6,頼むわ
2531.6,2533.6,あのAメロ聞いて欲しいなおめえらに
2536.6,2537.6,Aメロ聞いて欲しいな
2537.6,2538.6,違法はちょっとやめて
2538.6,2540.6,ドラえもんだけは
2541.52,2543.96,ドラえもんちょっとやめてやめて違法ウップサイトは
2547.2,2549.2,ワンピースパクったかな
2549.2,2551.2,あれ結構昔の時なんじゃないのか
2551.64,2554.72,15、6年前じゃない?ドラえもん
2556.0,2558.7599999999998,ああいうなんかね最近なんかそういうアニメねーよな
2559.44,2561.44,多分数が多すぎてなんか埋もれてんだろうね
2561.68,2566.44,だから数が多すぎてハードルが上がってんじゃない?みんなの目、見る目が超えてんだろうね
2567.44,2569.92,ドラえもんとかさ、ゆうゆう白書とかスラムダンクとかさ
2570.28,2572.4,ドラゴンボールとかもうその世代はもうそれしかなかったからね
2572.76,2574.0,与えられているものが
2574.0,2576.56,今はさ、百眼のシャナやらさ
2577.08,2579.08,ねえ、マドカマギカやらさ、いろいろあるだろ
2582.2000000000003,2584.2000000000003,選べねーよな、見る目が超えちゃってるよな
2584.64,2586.64,もったいない
2587.2400000000002,2589.2400000000002,もったいねーよな
2590.52,2592.52,トラドラとかさ
2593.32,2595.32,トラドラとかさ
2595.56,2597.32,クラウナーとかあんだろ
2597.32,2600.28,最近オタク向けのアニメばっかり詰まるな、いやブリーチ見ろよお前ブリーチ
2602.04,2604.04,ブリーチいいぞあれ
2605.04,2606.56,ブリーチいいぞ
2606.56,2609.7200000000003,ぜひちょっと、あとヨシオとトラいいな、ブリーチマジで見ろ
2610.36,2613.36,俺の話題についてきたくば、これからしばらくブリーチネタが増えるぞ
2614.04,2618.76,早くイチマルギンに心揺らされるところ見てんだよ、そこが見てんだよむしろ
2619.6000000000004,2623.0,イチマルギンがさ口切る気やのさ心を揺さぶるところ
2623.64,2628.28,あの時のね配信の糧になるよな、チャドの霊圧が消えるところとか
2629.32,2631.32,ドラマがあるよね
2632.6,2634.6,イチマルギン
2635.24,2637.24,ぜひ見たい
2637.96,2640.68,テニプリ見ようようんこちゃん、なんかさ渋谷でこの前さ
2641.08,2644.6,私の人生でテニプリ以上に大切なものないからっていうさデブがいたんだけどさ
2644.76,2646.76,それお前たちの仲間か
2647.48,2649.48,思わず声かけかけたわ本当に
2650.28,2652.92,俺テニプリよりニコ生じゃ俺の方が人気だぞみたいな感じで
2653.8,2656.44,ガチでそういうなんていうの本当にいるんだなみたいな
2659.08,2664.44,あれだな多分斧とかがあったら裂いてただろうな良かった武器が落ちてなくて日常生活に
2665.32,2667.32,俺が人を謝れるところだった
2668.92,2670.92,マジで
2671.2400000000002,2673.2400000000002,悲しくなったね
2674.1200000000003,2676.1200000000003,そういう
2676.1200000000003,2679.4,そういうだから冷静になったねやっぱり日常生活頑張ろうみたいな
2681.8,2686.36,俺でもテニスの王子さんをちょっと昔よっちゃん氏で見たことあるんだよな20、20巻ぐらいまで
2690.2000000000003,2692.76,別にそんななんていうのキモいアニメじゃなかった気がするんだけど
2693.5600000000004,2696.28,なんかその現実的じゃないなと思ったけど
2697.96,2700.36,現実的じゃないじゃないじゃん多分テニスの
2700.36,2702.92,ドライブBみたいなのあるだろうドライブD
2704.6800000000003,2707.1600000000003,普通に面白い面白いんだまあ見ねえけどな俺
2709.1600000000003,2711.1600000000003,最近ちょっとアニメ見てえなそういう
2712.2000000000003,2716.36,最近ちょっとアニメ見てねえな俺C出てねえな一番最近直近で見たのがなんだ俺
2717.1600000000003,2719.1600000000003,何見たって言ったっけ俺
2719.1600000000003,2721.8,ちょっとこの3日間ちょっと時間あるからちょっと見るか
2722.44,2726.6,クラナードもちょっと見ようと思ってるんだけどちょっと絵がキモすぎたわあれ
2726.8399999999997,2728.8399999999997,なんだっけ俺何見たっけアクエリオン見てねえな
2730.12,2734.92,あ、ちょっと偽物語見たわ俺途中まで7話ぐらいまで見た今溜めてる
2738.92,2741.96,7話ぐらいまで見たわ途中で何かいつの間にか見たくなってた
2742.68,2744.68,偽物語面白いよって言われたから見たけど
2747.16,2750.7599999999998,なんか続編ってさ飽きちゃうんだよな見れないんだよね
2751.88,2753.88,ちょっとなんか
2753.88,2755.88,スペースコブラかっこいいな
2755.88,2757.88,なんかありすぎて選べねえんだよな
2757.88,2759.88,ありすぎて
2759.88,2761.88,選べねえんだよなホントに
2761.88,2763.88,選択肢が広すぎて
2763.88,2765.88,何を見ていいか分かんないって言ってたからさ
2769.88,2771.88,まだアニメの良さがちょっと理解できてねえな
2771.88,2773.88,暇な時に彼女と見るみたいな
2773.88,2775.88,なんか
2775.88,2777.88,なんか
2777.88,2779.88,なんか
2779.88,2781.88,なんか
2781.88,2783.88,暇な時に彼女と見るみたいな
2783.88,2785.88,そういうなんかスタンスで
2785.88,2787.88,今見てるわ
2791.88,2793.88,ドラクエどこまでやったのドラクエやったんだよ
2793.88,2795.88,今参加したやつらが
2795.88,2797.88,ドラクエ終わっちゃったんだよな今日
2797.88,2799.88,4時間ぐらいやってたぜ結構済んだよ
2799.88,2801.88,ドラクエ
2805.88,2807.88,NEAはクラナドとコードギラスの日記を出てる
2807.88,2809.88,あそうなんだちょっと見るか
2811.88,2813.88,ちょっと見るかじゃその2つは
2813.88,2815.88,コードギラスなんだっけ
2815.88,2817.88,なんかあれ
2817.88,2819.88,あでもホモが
2819.88,2821.88,違うコードギラス見るやつホモだよ
2821.88,2823.88,顔がかっこいいやつだろ
2823.88,2825.88,ガンダムみたいなやつだろ俺だめだ
2825.88,2827.88,ああいうかっこいい系好きじゃねえ俺バキみたいにさ
2827.88,2829.88,血管が浮き出てないようなアニメ
2829.88,2831.88,見たくない
2831.88,2833.88,ホモだよたぶん
2833.88,2835.88,ホモじゃないホモが好きな女が
2835.88,2837.88,見るやつだろたぶん
2837.88,2839.88,コードギラス違うの
2841.88,2843.88,こういう俺の
2843.88,2845.88,この重しさを全面に出して
2845.88,2847.88,いけるようなアニメねえの
2847.88,2849.88,なんか兵士たら身が出るようなアニメ
2849.88,2851.88,お前ら表面上だけなんだよ
2851.88,2853.88,おならをしたいつっておならが出てる
2853.88,2855.88,ようなアニメを俺に紹介するんじゃねえ
2855.88,2857.88,おならがしたいつってうんこが飛び出るような
2857.88,2859.88,それぐらいの衝撃を受けるようなアニメを紹介してくれよ
2859.88,2861.88,思いっきり兵士言おうとして水みてえな
2861.88,2863.88,うんこビューって出るような
2863.88,2865.88,甘いんだよ全部
2865.88,2867.88,ソシナ全部そんなの
2867.88,2869.88,口に合わない
2869.88,2871.88,何スクライドって
2871.88,2873.88,ジャングルの王者ターチャンとか見るぞ俺は
2873.88,2875.88,こうなったらイオンオップサイトで
2875.88,2877.88,いいのか
2877.88,2879.88,いいな
2879.88,2881.88,今から俺満喫行くべかな
2881.88,2883.88,6時間ぐらい
2883.88,2885.88,超幸せまじで
2885.88,2887.88,ニートに憧れちゃうこんな生活
2887.88,2889.88,ニートに憧れちゃうよ
2889.88,2891.88,こんなね夜の2時ぐらいからさ
2891.88,2893.88,ちょっとなんか
2893.88,2895.88,ハンターハンター読みに行くべみたいなさ
2895.88,2897.88,最高だぜ
2897.88,2899.88,久々だな
2899.88,2901.88,ニコニコじゃない
2901.88,2903.88,昔イボーンの動画を見にさ
2903.88,2905.88,パソコンがなかった時代イボーンの動画を見に
2905.88,2907.88,最寄りの駅の満喫前で
2907.88,2909.88,言ってたこと思い出すわ
2911.88,2913.88,スクライドうんこ好きだぞ絶対
2913.88,2915.88,ちょっと見てみようかなスクライド
2915.88,2917.88,スクライドちょっと
2917.88,2919.88,見てみるわ
2919.88,2921.88,何気に
2921.88,2923.88,貴様らから紹介されたアニメ
2923.88,2925.88,アノバナとか俺おめえら
2925.88,2927.88,ピーシーズオブアクズのさ
2927.88,2929.88,ピーシーズオブアクズのさ
2929.88,2931.88,一つからさ発掘したアニメだからな
2931.88,2933.88,最終回見てねえけど
2933.88,2935.88,アノバナいいよなアノバナ
2935.88,2937.88,君と夏の終わりのやつ
2937.88,2939.88,あれいいよな
2939.88,2941.88,あの泣かせよ泣かせよってしてるところがいいよね
2945.88,2947.88,最近俺も何気に見て
2947.88,2949.88,最近ちょっとあれだな見てるよな
2949.88,2951.88,俺が今までさネルさんのさ
2951.88,2953.88,あのホームページみたいなさ
2953.88,2955.88,俺が今まで見てきたアニメをちょっとみんなで覚えておいて
2955.88,2957.88,えっと最近のあれだ
2957.88,2959.88,萌えアニメみたいなやつだ
2959.88,2961.88,アノバナ
2961.88,2963.88,トラドラ
2963.88,2965.88,全部4本じゃねえかよ今思えば
2965.88,2967.88,俺そういう
2967.88,2969.88,全部そういうのに惹かれてんのかもしんない
2969.88,2971.88,アノバナトラドラあと何
2971.88,2973.88,おれいも
2973.88,2975.88,あと何
2975.88,2977.88,あと何まどかまぎか
2977.88,2979.88,あと化物語
2979.88,2981.88,刀語結構見てんじゃねえかよ
2981.88,2983.88,竹田翔平だぞあと4つ
2983.88,2985.88,おれいも見た
2985.88,2987.88,それぐらいかまだ
2987.88,2989.88,あと釘宮春美だろ
2989.88,2991.88,7個かアクエリオン見たな
2991.88,2993.88,アクエリオンも萌えアニメとしてカウントしてくれるのか
2993.88,2995.88,ありがたい
2995.88,2997.88,あと2つシュタインズゲート見てねえんだよなぶっちゃけ
2997.88,2999.88,最後までは
2999.88,3001.88,途中でみんな諦めた
3001.88,3003.88,あと何
3003.88,3005.88,俺なんか見てなかったっけ
3005.88,3007.88,ちゃんと最後まで見たやつラキスタとか見てない全然
3007.88,3009.88,よっちゃんに悪いけど俺
3009.88,3011.88,ドラマ見る気しねえアニメ見る気しねえわ
3011.88,3013.88,ラキスタ
3013.88,3015.88,10万字違う
3015.88,3017.88,そんぐらいか
3017.88,3019.88,8個か
3019.88,3021.88,8個か
3021.88,3023.88,じゃあちょっと
3023.88,3025.88,残り10個目はなんかあれだな
3025.88,3027.88,思い出に残るようなあれにしたいね
3027.88,3029.88,それぐらいだな
3029.88,3031.88,ちゃんと全部見たっていうのはそれぐらいだな
3035.88,3037.88,おすすめのやつだと教えて
3037.88,3039.88,おすすめのやつだ
3039.88,3041.88,ものすごいベタな恋愛ものか
3041.88,3043.88,何ていうの
3043.88,3045.88,ものすごいベタな恋愛ものか
3045.88,3047.88,戦闘もの
3047.88,3049.88,真逆だけど
3049.88,3051.88,南極と北極みたいな違いがあるけどさ
3051.88,3053.88,攻殻機動隊はね
3053.88,3055.88,わっちゃんがめちゃくちゃオススメしてくるんだよ
3055.88,3057.88,攻殻機動隊見なきゃ損だよ
3057.88,3059.88,って言ってくるんだけど
3059.88,3061.88,まだちょっと見れないんだよね
3063.88,3065.88,ストライクウィッチーズあれだろ
3065.88,3067.88,対応してるやつは見たくないわ
3067.88,3069.88,関わりたくない
3069.88,3071.88,日常生活でタグチには
3071.88,3073.88,同じ目線で
3073.88,3075.88,いろんなもの見たくないわ
3075.88,3077.88,みんなもそうだろ
3079.88,3081.88,だからちょっとやめとく
3081.88,3083.88,なんかあいつも一時期
3083.88,3085.88,オタク歌ってたよな
3085.88,3087.88,最近オタクじゃなくなっちゃったのタグチ
3087.88,3089.88,オタクの話
3089.88,3091.88,昔はさミカリンとかに
3091.88,3093.88,粘着したとき一番面白かったんだけど
3093.88,3095.88,ユズカ姫にさ
3095.88,3097.88,ちょっとごめんね
3097.88,3099.88,すごい極小的な話になっちゃって申し訳ないけどさ
3099.88,3101.88,みんなも動画で見てみて
3101.88,3103.88,ユズカ姫に文句言ってるときのタグチ
3103.88,3105.88,あれ噛み替えるぞ
3105.88,3107.88,昨年度のニコ生オブザイヤに考えてもおかしくない
3107.88,3109.88,泣いちゃったときの
3109.88,3111.88,ミカリンがユズカ姫にいじめられて
3111.88,3113.88,俺は許せねえっていうくだり
3113.88,3115.88,あれぜひ見てくれ
3115.88,3117.88,あれはぜひ見てくれ
3117.88,3119.88,お前人のオススメ聞かないで
3119.88,3121.88,いやそんなことないよ
3121.88,3123.88,ドラクエ3まだクリアしてない
3127.88,3129.88,空の乙女
3129.88,3131.88,そういうなんかさ
3131.88,3133.88,あからさまに狙ってるの好きじゃねえんだよな
3133.88,3135.88,アニメもなんか
3135.88,3137.88,オススメがあったら
3137.88,3139.88,ちくいち俺に報告するような感じで
3139.88,3141.88,配信する
3141.88,3143.88,力はねえけど
3143.88,3145.88,1時間ぐらい寝る前までに
3145.88,3147.88,時間潰したいときってあんだろ
3147.88,3149.88,逆に俺らに
3149.88,3151.88,逆に俺らにオススメしてくれ
3151.88,3153.88,俺がオススメの悠々白書しかない
3153.88,3155.88,悠々白書すり切れる
3155.88,3157.88,テープがすり切れるまで見ろ悠々白書は
3157.88,3159.88,灯台に来たかったら見ろ
3159.88,3161.88,人生に成功したかったら悠々白書を見ろ
3161.88,3163.88,すり切れるまで
3163.88,3165.88,VHSで
3167.88,3169.88,てかさ
3169.88,3171.88,シティハンターのあれが超いいんだけど
3171.88,3173.88,ブックマークしてるかなしてねえか
3173.88,3175.88,おめえらに怪我
3175.88,3177.88,アバターの聖地みたいな感じで
3177.88,3179.88,おめえらに絶対怪我されたくない場所
3179.88,3181.88,ブックマークしてるんだよ
3181.88,3183.88,シティハンターの最終回のあれやばいな
3183.88,3185.88,マジで
3185.88,3187.88,あのー
3187.88,3189.88,サイバリオンが撃つところ
3189.88,3191.88,ゲットワイルドが流れるところ
3191.88,3193.88,あれやばいよな
3193.88,3195.88,ぜひ見てくれシティハンター
3197.88,3199.88,それで気分よくなってさ
3199.88,3201.88,一人でカラオケ
3201.88,3203.88,友達とカラオケ行ってシティハンター歌ったときの
3203.88,3205.88,小室哲也との
3205.88,3207.88,なんだっけ
3207.88,3209.88,TMネットワークのボーカルとの
3209.88,3211.88,俺の
3211.88,3213.88,歌に対する
3213.88,3215.88,姿勢の違いが
3215.88,3217.88,大きすぎてびっくりした
3217.88,3219.88,俺こんな下手くそだったっけみたいな
3219.88,3221.88,シティハンター
3221.88,3223.88,小室哲也か
3223.88,3225.88,あれいい歌だよな
3225.88,3227.88,ぜひみんな聴いてくれゲットワイルド
3229.88,3231.88,シティハンターって恋愛もの
3231.88,3233.88,いろんな要素があるよね
3233.88,3235.88,探偵なのか
3235.88,3237.88,シティハンターの職業は
3237.88,3239.88,シティハンターだな
3241.88,3243.88,あれはいいよな
3243.88,3245.88,そういう
3245.88,3247.88,紙作ないよな
3247.88,3249.88,紙作
3251.88,3253.88,ルパンとか
3253.88,3255.88,ルパン三世みたいな
3255.88,3257.88,鉄板さを覚えるよね
3257.88,3259.88,昨日とか
3259.88,3261.88,おとといとか
3261.88,3263.88,俺ジムで見てたんだけどさ
3263.88,3265.88,周りの目が痛すぎてさ
3265.88,3267.88,みんなニュースとか見てんのにさ
3267.88,3269.88,俺だけさコナン見てて
3269.88,3271.88,一番いちびってるのに
3271.88,3273.88,ちょっと恥ずかしくて途中でみんなやめちゃったんだよな
3273.88,3275.88,ランニングしながら見てたんだよ
3275.88,3277.88,ジムのテレビで
3277.88,3279.88,俺おしっこしてくるわ
3291.88,3293.88,おしっこしてくれる
3293.88,3295.88,おしっこしてくれる
3295.88,3297.88,おしっこしてくれる
3297.88,3299.88,おしっこしてくれる
3299.88,3301.88,おしっこしてくれる
3301.88,3303.88,おしっこしてくれる
3303.88,3305.88,おしっこしてくれる
3305.88,3307.88,おしっこしてくれる
3307.88,3309.88,おしっこしてくれる
3309.88,3311.88,おしっこしてくれる
3311.88,3313.88,おしっこしてくれる
3313.88,3315.88,おしっこしてくれる
3315.88,3317.88,おしっこしてくれる
3317.88,3319.88,おしっこしてくれる
3319.88,3323.88,お天気悪い
3323.88,3327.88,お天気悪い
3333.88,3335.88,スマン
3335.88,3337.88,何時間ぐらいやってる
3337.88,3339.88,わりぃ
3339.88,3341.88,わざとじゃないんだ
3343.88,3345.88,わざとじゃないんだ
3345.88,3347.88,許せ
3347.88,3351.88,許せ、許せる人間になれ、お前らが
3351.88,3355.88,そうだな、4時間超えたら1回ぐらい減ってるよな
3355.88,3359.88,許せ
3359.88,3362.88,ほんとだな、ちょっと男らしさが足りなかったな
3362.88,3365.88,今のところ、今の下りでうんこ漏らすぐらいの覚悟が必要だな
3365.88,3369.88,ちょっとあれだな、あのご飯がさ、地球へのダメージを抑えてしまったようにさ
3369.88,3373.88,俺もなんか自分への自尊心をさ、あれ、返り見てしまった
3373.88,3376.88,全開だったら出てただろ、うんこが、出せたはず
3376.88,3379.88,全盛期の俺だったら、6ポケ上げてる時の俺だったらうんこ出せたな、今
3379.88,3382.88,老いを感じるな、ちくしょう
3382.88,3385.88,自分のなんかその力不足を感じた、廃死に対する
3385.88,3388.88,甘いな、まだまだ
3388.88,3391.88,そこでうんこを出せないのが俺の弱さだな
3391.88,3395.88,でもその弱さを自分で把握してるってことが俺の武器だね
3398.88,3402.88,それが俺の武器、そうだな、今老いを感じたね、今
3402.88,3405.88,あるだろ、そういう瞬間
3405.88,3408.88,漫画欄は配信で使えるネタがいっぱいあるから見て
3408.88,3411.88,そういう目的で見たくないよ
3411.88,3414.88,自然と出ちゃうみたいなさ
3417.88,3420.88,そういうんじゃなくてさ、違うな
3420.88,3423.88,グレン、グレン、グレンラガン、なにそれ
3423.88,3426.88,カッコつけてんな、ちょっと
3426.88,3429.88,グレンラガン、ちょっと名前が言いづらいね
3430.88,3433.88,キセイ、キセイジュウも漫画は全部見たな
3433.88,3436.88,あれ面白いよな、キセイジュウ
3436.88,3439.88,ガンツはなんか、だめだ、俺あんな簡単に女がおっぱい出すような
3439.88,3442.88,あれ好きじゃねえわ、体操が低い、マジで
3442.88,3445.88,なんかさ、男を舐めてるっていうかさ
3445.88,3448.88,あれ女が作ってんだろ、ガンツって、たぶん
3448.88,3451.88,作者女じゃね?違うか、俺のそれアンニューな考えか
3451.88,3454.88,あれ作者女じゃない?女にありがちな
3454.88,3457.88,感じじゃない?男か
3457.88,3460.88,なんかその、おっぱい出してるけどちょっと食いつくんじゃねえかみたいなさ
3460.88,3463.88,ちょっとあれのがあんま好きじゃないね
3463.88,3466.88,でもなんかすごい面白いんでしょ?めちゃくちゃ面白いって言うよね、みんな
3466.88,3469.88,ガンツ
3471.88,3474.88,ガンツ、面白いって言うよね
3474.88,3477.88,大した面白くない?マジか
3477.88,3480.88,ちょっと、待て
3480.88,3483.88,わかった、なんか今日の俺配信雑な
3483.88,3486.88,げえ
3489.88,3492.88,青くなっちったよ、さっきまでできてたのに
3494.88,3497.88,なぜ?
3497.88,3500.88,ブースト切りたいな
3514.88,3517.88,まだこっちのほうがいいな、ちょっと
3520.88,3523.88,画質最低にしてちょっと音質上げるか
3523.88,3526.88,俺の良さ
3526.88,3529.88,俺の良さをちょっと生かしていくわ
3529.88,3532.88,このコア色で勝負
3532.88,3535.88,音質めっちゃいいだろ
3536.88,3539.88,ちょっとイケボで
3544.88,3547.88,ちょっともうこの
3547.88,3550.88,画像はちょっと勘弁してくれよ、もうこれで
3553.88,3556.88,俺ちょっと
3556.88,3559.88,雑誌でやっていきます
3559.88,3562.88,雑誌でやらせていただきます
3562.88,3565.88,よろしくお願いします
3565.88,3568.88,グリーンボックスしてんだけどさ
3568.88,3571.88,グリーンボックスしてんだけど無理だわ、ちょっと今
3571.88,3574.88,SGFHが言うこと聞かねえ
3576.88,3579.88,最近感動らないな
3579.88,3582.88,生態も鍛えられてるね、相当
3582.88,3585.88,シティハンターって1話からこんなかっけえんだけど
3585.88,3588.88,だろ、見ろって、最近のアニメも確かに面白いかもしんないけど
3588.88,3591.88,本当にやっぱ面白いから
3591.88,3594.88,そういうね、昔の作品、お前ユーハクションとか見てみろ
3594.88,3597.88,絵がゴミだぞ、本当に
3597.88,3600.88,作家が崩壊してる、本当にゴミ
3600.88,3603.88,昔の俺は許してたな、みたいな
3603.88,3606.88,ドラゴンボールとか下書きだぞ、本当に
3606.88,3609.88,ドラゴンボール
3609.88,3612.88,2回に1回下書きがあるぞ
3612.88,3615.88,俺とばっちゃんはそれをハズレ枠って呼んでる
3615.88,3618.88,いいんだよな
3618.88,3621.88,2人でさ、モンスターハンターをやりながら
3621.88,3624.88,明日モンハンやりたいな、モンスターハンターやりながらさ
3624.88,3627.88,ねえ、なんつーの?
3627.88,3630.88,バックにドラゴンボールをかけて
3630.88,3633.88,ポコダのダンシングサムライをかける、最高の婦人だね
3633.88,3636.88,やりたいな、明日
3636.88,3639.88,3DSのやつしか持ってないから
3639.88,3642.88,何持ってる?
3642.88,3645.88,3DSのトライGだっけ
3645.88,3648.88,それやってんだけどさ、最近またちょっとやり始めてる
3648.88,3651.88,でもさ、充電器なくしってさ、俺
3651.88,3654.88,どっかに捨てちまったよ、充電器
3654.88,3657.88,3DSの、充電できないんだよな
3657.88,3660.88,友達に会った時しかできないんだよ
3660.88,3663.88,布団ちゃん家あったから盗んでいくわ
3663.88,3666.88,明日朝一で布団ちゃん家行こうかな、俺
3666.88,3669.88,機嫌が良くなってきたから
3669.88,3672.88,あいつ今配信してるでしょ
3672.88,3675.88,このまま寝ないで
3675.88,3678.88,もうやめたの、あいつ
3678.88,3681.88,行くわ、このまま、寝ずに
3681.88,3684.88,今無理だ、俺がない
3684.88,3687.88,電車がない
3687.88,3690.88,電車がないよ
3690.88,3693.88,スカイプとかもできない、今動けない
3693.88,3696.88,動けません
3696.88,3699.88,3DSのモンハンGって売れたの?
3699.88,3702.88,あれ3Gだっけ
3702.88,3705.88,売れた?あれ正直、あんま売れてなくない?
3705.88,3708.88,売れたんだ、よかったよかった
3708.88,3711.88,それなりに面白かったよな
3711.88,3714.88,なんか俺、海のステージでもっとストレス溜まるかと思ったら
3714.88,3717.88,意外に対応できたわ
3717.88,3720.88,3DSで
3720.88,3723.88,ぜひ
3723.88,3726.88,なかなかボリュームもあって長いしさ
