start,end,text
4967.6,4969.6,寝っ転がってさ1000人の前で配信なんか
4969.6,4971.6,あのね雑ななんかできなかったんだから
4971.6,4972.6,その辺はもううまく折り合いをつけて
4972.6,4974.6,諦めていくしかないんだよな
4976.6,4977.6,仕方ない
4979.6,4980.6,うんこの前世記
4980.6,4981.6,今だよ
4981.6,4982.6,お前が大化したらいいね
4985.6,4986.6,仕方ないね
4987.6,4988.6,これは仕方ない
4992.6,4993.6,お願いだからうんこちゃんだけ
4993.6,4994.6,もっこらないで欲しい
4994.6,4995.6,これマジで
4995.6,4996.6,うーん
4996.6,4997.6,でもやめるんじゃないかな
4997.6,4998.6,多分
4998.6,4999.6,なんかその辺はさ
4999.6,5000.6,もうずーっとさ
5000.6,5001.6,Ustreamとかでも
5001.6,5002.6,やってた自分のさ
5002.6,5003.6,今抱えてる視聴者の人数ってね
5003.6,5004.6,大体同じくらいじゃん
5005.6,5006.6,それがもうやっぱね
5006.6,5007.6,明らかに減ってきたら安心してくれ
5007.6,5009.6,そこはでもやる気が削がれると思う
5009.6,5010.6,マジで
5010.6,5012.6,そういう美学は持ってないと思う
5012.6,5013.6,これはもう前から言ってるじゃん
5013.6,5014.6,ここだけは譲れない
5014.6,5015.6,なんていうのかな
5015.6,5017.6,変なプライドみたいなのがあるわけよ
5019.6,5020.6,変なプライドがあるわけよ
5023.6,5024.6,多重するわ
5024.6,5025.6,ほらそうなってくるだろ
5025.6,5026.6,そこはうまく俺が
5026.6,5027.6,弾いていく
5028.6,5029.6,人がいる限りやると思う
5029.6,5031.6,人が来るってことはやっぱ面白い
5031.6,5033.6,面白い放送ができているっていう風にさ
5033.6,5035.6,そういう風に痴漢してやっぱやるんじゃない
5035.6,5036.6,下が来ない
5036.6,5037.6,人が来ないってことはもうさ
5037.6,5038.6,放送する意味がないんだよ
5038.6,5039.6,そんなの
5039.6,5040.6,もうダセーほんとに
5042.6,5043.6,緑は視聴者が一人になっても
5043.6,5044.6,放送続けてて
5044.6,5045.6,いやそれ絶対ないな
5045.6,5046.6,100%ない
5046.6,5047.6,ミラーが出なくなったら絶対やめると思う
5047.6,5049.6,治療されなくなったら
5049.6,5050.6,どんな人間もやめると思うな俺
5054.6,5055.6,絶対ないと思う
5055.6,5056.6,そんな
5056.6,5057.6,飽きると思う
5057.6,5058.6,普通に
5058.6,5060.6,タチミビーとかまでしか出なくて
5060.6,5061.6,ねえ
5061.6,5063.6,視聴者にそれ超言われて
5063.6,5065.6,面白いって思えてたら
5065.6,5067.6,それはもう本当に心の病気だと思う
5067.6,5069.6,今あんだけやっぱ人が来てるから
5069.6,5070.6,面白いんだよ
5070.6,5071.6,それは面白いよ
5071.6,5072.6,あんだけ人来てさ
5072.6,5073.6,キャーキャー言われたらさ
5073.6,5075.6,誰でもそうやって言うって
5075.6,5076.6,悪鬼は頑張ってる
5076.6,5077.6,だからあれ病気だって
5077.6,5078.6,うん
5078.6,5079.6,あそこまで行くと
5079.6,5080.6,ほんとにテクノでどうしよう
5080.6,5081.6,やって
5081.6,5082.6,なんかやらないと
5082.6,5083.6,なんていうの
5083.6,5084.6,その
5084.6,5085.6,生きていけないみたいな
5086.6,5087.6,うん
5090.6,5091.6,ヤフミはカソって
5091.6,5092.6,もうクリア
5092.6,5093.6,縛りクリア
5093.6,5094.6,あーなんか
5094.6,5095.6,っぽいね
5095.6,5096.6,なんかね
5096.6,5097.6,っぽいな
5097.6,5098.6,でもカソることはないでしょ
5098.6,5099.6,そんなに急激に
5101.6,5102.6,いやモコウだって
5102.6,5103.6,人いんじゃん
5103.6,5104.6,めちゃくちゃいるだろ
5108.6,5110.6,めちゃめちゃいるでしょ
5110.6,5111.6,だって
5111.6,5113.6,ニコ生とか
5113.6,5114.6,人めっちゃ来てるでしょ
5115.6,5116.6,会えんじゃなくてさ
5116.6,5117.6,もっとさ
5117.6,5118.6,本格的なさ
5119.6,5120.6,だから
5120.6,5121.6,例に上がんないな
5123.6,5124.6,うまい
5124.6,5125.6,なんかそういうね
5125.6,5126.6,こういう言葉にも出てこないような人が
5126.6,5127.6,あれなんだろうな
5127.6,5128.6,30分で7000人来てると思う
5128.6,5129.6,それくらい来てれば全然
5129.6,5130.6,もうすげえじゃん
5130.6,5131.6,むしろトップクラスじゃねえかよ
5132.6,5133.6,ジュケさんか
5133.6,5134.6,俺ジュケさんみたいになったら
5134.6,5135.6,やめるな多分
5136.6,5137.6,ジュケさんには申し訳ないけど
5137.6,5138.6,絶対やめてるな
5139.6,5140.6,ジュケさんみたいになってたら
5141.6,5142.6,うん
5143.6,5145.6,脳細胞が溶けてまでやるもんじゃないな
5145.6,5146.6,そこはやっぱり冷静に
5146.6,5147.6,見ていかなきゃいけないな
5151.6,5152.6,ジュケさん面白いんだけど
5152.6,5153.6,そうだよね
5155.6,5156.6,うんこちゃんFacebookで
5156.6,5157.6,うんこちゃんのアカウント作って
5157.6,5158.6,ちょっとそれめんどくさいわ
5158.6,5159.6,ちょっとお前ら勝手に
5159.6,5160.6,自演しといてくれ
5160.6,5161.6,これうんこちゃんだよみたいな
5161.6,5162.6,それ許可する
5162.6,5163.6,それを許可すれば
5163.6,5164.6,俺がやってるのと変わんねえだろ
5164.6,5165.6,インターネットでね
5165.6,5166.6,やってることなんてさ
5166.6,5167.6,誰がやってるのか分かんねえんだから
5167.6,5168.6,全部俺のちょっと
5168.6,5169.6,陰虫者作って
5169.6,5170.6,それでうんこちゃんの
5170.6,5171.6,これうんこちゃんのアカウントだよ
5171.6,5172.6,って広めて
5172.6,5173.6,それをうんこちゃんだと思って
5173.6,5174.6,見ててくれ
5176.6,5177.6,Facebookは実名じゃなきゃ
5177.6,5178.6,バンじゃなかったか
5178.6,5179.6,なんか個人情報を
5179.6,5180.6,つつむけなんだよね
5180.6,5181.6,なんかそういうの絶対やりたくない
5181.6,5182.6,iPhone5出る話した?
5182.6,5183.6,してねえ
5184.6,5185.6,出んのか
5185.6,5186.6,てかお前いいこと思い出してくれたわ
5186.6,5187.6,俺てかあれだわ
5187.6,5188.6,ホワイト
5188.6,5189.6,ダブルホワイト
5189.6,5190.6,ちょっとプラン開発しにいかなきゃ
5190.6,5191.6,あのクズども
5191.6,5192.6,あのクズシステム
5192.6,5193.6,ほんとムカつくよな
5193.6,5194.6,ダブルホワイトにして
5194.6,5195.6,いろんな
5195.6,5196.6,システムつけなきゃ
5196.6,5197.6,iPhone0円になりませんよ
5197.6,5198.6,みたいな
5198.6,5199.6,あれほんとクズだよな
5199.6,5201.6,どうせ3日で解約するんだからさ
5201.6,5202.6,なんなんだろうなあれ
5202.6,5203.6,あのー
5203.6,5205.6,表面上取り繕う感じ
5205.6,5206.6,ほんとそういうの好きじゃないわ
5206.6,5207.6,ソフトバンクのやり方
5208.6,5210.6,携帯売ってるときもそうだったんだよな
5211.6,5212.6,うん
5212.6,5213.6,いやiPhone使うだろ
5213.6,5214.6,iPhoneカバーつけてる
5214.6,5215.6,レザーのやつ
5216.6,5217.6,レザーも
5217.6,5218.6,レザー物
5220.6,5221.6,うん
5221.6,5222.6,いや解約はしない
5222.6,5223.6,なぜならiPhoneが一番最強だから
5223.6,5224.6,たぶん
5225.6,5227.6,おいここうすとやぞ
5227.6,5228.6,すまん
5228.6,5229.6,うすとや
5229.6,5230.6,ここは
5233.6,5234.6,おしゃれアピ
5234.6,5235.6,まあそうだね
5235.6,5236.6,そういうわけじゃねえけどさ
5236.6,5237.6,いろんな
5237.6,5238.6,ソフトバンク以外もiPhone出してる?
5238.6,5239.6,嘘でしょ
5241.6,5242.6,そうなの?
5246.6,5247.6,出してんの?
5248.6,5249.6,あ、そうなの?
5249.6,5251.6,へー知らなかった
5251.6,5252.6,マジかよ
5252.6,5254.6,ユーストリームでなんか申し訳ねえけどさ
5255.6,5256.6,ほんとクズだわ
5256.6,5257.6,ソフトバンク
5258.6,5259.6,ほんとにさ
5259.6,5260.6,何とかしてくれよ
5260.6,5261.6,マジで
5261.6,5262.6,システムが
5262.6,5263.6,効いてんだろ損
5263.6,5264.6,直してくれようまく
5265.6,5266.6,そういう
5266.6,5267.6,汚らしい商売しやがったよ
5269.6,5270.6,このたちのアカウント
5270.6,5271.6,基本的にアカウントないです
5274.6,5275.6,おいマジバンされ
5275.6,5277.6,いやこんなんでバンしねえだろさすがに
5277.6,5278.6,俺キレるぞそしたら
5278.6,5279.6,内緒にしといてくれ
5283.6,5285.6,ソフトバンクの定額制度が終わるらしい件について
5285.6,5286.6,なんだ終わるらしい件って
5290.6,5291.6,厳しいねそれ
5291.6,5293.6,定額プランが終わったらちょっと終わってない?
5293.6,5294.6,明日ニコ生しよう
5294.6,5295.6,あんまやる気しねえんだよ
5295.6,5296.6,なんでだろう
5299.6,5300.6,うーん
5301.6,5302.6,なんでだろうな
5302.6,5303.6,なんでだろうな
5303.6,5304.6,なんでだろうな
5304.6,5305.6,うーん
5306.6,5307.6,なんでだろうな
5309.6,5310.6,なんか損
5310.6,5311.6,俺がツイッターだったら
5311.6,5312.6,損フォローしてくれよ
5313.6,5314.6,なんか金つつむからうまく
5314.6,5316.6,でも金に不自由してねえだろうしな
5316.6,5317.6,あいつ金で動かねえだろうな
5320.6,5321.6,どういうことしたら
5321.6,5322.6,俺は損とのこの
5322.6,5324.6,繋がりが持てるんだろうな
5328.6,5329.6,そうだな
5329.6,5330.6,まあYouStreamやるんだったら
5330.6,5331.6,明日はニコ生するわ
5331.6,5332.6,明日はニコ生の日
5332.6,5333.6,もしやるとしたらね
5335.6,5336.6,うーん
5338.6,5339.6,写真枠か
5339.6,5340.6,なんかさ
5340.6,5341.6,そういうのに縛られてるから
5341.6,5342.6,あんまやる気しねえのかな
5343.6,5344.6,いったん全部
5345.6,5346.6,今までやってきた企画は
5346.6,5348.6,もう二度としない方向にしてみようかな
5349.6,5350.6,そうすればなんか新しい
5350.6,5351.6,ことを生み出す
5352.6,5353.6,っていう風になるかもしれない
5353.6,5354.6,うーん
5356.6,5357.6,そうしよう
5357.6,5358.6,全部や
5358.6,5359.6,今までやったことは
5359.6,5361.6,もう二番煎じとしてやらないみたいな
5362.6,5363.6,うん
5363.6,5364.6,そうすればやりたいことが
5364.6,5365.6,出てくるはずなんだよな
5365.6,5366.6,過去のなんかそういうのに
5366.6,5367.6,縛られてるから
5368.6,5369.6,なんていうのかな
5369.6,5370.6,その
5370.6,5371.6,で新しいことを
5371.6,5372.6,ができないみたいな
5377.6,5378.6,そういう
5380.6,5381.6,ロマンス絵マネーが
5382.6,5383.6,うーん
5384.6,5385.6,なんかそうすればさ
5386.6,5388.6,なんか視野がすごい広がったな今
5389.6,5390.6,なんかさその
5391.6,5392.6,ねえ
5394.6,5396.6,まあ突末にしてもなんか
5396.6,5398.6,不幸なやつを待つみたいなさ
5399.6,5400.6,簡単に言っちゃったけど
5402.6,5403.6,そういう
5403.6,5405.6,何やるか俺が決めればよくない?
5405.6,5406.6,視聴者に委ねて
5406.6,5408.6,決めれるようなことじゃないじゃん多分
5408.6,5410.6,いろんな声が聞かれすぎていて
5414.6,5415.6,ちょっとその辺は考えていくわ
5418.6,5419.6,それで考えていく
5419.6,5420.6,ちょっと
5420.6,5421.6,全部やらない
5421.6,5422.6,方向で
5423.6,5424.6,方向転換も必要だもんな
5424.6,5425.6,早め早めにそういう
5425.6,5427.6,ガン細胞を取り除いていかなきゃいけないもんな
5428.6,5429.6,そうしよう
5429.6,5430.6,今決めたわ
5430.6,5432.6,カップル死んじゃえもん突末
5433.6,5434.6,おー
5434.6,5436.6,なんかでもやらせが発生しそうだよな
5436.6,5437.6,ほんとに
5437.6,5438.6,うん
5439.6,5440.6,なんかそういうんじゃなくて
5440.6,5441.6,なんかちょっとあれだよな
5441.6,5443.6,昔の戦竜みたいなさ
5443.6,5444.6,ああいうぽっと手のことを
5444.6,5446.6,どんどん生み出していかなきゃいけないよな
5446.6,5448.6,一枠でなんか考えて
5448.6,5449.6,次枠やろうぜみたいな
5450.6,5452.6,あの流れ俺好きなんだよな
5452.6,5453.6,あの流れ
5455.6,5456.6,ぽっと手がいいんだよね
5456.6,5458.6,寝れば寝るほどやっぱハードルが上がって
5458.6,5459.6,よくないもん
5459.6,5460.6,戦竜なんてさ
5460.6,5461.6,あんな昔からある
5461.6,5463.6,誰もできそうなことだけど
5463.6,5464.6,あんまやらないようなことじゃん
5465.6,5466.6,そういうなんかさ
5466.6,5467.6,東大元暮らしなんだよね
5469.6,5470.6,ニコ生で決めようそれは
5470.6,5471.6,それはちょっとニコ生で決めよう
5471.6,5472.6,今話すことじゃないね
5472.6,5473.6,やめようこの話は
5473.6,5475.6,ちょっと深みにハマっていくな
5478.6,5480.6,戦竜でうんこちゃんが一番好きだったのどうだよ
5481.6,5482.6,やっぱセピアじゃないか
5483.6,5484.6,開始
5484.6,5485.6,ねえあんな
5485.6,5486.6,ほんと一番最初に送ってきたメールで
5486.6,5488.6,あのクオリティ俺すげえと思ったよ正直
5488.6,5489.6,それかモコウかな
5490.6,5492.6,舌足らず実力足らずクソモコウ
5494.6,5495.6,もうおっさんだからぽっと手ないだろ
5495.6,5496.6,うーん
5496.6,5497.6,まあそれはちょっとね
5497.6,5499.6,選択肢がやっぱ狭くなっていくっていうのはしょうがないだろ
5501.6,5502.6,ポエム
5503.6,5504.6,ポエムじゃ無理だな
5505.6,5506.6,それってもう引きずってるじゃん
5506.6,5507.6,前の企画を
5508.6,5509.6,そういうんじゃないんだよね
5509.6,5512.6,もう新しい完全にもう滑ってもいい覚悟で
5512.6,5513.6,新しいものをさ
5513.6,5515.6,やっていきたいなちょっと
5517.6,5519.6,うんこちゃん桃鉄で雑談対戦するとマジキレしちゃうの
5519.6,5521.6,俺全然しないのそんなの
5521.6,5523.6,全然してない俺桃鉄とか負けたことねえじゃん
5524.6,5525.6,よっちゃんとふとんちゃんはキレるよ
5525.6,5528.6,ほんとよっちゃんなんかじゃないけど桃鉄やるとすげえキレるんだよな
5528.6,5529.6,あれ何なんだろうな
5530.6,5531.6,普段あんなうんこうなのにさ
5531.6,5533.6,桃鉄プライドはめっちゃたけんだよな
5533.6,5534.6,あとふとんちゃんもキレるほんとに
5534.6,5536.6,俺がねむねむ使って殺してた
5539.6,5540.6,うん
5541.6,5542.6,わっちゃんは強いな
5542.6,5543.6,いじめるからだよ
5543.6,5545.6,普通にやってもそんなになんかあんまりさ
5545.6,5546.6,なんつーの
5547.6,5548.6,ねえその
5549.6,5552.6,そんな真剣にやらないくない
5557.6,5558.6,ちょっとやりたいな
5560.6,5561.6,もうわっちゃん
5561.6,5562.6,よっちゃんと配信でゲームしない
5562.6,5564.6,よっちゃんもう配信に俺出す気ないよ多分
5564.6,5566.6,じゃ俺やるっつったら止めるもん全力で
5566.6,5567.6,やめとけよっちゃんつって
5567.6,5569.6,もうそんなもうそういうなんつーの
5569.6,5571.6,リスクをさ追うことないよつって
5571.6,5572.6,止めるぞ俺は
5572.6,5573.6,おめーらには悪いけど
5573.6,5575.6,よっちゃん舞台に気持ちはわからんでもないし
5575.6,5577.6,俺もよっちゃんと一緒に配信したいけど
5578.6,5579.6,やめたほうがいいと思う
5580.6,5581.6,マジで
5582.6,5583.6,楽しくできないよ
5583.6,5585.6,絶対コメントするやついるし100%
5588.6,5590.6,それでまたなんかねドロドロしてみたいな
5590.6,5592.6,目に見えてわかるわ
5594.6,5595.6,どうせふとんが出すから
5595.6,5596.6,そしたらもう全部あいつの責任だろ
5596.6,5599.6,俺はそういう方向性でやったほうがいいと思う
5599.6,5601.6,あれだなあのー
5601.6,5603.6,別々の道だなほんとそうなったら
5603.6,5604.6,別に
5605.6,5606.6,なんとかなるだろみたいな
5607.6,5608.6,そいつはもう
5610.6,5612.6,ねえ責任を取ってもらうしかない
5614.6,5616.6,うまい例えって出てこなかった
5616.6,5617.6,名前変えればいいじゃん
5617.6,5618.6,うんまあそうなんだけどね
5620.6,5622.6,死んじゃうよ最期を決めない
5623.6,5626.6,ルールはうんこちゃんが五択くらいの答えのない問題と
5626.6,5628.6,それと一番一致性が優勝ってどう?
5628.6,5630.6,全然良くないわ
5631.6,5633.6,全然良くないすっげえいいこと言った
5633.6,5635.6,ぽいこと言ったけど全然良くないわ
5643.6,5649.6,日本地図用意してダーツ当たった地域に地元の名産品や珍百景を聞く
5649.6,5651.6,おーいいね新しいなそれ
5651.6,5654.6,日本全国ダーツの旅っていう名前でちょっとやんねえかそれは
5654.6,5656.6,それちょっと前向きに考えるわ
5656.6,5658.6,ちょっと新しいなそれなー
5660.6,5662.6,日本全国ダーツの旅
5662.6,5663.6,4チャンでやってもらおう
5663.6,5664.6,ぜひ
5664.6,5665.6,売っていくわ
5666.6,5668.6,斬新な企画だね
5673.6,5676.6,懲戒儀で死んじゃうもんだけ殴り合いしに行こうぜ
5676.6,5678.6,言ってろよ勝手に
5678.6,5680.6,犯罪行為に俺を巻き込むんじゃねえ
5680.6,5682.6,自分がダメな理由を
5682.6,5685.6,お前の人生が華やかじゃない理由を俺のせいにするんじゃねえ
5685.6,5687.6,勝手にお前が捕まってこい
5687.6,5689.6,もっと簡単に捕まる方法あるぞ
5689.6,5691.6,銀行強盗とかで捕まれお前は
5691.6,5693.6,出てくるな無償から
5693.6,5695.6,豚箱にずっといてくれ一生涯
5700.6,5702.6,最強の男選手権見た?
5702.6,5703.6,見たいねちょっとね
5703.6,5705.6,俺ボクシングやってるからちょっと出たいなそしたら
5705.6,5707.6,なんかその
5707.6,5709.6,そういう戦い
5710.6,5713.6,人のこと思いっきりぶん殴ったことないからさ
5713.6,5715.6,ちょっとあれだよな
5715.6,5717.6,フェイス
5717.6,5719.6,顔全然出てこない
5719.6,5721.6,ねえその
5723.6,5725.6,ちゃんと顔とか守ってさやりたいよね
5727.6,5729.6,顔とか
5729.6,5731.6,ヘッドギアヘッドギア出てこない
5731.6,5733.6,運航かやりてえなちょっとな
5733.6,5735.6,でもさ生放送だとさ絶対さ
5735.6,5737.6,大変なんだよね
5739.6,5741.6,運航かちょっとやりたいな
5741.6,5743.6,そしたらくにおくんの
5743.6,5745.6,ダメだな
5745.6,5747.6,血とかが出たらダメだな
5747.6,5749.6,録画だったらやってもいいね
5749.6,5751.6,録画だったら
5751.6,5753.6,動画でやるかじゃあ
5753.6,5755.6,動画でやっていい?
5755.6,5757.6,だったらできるよ正直
5759.6,5761.6,動画
5763.6,5765.6,なんかでもあれなんだよな
5765.6,5767.6,うさんくせえテレビ番組みたいな
5767.6,5769.6,アップしてみたいなさ
5769.6,5771.6,そこがちょっとなんかあんまりね
5771.6,5773.6,うーんって感じなんだよね
5777.6,5779.6,そんな動画があったらじゃああげねえ
5779.6,5781.6,俺が配信で見せるんだよ
5781.6,5783.6,ノーカットでいきたいね
5783.6,5785.6,それだったら
5785.6,5787.6,運航ちゃんってディルアングレート
5787.6,5789.6,新生カマテジャン以外のバンドしてる?
5789.6,5791.6,俺バンドとかクソ興味ねえわほんとに
5791.6,5793.6,涙が出ないほんと死んでも
5793.6,5795.6,それぐらいほんとに興味ない
5795.6,5797.6,ごめんな一番俺嫌いな人種が
5797.6,5799.6,バンギャだほんとにあいつらとは
5799.6,5801.6,関わりたくない
5801.6,5803.6,なんだろうな
5803.6,5805.6,好きな人はほんと好きだよな
5805.6,5807.6,モコウとかも好きだろ
5811.6,5813.6,モコウとかも
5813.6,5815.6,ELTもバンドだよ
5815.6,5817.6,ビジュアル系バンドが好きじゃないだけだな
5817.6,5819.6,多分
5821.6,5823.6,なんでもいいから動画あげてみてほしい
5823.6,5825.6,別にあげてもいいよ
5825.6,5827.6,なんでもいいんだったら
5827.6,5829.6,そんなの中身がないような動画あげてさ
5829.6,5831.6,工作をされて
5831.6,5833.6,伸びて面白いから
5833.6,5835.6,中身も伴わないぞ
5835.6,5837.6,伸ばしてつったらある程度
5837.6,5839.6,マイリストしてくれるでしょみんな
5839.6,5841.6,測れなくないか
5841.6,5843.6,それだけじゃ
5843.6,5845.6,別アカウントで
5845.6,5847.6,何もっていう
5847.6,5849.6,でもそんなんで伸びないよ誰も
5849.6,5851.6,俺じゃなくても伸びない
5851.6,5853.6,マイリストとか
5853.6,5855.6,機能があるから伸びてるだけで
5855.6,5857.6,伸びない伸びない
5857.6,5859.6,神様のような人は見たことない
5863.6,5865.6,不毛だよな
5865.6,5867.6,あげたい
5867.6,5869.6,面白い動画あげれるんだったらあげたいけどさ
5869.6,5871.6,本当に中身もあって
5871.6,5873.6,それなりの動画
5875.6,5877.6,メリコム伸びてたよ
5877.6,5879.6,何の動画あげたの
5879.6,5881.6,学生サンタさん
5881.6,5883.6,明日のガチ相撲トーナメント見る
5883.6,5885.6,何ガチ相撲トーナメントって
5889.6,5891.6,ガチ相撲トーナメントってなんだ
5895.6,5897.6,サンタさんもう
5897.6,5899.6,この前の別アカウントあげたら伸びないすぎて
5899.6,5901.6,バラして伸ばした
5901.6,5903.6,知らない
5903.6,5905.6,動画で滑ってるうんこじゃなくて見たくない
5905.6,5907.6,生放送だったら許されるのは
5907.6,5909.6,生放送でやってること変わんねーよ多分
5911.6,5913.6,テレビか見ないな多分
5915.6,5917.6,なかなかむずいよな
5917.6,5919.6,視聴者のいらない感情が
5919.6,5921.6,どんどん芽生えてくるじゃん
5921.6,5923.6,そういうの気にせずやらなきゃいけないよな
5923.6,5925.6,確かに
5925.6,5927.6,それが最近のニコ生のやる気のなさの原因の一つだと思う
5927.6,5929.6,単純にモチベーションが低いってこともあるけどさ
5929.6,5931.6,なんかそういう視線を
5931.6,5933.6,気にしすぎてるよね
5933.6,5935.6,そんな雑音でしかないのに
5935.6,5937.6,雑談動画をゆるにしてあげよういいね
5941.6,5943.6,1週間でマイリス5000超えなければ
5943.6,5945.6,罰ゲーム全然いくって
5945.6,5947.6,マイリス5000なんていくって絶対
5947.6,5949.6,絶対いくわどんな動画でもいくよ
5949.6,5951.6,だから意味ない
5951.6,5953.6,そこの数字は意味ないね
5953.6,5955.6,シリーズ化して平均再生数15万とかだったらちょっと厳しいけど
5957.6,5959.6,今のいくって
5959.6,5961.6,普通に絶対いく
5961.6,5963.6,みんなになんかずっと別に
5963.6,5965.6,動画あげるからみたいな感じで
5965.6,5967.6,で
5967.6,5969.6,あれでしょ
5969.6,5971.6,コミノのトップページに貼ったりしてみたいな
5971.6,5973.6,よっぽどさ
5975.6,5977.6,10万はいかない
5977.6,5979.6,10万は絶対いかない
5979.6,5981.6,10万いかない
5981.6,5983.6,紙動画じゃなきゃいけないだろ
5983.6,5985.6,それをみずちが久しぶりに
5985.6,5987.6,ニコ生みたいに
5987.6,5989.6,みずちを追い出しておくわ
5989.6,5991.6,いや
5991.6,5993.6,モコウとか別に伸ばそうとしてないでしょ
5993.6,5995.6,多分
5995.6,5997.6,なんか
5997.6,5999.6,慣れちゃってる
5999.6,6001.6,モコウが動画あげるのに慣れちゃってるじゃんみんな
6001.6,6003.6,俺だって動画あげたの2年ぶりだぜ
6003.6,6005.6,そんなミデニアムプレミアムつくだろ
6005.6,6007.6,絶対なんかしらの
6007.6,6009.6,視聴者のあーみたいなの起きるって
6009.6,6011.6,こんだけ見てくれてる人いるんだから
6013.6,6015.6,内容が面白いとか面白くないとか
6015.6,6017.6,オワコンだからオワコンだからじゃないとかじゃなくて
6017.6,6019.6,だってさ
6019.6,6021.6,アンリの
6021.6,6023.6,あれとかが1万5000とか
6023.6,6025.6,行くって
6025.6,6027.6,別にバカにしてるわけじゃないけど
6027.6,6029.6,うんこちゃん懐かしいね
6029.6,6031.6,しかも俺ぶりっこしてとるし
6031.6,6033.6,そういうなんか
6033.6,6035.6,汚い汚い配信じゃないよって
6035.6,6037.6,振りしてとるし
6037.6,6039.6,そういうちゃんと台本つくって
6039.6,6041.6,生配信にさ求められるのってやっぱさ
6041.6,6043.6,素でどれくらい喋れるかみたいなの求められるじゃん
6043.6,6045.6,動画でやっぱ一番求められるのは
6045.6,6047.6,台本つくれるかどうかだからさ
6047.6,6049.6,うん
6049.6,6051.6,いかに台本つくるかじゃん正直
6051.6,6053.6,ちゃんとつくってなんていうの
6053.6,6055.6,いろんなところからパクって台本つくってあげようかな
6055.6,6057.6,じゃあ
6057.6,6059.6,不祥事に媚びてもちろん当たり前じゃねえや
6059.6,6061.6,あの
6061.6,6063.6,拘束隊とかつけてね
