start,end,text
4833.400000000001,4835.400000000001,そろそろみづちと何かやるゲーム来てるじゃない
4835.400000000001,4837.400000000001,もうみづちのことは忘れてくれ
4837.400000000001,4839.400000000001,あいつは死んだ
4839.400000000001,4841.400000000001,死んだあいつは
4843.400000000001,4845.400000000001,最近冷蔵庫また廃止
4845.400000000001,4847.400000000001,いいじゃんなんか
4847.400000000001,4849.400000000001,許してやれよいい加減
4849.400000000001,4851.400000000001,だってお前らもあれだろ
4851.400000000001,4853.400000000001,根に持ってねえだろ冷蔵のことは
4853.400000000001,4855.400000000001,冷蔵の件は
4859.400000000001,4861.400000000001,ふひきを絵を動画にする
4861.400000000001,4863.400000000001,最近のだから知らねえんだよマジで
4863.400000000001,4865.400000000001,最終実況者俺たちは知ってるよもちろん
4865.400000000001,4867.400000000001,あと誰小島定員
4867.400000000001,4869.400000000001,あとアブさん
4869.400000000001,4871.400000000001,あと誰だあとスギニャン
4871.400000000001,4873.400000000001,あそんぐれかあとPさん
4873.400000000001,4875.400000000001,ガッチマン
4875.400000000001,4877.400000000001,その辺本当にあとは知らねえんだよ
4877.400000000001,4879.400000000001,お前の周りの実況者全員消えたな
4879.400000000001,4881.400000000001,いやモコウ先生がいいんじゃねえか
4881.400000000001,4883.400000000001,周りと言っちゃあれだけどさ
4883.400000000001,4885.400000000001,モコウ先生がいるじゃねえか
4885.400000000001,4887.400000000001,同世代だったら
4887.400000000001,4889.400000000001,同世代だったらモコウ先生いいんじゃねえか
4893.400000000001,4895.400000000001,あと何だっけ
4895.400000000001,4897.400000000001,山本の龍が合唱で頑張ってる
4897.400000000001,4899.400000000001,なんかいろいろ
4899.400000000001,4901.400000000001,やめ方があるけどさ
4901.400000000001,4903.400000000001,合唱でやめるってすごいな
4903.400000000001,4905.400000000001,どんだけかけてんだよあいつら合唱に
4907.400000000001,4909.400000000001,最近誰でもゲームやってるよな
4909.400000000001,4911.400000000001,モコウまた実況やるしやっぱ実況上げてほしいよね
4913.400000000001,4915.400000000001,伸びずに叩かれてほしい
4915.400000000001,4917.400000000001,そこまでがモコウ先生みたいなさ
4919.400000000001,4921.400000000001,伸びると別に大して褒められもせず
4921.400000000001,4923.400000000001,伸びなかった時に
4923.400000000001,4925.400000000001,すごい叩かれるみたいなさ
4927.400000000001,4929.400000000001,形状ちょっと
4929.400000000001,4931.400000000001,あれだね見ないね最近
4933.400000000001,4935.400000000001,使用アンチ取り込んだ
4935.400000000001,4937.400000000001,使用
4937.400000000001,4939.400000000001,教えてくれや
4939.400000000001,4941.400000000001,としぞうが今の実況のてっぺん
4941.400000000001,4943.400000000001,内政を牛耳ってんのか
4943.400000000001,4945.400000000001,キャッツが
4949.400000000001,4951.400000000001,昨日やってたんだ
4951.400000000001,4953.400000000001,なんかちょっとあれだよな
4953.400000000001,4955.400000000001,その
4955.400000000001,4957.400000000001,あれもしないといけねえよな
4957.400000000001,4959.400000000001,なんていうのオワコン大会議じゃなくてさ
4959.400000000001,4961.400000000001,同窓会みたいな
4961.400000000001,4963.400000000001,あれって言い過ぎ言葉出なくなる
4963.400000000001,4965.400000000001,言葉が出ないんだってたぶん
4965.400000000001,4967.400000000001,熱によりさ頭の思考回路が
4967.400000000001,4969.400000000001,ショート寸前なんだよ
4969.400000000001,4971.400000000001,だからもうなんていうの
4971.400000000001,4973.400000000001,指示台名詞で何とか伝えようっていう
4973.400000000001,4975.400000000001,気持ちが前にいってるんだけどね
4975.400000000001,4977.400000000001,体がついてこない感じ
4981.400000000001,4983.400000000001,動画のコメントがキモすぎて笑った
4985.400000000001,4987.400000000001,あーなんか
4987.400000000001,4989.400000000001,なんか
4989.400000000001,4991.400000000001,あーなんか
4991.400000000001,4993.400000000001,何がいけねえんだよみたいな
4995.400000000001,4997.400000000001,って言ってて
4997.400000000001,4999.400000000001,アンチがこの人マジでいいよなみたいな
4999.400000000001,5001.400000000001,俺あの時の石川の力めっちゃ叩いてたわ
5001.400000000001,5003.400000000001,ふざけんじゃねえよみたいな感じで
5003.400000000001,5005.400000000001,あの動画クソ荒らしだわ
5005.400000000001,5007.400000000001,塩?ゴミだろみたいな
5007.400000000001,5009.400000000001,塩で俺のところ血拭いてっかんだっていうコメント残してた
5009.400000000001,5011.400000000001,主に
5011.400000000001,5013.400000000001,うんこした後俺塩で拭いてますみたいな
5013.400000000001,5015.400000000001,あれって言ってるとクセになるからやめろ
5015.400000000001,5017.400000000001,じゃあそれをなんかあれしようってみんなが
5017.400000000001,5019.400000000001,言ってるっていう作業にちょっと
5019.400000000001,5021.400000000001,今から入ろう
5021.400000000001,5023.400000000001,それを汲み取る作業に入ろうぜ
5023.400000000001,5025.400000000001,うん
5025.400000000001,5027.400000000001,あれだよね
5027.400000000001,5029.400000000001,そういうなんか時期もあったんだけどな
5029.400000000001,5031.400000000001,塩をなんかちょっと叩くみたいな
5033.400000000001,5035.400000000001,なんか明日仕事休むの?
5035.400000000001,5037.400000000001,いや別に行ってもよかったんだけどさ
5037.400000000001,5039.400000000001,休めって言われちゃったんだよ
5039.400000000001,5041.400000000001,休めと言われてしまいました
5043.400000000001,5045.400000000001,意識したぞって言ったら
5045.400000000001,5047.400000000001,もう昔からそうなんだよ
5047.400000000001,5049.400000000001,出てこないんだよ言葉がほんとに
5049.400000000001,5051.400000000001,わーって言いたいことがさいっぱいあると
5051.400000000001,5053.400000000001,わーってなんか
5053.400000000001,5055.400000000001,いろんな引き出しからさ開けてさ
5055.400000000001,5057.400000000001,話そうとするじゃん
5057.400000000001,5059.400000000001,そうすると出てこないんだよね言葉が
5061.400000000001,5063.400000000001,あれって言うたびに多分
5063.400000000001,5065.400000000001,ぶん殴って教育してやるよ
5065.400000000001,5067.400000000001,そんなんかっこよくない
5067.400000000001,5069.400000000001,大罰制裁みたいなかっこよくないわ
5071.400000000001,5073.400000000001,ちょっとあれだな
5073.400000000001,5075.400000000001,やんねえといけねえよな
5075.400000000001,5077.400000000001,そういうことも
5077.400000000001,5079.400000000001,インフルエンザって家から出てダメじゃないのか
5079.400000000001,5081.400000000001,別に法律はないでしょそういう
5081.400000000001,5083.400000000001,俺出るぞ明日
5083.400000000001,5085.400000000001,明日買いに行きたいものがあるんだよ
5085.400000000001,5087.400000000001,明日Sで行きたいしかも
5087.400000000001,5089.400000000001,予約取っちゃったもんだって
5089.400000000001,5091.400000000001,明日Sで行く黙って
5091.400000000001,5093.400000000001,エステティシャンにインフルエンザB型写してごめんな
5095.400000000001,5097.400000000001,新助ってアフィって叩かれたけどアフィってなんか悪いの
5097.400000000001,5099.400000000001,別に悪くないんじゃない好きじゃないだけで
5099.400000000001,5101.400000000001,だって別になんも悪いことないじゃん
5101.400000000001,5103.400000000001,しても警察に捕まれることないでしょ
5107.400000000001,5109.400000000001,実況ってパートどんぐらいがちょうどいいの
5109.400000000001,5111.400000000001,んーわかしらねえ10ぐらいじゃない
5111.400000000001,5113.400000000001,そんな考えてやっても面白くねえや
5113.400000000001,5115.400000000001,あのー
5115.400000000001,5117.400000000001,ねえパート10
5117.400000000001,5119.400000000001,アブさんの実況見てたよそういうのやめとけ
5119.400000000001,5121.400000000001,疲れるやってるほうが
5121.400000000001,5123.400000000001,疲れるよやめとけ
5123.400000000001,5125.400000000001,自分が上げたい動画を
5125.400000000001,5127.400000000001,が
5127.400000000001,5129.400000000001,例えばパート90とかになったとしても
5129.400000000001,5131.400000000001,ねえなんとか
5131.400000000001,5133.400000000001,さっきやってたクイズなにわかんない
5133.400000000001,5135.400000000001,貼られたやつ知らない
5135.400000000001,5137.400000000001,貼られたやつからわかんない
5139.400000000001,5141.400000000001,ちょうどよかったとしても伸びねえやん
5141.400000000001,5143.400000000001,わかんねえけどな最近のその実況会が
5143.400000000001,5145.400000000001,どうなってんのかさ
5145.400000000001,5147.400000000001,ちょっとあれだね
5147.400000000001,5149.400000000001,チャレンジしてみたい気持ちあるけどなんか
5149.400000000001,5151.400000000001,さすがにちょっとパワーがないわ
5151.400000000001,5153.400000000001,ほんとになんかさ年をとってしまってさ
5155.400000000001,5157.400000000001,私も私めも
5157.400000000001,5159.400000000001,ゲームクリアして泣いちゃうとどうなるのかわかんない
5159.400000000001,5161.400000000001,あんまりいねえんじゃないかそういう人
5161.400000000001,5163.400000000001,アルスってやつパート500くらいなかったっけ
5163.400000000001,5165.400000000001,それはちょっとやばいなだって1日1本
5165.400000000001,5167.400000000001,上げ続けても1年半かかるんだぞ無理だろそんなの
5167.400000000001,5169.400000000001,ニコ動始まって以来
5169.400000000001,5171.400000000001,同じ実況上げてることになるぞ
5171.400000000001,5173.400000000001,こいつ
5173.400000000001,5175.400000000001,気が触れてる
5175.400000000001,5177.400000000001,気が触れてると思う
5179.400000000001,5181.400000000001,過ぎるマザー3だったらそうなんだ見てねえわ
5181.400000000001,5183.400000000001,見てない
5183.400000000001,5185.400000000001,あ1日3本だなるほどなそういうあれか
5185.400000000001,5187.400000000001,天下阿部的確にディスってあると
5187.400000000001,5189.400000000001,何つってたの知りたい
5189.400000000001,5191.400000000001,俺も阿部さんの悪口をちょっと言っていかなきゃいけないんじゃないかなって思ってるわ
5195.400000000001,5197.400000000001,阿部さんの悪口をちょっと積極的にこれから言っていかなきゃいけないのかなと
5203.400000000001,5205.400000000001,500日くらい連続ウープしてる人なんかもう義務感なんだろうね
5207.400000000001,5209.400000000001,元裏社会の異聞ってフレーズ思い出し笑いするんだね
5209.400000000001,5211.400000000001,わかんない
5211.400000000001,5213.400000000001,あ
5213.400000000001,5215.400000000001,阿部氏に出てみずしも言ってた
5215.400000000001,5217.400000000001,マジで
5217.400000000001,5219.400000000001,うんこ竜がごとくやったことある
5219.400000000001,5221.400000000001,あのさディレクターが好きじゃなくて
5221.400000000001,5223.400000000001,肌黒くて汚いおっさん
5223.400000000001,5225.400000000001,もうあいつが
5225.400000000001,5227.400000000001,懐にゼニが入るって考えただけでやる気がする
5227.400000000001,5229.400000000001,絶対交わらない
5229.400000000001,5231.400000000001,絶対やだな
5231.400000000001,5233.400000000001,ブイブイとかいうやつ事故しても
5233.400000000001,5235.400000000001,動画ウープするらしいな
5235.400000000001,5237.400000000001,あそうなんだ物理的に無理なんじゃないのか
5241.400000000001,5243.400000000001,3000日くらい連続で上げてなかったっけ
5243.400000000001,5245.400000000001,お前すげーな
5245.400000000001,5247.400000000001,8年くらいじゃ
5247.400000000001,5249.400000000001,8年かニコニコ動画が
5249.400000000001,5251.400000000001,スタートする前から
5251.400000000001,5253.400000000001,そんな題材を繰り返したのか
5253.400000000001,5255.400000000001,著作権の問題は
5255.400000000001,5257.400000000001,犯罪者だ捕まえよう
5257.400000000001,5259.400000000001,今度俺が捕まった時はブンブンのせいだ
5259.400000000001,5261.400000000001,とんでもない悪党がいるんですよ
5263.400000000001,5265.400000000001,まず捕まえに行くって言っとけや
5265.400000000001,5267.400000000001,ブンブンに
5267.400000000001,5269.400000000001,俺が捕まってれば
5271.400000000001,5273.400000000001,って言っといて
5273.400000000001,5275.400000000001,昔の写真検索してみ
5275.400000000001,5277.400000000001,ダサいらしいぞ誰が
5277.400000000001,5279.400000000001,ブンブン?
5279.400000000001,5281.400000000001,ブンブン顔出ししてんの
5281.400000000001,5283.400000000001,公式実況してんの
5283.400000000001,5285.400000000001,俺だってブンブンって知らねーよ
5285.400000000001,5287.400000000001,誰ブンブンって
5287.400000000001,5289.400000000001,ブンブンじゃなくてマザー2の
5289.400000000001,5291.400000000001,ブンブンって誰
5293.400000000001,5295.400000000001,誰ブンブンって
5297.400000000001,5299.400000000001,イロリの仲間
5299.400000000001,5301.400000000001,何野郎
5303.400000000001,5305.400000000001,イロリ هミリー
5307.400000000001,5309.400000000001,そうゆうファミリーなんて
5309.400000000001,5311.400000000001,楽して生きながら食ってきて
5313.400000000001,5315.400000000001,巨悪の一部となりたい
5321.400000000001,5323.400000000001,瞑てたときに
5323.400000000001,5325.400000000001,イロリの仲間になって
5325.400000000001,5327.400000000001,よかった
5327.400000000001,5337.400000000001,地球戦水地豪が9月5日に2009年の雑誌をしたから、それで俺の計画が狂ったんだよ。俺が頑張らなきゃいけないみたいな。
5337.400000000001,5340.400000000001,ちょっと頑張らなきゃいけないよな。
5340.400000000001,5343.400000000001,チームNERのNでやってるんだよ。本当だよ。
5343.400000000001,5346.400000000001,本当に俺を保護してほしい。
5346.400000000001,5348.400000000001,うちのコミュニティともども。
5348.400000000001,5352.400000000001,うんこ褒めのメンツ見てみろよ。リアフレしかいないぞ。
5352.400000000001,5355.400000000001,ほんとだよ。それもう壊滅状態だから。
5355.400000000001,5358.400000000001,酔っちゃうもんいないし、布団ちゃうもんやる気ないし。
5358.400000000001,5361.400000000001,俺もなんかもう薄れてきてるし。壊滅危機なんだよ。
5361.400000000001,5364.400000000001,吸収してほしい。合併。
5364.400000000001,5367.400000000001,合併してもらわなきゃいけないな。
5367.400000000001,5369.400000000001,うん。
5369.400000000001,5371.400000000001,てんぐちゃんか。
5371.400000000001,5374.400000000001,あー。てんてんてん。
5374.400000000001,5377.400000000001,てんてんてんだね。
5378.400000000001,5381.400000000001,なんかちょっとあれだね。新しい刺激がないとさ。
5381.400000000001,5384.400000000001,俺もさ、新しい子でやる気しないんだよな。
5384.400000000001,5387.400000000001,最近の悩み。ネタがないのとかはさ、
5387.400000000001,5390.400000000001,配信のワックスでカバーできるんだけど、やる気がないのって
5390.400000000001,5393.400000000001,どう対処していいか分かんなくてさ、俺も。
5394.400000000001,5397.400000000001,限界を感じつつある。
5397.400000000001,5400.400000000001,もうちょっと新しい刺激を取り入れていかなきゃいけないんだよな。
5400.400000000001,5403.400000000001,うんことてんぐの仲いいの?
5403.400000000001,5406.400000000001,15年の付き合いだからな。
5406.400000000001,5409.400000000001,仲悪くねえんじゃねえか。悪口は言えるぞ。
5409.400000000001,5412.400000000001,俺とお前って気まずいよなって本人の前で言えるくらい仲いいよ。
5412.400000000001,5415.400000000001,5月病じゃねえ。
5415.400000000001,5418.400000000001,そうだな。5月病と信じよう。
5418.400000000001,5421.400000000001,うんこまべりでまともなの終わっちゃうんだけど。みんなまともだよ実は。
5421.400000000001,5424.400000000001,ピエロのマスクをかぶってるだけで。
5424.400000000001,5427.400000000001,みんな会社も絶対休まねえし。
5427.400000000001,5430.400000000001,遅刻もしねえし。それだけでまともだろ。
5431.400000000001,5434.400000000001,まとも。
5434.400000000001,5437.400000000001,顔出し雑談しようぜ。
5437.400000000001,5440.400000000001,微妙なんだよな。今更なんだよな。
5440.400000000001,5443.400000000001,何も得るものがないんだよな。顔出し雑談しても。
5443.400000000001,5446.400000000001,横の絡みは増えるだろうけどさ。
5446.400000000001,5449.400000000001,出やすいじゃん。コラボとかしやすいじゃん絶対。
5449.400000000001,5452.400000000001,顔出し雑談のほうが。
5452.400000000001,5455.400000000001,なんかそれだけなんだよな。メリットがないんだよな。
5455.400000000001,5458.400000000001,リスクしかないんだよな。本当に顔出しいらないよ。
5458.400000000001,5461.400000000001,自分的にメリットがないんだよな。
5461.400000000001,5464.400000000001,公式に出れるよ。出たところでメリットがないんだよな。
5464.400000000001,5467.400000000001,出たものがないんだよな。
5467.400000000001,5470.400000000001,たぶんそんなかっこよくなく戦われそう。いやそんなことないと思うよ。
5470.400000000001,5473.400000000001,俺かっこいいから顔は。安心しろそこは。
5473.400000000001,5476.400000000001,お墨付きだよみんなの。親も言ってるからさ。
5476.400000000001,5479.400000000001,イケメンと呼ばれる。
5479.400000000001,5482.400000000001,うーん。まあそうだな。
5482.400000000001,5485.400000000001,黒猫とコラボしよう。かそったら顔出そう。
5485.400000000001,5488.400000000001,やめる。
5488.400000000001,5491.400000000001,やめます。
5491.400000000001,5494.400000000001,逮捕されるぞ。
5494.400000000001,5497.400000000001,ハンサムかっこいい。
5497.400000000001,5500.400000000001,ニコ生で2番目かっこいい。
5500.400000000001,5503.400000000001,なんか俺の嫌いな顔してるぞ。
5503.400000000001,5506.400000000001,オールマイティにウケがいいよ。
5506.400000000001,5509.400000000001,普通以上。
5509.400000000001,5512.400000000001,全体的にまあまあだなみたいな。
5512.400000000001,5515.400000000001,公式に出たら金がもらえるってメリットあっても出さないの?
5515.400000000001,5518.400000000001,だって俺月100万稼いでんだぜ。だいたい。
5518.400000000001,5521.400000000001,今更1万2万もらってもさメリットはなくない?
5521.400000000001,5524.400000000001,俺のチャンネルができて未来英語俺が王国を築けるんだったら
5524.400000000001,5527.400000000001,ちょっと考えるけど無理じゃない?
5527.400000000001,5530.400000000001,お給料とかじゃねえんだよ。
5530.400000000001,5533.400000000001,もっと安定した視聴者が欲しいじゃん。
5533.400000000001,5536.400000000001,3000人。
5536.400000000001,5539.400000000001,そしたら出るわ。
5539.400000000001,5542.400000000001,俺が何をしてても3000人の視聴者確保できるんだったら公式出るわ。
5542.400000000001,5545.400000000001,出ないとできないだろ。
5545.400000000001,5548.400000000001,無理です。
5548.400000000001,5551.400000000001,結局は出る。
5551.400000000001,5554.400000000001,その発想に至った自分も恥ずかしいわ。
5554.400000000001,5557.400000000001,その発想に至った自分が恥ずかしい。
5557.400000000001,5560.400000000001,その発想に至った自分が恥ずかしい。
5560.400000000001,5563.400000000001,そうなんだよな。
5563.400000000001,5566.400000000001,ちょっとあれなんだよな。
5566.400000000001,5569.400000000001,12ヶ月の給料計算して
5569.400000000001,5572.400000000001,ボーナスとか加味したらそのくらいだろ。
5572.400000000001,5575.400000000001,年収的に計算しやすい。
5575.400000000001,5578.400000000001,変動があるんだよ。
5578.400000000001,5581.400000000001,給料の話って変動があるんだよ。
5581.400000000001,5584.400000000001,大体本職は35前後なの。
5584.400000000001,5587.400000000001,固定それくらいは。
5587.400000000001,5590.400000000001,3月少なかったな。
5590.400000000001,5593.400000000001,3月って給料引かれる?
5594.400000000001,5597.400000000001,これ何した俺って思ったんだよね。
5597.400000000001,5600.400000000001,色々あったのかな。
5600.400000000001,5603.400000000001,35くらいだね。毎月毎月。
5603.400000000001,5606.400000000001,アルバイトで35から45の間。
5606.400000000001,5609.400000000001,大体それくらい。
5609.400000000001,5612.400000000001,決算か。
5612.400000000001,5615.400000000001,当たり前に手取り。
5615.400000000001,5618.400000000001,手取り28だった3月は。
5618.400000000001,5621.400000000001,ずっと平社員だもん。
5621.400000000001,5624.400000000001,35万もらうと残業何時間だった?
5624.400000000001,5627.400000000001,20時間くらいじゃないか。
5627.400000000001,5630.400000000001,残業でつかないから。
5630.400000000001,5633.400000000001,総支給は39とかじゃない?
5633.400000000001,5636.400000000001,7万から8万円税金払ってるから。
5636.400000000001,5639.400000000001,総支給が43くらいだと思う。
5639.400000000001,5642.400000000001,8万くらい引かれて。
5642.400000000001,5645.400000000001,なんかあるんだろうね。
5645.400000000001,5648.400000000001,月による。
5649.400000000001,5652.400000000001,最近はサービス支出した。
5652.400000000001,5655.400000000001,先月2回した。
5655.400000000001,5658.400000000001,先月2回したよ。
5658.400000000001,5661.400000000001,得意の夕方からとかだけどね。
5661.400000000001,5664.400000000001,残業最近全然ない。
5664.400000000001,5667.400000000001,税金8万くらい余裕で行くでしょ。
5667.400000000001,5670.400000000001,だって俺あれだぜ。
5670.400000000001,5673.400000000001,所得税いくらくらい?
5673.400000000001,5676.400000000001,市民税?都民税?
5676.400000000001,5679.400000000001,2万くらいでしょ。
5679.400000000001,5682.400000000001,公正年金で4万でしょ。
5682.400000000001,5685.400000000001,それだけで6万いってんだよ。
5685.400000000001,5688.400000000001,2万くらいだろ多分。
5688.400000000001,5691.400000000001,会社の積立で引かれて。
5691.400000000001,5694.400000000001,手取り20万でも税金4万5千くらい取られる。
5694.400000000001,5697.400000000001,8万くらい取られるよね。
5697.400000000001,5700.400000000001,普通に取られるよ。
5700.400000000001,5703.400000000001,給与明細がないから詳しいデータができないけど。
5703.400000000001,5706.400000000001,俺のいつもの
5706.400000000001,5709.400000000001,あれだとそんくらいだと思うよ。
5709.400000000001,5712.400000000001,公正年金4万くらい。
5712.400000000001,5715.400000000001,社会保険。社会保険料として結構引かれてるだろ。
5715.400000000001,5718.400000000001,貯金して何が楽しいの?楽しくないよ別に。
5718.400000000001,5721.400000000001,楽しくて貯金してるわけじゃなくて将来のために貯金してるんだよ。
5721.400000000001,5724.400000000001,お金。
5724.400000000001,5727.400000000001,今年の目標は
5727.400000000001,5730.400000000001,貯金1千万を目標にしてるんだよな。
5731.400000000001,5734.400000000001,考えたんだよ。
5734.400000000001,5737.400000000001,年収が800から900くらいの間で変動してて。
5737.400000000001,5740.400000000001,そのうち200万円を貯金しようと思ったら
5740.400000000001,5743.400000000001,300万円の人が60万円貯金するのと
5743.400000000001,5746.400000000001,だいたいパーセンテージ一緒だろ。結構厳しいんじゃないのかなと。
5746.400000000001,5749.400000000001,850もない。
