start,end,text
6874.400000000001,6877.400000000001,6年付き合った彼女は別れたからもう誰とも付き合わない。
6877.400000000001,6880.400000000001,分かるわ。
6880.400000000001,6883.400000000001,俺も1年間引きずったね。
6883.400000000001,6886.400000000001,もったいねえぞ時間は。
6886.400000000001,6889.400000000001,一歩お前に近づいて言わせてくれ。
6889.400000000001,6892.400000000001,悩んでる時間は。
6892.400000000001,6895.400000000001,すぐさま立ち直った方がいいね。
6895.400000000001,6898.400000000001,告白するときに勇気とかいる?
6898.400000000001,6901.400000000001,分かんない。
6901.400000000001,6904.400000000001,本当に好きだったら?
6904.400000000001,6907.400000000001,8年くらい味わってないな。
6907.400000000001,6910.400000000001,告白する前にドキドキする。
6910.400000000001,6913.400000000001,高校卒業したての頃はドキドキしたんだけど。
6914.400000000001,6917.400000000001,俺も今3年付き合ってる。
6917.400000000001,6920.400000000001,お前多分別れるけど。
6920.400000000001,6923.400000000001,ちょうど3年くらいで別れるからみんな。
6923.400000000001,6926.400000000001,どうせお前24くらいだろ。
6926.400000000001,6929.400000000001,彼女が21だろ。
6929.400000000001,6932.400000000001,今年22になって新社会人。
6932.400000000001,6935.400000000001,そういう時には俺のこと見に来い。
6935.400000000001,6938.400000000001,俺が慰める術は108個の術があるから。
6938.400000000001,6941.400000000001,自然消滅なんて俺やったことないぞ。
6942.400000000001,6945.400000000001,自然消滅。
6945.400000000001,6948.400000000001,さっきの6年のものは誰とも結婚できる。
6948.400000000001,6951.400000000001,結婚なんかしなくていいだろ。
6951.400000000001,6954.400000000001,わりぃ。
6954.400000000001,6957.400000000001,1万円貯金するわ。
6957.400000000001,6960.400000000001,後日ちょっとそっと貯金するな。
6960.400000000001,6963.400000000001,"脳が恋愛を通してくれるのが2,3年だからそうなんだ。"
6963.400000000001,6966.400000000001,そういうメカニズムがあるんだ。
6966.400000000001,6969.400000000001,子供作っちゃうのが1番なんじゃない?
6970.400000000001,6973.400000000001,俺も最近思ったら本当に結婚するんだったら
6973.400000000001,6976.400000000001,そういう規制事実作らないと腰が重くない?
6976.400000000001,6979.400000000001,この人のこと守ってあげてーなんて思わないだろ。
6979.400000000001,6982.400000000001,あんまり。
6982.400000000001,6985.400000000001,俺この間4年付き合った彼女急に冷めて別れたら
6985.400000000001,6988.400000000001,よしよくやった。
6988.400000000001,6991.400000000001,お前から振ったんだったらよくやった。
6991.400000000001,6994.400000000001,大抵振られるじゃん男が。
6994.400000000001,6997.400000000001,みんな振って。
6997.400000000001,7000.400000000001,むかつくから。
7000.400000000001,7003.400000000001,俺がやられたことを女という種全体に求めるから。
7003.400000000001,7006.400000000001,見返りを。
7006.400000000001,7009.400000000001,セックスして子供を産んで自分で危機から逃れるようになれるまで
7009.400000000001,7012.400000000001,"大体2,3年だから。"
7012.400000000001,7015.400000000001,なんだその話。
7018.400000000001,7021.400000000001,こいつとセックスしてるなと思うことはいくらでもあるぞ。
7021.400000000001,7024.400000000001,1日に25人くらいの女とエッチしたがって。
7024.400000000001,7027.400000000001,俺今度数えておくわ。
7027.400000000001,7030.400000000001,本当性依存症なんじゃないかなと思う時があって。
7030.400000000001,7033.400000000001,1日にすれ違う女。
7033.400000000001,7036.400000000001,平気25人くらいの女とエッチしたいんだよね。
7036.400000000001,7039.400000000001,やべーよな。
7039.400000000001,7042.400000000001,多すぎだよね。
7042.400000000001,7045.400000000001,付き合うまでにデートするもん。
7045.400000000001,7048.400000000001,メールで出会い系とかってこと?
7048.400000000001,7051.400000000001,デートしてそこで告白するんじゃないの?
7051.400000000001,7054.400000000001,35の女で
7054.400000000001,7057.400000000001,あれだよね。
7057.400000000001,7060.400000000001,新しい。
7060.400000000001,7063.400000000001,想像できないわ。
7063.400000000001,7066.400000000001,頑張ってくれ。
7069.400000000001,7072.400000000001,30回くらいまではストーカーじゃないんじゃないか。
7072.400000000001,7075.400000000001,俺も5回はしたことあるし。
7075.400000000001,7078.400000000001,5回目でオッケーだったけどな。
7078.400000000001,7081.400000000001,確かにね。
7081.400000000001,7084.400000000001,お母さんの金で騙し取って大阪旅行に2人で行ってそこでエッチして付き合ったわ。
7084.400000000001,7087.400000000001,そういうの学んでけよ。
7087.400000000001,7090.400000000001,学べよ。
7090.400000000001,7093.400000000001,その辺はちゃんとお金でするとしっかり。
7093.400000000001,7096.400000000001,物、金、その辺だな。
7096.400000000001,7099.400000000001,俺の最終的な武器は。
7099.400000000001,7102.400000000001,痴漢したい。
7102.400000000001,7105.400000000001,俺じゃ解決できない。
7105.400000000001,7108.400000000001,本当にいいよ。
7108.400000000001,7111.400000000001,女の子は旅行とか好きじゃん。
7111.400000000001,7114.400000000001,旅行やたら好きじゃん。
7114.400000000001,7117.400000000001,うんこちゃんのおすすめの絶対落ちてるセリフってなんだっけ?
7117.400000000001,7120.400000000001,分かんない。
7124.400000000001,7127.400000000001,このままだと初告白がプロポーズになりそう。
7127.400000000001,7130.400000000001,どうやって親騙すの?
7130.400000000001,7133.400000000001,教科書代ちょうだい?
7134.400000000001,7137.400000000001,俺そういうレイプものとかも好きじゃないし。
7137.400000000001,7140.400000000001,あんまり好きじゃねえな。
7140.400000000001,7143.400000000001,願望はあるんだろうけどね。
7143.400000000001,7146.400000000001,男の人ってどこかしらにあるでしょ。
7146.400000000001,7149.400000000001,俺レイプはされたことあるよ。
7149.400000000001,7152.400000000001,両手で数えられないくらいはあるよ。
7152.400000000001,7155.400000000001,布団ちゃんと2回、よっちゃんと2回。
7155.400000000001,7158.400000000001,身内ですでに4回あるからな。
7158.400000000001,7161.400000000001,あの時は楽しかった。
7162.400000000001,7165.400000000001,1日最大何人だったか分かんない。
7165.400000000001,7168.400000000001,6人くらいじゃないか。
7168.400000000001,7171.400000000001,お店とか合わせたら。
7171.400000000001,7174.400000000001,数をどこまでいけるのか試したくなるもんね。
7174.400000000001,7177.400000000001,自分の彼女やらせたらそんなわけねえじゃねえかよ。
7177.400000000001,7180.400000000001,そんな鬼畜なことしねえよ。
7180.400000000001,7183.400000000001,そんな鬼畜なことしねえよ。
7183.400000000001,7186.400000000001,俺独占欲強いから自分の女とか絶対許さない。
7186.400000000001,7189.400000000001,俺だって殴るよ。
7190.400000000001,7193.400000000001,ハッキリお前ボコボコにすっかんな。
7193.400000000001,7196.400000000001,裏切がバレたらだな。
7196.400000000001,7199.400000000001,殴るけど暴行するからって。
7199.400000000001,7202.400000000001,燃焼かかってるから。
7202.400000000001,7205.400000000001,人殺ししてもいいけど、
7205.400000000001,7208.400000000001,警察に捕まるよっていうのと、
7208.400000000001,7211.400000000001,裏切しちゃだめだよ、俺が殴るよっていうのが、
7211.400000000001,7214.400000000001,ほぼ俺の中でイコールで繋がるんだよね。
7214.400000000001,7217.400000000001,悪いことなんだからしなきゃいいじゃん。
7217.400000000001,7220.400000000001,絶対許さない。
7220.400000000001,7223.400000000001,俺正直ここにいる童貞どもと違う正常人間だけど、
7223.400000000001,7226.400000000001,1日6人とかおかしいよね。
7226.400000000001,7229.400000000001,俺だって経験人数の95%が19歳までに済まされてるもん。
7229.400000000001,7232.400000000001,俺だって経験人数の95%が19歳までに済まされてるもん。
7232.400000000001,7235.400000000001,その後は、
7235.400000000001,7238.400000000001,みんなと同じ脳の構造に戻ってきたんだよ。
7238.400000000001,7241.400000000001,そういう脳の障害があったんだろうな。
7241.400000000001,7244.400000000001,俺も彼女にもし俺が浮気したら拷問していいって言ったらいいよね。
7244.400000000001,7247.400000000001,あれを詰めるべきだよね。
7247.400000000001,7250.400000000001,俺全然スウェットで言ってたよ。
7250.400000000001,7253.400000000001,スウェットに頭にタオル巻いて言ってたよ。
7253.400000000001,7256.400000000001,髪の毛長かったから前髪留めるのめんどくせーから、
7256.400000000001,7259.400000000001,白いタオルを頭に巻いて、上下汚いスウェットで言ってたよ。
7259.400000000001,7262.400000000001,別に彼女につくりって言ってるわけじゃないからいいでしょ。
7265.400000000001,7268.400000000001,悪口言われてたんだろうな。
7269.400000000001,7272.400000000001,気持ち悪がられてるんだな。
7272.400000000001,7275.400000000001,性格違反だと付き合ったことある?ある。
7275.400000000001,7278.400000000001,"たぶん2,3人はいるはず。"
7283.400000000001,7286.400000000001,浮気はどうかと思うけど結婚して子供いる人は浮気ぐらいでガタガタ言わないでほしい。
7286.400000000001,7289.400000000001,いや無理でしょ。
7289.400000000001,7292.400000000001,別れるでしょ。自分の奥さんが浮気しましたって言って。
7292.400000000001,7295.400000000001,いや別れない人。俺別れると思う。
7295.400000000001,7298.400000000001,今だったら強く言えるよ。
7298.400000000001,7301.400000000001,ゴリラも最終的に変な男に騙されて
7301.400000000001,7304.400000000001,向こうに行っちゃったけど、
7304.400000000001,7307.400000000001,性格が悪くなかったしね。
7307.400000000001,7310.400000000001,振られた回数の方がダンチで多いね。
7310.400000000001,7313.400000000001,ダントツで多い。
7313.400000000001,7316.400000000001,この前数えたら13人ぐらいだったっけ?
7316.400000000001,7319.400000000001,この前数えたんだよな。
7319.400000000001,7322.400000000001,自分のこと見たら本当だよ。
7322.400000000001,7325.400000000001,自分が浮気するけど彼女が浮気したらマジでムカつくわ。
7325.400000000001,7328.400000000001,まあそうだな。正しいよ。
7328.400000000001,7331.400000000001,お前の価値観はすごく正しい。
7331.400000000001,7334.400000000001,俺は浮気するけど彼女が浮気したらマジでうぜえわ。
7334.400000000001,7337.400000000001,今すぐちょっとつぶやけ。
7337.400000000001,7340.400000000001,今の彼女は歴代ないよ。
7340.400000000001,7343.400000000001,あんまり過去の女の子と比べたことないな。
7343.400000000001,7346.400000000001,違う。違いすぎる。
7346.400000000001,7349.400000000001,義務感強すぎて自分から触れない。
7349.400000000001,7352.400000000001,一切ないな。
7352.400000000001,7355.400000000001,昔はゴリラが初めて振られた女。
7355.400000000001,7358.400000000001,それぐらいの印象を受けたね。
7358.400000000001,7361.400000000001,初めての大失恋だろ。
7361.400000000001,7364.400000000001,次の女見つけようみたいな感じで。
7364.400000000001,7367.400000000001,でもあれは立ち直れなかったね。
7367.400000000001,7370.400000000001,初めて振られたって言っても過言じゃないな。
7370.400000000001,7373.400000000001,だってその価値観で人間が生き残る。
7373.400000000001,7376.400000000001,夫が働いてる間に
7376.400000000001,7379.400000000001,妻が家で浮気したら殺していいと思う。
7379.400000000001,7382.400000000001,そういう法律作ってほしいよね。
7382.400000000001,7385.400000000001,殴り殺していいって。
7385.400000000001,7388.400000000001,セックスが好きじゃないならどうやって好きになれる?
7388.400000000001,7391.400000000001,それは無理だな。俺には解決できない。
7391.400000000001,7394.400000000001,セックスが好きじゃない奴は人間じゃない。
7394.400000000001,7397.400000000001,たまにいるんだよな。
7397.400000000001,7400.400000000001,女の子でエッチ嫌いとかいう奴マジでいない。
7400.400000000001,7403.400000000001,俺が嫌いなのかな?
7403.400000000001,7406.400000000001,女もセックスも好きじゃない。
7406.400000000001,7409.400000000001,本当にさ。
7409.400000000001,7412.400000000001,年賞は絶対欠かせるべきだよ。
7412.400000000001,7415.400000000001,結婚するときに、もし浮気した場合は浮気した方が
7415.400000000001,7418.400000000001,浮気された方に全財産を与えますみたいな。
7418.400000000001,7421.400000000001,絶対に書いておいた方がいいね。
7421.400000000001,7424.400000000001,俺は浮気しねえし多分。
7424.400000000001,7427.400000000001,ここ俺6年ちょっと浮気してないからな。
7427.400000000001,7430.400000000001,相当な実績が今あるから。
7430.400000000001,7433.400000000001,俺浮気しねえと思うよ。
7433.400000000001,7436.400000000001,浮気の坊だわ。
7436.400000000001,7439.400000000001,メールした段階で俺浮気だ。
7439.400000000001,7442.400000000001,メールする必要がないじゃん。
7442.400000000001,7445.400000000001,男とメールする必要がない。
7445.400000000001,7448.400000000001,女の子がエッチに心境になるならしょうがない。
7448.400000000001,7451.400000000001,じゃあ酔わせるわ。
7451.400000000001,7454.400000000001,女がそういうスタンスだったら酔わせるからいいよ。
7454.400000000001,7457.400000000001,愛まみれない。
7457.400000000001,7460.400000000001,お前らが大事に守ろうとするんだったら
7460.400000000001,7463.400000000001,俺は必死に酔わせる。
7463.400000000001,7466.400000000001,みんなもぜひ彼女作ったら
7466.400000000001,7469.400000000001,報告してください。
7469.400000000001,7472.400000000001,友達って言い張っても
7472.400000000001,7475.400000000001,その発言で殴って
7475.400000000001,7478.400000000001,いい法律作ってほしいわ。
7478.400000000001,7481.400000000001,その時点で俺無口になると思う。
7481.400000000001,7484.400000000001,こいつはそういう低俗な人間なんだな。
7484.400000000001,7487.400000000001,スポットがずれてるじゃん。
7487.400000000001,7490.400000000001,他の男の子とメールしてて
7490.400000000001,7493.400000000001,気分がいいなって男はいないって言うのは
7493.400000000001,7496.400000000001,紀元後の2000年の歴史の中で
7496.400000000001,7499.400000000001,周知の事実じゃん。
7499.400000000001,7502.400000000001,それを変な言い訳つけてやるような女とは
7502.400000000001,7505.400000000001,付き合えないなってなっちゃうと思う。
7505.400000000001,7508.400000000001,今更そんなこと言われたら。
7508.400000000001,7511.400000000001,女友達ないのに一人もいないね。
7511.400000000001,7514.400000000001,それを言う女は
7514.400000000001,7517.400000000001,マジで殴っていいぞ。
7517.400000000001,7520.400000000001,そういった女の子に言われたらぶん殴っていいよ。
7520.400000000001,7523.400000000001,口で言って分かんないんだったら
7523.400000000001,7526.400000000001,体で教えるしかないから。
7526.400000000001,7529.400000000001,メール相手が布団だったら
7529.400000000001,7532.400000000001,布団ちゃん家の親を殺しに行くから。
7532.400000000001,7535.400000000001,本当に多いわ。
7535.400000000001,7538.400000000001,マジで。
7538.400000000001,7541.400000000001,仕事で必要な連絡相手って言われたことがあったけど
7541.400000000001,7544.400000000001,浮気相手だったわ。
7544.400000000001,7547.400000000001,そうじゃなかったケースがなくない?
7547.400000000001,7550.400000000001,そうじゃなかったケースってあるの?
7550.400000000001,7553.400000000001,ないでしょ。
7553.400000000001,7556.400000000001,俺マジで信じられないわ。
7556.400000000001,7559.400000000001,クリスマスに10万渡して女と別れた話。
7559.400000000001,7562.400000000001,その当時の俺はそんな手切れ金も払えなかった。
7562.400000000001,7565.400000000001,クリスマスにお金がなかったから
7565.400000000001,7568.400000000001,バイトもしてなかったし
7568.400000000001,7571.400000000001,クリスマスプレゼントもらえないの?
7571.400000000001,7574.400000000001,今でも覚えてるよ。
7574.400000000001,7577.400000000001,エビスのタコ公園。
7577.400000000001,7580.400000000001,エビスのタコ公園の夜10時に
7580.400000000001,7583.400000000001,2人で話してて
7583.400000000001,7586.400000000001,何歳だっけ?
7586.400000000001,7589.400000000001,エビスのタコ公園の駅前で話してて
7589.400000000001,7592.400000000001,本当にないの?
7592.400000000001,7595.400000000001,1万円でこれで終わりにしよう?
7598.400000000001,7601.400000000001,今だったら
7601.400000000001,7604.400000000001,俺殴ってるんじゃないかな?
7604.400000000001,7607.400000000001,首元掴んで
7607.400000000001,7610.400000000001,足浮いてるんじゃないかな?
7614.400000000001,7617.400000000001,成長したね。
7617.400000000001,7620.400000000001,嫌がらせだ。
7620.400000000001,7623.400000000001,嫌味。
7623.400000000001,7626.400000000001,めっちゃ謝ってたから。
7626.400000000001,7629.400000000001,絶対にいいですって言って
7629.400000000001,7632.400000000001,絶対に別れますって言って別れた。
7632.400000000001,7635.400000000001,めっちゃ気分良かった。
7635.400000000001,7638.400000000001,すぐコブヘイト付き合った。
7638.400000000001,7641.400000000001,女の子殴ったことない。
7641.400000000001,7644.400000000001,お母さんを突き飛ばしたことしかない。
7644.400000000001,7647.400000000001,女の子に手を挙げたことはそれしかない。
7647.400000000001,7650.400000000001,キティちゃんのアタッシュケースを
7650.400000000001,7653.400000000001,半分に叩き割ったことある。
7653.400000000001,7656.400000000001,あまりにも腹立ったし
7656.400000000001,7659.400000000001,もう一気に蹴っ飛ばして
7659.400000000001,7662.400000000001,半分に叩き割ったことある。
7662.400000000001,7665.400000000001,実際に当たっちゃうと
7665.400000000001,7668.400000000001,ワッパーかけられちゃうからね。
7668.400000000001,7671.400000000001,窓から全部捨てた。
7672.400000000001,7675.400000000001,そういう
7675.400000000001,7678.400000000001,彼女殴られるレベルで
7678.400000000001,7681.400000000001,そういうのはしたくない。
7681.400000000001,7684.400000000001,彼女作るネットを利用していいと思う。
7684.400000000001,7687.400000000001,本来であれば利用しないといけない。
7687.400000000001,7690.400000000001,変なイデオロギーが形成されて
7690.400000000001,7693.400000000001,俺の中でも
7693.400000000001,7696.400000000001,それは悪いことだ。
7696.400000000001,7699.400000000001,自分で決めちゃったから。
7700.400000000001,7703.400000000001,女の子って意外にそういう感じだ。
7703.400000000001,7706.400000000001,幻想を抱きすぎてる。
7706.400000000001,7709.400000000001,浮気しない女の子に
7709.400000000001,7712.400000000001,一回も会ったことない。
7712.400000000001,7715.400000000001,浮気しない女の子は
7715.400000000001,7718.400000000001,ゼロ人だよ。
7718.400000000001,7721.400000000001,マジでするぞ。
7721.400000000001,7724.400000000001,男もするだろうけど。
7724.400000000001,7727.400000000001,友達とかでも
7727.400000000001,7730.400000000001,そう感じただけじゃない。
7730.400000000001,7733.400000000001,結局そうなんだけど。
7733.400000000001,7736.400000000001,でも本当にするな。
7736.400000000001,7739.400000000001,するなって感じた。
7739.400000000001,7742.400000000001,だから自分が
7742.400000000001,7745.400000000001,上に上がっていくしかない。
7745.400000000001,7748.400000000001,オンリーワンとか言ってくれる人
7748.400000000001,7751.400000000001,誰もいないから。
7751.400000000001,7754.400000000001,そのままでいいよ。
7755.400000000001,7758.400000000001,スマップのこと真剣に言われたぞ。
7758.400000000001,7761.400000000001,応援してるとバカを見るぞ。
7761.400000000001,7764.400000000001,コブ兵は
7764.400000000001,7767.400000000001,俺が悪かった。
7767.400000000001,7770.400000000001,完全に俺に火があった。
7770.400000000001,7773.400000000001,悪さをしすぎた。
7773.400000000001,7776.400000000001,コブ兵の時は浮気してたんだよ。
7776.400000000001,7779.400000000001,今でも覚えてる。
7779.400000000001,7782.400000000001,コブ兵に別れを告げられた。
7782.400000000001,7785.400000000001,コブ兵は明日他の女の子と
7785.400000000001,7788.400000000001,品川水族館に行ってくるよ。
7788.400000000001,7791.400000000001,ルスバン頼むよ。
7791.400000000001,7794.400000000001,コブ兵に悪いことしたな。
7794.400000000001,7797.400000000001,19歳の頃の俺だから。
7797.400000000001,7800.400000000001,それが
7800.400000000001,7803.400000000001,許される関係性だったんだって。
7803.400000000001,7806.400000000001,ウンコちゃんが東京で一番かっこいい女。
7806.400000000001,7809.400000000001,ワボリの女だよ。
7809.400000000001,7812.400000000001,私と別れた男だよ。
7812.400000000001,7815.400000000001,クズだよ。
7815.400000000001,7818.400000000001,一番クズ。
7818.400000000001,7821.400000000001,コブ兵が一番かっこいい女なんだよ。
7821.400000000001,7824.400000000001,それで俺が
7824.400000000001,7827.400000000001,水族館に遊びに行って
7827.400000000001,7830.400000000001,女の子が遊んでる間にコブ兵から電話がかかって
7830.400000000001,7833.400000000001,あんたには耐えられへん。
7833.400000000001,7836.400000000001,コブ兵は人生で人間を拒絶したことが一回もなかった。
7836.400000000001,7839.400000000001,私が男の人を振るなんてことは
7839.400000000001,7842.400000000001,一生ないよ。
7842.400000000001,7845.400000000001,私はどんなことされても絶対に平気だったのに。
7845.400000000001,7848.400000000001,暴力もされたことがあったし。
7848.400000000001,7851.400000000001,どんなつらいことされても
7851.400000000001,7854.400000000001,男の人を振ったことないのに
7854.400000000001,7857.400000000001,あなたはあかんって言われたんだから。
7857.400000000001,7860.400000000001,コブとはどこで仕合ったの?
7860.400000000001,7863.400000000001,京都で付き合ってた韓国人の友達。
7863.400000000001,7866.400000000001,他の女とエッチしてしまった。
7866.400000000001,7869.400000000001,それがマジで?
7869.400000000001,7872.400000000001,こういう会話で話してたの。
7872.400000000001,7875.400000000001,今度は
7875.400000000001,7878.400000000001,机の下に隠れてて
7878.400000000001,7881.400000000001,他の女とエッチしてる。
7881.400000000001,7884.400000000001,コブ兵は友達だった。
7884.400000000001,7887.400000000001,本当に無理だわ。
7887.400000000001,7890.400000000001,友達だった。
7890.400000000001,7893.400000000001,本当に
7893.400000000001,7896.400000000001,反省した。
7896.400000000001,7899.400000000001,彼女だったの。
7899.400000000001,7902.400000000001,布団はコブ兵してる。
7902.400000000001,7905.400000000001,コブ兵には会ったことない。
7905.400000000001,7908.400000000001,コブとはエッチしてた。
7908.400000000001,7911.400000000001,何でコブ兵だったの?
7911.400000000001,7914.400000000001,お前コブ兵だ。
7914.400000000001,7917.400000000001,コブは何してるの?
7917.400000000001,7920.400000000001,一年前に電話で話して
7920.400000000001,7923.400000000001,今度遊ぼうね。
7923.400000000001,7926.400000000001,その遊ぶ日に俺がバックライフ。
