start,end,text
0.0,5.36,ん なんか適当にしゃべって終わる
5.6000000000000005,8.68,や疲れたなんか
18.240000000000002,20.8,ちょっと待ってねー
20.92,23.44,待てい
24.44,28.720000000000002,うわぁいっ 波に乗りかけたんだけどなぁ
29.8,32.160000000000004,一瞬な
36.8,39.84,いやでもなぁれはちょっとさぁ
40.52,43.44,悲劇だった正直
45.64,48.120000000000005,悲劇だったね
48.120000000000005,53.00000000000001,なんかテーマ決めてアナズベ 決めていいお前がじゃあ貴様が
53.00000000000001,59.120000000000005,"サイレントヒルズあのさあの ps 3でさぁ なんか1,2,3みたいな出てるでしょ"
59.120000000000005,64.52000000000001,あれやろうかな俺プレス3じゃないとさ画面が汚くてもやる気しねえんだよな
64.52000000000001,69.52000000000001,ファストボーラーってよくあれプロ野球選手に慣れたな
69.52000000000001,75.12,なんか俺さ無惨にやられてたイメージがあるんだけど 暁大付属にさボッコってやられてた
75.12,81.44,なんかさもうちょっと胃もたれするぐらいさ長いパープルやりてーなパープルの作説で一番長いの何だろう
82.72,87.68,パープルの作説で一番長い作説それやりたいな
89.68,94.48,やっぱてんだよねやっぱねー 銃投げようなめちゃくちゃ
94.48,99.12,なんでねそのなんていうの海外留学とかもやりたいなぁ
99.12,105.12,ドラフトもまあ面白い確かに ドラフトもまあ面白いあれは
105.12,110.12,後々やっていきたいなっていうのは サイレントリー動画見たけど面白かったぞ
110.12,115.12,それその程度なんだな所詮 面白いぐらいじゃやる気がしねえ
115.12,119.12,もっとなんかチーワキに行く踊るような愛心がしたいんだよ
119.12,124.12,よって却下 社会的なことはね
124.12,131.12,時間の長さで言ったら15は相当長いパープル2009かやってたぞ俺あれって難しすぎじゃない
131.12,136.12,パープル2009難しすぎじゃないちょっと
142.12,147.12,パープル2009は長いかな
147.12,158.38,今日めっちゃ重かったマジで
158.38,161.38,うんこラジオちょっとできねーわ 今日
161.38,162.46,できない
162.46,163.46,土曜日しかできない
163.46,164.46,今日日曜日だろ
164.46,165.46,うわー惜しい
165.46,166.86,土曜日だったらやってたのに
166.86,169.98000000000002,残念
169.98000000000002,172.70000000000002,もう少しだったわ
172.70000000000002,173.70000000000002,15じゃなくて13
173.70000000000002,175.44,13やったことねーな
175.44,180.07999999999998,全く触れたこともないね
180.07999999999998,181.07999999999998,13人
181.07999999999998,184.28,ちょっとなんかあれなんだよ
184.28,187.56,あのー俺の近くの家の近くのゲオ で
187.56,188.56,パワプロがね
188.56,191.48,なんかもう全部セットで抱き合わせ 売ってたの
191.48,193.16,買ってこうかなと思ったんだよね
193.16,194.16,あのーなんていうの
194.16,195.6,シックスぐらいから
195.6,196.6,全部さ
196.6,198.92,てか最近さパワプロの多数
198.92,201.92,出まくりじゃねー
201.92,203.84,パワプロの多数
203.84,207.32,みんなもう多数動画って言ったら パワプロみたいな
207.32,209.04,あれ最高なんだけどはっきり言って
209.04,210.04,あのバカども
210.04,212.52,もっとあげろバカども
212.52,213.52,クズどももっとあげろ
213.52,215.28,あげる機会になれ
215.28,218.28,自分の自分の生活を粉にして
218.28,219.28,あげてくれ
219.28,222.32,シックスかでもあれだね
222.32,224.84,プレイステーション版のパワプロ は
224.84,225.84,もうなじまない
225.84,232.44,なんか海の中でゲームやってる みたい
232.44,236.44,パワプロ8の多数は面白かった ね
236.44,238.44,パワプロ8の多数はすごい面白かった
238.44,239.44,じゃあもうあげなきゃ
239.44,240.44,あげてくれ
240.44,243.07999999999998,あげてくれ頼むから
243.07999999999998,246.72,11は帝王で簡単にクソ強いの できるしな
246.72,247.72,なんかちょっとあれだよね
247.72,250.6,俺さ野球ゲームやりたいんだけど
250.6,252.24,違うゲームやりたいんだよな
252.24,253.52,パワプロもやっただろ
253.52,254.88,プロスピアなんかね
254.88,256.6,あれ配信でやるゲームじゃなかった
256.6,257.6,マジで
257.6,261.84,配信でやるゲームじゃなかった
261.84000000000003,262.84000000000003,俺がやった感じ
262.84000000000003,264.44000000000005,今1回しかやったことないけど
264.44000000000005,265.44000000000005,1つしか
265.44000000000005,268.00000000000006,いやファミスタもできねぇな
268.00000000000006,269.00000000000006,インフル治ってない
269.00000000000006,270.20000000000005,多分重症化してきてる
270.20000000000005,271.20000000000005,ほんとに
271.20000000000005,273.08000000000004,泳いでる中みたい
273.08000000000004,276.16,泳いでるみたいな感じ今
276.16,277.16,パワポケか
277.16,279.24,前から言ってんだけどねパワポケ
279.24,280.24,野球つくだからさ
280.24,281.24,新作出してくれや
281.24,282.24,もう野球つくだったら
282.24,283.24,フラゲして破棄するわ俺
283.24,284.24,マジで
284.24,286.48,ほんとに
286.48,290.08000000000004,なんでさ今開発を途中で断念 してんの
290.08000000000004,291.68,野球つくの民はさ
291.68,295.40000000000003,もっと開発してほしいんだけど
295.40000000000003,297.0,プロスピ2012今までより
297.0,298.0,でも俺もう
298.0,299.88,多分ああいうゲーム好きじゃない と思うなんか
299.88,302.72,今まで結構3回くらい買ってるんだけど
302.72,304.32,多分10時間以上やってないと思う
304.32,307.8,前作
307.8,310.76,前作やってないんだよな
310.76,313.12,なんかねダメなんだよ
313.12,314.12,確かにね
314.12,317.48,すごい良いと思うんだけどさ
317.48,318.48,さかつくに持ってかれてる
318.48,319.48,ほんとだよね
319.48,320.48,サッカーなんて
320.48,323.12,俺今見てんのサッカー
323.12,325.20000000000005,話題にすらわかんないじゃん
325.20000000000005,327.96000000000004,サッカーって今日本でプロサッカー リーグあんの
327.96000000000004,328.96000000000004,日本で
328.96000000000004,333.52000000000004,俺そのぐらいのレベルなんだけど
333.52000000000004,334.52000000000004,ないの
334.52000000000004,336.48,女子は頑張ってるよな
336.48,338.36,野球つくつくれよマジで
338.36,341.48,野球つく
341.48,343.04,野球つくつくってくれよ
343.04,345.72,ほんとに
345.72,346.96000000000004,キャプツバ3とか面白かった
346.96000000000004,348.64000000000004,スーファミドだろ
349.15999999999997,351.56,ファッションタンスピード
351.56,353.08,あれいいゲームだったよな
353.08,354.52,ガッツとかあげてさ
354.52,359.32,あれやりたいわ俺むしろ
359.32,360.59999999999997,タミフル飲んだ
360.59999999999997,362.71999999999997,なんか熱出たてしか飲めねえんだよな
362.71999999999997,364.88,なんか高貴な薬だって聞いたぜ
364.88,366.24,飲みますって
366.24,368.15999999999997,僕が飲みますって
368.15999999999997,369.12,死んじゃうもん集めて野球場
369.12,371.76,誰か企画してじゃ
371.76,373.47999999999996,俺って名乗らずに参加できるような
373.47999999999996,375.24,俺も
375.24,376.03999999999996,そういうのやって
376.03999999999996,377.52,この中にうんこちゃんいるかもしれない
377.88,379.44,やも知れないみたいな
379.44,380.88,それぐらいのノリでできるような
380.88,387.52,野球大会開いて
387.52,388.59999999999997,今ね熱は測ってない
388.59999999999997,390.03999999999996,結構あると思う
390.03999999999996,390.76,声で分かるやべえだろ
390.76,392.91999999999996,だんだん俺今張ってこれぐらいだからね
392.91999999999996,396.2,頑張って
396.2,397.32,ちょっと今からもうつかない
397.32,398.52,パワプラ終わり
398.52,400.56,スパロウかスパロウはできねえな
400.56,404.12,あれなんか思い入れも強くないし
404.12,406.76,なんかやってたんだけどね
406.76,410.4,昔ね昔やってたんだけど
410.4,412.64,いや明日休み休まざるを得ないだろ
412.64,413.76,インフルなんだし
413.76,415.71999999999997,下熱したら電話くださいって言われた
415.71999999999997,419.15999999999997,俺下熱下熱がサインらしい
419.15999999999997,426.08,なんか熱下がったら連絡してきてみたいな
426.08,427.28,まさなスパロボといえばシンスカ
427.28,428.52,ほんとだよくできたと思う
428.52,430.71999999999997,俺スパロボの配信が一番難しいと思う
430.71999999999997,432.32,その配信ゲーム配信の中で
432.32,434.59999999999997,だって喋ることねえじゃん
434.64000000000004,437.72,長く作っていきたくない
437.72,438.92,流れないし
438.92,441.8,なんかそのあれもね
441.8,442.64000000000004,明日配信しない
442.64000000000004,444.40000000000003,なんかちょっとまったりするわ
444.40000000000003,445.68,じゃあ欲しいものがあるんだ
445.68,449.32000000000005,明日買い物行きたい
449.32000000000005,451.12,買い物行きたい
451.12,452.0,インフルで診断取れたの
452.0,454.28000000000003,一応なんか鼻にさメンボ突っ込んでさ
454.28000000000003,455.44,あれ超気持ち悪いだろ
455.44,459.0,グリグリグリグリやられてさ
459.0,461.84000000000003,もったいねえだろおめえ
461.84000000000003,465.40000000000003,せっかくお前たまの休みなんだからさ
465.40000000000003,469.40000000000003,ちょっとあれだよね
469.40000000000003,472.20000000000005,なんかあれしたいな
472.20000000000005,476.28000000000003,出かけたいな少し
476.28000000000003,477.08000000000004,もったいねえだろ
477.08000000000004,477.92,モンスターファンか
477.92,480.04,今4だったらあるな
480.04,482.56000000000006,俺が前やったのっていくつ
482.56000000000006,484.20000000000005,そこの時期に今流行ってるらしいよ
484.20000000000005,485.08000000000004,インフルエンザ気をつけろ
485.08000000000004,487.88000000000005,おめえらも今インフル流行ってるらしいぞ
487.88000000000005,491.68,ちなみになんか最近流行ってるんですよ
492.24,495.04,女の先生が
495.04,496.40000000000003,インフルって診断されるまで結構時間
496.40000000000003,497.68,いや10分15分だったよ
497.68,499.48,ちょっと待っててくださいって言われて
499.48,500.32,5分ぐらいだった
500.32,502.6,5分10分でどうぞって言われて
502.6,505.24,あなたインフルエンザですよって言われたよ
505.24,507.0,インフル流行ってるよな
507.0,509.6,マジでB型俺もB型
509.6,514.76,そう2日間ぐらいならサパ読める
514.76,517.44,なんだそれサパ読める
517.44,518.44,だからすげえ辛いんだよ
518.44,519.48,マジで今
519.48,523.8000000000001,たぶん今木酸クドニブ
523.8000000000001,525.2,たぶんもうこれで配信来たら
525.2,527.0,俺もうバタンってなると思う
527.0,529.0,ギオンがたぶん具現化されると思う
529.0,533.0,バタンつって
533.0,534.52,4は長期プレイ向きだから
534.52,537.48,なんかあれ天聖の儀式とかあんの
537.48,539.16,薬はたぶんタミフルってやつだと思う
539.16,540.48,タミフル
540.48,547.44,なんかニチャンを思い出したから俺
547.44,548.64,俺昔インフルの診断された時
549.36,551.4,タイミングにもよるんじゃないの
551.4,553.96,分かんないけど
553.96,556.3199999999999,タイミングにもよるんじゃないの
556.3199999999999,557.12,なんでテンション上げてんの
557.12,558.28,いや別にそういうわけじゃないけど
558.28,561.6,なんかその生活のサイクルが崩れるのが嫌じゃん
561.6,563.4,ストーリーが長いなるほど
563.4,565.92,俺今ゲーム何やるか見てくるわ
565.92,568.0,明日予告先発TDNの件
568.0,570.0,ホモのビデオでも出てけすげえ
578.64,592.72,サクッとできるゲームが落書き報告しかねえわ
592.72,595.56,なんかさやたらホモってさあれだよな
595.56,597.24,俺別に嫌いじゃねえの正直ぶっちゃけ
597.24,598.56,俺ゲイバーとかも行くし
598.56,600.12,俺ホモじゃねえけど
600.12,601.4399999999999,なんかさやたらさ
601.4399999999999,603.48,ホモだけ差別されているみたいなさ
603.48,608.08,あれ何なのあの訴え世界でのあの動き
608.12,610.8000000000001,あの動きは何なの世界でのあの動きは
610.8000000000001,613.6,ダニエルラドクリフとかもさ言ってんじゃん
613.6,616.4000000000001,ゲイだけが差別されているみたいな
616.4000000000001,618.8000000000001,そんなことねえだろ
618.8000000000001,621.08,そんなことなくねえかみたいなさ
621.08,623.64,ゲイばかりが差別されるこの世の中でみたいなさ
623.64,629.9200000000001,そんなことねえ気がすんだけどな俺
629.9200000000001,631.5200000000001,性的マイノリティの主張がすごいのは
631.5200000000001,633.9200000000001,まあそうだよな多分な
633.9200000000001,635.0,テレビのキモい若者さえ
635.0,639.96,それを何かあいつらいわく地位向上に
639.96,643.84,あれすんだろ貢献してんだろ
643.84,644.92,お前ドラグインのデータセーブ
644.92,645.72,消えるまで待ってんだろ
645.72,647.28,パソコンぶっ壊れるまで平気なんじゃねえか
647.28,651.56,俺M出し
651.56,655.72,うんこホモ友達ホモの友達いないな多分
655.72,656.96,このチャットだと女の方が差別
656.96,657.6,いや差別してるんじゃない
657.6,658.96,区別してんだよ男と女
658.96,660.52,そこの辺はしっかりしないといけねえだろ
660.52,663.48,よし足の判断していかないといけねえんだよ
663.48,678.48,こういう時はなゴミ捨ててくるわ
678.48,682.4,とりにこの前今日何話を全然覚えてねえんだけど
682.4,684.32,実際ここでも気もがってるやつ多いから
684.32,687.12,まあそうだな実際いるだろうね
687.12,688.76,この前ホモがうんこちゃんにメール送ってたけど
688.76,690.9200000000001,読んだまあ結構読んだね
690.9200000000001,692.48,ちょっと待ってメール紹介のコーナー
692.48,693.44,なんかあいつからメール来てたら
693.44,698.44,そういえば自衛隊のやつからそういえば
698.44,708.48,この場を借りてちょっと
708.48,714.16,マックフィーうざいわ本気で
714.16,722.24,マックフィーが
722.24,723.28,ちょっと待ってね
723.28,724.92,なんだこれうんこちゃんライム
724.92,731.3199999999999,チャットの配信用の設定について
731.3199999999999,733.8399999999999,できてんじゃないのかうまく
733.8399999999999,734.9599999999999,おまじかちょっと待って
734.9599999999999,736.28,すげー神がいる
736.28,738.04,ライムチャットのコメントの時刻と
738.04,740.36,名前表示の設定方法について説明させていただきます
740.36,742.88,ライムチャットの設定画面から
742.88,744.28,ちょっと待ってね
744.28,749.24,表示テーマ設定画面どこだ
749.24,757.96,これがちょっと待って設定画面から
757.96,763.0,メッセージつまで表示テーマ
763.0,768.76,メッセージ時刻消して
768.76,772.96,ニックネームを空白にする
772.96,784.48,よりはできんじゃねーか
784.48,786.4399999999999,誰のコメントが全然わかんない
786.4399999999999,788.4399999999999,全部一部になってるけど大丈夫
788.4399999999999,797.92,これ全てが一部になっちゃってるけど
797.9200000000001,800.5200000000001,めちゃくちゃ見づらくないこれ
800.5200000000001,805.48,どこで区切ってんの
805.48,808.1200000000001,時間だけ消してあれしようぜ
808.1200000000001,810.2400000000001,時間を消せるのはでかい
810.2400000000001,812.32,なんかごめんな
812.32,814.96,時間だけ表示しておけば良くない
814.96,819.8000000000001,コメントしてあーって
819.8000000000001,823.5200000000001,ちょっと右やったら見やすくなる
823.56,830.92,ニックネームだけとかの方がいいのか
830.92,833.52,わからんこの辺の設定は
833.52,835.16,よしよしをちょっとうまく
835.16,846.52,勘別していく方法あれが必要だね
846.52,848.04,一応さっきの設定に戻しておくわ
848.04,849.0,ニックネームどうするんだよ
849.0,850.96,これがなんだこれ
850.96,852.1600000000001,時刻決してニックネームだけに
852.1600000000001,857.4000000000001,すればいいんじゃないか
857.4000000000001,860.36,ほらこれだろ
860.36,861.0400000000001,ニックネームなんて
861.0400000000001,865.0400000000001,どうせさ見えないんだしさ
865.0400000000001,879.52,これが一番の一番のあれだな
879.52,881.4,ちょっと待ってね
881.4,883.72,次回に向けて調整をしておかないとさ
883.72,890.12,パッとやってサッとさ割れるような
890.12,892.84,そういう設定にしていく
892.84,894.92,キーワードじゃなくてなんだっけ
894.92,904.48,ログテキストこれがそんで
904.48,912.04,ニックネームを本当4とかでしょか
912.04,916.4,4じゃ見づらいな10にしとこ
916.4,929.24,10にして発言も10にしとけば
929.24,931.96,めちゃくちゃめちゃくちゃ見やすくない
931.96,940.0400000000001,これ勉強できる人のノートみたいな感じでね
940.0400000000001,951.52,これでいいんじゃないの
951.52,953.1600000000001,見えねえのはちょっとまだ調整で
953.16,969.8399999999999,何とでもなるだろう
969.8399999999999,971.8,時間は消えてるからなんだっけ
971.8,976.4399999999999,ニックネームの本当じゃちょっと落とすとか
976.4399999999999,977.3199999999999,8位ぐらいにしておくか
977.3199999999999,982.4,ちょっとこの辺は区別していかなきゃ
982.4,983.36,文字が小さいのか
983.36,987.0,お腹すげー住み心地のいい何かあれだね
987.0,989.8,えぼしのような気分で俺はここ住みやすい
989.8,992.6,村にしようって言った
992.6,994.52,えぼし様そんな感じで
994.52,1021.48,まさに
1021.52,1022.64,これぐらいがあれか
1022.64,1040.16,9台点かぼちぼちだな
1040.16,1041.76,妥協点がもうないからね
1041.76,1045.08,いつまでもやってると
1045.08,1049.24,俺さなんかその名前いらないですよ
1049.24,1050.28,じゃあお前消せ
1050.28,1051.6399999999999,なんとかして無理だ
1051.6399999999999,1054.08,なんかこのさっきそれをやってみたら
1054.08,1058.04,とんでもないことだったんだ
1058.04,1067.28,気にするな貴様が整理整頓できたんじゃないか
1067.28,1070.8799999999999,これは整理整頓
1070.8799999999999,1072.0,まあそうだよ
1072.0,1075.76,この方が多分コメントが全体的に見やすい
1075.76,1077.48,定期的にメール来る人ってどれぐらい来るの
1077.48,1078.8,毎日来るよ
1078.8,1080.72,毎日送ってくれてるよ
1080.72,1081.96,1人2人だけどね
1081.96,1086.12,そいつはで他の奴が2、3人多い時で5人ぐらい
1086.12,1087.0,みたいな
1087.0,1089.2,で俺はそれに目を通す日々みたいな
1089.2,1091.68,そんな感じかないつも
1091.68,1094.08,今日の奴らはクズだなみたいな感じで
1094.08,1095.68,面白くねメールは全部ゴミ箱に捨てるわ
1095.68,1098.6,すぐすぐ様
1098.6,1099.68,どうせコメント読んでるよ
1099.68,1100.3999999999999,メールだったら読むよ
1100.3999999999999,1103.3999999999999,だって楽じゃんコメント読むより
1103.3999999999999,1105.36,暇の時にさ電車の帰り道
1105.36,1107.44,帰り道の電車の中
1107.48,1109.48,iPhoneで見るみたいな思考だな
1109.48,1110.44,1日ずつも来ない
1110.44,1111.3600000000001,ずつも来ない
1111.3600000000001,1114.8,多くて誤通とかじゃない
1114.8,1115.64,多くて誤通
1115.64,1118.48,掲示板は見てないほとんど
1118.48,1122.3600000000001,たまに2、3日に1回全部見るよだから
1122.3600000000001,1125.0800000000002,定期的に追ってるわけじゃない
1125.0800000000002,1126.4,定期的に追ってるわけじゃないけど
1126.4,1130.24,一応目は通すよ全部
1130.24,1133.0,目はしっかり通してる
1133.0,1134.8400000000001,毎日来る一応毎日来る
1134.8400000000001,1136.04,コンスタントには来るけど
1136.04,1138.84,誤通ぐらいじゃない多くて
1138.84,1140.12,そんなこと言ってたらくずめるより
1140.12,1142.28,でも見ないから大丈夫そんなの
1142.28,1144.52,スルー
1144.52,1147.3999999999999,スレの紹介とかが配信で言われると嬉しい
1147.3999999999999,1151.3999999999999,なんかあったっけそんなの
1151.3999999999999,1154.6,うんこちゃん私の脇見たか見たって見たって
1154.6,1156.76,なんなら1回オーナーに仕掛けたよ
1156.76,1160.04,おめーの脇で自分の自我が
1160.04,1162.24,なんかそうさせなかったけどね
1162.24,1164.48,メール確認して暇ってことですよ
1164.48,1166.3600000000001,それじゃそういうわけにいかねえんだよな
1166.3600000000001,1172.1200000000001,なかなかそういうわけにいかねえんだよな
1172.1200000000001,1173.6,明日が助けたエボシを見て
1173.6,1175.08,やつだけ教えてくれた
1175.08,1176.44,さんの時なんだが可愛い
1176.44,1177.6,分かってんじゃねえかよ
1177.6,1179.16,おめーもようやく俺の行きまで
1179.16,1179.92,たどり着いたやつが
1179.92,1181.6,ちらほら出てきてるな
1181.6,1184.3600000000001,もののけマニアもののけマニアの
1184.3600000000001,1188.2,行きまで達してるよお前は
1188.2,1191.52,もうよせなんとか罰は受けているだろ
1191.52,1192.64,俺全部覚えてるから
1192.64,1193.96,俺セリフ全部言えるから
1193.96,1196.16,このシーンの明日がなんつったって聞け
1196.16,1196.64,もうあれだな
1196.64,1198.28,工事園みたいな感じだな
1198.28,1201.24,もうよせ罰は受けているって言ってるから
1201.24,1203.56,その時明日かひこは
1203.56,1204.3600000000001,明日かひこっていうかな
1204.3600000000001,1205.6000000000001,俺はフルネームで呼ぶから
1205.6000000000001,1209.48,名前間違えたら最悪の声だから
1209.48,1212.48,全部俺知ってるから
1212.48,1214.96,なんかジブリ見んの
1214.96,1215.64,まぁもうあれだね
1215.64,1218.96,ジブリしか見ないような感じだな
1218.96,1225.04,俺は最初のセリフ覚えてないそれは
1225.04,1231.68,すまんなんか山が出てくるって覚えてる
1231.68,1232.32,今何してんの
1232.32,1233.3600000000001,今ちょっと配信してる
1233.3600000000001,1235.32,もうぼちぼち終わろうかなっていう
1235.32,1238.92,終焉のムードで終焉のムード
1238.92,1240.92,じゃあ明日かひこの最初のセリフ覚えてんだけど
1240.92,1242.44,じゃあ雰囲気は覚えてんだけど
1242.44,1243.64,セリフだけ覚えてないんだな
1243.64,1245.8,山がザワザワしているみたいな
1245.8,1247.32,そういう感じだよね
1247.32,1249.6,あのね意味わかんねえさ
1249.6,1252.0,小屋を掘ったて小屋をちょっと
1252.0,1253.12,登っていくみたいな
1253.12,1255.12,最後のセリフはお前感動するぞ
1255.12,1257.2,お前ティッシュ言う?いい?
1257.2,1257.8799999999999,会いに行くよ
1257.8799999999999,1260.08,ヤックルに乗ってカラカラカラカラン
1260.08,1261.6799999999998,カランって終わる
1261.6799999999998,1264.4399999999998,あの首がくるくる回るやつ360度
1264.4399999999998,1266.36,おおなんだっけ曲がるやつがさ
1266.36,1269.04,言うよね最後に
1269.04,1272.24,人間は嫌いでも明日が好きみたいな
1272.24,1273.3999999999999,また会いに来てくれるかな
1273.3999999999999,1275.0,みたいなこと言うんだ山が
1275.04,1277.4,会いに行くよヤックルに乗って
1277.4,1280.8,トゥルートゥルーみたいな
1280.8,1281.8,カラカラカラカラン
1281.8,1283.84,カランってさ小玉
1283.84,1285.28,それで三宅博
1285.28,1286.48,性犯罪者なごめんなちゃんと
1286.48,1289.68,それはそれは正直にあの言ってあげないと
1289.68,1291.4,三宅博っていう名の覚醒剤グルーの
1291.4,1294.8,性犯罪者があの張り詰めた
1294.8,1297.6,指紋みたいなくるんだよ
1297.6,1300.16,ちょっと見てえなめちゃくちゃ
1300.16,1300.88,脳内サイトできたら
1300.88,1304.68,ちょもののけ姫マジ見ていくんで
1304.68,1306.0,最初は森が騒いでいるじゃなかった
