start,end,text
2689.0,2691.0,そういう何の根拠もない自信を持ってる人ってさ
2691.0,2693.0,そうそうそうそう
2693.0,2695.0,すごく
2695.0,2697.0,良くない
2697.0,2699.0,人としての魅力高くない
2699.0,2701.0,炎上して果たしての
2701.0,2703.0,ああ
2703.0,2705.0,そう元気になるっていうか
2705.0,2707.0,羨ましいよね
2707.0,2709.0,俺本当にそういうの全然ないから
2709.0,2711.0,いろんなこと考えてるじゃん
2711.0,2713.0,ちょっとエアコンつけるわ
2713.0,2715.0,俺無職だけど
2719.0,2721.0,だから俺さ
2721.0,2723.0,あれなんだよ
2723.0,2725.0,自衛隊のやつとかもさ
2725.0,2727.0,本当に雇いてるんだよね
2727.0,2729.0,あんだけ俺に忠義を尽くせるやつがさ
2729.0,2731.0,いねえだろ
2737.0,2739.0,マジで会社辞めたよ
2739.0,2741.0,何も考えずにバカになれるやつの
2741.0,2743.0,1割は成功する
2743.0,2745.0,俺もそう思う本当に
2745.0,2747.0,だからあいつなんかやった方がいいと思うんだよね
2747.0,2749.0,ちゃんとパズドラなんかやってねえでさ
2749.0,2751.0,もう20後半なんだからさ
2751.0,2753.0,なんかもったいねえ気がする
2753.0,2755.0,なんかあいつさ
2755.0,2757.0,比較的行動力もあるじゃん
2757.0,2759.0,だってさ普通20代後半でさ
2759.0,2761.0,芸能人になりてえってさ
2761.0,2763.0,こっち出てくる人いないじゃん
2763.0,2765.0,その1割ってただ運がいいやつだけど
2765.0,2767.0,いやでもさ
2767.0,2769.0,行動も起こさないとさ
2769.0,2771.0,それも絶対にもうゼロじゃん
2771.0,2773.0,そのリスクを背負って行動できるやつっていうのが
2773.0,2775.0,羨ましいなってこと
2775.0,2777.0,自分にはできないことだから
2781.0,2783.0,良くない?
2783.0,2785.0,山口だってコンビニ店員から教授に入ったしな
2785.0,2787.0,それはちょっと違うけど
2787.0,2789.0,あいつもでもずぶてえよな
2789.0,2791.0,そうだよね
2791.0,2793.0,人生そんな守るべきものないんだから
2793.0,2795.0,あいつガンガン色んなことやればいいのにね
2797.0,2799.0,まあその結果
2799.0,2801.0,あの年成功してないけど
2801.0,2803.0,いやでもこれからだろ
2803.0,2805.0,やるとしたら
2805.0,2807.0,20代前半の人やれることなんてほとんどねえよ
2807.0,2809.0,俺も27だけどさまだ
2809.0,2811.0,人生をたっかんしてるように語るけどさ
2811.0,2813.0,今だからこそできることって
2813.0,2815.0,いっぱいあるけどさ
2815.0,2817.0,会社作るにしても
2817.0,2819.0,20代前半じゃ
2819.0,2821.0,それは親の才能があったらできるけど
2821.0,2823.0,それと特別な才能たまにいるよね大学でさ
2823.0,2825.0,起業してなんかもう
2825.0,2827.0,上昇起流持ってるやつ
2827.0,2829.0,そうなのにバレてない?
2829.0,2831.0,本人はやっぱ25半くらいだよね
2831.0,2833.0,やるとかにしてもさ
2839.0,2841.0,まあもう遅いなんてことは
2841.0,2843.0,年齢は言い訳にしちゃいけねえよな
2843.0,2845.0,そうそうそう西村ひろゆきとかさ
2845.0,2847.0,ああいうのは特別じゃない?
2847.0,2849.0,2000万で借金する親の子だぞ
2849.0,2851.0,スケールがでかいじゃん
2851.0,2853.0,スケール超でかくない?
2853.0,2855.0,親が2000万借金背負ってるんだろとかあんま聞かなくない?
2857.0,2859.0,逆に転じることもあるかもしれない
2859.0,2861.0,スケールでかいなと思ったんだよ
2861.0,2863.0,俺それ聞いたとき
2863.0,2865.0,俺絶対やだよそんなの
2865.0,2867.0,絶対無理だけど
2867.0,2869.0,スケールのでかい家に
2869.0,2871.0,だからあいつあんなにスケールがでかいんだろうな
2871.0,2873.0,なんかあいつそういう
2873.0,2875.0,潜在能力の高さあるじゃん
2875.0,2877.0,そうだよね
2877.0,2879.0,プラスにもマイナスにも振り幅でかいよね
2879.0,2881.0,俺すっごいさ
2881.0,2883.0,狭いからさ振り幅が
2883.0,2885.0,すごいよね2000万の借金背負えるって
2885.0,2887.0,すごいことだよね
2887.0,2889.0,でも普通の人生が一番じゃない
2889.0,2891.0,そうだけどね
2891.0,2893.0,俺もそう思ってるんだけど
2893.0,2895.0,20代のうちに失敗するんだったら20代かなと思って
2895.0,2897.0,貯金ゼロになっちゃいました
2897.0,2899.0,30からまた貯め始めることできるけどさ
2899.0,2901.0,30代でさ貯金ゼロになっちゃいました
2901.0,2903.0,ってちょっと人生をさ
2903.0,2905.0,左右しかねなくない?
2907.0,2909.0,吉野部の父親は借金60億だよ
2909.0,2911.0,スケールでかいだろ
2911.0,2913.0,だからあんなにスケールでかい男に育ったんだよ
2913.0,2915.0,返しただろ全部高橋吉野部が
2915.0,2917.0,読売売れが肩替わりしたんじゃないの
2923.0,2925.0,すげーよな
2925.0,2927.0,あいつ借金あったときのほうが高いんじゃないの
2929.0,2931.0,6億だっけ
2931.0,2933.0,6億だっけ
2933.0,2935.0,60億確かにそれでかかるのは無理だよな
2935.0,2937.0,6億か
2937.0,2939.0,寝るわ今口座り30円しかないぞやばくねーか
2939.0,2941.0,犬野郎さん大丈夫なの
2945.0,2947.0,国が傾く
2947.0,2949.0,6億でも大変だけどね
2951.0,2953.0,すげーよスケールのでかい男だよね
2953.0,2955.0,6億借金背負ってたら
2955.0,2957.0,60かほんとに60やな
2961.0,2963.0,うんこちゃんもうすぐ30じゃないそうだろ
2963.0,2965.0,だからその30になる前に
2965.0,2967.0,ある程度失敗するにせよ
2967.0,2969.0,なんかやっておかなきゃなーと思ってんだけどね
2971.0,2973.0,損の励って100億寄付したんだよね
2973.0,2975.0,きちがいすごいよね
2975.0,2977.0,すげーと思った
2977.0,2979.0,なかなか100億100
2979.0,2981.0,あのー寄付できねーよね
2981.0,2983.0,企業すればいいってもんじゃないぞ
2983.0,2985.0,いやそうは思ってないけどなんかやりたいじゃん
2987.0,2989.0,別に暇だからやるってわけじゃなくて
2989.0,2991.0,そういうさ
2991.0,2993.0,挑戦をしてみたいな
2993.0,2995.0,って思うときない
2995.0,2997.0,いい企業に入ってなんか
2997.0,2999.0,幸せな生活を送ってたら
2999.0,3001.0,そういうこと思わないんだろうな
3001.0,3003.0,高田はまだ27だけど
3003.0,3005.0,ゼルプロの高田より年上の奴らは積んでると思う
3005.0,3007.0,そうかな
3007.0,3009.0,水池も十分積んでると思うけど
3009.0,3011.0,俺的に
3011.0,3013.0,まだって言えるとしてないけどな
3013.0,3015.0,27って
3015.0,3017.0,じゃない?
3017.0,3019.0,水池積んでんだろ
3019.0,3021.0,だからもったいねパソコンなんかやってねーぞ
3021.0,3023.0,いろいろやったほうがいいのにさ
3023.0,3025.0,もったいねーよマジで
3025.0,3027.0,なんかあいつの時間
3027.0,3029.0,俺に欲しいわマジ
3032.0,3034.0,23で積んでる俺みたいなもん
3034.0,3036.0,いや23では積んでねーよ何してても
3036.0,3038.0,中卒でも積んでねーよ23だったら
3038.0,3040.0,いくらでもやり直し聞くだろ
3040.0,3042.0,今から大学行き直したとしても28だろ
3042.0,3044.0,水池よりいいじゃねーかよそしたら
3045.0,3047.0,1年勉強したとして
3049.0,3051.0,竹内でも竹内なんだよ将来明かりいいだろ
3051.0,3053.0,まだあいつ21とか2どこだろ
3053.0,3055.0,いくらでも修正聞くじゃねーかよ本人にやる気があればね
3058.0,3060.0,音竹みたいなやつかもしれないぞ
3060.0,3062.0,あいつ積んでねーしな
3062.0,3064.0,要は自分の気の持ちようなんじゃない
3066.0,3068.0,別にそれを食うと思わずにさ
3068.0,3070.0,彼のようになんか
3070.0,3072.0,巨額の富を得てる人もいるしさ
3080.0,3082.0,人生積むことなんてそうそうないよね
3082.0,3084.0,ほんとに
3084.0,3086.0,俺の弟紹介しただけで積んでないからお前は別に紹介してねーんだろ
3086.0,3088.0,積んでねーんじゃないか
3088.0,3090.0,公転するときは来るよ絶対
3092.0,3094.0,絶対って言葉つけてもいいな
3094.0,3096.0,そんなに
3096.0,3098.0,悪いことばっかりじゃねーだろ
3098.0,3100.0,水池さんって一生売り立て生きてくるの
3100.0,3102.0,あいつもなんか人当たりがいいから
3102.0,3104.0,なんだかんだでどっかで拾われるんじゃね
3104.0,3106.0,そんな気がしない
3106.0,3108.0,俺そういう気がすんだけど
3110.0,3112.0,横浜みどりって積んでる?
3112.0,3114.0,俺あの辺だったけどちょっと積んでる気がする
3114.0,3116.0,今は楽しそうだけど
3116.0,3118.0,その典型的な例っていうか
3120.0,3122.0,俺のダウン症のいとこもドラム頑張ってる
3122.0,3124.0,そうだよね
3124.0,3126.0,あんまりそれを言い訳にしても
3126.0,3128.0,しょうがないことだからね
3132.0,3134.0,プラスに考えるとは言わないけど
3134.0,3136.0,いつまでもそうやって考えててもしょうがないよな
3140.0,3142.0,やり方次第でいくらでも
3142.0,3144.0,稼げるともう起業しなくて
3144.0,3146.0,でもなんかやっぱさそういう
3146.0,3148.0,肩書きって人生に必要じゃん
3150.0,3152.0,じゃない?
3154.0,3156.0,それは俺が考え方が固いのかな
3156.0,3158.0,コンスタントにやっぱね
3160.0,3162.0,流行りしたりがやっぱ激しそう
3164.0,3166.0,水池頭悪いだけでいい
3166.0,3168.0,あいついいやつだよね
3168.0,3170.0,俺の周りであいつが一番いいやつだと思うよ
3170.0,3172.0,裏表がないっていうかさ
3172.0,3174.0,あいつ俺もいいやつだと思う
3174.0,3176.0,普通に俺の周りみんなが知っている
3176.0,3178.0,俺の友達の中では
3178.0,3180.0,あいつが一番いいやつなんじゃないかなと思う時はあるな
3180.0,3182.0,知らねえけどあいつのことを対して
3186.0,3188.0,ワッチャンもいいだろ
3188.0,3190.0,それはだからみんなは知らないんだよね
3190.0,3192.0,一概にさあいついいやつだよなんて
3192.0,3194.0,言えなくない?
3194.0,3196.0,すげえ性格悪いイメージある
3196.0,3198.0,あんなもんだろう人なんて
3198.0,3200.0,いやそうだよね
3200.0,3202.0,全然ある
3204.0,3206.0,布団ちゃんがよっちゃんかばった時は
3206.0,3208.0,布団ちゃんとよっちゃんは別に性格良くねえな
3212.0,3214.0,俺よりはいいけど全然
3214.0,3216.0,俺よりはいいけど
3216.0,3218.0,だからさ
3218.0,3220.0,そういう風に思ってるって時点で
3220.0,3222.0,人のこと信用しない方がいいなって思うんだよね
3222.0,3224.0,性格良くねえし
3224.0,3226.0,いじめっ子だしな
3226.0,3228.0,ワッチャンも別に変わってるなって思うときは
3228.0,3230.0,別に俺にはすげえいいやつだよ
3230.0,3232.0,もちろんワッチャンは
3232.0,3234.0,俺はワッチャンのこと大好きだし
3234.0,3236.0,でも性格すげえいいなと思わない別に
3236.0,3238.0,俺にとってはかけがえのない友達だけど
3240.0,3242.0,やっぱりよっちゃんの友達の中でよっちゃんが一番クズだ
3242.0,3244.0,いやわかんねえぞみんな同じぐらいじゃねえか
3244.0,3246.0,ワッチャンはでも一個上の階級だな
3246.0,3248.0,俺的に
3248.0,3250.0,俺とよっちゃんと
3250.0,3252.0,布団ちゃんとてんぐちゃんは
3252.0,3254.0,似たり寄ったりだぞ
3258.0,3260.0,ほんとに
3260.0,3262.0,コーツつけがたいね
3262.0,3264.0,車分解したのって誰だっけ
3264.0,3266.0,よっちゃんとてんぐちゃん
3266.0,3268.0,俺そういうの見てるからね
3268.0,3270.0,あんまりさ人の車とかって壊しちゃいけないものじゃん
3274.0,3276.0,雷魚の車とか
3276.0,3278.0,ボッコボコにしてたからな
3278.0,3280.0,なんかうんこちゃんワッチャンに一点抜き払ってる
3280.0,3282.0,うんまあそうだねやっぱ尊敬してる部分が
3282.0,3284.0,そういいやつってこれワッチャンのこと尊敬してるんだよな
3284.0,3286.0,どっちかっていうと
3286.0,3288.0,人の良し悪しで友達とか決めねえじゃん
3288.0,3290.0,いいやつだよなみたいな
3290.0,3292.0,そういうのじゃなくて悪い部分も含めてまた
3292.0,3294.0,その人の人間性というか
3294.0,3296.0,尊敬しちゃってるからな
3296.0,3298.0,どこかでだからなんかそんなに
3298.0,3300.0,性格悪いなとか思っても別に
3300.0,3302.0,気になんねえっていうか
3302.0,3304.0,布団ちゃんの新作動画見た?見てない
3306.0,3308.0,これから今日はこれから予定ないの?
3308.0,3310.0,ねえんだよー
3310.0,3312.0,今とんでもないタイミングで配信してるからな
3312.0,3314.0,うん
3314.0,3316.0,ちゃんまんっていいやつかな
3316.0,3318.0,ちゃんまんはいいやつじゃないでしょ
3318.0,3320.0,警察に捕まってるようなやつにいいやつなんか一人もいねえよ
3320.0,3322.0,死刑にするべきだと思う俺は
3322.0,3324.0,自分が親の立場だったらね
3324.0,3326.0,うん
3326.0,3328.0,配信者とし別にそんな
3328.0,3330.0,人付き合い友達になるわけじゃねえしさ
3330.0,3332.0,配信者としては最高じゃない
3332.0,3334.0,うん犯罪者だって
3334.0,3336.0,犯罪者にいいやつなんか一人もいねえよっていうか
3338.0,3340.0,面白いよね
3340.0,3342.0,一人じゃまあ一応犯罪者じゃねえからな
3342.0,3344.0,あの
3344.0,3346.0,チャリンコパクって捕まってくれだろ
3346.0,3348.0,まあかわいいね
3348.0,3350.0,それぐらいのミスは誰でもしちゃうじゃん
3350.0,3352.0,お前国が保護するべきだとか言ってた
3352.0,3354.0,いやだから俺国が保護するべきだと思ってるけど
3354.0,3356.0,人としては最低じゃないだって犯罪者だよ
3356.0,3358.0,本を犯してるんだよ
3358.0,3360.0,殺されるべきじゃない
3362.0,3364.0,よっちが犬盗んでなかったらわかんねえ
3364.0,3366.0,それ本当の情報なの
3368.0,3370.0,本当の情報
3370.0,3372.0,本当の情報なの
3376.0,3378.0,よっちゃん
3384.0,3386.0,やりからない
3386.0,3388.0,よっちゃんそんなことしないよ
3388.0,3390.0,ギリニン状に熱いからね
3392.0,3394.0,銀行で繋いでた犬のパクって
3394.0,3396.0,本当に
3396.0,3398.0,悪魔じゃねえかよ
3398.0,3400.0,悪魔じゃねえかよ
3400.0,3402.0,あそうなんだ
3402.0,3404.0,よっちゃんは銀行から犬取ってきて
3404.0,3406.0,車で引いたらしい
3408.0,3410.0,そんなあれなんだな
3410.0,3412.0,心に闇を抱えてるんだな
3412.0,3414.0,天狗ちゃんも悪魔だしな結構
3414.0,3416.0,やっぱみんな
3416.0,3418.0,なんでお前の友達とみんなちゃんついてんの
3418.0,3420.0,わかんない
3420.0,3422.0,やばいね
3422.0,3424.0,まあそういうでもさ
3424.0,3426.0,過去の過ちも背負って生きていくんだよ
3428.0,3430.0,人から好かれてるなんて思ってねえだろ
3430.0,3432.0,よっちゃんもふとんちゃんも
3432.0,3434.0,俺たち仲間うちで別に好かれてないらいいだろ
3434.0,3436.0,そんな
3436.0,3438.0,もともと高貴な育ちじゃねえから
3438.0,3440.0,そんな人から好かれる必要ねえから
3444.0,3446.0,車で引かれたんだよ犬自体が可愛かったらしい
3446.0,3448.0,よっちゃんそういうとこありすぎなんだけど
3448.0,3450.0,あいつさ
3450.0,3452.0,ハムスター買ってきて部屋でタバコ吸って
3452.0,3454.0,高1の時にハムスターどっかからもらってきて
3454.0,3456.0,部屋でタバコ吸いすぎて
3456.0,3458.0,3日で殺してたからな
3458.0,3460.0,煙で
3460.0,3462.0,いいね
3462.0,3464.0,それってなんか人間以外の
3464.0,3466.0,うさぎもな
3466.0,3468.0,人間以外の命を粗末に扱う人は大好きだからな
3468.0,3470.0,やっぱりそういう優劣
3470.0,3472.0,上下関係はしっかりしないといけないからね
3474.0,3476.0,素晴らしい
3480.0,3482.0,自分で飼えよって感じだよね
3482.0,3484.0,マジで
3484.0,3486.0,なぜ自分で飼わねえんだろうな
3488.0,3490.0,そういうでも犯罪者はいねえな
3490.0,3492.0,まったく
3492.0,3494.0,ももちゃん実家にいるよ
3494.0,3496.0,今俺ん家の
3496.0,3498.0,実家に
3498.0,3500.0,猫7匹と
3500.0,3502.0,暮らしてるよ
3502.0,3504.0,なんか犬も増えてたな
3504.0,3506.0,黒芝
3506.0,3508.0,なんであいつあんなに動物好きなんだろう
3510.0,3512.0,ももちゃん死んじゃないよ生きてるよマジで
3512.0,3514.0,実家にいる
3514.0,3516.0,うちほんとにムチゴロ王国みたいになってんだよ
3518.0,3520.0,黒芝もなんか
3522.0,3524.0,黒芝も飼ってるし
3526.0,3528.0,臭そうだな実家
3528.0,3530.0,全然臭くないんだよ
3530.0,3532.0,姉ちゃんが大掃除してるさ毎日
3532.0,3534.0,子供がいるから
3536.0,3538.0,そんな臭くない
3538.0,3540.0,俺も帰ってくせえかなと思ったら全然臭くなかった
3540.0,3542.0,今の家で動物飼わないの?
3542.0,3544.0,ちょっと飼えねえな今の家じゃ
3544.0,3546.0,犬飼いてんだけどな
3546.0,3548.0,犬
3552.0,3554.0,この前ヤフートビに乗ってた目白飼ってたやつ
3554.0,3556.0,親父ってうちの味
3556.0,3558.0,目白って飼っちゃいけないな
3558.0,3560.0,でも今はうちの味飼ってなかったな
3560.0,3562.0,子供めっちゃ可愛かった
3562.0,3564.0,本気で
3564.0,3566.0,欲しくなっちまった
3566.0,3568.0,子供
3568.0,3570.0,魚か
3570.0,3572.0,手間がめんどくさそうだね
3572.0,3574.0,うち熱帯魚飼ってたからさ
3574.0,3576.0,昔でっけえ水槽で
3576.0,3578.0,意外に手間かかるんだよね
3580.0,3582.0,意外に手間かからない
3582.0,3584.0,熱帯魚
3584.0,3586.0,アクアリウムちょっと憧れるけど
3586.0,3588.0,比例部屋とかでやりたいけどね
3588.0,3590.0,カメとかな
3592.0,3594.0,耳水ってか乾燥エビ
3594.0,3596.0,うち洗わなかったで乾燥エビとか飼ってたのか
3596.0,3598.0,意外に手間かかるんだけど
3602.0,3604.0,なんか水を変えるのとかであるそうだよね
3604.0,3606.0,半分捨てて半分継ぎ足して
3606.0,3608.0,ってやつだね
3608.0,3610.0,カメが20年目に突入したけど
3610.0,3612.0,草カメとか80年くらい生きるぞ
3612.0,3614.0,お前ら長生きするぞ
3614.0,3616.0,捨てる場所考えろよちゃんと
3616.0,3618.0,俺が目つぶってやるから
3618.0,3620.0,捨てる場所ちゃんと考えろよ
3622.0,3624.0,水は1年に1回かかる
3624.0,3626.0,意外
3630.0,3632.0,つーか平日仕事行かないといって
3632.0,3634.0,マジでやばいわ
3634.0,3636.0,マジでやばい
3636.0,3638.0,俺こんなに
3638.0,3640.0,菩薩のような気持ちで配信したことないわ
3642.0,3644.0,菩薩
3646.0,3648.0,汚い顔にぶん投げればいいだろ
3648.0,3650.0,ニートの気持ち理解できた
3650.0,3652.0,これがずっと続くってなると
3652.0,3654.0,経済的に不安があるね
3656.0,3658.0,9月1日からだね
3660.0,3662.0,遅らせてもらおうかな
3662.0,3664.0,10月に家族旅行来てるんだよ
3664.0,3666.0,9月1日から働き始めて
3666.0,3668.0,10月に
3668.0,3670.0,一週間休み取れづらくない?
3670.0,3672.0,取れるけど
3676.0,3678.0,金に不安があるよな
3678.0,3680.0,今ニート3ヶ月目だけど
3680.0,3682.0,もう飽きたよ絶対
3682.0,3684.0,俺でも1日目だぞ
3684.0,3686.0,会社自体はまだ辞めてないけど
3686.0,3688.0,仕事には行かなくていいのね
3688.0,3690.0,すげー気持ちいいわ
3690.0,3692.0,じゃあ来年の4月から働けば
3692.0,3694.0,えー暇じゃん
3694.0,3696.0,それまで
3696.0,3698.0,もったいねーじゃん
3698.0,3700.0,月30万として
3700.0,3702.0,90、11、12、1、2、3
3704.0,3706.0,200万円の損失が出るんだ
3706.0,3708.0,もったいねーだろ
3708.0,3710.0,休み取れると不安になるやっぱそうだよね
3712.0,3714.0,そうそうあと有給消化室終わり
3714.0,3716.0,2週間
3718.0,3720.0,横になりながらやろうたまには
3722.0,3724.0,ちょっと待って
3724.0,3726.0,あ向こうでやればよかったな
3728.0,3730.0,向こうの部屋で
3730.0,3732.0,しくじった
3732.0,3734.0,設定でちょっとでかくすっか
3734.0,3736.0,こういう体制でやるの久々だな
3738.0,3740.0,テキストか
3742.0,3744.0,フォント
3744.0,3746.0,24とか
3748.0,3750.0,おーいいね
3768.0,3770.0,みんなにとっては
3770.0,3772.0,あんまり大きくないかもしれないけど
3776.0,3778.0,えーなーそれーな本当だろ
3782.0,3784.0,ツイッチの管理人バカだから大丈夫だよみんな
3784.0,3786.0,バカだから大バカ
3788.0,3790.0,大バカだから大丈夫
3790.0,3792.0,ほんとツイッチバカだよな
3792.0,3794.0,マジ
3794.0,3796.0,ちょっと待ってね
3798.0,3800.0,えーっと
3802.0,3804.0,えーっと
3812.0,3814.0,これで相当でかくなってるはず
3814.0,3816.0,よって
3816.0,3818.0,俺が離れても
3818.0,3820.0,問題なし
3820.0,3822.0,なはず
3822.0,3824.0,どう
3824.0,3826.0,最高だ
3828.0,3830.0,あ
3830.0,3832.0,俺さ最近あれ買ったんだよね
3832.0,3834.0,モバイル端末
3834.0,3836.0,iPad miniみたいなやつ
3836.0,3838.0,これどうなの
3838.0,3840.0,その前情報なんにもなかったんだけど
3840.0,3842.0,とりあえず買ってみるかみたいな
3844.0,3846.0,結局は2個とも見ることしか使ってないんだけどさ
3848.0,3850.0,寝ながら2個とも見れるからいいかなーと思ったんだけど
3850.0,3852.0,結局その直後にまたさ
3852.0,3854.0,パソコン新しくしてさ
3854.0,3856.0,新生パソコンできちゃったからさ
3856.0,3858.0,っていう
3858.0,3860.0,だよね
3860.0,3862.0,俺iPhone持ってるから
3862.0,3864.0,ノートパソコンもちなみにある
3866.0,3868.0,Macだから近いズレるんだよノートパソコンって
3874.0,3876.0,いらねーよな
3878.0,3880.0,転売
3880.0,3882.0,転売はしねーな
3882.0,3884.0,いやでも
3884.0,3886.0,なんかしらの用途があるかなー
3886.0,3888.0,と思ってんだよね
3888.0,3890.0,DVDプレイやって
3890.0,3892.0,DVDっていうかあの
3892.0,3894.0,映画鑑賞用になっちゃってる
3894.0,3896.0,移動の際の
3896.0,3898.0,動画見ることしかできねーよなー
3900.0,3902.0,なんかもうちょっと
3904.0,3906.0,欲しいね
3906.0,3908.0,外配信もできねーだろこれじゃあ
3908.0,3910.0,女に格好つけるためにMac買ったんだろ
3910.0,3912.0,会社にしか使ってねーやん
3912.0,3914.0,女の前で
3914.0,3916.0,パソコン触る機会なんかねーだろ
3916.0,3918.0,ノートパソコンも触る機会なんて
3918.0,3920.0,プレゼント
3920.0,3922.0,確かになプレゼント機とかいいな
3922.0,3924.0,Excelとか管理できんのこれ
3924.0,3926.0,外配信とか寒いからやめてくれ
3926.0,3928.0,なんで面白そうじゃん
3928.0,3930.0,やりてーよやれるもんなら
3930.0,3932.0,やれねーけど
3932.0,3934.0,そういえば今日の夜孤独ちゃんが謝罪配信するらしいんだよ
3934.0,3936.0,俺楽しみにしてるわ
3938.0,3940.0,今外暑いだろ
3940.0,3942.0,外暑い
3942.0,3944.0,なんかそういう新しいことに
3944.0,3946.0,反対する人っているよ
3946.0,3948.0,京都人だよ京都人
3950.0,3952.0,ちょっと待ってね
3964.0,3966.0,ちょっと待ってね
3970.0,3972.0,寒い
3976.0,3978.0,笑
3986.0,3988.0,なんでそんなにみんな嫌なんだろう
3988.0,3990.0,俺本当に理解できないんだよ
3990.0,3992.0,だってはっきり言ってさ
3992.0,3994.0,あのー
3994.0,3996.0,モブじゃん
3996.0,3998.0,クソ
3998.0,4001.32,ん じゃない
4002.4,4009.6,うんこでも囲い切れスザあるなんかマジに捉えられちゃう あるマジでこんなこと言ってくれネタだぞで怒ってねーぜ
4009.6,4016.52,お前でしょ急遽になってくれやれそれはさぁうまいことぞ折り合いをつけてほしいより 視聴者に
4016.52,4018.76,ねー
4018.88,4026.7200000000003,はっはっは それはあなたたちの自由もあるからじゃあそれ俺いいんだ別にそれは視聴者の自由もやっぱなきゃ
4026.7200000000003,4034.96,ダメじゃ俺たちばっかり自由にしてたらそれはこちら側の集合が間違ってるから なんていうのみんなが起こることに関してはいいんだけど俺はそこに乗っからないでいい
4034.96,4039.44,よねっていうさ 自己保診というか
4039.5600000000004,4041.92,じゃない
4042.1200000000003,4046.0800000000004,それは別に俺の権利としてあるよ
