start,end,text
1407.0,1409.0,ちょっとシャレにならんよ
1409.0,1411.0,これ言っていいのかな
1411.0,1413.0,うちの母ちゃんがさ
1413.0,1415.0,貰ってきてるやつって買ってるやつだから
1415.0,1417.0,なんか変なさ局所的なやつだったらさ
1417.0,1419.0,ばれちまうじゃん
1419.0,1421.0,あでも平気だなこれは
1421.0,1423.0,FTC UVパーフェクトボディベール
1423.0,1425.0,ボディ用日焼け止めミルク
1425.0,1427.0,50ml
1427.0,1429.0,これやばいな
1433.0,1435.0,みんなも使ってくれ
1437.0,1439.0,3泊4日で
1439.0,1441.0,8万とかで事件すげえよね
1441.0,1443.0,でもそれ時給観察でどんだけなの
1443.0,1445.0,3泊4日
1445.0,1447.0,っていうことは
1447.0,1449.0,86時間ぐらい
1449.0,1451.0,だとして
1451.0,1453.0,84時間
1453.0,1455.0,時給1000か
1457.0,1459.0,まぁでもぼちぼちだよね
1459.0,1461.0,そうやって考えると
1461.0,1463.0,寝てる時間もね
1463.0,1465.0,お金貰えると考えたら
1465.0,1467.0,たけえ仕事だよな
1467.0,1469.0,3日で8万で稼げないもんな
1469.0,1471.0,普通に
1471.0,1473.0,学生とかだったら最高じゃないか
1473.0,1475.0,医療関係は今後来ると思う
1475.0,1477.0,例えば医療関係のどういう分野が
1477.0,1479.0,ってこと
1479.0,1481.0,教えてくれ
1481.0,1483.0,俺に
1483.0,1485.0,今後来る
1485.0,1487.0,今後
1487.0,1489.0,この時間で聞いてもあれだろうな
1489.0,1491.0,今後来る商売
1491.0,1493.0,医薬品医療機器
1493.0,1495.0,でもそれこそさ
1495.0,1497.0,もう狭い
1497.0,1499.0,狭きもんじゃない
1499.0,1501.0,今から新規さんにできるの
1501.0,1503.0,初期投資がとんでもないくらいかかるだろ
1505.0,1507.0,やっぱもう
1507.0,1509.0,いかにさローコストでスタートするか
1509.0,1511.0,ってのが大事じゃない
1513.0,1515.0,弾を殴って
1515.0,1517.0,損傷具合を調べるバイトは1日10万らしい
1517.0,1519.0,無理だね
1519.0,1521.0,医療なんかずっと来てるようなもんじゃ
1521.0,1523.0,やっぱそうなのかね
1527.0,1529.0,最先端
1529.0,1531.0,医療機器なんてもう新規さんに
1531.0,1533.0,無理だよね多分ね
1535.0,1537.0,流行りすたりがないのがいいんだろやっぱ
1537.0,1539.0,教育と医療ってやっぱ
1539.0,1541.0,すたれちゃいけないものだからね
1541.0,1543.0,他国に対するイメージもあるしね
1543.0,1545.0,国としては絶対にすたれさせない
1545.0,1547.0,ものだしね
1547.0,1549.0,国が守ってくれなければならない
1549.0,1551.0,ものだしね
1551.0,1553.0,どうなんだろうね
1553.0,1555.0,今から来るのは水市場
1555.0,1557.0,水市場って説明会
1557.0,1559.0,何だ分かんない
1565.0,1567.0,ここの奴らお勉強できる奴ばっかりなの
1567.0,1569.0,ついていけないよ
1569.0,1571.0,小手先の知識でなんか薄っぺらいことを話してる団体だろ
1571.0,1573.0,今俺含め
1573.0,1575.0,絶対水不足が来るって言われてるらしいね
1575.0,1577.0,農業か
1579.0,1581.0,農業なんてしたくねーけどな
1581.0,1583.0,俺潰れていいけどな
1583.0,1585.0,なんかみんな守るよね
1585.0,1587.0,第一次産業大事だみたいな
1587.0,1589.0,なんかさたまたまさ
1589.0,1591.0,地球の歴史を考えてさ
1591.0,1593.0,生命が
1593.0,1595.0,生命を維持するために
1595.0,1597.0,手段として
1597.0,1599.0,たまたま千年ぐらいの間
1599.0,1601.0,農業が流行ってたっていうぐらいのものじゃないの
1601.0,1603.0,もう別に
1603.0,1605.0,廃れていいだろ
1605.0,1607.0,最先端の栄養補給方法が
1607.0,1609.0,生まれてくるべきじゃない
1609.0,1611.0,いらねーよな
1613.0,1615.0,日本だけだと一時が廃れるの
1615.0,1617.0,国の規模からしてさ
1617.0,1619.0,そこを盛り上げていこうって
1619.0,1621.0,無理じゃない
1623.0,1625.0,物理的に考えて
1625.0,1627.0,他国がやってくれるしかないでしょ
1627.0,1629.0,おばあちゃんが畑やってるけど大丈夫
1629.0,1631.0,うちも農家だよ
1631.0,1633.0,無理だよはっきり言って
1633.0,1635.0,そこを
1635.0,1637.0,守ろうとしてたらさ
1637.0,1639.0,どれだけの被害を被るか
1639.0,1641.0,わかんなくない
1641.0,1643.0,って俺は思うんだけどね
1643.0,1645.0,やっぱ流行りしたりがあるじゃん絶対
1647.0,1649.0,ない?
1649.0,1651.0,そこだけ守るのは無理な話だよ
1651.0,1653.0,確かにそういうさ古き良きなんかあれも
1653.0,1655.0,俺は大事だと思うけどさ
1655.0,1657.0,やっぱ無理なもんは無理っていうか
1657.0,1659.0,仕方ないもん
1659.0,1661.0,分もあるでしょ
1661.0,1663.0,農業捨てた国なんて落ちていくだけだろ
1663.0,1665.0,日本なんてそんな農業盛んじゃねーだろ
1667.0,1669.0,盛んなの?日本って
1669.0,1671.0,ほんとお前は石原さん
1671.0,1673.0,って考え方だよな
1673.0,1675.0,嬉しいよ
1675.0,1677.0,漁師はどうよ
1677.0,1679.0,盛んなの?日本って
1679.0,1681.0,全体の10%にも似てない
1681.0,1683.0,日本として
1683.0,1685.0,自給自足できないよね
1685.0,1687.0,盛んなの?
1687.0,1689.0,少ないよね
1689.0,1691.0,相当
1691.0,1693.0,いやその
1693.0,1695.0,世界的に見たら
1695.0,1697.0,かなり盛んじゃないよね
1697.0,1699.0,じゃねーよな
1699.0,1701.0,土壌があってさ
1701.0,1703.0,ねーじゃねーかよ
1707.0,1709.0,自給自足なんか無理だよね
1709.0,1711.0,無理だよね
1711.0,1713.0,農業技術を世界に輸出するんだよ
1713.0,1715.0,それは素晴らしいな
1715.0,1717.0,知識のなんか
1717.0,1719.0,っていうのは
1719.0,1721.0,そういう研究とか大賛成なんだけどさ
1721.0,1723.0,何ていうの
1723.0,1725.0,タータを増やして
1725.0,1727.0,自給自足をしていこうみたいなのは
1727.0,1729.0,もう無理でしょ
1729.0,1731.0,無理じゃない?こんなにさ
1731.0,1733.0,時代が発展してきてさ
1733.0,1735.0,なかなか難しくない?
1735.0,1737.0,そういうこと言ってんの
1737.0,1739.0,俺的に
1739.0,1741.0,超第一産業って
1741.0,1743.0,無理だよね
1743.0,1745.0,今のおじいちゃんとかおばあちゃんが
1745.0,1747.0,やってきたようなことを
1747.0,1749.0,繰り返してやっていくのは
1749.0,1751.0,結構厳しくないか
1751.0,1753.0,そういう技術の輸出とかいいよね
1753.0,1755.0,確かに
1755.0,1757.0,なんかもう外国に依存しちゃった
1757.0,1759.0,それやるなって言ってるわけじゃなくてさ
1759.0,1761.0,別にそこが育たれてしまったら
1761.0,1763.0,他のところやるしかないっていうか
1763.0,1765.0,時代の流れなんじゃないのかな
1765.0,1767.0,確かにね
1767.0,1769.0,日本の米って俺も世界で一番上手いと思うから
1769.0,1771.0,でもそういうのってさ
1771.0,1773.0,ブランド化していくんじゃないの
1773.0,1775.0,だから
1775.0,1777.0,今でも十分ブランドなんだろうけど
1777.0,1779.0,別にそこをスタレさせる必要はないけどさ
1779.0,1781.0,ただ破綻してる部分を
1781.0,1783.0,何ていうの
1783.0,1785.0,俺たちの税金で補っていくのは
1785.0,1787.0,すげえ馬鹿らしいなって思って
1787.0,1789.0,もっと他にやった方がいいんじゃないかな
1789.0,1791.0,と思っちゃうんだけどね
1791.0,1793.0,自分の浅はかな
1795.0,1797.0,日本結構農業盛んだと
1797.0,1799.0,生産額ベースの自給率は
1799.0,1801.0,世界6位とか7位だと
1801.0,1803.0,へえ
1803.0,1805.0,それなりに
1805.0,1807.0,あれなんだね
1807.0,1809.0,でも世界6位って言ったら結構農業大国と言っても
1809.0,1811.0,あれだね
1811.0,1813.0,おかしくないというか
1813.0,1815.0,それですらさ
1815.0,1817.0,農業大国の日本ですらさ
1817.0,1819.0,自給自足10%ぐらいしかできてない
1819.0,1821.0,って言うじゃん
1821.0,1823.0,90%他国に依存してるじゃん
1823.0,1825.0,世界の食を
1825.0,1827.0,アメリカとか
1831.0,1833.0,すげえなアメリカって
1833.0,1835.0,他の国は米食べないから
1835.0,1837.0,米に限定してるわけじゃないよ
1837.0,1839.0,さっきも言った通り米は確かにさ
1839.0,1841.0,日本で作ればいいけど
1841.0,1843.0,農業って米以外のものも指すでしょ
1847.0,1849.0,小麦とかはね
1849.0,1851.0,俺も習ったな中学校の時
1851.0,1853.0,冬小麦があだこだみたいな
1855.0,1857.0,土地があるやっぱりベースがあるの
1857.0,1859.0,でけえよなアメリカの技術がすげえ
1859.0,1861.0,っていうかさもう
1861.0,1863.0,ずりーよなそれはな
1865.0,1867.0,もっとなんかあれだよね
1867.0,1869.0,違うところに
1869.0,1871.0,うんこちゃんどれぐらい稼ぎたいの
1871.0,1873.0,やっぱベース1000万は欲しいな年収
1873.0,1875.0,手取りで手取りでっていうか
1875.0,1877.0,収入純利益として
1877.0,1879.0,そしたら俺
1879.0,1881.0,1000万欲しいな
1883.0,1885.0,軍事産業はまだ
1885.0,1887.0,需要あるんでしょ
1887.0,1889.0,一生なくならないんじゃない
1891.0,1893.0,確かにそうだな日本のその辺を
1893.0,1895.0,農業のその
1895.0,1897.0,率を引き上げてるのは
1897.0,1899.0,米だろうな
1899.0,1901.0,確かに米はうちも作ってるもんな
1903.0,1905.0,確かにそうだね
1905.0,1907.0,農地を一つにまとめれば
1907.0,1909.0,もっと上がる
1909.0,1911.0,それだけで飯食っていくのって無理だぜ
1911.0,1913.0,実家が農家だから言えるよ
1913.0,1915.0,よっぽどね広大な土地があってね
1915.0,1917.0,幸せな
1917.0,1919.0,あれだったら分かんねえけどさ
1921.0,1923.0,土地対価格がゴミくずな
1923.0,1925.0,クソ農作物は
1925.0,1927.0,あなるほど
1927.0,1929.0,食の話は誠実と繋がるから手抜けないぞ
1929.0,1931.0,輸出制限かけると脅されると
1931.0,1933.0,身動き取れないから
1933.0,1935.0,北朝鮮がいい例だよな
1937.0,1939.0,まさに
1939.0,1941.0,いい例だよな
1941.0,1943.0,今高級車のレンタルが来てるらしいぞ
1943.0,1945.0,三重パリのバカが借りるらしい
1947.0,1949.0,でもレンタカーってナンバーでばれちゃうだろ
1951.0,1953.0,その方をもくぐり
1953.0,1955.0,抜けることができる
1955.0,1957.0,なんかあれがあるの
1959.0,1961.0,方をも
1961.0,1963.0,抜けるような
1963.0,1965.0,なかなかなさそうじゃない
1965.0,1967.0,どんなに偉い人間の上にも
1967.0,1969.0,方は
1969.0,1971.0,あるでしょ
1971.0,1973.0,分かんねえけど
1973.0,1975.0,イスラエルで水産業やってるやつとかいる
1975.0,1977.0,もう来てるもの
1977.0,1979.0,真似ても儲かんねえからな
1979.0,1981.0,株とかいい例だよな
1981.0,1983.0,なんていうっけそういうの
1983.0,1985.0,俺すげえ好きな言葉があったんだよな
1985.0,1987.0,なんかもう
1987.0,1989.0,俺たち素人が知り得る知識
1989.0,1991.0,とか情報なんていうのは
1991.0,1993.0,そんなの専門家がいくらでも
1993.0,1995.0,なんていうの
1995.0,1997.0,ただアベノミクス
1997.0,1999.0,だから株やったら儲かるっていうのは
1999.0,2001.0,大きな間違いだよっていう理論なんていうっけ
2003.0,2005.0,そんなのはもう専門家が
2005.0,2007.0,俺たちが知り得る前に
2007.0,2009.0,全然余裕で知ってるから
2009.0,2011.0,市場には大きく影響しないよ
2011.0,2013.0,っていうのなんていうっけ難しい言葉
2013.0,2015.0,6文字ぐらいで
2015.0,2017.0,ちょっと俺気になって無理だ
2017.0,2019.0,ねえ
2019.0,2021.0,なんだっけ
2021.0,2023.0,全部漢字で
2023.0,2025.0,6文字ぐらいあるじゃん
2025.0,2027.0,これ残っちゃったけどね
2027.0,2029.0,なんだっけ
2029.0,2031.0,うわーなんだっけな火
2031.0,2033.0,絶対知ってんだって
2037.0,2039.0,俺調べてくね
2039.0,2041.0,調べてくって思い出す絶対いつかは
2041.0,2043.0,もうちょい言ってくれ
2043.0,2045.0,なんかだから株とかの
2045.0,2047.0,市場でよく用いられる言葉でさ
2047.0,2049.0,あの
2049.0,2051.0,専門家が
2051.0,2053.0,もうとっくにそういう情報を仕入れていて
2053.0,2055.0,えー
2055.0,2057.0,俺たち民間の脳みそに降りてくるまでには
2057.0,2059.0,そういうのが
2059.0,2061.0,吟味された上での
2061.0,2063.0,えー
2063.0,2065.0,結果として市場に現れてるから
2065.0,2067.0,こっから先のことは
2067.0,2069.0,誰にも分からないよっていう
2071.0,2073.0,こと
2073.0,2075.0,あの運だよ結局市場なんてどう転ぶか
2075.0,2077.0,全部ほとんど運だよっていう
2077.0,2079.0,そういう仮説みたいな
2081.0,2083.0,あるじゃん日本語で
2083.0,2085.0,長久武神破産ぐらいの
2085.0,2087.0,長さ
2087.0,2089.0,6文字ぐらいだと思うんだよな
2089.0,2091.0,分かんねえかやめようじゃあ考えるの
2091.0,2093.0,絶対出てこないから俺漢字漢字漢字漢字
2093.0,2095.0,それ俺らに聞く
2095.0,2097.0,いやお前らしか聞くやつがいねえんだよ
2097.0,2099.0,自分で思い出せねえよ
2099.0,2101.0,やめよう
2101.0,2103.0,やめよう
2103.0,2105.0,今考えても答えは出ない
2105.0,2107.0,なんでそんなことを知ってるの
2107.0,2109.0,いっぱい本読んでるから読んでねえ本なんて一冊も読んだことないやん
2113.0,2115.0,なんかこういうの
2115.0,2117.0,なんて言うんだろうっていうの調べて
2117.0,2119.0,あの
2119.0,2121.0,インプットしていくというか
2121.0,2123.0,こういうのって絶対
2123.0,2125.0,言葉としてなんか決まってるはずだな
2125.0,2127.0,みたいな
2127.0,2129.0,だっておかしいじゃん株なんかでさ
2129.0,2131.0,俺たちの
2131.0,2133.0,例えば自分俺がいれて
2133.0,2135.0,FXをやりますってなった時に
2135.0,2137.0,パソコン一台二台でやりますって
2137.0,2139.0,でもさもっと自分たち
2139.0,2141.0,俺より多分100倍ぐらい頭のいい人が
2141.0,2143.0,なんていうの
2143.0,2145.0,とんでもない企業に入って
2145.0,2147.0,すごい1000分の1秒
2147.0,2149.0,段位で取引ができるような
2149.0,2151.0,マシンパワーの機械を1000台並べて
2151.0,2153.0,情報処理を行っている人たち
2153.0,2155.0,に勝てるはずないじゃん
2155.0,2157.0,マーケティング
2157.0,2159.0,あっそう
2159.0,2161.0,効率的市場化せず
2161.0,2163.0,そうそうそうそうありがとうありがとう
2163.0,2165.0,ありがとうすげーすっげー胸を撫で下したわ
2165.0,2167.0,今
2167.0,2169.0,ありがとう
2169.0,2171.0,すっげーなんか
2171.0,2173.0,胸を撫で下した
2173.0,2175.0,ありがとうありがとう
2177.0,2179.0,っていう
2179.0,2181.0,風な認識から調べたくなったんだよね
2181.0,2183.0,これなんて言うんだろう
2185.0,2187.0,それそんな話だっけ
2187.0,2189.0,多分そんな話
2189.0,2191.0,大きくまとめると
2191.0,2193.0,そんな感じだったと思う
2193.0,2195.0,俺もそれを先行したわ
2195.0,2197.0,その分野を突き詰めたわけじゃないから
2197.0,2199.0,わかんないけど
2199.0,2201.0,ビール飲んで
2201.0,2203.0,なぜなら俺は無職だからな
2203.0,2205.0,やめて無駄になる
2205.0,2207.0,非常に無駄になるから
2207.0,2209.0,水飲もう
2215.0,2217.0,すいませんすいません
2223.0,2225.0,なんだよ
2225.0,2227.0,300人しかいない
2227.0,2229.0,数を求めるな
2229.0,2231.0,みんな
2231.0,2233.0,水について詳しく教えて
2233.0,2235.0,わかんない
2235.0,2237.0,頑張ってんじゃない
2237.0,2239.0,あいつはあいつなりに
2239.0,2241.0,別に一日
2241.0,2243.0,無職なんだから
2243.0,2245.0,無職だからこそできることってあるじゃん
2245.0,2247.0,時間を有効につかなきゃいけないでしょ
2247.0,2249.0,時間もお金も有限なんだからさ
2249.0,2251.0,特に
2251.0,2253.0,校舎に至ってはもう
2253.0,2255.0,ねえ
2255.0,2257.0,もう命だからさ俺
2257.0,2259.0,お金って
2259.0,2261.0,1円たりでもやっぱもう減らしたくないからさ
2261.0,2263.0,なんかやりたいな
2265.0,2267.0,金儲けしたいな
2267.0,2269.0,今何にもどこにも
2269.0,2271.0,社会に属してない状態で
2271.0,2273.0,金儲けしたいな
2273.0,2275.0,マジでマジで
2275.0,2277.0,大きく打って出たいなここで
2277.0,2279.0,じゃないと最後のチャンスだと思うんだよな
2281.0,2283.0,金のかかんねえ金儲け
2283.0,2285.0,いやリスクは多いよほんとに
2285.0,2287.0,俺の今の貯金全部失ってもいいから
2287.0,2289.0,何か
2289.0,2291.0,元では一応5600ある
2293.0,2295.0,金儲けなんて無理でしょ
2295.0,2297.0,そうだよな無理なんだよな結局な
2297.0,2299.0,結局は無理なんだよな
2299.0,2301.0,でもさそこでさ諦めてしまったらほんとに
2301.0,2303.0,ねえ
2305.0,2307.0,諦めてしまったらほんとにもう0%じゃん
2307.0,2309.0,諦めない限り
2309.0,2311.0,0ではないだろ
2313.0,2315.0,世界の子供たちから
2315.0,2317.0,毎日20円ずつ徴収するシステム作る
2317.0,2319.0,なんかそれ難しいんだよね
2319.0,2321.0,どう考えてもね
2321.0,2323.0,人件費がとんでもないくらいかかる
2323.0,2325.0,キティちゃんみたいなキャラクター
2325.0,2327.0,返すれば月何百万とか稼げるんだよな
2327.0,2329.0,キティちゃんみたいなキャラクター
2329.0,2331.0,返すればっていうけどそれを
2331.0,2333.0,するのが難しいだろ
2337.0,2339.0,有名に革命起こしたよ
2339.0,2341.0,小泉新一郎クラスの俺じゃ
2341.0,2343.0,なんか行動力とか人
2345.0,2347.0,人望がなきゃできないのか
2347.0,2349.0,無理じゃない
2349.0,2351.0,無理だよな
2351.0,2353.0,なりふり構わなければコミケで旅
2353.0,2355.0,DVD売れば結構儲かるよ
2355.0,2357.0,短期的に見たら100万200万なんていらないんだって
2357.0,2359.0,もっと長期的に
2359.0,2361.0,もうちょっとさ
2361.0,2363.0,多少中長期的に稼げるような
2363.0,2365.0,コミケが週に一回あってそれで
2365.0,2367.0,コンスタントに稼げていけるって言ったら分かるけどさ
2367.0,2369.0,実況者とかなんて本当に
2369.0,2371.0,それがするってなったらもう芸能人じゃん
2371.0,2373.0,人気商売じゃん
2373.0,2375.0,無理無理
2375.0,2377.0,俺精神病んじゃうよはっきり言って
2379.0,2381.0,長く細く儲ければ
2381.0,2383.0,俺らから毎日1000円ずつ
2383.0,2385.0,何かやだな
2385.0,2387.0,俺そういう人の繋がり作りたくねーし
2387.0,2389.0,特におめーらみたいな
2389.0,2391.0,人の足引っ張るの大好きなやつらと
2391.0,2393.0,言われた母親に
2393.0,2395.0,そういう付き合う人間は
2395.0,2397.0,ちゃんと選びなさいよ
2397.0,2399.0,だからあなたたちは
2399.0,2401.0,俺の放送は趣味として楽しんで
2401.0,2403.0,足引っ張りで他のやつ
2403.0,2405.0,マオとかゲロとか
2405.0,2407.0,そういうやつの足引っ張ってくんね
2407.0,2409.0,俺は一切そういう金に集中したくねーから
2409.0,2411.0,俺はお前の力になるよ
2411.0,2413.0,マジか
2417.0,2419.0,あの人みたいにインテリジェント高くないじゃん
2419.0,2421.0,やつはなんかもう
2421.0,2423.0,時代動かしてるじゃん
2423.0,2425.0,ニコ生の1000人動かしてるだけじゃん
2425.0,2427.0,そういうんじゃねーんだよな
2427.0,2429.0,もっとなんかね
2429.0,2431.0,ノマド的なビジネスってさ
2431.0,2433.0,認知されてなんぼでしょ
2433.0,2435.0,無理無理
2435.0,2437.0,俺でも結構
2437.0,2439.0,社会で見たら
2439.0,2441.0,俺の本名はみんなに知れ渡ってないけどさ
2443.0,2445.0,無理じゃない
2445.0,2447.0,洋服ブランド作ったらいいんじゃない
2447.0,2449.0,お前芸能人がやっても潰れてんじゃん
2449.0,2451.0,無理だろそれこそ
2451.0,2453.0,ワッチャンが講師する大学作ろう
2453.0,2455.0,ワッチャンと一緒に商売していいな
2455.0,2457.0,遊びで
2459.0,2461.0,遊びでな
2463.0,2465.0,飯屋か
2465.0,2467.0,ぶっちゃけね
2467.0,2469.0,その
2469.0,2471.0,その辺が一番手堅いんだよね
2471.0,2473.0,はっきり言って
2473.0,2475.0,リスクはめちゃくちゃ高いけど
2475.0,2477.0,何人もさ
2477.0,2479.0,ノウハウがない人間がやるってなったら
2479.0,2481.0,やっぱ飯屋とかになっちゃうんだよね
2481.0,2483.0,でも成功する確率なんで
2483.0,2485.0,それでもすごい少ないけど
2487.0,2489.0,ワッチャンって取り柄なんなの
2489.0,2491.0,ワッチャンの取り柄はね
2491.0,2493.0,俺ワッチャンよりメンタル強い人見たことないからな
2493.0,2495.0,あの人はね
2495.0,2497.0,本当に
2497.0,2499.0,どんな窮地に立たされても
2499.0,2501.0,すごく冷静に
2501.0,2503.0,判断できる
2503.0,2505.0,だから俺一緒に仕事してんだよ
2505.0,2507.0,俺ってそういう人間じゃないから
2507.0,2509.0,結構さ
2509.0,2511.0,気性転結
2511.0,2513.0,気度哀楽がすごくあって
2515.0,2517.0,なんていうのかな
2517.0,2519.0,あれだから正常な判断
2519.0,2521.0,パニックになった時に正常な判断が
2521.0,2523.0,できなそう
2523.0,2525.0,うん
2529.0,2531.0,ぜひ一緒にやらせていただきたいな
2533.0,2535.0,うんこちゃんの取り柄って何
2535.0,2537.0,ワッチャンに対してのメリットがないと
2537.0,2539.0,なんだろうな
2539.0,2541.0,うーん
2541.0,2543.0,確かになそうやって言われると
2543.0,2545.0,なんだろうな
2545.0,2547.0,俺の取り柄
2549.0,2551.0,ワッチャンのうんこで起業するメリットはそうだね
2551.0,2553.0,自分で分かんなくない
2553.0,2555.0,自分でさ
2555.0,2557.0,分かんねえな
2559.0,2561.0,困った時は
2561.0,2563.0,お母さんに相談すれば必ず解決する
2563.0,2565.0,確かにその
2565.0,2567.0,途中で投げたりはしないな
2567.0,2569.0,絶対に
2571.0,2573.0,能力はないかもしれないけど
2573.0,2575.0,そういうのはワッチャンは
2575.0,2577.0,俺の隣で見てるはずだから
2577.0,2579.0,そこは信頼してくれてると思うな
2579.0,2581.0,その責任を追うことはできる
2581.0,2583.0,自分の
2583.0,2585.0,その与えられた
2585.0,2587.0,ものに対する
2587.0,2589.0,途中で
2589.0,2591.0,ワッチャンに割り投げしてやめたとはならないかな
2593.0,2595.0,今流行ってるもののパクリ事業しかないだろう
2595.0,2597.0,今なんかね
2597.0,2599.0,ソフト番組でさ
2599.0,2601.0,財力があるとこだったらいいけどさ
2601.0,2603.0,飲み込んでいけるけどさ
2603.0,2605.0,ちょっと厳しくない
2605.0,2607.0,ワッチャンに聞いてみれば
2607.0,2609.0,聞いてみようかな
2609.0,2611.0,ワッチャンに俺の長所聞いてみよう
2611.0,2613.0,確かに人からそうやって長所を聞くことによって
2613.0,2615.0,自分が認識すればもっと伸びるかもしれないしな
2615.0,2617.0,聞いてみる聞いてみる
2617.0,2619.0,確かに聞いたことないわ
2619.0,2621.0,俺の長所ってなんだろうって
2621.0,2623.0,呼び込んで説明しようって
2623.0,2625.0,分かった
2625.0,2627.0,お前が立てといてくれ
2627.0,2629.0,高田の長所
2629.0,2631.0,いや水内なんか長所いっぺんあるよ
2631.0,2633.0,あいつメンタル強いじゃんめちゃくちゃ
2633.0,2635.0,いい意味でもさ
2635.0,2637.0,悪い意味でもさ
2637.0,2639.0,なんていうの
2639.0,2641.0,そんな
2641.0,2643.0,悩みすぎないってすごい大事じゃない
2647.0,2649.0,悩みすぎなくない
2649.0,2651.0,あいつ
2651.0,2653.0,ポジチョ
2653.0,2655.0,ポジティブって超武器じゃん
2655.0,2657.0,多分さあいつ1000万2000万
2657.0,2659.0,借金背負ったとしても結構ポジティブに生きていけそうじゃない
2659.0,2661.0,そういうのってさ
2661.0,2663.0,これすごく大事なスキルだと思うからさ
2665.0,2667.0,鈍感力そうそうそう流行ったよな
2667.0,2669.0,商売向きじゃないけどな
2669.0,2671.0,でもなんか
2671.0,2673.0,ああいうさ
2673.0,2675.0,明るさっていうのはさ
2675.0,2677.0,例えばすげー苦しいときに
2677.0,2679.0,なんかそういう一言かけてほしいときってない
2679.0,2681.0,大丈夫だよみたいな
2681.0,2683.0,彼女に俺そういうのすごい求めちゃうんだけど
2683.0,2685.0,すげー仕事とかで悩んで帰ってきて
2685.0,2687.0,うわマジ超落ち込むよみたいなときに
2687.0,2689.0,大丈夫だよみたいな
