start,end,text
0.0,30.0,次に、スイッチをオンにして、スイッチをオンにして、スイッチをオンにして、スイッチをオンにして、スイッチをオンにして、スイッチをオンにして、スイッチをオンにして、スイッチをオンにして、スイッチをオンにして、スイッチをオンにして、スイッチをオンにして、スイッチをオンにして、スイッチをオンにして、スイッチをオンにして、スイッチをオンにして、スイッチをオンにして、スイッチをオンにして、スイッチをオンにして、スイッチをオンにして、スイッチをオンにして、スイッチをオンにして、スイッチをオンにして、
30.0,60.0,スイッチをオンにして、スイッチをオンにして、スイッチをオンにして、スイッチをオンにして、スイッチをオンにして、スイッチをオンにして、スイッチをオンにして、スイッチをオンにして、スイッチをオンにして、スイッチをオンにして、スイッチをオンにして、スイッチをオンにして、スイッチをオンにして、スイッチをオンにして、スイッチをオンにして、スイッチをオンにして、スイッチをオンにして、スイッチをオンにして、スイッチをオンにして、スイッチをオンにして、スイッチをオンにして、スイッチをオンにして、ス
60.64,62.0,イ
63.64,67.64,どうもどうもすいませんでした
68.0,69.64,いや〜
70.0,76.0,いや私ね、ちょっと、生活が激変してましたよ、この2日間で
77.0,87.0,ちょっと、そのなんか、事務的ななんか処理に追われてたというか、まだ無事に、ね、えー落ち着きましたので
87.0,92.0,俺さぁ、仕事辞めれてさぁ、超嬉しい!
92.0,97.0,俺さぁ、マジで仕事辞めれてホント嬉しくてさぁ
97.0,100.0,もう、なんていうのかなぁ
100.0,104.0,視界、なんか頭にかかってたモヤモヤが取れたというかさぁ
106.0,108.0,最高だな、なんか
110.0,112.0,最高だね
113.0,117.0,なんかその辺の事務的なのは、全然まだ終わってないんだけど
117.0,121.0,絶賛有給消化中なんだよね、今
121.0,124.0,絶賛有給休暇消化中
124.0,127.0,で、その有給消化
127.0,131.0,消化終了した後に退職というか
131.0,134.0,どんぐらい休暇期間取るの?今何日?
134.0,138.0,8月までは、退職はまだしてないのか
139.0,144.0,7月の末日までは
144.0,147.0,高給と有給が残っているんだよ
147.0,151.0,多分8月の第1日から無職
152.0,155.0,無職だ、やべぇな
157.0,160.0,ヤバスだな、それは
161.0,164.0,とりあえずちょっとゆっくりしようかな
165.0,167.0,少しばっかし
168.0,171.0,ゆっくりしようかなと思っています
174.0,176.0,エンブレム枠いつ?
176.0,179.0,気が向いたらにしようかな
179.0,181.0,気が向いたら
181.0,183.0,俺も転職活動してるぞ
183.0,186.0,ムズいよなぁ、やっぱなぁ
186.0,188.0,なんだっけ
188.0,190.0,すごく
190.0,193.0,わがままっていうかさ
193.0,195.0,あれが強くなるからね
195.0,196.0,欲が
196.0,202.0,普通のさ、何にも知らない純真無垢な学生の状態の就活とはまた違った
202.0,204.0,自分との戦いがあるからね
204.0,208.0,どこを、どこで落とすかみたいなね
210.0,212.0,大変だよな、多分
212.0,214.0,すごく
215.0,220.0,村ちゃんまんがFC2でデリヘル有料配信したいって言ってたよ、どういうこと?
221.0,224.0,まあそうだね、年収とかな、いろいろ多分
224.0,227.0,そういうのが関わってくるよね
227.0,231.0,でも俺さ、年間100万円ずつぐらい損失だからさ、変な話
231.0,233.0,今の会社にいて
233.0,237.0,だからちょっと、それはやっぱりプロとしてどうかなみたいな
237.0,241.0,プラ級選手だったらね、100万なんて誤差なんだろうけどさ
241.0,243.0,綺麗事も言えるんだろうけどさ
243.0,246.0,前見みたいな、黒だみたいなこと言えるんだろうけどさ
246.0,249.0,やっぱり我々はさ、ねえ
249.0,252.0,1万円が大きい世界じゃないですか
253.0,256.0,全然、ちっちゃくないというかね
256.0,258.0,音ちっちゃくない?マジで?
258.0,260.0,ちょっと待ってね
263.0,265.0,あ、そっか、あれだ、分かった
265.0,267.0,ちょい待ちな
270.0,276.0,なんも考えず1試合目の中傷内定したから決めたんだからちょっと頑張った方がいいぞ
277.0,279.0,マジでマジで
283.0,286.0,えー、これで多少は
286.0,289.0,なんでちっちゃくなっちゃうんだろうな
289.0,291.0,俺の声がちっちゃくなっちゃったのかな
291.0,293.0,あんまりブースト入れてこないんだよな
297.0,301.0,ブーストが聞きたくないんだよな、できれば
302.0,305.0,あんま変わんねえけど朝日いいよな別にな
307.0,309.0,その妥協は必要だよね
310.0,311.0,エンブレムワークいつするの?
311.0,313.0,あー、7月中
313.0,315.0,今気分がいいからよ、まあいいじゃねえかよそれさ
315.0,317.0,カタクリ事故でやめようぜもう
317.0,319.0,今はそんなタスクに追われたくねえんだよ
319.0,321.0,無職をちょっと味わいたい
321.0,323.0,無職の味を
323.0,325.0,初だぞほんとに
325.0,326.0,初
326.0,327.0,うんこちゃん的には公務員ってどう?
327.0,329.0,まあいいんじゃねえのか
329.0,331.0,俺はなりたくねえけど
333.0,338.0,なんかいろいろもう人生決められた感が半端なくない?公務員って
338.0,340.0,可能性が少ないというか
340.0,342.0,俺はそう思ったよな
342.0,343.0,よいしょ
357.0,358.0,よいしょ
363.0,367.0,俺ももう少しで負け組公務員になるとこだったけどな
368.0,370.0,負け組公務員に
372.0,374.0,うんこちゃん昨日ソーラーパネル売る会社に泣いてもらったよ
374.0,377.0,ソーラーパネルはねお前いいところ見えつけたな
377.0,379.0,人が少ねえから言うけど俺も狙ってんだよな
379.0,381.0,なんかその田舎だしさ
381.0,383.0,土地があるからめちゃくちゃ
383.0,385.0,半端ねえぐらい土地あるのねうち
385.0,386.0,クソ田舎だから
386.0,389.0,そこに一面にソーラーパネル敷き詰めて
389.0,391.0,あの電力会社に
391.0,393.0,やっぱり多分こっから競争が始まってくるだろ
393.0,394.0,おそらく
394.0,396.0,これから来るだろエネルギー事業は
396.0,397.0,俺はそう考えてるぞ
397.0,401.0,だから田舎の良さってやっぱり
401.0,402.0,地下の安さだと思うんだよね
402.0,404.0,で無駄にあるからうち
404.0,405.0,ほんとに
405.0,407.0,300坪ぐらいあるのね
407.0,408.0,そこに全部ソーラーパネル敷き詰めて
408.0,410.0,おそらく初期投資2000万ぐらいで
410.0,412.0,で大体俺の計算だと
412.0,414.0,5年で元取れんじゃねえかなって思ったんだよね
414.0,416.0,超甘いから
416.0,418.0,畑には置けない農地保護機器は置けない
418.0,419.0,おそらく
419.0,420.0,おそらく
420.0,422.0,超甘いから
422.0,424.0,畑には置けない農地保護機器は置けない
424.0,428.0,畑には置けない
428.0,429.0,電気会社作ろうぜ
429.0,430.0,それワッチャンにも言われたよ
430.0,431.0,っていう話をしたら
431.0,432.0,ワッチャンそういう展望があるんだけど
432.0,433.0,って話したら
433.0,435.0,じゃあ電気会社作っちゃえば良くない?
435.0,436.0,みたいな
436.0,438.0,そうなってくるともう
438.0,439.0,ダメだよな
439.0,442.0,負担がでかいというか
442.0,444.0,俺東大でそういう環境系の研究してるけど
444.0,445.0,ソーラー浴びるようじゃ
445.0,447.0,何かそういう自然
447.0,449.0,エネルギー事業です
449.0,450.0,エネルギー事業です
450.0,451.0,何が来るの教えてくんね
451.0,453.0,こっそり
453.0,455.0,こっそり
455.0,457.0,田舎で300坪言うほどだな
457.0,458.0,だけどさ
458.0,460.0,東京の300坪って
460.0,462.0,東京でやることを考えると
462.0,464.0,田舎の300坪の方が全然
464.0,468.0,多分80分の1ぐらいなんだよ
468.0,471.0,そうするとコストカットできるだろかなり
471.0,473.0,ソーラーを浴びてまとめさせたら
473.0,475.0,そうなんだ何が来てんのじゃあ
475.0,476.0,まあそうだよな
476.0,477.0,大企業に邪魔される
477.0,478.0,その辺はさ
478.0,482.0,例えばみんな余裕資金のある人間が
482.0,483.0,何だっけ
483.0,484.0,あれするようなもん
484.0,486.0,マンション
486.0,487.0,マンションする
487.0,488.0,メンテナンスはどっちにしろかかるけどさ
488.0,491.0,人との付き合いがなくていいだろあんまり
491.0,493.0,電気自動車の類
493.0,497.0,専門性が高すぎるだろそれって
497.0,498.0,専門性が高すぎない
498.0,501.0,そんなことないの
501.0,502.0,画面大丈夫
502.0,503.0,どういうこと画面って
503.0,504.0,何か俺
504.0,507.0,映してないかもな
507.0,508.0,わりわり
508.0,511.0,スマソン
511.0,513.0,青山茂春の話聞けば
513.0,515.0,どれだけ邪魔が来るのかって分かるよ
515.0,518.0,どういうこと
518.0,521.0,パネル置くだけで収入あるなら楽だもんな
521.0,525.0,まあ素人的な考えで言うとね
525.0,526.0,一応なんかさ
526.0,529.0,その田舎の強みってやっぱりその
529.0,531.0,広大な土地だと思ってるからさ
532.0,534.0,東京でやることと同じスケールで
534.0,536.0,できてなおかつその土地の広さを
536.0,539.0,有効活用できるのってなんだろうなって思ったところ
539.0,541.0,やっぱ畑とかさ
541.0,544.0,あの
544.0,547.0,ソーラー光発電かと思ったんだよね
547.0,548.0,甘いかなやっぱ
548.0,549.0,じゃあやめるわ
549.0,551.0,別に夢でもなんでもないし
551.0,554.0,金になるかなと思って
554.0,557.0,うんこちゃんの年齢で家建てでソーラー設置しても
557.0,559.0,電気代で設置費用のもと取れるのは
559.0,562.0,ジジイになってから
562.0,564.0,それですだからちっちゃければ
564.0,566.0,だよね
566.0,567.0,いつかは実家に帰るの
567.0,570.0,今俺の家建ててるからね
570.0,572.0,うんこちゃんハウスを
572.0,573.0,うんこちゃんズハウスを
573.0,574.0,帰らないといけねえだろ
574.0,576.0,そこまでプレッシャーかけられて帰らない
576.0,579.0,って言えねえだろ
579.0,581.0,親父が建ててるよ
581.0,583.0,それは家の天井につけるとかの話じゃない
583.0,584.0,そうだよね
584.0,587.0,そうするとやっぱ時間かかるよね
587.0,588.0,金持ちじゃねえよ
588.0,591.0,田舎なんだってみんなの考えと違えんだって
591.0,593.0,それはさ
593.0,595.0,全然金持ちじゃねえだって
595.0,597.0,みんなの考えてる
597.0,600.0,家を建てるとかそういう考えじゃないの
602.0,605.0,本当に田舎だから
605.0,607.0,TPPで輸入産業
607.0,610.0,輸入業者は儲かる
610.0,612.0,一時的なものだと思うけどな
612.0,613.0,違うのかな
613.0,615.0,そういうのって
616.0,618.0,猫まで山ほど居る?
618.0,619.0,居たよ
619.0,621.0,山ほど居た
621.0,623.0,山ほど居たね
623.0,625.0,大工の味が自作してんの?
625.0,626.0,自作っていうかまあ
626.0,628.0,いろんな企業介入して
628.0,631.0,企業っていうかその業者っていうか介入して
633.0,635.0,最近実家帰ったの?
635.0,637.0,そうだね
637.0,638.0,昨日一昨日と
638.0,641.0,実家でちょっとやらなきゃいけない作業があって
641.0,642.0,帰ったよ
642.0,644.0,いいもんだねすごくね
645.0,647.0,姉ちゃんの子供にもあってさ
647.0,650.0,姉ちゃんが一年ぶりになったんだけど
650.0,653.0,すごくお母さんになったね
655.0,656.0,俺大工になりたいんだけど
656.0,657.0,親父紹介してよ
657.0,659.0,大工なんかやめた方がいいよ
659.0,660.0,マジで
660.0,662.0,すごくね尊敬のできる女性になってた
662.0,664.0,おおーと思った
664.0,666.0,なんか人間ってそういう
666.0,668.0,責任が生じるところになんかね
668.0,670.0,成長が生まれるんだなっていうのを
670.0,671.0,改めて思ったね
671.0,674.0,そして俺はものすごく子供だなと思った
675.0,677.0,母親とか姉ちゃんと接してみて
678.0,680.0,すごく俺は
680.0,683.0,人間として成熟してないなって思ったね
686.0,688.0,おすすめの新事業があるんだが
688.0,690.0,金持ちゲイ専門の高級デイレート
690.0,693.0,風俗業界は新規参入無理だよ
693.0,695.0,よっぽどコネクションがあるから運が良くないと
695.0,697.0,無理無理
698.0,700.0,お前人の代弁処理できるか
700.0,702.0,すげーよな
703.0,705.0,赤ちゃんのうんこ処理しててさ
705.0,707.0,喜んで
707.0,710.0,あーうんち出ちゃったねーみたいな感じで
712.0,714.0,すごいと思ったね
716.0,718.0,いやすごいと思った
719.0,722.0,なかなかできないじゃんそういうのって
722.0,725.0,なんかもうね優先順位が自分のことなんて
726.0,728.0,全然低いんだって
728.0,731.0,この子と紹介したからいつもうんこ処理してるよ
731.0,733.0,ごめんななんか
733.0,735.0,幸せ家族自慢しちゃって
737.0,739.0,幸せ家族自慢しちゃってごめん
739.0,741.0,今日もゴロリ食べな
742.0,744.0,会いたくない今日は
747.0,749.0,まったりしたいなんか
749.0,751.0,まったり
751.0,753.0,いやーでもマジで嬉しい
755.0,757.0,今までどれほどのさ
757.0,759.0,身近を背負ってたんだなっていうさ
760.0,762.0,思ったねー
762.0,764.0,1ヶ月ちょっとすっげーまったりしよう
764.0,767.0,10月さ家族旅行でハワイ行こうって話になって
767.0,769.0,それまで休みてんだよな
780.0,783.0,俺5年間無職だけど無職は飽きないよ
783.0,785.0,何やってんの
785.0,787.0,何やってんの5年間
787.0,789.0,ネット?
790.0,792.0,ネットやってたの?
794.0,796.0,ネット
799.0,801.0,なかなか
801.0,804.0,2日で辛かったぜやることがなさすぎて
804.0,806.0,昨日一昨日と
806.0,808.0,ハワイで何時行くの
808.0,810.0,んーほんと
810.0,812.0,4泊6日って言ってたからそんな大したとこ行けねーだろ
812.0,815.0,ハワイ行くんだったら1週間いなきゃだめだよな
815.0,819.0,4泊6日で20万ってどんだけホテル泊まるんだよ
819.0,821.0,シェラトンとか泊まるのかね
821.0,823.0,ちょっとあれだよな
823.0,825.0,中卒にしては
825.0,827.0,あのー
827.0,829.0,金の使い方があれだよな
831.0,834.0,うんこちゃんって自分の環境の変化とか平気なの怖いでしょ
834.0,837.0,まあそれは悪い方向に変化したら怖いけど
837.0,839.0,幸せじゃん仕事しなくていいんだよ
839.0,841.0,こんな幸せなことないだろ
841.0,844.0,たとえさえ有限であるとはいえね
844.0,846.0,期間が決まっているとはいえ
846.0,850.0,朝起きて仕事のこと考えなくていい日が来るなんて思ってなかったからさ
852.0,854.0,すげえ
854.0,856.0,いいねいいことだ
856.0,858.0,しばらくは無職を
858.0,860.0,まめまわす
860.0,862.0,たまにはな
862.0,864.0,いいんじゃないか
865.0,867.0,味わいたいね吟味したいね
871.0,873.0,最近さ俺さ
873.0,875.0,コミの掲示板とかさ
875.0,877.0,全く見えてなくて
877.0,879.0,今の会社は金属ネスどんなの
879.0,881.0,えーと1年半くらいじゃない
881.0,883.0,多分
883.0,885.0,ちゃんと数えてねえな
885.0,887.0,数えてない
887.0,889.0,その1個前の会社4年いたけどね
889.0,891.0,丸4年
891.0,893.0,4年ちょっといたほうが
893.0,897.0,仕事せずに朝から高級焼きビールの楽しみ
897.0,899.0,やべえそれ
899.0,901.0,それやべえな
901.0,903.0,夏朝起きてさ
903.0,905.0,ああ甲子園見ようみたいな感じであれでしょ
905.0,907.0,見るんでしょ
907.0,909.0,夕方くらいになってきたら配信すべえみたいな感じで
909.0,911.0,やべえなそれ
911.0,913.0,最高だな
913.0,915.0,しばらくその夏を過ごすわ
915.0,917.0,たまらんね
919.0,921.0,たまらんわ
921.0,923.0,夜はプロ野球
923.0,925.0,いいね
925.0,927.0,予選も始まってるぞらしいね
927.0,929.0,頑張ってほしい
929.0,931.0,みんなに
935.0,937.0,野球実況解説枠やろよ
939.0,941.0,そうやって言うとさ
941.0,943.0,なんていうの
943.0,945.0,熱狂的な奴らが来るじゃん
945.0,947.0,嫌じゃんそんなの
947.0,949.0,面倒くせえじゃん楽しく見れねえってか
949.0,951.0,理論とか必要ねえんだ野球に
951.0,953.0,見る分にはね
953.0,955.0,普通にわーわーぐらいの
955.0,957.0,朝会連中と見てるのが一番面白いんだよな
957.0,959.0,やたらと口うるさい奴を
959.0,961.0,見せても面白くもなんともない
961.0,963.0,だからインターネットでそういうことするのは
963.0,965.0,ぐのこっちょなんだ
965.0,967.0,俺的には無理だできねえ
969.0,971.0,今野球終わってお盆でやめますって
971.0,973.0,言ってきたらいいね
973.0,975.0,みんな
975.0,977.0,天気
977.0,979.0,そうだな
979.0,981.0,9月から後期が始まるから
981.0,983.0,それくらいのこのくらいの時期は
983.0,985.0,もらって一段落っていう人が多いのかな
985.0,987.0,20代前半
987.0,989.0,前半は無理だ後半とかになってくると
989.0,991.0,明日は松井からMLVの解説やるよ
991.0,993.0,明日も俺仕事行かねえから見るかじゃあ
993.0,995.0,素晴らしいですなんかこの
995.0,997.0,パチンコでもやんべえかし
997.0,999.0,パチンコ
999.0,1001.0,文装って言葉あるからさ
1001.0,1003.0,パチンコやるわもう暇だし
1003.0,1005.0,パチンコで暮らす
1005.0,1007.0,そういう知識しけらかしたい奴を
1007.0,1009.0,片っ端からバンって騙される
1009.0,1011.0,別に嫌じゃないんだけど面白くないだけ
1013.0,1015.0,パチンコだけやめとけ
1015.0,1017.0,マジにとらえられても
1017.0,1019.0,困るんだけど別に
1019.0,1021.0,全然やる気はないよ全く
1025.0,1027.0,おじいちゃんが巻きがんなんだけど
1027.0,1029.0,撫でたほうがいいかな
1029.0,1031.0,まあいいんじゃないかじいちゃんっていうくらいだから
1031.0,1033.0,年齢も結構上なんだろ
1033.0,1035.0,もうがんになったら天命だよそれは
1035.0,1037.0,抗うな受け入れるしかないよ
1037.0,1039.0,3040だったら
1039.0,1041.0,ある程度ね家族のこととかも考えて
1041.0,1043.0,天命かもしんないけど
1043.0,1045.0,7080でがんになったら天命じゃないか
1045.0,1047.0,俺はそう思うんだけどな
1047.0,1049.0,自分だったら何にもせずに殺してほしい
1049.0,1051.0,わっちゃんいつ仕事やめんの
1051.0,1053.0,わっちゃん仕事やめんのわかんねえ
1053.0,1055.0,アサミンママあの年齢だったら
1055.0,1057.0,家族のこと考えても
1057.0,1059.0,死ねなくね自分だったら
1059.0,1061.0,俺と同い年くらいだろあいつ
1061.0,1063.0,わかんねえけど
1063.0,1065.0,でもあの人はたっかんしてると思う
1065.0,1067.0,なんか精神がねえ
1067.0,1069.0,本当千人の意義に達してると思うよ
1069.0,1071.0,家族に振る舞えない絶対
1073.0,1075.0,なんかその自分がかわいそうだってことを
1075.0,1077.0,世にアピールしたくなっちゃうと思う
1077.0,1079.0,あの子はすごいよね
1079.0,1081.0,元の根底の土台の性格がいいんだと思う
1083.0,1085.0,家族にがんになりましたなんて言えないわ
1085.0,1087.0,俺超言うけどな
1087.0,1089.0,俺マジもう無理なんだけどがんだし
1089.0,1091.0,俺弱音吐くの超得意だからさ家族に
1095.0,1097.0,もうピカイチだね
1097.0,1099.0,家族の中でこんなに上手く綺麗に弱音吐けるのは
1099.0,1101.0,俺くらいなんじゃないかな
1105.0,1107.0,何年も人前でセックスしてるんだから
1107.0,1109.0,波の精神じゃねえだろ
1109.0,1111.0,頭のネジはずれてるんだろうな
1111.0,1113.0,でも明るくてね頑張ってほしいなって
1113.0,1115.0,単純に人として応援したくなる
1115.0,1117.0,人間かもしれない
1117.0,1119.0,朝見ゆまちゃん
1123.0,1125.0,どうなんだろうね
1125.0,1127.0,順調なのかな
1129.0,1131.0,俺もいい奴だなと思った
1131.0,1133.0,最近さ
1133.0,1135.0,よくそういう話題にならない
1135.0,1137.0,ダルシムの件でさ
1137.0,1139.0,ニコ生じゃねえからさ
1139.0,1141.0,そういうものすごい細部にまで
1141.0,1143.0,わたって話題をひっくり広げるけどさ
1149.0,1151.0,あいついい奴だと思っちゃったみたいな
1151.0,1153.0,でも俺はそういうのあんまり良くないと思うな
1153.0,1155.0,単純に
1155.0,1157.0,10年付き合わないといい奴かどうかなんてわかんねえからな
1159.0,1161.0,マジでマジで
1163.0,1165.0,そういう色眼鏡をかけてると
1165.0,1167.0,騙されそう
1167.0,1169.0,普通に
1169.0,1171.0,この人いい人だなって
1171.0,1173.0,思うのはあんまり良くないんだよね
1179.0,1181.0,やめたほうがいいと思う
1181.0,1183.0,マジで
1183.0,1185.0,今日何やってんのあいつ
1185.0,1187.0,仕事だな
1187.0,1189.0,そんなUFO会いたくもねえし
1191.0,1193.0,自分のことめっちゃ性格
1193.0,1195.0,いいと思うんだけど
1195.0,1197.0,どう思う
1197.0,1199.0,いいことじゃない
1199.0,1201.0,そういうプラス思考のやつ好きだな
1201.0,1203.0,俺って性格悪いとか言ってる
1203.0,1205.0,本気で言ってる奴よりは全然いいと思う
1205.0,1207.0,俺も自分の性格めっちゃいい奴だと思うし
1207.0,1209.0,うん
1209.0,1211.0,いいんじゃないか
1211.0,1213.0,ネガティブよりは
1213.0,1215.0,ポジティブのほうが
1215.0,1217.0,スチーだな俺は
1217.0,1219.0,スチー
1219.0,1221.0,今日さあ
1221.0,1223.0,今日帰ってきたんだけど
1223.0,1225.0,ぶっちゃけちゃうと
1225.0,1227.0,朝一の新幹線で
1227.0,1229.0,たださあ
1229.0,1231.0,姉ちゃんの子供の夜泣きが半端ねえぐらい
1231.0,1233.0,うるさくてさ
1233.0,1235.0,2時半に起きてさあ
1235.0,1237.0,12時から
1237.0,1239.0,夕方の4時ぐらいまで寝て
1243.0,1245.0,無職
1249.0,1251.0,まだ無職じゃない
1251.0,1253.0,確かに
1253.0,1255.0,気が流行ってしまった
1255.0,1257.0,無職になりたい願望がなんか
1257.0,1259.0,退職を受理
1259.0,1261.0,有給が評価され
1261.0,1263.0,正式に退職を受理された瞬間に
1263.0,1265.0,もっとなんか
1265.0,1267.0,俺の背中に羽を生えるんだろうね
1269.0,1271.0,だよね
1271.0,1273.0,まだちょっと心のどこかで
1273.0,1275.0,社会との繋がりを感じているからね
1279.0,1281.0,さあこれ貯金が10億ぐらいあったら
1281.0,1283.0,もう天国なんだろうな
1283.0,1285.0,ずーっと白食い中配信
1287.0,1289.0,やばいわ
1289.0,1291.0,ほんとにいいわ
1293.0,1295.0,やばい
1317.0,1319.0,みんなにおすすめのコスメのコーナーしていい?
1319.0,1321.0,すげえ高えけど
1321.0,1323.0,これでもあれかな
1323.0,1325.0,なんか
1327.0,1329.0,言っちゃダメなのかなこれ
1331.0,1333.0,まあいいややめとこう
1335.0,1337.0,昨日ちゃんまん財布の中に100万以上入れてたよ
1337.0,1339.0,すごくね
1339.0,1341.0,なんで
1341.0,1343.0,なんでニコ生無職に優しいの
1343.0,1345.0,100万で酔い残っちゃねえぞ
1351.0,1353.0,これ
1357.0,1359.0,財布が立ってたよ100万あったら
1359.0,1361.0,財布立つだろう
1361.0,1363.0,ゲンナまで100万も
1365.0,1367.0,今食べてるのよくわかったね
1367.0,1369.0,お前も
1369.0,1371.0,100万だ
1375.0,1377.0,うんこちゃん知見のバイトしたことある
1377.0,1379.0,したことない
1379.0,1381.0,なんでああいうのって体を張るの
1381.0,1383.0,俺好きじゃないからさ
1383.0,1385.0,ないない
1385.0,1387.0,クラッチバックってどこ行けば売ってんの
1387.0,1389.0,うーんなかなか売ってねえんだよな
1389.0,1391.0,でも絶対さ例えばさ
1391.0,1393.0,若者が持ってるような汚らしいやつは
1393.0,1395.0,持たないほうがいいぞだせえからなあれ
1395.0,1397.0,ちゃんと結構高いの買ったほうが
1397.0,1399.0,ちっちゃければちっちゃいほど高いの買ったほうが
1399.0,1401.0,俺はいいと思うなんだろうな
1401.0,1403.0,ブランドハイブランド系の
1403.0,1405.0,やつがいいんじゃない俺の日焼け止め高えぞ
1405.0,1407.0,1万するぞ
