start,end,text
5329.96,5336.639999999999,女いられんで3年あれば別に言う男はもう男だけで子供を作れるなるんだなぁ っていうのを証明されたじゃん
5336.64,5345.4400000000005,女1億1億年かかるからね3000万倍かかるから男より そういう意味ではもう中指の繁栄の権利すら男がも握っちゃったじゃん
5345.4400000000005,5351.68,唯一俺女性がに兼ねたてないなと思ったことがそこだったんだよ
5352.200000000001,5358.400000000001,もう本当に必要ないよな女が 制服の処理でも俺はな性依存症だからなぁ
5358.56,5368.120000000001,3年で進化できるからな俺らお前はできてるな オンブリー学校だけどなあの科学者化け学者のもの
5368.68,5372.88,言語力が優れてるの実証だったらそうなの
5378.320000000001,5382.200000000001,そうなんだ なんかそれもなんか
5382.200000000001,5387.080000000001,本当なのってなるけど そうでは言語力なんだよ2
5387.12,5391.48,国語の点数で決めようとじゃあ テストですで決めないか
5391.48,5394.24,言語力も
5399.0,5407.12,よりできれば男と結婚してマジで俺が男の男の人のことを好きになれるんだったら 男の人と結婚したよ
5409.68,5413.6,ホモじゃねーけど女が好きだけど
5417.08,5424.08,女が性による区別を性差別と勘違いして騒ぎ出すのをどうにかしてもございましょうねん じゃねーか弱者ってそういうふうに吠えたがるんだよ
5427.68,5430.5599999999995,これたがるんだよな
5430.5599999999995,5437.64,男女の違いはあるけど男優れどことなるとわからないそうだよね本当にいよいよなくなっちゃったよな
5437.64,5442.36,本当に どうすんだろうなぁ
5443.36,5448.5199999999995,高い歌が歌うやる低いた歌いねぇだろそれはなんか ねぇ
5448.5199999999995,5454.599999999999,メリットがでメリットっていうか このくそ詐欺でたいなぁよく言ったらちょっとやろうぜ
5454.599999999999,5458.639999999999,そさっきはあるか なんかテーマ決めようとじゃあ
5458.639999999999,5462.96,まあ僕はあのー そんなのやろうぜ
5462.96,5465.2,へー
5465.2,5470.2,今度のクソ騒ぎ出たいなぁ。よく言ったなぁ。ちょっとやろうぜ。クソ騒ぎ。今日やるか。
5470.2,5473.2,なんかテーマ決めようぜ、じゃあ。
5473.2,5476.2,テーマがねえとやる気になんねえからよ。
5476.2,5479.2,恋のクソ騒ぎ、第3期。
5479.2,5484.2,女と仲良くすると世間的な…うーん。
5484.2,5487.2,夜の写真は仕事だよ。
5487.2,5490.2,うーん。別に参加しなくていいよ、別に。そんな。
5490.2,5492.2,何か決めたいよね。
5492.2,5497.2,もうこれ女の人いないぞ。この前も途中で女の人に向かってこなかったからな。
5497.2,5500.2,やべえな。
5500.2,5505.2,なんかでもちゃんと…
5505.2,5509.2,あれだよね。テーマを持っているのが見たいよね。
5509.2,5512.2,井上がいたな。あ、いたいたいた。
5512.2,5515.2,いたいたいた。ちょっと待って。今、ちょっと待って。
5515.2,5518.2,俺、ようやく座って配信する気になったわ。
5518.2,5524.2,うぬらゴミらのせいで。うぬらゴミのおかげでな。
5524.2,5528.2,これ消す。
5528.2,5531.2,しかも井上が生ある人はそうなの。じゃあちょっとダメじゃん。
5531.2,5535.2,素人。ずぶの素人からさ。
5535.2,5537.2,ずぶの素人からのほうがいいだろ。
5537.2,5548.2,一読者。一読者から行くわよ。
5548.2,5551.2,お、ジャンボ今ログインしてるぞ。ジャンボかけて。
5551.2,5557.2,あいつ。ジャンボログインしてるから。今。
5557.2,5561.2,ちょっと待ってね。
5561.2,5563.2,いいとかよ。
5563.2,5569.2,あいつはジャンボ日記でさ、やたら出かけてますみたいなアピールしてるけど、本当にお前出かけてるのかってさ。
5569.2,5571.2,この前ね、謝罪メールが来たよ。
5571.2,5576.2,うんこちゃん、アーカイブ見ました。ごめんなさい。ごめんなさいーって来てた。
5576.2,5578.2,7月16日の8時6分に。
5578.2,5584.2,で、俺ちょうどその時スカイプログインしてていいよって返事だった。優しさだな。男の。
5584.2,5588.2,男の優しさ。
5588.2,5593.2,選べ。ジェニファー、ジャンボ、マイシャン、シュー君。誰だシュー君って。
5593.2,5597.2,バトラ、ペニコ。お前ら選んでいいぞ。
5597.2,5601.2,なんか俺も友達いっぱいできたな。なんかこうやってみるぞ。
5601.2,5608.2,めっちゃ友達いるな。ジェニファー、ジャンボ、マイシャン、シュー君、バトラ、ペニコ。選んでいいぞお前ら。
5608.2,5610.2,シュー君って誰か知らねえ。
5610.2,5613.2,誰これ。
5613.2,5618.2,誰だこれ。シュー君。
5618.2,5624.2,悩み相談は受け付けてません。悩みなら他の方へどうぞ。絶対お前これあれだろ。お前の。
5624.2,5628.2,あれだよな。7月13日に。
5628.2,5630.2,友達になってるから。
5630.2,5634.2,そういうことだろうな。
5634.2,5636.2,分かんねえ。
5636.2,5640.2,ペニコも許してやれよ。いや別に怒ってねえよ俺。
5640.2,5646.2,なんかダルシムのいじめられっぷりがあまりにも綺麗だったからちょっと絡みたくなっちゃったんだよ。
5646.2,5653.2,みんなに勘違いさせたのであるならばもう謝る。
5653.2,5656.2,最低そんぐらいだな。今ログインしてんのは。
5656.2,5661.2,ジャンボにかけるか。ジャンボにスカイプ送ろう。
5661.2,5664.2,一応女性の中じゃリーダーだからなこいつが。
5664.2,5667.2,副、副団長。
5667.2,5669.2,いるか。
5669.2,5678.2,いますか。
5678.2,5685.2,います。おー仕掛けか。ジャンボの声分かんねえよ。
5685.2,5686.2,もしもし。
5686.2,5687.2,おはようございます。
5687.2,5688.2,ジャンボさんすか。
5688.2,5689.2,はい。
5689.2,5691.2,どうもうんこちゃんです。
5691.2,5692.2,はい。おはようございます。
5692.2,5695.2,おはようございます。今日は休みですか。ジャンボさんは。
5695.2,5698.2,今日は3時くらいから面接あって。
5698.2,5699.2,何の面接。
5699.2,5700.2,コールセンターですね。
5700.2,5702.2,やめよう今日は。
5702.2,5703.2,ダメです。
5703.2,5708.2,今日は夕方から第3回あれがあるから。
5708.2,5710.2,企画ですか。
5710.2,5714.2,一応女もリーダーとして出なきゃいけないからさ。
5714.2,5716.2,3時半くらいから行かなきゃいけなくて。
5716.2,5718.2,それやめよう普通に。
5718.2,5723.2,声のクソ騒ぎあるから。俺も今無職だからさ。
5723.2,5724.2,ジャンボ実家でしょ。
5724.2,5725.2,実家です。
5725.2,5727.2,いいじゃん別に働かなくて。
5727.2,5733.2,さすがにお母さんからの圧迫感がやばくて。
5733.2,5735.2,そうなんだ。ジャンボ今年いくつ。
5735.2,5737.2,今もうちょっとで20になります。
5737.2,5738.2,そんな上げるんだ。
5738.2,5740.2,はい今21ですね。
5740.2,5742.2,そうなんだ。今無職なんだ。
5742.2,5743.2,今無職です。
5743.2,5744.2,そうなんだ。
5744.2,5745.2,はい。
5745.2,5749.2,ジャンボ日記1日2日にちょっとペース上げてほしいんだよね。
5749.2,5752.2,こういう困った時にネタがない時こそ書いてほしいんだよね。
5753.2,5759.2,思ったより1日1回もネタがなくてやばいなって毎日書いてるんですけど。
5759.2,5761.2,いいよ。2回にちょっと分けて。
5761.2,5764.2,いい感じに盛り上げていってほしいんだよね。
5764.2,5767.2,もっと顔さ。もっとさ。
5767.2,5769.2,自己顕示してほしいんだよね。
5769.2,5770.2,あえて。
5770.2,5773.2,これ今ジャンボのアンチがものすごいいるけど。
5773.2,5778.2,そこでなおかつ自己顕示をどんどんしてほしいんだよね。
5778.2,5780.2,もうやめろって声がすごい湧いてるんだよ。
5780.2,5784.2,それでも自己顕示して1.2になってほしい。
5784.2,5790.2,俺のアンチの気持ち。アンチをもジャンボに託したいというか。
5790.2,5792.2,ちょっと頑張ってみます。
5792.2,5793.2,よろしく。
5793.2,5794.2,わかりました。
5794.2,5795.2,コールセンターのバイト頑張って。
5795.2,5796.2,ありがとうございます。
5796.2,5797.2,お疲れ様でした。
5797.2,5799.2,はい。お疲れ様です。
5801.2,5803.2,くそー。ダメだったわ。
5805.2,5807.2,うんこふざけてんのか。
5807.2,5809.2,こいつバカやから冗談するしないぞ。
5809.2,5811.2,お前らとの争いを見たい。
5811.2,5813.2,繰り広げられて。
5814.2,5816.2,ジャンボだ。
5816.2,5818.2,何で一応喧嘩してんの。
5819.2,5820.2,ジャンボと。
5823.2,5824.2,ジャンボのネッキか。
5824.2,5825.2,それ聞きたかったんだよ。
5825.2,5827.2,お前自演乗聞こう。それ。
5827.2,5830.2,ジャンボ自演乗してたとか言ってたでしょ。
5830.2,5831.2,あれ。ほんとだよ。
5831.2,5834.2,それ聞きたくない?聞こう。
5835.2,5836.2,聞こう。
5836.2,5838.2,それ捌こう。ちゃんと。
5838.2,5839.2,もしもし。
5839.2,5840.2,もしもし。
5840.2,5842.2,ジャンボさ。俺一個聞きたいんだけどさ。
5842.2,5845.2,なんかお前俺の掲示板で自演してたって噂があるんだけどさ。
5845.2,5846.2,素直に答えてくれない?
5846.2,5847.2,あれガチで自演してた?
5847.2,5848.2,そうなんですよ。
5848.2,5850.2,なんかトリップバレてて。
5850.2,5851.2,うん。
5851.2,5854.2,なんか気づいたらジャンボってめっちゃ増えてたんですけど。
5854.2,5856.2,全く私一つのアカウントしか使ってないんで。
5856.2,5857.2,してないです。
5857.2,5858.2,それほんとにしてないの?
5858.2,5859.2,ほんとにしてないです。
5859.2,5861.2,ほんとにしてなくて。
5861.2,5862.2,わかった。
5862.2,5863.2,びっくりした今日。
5863.2,5865.2,じゃあ一応それはお前の言うこと信じるわ。
5865.2,5867.2,信じてください。してないです。
5867.2,5868.2,ほんとにしてないんで。
5868.2,5869.2,わかったわかった。ありがとう。
5869.2,5870.2,はい。
5870.2,5871.2,じゃあ頑張って。
5871.2,5872.2,はい。
5872.2,5875.2,どうやら白らしい。
5875.2,5878.2,どっちを信じていいかマジでわかんねーよ。
5878.2,5883.2,本当はあれなの?
5883.2,5885.2,本当に証拠を出してくれ。
5885.2,5886.2,ちゃんと裁判にかけよう。
5886.2,5887.2,今度からさ、あれしようぜ。
5887.2,5890.2,あのさ、こういう揉め事起きた時はさ、
5890.2,5892.2,このツイッチで裁判かけていこう。全部。
5892.2,5894.2,うちわの揉め事は、
5894.2,5896.2,俺が裁判官となって裁判かけていこう。
5896.2,5899.2,今ある問題をちょっとあげろ。
5899.2,5901.2,ちゃんとそこは白黒はっきりつけていこうぜ。
5901.2,5902.2,これからは。
5902.2,5907.2,その辺のナナナナっての良くねーからさ。
5907.2,5910.2,なんかその辺の裁判もちゃんとしてくからな。
5910.2,5912.2,頼むぜ。
5912.2,5913.2,鉄心はもうだって、
5913.2,5914.2,あれはもう被害者じゃん。
5914.2,5915.2,一方的な鉄心。
5915.2,5918.2,鉄心悪くねーもん俺的に。
5918.2,5922.2,じゃない?
5922.2,5923.2,じゃない?
5923.2,5924.2,そこは実は、
5924.2,5926.2,俺、自由を、自由じゃない、
5926.2,5927.2,平等をさ、
5927.2,5929.2,に重きを置く人間だからさ。
5929.2,5930.2,今あれはちょっとね、
5930.2,5931.2,違うと思う。
5931.2,5933.2,ちゃんと本当に揉め事起きた時は、
5933.2,5935.2,ツイッチで裁判かけよう。
5935.2,5937.2,で、みんなで最終的にアンケート取って、
5937.2,5938.2,どっちが悪いか決めて、
5938.2,5940.2,謝らせるっていう。
5940.2,5944.2,良くないか。
5944.2,5946.2,今度からそういう方式を取っていこうと思う。
5946.2,5948.2,掲示板にガチで沼がいる件については、
5948.2,5950.2,最近見れてねーんだよな。
5950.2,5952.2,なんかそのジャンボの、
5952.2,5953.2,あのさ、
5953.2,5954.2,あの自演、
5954.2,5955.2,あれで俺笑ったんだよな。
5955.2,5956.2,なんかあれなんだよね。
5956.2,5958.2,トリップが思いっきり同じでさ、
5958.2,5962.2,ジャンボユキ面白ーみたいなコメントがあった時でしょ。
5962.2,5963.2,あれ受けたよね。
5963.2,5965.2,あれ自演だったら面白いよな。
5965.2,5966.2,そういう欲も、
5966.2,5969.2,あ、こいつなんかそういう欲を出してきてるんだなっていうさ。
5969.2,5970.2,あったよね。
5970.2,5973.2,あれちょっとでも正直受けなかった。
5973.2,5976.2,あれ、黒だったら面白かったよな。
5976.2,5977.2,そういうさ、
5977.2,5978.2,身の、なんかね、
5978.2,5983.2,あ、こいつそういうことも自発的にできるようになってきたんだなっていうさ。
5983.2,5986.2,受けるじゃん。
5986.2,5987.2,うわーって思った。
5987.2,5992.2,感情のなんか交通がね、行われてる。
5992.2,5993.2,あれ絶対自演だぞ。
5993.2,5994.2,なんかいいね。
5994.2,5996.2,お前はあれだ。
5996.2,5997.2,今、
5997.2,5999.2,このあれ絶対自演だぞってコメントしたやつは、
5999.2,6000.2,なんか捌いてくれ。
6000.2,6001.2,ちゃんと。
6001.2,6002.2,裏を取ってくれしっかり。
6002.2,6003.2,しっかりと状況証拠があれば、
6003.2,6005.2,俺はもう一回裁判かけて、
6005.2,6006.2,俺は確かにジャンボ可愛がってるけど、
6006.2,6007.2,もう破門するわ。
6007.2,6009.2,それはしっかりお前の、
6009.2,6013.2,1、視聴者を大事にするっていう俺の意志を見せる。
6013.2,6015.2,特別な人間はいないっていう意志を見せて、
6015.2,6021.2,お前の意志を通しジャンボを破門にするよ。
6021.2,6024.2,頼むわ。
6024.2,6027.2,いや男性女性問わず俺はしっかり捌いてくよ。
6027.2,6028.2,トリップってバレないでしょ。
6028.2,6035.2,いやわかんない。
6035.2,6038.2,ページ版同じやつしか書いてない。
6038.2,6040.2,なんかもうちょっとあれだよな。
6040.2,6043.2,もうちょっと色んな人が出入りしてほしい。
6043.2,6044.2,話がさ、
6044.2,6045.2,原曲的すぎるんだって。
6045.2,6046.2,もっとなんかさ、
6046.2,6047.2,話題、
6047.2,6048.2,なんか広くさ、
6048.2,6050.2,喋れるような話題を誰かがポンと出すとさ、
6050.2,6053.2,それについて話もできるだろうけどさ、
6053.2,6056.2,孤独チャット話ばっかりしてんだよお前ら。
6056.2,6060.2,クッソどうでもよいだろあんなの。
6060.2,6061.2,超どうでもよくない?
6061.2,6064.2,色んなテーマに沿って話をしてほしいんだよ。
6064.2,6066.2,じゃないか。
6066.2,6068.2,ナシコとさ、
6068.2,6070.2,孤独チャン。
6070.2,6072.2,定期化して面白くしようとしてるやつばっかり。
6072.2,6075.2,どういうことだ。
6075.2,6076.2,もう俺たちも話題ないんだよさっしろ。
6076.2,6077.2,うーん、
6077.2,6078.2,それは俺の責任だな。
6078.2,6082.2,何かしら話題を提供しなきゃいけないよな。
6082.2,6083.2,おいナシコの電話かけろよ。
6083.2,6084.2,ナシコの番号知らねえじゃん。
6084.2,6089.2,俺ナシコの電子式ねえよ。
6089.2,6091.2,孤独チャンだけそうなんだよな。
6091.2,6092.2,1日でさ、
6092.2,6095.2,線とかついてるんだよ孤独チャン関連で。
6095.2,6097.2,それ、
6097.2,6098.2,ついていけねえよ。
6098.2,6101.2,俺ですらついていけねえよ。
6101.2,6102.2,無理だろ。
6102.2,6103.2,そんなの。
6103.2,6109.2,ニートしかついていけねえよ。
6109.2,6112.2,だがな、
6112.2,6114.2,もうちょっとなんかね、
6114.2,6116.2,あの、
6116.2,6118.2,ねえ、みんなが、
6118.2,6119.2,いや線ついてたからね。
6119.2,6120.2,普通に。
6120.2,6123.2,普通に線ついてるよ。
6123.2,6124.2,線。
6124.2,6126.2,1日で線、線流れてたんだよ。
6126.2,6127.2,ザーって。
6127.2,6128.2,線以上流れてたよ。
6128.2,6131.2,1500とか。
6131.2,6132.2,だから俺だって、
6132.2,6134.2,見る時間決まってるからだいたい。
6134.2,6136.2,朝昼晩で見るから。
6136.2,6137.2,掲示板は。
6137.2,6141.2,夜暇の時とかずっと見てるし。
6141.2,6142.2,なんか変な、
6142.2,6143.2,変なイケルマが常駐してるんだよ。
6143.2,6145.2,いちいち反応してきて書き込む気がする。
6145.2,6147.2,いや別にそれはお前が反応しなきゃいいだろ。
6147.2,6149.2,そんなもし本当にそいつがイケルマだとしたら
6149.2,6152.2,そこに合わせる必要ねえよ。
6152.2,6154.2,込み掲示板、うんこウィキ、うんこスレ、交流の場、
6154.2,6155.2,全部見るのきつい。
6155.2,6156.2,だからそれを全部、
6156.2,6158.2,込みの掲示板にまとめようって言ってんじゃん。
6158.2,6159.2,俺だってさ、
6159.2,6160.2,その不平等に扱ったことあるか?
6160.2,6161.2,俺の悪口書いてるから
6161.2,6163.2,お前のID晒し上げるわなんて言うと
6163.2,6165.2,どうなるか?
6165.2,6166.2,ねえだろ?
6166.2,6167.2,俺は信じてくれそこだけは。
6167.2,6168.2,だからそれを全部、
6168.2,6170.2,一箇所にまとめようって言ってんの。
6170.2,6171.2,込みの掲示板に。
6171.2,6173.2,みんなすごい楽じゃない?
6173.2,6176.2,俺もその方が楽なんだよね。
6176.2,6177.2,だって決してお前、
6177.2,6178.2,そしたらウィキとかさ、
6178.2,6179.2,うんこスレ、
6179.2,6185.2,交流の場とかに移動すればよくない?
6185.2,6186.2,だよねえ。
6186.2,6187.2,それ、
6187.2,6190.2,悪い案かなあ?
6190.2,6191.2,良くない?
6191.2,6192.2,この案は。
6192.2,6195.2,あー流れが早すぎてか。
6195.2,6198.2,使いづらいってところはあるなあ。
6198.2,6200.2,あのーてか俺一番良くねえのはさ、
6200.2,6202.2,バグるだろあれ。
6202.2,6203.2,バグんない?
6203.2,6204.2,あれなくなれば
6204.2,6207.2,あれなくなればもっと使いやすくなると思うんだよ。
6207.2,6208.2,あんなのさ、
6208.2,6212.2,治るだろ。
6212.2,6214.2,あれちょっとみんな的にもさ、
6214.2,6215.2,治える要素の一つじゃない?
6215.2,6220.2,ちょっとごめんね。
6220.2,6222.2,はい。
6222.2,6226.2,はい。
6226.2,6233.2,あすまさんいいでーす。
6233.2,6263.2,悪い悪い悪い悪い悪い悪い悪い悪い悪い悪い悪い悪い悪い悪い悪い悪い悪い悪い悪い悪い悪い悪い悪い悪い悪い悪い悪い悪い悪い悪い悪い悪い悪い悪い悪い悪い悪い悪い悪い悪い悪い悪い悪い悪い悪い悪い悪い悪い悪い悪い悪い悪い悪い悪い悪い悪い悪い悪い悪い悪い悪い悪い悪い悪い悪い悪い悪い悪い悪い悪い悪い悪い悪い悪
6263.2,6270.2,悪い悪い悪い悪い悪い悪い悪い悪い悪い悪い悪い悪い悪い悪い悪い悪い悪い悪い悪い悪い悪い悪い悪い悪い悪い悪い悪い悪い悪い悪い悪い悪い悪い悪い
6293.2,6300.2,悪い悪い悪い悪い悪い悪い悪い悪い悪い悪い悪い悪い悪い悪い
6324.2,6329.48,なるほどなそういうなんか確かに使い 確かになぁ
6329.48,6332.2,確かにたしかに
6333.08,6341.5199999999995,ウィキに込み貼ってたじゃんあれは俺のウィア込みがなかったからね ドル1個うんこちゃんウィークほとんど見てねーぞ
6342.76,6348.599999999999,うんこちゃんウィーキはおばみとなしこの話しがねなんでおばみとなしこって
6348.679999999999,6352.12,なしこはしてるんだおばみって
6352.72,6358.08,なにおばみって なにおばみって
6359.32,6362.28,おばみって
6362.68,6365.5599999999995,なにおばみって
6366.24,6371.36,おばみ本気で知らない何おばみって なんか流行り生
6371.36,6380.08,ニコ生のしたらば掲示板でも作ったら嫌でもさぁ だってあのコミュにあることがなんかやりやすいっていうかさぁ
6380.08,6384.92,やっぱなんていうのかなそのきっかけになって欲しいっていうか 例えばさぁ
6384.92,6391.48,ツールとか入れてなくてアラートも入れてなくてコミュの掲示板ちらっと見たときに やってるみたいなさそういいきっかけになるじゃん
6391.48,6401.32,俺のコミュに訪れるいいきっかけにならない 既存の視聴者が新規じゃなくてそういう企業取るが大事だと思うんだな
6401.32,6406.96,まあやってるし見るかーみたいなそれぐらいのライトのさ
6407.2,6412.0,コミュ掲示を追いかけてよな俺も追いかけてんだよ通過
6412.24,6420.36,追いかけてんだよと使い勝手が悪いんですよみんな言ってくんねー 本当にコミュの掲示板が使いづらいんですけどって
6420.36,6427.2,だって使ってねー奴がいるんだからさあそいつらをなんかねうまいことなんかでき ないのかねぇ
6427.8,6434.72,バグひでーよなぁ 掲示板一時回だと追いかけるだれたから朝昼晩で見るんだそしたらうんこちゃんの情報が
6434.72,6437.64,新しいようが出てくるだろう
6438.12,6441.8,20しか出ないところもくそそうだよねー
6443.6,6453.400000000001,改良案でも上げないと変えてくれんじゃそれを言っちゃったらさぁ 俺たちの仕事じゃなくない利用者の用途に応えるのが企業のなんかさ
6453.400000000001,6458.320000000001,仕事務めなんじゃないのか 別に難しいこと言ってねーだろう
6458.32,6464.759999999999,難しいのかなぁ掲示板を直すのってやっぱスケールがでけぇから難しいんだろう
6469.599999999999,6480.5599999999995,あんなに使ってるのうんこちゃんくらいなんじゃないやでもいいじゃん使ってこうよ でもここまで掲示板に書き込めるコミュ打ち黒い親もっとあるとこもあるだろうけどね
6481.56,6490.280000000001,うんこちゃん喋ってる間どこ見てるのその次以降のコメントよ別にどこも見てないよ 今お前のコメントずっと見てたから
6493.72,6504.0,ちょっとマジで頼むわみんなもさぁいやーの掲示板なくなったら寂しいよ 俺だっていつもさあ消すときにもったいねえなって思うが唯一掲示板だぜ
6504.0,6510.88,マジで俺コミュニティとかほんとくそどもくそほどどうでもいいけど 掲示板だけはやっぱさあなんていうのかな
6510.88,6513.6,面白いよ
6518.16,6523.56,でも役しか書いてないやでもそこをだからさ今現地 現在さ
6523.56,6528.68,書いてないのであればやっぱ書けるようにしたいじゃん じゃない
6528.68,6537.400000000001,でも本日あまり見てみてる俺はっきり言ってあの嘘じゃなくてねうんこウィッキーもほとんど 見てないしうんこちゃんのにちゃんとすればほとんど見ない見てないけど掲示板をメリー
6537.400000000001,6540.52,通すようにしてるよ ちゃんと
6540.52,6545.6,ちゃんとって言うが 朝昼晩は見てる
6545.6,6552.4800000000005,マジで嘘じゃねえ 掲示板にフィーチャーし始めたら来第6シーズン以降だけどその前から見てたの
6552.4800000000005,6558.200000000001,いやでも見てないなんかみんなも意見を書いてなかったしなぁ掲示板には
6558.8,6568.320000000001,なんかだからもっとねそのうんこちゃんウィッキーに書いているようなことをそこに書いて ほしいというかめんどくせえんだろうなぁ
6569.360000000001,6580.72,まこてんしのすれば一日戦2戦ですあるよそれにちゃんねるのスレッドこと ケージを見つけ俺なんかでも結構各各にして頼んでた気がする
6580.72,6587.84,なんか話題になるじゃん雑談のネタにもあるさぁ ありがたいんだよねあれ書いてくれるとやりやすいんだよね放送
6587.84,6598.56,じゃあケージもの沼に何回てくれいやそれも個性じゃねそういう奴もいてほしいんだよ そうやって自分の都合のいいようになんか線民してったら
6598.56,6601.52,よっダメじゃない
6601.76,6605.96,ん 嫌な女だからそれを書いててくれ常にずっと
6605.96,6613.68,お前しねえよみたいに出てけよみたいなさ一言でみんな そこで者裁判しようぜって言わないもあるじゃん
6613.68,6617.92,それを放棄してもしてしまうとアレなんだよねー
