start,end,text
0.0,19.0,【早送り中】
19.0,22.0,こんにちは
22.0,24.0,どうも
24.0,25.0,うんこちゃんと申します
25.0,27.0,これ出てんのかな声
27.0,28.0,あ、あ
28.0,29.0,聞こえてますか
29.0,31.0,ちょっとあのー
31.0,33.0,ブースト切ります
33.0,35.0,待ってくださいね
35.0,37.0,これ下準備すごく大事なんで
45.0,47.0,こういうことを怠るやつ
47.0,49.0,あ、ごめんなさい聞こえてなかったですね
49.0,51.0,こういうことを怠るやつってのは
51.0,53.0,やっぱいい配信ができないと
53.0,60.0,いう風に私は
60.0,62.0,思います
62.0,64.0,えーどうもこんにちは
64.0,66.0,うんこちゃんと申します
66.0,68.0,えー皆さん
68.0,69.0,名前だけでもね
69.0,71.0,本日覚えて帰っていただければなと
71.0,73.0,えー私は
73.0,74.0,今思っております
74.0,76.0,えーお久しぶりですどうも
76.0,78.0,いやーなんかもう
78.0,80.0,今日朝起きてね
80.0,82.0,感じたことを皆さん何ですか
82.0,84.0,まあね私はね
84.0,86.0,もうピンときましたね
86.0,88.0,寒いなと
88.0,90.0,ねーあんだけ暑い暑いと言ってた
90.0,92.0,夏もねーもう終わりに差し掛かってね
92.0,94.0,早くもう
94.0,96.0,秋のねなんていうのかな
96.0,98.0,そのー香りがね漂い始めた
98.0,100.0,今日この頃
100.0,102.0,いかがお過ごしでしょうか
102.0,104.0,お昼はね結構
104.0,106.0,むしろあっちいなーみたいな
106.0,108.0,感じだったと思うんですが
108.0,110.0,朝はねーものすごい寒かったじゃないですか
110.0,112.0,まあねーあのー
112.0,114.0,朝寒くて昼暑いみたいなね
114.0,116.0,服装に困るような時期に差し掛かってきました
116.0,118.0,なので皆さんもね体調管理の方にはね
118.0,120.0,えー十分
120.0,122.0,十二分にね気を付けていただければなと
122.0,124.0,思います
124.0,126.0,えー本日のあごめんなさい
126.0,128.0,画面が出てなかったですね
128.0,130.0,はい
130.0,132.0,えー本日のコンセプトといたしましては
132.0,134.0,最近ニコ生で
134.0,136.0,全然雑談してなかったので
136.0,138.0,えーリハビリも兼ねて
138.0,140.0,一時間ぐらい喋ろうかなと
140.0,142.0,えーいう風に私は思ってるんですが
142.0,144.0,ちょっとねお風呂が沸いちゃったら
144.0,146.0,えー途中で切れる可能性も
146.0,148.0,ゼロではないと
148.0,150.0,いうような感じで一つはよろしくお願いします
150.0,152.0,えーお茶飲みますね
158.0,160.0,雑談生主になろうかなと
160.0,162.0,私は
162.0,164.0,えー意気揚々とね
164.0,166.0,えー乗り込んできております
166.0,168.0,これね何にも話すこととかないんですよ
168.0,170.0,ただやっぱ
170.0,172.0,ねえ基本に書いてと言いますか
172.0,174.0,枠取らないと
174.0,176.0,やっぱりネタっていうのはどんどんどんどん
176.0,178.0,出てこないんですね
178.0,180.0,家でねアホみたいにさ
180.0,182.0,芸能人芸人みたいにさ
182.0,184.0,そんなねネタ調台本書いて
184.0,186.0,やる生放送っていうのはあんまり面白くないんですよ
186.0,188.0,やっぱりねこれパッと出て
188.0,190.0,何が起こるかわからねえよみたいな
190.0,192.0,そういうねえー
192.0,194.0,雑談をしていこうかなと思いますので
194.0,196.0,えー一つ皆さん
196.0,198.0,えーなんかねうんこちゃんに最近こんなこと
198.0,200.0,あったよーっていうね
200.0,202.0,えーそういうね話がありましたら
202.0,204.0,どしどしえーご応募しております
204.0,206.0,ご応募いただいております
206.0,208.0,タムラアツシ
208.0,210.0,結婚ロンドンハーツ3時間生放送スペシャルにて
210.0,212.0,緊急記者会見
212.0,214.0,うーんなんかね芸能人のさ
214.0,216.0,結婚とか恋愛なんてさ
216.0,218.0,至極俺はどうでもいいの正直
218.0,220.0,至極どうでもいいじゃん
220.0,222.0,まあ多少ね
222.0,224.0,あのー自分が好きな芸能人とかだったらさ
224.0,226.0,気持ちは
226.0,228.0,見たいな知りたいなって気持ちは
228.0,230.0,わからんでもないんだけど
232.0,234.0,あごめんなさい
234.0,236.0,お風呂が割れちゃいました
236.0,238.0,早くもねえー
238.0,240.0,終わりのね既適が
240.0,242.0,なりましたけどここからやっぱりね
242.0,244.0,気合い入れていかなきゃいけないのかなと
244.0,246.0,今聞こえちゃいました?
246.0,248.0,聞こえちゃいました?まあまあまあまあいいじゃないですか
248.0,250.0,今意気揚々とね話し始め
250.0,252.0,今まさに火蓋が落とされたところじゃないですか
252.0,254.0,私のニコニコ生放送の
254.0,256.0,なんでもうちょっとお話しさせてください
256.0,258.0,至極どうでもいいじゃないですか
258.0,260.0,世の中の皆さんは
260.0,262.0,果たして興味あるのかなと
262.0,264.0,よくなんかね新聞とかのね
264.0,266.0,見出しとかでもさ
266.0,268.0,なんかね一面をにぎわすじゃないですか
268.0,270.0,おそらくねあの俺見てないんだよ
270.0,272.0,テレビとか今日見てないんですけど
272.0,274.0,ロンドンブーツの厚紙がね皆さんのコメント
274.0,276.0,見る限り結婚したかもしくは婚約を
276.0,278.0,発表したとそういうニュースで
278.0,280.0,今にぎわってるんでしょ
280.0,282.0,で明日おそらくまあね新聞とか
282.0,284.0,朝のニュース番組とかでは
284.0,286.0,こぞって取り上げるんだろうけど
286.0,288.0,至極どうでもいいんです本当に私は
288.0,290.0,全く興味がないというかただやっぱりね
290.0,292.0,需要がないところに供給
292.0,294.0,っていうのは湧かないと思うんですね
294.0,296.0,なので皆さんは知りたがってんのかな
296.0,298.0,っていうのが単純に今
298.0,300.0,なんていうのかな私の頭の中にね
300.0,302.0,ポッと出てきたんですよ
302.0,304.0,全然どうでもいいじゃないですか自分のね結婚とかさ
304.0,306.0,身内の結婚とかだったらまあ多少
306.0,308.0,友達とかね仲のいい友人とか
308.0,310.0,ねえそういう結婚
310.0,312.0,のニュースだったら結構ね気には
312.0,314.0,なるんですがまあね
314.0,316.0,他人の結婚とかあんまり興味ないというかね
316.0,318.0,いまだにテレビって人気あるの
318.0,320.0,でもやっぱり特別なんじゃない
320.0,322.0,俺ねこの前ねあの
322.0,324.0,あいつに会ったんですよ
324.0,326.0,ザブングルの加藤
326.0,328.0,ザブングルねえはっきり言ってザブングルの
328.0,330.0,加藤なんて日常生活で
330.0,332.0,お話しするときなんてザブングルの
332.0,334.0,加藤ごときじゃないですかただね
334.0,336.0,見たらものすごいテンション上がっちゃいました
336.0,338.0,その日一日幸せだったと
338.0,340.0,あんまりテレビに興味のないうんこちゃんですら
340.0,342.0,そういうね好評感を覚えるということは
342.0,344.0,やっぱりねテレビ好きな人にとっては
344.0,346.0,すごいね
346.0,348.0,嬉しいことなんじゃないのかなと
348.0,350.0,いう風に思います
350.0,352.0,最近さ俺悩みがあって
352.0,354.0,俺昔ね英語超できたの
354.0,356.0,松井が結婚するときどう感じた
356.0,358.0,んーはっきり言ってね自分のことのように喜んだ
358.0,360.0,松井秀樹は俺唯一
360.0,362.0,特別の存在だからね俺ね最近ね
362.0,364.0,あの免許更新に行ったんだけど
364.0,366.0,松井秀樹が訪れたっていう理由だけで
366.0,368.0,家から遠いサメ図まで行ってきたからね俺
368.0,370.0,松井秀樹はどうやら
370.0,372.0,あそこの教習所で免許を更新してるよ
372.0,374.0,っていう情報を仕入れて
374.0,376.0,私はわざわざ一番遠方の地である
376.0,378.0,サメ図まで行って更新してきたからね
378.0,380.0,ちょっとでも感じたいから
380.0,382.0,ちょっとでも松井と同じ環境に身を置きたいから
382.0,384.0,まだまだ俺はそういう気持ちでいるからね
384.0,386.0,まだ現役復帰望んでるからね俺は
386.0,388.0,松井のぬくもりを感じながら
388.0,390.0,免許の更新を先日してきました
390.0,392.0,何の話だっけ
392.0,394.0,何の話だっけ
394.0,396.0,聖地巡礼ですねまさにだからそういうね
396.0,398.0,オタクのねあのちょっと待ってね
398.0,400.0,銀行口座のパスワード保護みたいな
400.0,402.0,ノートンが騒ぎ出してるけどちょっと待ってね
402.0,404.0,分かるんですよ
404.0,406.0,九牛が行ったところに行くぞ
406.0,408.0,みたいな
408.0,410.0,来るーみたいな
410.0,412.0,あるじゃないですかみんなが好きな声優なんだっけ
412.0,414.0,あのおでこ広い女の子
414.0,416.0,名前なんだっけ
416.0,418.0,あの何だっけ
418.0,420.0,あのみんなのさ
420.0,422.0,好きなさおでこの広い女の子名前なんだっけ
422.0,424.0,そう平野綾
424.0,426.0,平野綾が神社に訪れたぞみたいな感じで
426.0,428.0,よくみんなはねこぞって出かけたりするじゃないですか
428.0,430.0,埼玉のね
430.0,432.0,埼玉くんだりまで出かけるじゃないですか
432.0,434.0,まそれと同じような感じですよね
434.0,436.0,聖地巡礼
436.0,438.0,多少なんていうのかなあの気持ちは分からんでもないな
438.0,440.0,っていう風に正直思いました
440.0,442.0,でそう最近の悩みがあってね
442.0,444.0,俺ね最近ね俺学生の頃
444.0,446.0,高校時代とか英語マジでできたの
446.0,448.0,マジでできたっていうか
448.0,450.0,自分の高校が大して頭良くなかったから
450.0,452.0,その高校の中ではできたっていうくらいなんだけど
452.0,454.0,センター試験で言ったら9割くらい取れてたの
454.0,456.0,でだからなんていうの
456.0,458.0,一般教養の英語のレベルで言ったら
458.0,460.0,普通以上じゃないですか
460.0,462.0,一応ね一応普通以上じゃないですか
462.0,464.0,で最近ね
464.0,466.0,よく外人に話しかけられるの
466.0,468.0,俺本当に今日もね
468.0,470.0,会社の帰り
470.0,472.0,大都会を歩いてたら
472.0,474.0,本当に4人組くらいの若い女の子の
474.0,476.0,外人に話しかけられて
476.0,478.0,Excuse meって言われたのね
478.0,480.0,で俺すげえテンパっちゃって
480.0,482.0,すげえテンパっちゃって
482.0,484.0,I don't speak Englishって言っちゃったの
484.0,486.0,でなんていうのかな
486.0,488.0,本来のポテンシャルが全然
488.0,490.0,出せてないんだよね
490.0,492.0,いや持ってない本当にそうやって言っちゃって
492.0,494.0,あのー
494.0,496.0,やばいじゃんちょっとやべえと思って
496.0,498.0,次話しかけられた時は
498.0,500.0,絶対そんなことないようにしよう
500.0,502.0,そんなことないようにしようって
502.0,504.0,話しかけようみたいな
504.0,506.0,困ってる外人が見かけたらやっぱり
506.0,508.0,自分が偏見のうち外国に赴いた時に
508.0,510.0,困ってる時に優しくしてくれる現地の人って
510.0,512.0,やっぱいいじゃないですか
512.0,514.0,本当に日本人のやっぱりね
514.0,516.0,優しさ見せちゃうぞみたいな感じで
516.0,518.0,この前渋谷に遊びに行った時にね
518.0,520.0,あのー
520.0,522.0,外人が写真撮ろうとしてたの
522.0,524.0,女の子2人と
524.0,526.0,メンズ1人で写真撮ろうとしたんだけど
526.0,528.0,そこであ分かったじゃ俺が
528.0,530.0,写真撮ってやろうと思って
530.0,532.0,考えたんだけど
532.0,534.0,Would you like me
534.0,536.0,to take your picture
536.0,538.0,っていう言葉が出てこなくて
538.0,540.0,なんかいよいよ
540.0,542.0,最近ね本当に
542.0,544.0,英会話の
544.0,546.0,基礎能力が
546.0,548.0,すごくね
548.0,550.0,落ちてるんですよねなので
550.0,552.0,Would you like me
552.0,554.0,to take your pictureでしょ
554.0,556.0,Would you like me
556.0,558.0,to take your pictureでしょ
558.0,560.0,Would you like me to take your pictureでしょ
560.0,562.0,合ってるでしょ
562.0,564.0,Would you like me to take your picture
564.0,566.0,文法ばっか並んでたから
566.0,568.0,Would you like toって
568.0,570.0,熟語のように覚えてたから
570.0,572.0,出てこなくて通じなかったみたいな
572.0,574.0,ニュアンスで向こうは感じ取ってくれたけど
574.0,576.0,なるほどねジャップねみたいな
576.0,578.0,そういう感じだったんですよ
578.0,580.0,だからね
580.0,582.0,そうやって言うとね
582.0,584.0,バカにされるの若い子たちに
584.0,586.0,ただお前らも10年経ったらマジで
586.0,588.0,できなくなるから
588.0,590.0,コツコツコツコツ
590.0,592.0,英語ができないっていうと
592.0,594.0,世界の共通語って言われてるじゃないですか
594.0,596.0,その分なんか
596.0,598.0,インプットの数が減るっていうすごいね
598.0,600.0,自分にとってはね
600.0,602.0,昔はできたんだよ本当に
602.0,604.0,日常生活
604.0,606.0,日常会話ぐらい
606.0,608.0,弱日常会話ぐらいは
608.0,610.0,一応聞き取れたり喋れたりできたんだけど
610.0,612.0,それすらできなくなってるんだと
612.0,614.0,なんで皆さんもね
614.0,616.0,今ね持ってる知識がね
616.0,618.0,未来英語を続くとは限りません
618.0,620.0,コツコツコツコツね
620.0,622.0,努力し積み上げていただければなと
622.0,624.0,思いますちょっとお茶飲みますね
628.0,630.0,昔はできたアピールしてる今が
630.0,632.0,一番ダサい
632.0,634.0,いや違うその今
634.0,636.0,だって昔できなかったら今できてるの
636.0,638.0,当たり前じゃんみたいな感じじゃん
638.0,640.0,昔はすごいできたのに今はこんなにできないんだよ
640.0,642.0,っていうさ比較
642.0,644.0,過去の自分と比較してるんですよ
648.0,650.0,本当に本当に
650.0,652.0,最近ね
652.0,654.0,速読英単語
654.0,656.0,速読英単語の初級編をね
656.0,658.0,めちゃくちゃ勉強してます
658.0,660.0,なんで
660.0,662.0,大企業に入らん限り使わなくない?
662.0,664.0,使わないけどさ
664.0,666.0,喋れたら喋れたで面白い
666.0,668.0,よしかぜかひかで言ったらぜでしょ
668.0,670.0,みんなも喋れるようになるよ
670.0,672.0,って言ったら喋れるようになるでしょ
672.0,674.0,俺もその程度のニュアンスなんだけど
674.0,676.0,やっぱりなんていうのかな
676.0,678.0,昔できてたことができなくなるっていうのはね
678.0,680.0,すごく物悲しいもんですよ
682.0,684.0,頭の中身だけじゃなくて
684.0,686.0,陽子にも顕著に現れてくるんですよ
688.0,690.0,朝起きて顔に
690.0,692.0,寝相が悪いからね顔にすごいさ
692.0,694.0,枕のシミとか跡とかがついてて
694.0,696.0,それが昼前まで治んないとかさ
696.0,698.0,なんか毛穴が気になってきちゃったなみたいな
698.0,700.0,DSの上の画面に映る自分が
700.0,702.0,なんかちょっと
702.0,704.0,親父の臭いを感じるみたいな
704.0,706.0,シミじゃないシワね
706.0,708.0,そういうね
708.0,710.0,劣化をすごく
710.0,712.0,最近感じるんですよね
712.0,714.0,なのでちょっと皆さんもね
714.0,716.0,本当にね今だけだぞ
716.0,718.0,本当に生きがってられるのは
718.0,720.0,今だけだと思いますよ
720.0,722.0,20代後輩になってくると進化
722.0,724.0,成長ではなく劣化
724.0,726.0,本当にねそのようにまざまざと
726.0,728.0,自分で老化ですよね
728.0,730.0,そのようなね
730.0,732.0,感情が本当に
732.0,734.0,湧いてきます
734.0,736.0,なので最近エステティックサロンに
736.0,738.0,週2回会話していただいておりまして
738.0,740.0,本日もね行ってきました
740.0,742.0,なんでねすごく気分が良くて
742.0,744.0,今日だったらニコ生できるんじゃないか
744.0,746.0,っていうねそういう気持ちで
746.0,748.0,今ニコ生やらせていただいております
748.0,750.0,業務連絡でしたちょっと水飲ませてくださいね
754.0,756.0,立見師表示できてない?
756.0,758.0,マジで?ごめんごめん
758.0,760.0,ちょっと待ってね
760.0,762.0,立見師じゃあ目視しますちゃんと
762.0,764.0,この自分で
764.0,766.0,こんにちはこんにちは
766.0,768.0,どうもどうも
768.0,770.0,うんこちゃんでーす
770.0,772.0,よろしくお願いしまーす
772.0,774.0,なんか全然気づけませんでした
774.0,776.0,なんかねうまくコメビューがうまく
776.0,778.0,映してくれませんでした
778.0,780.0,すいませんすいません
780.0,782.0,たぶん次回やる頃には
782.0,784.0,やる頃には
784.0,786.0,綺麗になってるんじゃないのかなと思います
786.0,788.0,ポコタが吉本入ったの知ってる
788.0,790.0,あそうなんだなんかでも
790.0,792.0,芸能活動するってなったら
792.0,794.0,どっかのプロダクションに
794.0,796.0,入らないといけないんでしょ
796.0,798.0,俺よくわかんないけど
798.0,800.0,芸能関連の仕事してないから
800.0,802.0,だからまあでっかい事務所なんだし
802.0,804.0,いいんじゃないのかなと
804.0,806.0,私はもう素人の考えながら
806.0,808.0,そういう風に思いますけどね
808.0,810.0,最近なんかねそのような
810.0,812.0,伝統化がすごいじゃないですか
812.0,814.0,ゲロさんもね
814.0,816.0,全国ツアー回ってるみたいですし
816.0,818.0,ポコタもねダウンタウンデラックスの
818.0,820.0,エンディング歌ってるじゃないですか
820.0,822.0,ウラタニタッチはね変な大手
822.0,824.0,声優事務所
824.0,826.0,なんかすごい
826.0,828.0,そうやってね一般化していくのはねすごく
828.0,830.0,やっぱ良くないんじゃないのかなと
830.0,832.0,私自身ね思いますので
832.0,834.0,私はもうひたすらにこの殻にこもって
834.0,836.0,いつものようにねしていこうかなと
836.0,838.0,いう風に私は
838.0,840.0,皆さん大好き高田健一さんもね
840.0,842.0,あの今俳優として
842.0,844.0,なんと半沢直人の方にもね
844.0,846.0,あのーすいません遅れちゃってね
846.0,848.0,申し訳ないんですけど私のね友人の
848.0,850.0,高田健一くんが半沢直人の方にね
850.0,852.0,出演したらしいのでぜひ皆さんね
852.0,854.0,応援していただければと
854.0,856.0,半沢直人だっけなんだっけ
856.0,858.0,伊達直人と半沢直人が混ざっちゃったんだけど
858.0,860.0,半沢直樹だっけ
860.0,862.0,ちょっと待て俺たちみし表示するわ一回
862.0,864.0,ちょっとごめんね一瞬切るわ
864.0,866.0,あの
866.0,868.0,コメントは見れてないんですけどちゃんと
870.0,872.0,なんか再コメ部再接続すれば
872.0,874.0,どうやら繋がる
876.0,878.0,らしいので
878.0,880.0,ちょい待ってね
884.0,886.0,今日ちょっと2時間ぐらい喋りてんだよな
894.0,896.0,来い!よーし
898.0,900.0,皆さん見てますか
904.0,906.0,これでちょっといつものようなね
906.0,908.0,あの雑談体制に
908.0,910.0,しておこうかなと
910.0,912.0,していこうかなと私もね
912.0,914.0,今日はいつもはね寝ながら放送してるんですけど
914.0,916.0,あちょっと分かった
916.0,918.0,330秒やるわ
918.0,920.0,ちょっと今日彼女もいねーしゴミがいねーから
920.0,922.0,ちょっと
922.0,924.0,ちょっと
924.0,926.0,必殺雑談体制でちょっと
928.0,930.0,NERも真っ青なちょっと
930.0,932.0,放送していこうかなと
932.0,934.0,思います
934.0,936.0,気分がね
936.0,938.0,落ち込み次第放送やめるんで
938.0,940.0,よろしくお願いします
940.0,942.0,ハンガリーからもね全国
942.0,944.0,ね世界からね集まってきますんで
944.0,946.0,私の放送にね
946.0,948.0,こぞって参加していただければなと
948.0,950.0,いう風に思っております水飲みますね
952.0,954.0,まずジーンズについて語って
954.0,956.0,なんかちょっとあれしようかな
956.0,958.0,あの各
958.0,960.0,あのセクター
960.0,962.0,ワンセクター30分とし
962.0,964.0,アリーナたちみえたちみびたちみしーから
964.0,966.0,一個ずつ議題を拾いながら
966.0,968.0,ちょっと30分
968.0,970.0,絶対無理だな絶対無理だ
970.0,972.0,俺の浅はかな知識でさ
972.0,974.0,そんなさ
974.0,976.0,難しいなまあでもちょっと
976.0,978.0,チャレンジすることはいいことだもんな
978.0,980.0,じゃあアリーナの方からちょっとね
980.0,982.0,コメント拾いつつ
982.0,984.0,30分ねなんかちょっと熱くなれるような
984.0,986.0,議題がいいな
986.0,988.0,熱くなれるような議題
988.0,990.0,なんかムキになる俺もムキになれるし
990.0,992.0,視聴者もムキになれる
992.0,994.0,みたいな
994.0,996.0,そういうちょっとなんか
996.0,998.0,あのちょっと待ってください他の人たちコメントしないでください
998.0,1000.0,今アリーナの人たちから拾うんで
1000.0,1002.0,巨人野球に関してはね
1002.0,1004.0,血股すぎる
1004.0,1006.0,局所的すぎるからもうちょっと全人類が
1006.0,1008.0,脳に障害を持たない
1008.0,1010.0,痛みだったら喋れるような
1010.0,1012.0,それぐらいのなんつーのかな
1012.0,1014.0,広いなんか
1014.0,1016.0,区切りでしょ
1016.0,1018.0,あ絶対まあいいや
1018.0,1020.0,オリンピックねえなんか
1020.0,1022.0,2020年違う
1022.0,1024.0,2020年だっけなんかオリンピック東京でやるんでしょ
1024.0,1026.0,俺ねすげー楽しみなんだよね
1026.0,1028.0,なんかやっぱ我々ね
1028.0,1030.0,あの若者は
1030.0,1032.0,オリンピック生で見てないじゃん1964年だっけ
1032.0,1034.0,に東京五輪があって
1034.0,1036.0,それ以来46年
1036.0,1038.0,じゃあ56年ぶりか
1038.0,1040.0,56年ぶり?何年ぶりだ
1040.0,1042.0,56年ぶりぐらいか
1042.0,1044.0,にーで来るんでしょ
1044.0,1046.0,なんかすごいテンション上がるよね
1046.0,1048.0,なんかね俺もそれまで俺の野望としては
1048.0,1050.0,それまでちょっと肌とか綺麗にしといて
1050.0,1052.0,外人の女と一発やりたいって
1052.0,1054.0,すぐに浮かんできたからね
1054.0,1056.0,35だったらまだいけるだろうみたいな
1056.0,1058.0,そういう男の渋さ持ってんだろうみたいな
1058.0,1060.0,なので皆さんもねこれから
1060.0,1062.0,しっかりね肌のケア等々
1062.0,1064.0,いたしましてね
1064.0,1066.0,日本人の女以外とも
1066.0,1068.0,肌と肌を重ねることって大事じゃないですか
1068.0,1070.0,世界的にねあの女の子はどういう考えを
1070.0,1072.0,持ってるんだろうと
1072.0,1074.0,私は思ってませんで
1074.0,1076.0,ぜひそのようなねあの影の活動もね
1076.0,1078.0,していこうかなと
1078.0,1080.0,金梅と同い年のうんこ
1080.0,1082.0,ちょっとねもしかしたらニコ生やってないのかもしれませんが
1082.0,1084.0,できればニコ生もやっていきたいなと
1084.0,1086.0,思ってるんですけどね
1086.0,1088.0,世界の悪く15歳
1088.0,1090.0,うーん
1090.0,1092.0,まあねただねあんまりね
1092.0,1094.0,最近さあの仕事ばっかしててね
1094.0,1096.0,一つのことしか考えてなくて
1096.0,1098.0,全くねあの寄せ人
1098.0,1100.0,みたいになってんの本当に全く世間の流れが
1100.0,1102.0,わからないというか
1102.0,1104.0,もちろんなんかニュースとかはチラチラ見てるから
1104.0,1106.0,まあかいつまんだよね本当に
1106.0,1108.0,局所的にはなんか仕入れてるんだけど
1108.0,1110.0,世界が今シリアが何が起きてるか
1110.0,1112.0,とか全然わかんないわけよ
1114.0,1116.0,だからちょっとねもうちょっとわかりやすい
1116.0,1118.0,アンパンマンみたいなね
1118.0,1120.0,そのような話題でちょっとしていきたいなと
1120.0,1122.0,職場でいじめられてない
1122.0,1124.0,あのすごいね
1124.0,1126.0,感じ悪いんだけどね俺すげー職場で
1126.0,1128.0,偉くてさ
1128.0,1130.0,なんかねえ
1130.0,1132.0,偉い人になっちゃって職場で
1132.0,1134.0,偉いつってもちっちゃいちっちゃい
1134.0,1136.0,部署の中でちょっと偉い
1136.0,1138.0,ぐらいなんだけどやっぱ平社員
