start,end,text
2188.0,2190.0,お財布にちょっと余裕がある方のみ
2190.0,2192.0,参加していただければなと
2192.0,2194.0,あの観客は一切入れません
2194.0,2196.0,観客はゼロ人でやります
2196.0,2198.0,観客はゼロ人でやります
2198.0,2200.0,えーそういうなんていうのかな
2200.0,2202.0,ねえそのなんていうの終わった後みんなで飲もうぜ
2202.0,2204.0,みたいなクソくだらねえようなね
2204.0,2206.0,あのそういうのマックスがやるんだよ
2206.0,2208.0,私は参加者のみ競技内容
2208.0,2210.0,もう戦いに戦いの舞台に登れるのは
2210.0,2212.0,戦士だけなんだよ
2212.0,2214.0,戦士だけなんで
2214.0,2216.0,ただねなんでなんで55人ぐらいは欲しいなと
2216.0,2218.0,ねえあのー
2218.0,2220.0,55と言えば何かとね私にちなんだ
2220.0,2222.0,数字じゃないですか
2222.0,2224.0,何かと私にちなんだ数字じゃないですか
2224.0,2226.0,ちょっと東京ドームでね
2226.0,2228.0,2時間やりたいなと
2228.0,2230.0,前もそんな話したぞ
2230.0,2232.0,いや俺夢なんだよだからやりてえって言ったじゃん
2232.0,2234.0,やりてえよやりてえよって前から言ってたじゃん
2234.0,2236.0,東京ドームでなんか
2236.0,2238.0,運動会やろうぜって
2238.0,2240.0,ただねえちょっとねえ裏方そしたらね
2240.0,2242.0,募集しなきゃいけないんだよね
2242.0,2244.0,でも俺ねおめえらみたいな
2244.0,2246.0,俺おめえらのことほんとに
2246.0,2248.0,あんまり関わりたくないから
2248.0,2250.0,俺抜きでみんなで裏方してほしい
2250.0,2252.0,で俺とは一切コンタクト取らないでほしいんだよね
2252.0,2254.0,絶対顔見せたくないしさ
2254.0,2256.0,みんなに
2256.0,2258.0,あとそのあと影で慣れ合ってたら
2258.0,2260.0,マジで殺すっていうか
2260.0,2262.0,一人だけ俺の四角を
2262.0,2264.0,打ってみんなの顔写真撮るから
2264.0,2266.0,裏方は全員顔写真撮って
2266.0,2268.0,本名フルネーム住んでるところ
2268.0,2270.0,住所氏名年齢電話番号
2270.0,2272.0,全て個人情報取ります
2272.0,2274.0,そんで後々
2274.0,2276.0,出会ったり携帯番号の交換はしません
2276.0,2278.0,私のコミュニティの掲示板
2278.0,2280.0,私のコミュニティの掲示板で連絡を取り合ってください
2280.0,2282.0,それその違反者が出た場合は
2282.0,2284.0,本当に許しません
2284.0,2286.0,これね冗談今まで俺冗談で
2286.0,2288.0,こいつ許さねえぞとか言ってきたけどこれ本当に許しません
2288.0,2290.0,そのような
2290.0,2292.0,誇り高き
2292.0,2294.0,気高い純
2294.0,2296.0,順度の高い
2296.0,2298.0,信者以外は
2298.0,2300.0,指くわえて
2300.0,2302.0,放送で見ていただければと
2302.0,2304.0,戦う資格がないので
2304.0,2306.0,出会い禁止っていうかもう
2306.0,2308.0,出会うことはないですよだって
2308.0,2310.0,うんこちゃんのコミュニティの掲示板以外で
2310.0,2312.0,やり取り禁止ですから携帯番号も
2312.0,2314.0,交換させません
2314.0,2316.0,当日
2316.0,2318.0,ちょっとね
2318.0,2320.0,ちょろちょろっと口裏を合わせる程度
2320.0,2322.0,男性
2322.0,2324.0,しかも男性のみ
2324.0,2326.0,そのね
2326.0,2328.0,縛りをちょっと設けたいと思いますので
2328.0,2330.0,ぜひね
2330.0,2332.0,大学最後の夏休み
2332.0,2334.0,うんこちゃんにちょっとね
2334.0,2336.0,捧げてみようと
2336.0,2338.0,そういう方がいましたらね
2338.0,2340.0,応募次第
2340.0,2342.0,まあそのちょっと色はつけたいなと
2342.0,2344.0,色はつけたいなと
2344.0,2346.0,思いますのでよろしくお願いします
2346.0,2348.0,この放送に女いないだろう
2348.0,2350.0,今アンケート取っていいですか参加してくれますか
2350.0,2352.0,裏方
2352.0,2354.0,裏
2354.0,2356.0,方
2356.0,2358.0,ちょっと待ってね
2358.0,2360.0,裏方
2360.0,2362.0,ちょっとやろうぜ
2362.0,2364.0,なんかさ
2368.0,2370.0,そういうさ
2370.0,2372.0,いよいよだなみたいな
2372.0,2374.0,なんだフォームにスペースがあります
2374.0,2376.0,なんだこいつバカなんじゃないの
2376.0,2378.0,フォームに空欄があります
2378.0,2380.0,バカなんじゃないの
2380.0,2382.0,意味がわかんない
2382.0,2384.0,なに空欄って
2384.0,2386.0,あここかごめん
2386.0,2388.0,俺が間違ってた空欄があった
2388.0,2390.0,正しい日本語使ってやがった
2390.0,2392.0,夏のほうがこれちょっと真剣にやってくださいね
2392.0,2394.0,女性の方は家に入れてください
2394.0,2396.0,残念ながら当コミュニティ
2396.0,2398.0,ではちょっとあの女性の
2398.0,2400.0,土俵上
2400.0,2402.0,あげるわけにはいかないんで
2402.0,2404.0,よろしいですか
2404.0,2406.0,女性は家に入れてくださいね
2406.0,2408.0,私はちなみに家に入れました
2408.0,2410.0,それでは結果を表示します
2410.0,2412.0,おおということは1000人
2412.0,2414.0,裏方だけでも1000人
2414.0,2416.0,集まると
2416.0,2418.0,わかりました
2418.0,2420.0,その裏方の中で
2420.0,2422.0,待ってねちょっと待って
2422.0,2424.0,やってもいいよっていう
2424.0,2426.0,気持ちがあるけど
2426.0,2428.0,やれる
2432.0,2434.0,やる気が
2434.0,2436.0,あるけど
2436.0,2438.0,物理的に
2438.0,2440.0,不可能
2442.0,2444.0,もしくは
2444.0,2446.0,無理
2446.0,2448.0,やらない
2448.0,2450.0,タイピングおっせぇな
2452.0,2454.0,ちょっとこれで
2454.0,2456.0,いやその仕事やってる人にも
2456.0,2458.0,日曜日のあたりあの土曜日の夜
2458.0,2460.0,あのもちろん24時間やるんで
2460.0,2462.0,今一応
2462.0,2464.0,今の俺のプランで24時間やろうかなと思ってるんで
2464.0,2466.0,ちょっとその辺も
2466.0,2468.0,あの一つよろしくお願いします
2468.0,2470.0,じゃあいきますよ
2470.0,2472.0,じゃあ結果表示します
2472.0,2474.0,あーなるほど
2474.0,2476.0,ということは2000の35%
2476.0,2478.0,700人か
2478.0,2480.0,700人のうちの10%来たら70人でしょ
2480.0,2482.0,まあそのうちの
2482.0,2484.0,1%来たとしても
2484.0,2486.0,7人か
2486.0,2488.0,10人くらいあれば
2488.0,2490.0,悪くないんじゃないのかなと思いますんで
2490.0,2492.0,ぜひ皆さん
2492.0,2494.0,日にち決めるわみんな
2494.0,2496.0,日にち決めるわ
2496.0,2498.0,もちろん生放送するよ
2498.0,2500.0,生放送しないで
2500.0,2502.0,生放送しないでさ30人くらい集めて
2502.0,2504.0,運動会やってたらさ
2504.0,2506.0,頭ちょっとイカれてないかそれ
2506.0,2508.0,俺
2508.0,2510.0,生放送するためにやるんだよ
2514.0,2516.0,なれあいも
2516.0,2518.0,なれあいのもくそもねえだろそんなさ
2518.0,2520.0,ほぼなんていうんだろしょうもない
2520.0,2522.0,さえない男だろどうせくんの
2522.0,2524.0,さえない男をさ
2524.0,2526.0,ちょっとね集めてさ
2526.0,2528.0,30人40人
2528.0,2530.0,それ微妙だと思うんでね
2530.0,2532.0,OK
2532.0,2534.0,じゃあね
2534.0,2536.0,10月がいい
2536.0,2538.0,10月10日って
2538.0,2540.0,急すぎない
2540.0,2542.0,みんないける
2542.0,2544.0,あと3週間後だけど
2544.0,2546.0,10月10日でいけるか
2546.0,2548.0,真剣にもう
2548.0,2550.0,何だったら10月10日だろ
2550.0,2552.0,やるとしたら
2552.0,2554.0,休みだろいけるよな
2556.0,2558.0,10月10日
2560.0,2562.0,体育の日だ体育の日
2564.0,2566.0,無理か
2568.0,2570.0,11月とかにすると
2570.0,2572.0,まだ時間あるじゃんっていうさ
2572.0,2574.0,分かった聞いて日にちは
2574.0,2576.0,まだ未定だけど
2576.0,2578.0,10月10日にやると
2578.0,2580.0,そういう気持ちで
2580.0,2582.0,一つ準備を
2582.0,2584.0,東京ドーム抑えられる
2584.0,2586.0,確かに
2586.0,2588.0,なんかねさすがにさ
2588.0,2590.0,東京ドームもう閉まってる
2590.0,2592.0,東京ドーム電話していい
2592.0,2594.0,ちょっと東京ドームの番号
2594.0,2596.0,ちょっと待ってドームに聞いてみるガチで
2598.0,2600.0,やっぱ
2600.0,2602.0,せいせいどんどんやらなきゃいけないだろ
2602.0,2604.0,真っ向勝負でしょ
2606.0,2608.0,いやいたずら電話じゃねえよ
2608.0,2610.0,予約取るんだよ
2610.0,2612.0,どんな規模で
2612.0,2614.0,確かにな規模が決まってないと確かに
2614.0,2616.0,何名ぐらいですかって前もそうだったよな
2616.0,2618.0,何名様ぐらいですかみたいな
2618.0,2620.0,じゃあ煮詰めてから場所は確保する
2620.0,2622.0,ということで
2624.0,2626.0,まあでも今年中にやりてえな
2626.0,2628.0,いやでも11月にやりてえな
2628.0,2630.0,クライマックスシリーズの日
2630.0,2632.0,さすがにちょっとそれは
2632.0,2634.0,譲ってくんねえよな
2634.0,2636.0,でもなんかねえちょっとうまいこと
2636.0,2638.0,合間を縫って11月とかね
2638.0,2640.0,ファンフェスみたいな感じで
2640.0,2642.0,ファンフェスとずらして
2642.0,2644.0,用途も言わなきゃいけねえぞ
2644.0,2646.0,いや死んじゃえもん大運動会っていう枠で
2646.0,2648.0,取るしかないでしょ
2648.0,2650.0,貸切いくらするんだよね2時間で50万ぐらいだと思う
2650.0,2652.0,シーズンオフだったらもうちょっと安いと思うんだよね
2652.0,2654.0,ちょっとさ俺がさこの間煮詰めてる間にさ
2654.0,2656.0,視覚たちがさ
2656.0,2658.0,東京ドームの2時間いくらか
2658.0,2660.0,ちょっと
2660.0,2662.0,2時間って相当時間だくない
2662.0,2664.0,1時間で準備して1時間でやるってことでしょ
2664.0,2666.0,なんかもうあれだよな
2666.0,2668.0,機材すげえ
2668.0,2670.0,パソコン10台ぐらい持ち込んでさ
2670.0,2672.0,なんつーのコミュニティ10個ぐらいでさ
2672.0,2674.0,いろんなところからさ
2674.0,2676.0,放送しないとちょっと厳しいよね
2676.0,2678.0,片付けもいるからおそらく
2678.0,2680.0,協議してられる時間は
2680.0,2682.0,36万かじゃあわかった4時間は
2682.0,2684.0,72万か
2684.0,2686.0,4時間が72万か
2686.0,2688.0,平日が
2688.0,2690.0,47万2500円
2690.0,2692.0,休日が60万円
2692.0,2694.0,うーんちょっとでもね
2694.0,2696.0,俺東京ドームやりたいんだよね東京ドーム
2696.0,2698.0,東京ドームでやりたいから
2698.0,2700.0,あのねしかもねバックあの
2700.0,2702.0,あれは絶対やりたいんだよバックスクリーンをね
2702.0,2704.0,確かね10万ぐらい15万で貸し切れるんだよ
2704.0,2706.0,だから
2706.0,2708.0,バックスクリーンにやっぱちゃんと選手
2708.0,2710.0,入場みたいなのは入れたいんだよね
2712.0,2714.0,じゃもしさえ深夜で6時間
2714.0,2716.0,87万深夜で
2716.0,2718.0,6時間87万だって
2718.0,2720.0,やろうよ
2720.0,2722.0,深夜やろうよ深夜
2722.0,2724.0,23時30分から5時までで
2724.0,2726.0,84万これ
2726.0,2728.0,でしょ100万だったらみんな
2728.0,2730.0,いいだろ
2730.0,2732.0,いいじゃんいいじゃん
2732.0,2734.0,なんかそのミドリンピックとかバクれよくない
2734.0,2736.0,だって先人のやつをちょっと
2736.0,2738.0,うまいことバクれいいじゃん
2738.0,2740.0,そんなのさ俺たちが一から作り
2740.0,2742.0,作ることねえだろうがなんか適当にデブ集めて
2742.0,2744.0,プールとかやらせていいだろうが
2744.0,2746.0,あのもし下りそうになったらよくねえか
2746.0,2748.0,それで
2748.0,2750.0,そしたらなんつーの100人入れて
2750.0,2752.0,1万でよくない
2752.0,2754.0,いやお前な
2754.0,2756.0,このな正規の
2756.0,2758.0,大運動会に1万円で
2758.0,2760.0,参加できるんだぞ
2760.0,2762.0,出なきゃ損損だろ
2762.0,2764.0,普通に考えてわかった
2764.0,2766.0,賞金出す賞金100万
2766.0,2768.0,優勝賞金100万だぞ
2768.0,2770.0,みんなで1人2万ずつ出して
2770.0,2772.0,優勝賞金100万で法律が
2772.0,2774.0,アダゴーダー来たらもうめんどくせえから
2774.0,2776.0,やってねえってことにしよう
2776.0,2778.0,現物の手渡しだったらばれねえから
2778.0,2780.0,税務署あたりのやつでも
2780.0,2782.0,現物の手
2782.0,2784.0,お前うなちゃんマンがやったらバカ野郎だよ
2784.0,2786.0,お前らみたいに
2786.0,2788.0,みずほ経由でやってんじゃねえ
2788.0,2790.0,こっちは元気でもらってんだよ
2790.0,2792.0,現物だったらバカなよ
2792.0,2794.0,税務署も気遣わないから
2794.0,2796.0,1人2万で持ち寄って
2796.0,2798.0,優勝賞金100万
2798.0,2800.0,ちょっと
2800.0,2802.0,かけ事じゃない
2802.0,2804.0,成果に見合った報酬というか
2806.0,2808.0,1000人入れて1人1000人しよう
2808.0,2810.0,いやちょっとさ観客がいたら面白くねえだろ
2810.0,2812.0,やっぱりそこはなんか
2812.0,2814.0,聖地というか
2814.0,2816.0,入ってほしくはないんだよな
2816.0,2818.0,ちょっと悪いみんな
2818.0,2820.0,今からバイトしてくれ
2820.0,2822.0,頼むだってさ1万なんてさ年出するの
2822.0,2824.0,1日300円だぞ
2824.0,2826.0,お前ら1日ペットボトル3本くらい飲むだろ
2826.0,2828.0,それを2ヶ月間節約すれば
2828.0,2830.0,たまるじゃねえか2万
2830.0,2832.0,2万節約してくれねえか
2832.0,2834.0,今から
2834.0,2836.0,そんでやろうぜ
2836.0,2838.0,ドタキャンシー
2838.0,2840.0,先払いな
2840.0,2842.0,めんどくせえことが起こりそう
2842.0,2844.0,あの金おめえ応料しただろ
2844.0,2846.0,みたいな
2846.0,2848.0,すげえめんどくせえんだけどどうしよう
2848.0,2850.0,いやでも当日
2850.0,2852.0,お前よ
2852.0,2854.0,当日着払いとかだって
2854.0,2856.0,30人しか来なかったとかだってどうすんだよ
2856.0,2858.0,ちょっと揉めそうじゃない
2858.0,2860.0,なんかさ
2860.0,2862.0,どうしよう誰かちょっとなんか
2862.0,2864.0,俺以外の人が金管理してるだけ無理だな
2866.0,2868.0,俺以外の人が管理してるだけ無理だろ
2868.0,2870.0,お前さっきの手口みたいになってる
2870.0,2872.0,だからさ今のニコ生は本当にさ
2872.0,2874.0,物語配信がもうはびこってるからさ
2874.0,2876.0,そういうねお金の流れっていうのは
2876.0,2878.0,本当に遠目
2878.0,2880.0,あゆが進めるようなね
2880.0,2882.0,純度の純粋なる
2882.0,2884.0,等度の高い管理をしないと
2884.0,2886.0,みんなにねそういう気持ちで
2886.0,2888.0,この祭典を見てほしくないんだよね
2888.0,2890.0,本当に
2890.0,2892.0,この人たちは戦ってるんだなっていう
2892.0,2894.0,チケット売れよ
2894.0,2896.0,いやそんな物理なことはしたくないんだよね
2896.0,2898.0,だって参加したい
2898.0,2900.0,自分たちが参加したいからお金払ってきてるんだから
2900.0,2902.0,それはなんていうのかな
2902.0,2904.0,元も子もないというか
2904.0,2906.0,ぜひちょっとね
2906.0,2908.0,深夜
2908.0,2910.0,でもさいつまでになんか
2910.0,2912.0,金払わなきゃいけないみたいなね
2912.0,2914.0,ちょっとやって
2914.0,2916.0,100万にならなくても総取りでいいじゃん
2916.0,2918.0,まあそうだね
2918.0,2920.0,賞金はなしにして単純に
2920.0,2922.0,ねそのステータス
2922.0,2924.0,富ではなく名声をちょっと得る戦いというか
2924.0,2926.0,それはなんかもう
2926.0,2928.0,一生なんか称えられるような
2928.0,2930.0,伝説のなんかレジェンドにしていきたいよね
2930.0,2932.0,記録
2932.0,2934.0,もう多分二度とやんねえだろうが
2934.0,2936.0,その運動会で彼女連れてっていい?
2936.0,2938.0,参加者以外は入れませんよ中に
2938.0,2940.0,ちょっとごめんなさい
2940.0,2942.0,ティッシュ持ってきます
2942.0,2944.0,参加者以外は中に入りません
2944.0,2946.0,観客はゼロでやります
2946.0,2948.0,観客がいるとなんか
2948.0,2950.0,ざわざわざわざわしちゃって
2950.0,2952.0,うるさいんでぜひちょっと
2952.0,2954.0,貸切のお金はうんこ持ちでしょ
2954.0,2956.0,いや貸切のお金も全部俺ももちろん払うよ
2956.0,2958.0,人数分できっちりセッパン
2958.0,2960.0,1円の
2960.0,2962.0,これぐらいでいいでしょみたいな
2962.0,2964.0,そういうのも一切なし
2964.0,2966.0,電子のマネで
2966.0,2968.0,電子に変えてちょっとやり取りさせていただきたいんで
2968.0,2970.0,1000万本当に
2970.0,2972.0,10001円1000まで
2972.0,2974.0,ちょっとね割って
2974.0,2976.0,行こうかなと
2976.0,2978.0,思います
2978.0,2980.0,お前顔バレるだろ100%バレない格好で行きます
2980.0,2982.0,あのマスクかぶって行きます
2982.0,2984.0,絶対に私顔頭上バレたくないんで
2984.0,2986.0,当日はタクシーで遠回りして帰るんで
2986.0,2988.0,あのー美行とかして
2988.0,2990.0,あのー分かった俺が先に出る
2990.0,2992.0,俺が先に出て
2992.0,2994.0,30分後じゃないかみんな
2994.0,2996.0,そこは高田賢士がちゃんとあのちょっと待ってくださいと
2996.0,2998.0,あのそのような
2998.0,3000.0,いろんな顔があってそういう
3000.0,3002.0,ボディーガードの役割もになってるんで
3002.0,3004.0,なのであの私が
3004.0,3006.0,退場した後
3006.0,3008.0,しっかり私が退出した30分後に
3008.0,3010.0,退出すると
3010.0,3012.0,そのような形で一つ
3012.0,3014.0,よろしくお願いしますみんなマスク着ようと
3014.0,3016.0,みんなマスクそうだね顔は
3016.0,3018.0,顔出しはなしでちょっと
3018.0,3020.0,行きたいなと思いますただね
3020.0,3022.0,なかなかそうなってくると
3022.0,3024.0,難しいと思うんでそういったねリスクを
3024.0,3026.0,背負う覚悟のある方というかね
3026.0,3028.0,でもちろん生放送してない方
3028.0,3030.0,生主の人は
3030.0,3032.0,参加しないでいただきたいで
3032.0,3034.0,生放送してないってことが大条件
3034.0,3036.0,というか1ウンコちゃんの視聴者
3036.0,3038.0,そのような形で
3038.0,3040.0,一応考えておりますので
3040.0,3042.0,本当に参加したかったら今すぐ込み受けして
3042.0,3044.0,どんなどんな人数の
3044.0,3046.0,アカウント
3046.0,3048.0,メンバー1人とかでも
3048.0,3050.0,ダメなのでよろしくお願いします
3050.0,3052.0,アスリート限定というかまだ競技は決めてないんだよね
3052.0,3054.0,競技は
3054.0,3056.0,決めていないので
3056.0,3058.0,早急に過急的速やかに
3058.0,3060.0,内容を練って
3060.0,3062.0,やっていきたいなと
3062.0,3064.0,マスクに番号書いて
3064.0,3066.0,番号で呼び合おう
3066.0,3068.0,いいですね
3068.0,3070.0,ウンコの放送
3070.0,3072.0,見たことないけど誘われてきましたってやつ
3072.0,3074.0,いやだから観客いないって1人もアスリート以外は
3074.0,3076.0,いれませんよ
3076.0,3078.0,本当に当日
3078.0,3080.0,秘密参加者のみ知る場所で
3080.0,3082.0,会って一言も
3082.0,3084.0,会話することなく100人連れて来ますんで
3084.0,3086.0,しごした瞬間に退場
3086.0,3088.0,で、背番号何番は
3088.0,3090.0,途中でしごをしたので
3090.0,3092.0,退場させていただきます
3092.0,3094.0,選手宣誓はたかだか
3094.0,3096.0,俺がやっていく
3096.0,3098.0,それぐらい順度の高い大会で
3098.0,3100.0,会ってほしいというか
3100.0,3102.0,本当にね
3102.0,3104.0,それぐらいの本当に意気込みで
3104.0,3106.0,じゃないとさ見てるほうがうさんくせえだろ
3106.0,3108.0,結局こいつらなんかあれがあるんだろみたいな
3108.0,3110.0,そういうの一切なしで
3110.0,3112.0,やらせていただきたいんでよろしくお願いします
3112.0,3114.0,前売り券を施設費用として売ればいいんじゃない
3114.0,3116.0,いやだからそういうのやりたくないんだよな
3116.0,3118.0,いやそういうのやりたくないんだよね
3118.0,3120.0,めんどくさいっていうか話がこじれるんだよね
3120.0,3122.0,うん
3122.0,3124.0,わきがだけどいいあのー全然いいですよ
3124.0,3126.0,なんでもどんな障害を持った方でも
3126.0,3128.0,あのー気持ち一つでちょっと参加していただければなと
3128.0,3130.0,ドーム借りるのに野球やんねえんだ
3130.0,3132.0,野球なんて見てても面白くねえだろやってるやつしか
3132.0,3134.0,面白くねえんだよプロ野球なんていうのはさ
3134.0,3136.0,なんていうのは人外の動きをしてるから
3136.0,3138.0,上記を逸した自分たちにできない
3138.0,3140.0,動きをしてるから面白いと
3140.0,3142.0,素人のさ人たちが
3142.0,3144.0,野球やってるの見ても全然面白くねえぞ
3144.0,3146.0,何も喋らなくていいの
3146.0,3148.0,もう別に喋ってもいいし喋らなくてもいいというか
3148.0,3150.0,俺が実況をするというかね基本は俺が
3150.0,3152.0,まあそんなねアクシデントも
3152.0,3154.0,起こらないし盛り上がるところもなかなかないじゃないですか
3154.0,3156.0,だからもしかしたら
3156.0,3158.0,東京ドームで俺が雑談してるっていうね
3158.0,3160.0,悲惨な大会にまあそっちのほう
3160.0,3162.0,確率のほうが高いですで万が一
3162.0,3164.0,そのようになったときはえー時間
3164.0,3166.0,あのーが来なかったとしても私は先に
3166.0,3168.0,あのニキビの兼ね合いがありますので
3168.0,3170.0,退場させていただきますよろしくお願いします
3170.0,3172.0,ちょっとね競技をちょっとね
3172.0,3174.0,えーまあちょっと今は決まんないと思うんだよね
3174.0,3176.0,みんながこの競技いいんじゃないっていうのを
3176.0,3178.0,うんこちゃん12345
3178.0,3180.0,アットマークgmail.com
3180.0,3182.0,うんこちゃん123アットマークgmail.com
3182.0,3184.0,今からうんこちゃん
3184.0,3186.0,うんこちゃんのねその黒子たちがね
3186.0,3188.0,各アリーナたちみえたちみびたちみしーに
3188.0,3190.0,あのーメールアドレス貼りますので
3190.0,3192.0,ねちょっとぜひ
3192.0,3194.0,あのーこんなのがいいんじゃないっていうのをね
3194.0,3196.0,わかったらお届けいただきあのー
3196.0,3198.0,送っていただければなと
3198.0,3200.0,今決められないとまずいもんなでもさ
3200.0,3202.0,決まんなくないそんな簡単に
3202.0,3204.0,そんな簡単にポンポン出てこなくない別に
3204.0,3206.0,あったら別にいいけど随時募集してます
3206.0,3208.0,随時募集してますんでよろしくお願いします
3208.0,3210.0,うぐいすじょーいらないならうぐいすじょー
3210.0,3212.0,なしこにお願いしようかなと思ってますんで
3212.0,3214.0,あのなしこさんはぜひね
3214.0,3216.0,顔出ししなくていいんでね
3216.0,3218.0,顔出ししなくていいんでよろしくお願いします
3218.0,3220.0,なのでぜひよろしくお願いしますね
3220.0,3222.0,ちょっと水飲みますね
3222.0,3223.0,見た見た
3226.7,3227.5,ありがとうございます
3227.5,3228.0,そのようにね
3228.0,3229.0,このうんこちゃん12345
3229.0,3229.5,アットマーク
3229.5,3231.0,gmail.comの方にね
3231.0,3232.0,メール送って頂ければなと
3237.0,3238.0,いや、あのー
3238.0,3239.0,ゲストとかは
3239.0,3240.0,一切
3240.0,3241.0,いません
3241.0,3242.5,誰もゲストはいません
3242.5,3243.5,純粋に
3243.5,3244.0,ほんとに
3244.0,3245.5,男たちの
3245.5,3247.0,男たちのなんか
3247.0,3248.0,戦いというか
3248.0,3248.5,そのような形でね
3248.5,3249.5,やらせて頂きたいんで
3249.5,3250.5,50人までしか
3250.5,3251.5,グランド入れないらしいぞ
3251.5,3253.0,めちゃくちゃいいじゃん
3253.0,3254.5,よりいいじゃんそれ
3254.5,3255.5,選ばれし50人で
3255.5,3257.5,頂点決めようやじゃん
3257.5,3259.5,選ばれし50人で
3259.5,3260.0,なんかもう
3260.0,3260.5,てかさ
3260.5,3261.5,スタンダードになんか
3261.5,3263.5,50m走とかでいいなじゃあ
3263.5,3264.5,よくない?
3264.5,3265.0,その方が
3265.0,3265.5,変にさ
3265.5,3266.5,凝ったさ
3266.5,3267.5,なんかやるより
3267.5,3268.5,単純明快のやつの方が
3268.5,3269.5,よくない?
3269.5,3271.5,100m走とか
3271.5,3273.5,よくない?そっちの方が
3273.5,3275.5,なんかさ変にさ
3275.5,3276.5,あのー
3276.5,3277.5,なんつーの
