start,end,text
3226.0,3228.0,お前らだけでも俺のこと信用してくれよ最後まで
3228.0,3230.0,世界の
3230.0,3232.0,ヘコキタイが最近ヤフミより人多いぞ
3232.0,3234.0,すごいねなんかずーっとパワープレイ
3234.0,3236.0,やってるでしょ誰かなんかねえ
3236.0,3238.0,信用に
3238.0,3240.0,おける医者を紹介したら嬉しいわ
3240.0,3242.0,これもなんかちょっとやばいよな
3242.0,3244.0,あのヤフミ
3244.0,3246.0,チャンネルの末期の
3246.0,3248.0,なんかその心の
3248.0,3250.0,闇を感じるよ俺世界のヘコキタイから
3250.0,3252.0,救ってやりたい
3252.0,3254.0,あの時できなかったただ今の
3254.0,3256.0,俺たちだったらできるんじゃないのか
3256.0,3258.0,って思いますけどね
3258.0,3260.0,ジュケさん
3260.0,3262.0,ニセジュケさん
3262.0,3264.0,ニコ生をつなぎ止めてるのは
3264.0,3266.0,キークスとヘコキ
3266.0,3268.0,何キークスって
3268.0,3270.0,なんかすごいよねその
3270.0,3272.0,うんこちゃんでカオTV知らない俺
3272.0,3274.0,知らない
3274.0,3276.0,だからまあでもまあいいじゃんなんかずーっと
3276.0,3278.0,同じことやってるっていうのはすごいね
3278.0,3280.0,なんていうの
3280.0,3282.0,めっちゃメンタルが強いと思うんだよだってさ
3282.0,3284.0,自分の立場
3284.0,3286.0,だったらさ新しいことやんなきゃっていう
3286.0,3288.0,脅迫観念に駆られると思うんだよ俺は自分
3288.0,3290.0,はそうだけど自分はそうだから
3290.0,3292.0,なのにさ1年もやっぱね2年も
3292.0,3294.0,同じゲームをやり続けるって
3294.0,3296.0,相当メンタル強いか頭のネジ吹っ飛んでるか
3296.0,3298.0,どっちかだよね
3298.0,3300.0,視聴者にとってまあ分かりやすいよね
3300.0,3302.0,まあ変な話面白くねえよって言うやつも
3302.0,3304.0,多いだろうけどそういうのってさ
3304.0,3306.0,新鮮味を求める人たちは嫌うじゃん
3306.0,3308.0,ただやっぱさ
3308.0,3310.0,毎回行ったらあの放送やってるみたいなのは
3310.0,3312.0,いいよね
3312.0,3314.0,すごく
3314.0,3316.0,いや延長はしませんもうお風呂入って寝ます
3316.0,3318.0,おねんねの時間なんだよ私
3318.0,3320.0,おねんねの時間
3320.0,3322.0,ユミが不倫して延長したよ
3322.0,3324.0,えなんかそのなんか俺ね海外の人間は
3324.0,3326.0,なんか朗報はないの
3326.0,3328.0,誰しも矢野がちょっと育ってきたぜ
3328.0,3330.0,みたいなさそういうなんか
3330.0,3332.0,いい話はねえの
3332.0,3334.0,いい話で締めようぜ
3334.0,3336.0,ユミがフェンリルと不倫した
3336.0,3338.0,あそうだ俺フェンリルさん知らない
3338.0,3340.0,なんかスパ方の人
3340.0,3342.0,スパ方の人
3342.0,3344.0,スパ方の人
3344.0,3346.0,違うの
3346.0,3348.0,違うの
3350.0,3352.0,違うんだ
3352.0,3354.0,スパ方の人だよねフェンリル
3354.0,3356.0,まあいいじゃんなんかそういうね
3356.0,3358.0,他人のね恋愛のいざこざには
3358.0,3360.0,いざこざにはあんまり
3360.0,3362.0,関わりたくないんだよね怖いんだよ私
3362.0,3364.0,田口が
3364.0,3366.0,直して2000人になった
3366.0,3368.0,なんか爆発しちゃったんでしょ
3368.0,3370.0,俺それはうすうす風の噂でか彼女から聞いたわ
3370.0,3372.0,ねえねえ
3372.0,3374.0,田口が米爆発したんだけどあいつ
3374.0,3376.0,俺の彼女にもすげえ見下されてたわ
3376.0,3378.0,なんか歴代の彼女
3378.0,3380.0,はなんか田口だけは
3380.0,3382.0,その見下すみたいな
3382.0,3384.0,そういうね
3384.0,3386.0,なんかやっぱあるんだろうね女性から
3386.0,3388.0,親しみよく言えば親しみを
3388.0,3390.0,持ってみられるみたいな
3390.0,3392.0,最近高田健史がすごい配信ページだぞ
3392.0,3394.0,あいつも配信熱に火が付いた
3394.0,3396.0,なんかどうせあれだろ女とうまくいってねえとかそういう感じだろ
3396.0,3398.0,それでなんか一人暮らしに戻って
3398.0,3400.0,なんか造成してたじゃん一人暮らしに戻って
3400.0,3402.0,なんか自分をふと振り返ったときに
3402.0,3404.0,俺って何もないやん生うぞ
3404.0,3406.0,するしかないやんみたいなでパズドラ
3406.0,3408.0,がなんかやってたら絶対そうだ
3408.0,3410.0,俺に分かる手の取りを
3410.0,3412.0,おっことぬしか悟空か俺かだからな
3412.0,3414.0,そうやって言葉を返せずに
3414.0,3416.0,手のひらを当てただけで
3416.0,3418.0,あの能力なんなんだろうな
3418.0,3420.0,もののげ姫最近見たんだけどさ
3420.0,3422.0,健史がさなんかねえ
3422.0,3424.0,俺もうほんとに納得いかないんだけど
3424.0,3426.0,あのさあのー
3426.0,3428.0,獅子神のさ泉でさ
3428.0,3430.0,こいつさいい
3430.0,3432.0,あのーなんて言ったやろ全然だってこれ
3432.0,3434.0,今の2分なしにしよう
3434.0,3436.0,そういうことだよ
3436.0,3438.0,バカどもてめえらがなんか
3438.0,3440.0,俺のそういう足らない電話てめえらが起きないバカどもかや
3440.0,3442.0,気の利かねえ視聴者だなほんとに
3442.0,3444.0,気の利かねえ視聴者だよ
3444.0,3446.0,普通なんかそういうの俺の発言を
3446.0,3448.0,どういう発言をしたいかを見越して
3448.0,3450.0,どんだろうがや生放送ってのは
3450.0,3452.0,言ってたぞちゃんまんだってや
3452.0,3454.0,おいカジトってな視聴者とな
3454.0,3456.0,カジトって行くんだよみたいなこと言ってたよ
3456.0,3458.0,ちゃんまんも
3458.0,3460.0,最近よっちゃんがよ
3460.0,3462.0,あのおい
3462.0,3464.0,ちょっと待ってちょっと放送延長しよう
3464.0,3466.0,言わなきゃいけないことがある
3466.0,3468.0,ごめんちょっと5分だけ付き合って
3468.0,3470.0,内緒なんだけどよっちゃんが
3470.0,3472.0,ローリエって知ってる?
3472.0,3474.0,ローリエみんなローリエって知ってる?
3474.0,3476.0,ローリエ
3476.0,3478.0,ローリエ
3478.0,3480.0,ローリエって知ってる?ローリエ
3480.0,3482.0,葉っぱがあるのね
3482.0,3484.0,これね言ったらよっちゃんとよっちゃんの彼女が怒られるんだけど
3484.0,3486.0,これは伝えなきゃいけないんだけど
3486.0,3488.0,ローリエってやっぱ
3488.0,3490.0,よっちゃんは料理するわけよ
3490.0,3492.0,ごめんよっちゃんって誰だよっていう人に言うと
3492.0,3494.0,よっちゃんって俺の友達がいるんだけど
3494.0,3496.0,俺の友達のアホがいるんだけど
3496.0,3498.0,まじで偏差値70ぐらいの
3498.0,3500.0,IQ70ぐらいのギリギリひまわり学校
3500.0,3502.0,学級かかんなかったぐらいのやつがいるんだけど
3502.0,3504.0,仲いいんだけどね
3504.0,3506.0,彼女と喧嘩したわみたいな
3506.0,3508.0,彼女と喧嘩したわみたいな
3508.0,3510.0,珍しいなんでって聞いたら
3510.0,3512.0,なんか聞いてくれよ
3512.0,3514.0,まじでありえないんだけど
3514.0,3516.0,俺がさローリエのことをさ
3516.0,3518.0,和名で言ったら
3518.0,3520.0,あいつがキレやがってみたいな
3520.0,3522.0,なんでよっちゃんはさすぐそうやってカッコつけるの
3522.0,3524.0,まじでうざいんだけどみたいな
3524.0,3526.0,月桂樹
3526.0,3528.0,月桂樹って言うらしいんだけどローリエのこと
3528.0,3530.0,それをよっちゃんが
3530.0,3532.0,これに月桂樹入れるとうめえんだよみたいな
3532.0,3534.0,そしたらねカレーをぐつぐつ煮込んでる彼女が
3534.0,3536.0,箸をバーンと置いて
3536.0,3538.0,なんでさローリエって言われて月桂樹って言うの
3538.0,3540.0,あなたのそういうカッコつけるところが
3540.0,3542.0,ほんとにムカつく
3542.0,3544.0,黙って出てちゃダメだよ
3544.0,3546.0,それでさほんとに腹立つ
3546.0,3548.0,まじあいつぶっ殺せみたいな話してきて
3548.0,3550.0,おいうんこちゃんニコ生進めみたいな
3550.0,3552.0,俺はっきり言って今だったら
3552.0,3554.0,俺言っとくけどなただでよ
3554.0,3556.0,2年間放送してなかったわけじゃねえからな
3556.0,3558.0,俺言っとくけどはっきり言って
3558.0,3560.0,ユイがぶっ殺せるからって言ってたから
3560.0,3562.0,完全に2年前で
3562.0,3564.0,あいつのニコ生の知識2年前で止まってんだよね
3564.0,3566.0,俺今だったらユイがぶっ殺せるからな
3566.0,3568.0,みたいなこと言って
3568.0,3570.0,流行ってねえじゃんはっきり言って
3570.0,3572.0,Dプラスの時の知識で止まってんの
3572.0,3574.0,俺今だったら
3574.0,3576.0,ガークとユイがぶっ殺せるからな
3576.0,3578.0,ガークもユイが死んでるじゃん
3578.0,3580.0,完全に
3582.0,3584.0,おめえが殺さなくてもガークもユイが死んでるよ
3584.0,3586.0,って言って俺が止めてあげたの
3586.0,3588.0,今ここでおめえが生放送しちゃったら
3588.0,3590.0,なんていうのは彼女がさ
3590.0,3592.0,怒っちゃうじゃんって
3592.0,3594.0,俺はね確かにやりたい気持ちあるから
3594.0,3596.0,もう1回酔ってない時に
3596.0,3598.0,電話してきてやろうって言った時は
3598.0,3600.0,ニコ生やろうよと
3600.0,3602.0,そういう風に約束させてもらいますので
3602.0,3604.0,もしかしたら久々に
3604.0,3606.0,酔っちゃうとね
3606.0,3608.0,ニコ生するかもしれないんで
3608.0,3610.0,その時はみなさんぜひよろしくお願いします
3610.0,3612.0,本当に怒ってたわ
3612.0,3614.0,なんでさあ
3614.0,3616.0,俺がちょっと頭悪いことを知らねえでさ
3616.0,3618.0,ニコ生が出てこなかったんだよ
3618.0,3620.0,って泣いてたわ
3620.0,3622.0,カッコつけたと思われたらしい
3622.0,3624.0,酔っちゃうのさ
3624.0,3626.0,食のうんちくがうぜえっていうキャラなのね
3626.0,3628.0,酔っちゃうの食のうんちくってすげえうぜえの
3628.0,3630.0,で俺がよくいじってるのね
3630.0,3632.0,だから彼女も同じところに
3632.0,3634.0,ムカついたんだろうな
3634.0,3636.0,なんでこの人そうやってカッコつけるんだろう
3636.0,3638.0,みたいなので
3638.0,3640.0,そうビミシンボビミシンボ好きだから
3640.0,3642.0,だからみなさんもね
3642.0,3644.0,いやあすっきりした
3644.0,3646.0,ほんとにすっきりした
3646.0,3648.0,ほんとにさっぱりした
3648.0,3650.0,なんでみなさんもね
3650.0,3652.0,またちょっとねしばらく会いませんけど
3652.0,3654.0,私のね
3654.0,3656.0,私の存在を近くに感じながらね
3656.0,3658.0,あっ
3658.0,3660.0,やっぱりうんこちゃんっていいもんやなと
3660.0,3662.0,そういうね
3662.0,3664.0,あったかいねあったけえなと
3664.0,3666.0,家族だなと
3666.0,3668.0,いう感じでね過ごしていただければなと
3668.0,3670.0,思います
3670.0,3672.0,じゃあみなさん
3672.0,3674.0,お疲れ様でした疲れちゃったんでね
3674.0,3676.0,お疲れ様でしたさよなら
