start,end,text
2124.0,2126.0,通じた出会いじゃねえから
2126.0,2128.0,ちょっと許していただきたいなと
2128.0,2130.0,ゲロだしにしてさ
2130.0,2132.0,女釣ろうとしたんだけどさ
2132.0,2134.0,見事になんか釣れなくてさ
2134.0,2136.0,うわーすごい芸能人で会ってみたいです
2136.0,2138.0,みたいな
2138.0,2140.0,今度遊べよみんなで
2140.0,2142.0,二人で遊ぼうって言ったら
2142.0,2144.0,LINEすら返ってこなかったっていうね
2144.0,2146.0,でそいつが新宿のさ
2146.0,2148.0,国運タワーのさ
2148.0,2150.0,東京モード学園の
2150.0,2152.0,生徒だったから
2152.0,2154.0,一気にあのビルが嫌いになったわ
2154.0,2156.0,であのビル本当に爆発されねえかなって
2156.0,2158.0,ワッチャーにこの前相談してた
2158.0,2160.0,男はやっぱ根に持つんだよね俺ってね
2160.0,2162.0,本音はそうだよ
2162.0,2164.0,みんなもさ男性はこうあるべきだ
2164.0,2166.0,みたいな
2166.0,2168.0,男性はこうあるべきだみたいなさ
2168.0,2170.0,感じでやっぱ男は
2170.0,2172.0,男らしく会ってほしいみたいなこと言うじゃん
2172.0,2174.0,違うよ本性っていうのはこうだよ
2174.0,2176.0,俺はね
2176.0,2178.0,世では会社とかではね
2178.0,2180.0,男らしい自分を演じてるけど
2180.0,2182.0,やっぱりねめめしいわけよ
2182.0,2184.0,めめしさこそ男らしさだからね
2184.0,2186.0,エゴロイ別れてないよ仲良しだよ
2186.0,2188.0,仲良しだよマジで
2188.0,2190.0,最近もなんか
2190.0,2192.0,喧嘩もしてないねちょくちょくちょくちょく
2192.0,2194.0,なんか遊んでるよ
2194.0,2196.0,なんでその辺はみなさん
2196.0,2198.0,まだ私はね結婚とかは全然しませんけど
2198.0,2200.0,応援していただければなと
2200.0,2202.0,思います
2202.0,2204.0,ゴロリの萌え話
2204.0,2206.0,萌え話最近ねえなーいっぱいあるんだろうけど
2206.0,2208.0,ちょっとあのー
2208.0,2210.0,話しながら頭の方
2210.0,2212.0,右脳で考えながらちょっと左脳で話して
2212.0,2214.0,番組の後半に
2214.0,2216.0,あのーさせていただければなと
2216.0,2218.0,ポメラニアンはねマジで可愛いわ
2218.0,2220.0,ん?ちょっと見たいか?
2220.0,2222.0,動画
2222.0,2224.0,見たいか?
2224.0,2226.0,ちょっとなんか上手いことあげたいな
2226.0,2228.0,うちの話はマジで可愛くてさ
2228.0,2230.0,マジでうちもポメ買ってる
2230.0,2232.0,可愛いよななんか相苦しいよね
2232.0,2234.0,だからみんなにもなんか
2234.0,2236.0,なんとかしてねお披露目
2236.0,2238.0,お披露目させていただきたいなと
2238.0,2240.0,思います
2240.0,2242.0,ファッションとか自分で考えない下に委ねんな
2242.0,2244.0,なんか俺を抜きにして
2244.0,2246.0,ヒートアップしてる
2246.0,2248.0,方々もいるようですけど
2248.0,2250.0,ちょっとね静粛にお願いしていただきたいなと
2250.0,2252.0,思います
2252.0,2254.0,お前犬飼ってんのか最近飼い始めたよ
2254.0,2256.0,最近なやっぱちょっと余裕も
2256.0,2258.0,心にもね懐にも
2258.0,2260.0,余裕ができ始めてぼちぼち
2260.0,2262.0,なんかそういう責任を負いたいなって
2262.0,2264.0,思って結婚せずに犬飼ったわ
2264.0,2266.0,犬のおしっこは
2266.0,2268.0,気にならないの?俺毎日毎日大掃除してるからさ
2268.0,2270.0,犬の部屋も
2270.0,2272.0,犬はお風呂にはまだ入れてないんだけど
2272.0,2274.0,犬のお部屋とかも
2274.0,2276.0,ちゃんと毎日掃除するから拭き掃除するから
2276.0,2278.0,やっぱねああいう匂いとか
2278.0,2280.0,しつけっていうのは全部犬のせいじゃなくて
2280.0,2282.0,飼い主のせいだから
2282.0,2284.0,自分がしっかりしてれば犬がそういうソソーとか
2284.0,2286.0,なんていうのかするような感じには
2286.0,2288.0,ならないと思う今のところすごいね
2288.0,2290.0,優秀とあれなんていうの?
2290.0,2292.0,礼儀正しいすごい礼儀正しい
2292.0,2294.0,ワンちゃんで
2294.0,2296.0,手を焼きませんよ全く
2296.0,2298.0,女より従順だからかわいいよな
2298.0,2300.0,最近ほんとにね
2300.0,2302.0,女性嫌いになったね
2302.0,2304.0,ほんとに最近ね
2304.0,2306.0,昔にも増して
2306.0,2308.0,嫌いになっちゃったんですよね
2308.0,2310.0,なんでぼちぼちなんかね私の制作がね
2310.0,2312.0,身を結ぶ日が
2312.0,2314.0,来るといいなとは思っているんですけどね
2314.0,2316.0,それ女性っていうかシャークが嫌い
2316.0,2318.0,いややっぱ職場にもよ
2318.0,2320.0,ムカつく女っているわけよ
2320.0,2322.0,なんかこまけえ女いない?
2322.0,2324.0,こまけえ女
2324.0,2326.0,まあその具体的なことも
2326.0,2328.0,めっちゃ言いたいんだけど
2328.0,2330.0,私ね自分の仕事明かしてないもんで
2330.0,2332.0,なかなか言えない歯がゆさがあるわけなんですよ
2332.0,2334.0,その奥ゆかしい感じをね
2334.0,2336.0,皆さんも分かっていただければなと
2336.0,2338.0,奥歯のかゆい感じがね
2338.0,2340.0,女ってなんであんなに保診がうまいんだろうな
2340.0,2342.0,なんかねやっぱり最終的に
2342.0,2344.0,責任を取らされるのは
2344.0,2346.0,男ですからね皆さんも大多数がね
2346.0,2348.0,男性だと思いますよ
2348.0,2350.0,世知辛い世の中ですよ男性にとっては
2350.0,2352.0,ただねここで負けずにね凛として
2352.0,2354.0,生きていただきたいなと思います
2354.0,2356.0,早く女と年寄りはウバステ山に
2356.0,2358.0,捨てに行けるようにしてくれよ
2358.0,2360.0,俺はちょっとね
2360.0,2362.0,国勢に打って出た暁には皆さん
2362.0,2364.0,必ずやね男性が住みやすい
2364.0,2366.0,このね日本を男性が住みやすい国に
2366.0,2368.0,変えていきたいなと思っておりますんで
2368.0,2370.0,合唱コンクールでキレるタイプの女かな
2370.0,2372.0,マジでそれだわ
2372.0,2374.0,本当にそんな感じ
2374.0,2376.0,俺ちなみにパートリーダーだよ
2376.0,2378.0,パートリーダーなのに
2378.0,2380.0,俺無理だタバコ吸ってくるよみたいな感じで
2380.0,2382.0,一心もう
2382.0,2384.0,女中の女から嫌われてたからな
2384.0,2386.0,俺とニワトリとチャック
2386.0,2388.0,俺とニワトリとチャックは
2388.0,2390.0,うんちなのに
2390.0,2392.0,パートリーダーやってたんで
2392.0,2394.0,その辺のプライドはやっぱ持ってますよ
2394.0,2396.0,音楽に対するね
2396.0,2398.0,水飲んでいいですか
2398.0,2400.0,喉がらがらになっちゃいました
2408.0,2410.0,すいませんすいません
2410.0,2412.0,俺なんかさ
2412.0,2414.0,俺おかしいんだよね
2414.0,2416.0,嫌われる要素なくない俺マジで
2416.0,2418.0,俺ねみんな
2418.0,2420.0,これ嫌味じゃないから聞いてほしい
2420.0,2422.0,俺金持ってるし顔もかっこいいし
2422.0,2424.0,比較的明るい人間なのね
2424.0,2426.0,しかも優しいの
2426.0,2428.0,なんで俺のこと嫌いになるのか
2428.0,2430.0,意味がわかんなくない
2430.0,2432.0,マジでマジで
2432.0,2434.0,俺ね世の女性に
2434.0,2436.0,聞いてもらえた肌綺麗だしさ
2436.0,2438.0,世の女性に
2438.0,2440.0,俺理解できない女ってマジで女が悪いと思うんだよね
2440.0,2442.0,だって待ってみんな聞いて
2442.0,2444.0,俺のこと知らないからみんなは評価できないと思うけど
2444.0,2446.0,俺がもし言ってることが正しかったとしたら
2446.0,2448.0,世の女ってバカだよなマジで
2448.0,2450.0,じゃない
2450.0,2452.0,俺がもし正しいこと
2452.0,2454.0,俺が本当の真実を述べてたら
2454.0,2456.0,世の女ってマジでバカだよな
2456.0,2458.0,あんなドグマカザミより俺のほうが絶対いいじゃん
2458.0,2460.0,将来性もあってさ
2462.0,2464.0,なんでなのって
2464.0,2466.0,ほんとに見る目がないんだよねみんな
2466.0,2468.0,ちょっと宮古さんほんとに
2468.0,2470.0,今だったらまだ私も独身
2470.0,2472.0,1年後2年後はわかりませんよ
2472.0,2474.0,今だけですよ
2474.0,2476.0,ほんとにね
2476.0,2478.0,マジで
2478.0,2480.0,ちゃんと女性視聴者
2480.0,2482.0,女性配信者諸君は
2482.0,2484.0,しっかり身の振り考えてからね
2484.0,2486.0,男性
2486.0,2488.0,誰の囲っていくかを
2488.0,2490.0,考えていくようにしていただければなと
2490.0,2492.0,目くさってるよな
2492.0,2494.0,宮古は急速劣化したぞ
2494.0,2496.0,なんか俺よく見るよ
2496.0,2498.0,あれ面白いよなあのスレ
2498.0,2500.0,なんとかの現在
2500.0,2502.0,劣化わらわらみたいな
2502.0,2504.0,クソどうでもいいわ
2504.0,2506.0,あれだろ乗車必須だろ
2506.0,2508.0,誰でも
2508.0,2510.0,ほんと俺たちもさ
2510.0,2512.0,10年経ったらおじさんおばさんになっていくわけなんですよ
2514.0,2516.0,そんなことに一喜一憂していけばだめだと思いますよ
2516.0,2518.0,受け止めろ
2518.0,2520.0,劣化を
2520.0,2522.0,受け止めろバカたれが
2522.0,2524.0,女は掃除で頭悪い
2524.0,2526.0,キメェよな
2526.0,2528.0,俺の知ってるキメェ女の最近
2528.0,2530.0,みたいな
2530.0,2532.0,俺の心を豊かにしてくれ
2532.0,2534.0,タハタオ
2534.0,2536.0,タガヤソウゼ
2536.0,2538.0,チーメロディ
2538.0,2540.0,チーメロディ
2540.0,2542.0,何してんの
2542.0,2544.0,会社サボってた
2544.0,2546.0,ずっとボーっとしてた
2546.0,2548.0,チーメロディ何やってんの
2548.0,2550.0,元気してんの
2550.0,2552.0,あのクソ
2552.0,2554.0,あのクソ
2554.0,2556.0,チーメロディ最近調子乗ってる
2556.0,2558.0,お前らから言わせたら大半の配信者
2558.0,2560.0,調子に乗ってるじゃん
2560.0,2562.0,女生主の顔出しで
2562.0,2564.0,一番楽しい
2564.0,2566.0,面白いんだ
2566.0,2568.0,顔出しして成功したタイプの
2568.0,2570.0,人間なんだな
2570.0,2572.0,女配信者は全体的に
2572.0,2574.0,気持ち悪い
2574.0,2576.0,アイデアが枯渇してやることないもんな
2576.0,2578.0,俺もね
2578.0,2580.0,生放送するとしても
2580.0,2582.0,何していいか全く分かんないんだよね
2582.0,2584.0,ほんとに
2584.0,2586.0,だから顔出しするくらいしか
2586.0,2588.0,女ってないんだろうね
2588.0,2590.0,増えねえだろ
2590.0,2592.0,放送してもやることない女なんて
2592.0,2594.0,なんもなくない犬みたいなもんなんだからさ
2594.0,2596.0,顔出せなきゃなんもね
2596.0,2598.0,価値がないじゃん
2598.0,2600.0,ほんとに
2600.0,2602.0,仕方ない
2602.0,2604.0,仕方ないものだと思われるけどね
2604.0,2606.0,チヤホヤされただけだからな
2606.0,2608.0,まあね
2608.0,2610.0,なんかもっとうまい方法でね
2610.0,2612.0,なんかチヤホヤされればいいのにね
2612.0,2614.0,最近の女の子の顔出しラッシュ
2614.0,2616.0,誰が出したか教えてくれよ
2616.0,2618.0,この浦島太郎のうんこちゃんに
2620.0,2622.0,浦島太郎の
2622.0,2624.0,来る顔出しちゃうんだ
2624.0,2626.0,つーかさ
2626.0,2628.0,俺さマジでムカつくのがあったんだけど
2628.0,2630.0,ゲルゲがチャンマンにさ
2630.0,2632.0,いいんでさ
2632.0,2634.0,あのバカあのクソアンパンマンがさ
2634.0,2636.0,俺言っとくけどあれだからな
2636.0,2638.0,ゲルゲてめえ聞いてたらほんとに一言言ってんだけど
2638.0,2640.0,よく名前主がやるプロレスじゃねえかな
2640.0,2642.0,俺てめえのこと本気で聞いてたからなほんとに
2642.0,2644.0,最近の慶応大学の大学生が
2644.0,2646.0,お前首きっつって死ねえよみたいな
2646.0,2648.0,こと言ってたじゃん
2648.0,2650.0,俺まったくお前同じ感情てめえに抱いてるからな
2650.0,2652.0,えんけーえんけちゃんと犬ちゃんマンだけど
2652.0,2654.0,好きんじゃないかさ
2654.0,2656.0,国家で保護するべきだとか言ってねえ
2656.0,2658.0,みたいなこと言ってんだよあのバカ
2658.0,2660.0,そういうのってさ
2660.0,2662.0,空気読んでさ名前出しちゃいけねえじゃん
2662.0,2664.0,ほんとに迷惑なんだよねあれの
2666.0,2668.0,見ただろあいつ
2668.0,2670.0,あのゴミやめてほしいよな
2670.0,2672.0,関わんねえでほしいよなまじで
2672.0,2674.0,なんかさよくあるじゃん
2674.0,2676.0,そういう実は
2676.0,2678.0,実は嫌いじゃないぜみたいな
2678.0,2680.0,俺言っとくけどほんとに嫌いだからな
2680.0,2682.0,ゲルゲごめん
2682.0,2684.0,俺久々にこんな嫌いな人間俺姉ちゃんよりゲルゲのほうが嫌いだからね
2684.0,2686.0,悲報
2686.0,2688.0,ゲルゲ姉ちゃんより嫌い
2688.0,2690.0,相当嫌いだ
2690.0,2692.0,金魚の糞みたいな
2692.0,2694.0,ほんと嫌いだからごめんな
2694.0,2696.0,悲報
2696.0,2698.0,ごめんなさい
2698.0,2700.0,あんまりねえそうなんだよ
2700.0,2702.0,男性より女性より
2702.0,2704.0,女性のほうが
2704.0,2706.0,嫌いなハードル低いんで
2706.0,2708.0,すごく嫌いになっちゃうんだよね
2708.0,2710.0,姉ちゃんよりって
2710.0,2712.0,相当嫌いだよ
2714.0,2716.0,ちょっとごめんね
2716.0,2718.0,渋谷のキングのことは嫌いじゃねえ
2718.0,2720.0,嫌いじゃねえよ
2720.0,2722.0,なんで諦めるんだよお前ら
2724.0,2726.0,俺一途なやつ嫌いじゃないからさ
2726.0,2728.0,そこまでコメントすると拾っちゃうどうしても
2728.0,2730.0,そんな自分が好きだわ俺
2730.0,2732.0,拾わなくていいのに
2732.0,2734.0,拾わなくていいと分かってても期待に応えたくなっちゃう
2734.0,2736.0,俺もごめんなさいね
2736.0,2738.0,すいません
2740.0,2742.0,これ以上は
2742.0,2744.0,不必要なコメントは
2744.0,2746.0,拾っていかないように
2746.0,2748.0,していこうかなと思います
2748.0,2750.0,あんまりだからね
2750.0,2752.0,そのーなんていうの
2752.0,2754.0,皆さんもねこれから
2754.0,2756.0,うんこちゃんの放送を見てて
2756.0,2758.0,生主はじめまんたんみたいなやついるだろ
2758.0,2760.0,マジでやめとけよ
2760.0,2762.0,いいこと一つもねえからな
2762.0,2764.0,マジでお前らやるだろどうせ
2764.0,2766.0,やってみまんたんみたいな
2766.0,2768.0,やめとけよ本気で
2768.0,2770.0,マジでやめとけよ
2770.0,2772.0,実況とか曲げんじゃねえぞ
2772.0,2774.0,MSSPみたいになっかんな
2774.0,2776.0,俺見たぜ
2776.0,2778.0,メール来たぜうんこちゃん宛てに
2778.0,2780.0,実況界最強の資格
2780.0,2782.0,MSSPみたいな
2782.0,2784.0,俺の知らねえうちにさ
2784.0,2786.0,最強俺たちよりMSSPの格上になってたらしくね
2786.0,2788.0,なんかねえ
2788.0,2790.0,おいおい待てよと
2790.0,2792.0,おめえうんこちゃんがいないトーナメント
2792.0,2794.0,はんまゆうじろうがいない最強トーナメント
2794.0,2796.0,一緒なんじゃねえのかと
2796.0,2798.0,ニコ動主催で最強の実況者を
2798.0,2800.0,決めるべきだと思うんだよな
2800.0,2802.0,そしたら俺も名乗りをあげる
2802.0,2804.0,ようやく俺の出番だなと
2804.0,2806.0,ためにためたこの
2806.0,2808.0,鬱憤をね動画で
2808.0,2810.0,晴らしていきたいなと
2810.0,2812.0,あいつらCD出してて笑った
2812.0,2814.0,しかもさボカロのCDでしょ
2814.0,2816.0,なんだもうやりてようで
2816.0,2818.0,レイプされてんじゃんおめえら
2818.0,2820.0,かわいそうだよほんとに
2820.0,2822.0,かわいそうなんかかわいそすお前らが
2822.0,2824.0,お前らレイプされてて
2824.0,2826.0,俺見てるお前らがレイプされてるの見てる
2826.0,2828.0,ほんとにもう悔しい
2828.0,2830.0,何が悔しいってこんなね
2830.0,2832.0,腐った世の中を変えれない
2832.0,2834.0,自分が悔しいほんとに
2834.0,2836.0,自分の実力の無しさが悔しいわ
2836.0,2838.0,悔しい
2838.0,2840.0,俺が変えていきたいのに
2840.0,2842.0,あいつら本業がミュージシャンなんじゃないの
2842.0,2844.0,あそうなんだもっとクソじゃんじゃあ
2844.0,2846.0,もっとクソみたい
2846.0,2848.0,俺から言わせればねごめんね
2848.0,2850.0,嫌いじゃないんだよ
2850.0,2852.0,嫌いじゃないんだけどね
2852.0,2854.0,だからねついていけてねえんだよな
2854.0,2856.0,ついていけてねえ唯一見てる実況で
2856.0,2858.0,キリンさんのサイレン2だし
2858.0,2860.0,いいじゃん俺
2860.0,2862.0,唯一見てる実況がキリンさんのサイレン2なんだよ
2862.0,2864.0,もうそんなやつ流行んないじゃん絶対
2864.0,2866.0,分かってはいるけど
2866.0,2868.0,抜け出せない
2868.0,2870.0,爆松コメ絶対拾うなよごめん
2870.0,2872.0,拾っちゃったお前の
2872.0,2874.0,お前のなんかちょっと
2874.0,2876.0,コメントで火をつけた俺に
2876.0,2878.0,爆松コメ
2878.0,2880.0,何爆松コメって
2880.0,2882.0,爆松コメ教えて俺に
2882.0,2884.0,爆松コメ
2884.0,2886.0,なんかちょっとラグあるね若干ね
2886.0,2888.0,爆松最近俺見たぜ
2888.0,2890.0,やつが来る
2890.0,2892.0,やつが来るの新作出たってこと?
2892.0,2894.0,やつが来るの新作出したってこと?
2896.0,2898.0,あスマブラなんだ
2898.0,2900.0,見てみようちょっと見るわ今日
2900.0,2902.0,この後寝ながら
2902.0,2904.0,布団に入りながら
2904.0,2906.0,ニンテンドー3DSでさ
2906.0,2908.0,ニコ動見れんの
2908.0,2910.0,よくない?
2910.0,2912.0,めっちゃ
2912.0,2914.0,スギルがふかしたけどつまらなかった
2914.0,2916.0,みんなやりたい方出たよね
2916.0,2918.0,来たーあっきぃ
2918.0,2920.0,やべー
2920.0,2922.0,俺たちっつったらあっきぃじゃん
2922.0,2924.0,あっきぃ一瞬で
2924.0,2926.0,あれいなくなっちゃったけど
2926.0,2928.0,なんかすごい申し訳
2928.0,2930.0,程度の弾幕
2930.0,2932.0,あっきぃ来た来た来た
2932.0,2934.0,F1みたいな嵐に荒らされた
2934.0,2936.0,洗礼を受けた
2936.0,2938.0,あっきぃのごめんなさい
2938.0,2940.0,俺あっきぃのおかげで
2940.0,2942.0,あっきぃがさ通報しようぜ
2942.0,2944.0,あっきぃがさ
2944.0,2946.0,震災にあやかってさ
2946.0,2948.0,違法アップロード
2948.0,2950.0,違法ダウンロードして
2950.0,2952.0,映画流してたじゃん
2952.0,2954.0,それについて
2954.0,2956.0,助けられたからさ
2956.0,2958.0,心勇気づけられたの俺も
2958.0,2960.0,だからなんか
2960.0,2962.0,トイストーリー3流してたじゃん
2962.0,2964.0,勇気づけられた口だからさ
2964.0,2966.0,恩をさ
2966.0,2968.0,返したいよ
2968.0,2970.0,牧野が震災にあやかって
2970.0,2972.0,おにぎり配らせした話
2972.0,2974.0,懐かしすぎるだろそれ
2974.0,2976.0,燃えたんだよね
2976.0,2978.0,森元総理と
2978.0,2980.0,同じ匂いしたい
2980.0,2982.0,やることなすことうまくいかない
2982.0,2984.0,あざといよね
2984.0,2986.0,そんなことしなきゃいいじゃん
2986.0,2988.0,民意はそれで心打たれないじゃん
2988.0,2990.0,そんなこと分かんない
2990.0,2992.0,みんなだったらしないじゃん
2992.0,2994.0,しちゃうんだよね
2994.0,2996.0,最近牧野さんって放送してんの
2996.0,2998.0,牧野放送してんの
3000.0,3002.0,してないの
3002.0,3004.0,牧野さんしてないんだ
3004.0,3006.0,俺なんだかんだで見てたんだよな
3008.0,3010.0,なんだかんだで見てたんだよね
3010.0,3012.0,ニコ生の有料放送について
3012.0,3014.0,最近有料化してんの
3014.0,3016.0,ニコ生って有料じゃん
3016.0,3018.0,俺の放送だってみんなプレミアムでしょ
3018.0,3020.0,500円払ってるわけでしょ
3020.0,3022.0,俺も500円
3022.0,3024.0,各私も払ってるわけですよ
3024.0,3026.0,要は別に無料じゃないじゃん
3026.0,3028.0,無料じゃなくない
3028.0,3030.0,個人チャンネルで金儲けしてんのが
3030.0,3032.0,気に食わねえと
3032.0,3034.0,はいはい分かります俺も気に食わないですよ
3034.0,3036.0,ただね
3036.0,3038.0,最近ねカメゴロ
3038.0,3040.0,すげー好きでさ俺カメゴロ
3040.0,3042.0,カメゴロに金払いかけてんだよね
3042.0,3044.0,それをちょっと
3044.0,3046.0,自分立志してもらうためにも
3046.0,3048.0,今日俺はこの門を開けた
3048.0,3050.0,カメゴロ知らねえの
3050.0,3052.0,カメゴロ面白いぞマジで
3052.0,3054.0,お前ら見ろよ
3054.0,3056.0,サバイバルやってるから
3056.0,3058.0,カメゴロじゃねえやカメゴロってやつがいるんだよ
3058.0,3060.0,なんかアホみたいにさ
3060.0,3062.0,すっぽんの生き血を食らう
3062.0,3064.0,ああいう男になってきたよな
3064.0,3066.0,生き血を食らうみたいなさ
3066.0,3068.0,ぶっこみの巧みみたいな
3068.0,3070.0,そういう一本筋の通った
3070.0,3072.0,男だから
3072.0,3074.0,ぜひね皆さん見ていただければなと
3074.0,3076.0,モコがサイエルのイベントで金稼いで話してくれよ
3076.0,3078.0,モコサイエルのイベントで出たの
3080.0,3082.0,なんかモコ瞑想してんな
3082.0,3084.0,詳しく教えてよ俺に
3084.0,3086.0,教えてよモコ
3088.0,3090.0,置物だったらしい
3090.0,3092.0,お前ら知らないやろモコ置物だぞ
3092.0,3094.0,なんか俺ねモコと俺と
3094.0,3096.0,ゲロとサイオレの
3096.0,3098.0,誰だっけ
3098.0,3100.0,ずっと間違えてた
3100.0,3102.0,なんだっけルナサイオレのルナ
3102.0,3104.0,コウスケ
3104.0,3106.0,サイオレのルナとモコと俺と
3106.0,3108.0,ゲロで飲んだ時モコ一言も
3108.0,3110.0,喋んなかったからおい
3110.0,3112.0,ずーっと合図打ち打ってたからね
3112.0,3114.0,ずーっとモコ置物だぞ
3114.0,3116.0,でもなんかあいつ
3116.0,3118.0,すごいよね一人になるとあんだけ
3118.0,3120.0,ペラが回るってことはさ
3120.0,3122.0,なんかそういうスイッチが
3122.0,3124.0,あるんだろうね
3124.0,3126.0,スイッチが
3126.0,3128.0,コミショーなんじゃないの
3128.0,3130.0,可愛いコミショーだったよ
3130.0,3132.0,俺が見た感じでもね俺
3132.0,3134.0,年下だったから許せたけど
3134.0,3136.0,同い年だったらぶっ飛ばしてた
3136.0,3138.0,同い年だったらね
3138.0,3140.0,なにそのイベント
3140.0,3142.0,あいつらなんで俺誘われねえの
3142.0,3144.0,なんかちょっと話しがねえからおい
3144.0,3146.0,この事件ちょっと大きくなるぞ
3146.0,3148.0,俺は誘われてねえんだけど
3148.0,3150.0,だってモコを経由で俺にお誘いが来てもおかしくねえだろ
3150.0,3152.0,そういう飲み会の誘いはしても
3152.0,3154.0,公には出してはいけねえと
3156.0,3158.0,ちょっとなんかおかしいなと
3158.0,3160.0,思いますよ
3160.0,3162.0,引退してねえや
3162.0,3164.0,ニコ生チャンピオンだぞ
3164.0,3166.0,うんこは出たいのか出たくないのかややこしい
3166.0,3168.0,出たくねえや
3168.0,3170.0,でもやっぱ誘われては欲しいだろ
3170.0,3172.0,みんな的にも
3172.0,3174.0,みんな的にもやっぱさ
3174.0,3176.0,うっぷ主がさ
3176.0,3178.0,やっぱり応援してるうっぷ主がよ
3178.0,3180.0,大物のほうがいいだろ
3180.0,3182.0,ちょっとそれ吐くがつくだろ
3182.0,3184.0,なんかヤフミチャンネル見て
3184.0,3186.0,言いてえよ俺も長穂素子に
3186.0,3188.0,俺がこの前断っちまったよ悪いな
3188.0,3190.0,おめえらの期待に応えられなくてよ
3190.0,3192.0,みたいな
3192.0,3194.0,そういう人波乱を起こしたよ俺も
3194.0,3196.0,全然細子連盟くせに他の長穂素子の悪口
3196.0,3198.0,悪口じゃねえだろ今の
3198.0,3200.0,悪口じゃねえだろ全然
3200.0,3202.0,正しいことをやっぱ正しいやっぱ
3202.0,3204.0,あれだなつれえよな俺たちって
3204.0,3206.0,いつも悪者だよほんとに見たか
3206.0,3208.0,これがミーだぞお前ら
3208.0,3210.0,お前らの大好きなミーだぞ俺が
3210.0,3212.0,俺たちは正しいことをしてるのに
3212.0,3214.0,なあ一人がそうやって言い出すと
3214.0,3216.0,ネットって怖えよなそうやってな
3216.0,3218.0,一人が言い出すとどんどんどんどんな
3218.0,3220.0,そうやって拍車かかってな俺たちが悪者
3220.0,3222.0,なってくんだよ
3222.0,3224.0,気をつけろよほんとに
3224.0,3226.0,リエライ見てよ
