start,end,text
1070.0,1072.0,あいつ馬鹿だよ本当に
1072.0,1074.0,一歳6ヶ月くらいだったら
1074.0,1076.0,いらねえだろもう
1076.0,1078.0,本当にあんなねえ
1078.0,1080.0,汚れた悪魔だろ絶対
1080.0,1082.0,しょうもない男になるだろ
1082.0,1084.0,どう考えても
1084.0,1086.0,片親のさ馬鹿なさ
1086.0,1088.0,そんなクソ
1088.0,1090.0,気づいたんだけど子供好きじゃないんだよね
1090.0,1092.0,みたいなこいつ
1092.0,1094.0,お前なんか子供つくんだけじゃん
1094.0,1096.0,酔っ払っただけで
1096.0,1098.0,あんま子供好きじゃん自分の子供だったらいいんだけどさ
1098.0,1100.0,みたいなこいつ
1100.0,1102.0,頭おかしいじゃん
1102.0,1104.0,なんでそれさ
1104.0,1106.0,なんつーの
1106.0,1108.0,周りのさ
1108.0,1110.0,あのー
1110.0,1112.0,ねえなんかもうかわいそうでさ
1112.0,1114.0,なんでそういう時にゴロリは
1114.0,1116.0,引っ込んでんだ
1116.0,1118.0,帰ってって言っちゃった
1118.0,1120.0,そうなんか言っちゃうんだよね
1120.0,1122.0,マジで
1122.0,1124.0,なんかかわいそうになっちゃって子供が
1124.0,1126.0,かといってさ俺自分の子供以外育てる気ねえから
1126.0,1128.0,マジサラサラ
1128.0,1130.0,でお母さんもなんか
1130.0,1132.0,兄弟高校しなきゃねえみたいなこと言ってんの
1132.0,1134.0,なんかそうやって
1134.0,1136.0,力になってあげてねえみたいな
1136.0,1138.0,んーわかったよ
1138.0,1140.0,じゃああなたが言うんだったらね
1140.0,1142.0,私は力になりますけど
1142.0,1144.0,包囲じゃありませんよみたいな
1144.0,1146.0,冷たくしたほうがいいよなマジで
1146.0,1148.0,冷たくしたほうがいいよね
1150.0,1152.0,マジで
1152.0,1154.0,そのかけたらポッキーゲームされてくれ
1154.0,1156.0,本当に冗談なくねえ
1156.0,1158.0,本気で悩んでるんだよ
1158.0,1160.0,本気で悩んでんの
1160.0,1162.0,背中押してってことだよ
1162.0,1164.0,女ってそうじゃん相談があるんだ
1164.0,1166.0,っていうのはもう自分の中で結論出てて
1166.0,1168.0,背中押してそうだよ離婚しちゃえよ離婚しちゃえよ
1168.0,1170.0,だよねだよねっていう展開を
1170.0,1172.0,向こうが待ってたから俺は一切ダンコ反対した
1172.0,1174.0,それはやっぱり男の気持ちが
1174.0,1176.0,俺はわかるから
1176.0,1178.0,お父さんもこういう気持ちでやってると思うよ
1178.0,1180.0,いやでもさあみたいな
1180.0,1182.0,全部ねえ
1182.0,1184.0,批判で返されるんだよね
1184.0,1186.0,それじゃやっぱ良くないと思うんだよ
1186.0,1188.0,そんな簡単に結婚離婚なんてすんの
1188.0,1190.0,本当だよな彼氏彼女が別れる別れで
1190.0,1192.0,喧嘩してるわけじゃねえんだから
1192.0,1194.0,ちょっとねえ
1194.0,1196.0,うちの姉ちゃんおかしいんだよね
1196.0,1198.0,30万周期出してんだから
1198.0,1200.0,ふざけんなよバカたれと
1200.0,1202.0,バカ使ってやってると思ってんだよみたいな
1202.0,1204.0,俺一言も言ってるんだからなそれ
1204.0,1206.0,マジで
1206.0,1208.0,ええうんかち姫お年玉も言わなきゃくれない
1208.0,1210.0,みたいな
1210.0,1212.0,あごめん俺マジごめんなみたいな感じでさ
1212.0,1214.0,あげてんだけど
1214.0,1216.0,俺30万出してるからな
1216.0,1218.0,本当に姉ちゃんの結婚式お母さんとお父さんが
1218.0,1220.0,ちょっと金ねえから貸してくんねえか
1220.0,1222.0,俺すって自分の家のさ
1222.0,1224.0,周期をね
1224.0,1226.0,俺が出してやってんだからなんで子供できた
1226.0,1228.0,5万円結婚したじゃん
1228.0,1230.0,別々に周期渡してるからね
1230.0,1232.0,あごめんちょっと俺結婚式なんか
1232.0,1234.0,タイミング悪くてねご周期渡せなかったから
1234.0,1236.0,ご周期渡して
1236.0,1238.0,もういいだろそんな仮面兄弟みたいなのは
1240.0,1242.0,仮面兄弟は
1242.0,1244.0,いいだろもう
1244.0,1246.0,しかもやっぱさ
1246.0,1248.0,兄弟のさことだからさ
1248.0,1250.0,なんていうの誰にも相談できねえじゃん
1250.0,1252.0,彼女にも言えねえじゃん
1252.0,1254.0,あんまり言っちゃいけねえだろ
1254.0,1256.0,家族のことはやっぱそれで悪く
1256.0,1258.0,お母ちゃんは
1258.0,1260.0,金なくねえんだけど母ちゃんはちょっと
1260.0,1262.0,なんかもう浪費家なんだよアホみたいな金使うんだよ
1262.0,1264.0,無理なんだよ
1264.0,1266.0,俺どっちかっていうとさ貯蓄派だからさ
1266.0,1268.0,なんていうのある程度ね
1268.0,1270.0,自分の決まった額貯金はしてるんだけど
1270.0,1272.0,でお父さんすぐなんかアホみてり
1272.0,1274.0,ねえ無職もう10年くらい
1274.0,1276.0,ちゃんとした後仕事してねえのに
1276.0,1278.0,年に2回海外旅行行ってんのもう
1278.0,1280.0,俺はもうドロップアウトだろ
1280.0,1282.0,みたいな感じで
1282.0,1284.0,お母さんのカードで海外旅行行ってんのね
1284.0,1286.0,もうちょっと頭おかしくなってきたよ
1286.0,1288.0,もうなんていうのかなあ
1288.0,1290.0,まあ余生を
1290.0,1292.0,謳歌してるみたいな
1292.0,1294.0,うちのお父さんバチンコ言ってるよまだ
1294.0,1296.0,もうバチンコ言ってるよまだ
1296.0,1298.0,ただやっぱだからもう俺になんか
1298.0,1300.0,家族のなんかそういうのが
1300.0,1302.0,グーってのしかかってきてんだよね俺が今
1302.0,1304.0,もうブルブルって
1304.0,1306.0,震えながら俺が家族を支えてるみたいな
1306.0,1308.0,俺決してね貯金を
1308.0,1310.0,仕送りしてるわけじゃないんだけど
1310.0,1312.0,お前に後は頼んだぞみたいな
1312.0,1314.0,そういう
1314.0,1316.0,重圧がさ
1316.0,1318.0,半端ないんだよね
1318.0,1320.0,普通にかわいそうだったほんとだろ
1320.0,1322.0,俺かわいそうだろ
1322.0,1324.0,まじで
1324.0,1326.0,本気でかわいそうじゃないか
1326.0,1328.0,一回お前の重要性分からせてやれ
1328.0,1330.0,ほんとだよなあなんかでもこの前ね
1330.0,1332.0,黙らしてやったよなんか俺ね
1332.0,1334.0,自分の年収とかお父さんに一回も言ったことなかったんだけど
1334.0,1336.0,この前さあ
1336.0,1338.0,家帰った時におめえはよ
1338.0,1340.0,一人前にもならねえでよみたいなこと言われたから
1340.0,1342.0,俺でもだいたいこんぐらい稼いでるよみたいな
1342.0,1344.0,言って
1344.0,1346.0,車を
1346.0,1348.0,買うって話になって
1348.0,1350.0,駐車場借りるんだみたいな話になった時に
1350.0,1352.0,そういうこと言われたの
1352.0,1354.0,本当にガミガミ言われたの俺でも今こんぐらい稼いでるよ
1354.0,1356.0,って言って
1356.0,1358.0,厳選聴取をピラッと見せてやったの
1358.0,1360.0,それでちょっと黙ったわさすがに
1360.0,1362.0,もうおめえの時代じゃねえんだぞって
1362.0,1364.0,男の30まじかなんつったら
1364.0,1366.0,最もパワーがあるじゃん
1366.0,1368.0,数字をチラつかせたらやっぱ
1368.0,1370.0,お父さんももうこいつだなと
1370.0,1372.0,安心して任せられるかみたいな
1372.0,1374.0,そういう信頼を
1374.0,1376.0,得たね俺は
1376.0,1378.0,なんかすごいスッキリした
1378.0,1380.0,最近の俺の心のもやもやをさ
1380.0,1382.0,あれだな
1382.0,1384.0,自分に溜め込んじゃだめだな
1384.0,1386.0,昔もよく言ったけどさ
1386.0,1388.0,青春と日記と
1388.0,1390.0,生放送は溜めるなと
1390.0,1392.0,言ったじゃないですか
1392.0,1394.0,皆さんもねストレス溜まるじゃないですか
1394.0,1396.0,何かとね気候もね
1396.0,1398.0,グチャグチャしてるじゃんまた来週から
1398.0,1400.0,ぐーんとね
1400.0,1402.0,気温下がるみたいですよ
1402.0,1404.0,体調にもね重々に
1404.0,1406.0,気を付けてやっていかなきゃいけないと
1406.0,1408.0,ストレスでね
1408.0,1410.0,死んでしまうんで
1410.0,1412.0,皆さんも重々に
1412.0,1414.0,気を付けていただければなと
1414.0,1416.0,親父もお前のことATMとして
1416.0,1418.0,見てるぞいやお父さんはね
1418.0,1420.0,俺のことそういう目で見てないんだ
1420.0,1422.0,お母さんをそういう目で見てる
1422.0,1424.0,お母さんをそういう目で
1424.0,1426.0,見てるけど俺やっぱ子供にはね
1426.0,1428.0,お金借りれないんじゃないお父さんは
1428.0,1430.0,お母さん経由して借りてくるからね
1430.0,1432.0,俺には
1432.0,1434.0,まあでもねやっぱ親にはさ
1434.0,1436.0,無償の愛でさ育てていただいた御恩が
1436.0,1438.0,あるじゃないですかアホみたいにお金も
1438.0,1440.0,かかっただろうし俺は
1440.0,1442.0,その点は全然いいんだけどお姉ちゃんはちょっとね
1442.0,1444.0,なんか俺納得いかねえな納得いかねえな
1444.0,1446.0,っていう風にね最近思ってるんですよ
1446.0,1448.0,皆さんもだから
1448.0,1450.0,家族のねこういうごちゃごちゃ
1450.0,1452.0,本当に悲しくなっちゃうんで後味悪くなっちゃうんでね
1452.0,1454.0,うん
1454.0,1456.0,ちっちゃいちっちゃいうちにね目を借り取ったほうがいいと思いますよ
1458.0,1460.0,ちょっと待ってくださいね
1460.0,1462.0,お姉ちゃんと子供の面倒が見えないっていう
1462.0,1464.0,いやでもそんなこと
1464.0,1466.0,向こうが言われたときに
1466.0,1468.0,面倒ちょっと苦面してほしいって言われたときに
1468.0,1470.0,NOとは言うけど
1470.0,1472.0,いきなりもうそんなのさ
1472.0,1474.0,断絶じゃん本当に
1474.0,1476.0,いや俺言っとくけどお前が離婚しても
1476.0,1478.0,子供のせいは見ねえからなってそんなさ
1478.0,1480.0,弟がいきなり言い出したら頭おかしいじゃん
1482.0,1484.0,頭おかしいじゃん
1484.0,1486.0,離婚したらお前の家に住みつくぞ
1486.0,1488.0,いやそれは絶対ないわ
1488.0,1490.0,俺もやっぱこっちにね
1490.0,1492.0,こっちにやっぱ暮らしがあるわけだから
1492.0,1494.0,暮らしがあるわけだからさ
1494.0,1496.0,なかなか難しいじゃないですか
1496.0,1498.0,俺お姉ちゃんに学歴
1498.0,1500.0,年収すべての受けで負けてるからたかるわ
1500.0,1502.0,いややっぱり家族ってなんかそういう目で
1502.0,1504.0,見ちゃいけないじゃないですか
1504.0,1506.0,でも最近ちょっとズズしいって言ったらいい
1506.0,1508.0,俺お母さんに言ったよあいつが悪いよ
1508.0,1510.0,めっちゃ駆け口言っといた
1510.0,1512.0,お母さん騙されちゃいけねえよお母さん
1512.0,1514.0,あいつが悪いぞって
1514.0,1516.0,お母さんもねお父さんも洗脳されてるよって
1516.0,1518.0,ものすごい口うまいからさ
1518.0,1520.0,あいつが悪いぞ
1520.0,1522.0,第3者俺はさ家に出て10年経ってるから
1522.0,1524.0,すごい客観的にね今の家庭を
1524.0,1526.0,見ることができるけど家の外にいる人間だからね
1526.0,1528.0,長男という立場はあるけど
1528.0,1530.0,家の外にいる人間だから
1530.0,1532.0,すごくね客観的に見てるけど
1532.0,1534.0,あいつが悪いぞって言っときます
1534.0,1536.0,延長しますかみなさんのご希望に
1536.0,1538.0,添える形で
1540.0,1542.0,まあでもさ
1542.0,1544.0,基本的に親っていうのはやっぱ
1544.0,1546.0,ねえ子供の見方しちゃうじゃないですか
1546.0,1548.0,俺がねいざとなったらガツンと
1548.0,1550.0,言っていかなきゃいけないなとは
1550.0,1552.0,思ってるんですけどね
1552.0,1554.0,今ちょっと
1554.0,1556.0,最近の近況なんか
1556.0,1558.0,なんかちょっとねいろいろ話したいことあったんだよな
1558.0,1560.0,措置でのなんか
1560.0,1562.0,ねえこととか
1562.0,1564.0,全然興味ないけど
1564.0,1566.0,なあ措置
1566.0,1568.0,やっぱ措置だよなあやっぱなあ
1568.0,1570.0,ここ一ヶ月ったらなあ
1570.0,1572.0,措置
1572.0,1574.0,おめえらもなあ
1574.0,1576.0,応援しろよ措置
1576.0,1578.0,でもなんか俺はね
1578.0,1580.0,まおちゃんいるじゃん
1580.0,1582.0,まおちゃん
1582.0,1584.0,まおちゃんみたいな女と結婚してるよな
1584.0,1586.0,ああいうちょっとなんていうの謙虚なさ
1586.0,1588.0,心の底から
1588.0,1590.0,純粋な気持ちで
1590.0,1592.0,下心なく応援して
1592.0,1594.0,こいつのためになんとかしてやりたいなみたいな
1594.0,1596.0,いや本当に
1596.0,1598.0,まおちゃんみたいな女と結婚してるなって
1598.0,1600.0,本当に心の底から思ったわ
1600.0,1602.0,みなさんもああいう女性をね
1602.0,1604.0,しっかり見つけてあげてくださいね
1604.0,1606.0,顔もまあ
1606.0,1608.0,かわいらしいじゃんかわいらしいじゃないですか
1608.0,1610.0,ああいう女性を
1610.0,1612.0,本当にね心がね
1612.0,1614.0,きれいなすんだね
1614.0,1616.0,ああいう女性を見つけてあげていただければなと
1616.0,1618.0,よくじゃん森の発言はどうですか
1618.0,1620.0,なんかねあいつはいつも
1620.0,1622.0,転ぶなあみたいなこと言ったんでしょ
1622.0,1624.0,まあいいじゃないですか
1624.0,1626.0,なんか俺はね
1626.0,1628.0,彼なりの優しさ
1628.0,1630.0,彼なりの優しさと俺は
1630.0,1632.0,取りましたけど
1632.0,1634.0,政治家ってね
1634.0,1636.0,何かとそういう目で見られちゃうからね
1636.0,1638.0,なんか双方叩きに
1638.0,1640.0,袋叩きになってたよね
1640.0,1642.0,あんなこと言わなきゃいいのになあ
1642.0,1644.0,あんなこと言わなきゃいいのにって
1644.0,1646.0,そういうやつっているよね
1646.0,1648.0,言わなきゃいいのにみたいな
1648.0,1650.0,もうだってさあの人ももうね
1650.0,1652.0,前線にいるけどさ
1652.0,1654.0,女性みたいな感じじゃん
1654.0,1656.0,なんかもう何も言わなければ幸せに過ごせるのに
1656.0,1658.0,って思っちゃうんですよね
1658.0,1660.0,あマスコミが悪いよね
1660.0,1662.0,絶対ね報道の仕方悪いよねあれね
1662.0,1664.0,ちゃんとさ前後の文脈もね
1664.0,1666.0,しっかりさね届けてあげないとさ
1666.0,1668.0,あそこのブロックだけさ
1668.0,1670.0,抽出してさみんなに伝えたらさ誤解を招くじゃん
1670.0,1672.0,あれちょっとねあの
1672.0,1674.0,前後のなんかセリフもしっかり
1674.0,1676.0,聞いてほしいな
1676.0,1678.0,羽生くん俺も好きだわ
1678.0,1680.0,羽生くんのどこが好きって俺さ
1680.0,1682.0,スケートとかクソ興味ねえから
1682.0,1684.0,どうでもいいんだけどスケートの内容は
1684.0,1686.0,あいつ肌が綺麗だろ
1686.0,1688.0,ああいうやっぱ肌になっていかなきゃいけないよねやっぱ羽生くん
1688.0,1690.0,おめえらも羽生くんの肌見ろよ
1690.0,1692.0,マジで肌
1692.0,1694.0,羽生くんの肌やばくないあれ
1694.0,1696.0,ものすごい綺麗だよね
1696.0,1698.0,あのー
1698.0,1700.0,15歳みたいな
1700.0,1702.0,おい!みたいなやついるじゃん
1702.0,1704.0,渋谷のキングみたいなやついるじゃん
1704.0,1706.0,15歳のオイスみたいなやつ
1706.0,1708.0,あいつはやっぱさ若気のイタリでさ
1708.0,1710.0,言ってるけどさ
1710.0,1712.0,羽生くんはいいなって
1712.0,1714.0,思いましたよな
1714.0,1716.0,頭もいいらしいね
1716.0,1718.0,頭もいいなんかそういうのって
1718.0,1720.0,ねえやっぱ天は
1720.0,1722.0,荷物を与えちゃうんだよな
1722.0,1724.0,羽生くん相当のナルシストらしい
1724.0,1726.0,やっぱ自分でさ自分のことをさ
1726.0,1728.0,よく女性が言うじゃんなんか
1728.0,1730.0,ナルシストキモいみたいな
1730.0,1732.0,自分で自分のことを愛せずに
1732.0,1734.0,どうやって人を愛していくんだと
1734.0,1736.0,まずはなんていうのかな
1736.0,1738.0,世界のねこの
1738.0,1740.0,イデオロギーをぶっ壊していきたい
1740.0,1742.0,私もね各位私もかなりのナルシスト
1742.0,1744.0,最近もねすごく
1744.0,1746.0,ナルシストに拍車がかかってきて
1746.0,1748.0,自分に自信が出てきたと
1748.0,1750.0,根拠のない自信もやっぱ
1750.0,1752.0,時には必要じゃないですか
1752.0,1754.0,時には必要じゃないですか
1754.0,1756.0,皆さんもねどんどんナルシストになっていっていただければ
1756.0,1758.0,ちょっとさコメビューがなんかこうやって曲がってんの
1758.0,1760.0,気になるから一瞬直していい?
1760.0,1762.0,ごめんな
1762.0,1764.0,なにこれ
1764.0,1766.0,え?なにこれ
1766.0,1768.0,なにこれ
1768.0,1770.0,こっちか
1770.0,1772.0,わりわり
1772.0,1774.0,ごめんな
1780.0,1782.0,不慣れだよ
1782.0,1784.0,最近の俺は
1794.0,1796.0,どう?
1798.0,1800.0,俺さ
1800.0,1802.0,あーじゃあちょっと
1802.0,1804.0,そろそろコメントでも読んでいくか
1804.0,1806.0,コメントでも
1806.0,1808.0,でもちょっとね
1808.0,1810.0,俺最近ニコ動とニコ生の
1810.0,1812.0,をあんま見てないのね
1812.0,1814.0,あんま見てないというかぶっちゃけほんとに見てないの
1814.0,1816.0,で俺一番嫌いなのが
1816.0,1818.0,俺もう
1818.0,1820.0,おめーらとちげーからよみたいな
1820.0,1822.0,いるじゃんそんなにやりたくねーからさ
1822.0,1824.0,でニコ動とニコ生の話はよすべー
1824.0,1826.0,じゃこれから強烈に
1826.0,1828.0,勉強してくるから俺
1828.0,1830.0,この1ヶ月で俺は
1830.0,1832.0,強烈に仕上げてくるから
1832.0,1834.0,ニコ動とニコ生の話はやめよう
1834.0,1836.0,なんか2ヶ月ぶりくらいにちくわちゃんランキング開いて
1836.0,1838.0,なんだこいつはよーみたいな
1838.0,1840.0,なんだこいつはよー
1840.0,1842.0,だからちょっとあれすべーみたいな
1842.0,1844.0,宝剣士だよなーみたいな
1844.0,1846.0,ランキング1位からずーっと打ってきちゃったよ
1846.0,1848.0,手始めにやっぱ生放送する前にはね
1848.0,1850.0,それくらいの助走が必要じゃん
1850.0,1852.0,やるぞと今日はやるぞ
1852.0,1854.0,という感じでコメントも残してきた
1854.0,1856.0,宝剣士だよな
1856.0,1858.0,お前って宝剣士だよなー
1858.0,1860.0,みたいな
1860.0,1862.0,俺は別に荒らしたわけじゃない
1862.0,1864.0,本当に宝剣士ではないかと
1864.0,1866.0,疑ったわけだからね
1866.0,1868.0,その彼のためにも疑惑を
1868.0,1870.0,晴らすためにも俺は質問せざるを得なかった
1870.0,1872.0,俺はな
1872.0,1874.0,宝のホストみたいななにそれ
1874.0,1876.0,俺さその別に
1876.0,1878.0,マブじゃねーからさあいつが何してるかとか
1878.0,1880.0,全然わかんないんだ1年くらい連絡も取ってないし
1880.0,1882.0,俺わかんないんだよね
1882.0,1884.0,うん
1884.0,1886.0,わかんないんだよね
1886.0,1888.0,逆にみんなからの情報を
1888.0,1890.0,集めてパーツをね
1890.0,1892.0,ピースを集めてパチパチはめていく作業に
1892.0,1894.0,これから勤しむと
1894.0,1896.0,勤しむとす
1896.0,1898.0,最近でもねテレビはねテレビっていうかね
1898.0,1900.0,スポーツ
1900.0,1902.0,スポーツって偏ってあれだな
1902.0,1904.0,情報収集してるな
1904.0,1906.0,にちゃんのまとめすれの
1906.0,1908.0,なんだっけそのから抽出した
1908.0,1910.0,情報しかないから
1910.0,1912.0,ちょっとね偏った情報になっちゃってるんだよね
1912.0,1914.0,うん偏った情報に
1914.0,1916.0,アフィ騒動してるのにアフィ騒動って
1916.0,1918.0,なんかでもそんなさもうさ
1918.0,1920.0,アフィとかさ
1920.0,1922.0,小敷とかで荒れるようなニコ生とか
1922.0,1924.0,じゃねーだろもう
1924.0,1926.0,当たり前じゃんそんなのが
1926.0,1928.0,当たり前じゃない
1928.0,1930.0,ははは
1930.0,1932.0,ははは
1932.0,1934.0,シビアズキングがPC買って話して
1934.0,1936.0,なんか何を
1936.0,1938.0,神のような俺スキルを持ってると思ってるんだろう
1938.0,1940.0,その
1940.0,1942.0,稚拙な話題で俺どうやって話題を広げればいいの
1942.0,1944.0,1ヶ月ぶりのニコ生なのにさ
1944.0,1946.0,なかなかハードル高くないか
1946.0,1948.0,その
1948.0,1950.0,新しい何のパソコン買った
1950.0,1952.0,あれみたいな
1952.0,1954.0,あのレノボ
1954.0,1956.0,レノボ買ったみたいなさ
1956.0,1958.0,そういう話しかできねー
1958.0,1960.0,最近タバコ吸ってるんや1月1日にね
1960.0,1962.0,タバコ2箱吸ったんだけど
1962.0,1964.0,全然
1964.0,1966.0,吸いたくもならず
1966.0,1968.0,自生できております
1968.0,1970.0,ネルは強制退去で3月8日に
1970.0,1972.0,生主ハウスに行くぞ
1972.0,1974.0,マジかよそんなにネルさん落ちぶれちゃったのかよ
1974.0,1976.0,なんか
1976.0,1978.0,もう1回やっぱね
1978.0,1980.0,底辺をやっぱ知ることによりさ
1980.0,1982.0,頂上が見えてくる
1982.0,1984.0,てっぺんが見えてくるみたいな
1984.0,1986.0,そういう私は
1986.0,1988.0,期待
1988.0,1990.0,期待を込めて
1990.0,1992.0,何かその生主ハウスブーム来てんの
1992.0,1994.0,生主ハウスブーム来てんの
1994.0,1996.0,生主ハウスブーム
1996.0,1998.0,生主ハウスブーム
1998.0,2000.0,来てんの
2002.0,2004.0,生主ハウスブーム来てんの
2004.0,2006.0,近場にニコ生運動しとったの
2006.0,2008.0,本当に寂しいねちょっと
2008.0,2010.0,寂しいね
2010.0,2012.0,なんかやっぱそういうさ
2012.0,2014.0,自分がさちょっとでもさ
2014.0,2016.0,繋がりのある人間がさ
2016.0,2018.0,いなくなっちゃってるのは寂しいな
2018.0,2020.0,名前の生主ハウスはゴミってみずちが言ってたな
2020.0,2022.0,なんか初めて俺4年間
2022.0,2024.0,5年間ぐらいみずちと一緒にいて初めて正しいこと言ったな
2024.0,2026.0,みずちが
2026.0,2028.0,あいつもなんか成長したんだな
2028.0,2030.0,嬉しいよなんか友達ながらに
2030.0,2032.0,初めて正しいこと言ったなみずちがな
2032.0,2034.0,近場は定期的にニコ生引退してる
2034.0,2036.0,ああ
2036.0,2038.0,様式美みたいな感じね
2038.0,2040.0,ネルは暗黒関連とは関わらないでほしい
2040.0,2042.0,俺全然見てねえんだよなその辺も
2042.0,2044.0,ニコ生とニコ動の話やめようぜ
2044.0,2046.0,俺ガチでついていけないからさ本気で
2046.0,2048.0,この1ヶ月でちょっと
2048.0,2050.0,猛収集すっから猛収集
2052.0,2054.0,猛収集にすっからさ
2054.0,2056.0,猛攻2位となったんだね
2056.0,2058.0,猛攻とも合ってねえな全然しゃべってないから分かんないけど
2058.0,2060.0,ちょっとなんか今度じゃあ聞いてみるわ
2060.0,2062.0,仕事やめたんですかみたいな
2062.0,2064.0,よそよそしい距離感のあるなんか
2064.0,2066.0,対応でうまいこと聞いたの
2066.0,2068.0,聞き出した兄ちゃんに猛攻するやっとくわ
2068.0,2070.0,あいつなんとかするらしいぞみたいな
2072.0,2074.0,ギガゾンビRTAはうんこちゃんが登録した
2074.0,2076.0,ギガゾンビRTAは俺が登録した
2076.0,2078.0,あれめっちゃ面白くない
2078.0,2080.0,めっちゃ面白くない見たみんなギガゾンビのRTA
2080.0,2082.0,見とけよあれ
2082.0,2084.0,絶対に
2084.0,2086.0,ゲロと飲んで話してくれ
2086.0,2088.0,まだ言ってんのか根にもってんのか
2088.0,2090.0,それ
2090.0,2092.0,まだ根にもってんの俺でももっとさ
2092.0,2094.0,あれなんだよねこの前さなんか知り合った女が
2094.0,2096.0,この前いつもあれだよ彼女ができる前に
2096.0,2098.0,知り合った女が
2098.0,2100.0,なんか私ニコ動とか見てるんですよみたいな
2100.0,2102.0,こと言って
2102.0,2104.0,あのー
2104.0,2106.0,歌ってみるとか聞いてんの聞いてます聞いてます
2106.0,2108.0,みたいなシャウト系が好きなんですよ
2108.0,2110.0,ゲロとか知ってんのみたいな話になって
2110.0,2112.0,俺ゲロと友達だぞみたいな
2112.0,2114.0,終わりあのーゲロとさ
2114.0,2116.0,LINEをしてるの見せて知ったよ
2116.0,2118.0,ごめんな魂を売って
2118.0,2120.0,ゲロ使って女抱こうとして
2120.0,2122.0,ごめんマジで
2122.0,2124.0,ただその生放送を
