start,end,text
0.0,14.0,【早送り】
14.0,16.0,あー
16.0,18.0,どうでしょうかね
18.0,20.0,皆さんに私の声は
20.0,22.0,聞こえてるんでしょうかね
22.0,24.0,いかがでしょう
24.0,26.0,あ
26.0,28.0,聞こえてますか
28.0,30.0,皆さんの
30.0,32.0,レスポンスがちょっと
32.0,34.0,ないようなので
34.0,36.0,うまいこと円滑にちょっと物事が
36.0,38.0,進んでいかないんですけど
38.0,40.0,どうも
40.0,42.0,こんにちは
42.0,44.0,ちょっと待ってくださいね
44.0,46.0,音質綺麗かマジか
48.0,50.0,知らず知らずのうちに
50.0,52.0,なんかパワーアップしたんだな
54.0,56.0,こんにちはどうも
56.0,58.0,文子ちゃんと申します
58.0,60.0,皆さんどうですか調子は
60.0,62.0,いやーなんかだんだんね
62.0,64.0,日も長くなってきてね
64.0,66.0,春の訪れを皆さん感じませんか
66.0,68.0,私は最近ね
68.0,70.0,一時期めちゃくちゃ寒かったじゃん
70.0,72.0,めっちゃ寒くなかった
72.0,74.0,雪なんか降っちゃったりしてね
74.0,76.0,東京にいるとは思えないような
76.0,78.0,そんななんかちょっとね変わった
78.0,80.0,風だったじゃないですか
80.0,82.0,今シーズンはね
82.0,84.0,ただなんかね最近仕事終わりに
84.0,86.0,日夜道をてこてこてこてこ帰宅してくるんですけど
86.0,88.0,なんか明るいなーなんつってね
88.0,90.0,もうやっぱ春だなと
90.0,92.0,そういうねなんか季節感は
92.0,94.0,やっぱ素晴らしいですよね
94.0,96.0,日本に住んでてよかったなと
96.0,98.0,いう風に思いますよね
98.0,100.0,なんか話がずれちゃいましたけど
100.0,102.0,どうも文子ちゃんです
102.0,104.0,名前だけでも覚えて帰っていただければなと
104.0,106.0,思いますちょっと水飲みますね
106.0,108.0,綾鷹
108.0,110.0,なんかさー
110.0,112.0,ほんとにもうマジで
112.0,114.0,俺ねあれなんだよね
114.0,116.0,憎しを殺し殺しかけたったんだよね
116.0,118.0,ほんとに
118.0,120.0,なんかうちの姉ちゃんが
120.0,122.0,離婚するって言い始めていきなり
122.0,124.0,うちの姉ちゃんが
124.0,126.0,まあ2年しか結婚してない
126.0,128.0,離婚するって言い始めて
128.0,130.0,まあなんかおーマジかみたいな
130.0,132.0,あのー第3者からすると
132.0,134.0,ウケるじゃん
134.0,136.0,あ、離婚するって結婚
136.0,138.0,した人のまあ3割は離婚するから
138.0,140.0,別に普通だよなみたいな
140.0,142.0,そういうのあるじゃん
142.0,144.0,ただね結構
144.0,146.0,禁止者が離婚しかけると
146.0,148.0,かなり心にくるような感じで
148.0,150.0,しかもなんかもう
150.0,152.0,完全に
152.0,154.0,なんていうのかな
154.0,156.0,もう男を振るときの女の感情が
156.0,158.0,芽生えてるんだよね
158.0,160.0,なんかもう手繋ぎたくないとか
160.0,162.0,顔見たくないとか
162.0,164.0,生理的にも受け付けないみたいな
164.0,166.0,そういう
166.0,168.0,なんか俺相談をよく受けてるんだけど
168.0,170.0,まあでもさ子供いるわけよ
170.0,172.0,聞いてよみんな子供いるわけよ
172.0,174.0,子供がねうちのお姉ちゃん
174.0,176.0,1歳何ヶ月かわかんねーけど
176.0,178.0,子供がいるわけよまだ喋れもしない
178.0,180.0,子供がいるわけよ
180.0,182.0,で私はね28歳にもなりましたけど
182.0,184.0,今年でもう29歳になるんですけど
184.0,186.0,一応男性なんですね
186.0,188.0,でやっぱ父上の影響をやっぱ
188.0,190.0,激しく受けてきて
190.0,192.0,30年弱いもうね30年弱
192.0,194.0,生きてますので父上の偉大さって
194.0,196.0,やっぱ測り知れなくないですか
196.0,198.0,この歳になってみてさ
198.0,200.0,うわお父さんってすげーなみたいな
200.0,202.0,ねえ
202.0,204.0,そういうふうにやっぱ思うわけですよだからね
204.0,206.0,あの男の立場から言わせてもらったら
206.0,208.0,絶対にお父さんはいなきゃだめだよと
208.0,210.0,しかも
210.0,212.0,一番の問題はきれいごとじゃなくて
212.0,214.0,一番の問題は経済的にどうすんだよ
214.0,216.0,って感じじゃないですか
216.0,218.0,これから一番ね
218.0,220.0,金がかかってくるのにやっぱ小学校行ってね
220.0,222.0,中学校行って高校行って大学来てって
222.0,224.0,大学行かせなきゃいけないじゃないですか
224.0,226.0,お前のな安月給でどうやって
226.0,228.0,暮らしていくんだよっていう話になるじゃないですか
228.0,230.0,ほんとしかもね
230.0,232.0,聞いて!医者料だろって言うだろ
232.0,234.0,こっちが払わなきゃいけないからね
234.0,236.0,向こうなんも悪くないからね
236.0,238.0,向こうなんも悪くないから
238.0,240.0,うちの姉ちゃんね
240.0,242.0,こんなことね俺ね言いたくなかったんだよ
242.0,244.0,あの放送でね言いたくなかったんだけど
244.0,246.0,うちの姉ちゃん学生時代めっちゃモテたの
246.0,248.0,本当にとんでもないくらいモテたので
248.0,250.0,その時の感性のまま味噌汁になってるから
250.0,252.0,なんていうの
252.0,254.0,もう
254.0,256.0,多分ね
256.0,258.0,なんかねもう
258.0,260.0,聞いたの何が一番の原因なのみたいな
260.0,262.0,聞いたら
262.0,264.0,おじさんみたいで嫌だって言ってんの
264.0,266.0,あの旦那さんのことをね
266.0,268.0,まあそれは聞いてやと
268.0,270.0,姉ちゃんと
270.0,272.0,あれだよ!とぐろを悟す時の限界みたいな
272.0,274.0,あんたも歳をとれば
274.0,276.0,あいつも歳をとればあんたも歳をとる
276.0,278.0,それでいいじゃねーかと
278.0,280.0,俺ほんと言ったんだよ
280.0,282.0,ただ違うのもう
282.0,284.0,なんかね職場にいる若い男の子とか見てると
284.0,286.0,あーいいなーみたいな
286.0,288.0,ほんとに
288.0,290.0,って思っちゃうんだって
290.0,292.0,たださよくねーじゃん
292.0,294.0,旦那6時半からね家出て家帰ってくるの10時だよ
294.0,296.0,ずーっと牛で
296.0,298.0,あの牛のクソをさ
298.0,300.0,掃除してんだよ
300.0,302.0,牛のクソを
302.0,304.0,16時間くらい
304.0,306.0,そんな牛のクソをさ
306.0,308.0,ねー掃除しててさ
308.0,310.0,週に1回しか休みないんだよ
310.0,312.0,週に1回
312.0,314.0,なのになんかね
314.0,316.0,子育てを手伝ってくれてる
316.0,318.0,気がしないとかやっぱり
318.0,320.0,仕事があるってのは分かってるし
320.0,322.0,帰ってくるのが遅いから
322.0,324.0,理解してるつもりなんだけど
324.0,326.0,私がね家に行ってずーっと子供を養して寝かして
326.0,328.0,朝起こしてご飯食べさしてみたいな
328.0,330.0,だから私1人で子育てしてる気がする
330.0,332.0,みたいな
332.0,334.0,そういう脳みそになっちゃってるんだよね
334.0,336.0,うちお姉ちゃん
336.0,338.0,ほんとに
338.0,340.0,でもちろんね
340.0,342.0,家族って特別じゃん
342.0,344.0,そんなことを相手に言えるわけもなく
344.0,346.0,相手のお母さんにも言えるわけもなく
346.0,348.0,心にねそういう闇を抱えたまま
348.0,350.0,離婚したいって
350.0,352.0,ずーっと言ってるんだって顔見たくないんだって
352.0,354.0,でね毎週末
354.0,356.0,うちの家に泊まりに来るのマジで鬱陶しいの
356.0,358.0,それが
358.0,360.0,東京駅から
360.0,362.0,ほんとにぶっ殺したいのが
362.0,364.0,俺ほんとマジで子供大っ嫌いになったんだけど
364.0,366.0,あのー
366.0,368.0,子供がいる女のさ
368.0,370.0,荷物多いと
370.0,372.0,荷物多いし子供いるから駅まで迎えに来て
372.0,374.0,みたいなこと言われんの
374.0,376.0,わかんない
376.0,378.0,いないそういうやつ
378.0,380.0,だから俺はさ
380.0,382.0,なんにも手伝う義務ねーじゃん
382.0,384.0,家庭だから
384.0,386.0,そんなに子供が邪魔なら子供なんて産むんじゃねーよ
386.0,388.0,って感じじゃん
388.0,390.0,なんか当たり前みたいな
390.0,392.0,電車とか乗っても席譲られても俺は言わねーの
392.0,394.0,俺があれ騙すみたいな感じで
394.0,396.0,お姉ちゃんあどうもーみたいな感じで
396.0,398.0,座るんだけど
398.0,400.0,若いカップルがどうぞーみたいな感じで席譲ってくれるんだけど
400.0,402.0,お姉ちゃんなんかね
402.0,404.0,鋭意も言わなくて
404.0,406.0,なんかねー
406.0,408.0,ちょっとなんていうのかな
408.0,410.0,静粛したいんだよね本気で
410.0,412.0,俺前から言ってたじゃん嫌い嫌いって
412.0,414.0,ほんとにもうねー
414.0,416.0,絶縁したいほんとに
416.0,418.0,ほんとにね
418.0,420.0,あのー
420.0,422.0,絶縁したいんだけどほんとに
422.0,424.0,あごめんね粛清ごめんなさいコメント一切読んでませんでした
424.0,426.0,粛清でしたすみませんね
426.0,428.0,ほんとねなんか典型的な
428.0,430.0,俺の嫌いな女に
430.0,432.0,なってきてるんだよね
432.0,434.0,お前の親はどういう判断やのよく聞いてください
434.0,436.0,うちの親は
436.0,438.0,お姉ちゃんの味方なんだよね
438.0,440.0,だから俺が一番ね
440.0,442.0,俺めっちゃ正しいこと言ってんじゃん
442.0,444.0,家族の問題なのに俺がね
444.0,446.0,こうやって問題定義してみんなに言ってるんだから
446.0,448.0,もうねうちのお父さんとか
448.0,450.0,相手が悪いとか言ってんの
450.0,452.0,なんかねしかもことの発端から話
452.0,454.0,ほんとに最近の悩みなんだけどことの発端から
454.0,456.0,話すと家買うって話になって
456.0,458.0,うちのお姉ちゃん家買ういいねいいね
458.0,460.0,幸せだなーみたいな
460.0,462.0,結婚してーな子供もできていいなーみたいなね
462.0,464.0,感じじゃないですかやっぱ
464.0,466.0,肌から見ればみんなもそうでしょ自分のこと
466.0,468.0,ちょっと待ってお風呂が開いたびっくりした
468.0,470.0,そうじゃないですか俺もそうだったんだよ
470.0,472.0,家建てるよって話になって
472.0,474.0,なんか相手方の親のメンツってあるじゃんやっぱり
474.0,476.0,向こうが男こっちが女だから
476.0,478.0,相手方の親のメンツがめっちゃあって
478.0,480.0,なんかその相手の
480.0,482.0,型の親が
482.0,484.0,家を買ってあげたかったんだって
484.0,486.0,ただ相手の親
486.0,488.0,借金まみれでブラックリスト乗ってるんだって
488.0,490.0,ほんとになんかね
490.0,492.0,若い頃になんか
492.0,494.0,なんかなんかあのうちの
494.0,496.0,うちのトラブルがなんかね
496.0,498.0,超ブラックリスト乗ってるみたいで
498.0,500.0,そんで
500.0,502.0,なんか銀行から金が借りれない
502.0,504.0,買ったんだって
504.0,506.0,でねちょっと最後まで聞いてみんな
506.0,508.0,これほんとにネタじゃないから最後まで聞いて
508.0,510.0,うちのトラブルがあったんだよなんかいろいろな
510.0,512.0,そんで最後まで聞いてマジで
512.0,514.0,ほんとにこの事件の根っこはマジで深いからね
514.0,516.0,すごい点と点が
516.0,518.0,線で繋がってって
518.0,520.0,高いピラミッドを
520.0,522.0,形成してるんだよちょっと聞いてよほんでね
522.0,524.0,あのー
524.0,526.0,あれなんだよ忘れてたよほんでね
526.0,528.0,だから
528.0,530.0,それでなんかわだかまりができちゃったので
530.0,532.0,家買うって言ってたのに結局買えなかったんだ
532.0,534.0,みたいな
534.0,536.0,でうちのお父さん大工だから
536.0,538.0,お父さんが建ててやるよみたいな
538.0,540.0,じゃあ俺の人生最後のお仕事だなー
540.0,542.0,みたいなね感じで
542.0,544.0,お父さんめっちゃ張り切ってたの
544.0,546.0,孫ができて嬉しいから
546.0,548.0,ほんでねそれで
548.0,550.0,いい話だなーって聞いてたら
550.0,552.0,どんどんどんどんそれが契機に
552.0,554.0,なんか嘘つき始めたんだって向こうの親が
554.0,556.0,なんかわかんない銀行が
556.0,558.0,あれしてくれねーみたいな
558.0,560.0,向こうの親もちょっと
560.0,562.0,あららおかしいんだけど
562.0,564.0,向こうの親が自分の面倒を保つために
564.0,566.0,嘘つき始めてたんだって
566.0,568.0,それがちょっとなんか許せなかった
568.0,570.0,みたいな感じでうちのお父さんが
570.0,572.0,あのーそのね現場検証みたいな
572.0,574.0,行くわけよここに家建てるよみたいなところ
574.0,576.0,あの相手方の持ってる土地に
576.0,578.0,家建てに行こうとしたんだけど
578.0,580.0,汚染水にまみれた地獄のような
580.0,582.0,場所だったんだって
582.0,584.0,俺これ聞かされた話だからな
584.0,586.0,姉ちゃんが話持ってるかもしれないけど
586.0,588.0,汚染水にまみれた
588.0,590.0,地獄のような土地を用意して
590.0,592.0,それにうちの親父がもう
592.0,594.0,発狂して
594.0,596.0,発狂しちゃってうちのお父さんがもう
596.0,598.0,ここじゃ家建てらんねーみたいな感じで
598.0,600.0,大喧嘩しちゃったんだって向こうの親と
600.0,602.0,でね
602.0,604.0,やっぱり家建てるってさ
604.0,606.0,一大決心じゃん向こうの家はね
606.0,608.0,自営業でさやっぱり大きい金作れねーじゃん
608.0,610.0,うちのお母さんみたいにさ
610.0,612.0,会社勤めだったらある程度まとまった金ってさ
612.0,614.0,計算できるけどさ
614.0,616.0,自営業だからねーその日暮らしじゃん変な話
616.0,618.0,その日暮らしじゃないですか自営業やってる人この中にいるでしょ
618.0,620.0,多少ね俺は向こうの気持ちも
620.0,622.0,分かってあげなきゃいけないんじゃない
622.0,624.0,っていう風に言ってるんだけど
624.0,626.0,いやでもでもみたいな
626.0,628.0,借金してる時点でごめん
628.0,630.0,牛のトラブルっていうのは
630.0,632.0,商売やり始める時に
632.0,634.0,お金を借りてそれを
634.0,636.0,返さずバックレターみたいな
636.0,638.0,そういう話なんだって
638.0,640.0,ほんとに
640.0,642.0,そういう話なんだって
642.0,644.0,じゃ俺すげーまともじゃん
644.0,646.0,しかももう家から
646.0,648.0,あなたはとついだんだから
648.0,650.0,ひとまず向こうの家の
650.0,652.0,ね?ひとまず向こうの家の
652.0,654.0,ルールに従いなさいよ
654.0,656.0,って言ってあげたの
656.0,658.0,あなたはもううちの人間じゃなくて
658.0,660.0,とついだ側の人間なんだから
660.0,662.0,向こうのルールに従いなさいよって言ってあげたの俺
662.0,664.0,そしたらなんかさ正論だよね
664.0,666.0,正論じゃんそしたらなんか
666.0,668.0,あんたは余計なこと言わなくていいみたいな
668.0,670.0,もうごめんってやっぱお母さんに逆らえないじゃん
670.0,672.0,でなんかね
672.0,674.0,今俺言ったの
674.0,676.0,道をね道しるべを
676.0,678.0,与えてあげたの
678.0,680.0,じゃあ別に家建てなくてもいいから同居すればいいじゃんって言ったの
680.0,682.0,みんなもあれでしょ
682.0,684.0,みんなもそう思うじゃん同居すればいいじゃんって
684.0,686.0,思うじゃん
686.0,688.0,うちのね?姉ちゃんの旦那さんの
688.0,690.0,実家が地区140年らしくて
690.0,692.0,もうね
692.0,694.0,あのうちの姉ちゃんのあだ名なんだっけ
694.0,696.0,うんこちゃんのお姉ちゃんにお風呂場が
696.0,698.0,見せられないみたいなそういう理由で
698.0,700.0,却下されたんだってものすごいだから
700.0,702.0,とんでもない貧乏の家に
702.0,704.0,届いたらしいのもう建て替えられねえの
704.0,706.0,本当に
706.0,708.0,建て替えられねえんだって
708.0,710.0,本当に地区140年らしいの
710.0,712.0,ちょっとさ
712.0,714.0,でも
714.0,716.0,それ言っちゃうと親の面倒半分半分にできないぞ
716.0,718.0,なんかねそれでねもう大目に
718.0,720.0,それでケーキにものすごい
720.0,722.0,喧嘩になって
722.0,724.0,なんかもうあなたの家の
724.0,726.0,両親の面倒は見たくありません
726.0,728.0,みたいなことを旦那さんに言っちゃったらしくて
728.0,730.0,それって一番言っちゃいけないじゃん
730.0,732.0,自分がさ子供の立場でさ
732.0,734.0,あなた達にも親いるでしょしょうもない親が
734.0,736.0,いるじゃないですかただそんなしょうもない
736.0,738.0,親でもやっぱ自分のね子供から見たら
738.0,740.0,たった一つのかけがえのないやっぱ親じゃないですか
740.0,742.0,それってどんなことがあっても
742.0,744.0,言っちゃいけない発しちゃいけない言葉じゃん
744.0,746.0,言ったらしいあなたの親はどんなことが
746.0,748.0,あっても面倒は見ませんって言ったらしくて
748.0,750.0,言わなくてもいいじゃん
750.0,752.0,心の中で思っとけばいいじゃんそうやって
752.0,754.0,なんだかなっていう最近ね
754.0,756.0,そういう家庭の事情がね
756.0,758.0,今すごい渦巻いてるんですよね
758.0,760.0,しかもさ絶対なんかね
760.0,762.0,俺が経済的に支援しなきゃ
762.0,764.0,いけなくなってくるじゃん将来的に
764.0,766.0,やじゃん本当に
766.0,768.0,だから俺思ったんだ
768.0,770.0,家族だから絶好
770.0,772.0,したいとかねさっき言っちゃったけど
772.0,774.0,家族だから絶好したいとか
774.0,776.0,死ねとかそこまでは思ってないの
776.0,778.0,俺の知らないところで
778.0,780.0,遠くで幸せ
780.0,782.0,にしててほしいんだよね
782.0,784.0,二度と関わりたくはないけど幸せにはしててほしいから
784.0,786.0,俺の知らないどっか遠く
786.0,788.0,どっか遠くでちょっと幸せに
788.0,790.0,なっててほしいんだよね
790.0,792.0,なんかもう全部
792.0,794.0,俺がねご飯台とか出してあげるの
794.0,796.0,当たり前のように
796.0,798.0,普通さ親しき仲に礼儀あるじゃん
798.0,800.0,お前らさ兄弟でもご飯ごちそうになったら
800.0,802.0,ごちそうさまとか言うだろ
802.0,804.0,なんも言わねえからな
804.0,806.0,子供がワンワン泣いて
806.0,808.0,子供のせいにしてちょっと
808.0,810.0,おかげしててみたいな
810.0,812.0,そんな古臭い手
812.0,814.0,三十にしてさ
814.0,816.0,俺そんな古臭い手を
816.0,818.0,食らうとは思わなくて
818.0,820.0,子供あやしてるからちょっとお前お金
820.0,822.0,払っといてゴールドラッシュ原宿の
822.0,824.0,3700円
824.0,826.0,俺こういうのずっと覚えてるからね
826.0,828.0,しかもさ聞いてくれよまだまだいっぱいあるんだよ
828.0,830.0,でね向こうの実家にいたから
830.0,832.0,お母さんにねお母さん分かったよ
832.0,834.0,姉ちゃんがちょっと調子悪いみたいだから
834.0,836.0,うちに呼んでいいからちょっとさ
836.0,838.0,買い物でもさしてやりたいからさ
838.0,840.0,ちょっと3万くらいお小遣いあげて
840.0,842.0,あげてくんない?もう俺がなんかちょっと
842.0,844.0,気持ちで返していくからって俺そこまで
844.0,846.0,言ったんだよ何にも関わらずその
846.0,848.0,なんつーのお母さんから
848.0,850.0,お小遣いもらったからじゃ一緒に食べよっかとかさ
850.0,852.0,そういうの期待するじゃん普通は兄弟ってそういうもんじゃん
852.0,854.0,一切言わないからねそういうのも
854.0,856.0,平気で
856.0,858.0,タクシー代も東京行くから
858.0,860.0,ねアホみてにタクシー代
860.0,862.0,俺が払ってやって迎えに行けなかったから
862.0,864.0,っていう理由で
864.0,866.0,俺優しいんだよねすっごい
866.0,868.0,盗賊だろほんとに
868.0,870.0,盗賊なんだよほんとに
872.0,874.0,てかなんかねみんなもね
874.0,876.0,って言ったじゃん
876.0,878.0,俺だからお姉ちゃんは家族で
878.0,880.0,唯一嫌いなんだよみたいな
880.0,882.0,発泡美人だからねうちの姉ちゃんなんか
882.0,884.0,そういう周りからさ
884.0,886.0,会社とかですごい人気があるやつ
886.0,888.0,のくずなんだよ
888.0,890.0,マジでで俺さ結構
890.0,892.0,コミュ障っていうかさそういう人付き合い
892.0,894.0,あんま得意じゃねえからさ
894.0,896.0,どっちかって言うとあいつはなんかならず者だみたいな
896.0,898.0,なんかうちの姉ちゃんが
898.0,900.0,俺の写真を久々に
900.0,902.0,姉ちゃんの友達に見せたら
902.0,904.0,もうギャルをやめたんだみたいな
904.0,906.0,私の中のうんこちゃんはそういう印象で止まってたよ
906.0,908.0,みたいなそういうエタみたいな
908.0,910.0,扱いを受けてるんだ俺地元じゃ
910.0,912.0,地元のその界隈じゃさ
912.0,914.0,エタみたいな扱いを受けてるんだ俺
914.0,916.0,ギャル王じゃねえんだもうみたいな
916.0,918.0,ちょっとね
918.0,920.0,歯がゆいんだよね
920.0,922.0,この真の一本通ったね
922.0,924.0,あの男に成長したか
924.0,926.0,っていうのも知らせたいし
926.0,928.0,姉がねいかに心の中が
928.0,930.0,あの腐ってるか
930.0,932.0,っていうのも本当にね
932.0,934.0,マジで知ってほしい
934.0,936.0,そういった自分のね
936.0,938.0,悪いところを周りに見せることによって
938.0,940.0,もうちょっとね
940.0,942.0,姉ちゃんも成長できるんじゃないのかなと
942.0,944.0,絶対お前の姉離婚するぞ
944.0,946.0,夫のためにもそうなのよ
946.0,948.0,だからさこぶつきのさ
948.0,950.0,なんてさ
950.0,952.0,世の男性からしたら需要ないじゃん本当に
952.0,954.0,俺言ってやりたいんだよね
954.0,956.0,お前需要ねえよ
956.0,958.0,30過ぎてさこぶつきでさ
958.0,960.0,需要ねえぞってさ
960.0,962.0,言ってやりたいんだけど
962.0,964.0,俺の立場が
964.0,966.0,うんこちゃん家における
966.0,968.0,俺の立場ってマジで低いのね
968.0,970.0,俺に発言権はないの
970.0,972.0,常に俺は
972.0,974.0,受け止める存在で
974.0,976.0,あるんだよ
976.0,978.0,一人養っていかなきゃいけないじゃん
978.0,980.0,お姉ちゃんとすでに養っているもんなの
980.0,982.0,毎週末着てさ
982.0,984.0,俺月勤で仕事してクッタクタやってきたのにさ
984.0,986.0,家帰ってきてさ
986.0,988.0,お姉ちゃんが9時とか
988.0,990.0,私さ子供寝かしつけなきゃいけないからさ
990.0,992.0,9時に寝るじゃん
992.0,994.0,俺がさ9時半くらいからさ子供と姉ちゃんの服を洗って
994.0,996.0,夜にさ
996.0,998.0,乾燥機かけに行くんだよ
998.0,1000.0,ありえないじゃんマジで
1002.0,1004.0,パパじゃん俺
1004.0,1006.0,おかしいなって思ってるんだよね
1006.0,1008.0,そうだよだからさ
1008.0,1010.0,俺も経済的に別に余裕あるわけじゃねえからさ
1010.0,1012.0,子供なんて養っていけないじゃん
1012.0,1014.0,子供なんて
1014.0,1016.0,家賃になっていけないわけじゃん
1016.0,1018.0,しかも買ったばかりのソファーをさ
1018.0,1020.0,ヨダレまみれにされてさ
1020.0,1022.0,赤ちゃんのお母さんってさ
1022.0,1024.0,そういうの全然気にならないんだって
1024.0,1026.0,あーかわいいかわいい
1026.0,1028.0,あんたのうんちだったら喜んで触れるって
1028.0,1030.0,お前だけなんだよ
1030.0,1032.0,俺はね本当に潔癖症だから
1032.0,1034.0,本当に潔癖症だから
1034.0,1036.0,自分の体液ですら許されないのに
1036.0,1038.0,それ愛とは別次元なの
1038.0,1040.0,なんか言うやついない?
1040.0,1042.0,お母さんってさ
1042.0,1044.0,あーもう全然
1044.0,1046.0,汚くても本当触れるみたいな
1046.0,1048.0,本当にね勘違いもはなはなしいよ
1048.0,1050.0,お母さん達
1050.0,1052.0,うんこはうんこだからねマジで
1052.0,1054.0,普通にクセ感だマジで
1054.0,1056.0,マジで人のさ
1056.0,1058.0,大の大人のうんこみたいな匂いがするわけじゃん
1058.0,1060.0,やっぱり排泄物だから
1060.0,1062.0,でもなんかさ
1062.0,1064.0,アホの味が馬鹿なのしかも
1064.0,1066.0,俺もうさだめだ
1066.0,1068.0,俺嫌いになってる子供が
1068.0,1070.0,俺お姉ちゃんの子供が嫌い
