start,end,text
0.0,30.0,地震発生時の地震発生時の地震発生時の地震発生時の地震発生時の地震発生時の地震発生時の地震発生時の地震発生時の地震発生時の地震発生時の地震発生時の地震発生時の地震発生時の地震発生時の地震発生時の地震発生時の地震発生時の地震発生時の地震発生時の地震発生時の地震発生時の地震発生時の地震発生時の地震発生時の地震発生時の地震発生時の地震発生時の地震発生時の地震発生時の地震発生時の地震発生時
30.0,60.0,地震発生時の地震発生時の地震発生時の地震発生時の地震発生時の地震発生時の地震発生時の地震発生時の地震発生時の地震発生時の地震発生時の地震発生時の地震発生時の地震発生時の地震発生時の地震発生時の地震発生時の地震発生時の地震発生時の地震発生時の地震発生時の地震発生時の地震発生時の地震発生時の地震発生時の地震発生時の地震発生時の地震発生時の地震発生時の地震発生時の地震発生時の地震発
60.0,64.56,マイクが入っていない
90.0,103.0,え、声聞こえ、声聞こえてるでしょ?
103.0,110.0,声聞こえてるでしょ?
110.0,112.0,あー
112.0,116.0,聞こえてるね、よかったよかった
117.0,121.0,なんかいまいち確信が持てなくてさ、毎回毎回
136.0,139.0,固くなりに聞こえないってやつがいるな
139.0,142.0,聞こえてるってのは俺わかってんだ
143.0,146.0,今日久々にさ、俺渋谷行ってきたんだよ
146.0,147.0,久々に
148.0,150.0,なんかもう街が変わっちゃってるな
151.0,155.0,俺がもうジェネレーションギャップを感じてるんだろうけどさ
155.0,157.0,なんかさ、ファッションとかさ
159.0,160.0,なんていうのかな
160.0,163.0,みんなギラギラしてないよね、ほんと
164.0,167.0,いや、若者ぶってるわけじゃなくて、だから久々に行ったんだよ
168.0,170.0,でも4、5ヶ月ぶりっていうか
173.0,174.0,すごいね
175.0,177.0,もうついていけねえ
180.0,182.0,ついていけねえわ、マジで
184.0,186.0,いつもどこで買ってるの?何を?
189.0,190.0,何を何を?
192.0,196.0,年取ったんだな、なんか28になったからさ
196.0,199.0,言ってもまだなんか20代だからそんなに
199.0,204.0,ねえ、理解はしてあげれると思ってたんだけど
204.0,206.0,もうさ、洋服とかさ
207.0,209.0,わかんなくてさ、女の子が
209.0,213.0,これ今の女の子たちは可愛いと思って着てるんだみたいな
215.0,218.0,変わったのは街かお前の心か
218.0,220.0,両方じゃねえか
222.0,224.0,センター界に吸い寄せられねえよ
225.0,230.0,ほんと悔しい、昔はさ、俺の街だったのにさ、もうダメだ、みんな
231.0,233.0,拒絶されてる、俺は
234.0,236.0,街から拒絶されてる
238.0,239.0,ほんとに
240.0,242.0,バスケットボールストリート
244.0,245.0,になっちまってるよ
246.0,248.0,いやでもそうじゃない?
249.0,250.0,もうギャルじゃない?
250.0,252.0,いやでもさ、ギャル男いねえじゃん普通に
252.0,254.0,みんななんかすげえさ
254.0,256.0,清楚な格好してるじゃん、男も女も
258.0,260.0,ドラゴンボール面白かった?
260.0,261.0,服か
261.0,262.0,いろんなとこだよ
262.0,265.0,なんか固定でなくない?
268.0,269.0,固定で
271.0,272.0,そうだね
274.0,277.0,ほんとなんかストリートって感じだよね
279.0,280.0,ザラとかでも買う買う
282.0,283.0,ザラのいいところはね
283.0,285.0,夜遅くまでやってるっていう
285.0,287.0,10時までやってんじゃんなんかザラって
287.0,288.0,全然買うよ
289.0,290.0,うっせえな
294.0,295.0,ギャル落ちてあげると派手じゃなくなった
295.0,296.0,派手じゃなかったらね
296.0,298.0,ちょ、花ちゃん今ご飯食べてんだよね
300.0,301.0,アーカイブ系のコメント読めよ
301.0,304.0,何アーカイブ系のコメントって
305.0,306.0,なんかあった?
308.0,311.0,細身の服は別に好きでも嫌いでもないんだよね
311.0,312.0,普通の
313.0,314.0,普通
318.0,319.0,普通が好き
319.0,321.0,サイズはなんかもうジャストがいいかな
322.0,323.0,ジャスト
324.0,326.0,アーカイブ公開してくださいって散々書いてあった
326.0,328.0,なんか撮るに足らないコメントだった悪い
328.0,330.0,だって録画してねえもん
331.0,333.0,録画してねえもん絶対アーカイブ公開すんだよ
334.0,336.0,まあいいじゃん別に
336.0,338.0,そんななんか録画するようなあれじゃねえよ
340.0,342.0,俺も腹減ったからなんかちょっと今日沖縄料理食っちゃったよ
343.0,345.0,え、なんかこれ自動録画じゃないでしょ
350.0,352.0,まあ別にそんななんかあれだよ
352.0,354.0,そんなカタクリすることしなくていいよ
354.0,355.0,普通に普通にさ
355.0,357.0,普通でいいじゃん普通で
359.0,361.0,いやなんかFCであれだよ
362.0,364.0,いやなんかFC2俺も自動録画
365.0,367.0,ができるのかなと思ったけどどうやら濃度的に
368.0,370.0,いや沖縄料理うまくない?
371.0,373.0,俺沖縄料理最近めちゃハマりなんだけど
373.0,374.0,どんハマり
376.0,377.0,どんハマり
379.0,381.0,あれうまくない?
383.0,384.0,沖縄そば
385.0,387.0,ドーナツみたいなやつ好き
387.0,389.0,あーあれなんだっけあれ
389.0,391.0,チャンプルグレードが好き
391.0,393.0,チャンプル好きだったら相当好きじゃない?
396.0,398.0,自由が丘来いよ
398.0,400.0,自由が丘にあんの?
402.0,404.0,うまい沖縄料理屋
404.0,406.0,タコライスってあれだよね
407.0,409.0,俺もちょくちょく食うんだけどさ
409.0,411.0,メキシコのなんだっけ
411.0,413.0,あれと一緒だよね
415.0,417.0,メキシコの
418.0,420.0,タコスと一緒だよね
420.0,422.0,だからなんかそれちょっともじってんのかと思ってた
426.0,428.0,タコスのライス飯
428.0,430.0,俺でもね嫌いじゃねえんだ
430.0,432.0,カレーの好きだから
432.0,433.0,何時までやる?
433.0,435.0,なんかフルワークまでやろうかなと思ってたけど
435.0,437.0,12時ぐらい?12時ちょいすぎぐらいまで
437.0,439.0,ベルギーかベルギーチョコうめえよな
439.0,441.0,うちの姉ちゃんもとがれベルギー人で
441.0,443.0,よくちょくちょくベルギー行ってたからさ
443.0,445.0,結構俺とは深い
445.0,447.0,繋がりがある
447.0,449.0,勝手に俺の心の中では
449.0,451.0,第二のふるさとベルギー
451.0,453.0,チョコうめえよな
455.0,457.0,あいつらスパムというゴミに食ってんね
457.0,459.0,スパムって何?なんかでもさ
459.0,461.0,沖縄のさ
461.0,463.0,すごい高い豚
463.0,465.0,豚をしてこない?
465.0,467.0,沖縄の料理って
467.0,469.0,あれなんなの
469.0,471.0,あれ
471.0,473.0,なんてやつ
475.0,477.0,なんかすげえ高い肉ない?
477.0,479.0,ラフティだラフティ
479.0,481.0,ラフティ
481.0,483.0,俺スパムってわかんないんだけど
483.0,485.0,スパムってなんかあの缶詰みたいな感じでしょ
485.0,487.0,ラフティって何なの
487.0,489.0,よく蕎麦とかにさ
489.0,491.0,ラフティ蕎麦みたいな感じで出されるけど
491.0,493.0,嫌いじゃねえんだけどさ
493.0,495.0,豚マニアの俺からするとなんかちょっと
495.0,497.0,ちげえんだよな
497.0,499.0,ベルギーってクッソうまいパンあるよな
499.0,501.0,なんかあの辺ってチョコ名産だよね
501.0,503.0,ベルギーのお土産のチョコ
503.0,505.0,なんかもうめちゃくちゃうまかったイメージがある
507.0,509.0,角煮みたいなやつそうそうそうそう
509.0,511.0,角煮みたいなやつ
511.0,513.0,別にいい豚食べてねえんだけど
513.0,515.0,なんか
515.0,517.0,そこそこの2000円ぐらいのやつを回りまくってる感じ
517.0,519.0,なんかさ牛とか豚ってさ
519.0,521.0,高いやつほんと高いじゃん
521.0,523.0,そういうのはちょっとまだやっぱ
523.0,525.0,ねえ財布に優しくないから
525.0,527.0,2000円ぐらいの
527.0,529.0,ちょっとなんか
529.0,531.0,高揚感を覚えるぐらいの値段の
531.0,533.0,肉を最近よく食べてるわ
533.0,535.0,スパムはソーセージの腸じゃなくて
535.0,537.0,缶に詰めたやつ
537.0,539.0,要はソーセージってことだよね
539.0,541.0,あんま好きじゃねえんだよな
541.0,543.0,ステーキにハマってた頃
543.0,545.0,いや最近ねえ
545.0,547.0,毎夕ステーキだわ
547.0,549.0,またステーキにどんハマりしちゃった
549.0,551.0,かやがれどこが好き
551.0,553.0,俺も好き
553.0,555.0,かやがれどこが好き
555.0,557.0,俺そんなに行ったことねえんだよ
557.0,559.0,アジアしか行ったことねえんだよ
559.0,561.0,でもねマレーシア
561.0,563.0,シンガポールはすごい綺麗だったイメージがあるから
563.0,565.0,もっかい行きてえな
567.0,569.0,もっかい行きてえ
569.0,571.0,ステーキは糖質含んでないから太らない
571.0,573.0,あそうなんだ
573.0,575.0,最近ねもう
575.0,577.0,ご飯を食べずにステーキだけ食って帰ってくるんだよね
577.0,579.0,もったいない
579.0,581.0,胃袋にご飯詰めるともったいなくなっちゃって
581.0,583.0,食えねえじゃんそんなに量
583.0,585.0,ステーキだけなんで
585.0,587.0,ステーキだけ食って帰ってくる
587.0,589.0,シンガポールで
589.0,591.0,飯超辛くない
591.0,593.0,なんかさアジアって全部さ
593.0,595.0,香辛料なんていうの
595.0,597.0,パクチーみたいな味全部するよね
597.0,599.0,タイ行った時も飯食えなかった
599.0,601.0,シンガポールも食えなかったし
601.0,603.0,バンコクタイマレーシア
603.0,605.0,台湾行った時も飯食えなかったし俺
605.0,607.0,ことことベトナムだけだよ
607.0,609.0,料理がそれなりに食えたの
609.0,611.0,ベトナムだけ
611.0,613.0,台湾もね
613.0,615.0,結構ね
615.0,617.0,ちょっとクセっぽい感じだね
619.0,621.0,ハワイとか
621.0,623.0,ガキの頃行ってるからさ
623.0,625.0,覚えてないんだよね
625.0,627.0,ハワイなんつったら料理なんか
627.0,629.0,料理なんてそれなりにうまいでしょ
629.0,631.0,旅行者に向けて作ってるでしょ
631.0,633.0,要は日本食いっぱいあるってことでしょ
633.0,635.0,インドネシアとか行ったことないな
635.0,637.0,行ったことないな
637.0,639.0,どうなんだろう
641.0,643.0,わかんない
643.0,645.0,ヨーロッパとかさ
645.0,647.0,行ったことないんだ
647.0,649.0,まずはアジアを制してから
651.0,653.0,まずは
653.0,655.0,エイジアを制覇してから
655.0,657.0,シンガポールのおすすめか
657.0,659.0,シンガポールの
659.0,661.0,おすすめなんだろうな
661.0,663.0,本当さ
663.0,665.0,ナイトサファリとかさ
665.0,667.0,言えねえじゃん
667.0,669.0,俺は動物園めっちゃ好きだから
669.0,671.0,動物めっちゃ好きだからさ
673.0,675.0,そういう系のとこ回ったけど
675.0,677.0,トルコ料理おいしいって言うよね
677.0,679.0,日本食に近いんでしょ
681.0,683.0,日本食に
685.0,687.0,初めて外国行けないとこ
687.0,689.0,やっぱりでもさ
689.0,691.0,わかりやすいじゃんすごい
691.0,693.0,ガイドつけなくても
693.0,695.0,回れるっていうか
695.0,697.0,ちょっとコアなとこ行くんだったら
697.0,699.0,ガイドつけたほうが面白いと思う俺は
699.0,701.0,カッコつけずに
701.0,703.0,でも全部一番おすすめのとこ
703.0,705.0,言ってくれるからわかりやすく
705.0,707.0,脳みそ使わずに単純に楽しめる
709.0,711.0,トルコってケバムなんだ
711.0,713.0,ベトナムいいよな
713.0,715.0,俺と同じ言ってたの
715.0,717.0,ベトナム対ラオスっていう
717.0,719.0,17万ぐらいで
719.0,721.0,歩いて行ったわけじゃないけど
721.0,723.0,貧乏旅行してたのちょっと前
725.0,727.0,俺なんかハワイ行ったとき
727.0,729.0,あいつと一緒だったよ
729.0,731.0,行事
731.0,733.0,行事って代々就名していくじゃん
733.0,735.0,何代目かの行事とずっと一緒だった気がする
739.0,741.0,LCC使えば安いもん
741.0,743.0,今すげー安いのもあるもんね
743.0,745.0,グアムなんか姉ちゃんと親父が行ったけど
745.0,747.0,ところって感じかな
747.0,749.0,コメント普通に見てるよ
751.0,753.0,なんか普通にカップルで行くんだったら
753.0,755.0,バカンスに行くみたいな
755.0,757.0,こともあろうに
757.0,759.0,うちの姉は親父と二人で行ったからさ
759.0,761.0,なんかずーっとプールで泳いでたらしいよ
765.0,767.0,本当に
767.0,769.0,ビーチってそういう感じだな
769.0,771.0,まぁあれだよね
771.0,773.0,そういう感じだよね多分
773.0,775.0,先輩が女と言ったけどすげーやっぱ
775.0,777.0,綺麗だったって言ってたよ
777.0,779.0,単純に綺麗って言ってた
779.0,781.0,でもさ金かかんじゃん
781.0,783.0,金
783.0,785.0,お金がかかるじゃない
787.0,789.0,親父と夕日見てもつまんないだろ
789.0,791.0,まぁでもそれなりに面白かったって言ってたよ
793.0,795.0,カジノはね一回だけなんかどっか行ったな
795.0,797.0,でも
797.0,799.0,俺確か年齢制限で入れなくて
799.0,801.0,そのとき親父が言ってたよ
801.0,803.0,お父さん海外行ってもやることねーからさ
803.0,805.0,マッサージ行くのとカジノ行くことしかしねーから
805.0,807.0,言ってたな
807.0,809.0,俺は行ってない
809.0,811.0,どこで行ったかわからなかった
811.0,813.0,忘れちゃったよ
813.0,815.0,18歳以上だから
815.0,817.0,そうだったっけ
817.0,819.0,俺も多分若くて全然行けなかった気がする
819.0,821.0,あれなんだよね
821.0,823.0,飛行機がさ
823.0,825.0,俺嫌いじゃねーんだけど飛行機
825.0,827.0,映画何本も見れるから
827.0,829.0,嫌いじゃねーんだけどやっぱり
829.0,831.0,腰痛いから
831.0,833.0,腰痛いからさ
833.0,835.0,耳もうちょっとって感じかな
835.0,837.0,でもねだいぶ良くなってきた
837.0,839.0,テンション上がってきたよマジで
843.0,845.0,フィンランド綺麗って言うよね
847.0,849.0,ルーレット600円が36倍になった
849.0,851.0,マジか18000円か
851.0,853.0,やるね
853.0,855.0,21600円か
855.0,857.0,いやうち金持ちじゃねーよ
857.0,859.0,腰痛の時代だったからさ
859.0,861.0,昔よく海外旅行してたんだよ
861.0,863.0,てかうちの親父が海外旅行好きでさ
863.0,865.0,ちょくちょく行ってんだよね
867.0,869.0,腰痛はトリガーポイント調べてみ
869.0,871.0,世界変わるよ
871.0,873.0,何トリガーポイントって
873.0,875.0,剣士に突発性なんちゃうの
875.0,877.0,相談してね
877.0,879.0,ちょっと今電話してみるか
879.0,881.0,特にもう治っちゃったからな
883.0,885.0,うち両親っていうかね
885.0,887.0,年に一回海外行きたいんだって
889.0,891.0,親父が
891.0,893.0,母ちゃんはそんなに行きたがんねーよ
895.0,897.0,一行じゃ無理だから調べてみよかった
897.0,899.0,トリガーポイントだな
899.0,901.0,今日もマッサージ行ったんだけど
901.0,903.0,右腰
903.0,905.0,やたら凝ってます
905.0,907.0,右腰から右肩にかけてやたら凝ってますねって言われたで
911.0,913.0,本当に落ちるそういう
915.0,917.0,落ちくらながら喜んでた
917.0,919.0,なんだそれ
919.0,921.0,お前がたまに言うジーフィン
921.0,923.0,よかった
923.0,925.0,よく言ってたじゃん俺バキでさ
925.0,927.0,機械をくれ私にジーフィンを
927.0,929.0,ってレッツかよ
929.0,931.0,言ってただろ
931.0,933.0,なんかそれちゃんと
933.0,935.0,その時聞いてほしかったわ俺に
935.0,937.0,自分でなんか理解する前に
937.0,939.0,NKRじゃない
939.0,941.0,普通にマッサージ
941.0,943.0,最近マッサージ安くていいよな
945.0,947.0,最近マッサージ安くて本当に重宝してますよ
949.0,951.0,一人旅行好きだけどやっぱり女性来てるわ
951.0,953.0,国内に行くってこと
953.0,955.0,最近ちょっと大人になってきたから
955.0,957.0,国内にちょっとだけ物足んねーんだよな
957.0,959.0,若い頃はさ
959.0,961.0,国内全然好きだったんだけど
961.0,963.0,やっぱりちょっと海外志向になっちゃうよね
963.0,965.0,1時間3000円とか
965.0,967.0,ザラにあるよね今ね
967.0,969.0,価格破壊起こしてるよね
969.0,971.0,チェーン店ができたからだと思う一個
971.0,973.0,名前忘れちゃったけど
973.0,975.0,免税捨て行くぜ
975.0,977.0,免税捨て
977.0,979.0,ちょくちょく行くよ
979.0,981.0,気持ちいいから
981.0,983.0,てもみんじゃねーな
983.0,985.0,全身の
985.0,987.0,全身のやつ
987.0,989.0,ハイスコアガールがアニメになる話した
989.0,991.0,あれってさうちらの世代ドンピシャじゃない
991.0,993.0,結構なんか
993.0,995.0,すごく共感できるんだけど
995.0,997.0,あったねあったねみたいな
997.0,999.0,名前忘れちゃった
999.0,1001.0,なんかでもさすっごいどこにでもあるよ
1001.0,1003.0,どこにでもある
1003.0,1005.0,キョコロちゃんいないよ
1005.0,1007.0,ソウシャンケイスケの
1007.0,1009.0,時代がドンピシャ
1009.0,1011.0,あそうなんだ
1011.0,1013.0,え26だけど
1013.0,1015.0,わかんないマジで
1015.0,1017.0,花はいるんじゃないか
1017.0,1019.0,わかんないおとなしくしてるだろ
1019.0,1021.0,今は
1021.0,1023.0,いやーやっぱ
1023.0,1025.0,三連休っていいな
1025.0,1027.0,三連休っていいね
1027.0,1029.0,二日休んでもさ
1029.0,1031.0,まだあと一日あると
1031.0,1033.0,最高だよねなんか
1035.0,1037.0,てか花ちゃんあれ売ってきたよそういえば
1037.0,1039.0,なんだっけ
1039.0,1041.0,あの注射
1041.0,1043.0,二週間
1043.0,1045.0,散歩は大預けって言われてるけど
1045.0,1047.0,俺花見行きたかったんだよな
1047.0,1049.0,こいつと
1049.0,1051.0,4月の第一週の
1051.0,1053.0,週末まで
1053.0,1055.0,桜咲いてるかね
1055.0,1057.0,いや狂犬病はまだ
1061.0,1063.0,狂犬病まだ
1063.0,1065.0,なんていうの
1065.0,1067.0,五種混合みたいな
1067.0,1069.0,咲いてるか
1071.0,1073.0,咲いてるんだったらオッケー
1075.0,1077.0,ゴロちゃんも行くんじゃねーよ
1077.0,1079.0,さすがに二人で
1079.0,1081.0,俺と花ちゃんだけで行けねーだろ
1081.0,1083.0,で
1083.0,1085.0,感じ悪くない
1085.0,1087.0,それでもいいんだけど
1087.0,1089.0,うちもポメ買ってるよって
1089.0,1091.0,やっとコメできる
1091.0,1093.0,なんだそれ
1093.0,1095.0,伏せていたのか
1095.0,1097.0,ポメいいよなあい苦しいよな
1097.0,1099.0,俺ポメ反対だったんだけど
1099.0,1101.0,彼女が
1101.0,1103.0,ポメかわいいポメかわいい
1103.0,1105.0,ポメ買いたいよって言われて
1105.0,1107.0,トイプードル買いたくてさ
1107.0,1109.0,って思って
1109.0,1111.0,俺がハマっちゃったみたいな
1111.0,1113.0,ソマリかわいいよな
1113.0,1115.0,俺ああいうなんかさ
1115.0,1117.0,スッとしたさ足投げ猫すっげー好きなんだよね
1117.0,1119.0,てか今狙ってる猫いるんだよね
1119.0,1121.0,ただなんか
1121.0,1123.0,それやっちゃったらなんかうちがほんとに
1123.0,1125.0,動物ハウスになっちゃうから
1125.0,1127.0,あの猫かわいい
1127.0,1129.0,ソマリ超かわいい
1131.0,1133.0,シンガプーラか
1133.0,1135.0,マンチカンもまあかわいいんだけどな
1135.0,1137.0,無駄に高え
1137.0,1139.0,土手系だよね土手みたいな
1139.0,1141.0,土手みたいな
1141.0,1143.0,ロシアンブルーワッチャンが買うつってたな今度
1145.0,1147.0,もう買ってるかもしんねぇ
1149.0,1151.0,前猫は実家で飼ってる
1151.0,1153.0,6匹くらい飼ってるよ多分
1153.0,1155.0,1匹猫エイズで死んだらしいけど
1155.0,1157.0,うちの猫かわいいんだよな
1157.0,1159.0,奇跡的に
1159.0,1161.0,俺あんま好きじゃなかったんだけど
1161.0,1163.0,あんま近寄ってこねぇんだよね
1163.0,1165.0,言ってる?
1165.0,1167.0,言ったっけ俺
1167.0,1169.0,みーちゃん
1169.0,1171.0,みーちゃん
1171.0,1173.0,なんか猫エイズ顔が時計だぜ
1175.0,1177.0,一人暮らしの30代がペット飼うの
1177.0,1179.0,一人暮らしの30代って結構ペット飼ってそうじゃない
1179.0,1181.0,メインだと思うぜ寂しいんだよ
1183.0,1185.0,寂しい
1185.0,1187.0,動画出してたから
1187.0,1189.0,一人暮らしで猫って飼えるの
1189.0,1191.0,猫なんてほっとけば大丈夫でしょ
1191.0,1193.0,猫なんか自分でやらない?
1193.0,1195.0,ガリガリやられたらちょっと怖いんだよね
1195.0,1197.0,それがネック
1197.0,1199.0,それがネックなんだよね
1203.0,1205.0,ネック
1205.0,1207.0,別にほっとけばいいんじゃないの
1207.0,1209.0,ある程度
1209.0,1211.0,狭っちゅう狭いあんまねえと思うよ
1215.0,1217.0,それ男も女も結婚できない
1217.0,1219.0,仲いいよね
1219.0,1221.0,結婚できないって
1221.0,1223.0,逆説もありそうじゃない
1223.0,1225.0,結婚できないから動物で寂しさ紛らわすみたいな
1225.0,1227.0,俺どっちかとそうなんだけど
1227.0,1229.0,そっちに近いと思うんだけど
1231.0,1233.0,猫ってトイレのしつけってどうやってやるんだろうな
1233.0,1235.0,今飼ってないから分かんないけど
1235.0,1237.0,詳しくは
1237.0,1239.0,ただね悩みがあってさ
1239.0,1241.0,ケージから出すと興奮しちゃって
1241.0,1243.0,トイレできなくなっちゃうんだよね
1243.0,1245.0,それを今頑張って
1245.0,1247.0,気長に練習中
1249.0,1251.0,練習中です
1253.0,1255.0,なんかねえ
1255.0,1257.0,結構個体差があるらしいんだよな
1257.0,1259.0,父親が1.2キロ
1259.0,1261.0,母親が1.0キロぐらいで
1261.0,1263.0,うちの花ちゃんも今4ヶ月で
1263.0,1265.0,550なんだ重さ
1265.0,1267.0,2キロはいかないと思うって言われたら
1267.0,1269.0,分かんねえもんなそんなの
1269.0,1271.0,バカバカ食ってるででかくなると思うんだけどな
1271.0,1273.0,バカバカ食わして今どんどんでかくなってる
1279.0,1281.0,まだでかくなっている
1281.0,1283.0,家の中の花違いを家に閉じ込めたら
1283.0,1285.0,閉じ込めさらに
1285.0,1287.0,ケージで世界戦まで
1287.0,1289.0,まあでもそれはしょうがない
1289.0,1291.0,俺に飼われちゃったからさ
1291.0,1293.0,ある程度やっぱ人間の暮らしに
1293.0,1295.0,合わせてくれないと俺も花ちゃんに合わせるけど
1295.0,1297.0,仕方ねえんだ
1297.0,1299.0,そこは我慢してもらうしかない
1299.0,1301.0,それ以外のところでなんとか
1301.0,1303.0,需要を満たせるように頑張るわ
1303.0,1305.0,まあでも今のところ
1305.0,1307.0,幸せそうに暮らしてるよ
1307.0,1309.0,分かんねえけどな
1309.0,1311.0,ゴロリ分かんねえ
1311.0,1313.0,何キロなんだろう
1313.0,1315.0,あいつ46キロぐらいじゃねえか
1315.0,1317.0,156センチで
1317.0,1319.0,この前体重計乗ってるのそっと見たけど
1319.0,1321.0,156センチで
1321.0,1323.0,46キロぐらいだと思う
1323.0,1325.0,細くない普通だと思うぜ
1325.0,1327.0,筋肉全くないから
1327.0,1329.0,筋肉全くないから
1333.0,1335.0,凍えてないしストレスはまだ大丈夫
1335.0,1337.0,なんかねえ
1337.0,1339.0,でもすごい
1339.0,1341.0,なんていうの
1341.0,1343.0,時間を使ってるからな
1343.0,1345.0,定期的にずっと外で遊ばせて
1345.0,1347.0,なんかさ体ちっちゃいからさ出しっぱなしにしてるとさ
1347.0,1349.0,遊びすぎちゃってさ
1349.0,1351.0,一回低血糖でぶっ倒れたことがあって
1351.0,1353.0,それ以来ある程度セーブしてんだよね
1353.0,1355.0,強制的に休ませないと
1355.0,1357.0,バカじゃん犬って本気で
1357.0,1359.0,ほんとほんと
1359.0,1361.0,体ちっちゃいと
1361.0,1363.0,なんでそれで太ってるかな
1363.0,1365.0,顔が似てる
1365.0,1367.0,今はないよ
1367.0,1369.0,ちっちゃい頃ね
1369.0,1371.0,小片県千和とかって結構そういうのあるらしくて
1371.0,1373.0,聞いてたんだけど
1373.0,1375.0,だから俺
1375.0,1377.0,砂糖水を買ってたから
1377.0,1379.0,なんかもうヨロヨロってしたから
