start,end,text
2769.0,2771.0,口にもするよ
2771.0,2773.0,だからなんか
2773.0,2775.0,あれなんだよかなりね
2775.0,2777.0,俺の人格とは
2777.0,2779.0,乖離してんだから不思議にしょうがないんだよね
2779.0,2781.0,なんで俺はさ
2781.0,2783.0,ニコニコ動画でこういうキャラなんだろう
2783.0,2785.0,と思って
2785.0,2787.0,いつからなんだろうって
2787.0,2789.0,自分でも分かんないんだよね
2789.0,2791.0,だからかけ離れすぎてるから
2791.0,2793.0,自分でも面白いっていうのはあるんだけど
2793.0,2795.0,見てさ
2795.0,2797.0,自分じゃないみたいだからほんとに
2797.0,2799.0,俺よく言うの
2799.0,2801.0,こいつ超面白くない?
2801.0,2803.0,彼女に言うの
2803.0,2805.0,もう一回ここ見て
2805.0,2807.0,こんなのさ出てこなくない?
2807.0,2809.0,俺じゃないんだよね本気で
2809.0,2811.0,ほんとに
2811.0,2813.0,嘘じゃない
2813.0,2815.0,誤解しないでほしい
2815.0,2817.0,悪口とか言わねえし俺
2817.0,2819.0,もう一人の僕
2819.0,2821.0,本性なんだろうな
2821.0,2823.0,本当は
2823.0,2825.0,みんなにキャーキャー言われたい
2825.0,2827.0,みたいなのがあるんだろうね
2827.0,2829.0,マジで
2829.0,2831.0,マジでな
2831.0,2833.0,ゲームしてる時の記憶ある?
2833.0,2835.0,ゲームあんましねえけど記憶あるんじゃねえの?
2835.0,2837.0,分かんねえけど
2837.0,2839.0,誰が人格障害だそれ
2839.0,2841.0,でもそんなさ
2841.0,2843.0,師匠はないから
2843.0,2845.0,配信やっててやべえこと言っちまって
2845.0,2847.0,パクられたとかそれだったら問題だけど
2847.0,2849.0,そんな師匠ないじゃん
2849.0,2851.0,そんな師匠なくない?
2853.0,2855.0,わさわさ
2855.0,2857.0,あごめん今ティッシュを
2857.0,2859.0,ティッシュで机の上拭いてた
2859.0,2861.0,ごめんな
2861.0,2863.0,じゃあゴミ捨ててくるわ
2863.0,2865.0,お茶持ってくる
2867.0,2869.0,なんでここ
2869.0,2871.0,あなた
2871.0,2873.0,ほら
2877.0,2879.0,これルップだよルップ
2879.0,2881.0,このルップは
2881.0,2883.0,人間のルップよりでかいじゃん
2887.0,2889.0,うえ
2891.0,2893.0,誰だこのおけんぼさんあんた
2893.0,2895.0,かいめんですねルップが
2903.0,2905.0,うえ
2909.0,2911.0,ほら食べちゃう
2911.0,2913.0,よいしょ
2913.0,2915.0,ほら食べちゃう
2937.0,2939.0,すまんすまん
2943.0,2945.0,うえ
2945.0,2947.0,トイレにできたらご褒美のボウロあげよ
2947.0,2949.0,ボウロくっそ懐かしい
2949.0,2951.0,お前それ人が食べてくるもんだろあのちっちゃいさ
2951.0,2953.0,ボウロってくっそなちいな
2953.0,2955.0,年代がちょっとやばいな
2955.0,2957.0,30近いな
2957.0,2959.0,ボウロって今あんの
2959.0,2961.0,たまごボウロ
2961.0,2963.0,あ知ってんだ
2963.0,2965.0,うち部屋広いんだごめん自慢みたいになっちゃって
2965.0,2967.0,でもそんな広くねえな
2967.0,2969.0,12畳ぐらいだな多分トータルで
2969.0,2971.0,ここ
2973.0,2975.0,ボウロかん
2975.0,2977.0,あれうまくなかった
2977.0,2979.0,おいしいよね
2979.0,2981.0,大人になってから食うと全然
2981.0,2983.0,うまくないな
2983.0,2985.0,それからラグすごい
2987.0,2989.0,ラグすごいな
2989.0,2991.0,なんかみんなちょっと
2991.0,2993.0,犬用のボウロくっそううまいぞ
2993.0,2995.0,あそうなんだ
2995.0,2997.0,ちょっとあげようかな
2997.0,2999.0,お菓子あげてないまったく
2999.0,3001.0,全く
3001.0,3003.0,ラグある
3003.0,3005.0,多分ラグあるぜすごい
3005.0,3007.0,一回みんな
3007.0,3009.0,更新を推奨
3011.0,3013.0,推奨します
3013.0,3015.0,数字って何の数字
3015.0,3017.0,ラグあるよ多分
3017.0,3019.0,10秒ぐらいだけど
3019.0,3021.0,なんかねさっきからね
3021.0,3023.0,タイムリーに答えが返ってこないんだよね
3025.0,3027.0,これ読んで
3027.0,3029.0,わかんないんだ
3029.0,3031.0,更新したか
3031.0,3033.0,だいたいでいいんだけど
3035.0,3037.0,ごめんおならしてしまった
3037.0,3039.0,7秒か
3039.0,3041.0,まずまずだな
3041.0,3043.0,ない人もいると思うけど
3043.0,3045.0,ない人は
3047.0,3049.0,今おならでもうわかった
3049.0,3051.0,7秒だわ
3051.0,3053.0,俺がおならしてからみんなのコメントが
3053.0,3055.0,返ってくるまで
3055.0,3057.0,リアルに
3057.0,3059.0,俺いつでもおならできるからさ
3059.0,3061.0,ゴルゴ松本俺ぐらいだろな
3065.0,3067.0,将来どんな暮らししたい
3069.0,3071.0,とりあえずね俺の目標はね
3071.0,3073.0,30代のうちに5000万貯めて
3073.0,3075.0,5000万あれば子供2人育てられるんだろ
3075.0,3077.0,そしたら田舎帰って
3077.0,3079.0,適当に公立使い合わせながら
3079.0,3081.0,でっかい家住んであとは死に行く
3081.0,3083.0,でたまに東京来るみたいな
3085.0,3087.0,5000万あったら絶対育てられるんだろ
3089.0,3091.0,無理かな
3091.0,3093.0,38ぐらいで結婚するのが
3093.0,3095.0,ベストなんだけどね
3099.0,3101.0,実家帰るの確定なんだ
3101.0,3103.0,最近姉ちゃんが実家帰ってんだよ
3103.0,3105.0,姉ちゃんが実家にいるの
3105.0,3107.0,そのまま離婚して
3107.0,3109.0,実家で子育てしていただければ
3109.0,3111.0,俺帰る
3111.0,3113.0,俺が帰らない大義名分ができるから
3113.0,3115.0,ちょっとなんかありかなって思ってる
3115.0,3117.0,今
3117.0,3119.0,ありかなと思ってる
3119.0,3121.0,リアルに
3125.0,3127.0,親の老後は
3127.0,3129.0,いやそんなさ
3129.0,3131.0,家に住む人が老後みたい
3131.0,3133.0,俺ももちろん見るけど
3133.0,3135.0,同居はできないでしょそんなさ
3135.0,3137.0,姉ちゃんと一緒に住みたくねーよ
3139.0,3141.0,住みたくないんだが
3141.0,3143.0,姉ちゃんと
3145.0,3147.0,もちろん金は出すけどさ
3153.0,3155.0,なんかちょっとでも
3155.0,3157.0,いろいろ同居はできないね
3157.0,3159.0,お姉ちゃんとは
3159.0,3161.0,俺唯一姉ちゃんとだけは仲良くないから
3163.0,3165.0,だけど子供を田舎で育ててくない
3165.0,3167.0,それもあるんだよねたださ
3167.0,3169.0,学校の選択肢とか考えると
3169.0,3171.0,うーんって感じなんだよね
3171.0,3173.0,東京推奨派
3173.0,3175.0,俺は
3179.0,3181.0,さっきの布団にするみたいに
3181.0,3183.0,俺らにチューして
3183.0,3185.0,わかった
3185.0,3187.0,あれはな
3187.0,3189.0,お別れの挨拶はキスで
3189.0,3191.0,お前らにキスしてお別れするわ今日
3193.0,3195.0,子供を別途なる環境で育てたくない
3195.0,3197.0,それは無理じゃん絶対
3197.0,3199.0,お母さんが渡すしかないと思うんだけど
3199.0,3201.0,やっぱしっかりとした
3201.0,3203.0,日本にならなきゃだめだよな
3203.0,3205.0,本当にそれ思うわ
3207.0,3209.0,携帯だってここまで買わないとか無理じゃん多分
3211.0,3213.0,お前らラグ見にくくてなんかいるんだよね
3213.0,3215.0,ひどいやついるんだよ
3217.0,3219.0,教育パパってかある程度なんかでもね
3221.0,3223.0,高水準ななんか
3223.0,3225.0,教育を受け出してあげたいよな
3225.0,3227.0,俺母親がすごいさ
3227.0,3229.0,例えば塾とかいっぱい
3229.0,3231.0,いかしてくれたし
3231.0,3233.0,なんかいろいろ学費とかもめっちゃ出してくれたからさ
3233.0,3235.0,そうやって考えるとやっぱ
3235.0,3237.0,親からしてもらったことぐらいは
3237.0,3239.0,同じぐらいの水準はやっぱ子供にしてやりたいよな
3241.0,3243.0,不自由はさせたくないよね
3243.0,3245.0,そこの
3245.0,3247.0,俺いっぱい行ったぜ塾
3247.0,3249.0,でも今覚えてるのは東進しかないんだよね
3249.0,3251.0,いっぱい行ったよ
3251.0,3253.0,本当にいかしてもらったわいっぱい
3253.0,3255.0,契約するのやっぱ
3255.0,3257.0,30万とか40万かかるわけじゃん
3259.0,3261.0,なんか早稲田塾みたいなのなかったっけ
3263.0,3265.0,でもちろん書き講師はさ
3265.0,3267.0,いっぱいなんか
3267.0,3269.0,余税みたいなのいったらしい
3271.0,3273.0,早稲田アカデミー
3273.0,3275.0,ガキの頃だったか覚えてねえ
3275.0,3277.0,なんでその塾行ったのやっぱ
3277.0,3279.0,母親も同じ気持ちになってたんじゃない
3279.0,3281.0,同じ気持ちになってたんじゃない
3283.0,3285.0,子供に何歳か聞いたら
3285.0,3287.0,それはまあわかんないな
3287.0,3289.0,小6ぐらいじゃない
3289.0,3291.0,中1とか
3291.0,3293.0,姉ちゃんは勉強できなかったんだよね
3293.0,3295.0,お姉ちゃんは
3295.0,3297.0,じゃあなんで中卒の大学と結婚したの
3297.0,3299.0,うーんなんでだろうね
3299.0,3301.0,だからそういうので見てなかったんだよね
3301.0,3303.0,お父さんはやっぱ立派だったし
3303.0,3305.0,若い頃はやっぱさ
3305.0,3307.0,中学出てすぐ働き始めてさ
3307.0,3309.0,兄弟みんな学校出させてあげてさ
3309.0,3311.0,車の免許は取らせてやってさ
3311.0,3313.0,家はさ
3313.0,3315.0,うちのおじいちゃん働いてなかったから
3315.0,3317.0,家にお金は入れてて結構ね
3317.0,3319.0,若くしてさ頑張ってきたから
3319.0,3321.0,なんかその時は素敵だったんじゃない
3321.0,3323.0,うちの親父の昔の写真見ると超かっけえしパンチパンまで
3323.0,3325.0,クソ決まってんだよ
3325.0,3327.0,今じゃ見る限りもねえけどさ
3327.0,3329.0,お母さんは頭良かったのすごい
3331.0,3333.0,俺
3333.0,3335.0,熟大で月6ぐらいパクってたよ
3335.0,3337.0,そんなになったら涙出てくるんだけど
3339.0,3341.0,大工はやっぱ昔はね
3341.0,3343.0,バブルの時代はね
3343.0,3345.0,稼げたからな
3345.0,3347.0,でもそんな子供になったらすげえ部屋なんだけど
3349.0,3351.0,俺陶器工事
3351.0,3353.0,俺もあれだけど
3353.0,3355.0,大学時期にばっくれたこと
3355.0,3357.0,一個受かってあと全部ばっくれたけど
3357.0,3359.0,普通に行って
3359.0,3361.0,ホテルで泊まって
3361.0,3363.0,いや今日行かねえで
3363.0,3365.0,渋谷行ったわそういえば
3365.0,3367.0,懐かしい思い出
3367.0,3369.0,母ちゃんに落ちたって言ったけど全部
3371.0,3373.0,ほんと謝りたいその時の
3373.0,3375.0,4万ぐらいすんじゃんあれ
3375.0,3377.0,4万ぐらいすんじゃん
3379.0,3381.0,ホテルでさ
3381.0,3383.0,あれだよ
3383.0,3385.0,蹴りたい背中と蛇にピアス
3385.0,3387.0,ちょうどその二人が
3387.0,3389.0,受賞した年に
3389.0,3391.0,俺たぶん受験だったのね
3391.0,3393.0,印刷読みたくて
3393.0,3395.0,今でも忘れねえよあのゲオ
3395.0,3397.0,渋谷のさ
3397.0,3399.0,東急東横インに泊まったんだよ俺
3399.0,3401.0,1万5千円一部屋
3401.0,3403.0,で2日間か何か2日か3日間
3403.0,3405.0,泊まり込みで受験行ったんだけど
3405.0,3407.0,もう受験せずに
3407.0,3409.0,ずーっと渋谷で
3409.0,3411.0,ナンパするか
3411.0,3413.0,蹴りたい背中を読んでたわ
3413.0,3415.0,直木少年さそうそうそう
3415.0,3417.0,18の頃
3417.0,3419.0,あごめん
3419.0,3421.0,東急インだけど東横インだ
3421.0,3423.0,東横イン
3423.0,3425.0,東急東横先頭
3425.0,3427.0,間違えちゃった
3427.0,3429.0,東横インだそうそうそう
3429.0,3431.0,蹴りたい背中
3431.0,3433.0,なんか忘れちゃったよもう
3433.0,3435.0,忘れてしまった
3435.0,3437.0,10年前だな
3437.0,3439.0,10年前
3439.0,3441.0,懐かしい
3441.0,3443.0,俺今でもたまに行くんだよ
3443.0,3445.0,自分のなんか
3447.0,3449.0,ここから俺は始まったな
3449.0,3451.0,何にも始まってねぇのに
3451.0,3453.0,観賞にしたりに行く
3453.0,3455.0,ここから俺の渋谷ライフ始まったんだな
3455.0,3457.0,みたいな感じで俺の
3457.0,3459.0,ソース
3459.0,3461.0,あいつにさ
3461.0,3463.0,東山にちょっとナレーション
3463.0,3465.0,当ててほしいわ俺のルーツ
3469.0,3471.0,歩こう
3471.0,3473.0,歩こうみたいなさ
3473.0,3475.0,そういう歌あんじゃん
3475.0,3477.0,あのBGMバックに東山に
3477.0,3479.0,ナレーションしてほしい
3479.0,3481.0,なんかそういう歌あるじゃん
3483.0,3485.0,あの歌聞いて
3485.0,3487.0,歩いて歩こう
3487.0,3489.0,みたいな歌あんじゃん
3489.0,3491.0,最近の歌
3491.0,3493.0,ちょっと聞こうぜあれ
3493.0,3495.0,菅氏顔なのあれ
3497.0,3499.0,そう仕事の流儀そうそうそう
3499.0,3501.0,なんでも思える答えが返ってくるな
3503.0,3505.0,そうプロフェッショナルのやつ
3505.0,3507.0,ちょっと聞こう
3507.0,3509.0,あれ菅氏顔なんだ
3511.0,3513.0,ちょっと作ってくれ
3513.0,3515.0,東山に頼んで
3515.0,3517.0,なんていうタイトルあれ
3521.0,3523.0,なんだっけ
3523.0,3525.0,プロフェッショナル
3529.0,3531.0,プログレス
3531.0,3533.0,センキュー
3533.0,3535.0,プログレス
3537.0,3539.0,菅で出てくるか
3545.0,3547.0,youtube鳴らしてバンとかねーやろ
3547.0,3549.0,うわーイヤホンしてねーから聞けねー
3549.0,3551.0,最悪
3551.0,3553.0,割と最悪
3555.0,3557.0,ちょっと一回止めていいか
3557.0,3559.0,聞くわ
3583.0,3585.0,ちょっとごめんな
3587.0,3589.0,これこれ
3589.0,3591.0,これこれ
3595.0,3597.0,これ何のテーマだっけ
3599.0,3601.0,俺東山のイメージがあるんだけど
3607.0,3609.0,ここがうんこちゃんのルーツだみたいな感じで
3609.0,3611.0,そのあとこれが流れて
3611.0,3613.0,俺が東洋公園を
3613.0,3615.0,眺めているところで閉めてほしい
3617.0,3619.0,ちょっと作ってくれ
3619.0,3621.0,かっこいいCM作って
3623.0,3625.0,東山違うか
3625.0,3627.0,ゾーンみたいな
3627.0,3629.0,これこれ
3635.0,3637.0,死ねやっぱり
3641.0,3643.0,憧れた東京生活
3643.0,3645.0,渋谷の画で作ってくれ
3645.0,3647.0,東洋公園で蹴りたい背中を読んでて
3647.0,3649.0,パタってしまうんだよ
3649.0,3651.0,渋谷の街並みに消えていくみたいな
3651.0,3653.0,作ってくれ
3653.0,3655.0,東山の音声を抽出して
3655.0,3657.0,ナレーションつけて
3657.0,3659.0,最後にうんこちゃんのルーツはここだった
3659.0,3661.0,最後菅氏から流して
3663.0,3665.0,マジ頼む
3671.0,3673.0,東山じゃないっけ
3673.0,3675.0,誰?
3679.0,3681.0,マジで作って
3683.0,3685.0,ナンパしてる背中も作ってくれ
3685.0,3687.0,声かけられるけど田舎モンだから
3687.0,3689.0,全然相手されないみたいな
3693.0,3695.0,これこれこれ
3697.0,3699.0,これ作ってくれマジで
3703.0,3705.0,これいいよな
3709.0,3711.0,もうちょっと
3711.0,3713.0,この後が好きなんだよな
3713.0,3715.0,必死でもがいていた
3715.0,3717.0,みたいな
3721.0,3723.0,これがいいんだよ
3733.0,3735.0,一歩だって前に進もう
3739.0,3741.0,これなんかさ俺さ
3741.0,3743.0,あれのテーマ
3743.0,3745.0,なんだっけ
3745.0,3747.0,杉内
3747.0,3749.0,杉内のイメージがあるんだけど
3749.0,3751.0,杉内
3755.0,3757.0,橋本卒師分かんない
3757.0,3759.0,杉内じゃない杉内杉内
3759.0,3761.0,杉内杉内
3761.0,3763.0,杉内
3767.0,3769.0,ああいう系の
3769.0,3771.0,番組面白くない
3771.0,3773.0,ああいう系のコストやらさ
3773.0,3775.0,あとね
3775.0,3777.0,まあその
3777.0,3779.0,戦力外のやつらやらさ
3779.0,3781.0,ああいう系はすごい好きだな
3781.0,3783.0,ドキュメンタリーっていうの
3785.0,3787.0,バースデーも面白いな
3787.0,3789.0,パティシエやらな
3791.0,3793.0,あれでもいつやってるのか
3793.0,3795.0,わかんない
3797.0,3799.0,いつやってるのか
3799.0,3801.0,わかんない
3801.0,3803.0,マジで
3803.0,3805.0,常任スタイリックなの違うでしょ
3807.0,3809.0,雑談だけど
3809.0,3811.0,うんこちゃん成分は入れなくていいんだよ
3811.0,3813.0,俺の中の人の
3813.0,3815.0,俺のルーツは
3815.0,3817.0,ここにあるんだみたいな
3817.0,3819.0,ビダンで終わらせたい
3819.0,3821.0,俺が受験サボったこと
3821.0,3823.0,4万円パクったこと
3823.0,3825.0,払い込んでたんだな
3825.0,3827.0,ちゃんとなんかビダンで
3827.0,3829.0,終わらせたい
3829.0,3831.0,唯一母親に謝らなきゃいけない
3831.0,3833.0,お母さんがさ
3833.0,3835.0,お母さんはそこの大学行ってほしかったみたいなんだけど
3835.0,3837.0,俺別に全然行く気なくても
3837.0,3839.0,よかったからいいやみたいな感じで
3839.0,3841.0,そんで
3841.0,3843.0,俺が学校だったのかな
3843.0,3845.0,お母さんがネットで
3845.0,3847.0,ネットで合格発表を見て
3847.0,3849.0,見たんだよ
3849.0,3851.0,残念ながら
3851.0,3853.0,番号ありませんでしたみたいな
3853.0,3855.0,お母さん悪いよ俺知ってるよ
3855.0,3857.0,受けてねえもんみたいな
3857.0,3859.0,俺何がつらかったって
3859.0,3861.0,落ちて悲しんでるより一番つらかった
3861.0,3863.0,マジか
3863.0,3865.0,力及ばずですか
3865.0,3867.0,本当に
3867.0,3869.0,すごい
3869.0,3871.0,慰めてくれて
3871.0,3873.0,受けてたよみたいな
3873.0,3875.0,受けてすらねえんだけどな
3877.0,3879.0,受けてすらねえんだけどな
3879.0,3881.0,受かっただろうな
3881.0,3883.0,分かんねえ
3883.0,3885.0,たらればじゃん
3885.0,3887.0,たらればじゃないそんなの
3887.0,3889.0,受験なんて運の良さも結構あるでしょ
3897.0,3899.0,早く解放されたかったんだよな
3899.0,3901.0,早く解放されたかったんだよな
3901.0,3903.0,されたかったんだよな
3903.0,3905.0,草抜きで後輩になれたがいい
3905.0,3907.0,草抜きってどこ行ったっけ
3907.0,3909.0,大東文化大学だっけ
3909.0,3911.0,違うアジア大学だ
3911.0,3913.0,アジア大学野球強いよな
3913.0,3915.0,ちょくちょく問題を起こすイメージあるけど
3915.0,3917.0,野球部が
3917.0,3919.0,でもその気持ちわかる
3919.0,3921.0,わかってくれるだろう
3921.0,3923.0,わざわざ東京に来てくれたら
3923.0,3925.0,東京への憧れが
3925.0,3927.0,俺一番強かったからさ
3927.0,3929.0,だから東京デビューしちゃったんだろうな
3929.0,3931.0,19になって
3931.0,3933.0,19の歳
3933.0,3935.0,狂ったように
3935.0,3937.0,狂ったように女を抱いたあの19の歳
3939.0,3941.0,反動だよこれも
3941.0,3943.0,反動だ
3945.0,3947.0,マジで
3949.0,3951.0,東京震災来ると速攻で麻痺するじゃん
3951.0,3953.0,怖いけど仕方ねえよな
3953.0,3955.0,運命だよそれは
3957.0,3959.0,俺の友達ブラケル選手はアジア大学だ
3961.0,3963.0,あそこ野球強いもんね
3963.0,3965.0,強いもんね
3967.0,3969.0,田舎元大学入って爆発する
3969.0,3971.0,そうだよねでもね
3971.0,3973.0,仕方なくない
3973.0,3975.0,だって夢の国だったぞ当時
3977.0,3979.0,なんなんだここは
3979.0,3981.0,みたいな
3981.0,3983.0,なんなんだ
3983.0,3985.0,って思ってたな
3985.0,3987.0,運行的には東京どこが住みやすい
3987.0,3989.0,なんかでも
3989.0,3991.0,職場から近いとこじゃないやっぱ
3993.0,3995.0,大学受かったフリして一人暮らしはやばすぎ
3995.0,3997.0,それはちょっとやばくないか
3997.0,3999.0,それ
3999.0,4001.0,なに大学受かったフリして一人暮らしって
4001.0,4003.0,ハイレベルだな来年受かればいいや
4003.0,4005.0,みたいなすげえなそういう性格
4005.0,4007.0,なりたかったら高田健一も同じようなタイプだよね
4011.0,4013.0,俺は21年東京住んでるけど
4013.0,4015.0,21歳ってことは
4015.0,4017.0,東京生まれか
4017.0,4019.0,これからだろ21って言ったら
4021.0,4023.0,渋谷って光江で変わったら変わったと思う
4023.0,4025.0,やっぱあの西口じゃなくて
4025.0,4027.0,あの光江側が本当に
4027.0,4029.0,大人の街になってるよね
4031.0,4033.0,本当に大人の街になってると思う
4033.0,4035.0,センター街のほうとかはまだ
4035.0,4037.0,全然若い子が多い
4037.0,4039.0,だろうけどね
4039.0,4041.0,わかんないって最近言ってねえもん
4043.0,4045.0,渋谷の再開発するか
4045.0,4047.0,東横の乗り換え超めんどくさくなったな
4049.0,4051.0,てか俺渋谷に住んでるのに
4051.0,4053.0,うんこになんで会えないの
4053.0,4055.0,渋谷区って広いじゃん
4055.0,4057.0,俺も昔渋谷区住んでたで
4057.0,4059.0,ちょろっとだけ
4059.0,4061.0,口が裂けても渋谷区って言えないようなとこだったけど
4063.0,4065.0,来年大学卒業する
4065.0,4067.0,千葉住みだけど就職は東京いいね
4067.0,4069.0,そういうとき一番テンション上がるよな
4069.0,4071.0,一番テンション上がるよな
4073.0,4075.0,もう何も
4075.0,4077.0,ないからな
4077.0,4079.0,俺はこれ以上
4079.0,4081.0,土地的ステップアップが
4085.0,4087.0,羨ましいそういう
4087.0,4089.0,感情は
4089.0,4091.0,羨ましいな
4091.0,4093.0,俺名古屋とかゴミで就職なのか
4093.0,4095.0,いや名古屋とかめっちゃ住んでるけど
4095.0,4097.0,女の股が軽いってイメージがめっちゃあるわ
4097.0,4099.0,女の股が軽いっていう
4099.0,4101.0,23歳とか
4101.0,4103.0,今すぐ戻りてえよ
4103.0,4105.0,23に一番戻りてえよ
4105.0,4107.0,そっこ仕事やめるよ
4107.0,4109.0,あの仕事
4109.0,4111.0,本当に
4111.0,4113.0,今のこの心のまま戻れるなら
4113.0,4115.0,あの経験値はたまってるはずだから
4115.0,4117.0,すぐもうやめてえよ
4117.0,4119.0,名古屋は海もディスってた
4119.0,4121.0,あそうなんだ
4121.0,4123.0,福岡いいよね
4123.0,4125.0,今度は遊び行く予定だぜ
4125.0,4127.0,福岡
4127.0,4129.0,行きて
4129.0,4131.0,ちょっともう寝よ
4131.0,4133.0,悪い今日寝るわ
4133.0,4135.0,お風呂入って寝ないと
4135.0,4137.0,お肌に悪いさよなら
