start,end,text
1379.0,1381.0,砂糖水口の中でビュッて
1381.0,1383.0,それで病院連れてった
1383.0,1385.0,しつけはどうなんだろうね
1385.0,1387.0,お座りお手おかわり
1387.0,1389.0,待て伏せぐらいかな
1389.0,1391.0,あとハウス
1391.0,1393.0,あとトイレ覚えればもう俺はいいかなと思ってんだけど
1393.0,1395.0,別に芸達者にしたいわけじゃないし
1395.0,1397.0,人間の暮らしにさ
1397.0,1399.0,ライフスタイルに合わせられるぐらいの
1399.0,1401.0,しつけができたらいいかなと思ってんだけど
1401.0,1403.0,吠え癖はねえなあんまり
1403.0,1405.0,なんもない
1405.0,1407.0,噛み癖とかもない
1407.0,1409.0,散歩はまだデビューさせてないな
1409.0,1411.0,坂上忍の犬超かわいいよね
1413.0,1415.0,坂上忍の犬超かわいいよね
1415.0,1417.0,隣の犬が吠える犬
1417.0,1419.0,飼ってて殺そうかと思った
1419.0,1421.0,あれほんとするぜ
1421.0,1423.0,でもうちね結構ね壁厚いから
1423.0,1425.0,大丈夫だとは思う
1427.0,1429.0,大丈夫だとは思う
1429.0,1431.0,あの犬かわいい
1431.0,1433.0,金持ちだ
1433.0,1435.0,じゃなきゃ8匹は飼えねえよ
1435.0,1437.0,金持ちだ
1437.0,1439.0,じゃなきゃ8匹は飼えねえよ
1439.0,1441.0,金持ちじゃないと
1441.0,1443.0,ウナのパグとお見合いしよう
1443.0,1445.0,俺ブルドック飼いてんだよな
1445.0,1447.0,本物の
1447.0,1449.0,ブルドック
1449.0,1451.0,服着とかあんま着せさせる気なかったんだけど
1451.0,1453.0,ポメラニオンってね
1453.0,1455.0,毛がすごい抜けるのね
1455.0,1457.0,だから散歩するときに
1457.0,1459.0,犬アレルギーの人とかもいるから
1459.0,1461.0,周りに配慮して服着させてるらしくて
1461.0,1463.0,毛が舞い上がらないように
1463.0,1465.0,だからそれを知って
1465.0,1467.0,俺も服着させなきゃなって思ったんだよね
1467.0,1469.0,そうそうそう
1469.0,1471.0,舞い散るじゃん
1471.0,1473.0,毛がフワフワって
1473.0,1475.0,あれをそれを抑え込むために
1475.0,1477.0,ジャケットみたいなの
1477.0,1479.0,羽織らせてるんだって
1479.0,1481.0,今は寒毛期
1481.0,1483.0,冬の毛が抜けてくるやっぱそうなんだ
1485.0,1487.0,ただの自己満だと思った
1487.0,1489.0,俺もただの自己満だと思った
1489.0,1491.0,しかも小さい細い犬とかは
1491.0,1493.0,毛が少ない犬とかは
1493.0,1495.0,着させてあげなきゃいけないらしいよ
1495.0,1497.0,着させてあげないと
1497.0,1499.0,いけないんだって
1501.0,1503.0,仕方ないんだって
1503.0,1505.0,ブルブル震えちゃうんだって
1505.0,1507.0,そんなさ骨
1507.0,1509.0,皮と骨の犬をさ
1509.0,1511.0,散歩させなくても良くないと思っちゃうんだけど
1511.0,1513.0,家の中で
1515.0,1517.0,家の中で
1519.0,1521.0,お風呂入れてるよ
1521.0,1523.0,もう空いたんじゃねえかな
1523.0,1525.0,もちもち行こうかなと思ってるけど
1525.0,1527.0,もうちょっと話足りねえから
1527.0,1529.0,食べちゃいけないもの一覧よく見落として
1529.0,1531.0,チョコとか玉ねぎとか
1531.0,1533.0,でも俺毒風呂以外食わせてねえからさ
1533.0,1535.0,基本的に毒風呂以外あげないから
1535.0,1537.0,人間のご飯は100%あげないから
1537.0,1539.0,一応参考までに気を付けるわ
1541.0,1543.0,犬は下手したらそこら辺の人より
1543.0,1545.0,良い暮らししてる
1545.0,1547.0,イチローの犬とか超良い暮らししてるよな
1547.0,1549.0,いや
1549.0,1551.0,毒風呂だけ食わせるのが犬にとって一番良いんだって
1551.0,1553.0,あれはもう究極の食べ物なんだって
1553.0,1555.0,究極の
1555.0,1557.0,センズみたいな食べ物なんだって
1557.0,1559.0,犬にとっての毒風呂って
1561.0,1563.0,あれ怖いよね
1563.0,1565.0,怖いよな
1565.0,1567.0,やっぱ
1567.0,1569.0,悪魔が食わせるとデカくなるんだよな
1569.0,1571.0,なんかいるなマッスル
1571.0,1573.0,マッスルが
1573.0,1575.0,今お湯でぐちゃぐちゃに
1575.0,1577.0,でもぼちぼちなんかね
1577.0,1579.0,歯も結構しっかり生えてきたから
1579.0,1581.0,硬いまま
1581.0,1583.0,ある程度ふやかして食わせてる
1583.0,1585.0,噛み癖つきそうでさ
1585.0,1587.0,うちのぼみは
1587.0,1589.0,毒風呂食わなくなった
1589.0,1591.0,白米を
1591.0,1593.0,求めだした
1593.0,1595.0,だめなんだよね
1595.0,1597.0,絶対それ以外あげないようにする俺も
1597.0,1599.0,あいだ
1599.0,1601.0,白米求めだしたら
1601.0,1603.0,超肉たらしいんだけど
1603.0,1605.0,絶対無理だよ
1605.0,1607.0,無理無理
1607.0,1609.0,カフェインだめなんだ
1609.0,1611.0,でも毒風呂以外食わせない
1613.0,1615.0,缶詰よくて
1615.0,1617.0,ちょっと缶詰混ぜてあげてたんだよね
1617.0,1619.0,かなり痩せてたから
1621.0,1623.0,でもやっぱり人間と一緒で味覚えるんだろうな
1627.0,1629.0,白米に犬用のかつお節をのっけてるよ
1629.0,1631.0,あ、そうなんだ
1633.0,1635.0,そうなんだ
1635.0,1637.0,そういう昔の猫まんま的な感じか
1639.0,1641.0,猫まんま的な
1641.0,1643.0,うちのワルチーズはケンタッキーで
1643.0,1645.0,なんでみんなそういうの食わせんの
1645.0,1647.0,怖くない?
1647.0,1649.0,これあげてみっかみたいな感じ
1649.0,1651.0,うちの猫がアワビ食うみたいな感じ
1651.0,1653.0,うちの猫アワビ超好きでさ
1653.0,1655.0,親父がさ
1655.0,1657.0,ばあちゃんが俺が帰ってくるよ
1657.0,1659.0,アワビをばあって買ってくるんだけど
1659.0,1661.0,それを猫にあげ始めてて
1661.0,1663.0,もうみんな6匹が群がってくるんだよね
1665.0,1667.0,アワビ
1669.0,1671.0,向こうが干してくるからあげたくなるんだよ
1671.0,1673.0,わからんでもねえな
1673.0,1675.0,わからなくもない
1677.0,1679.0,わからなくもないな
1679.0,1681.0,果物いいんだ
1681.0,1683.0,へえ
1683.0,1685.0,でも毒風呂だけでいいや
1685.0,1687.0,こんなのがおいしいんだな
1687.0,1689.0,みたいな感じであげてるけど
1689.0,1691.0,アホみたいに食ってるよ
1691.0,1693.0,絶対食わせねえから
1693.0,1695.0,健康でいてほしいからね
1695.0,1697.0,早死にさせたいのは50年って感じ
1697.0,1699.0,でもわかんねえよな
1699.0,1701.0,健康に気をつけてても死ぬやついるしさ
1701.0,1703.0,アホみたいにタバコ吸ってても長生きするやついるじゃん
1705.0,1707.0,バッタ食わせてたら意外と食ってた
1707.0,1709.0,それすごいな
1709.0,1711.0,毒風呂食べたことない
1711.0,1713.0,実家で鯉を100匹くらい飼ってるんだけど
1713.0,1715.0,鯉の餌を昔食ったことがあって
1715.0,1717.0,それ以来
1717.0,1719.0,動物系のご飯はもう
1719.0,1721.0,絶対食べれないわ
1721.0,1723.0,毒風呂と同じ匂いするよな
1723.0,1725.0,犬と散歩行くと雑草食ってるの
1725.0,1727.0,犬が食べれる雑草みたいなの
1727.0,1729.0,売ってるよなペットショップ
1733.0,1735.0,売ってるじゃん
1735.0,1737.0,細長い大根みたいなやつ
1737.0,1739.0,散歩中に草食べるのは
1739.0,1741.0,繊維が足りないか
1741.0,1743.0,一番苦手なものはなんだろうな
1743.0,1745.0,虫
1745.0,1747.0,最近虫ダメだわ
1747.0,1749.0,昔はさいっぱい殺してたのに
1749.0,1751.0,素手で虫殺してたのにさ
1751.0,1753.0,パンチで
1753.0,1755.0,カエルとかさ
1755.0,1757.0,くし出しにしてたのに
1757.0,1759.0,その対象が人間に移るまでに
1759.0,1761.0,時間はそう長くかからなかった
1761.0,1763.0,ほんとに俺殺してたのね
1763.0,1765.0,コオロギとか
1765.0,1767.0,カエルとか
1767.0,1769.0,見つけ次第処刑してたの
1769.0,1771.0,オキブリも全然平気だったよ
1771.0,1773.0,オキブリいるねー
1773.0,1775.0,今は絶対無理
1775.0,1777.0,今は絶対無理
1779.0,1781.0,カエル殺したら
1781.0,1783.0,寄生虫飛び出るはそうなんだ
1783.0,1785.0,りょうちゃんの最近の面白い話
1785.0,1787.0,んーない
1787.0,1789.0,普通の
1789.0,1791.0,暮らししてんじゃない
1791.0,1793.0,普通の暮らし
1795.0,1797.0,別に特に
1797.0,1799.0,かもなく不可もなく
1799.0,1801.0,ビーデルのおじってラディッツなの?
1801.0,1803.0,全然ちげえだろ
1803.0,1805.0,ビーデルの旦那さんの
1805.0,1807.0,お父さんの
1809.0,1811.0,お兄ちゃんがラディッツだからなんだろうな
1813.0,1815.0,わからない
1815.0,1817.0,ハムスターいじってたら10分くらいで死んだわ
1817.0,1819.0,キンバイの動画を見て
1819.0,1821.0,傷をなめ合え
1821.0,1823.0,珍しいだろこの時間に落とすの
1823.0,1825.0,なんかちょっと
1825.0,1827.0,一番活気がある時間にさ
1827.0,1829.0,やりたくなるやん
1829.0,1831.0,やりたくなるやん
1831.0,1833.0,子供の頃残酷だよ
1833.0,1835.0,猫とか殺してなかったけど
1835.0,1837.0,虫は本当に殺してた
1839.0,1841.0,ちょっとでも疲れちゃったから
1841.0,1843.0,今日は早めに寝ます
1843.0,1845.0,早めに
1845.0,1847.0,プレゼンツの
1847.0,1849.0,6種のどれか教えて
1849.0,1851.0,お前の好みでいいだろ
1851.0,1853.0,ハンドクリーム3000円くらいだぞ
1853.0,1855.0,あんまり微妙かもしんない
1855.0,1857.0,どこでも買えるじゃん
1857.0,1859.0,そのご当地じゃねえからな
1861.0,1863.0,日本で買えちゃうからね
1863.0,1865.0,フランスかなんかが
1865.0,1867.0,あれだったと思うけど
1867.0,1869.0,本店だったと思うけど
1869.0,1871.0,ヨンドシーのポーチ
1871.0,1873.0,分かんねえ
1873.0,1875.0,ヨンドシーのポーチって何のポーチ
1875.0,1877.0,ヨンドシーのポーチ
1881.0,1883.0,俺親に5000円のハンドクリーム買ったわ
1883.0,1885.0,喜んでた
1885.0,1887.0,でも最近いいハンドクリーム
1887.0,1889.0,見つけたんだよね
1889.0,1891.0,アベンヌのコールドクリーム
1891.0,1893.0,結構油分が多いんだけど
1893.0,1895.0,あれは肌荒れしなくていい
1895.0,1897.0,俺肌荒れすぐするんだけど
1897.0,1899.0,みんなにおぬめ
1901.0,1903.0,今の髪型は
1903.0,1905.0,写真撮ってみるわ
1907.0,1909.0,短いよ俺今
1913.0,1915.0,あれだ
1915.0,1917.0,ちょうどね
1917.0,1919.0,あれだ
1919.0,1921.0,広瀬じゃなくて
1921.0,1923.0,あいつ忘れちゃった
1923.0,1925.0,あいつなんだっけ
1925.0,1927.0,忘れちゃった
1929.0,1931.0,忘れちゃった
1931.0,1933.0,スマブキじゃなくてさ
1935.0,1937.0,名前忘れちゃった
1939.0,1941.0,タメスエじゃなくてさ
1941.0,1943.0,いるじゃん
1943.0,1945.0,タメスエみたいなやついるじゃん
1947.0,1949.0,名前忘れちゃったよ
1951.0,1953.0,ずっと同じ髪型のやつ
1953.0,1955.0,ずっと同じ髪型のやつ
1957.0,1959.0,一人も出てきてない
1959.0,1961.0,なんだっけあいつ
1961.0,1963.0,ナリミアとぴったし一緒
1965.0,1967.0,短くするんだったら
1967.0,1969.0,こんぐらいがいいなと思って
1971.0,1973.0,ごめんごめんナリミアだった
1973.0,1975.0,似てんだろタメスエと
1977.0,1979.0,わかんないか
1983.0,1985.0,写真撮ったらいいもん
1985.0,1987.0,あれすんのがめんどくせーからやめた
1989.0,1991.0,言うほど短いか言うほど短くねーよな
1991.0,1993.0,今日もなんか
1993.0,1995.0,行きつけのさ
1995.0,1997.0,マッサージ屋に
1997.0,1999.0,なんか髪の毛伸びるの早いですねって
1999.0,2001.0,言われたわ
2001.0,2003.0,ナリミア超かっこいいよね
2003.0,2005.0,俺最近気づいたわあいつのかっこよさに
2007.0,2009.0,かっこいいわ
2009.0,2011.0,キャッツ
2011.0,2013.0,あのさ最近ナリミアでさ雑誌
2015.0,2017.0,何の雑誌かわかんねーけど
2019.0,2021.0,ポイ感じにした
2025.0,2027.0,伸びてきちゃったんだよな
2027.0,2029.0,襟足切りたいな
2029.0,2031.0,借り上げて
2033.0,2035.0,スマートだかわかんないけど
2035.0,2037.0,なんか出てたよね
2041.0,2043.0,キサラズキャッツアイでナリミアで出てたんだ
2043.0,2045.0,弟か
2045.0,2047.0,あいつの
2047.0,2049.0,久保塚じゃなくて
2049.0,2051.0,全然わかんない
2053.0,2055.0,あいつの弟か
2057.0,2059.0,ささき役だそうだそうだ
2059.0,2061.0,兄の弟かと思ってた
2065.0,2067.0,ちょっと待ってね
2067.0,2069.0,あそうだよね
2069.0,2071.0,兄の弟だよね
2071.0,2073.0,ささき役は違うやつだよな
2073.0,2075.0,兄の弟はささき
2075.0,2077.0,あそういうことだ
2077.0,2079.0,あつまぶきそう
2079.0,2081.0,ささきはつまぶきだろ
2081.0,2083.0,ささきはつまぶき
2085.0,2087.0,あれ面白かったよな
2087.0,2089.0,面白かったと思う
2089.0,2091.0,西村和彦の
2091.0,2093.0,トークショー行ったけどイケメンだ
2093.0,2095.0,西村和彦って誰
2095.0,2097.0,ねね最近さ
2097.0,2099.0,俺めっちゃかっこいいと思う
2099.0,2101.0,俳優いるんだけど
2101.0,2103.0,40歳ぐらいのさ
2105.0,2107.0,あのキムタクの
2107.0,2109.0,あれに出てた人
2111.0,2113.0,あいつ名前なんて言ってんだっけな
2113.0,2115.0,違う違う違う
2115.0,2117.0,あれそれが西島
2117.0,2119.0,すっげえかっこいいやついない
2119.0,2121.0,よく最近超テレビ出てる
2121.0,2123.0,CMとか
2123.0,2125.0,そう西島秀俊
2125.0,2127.0,あいつ超かっこよくない
2127.0,2129.0,なんでいきなり出てきたのあいつ
2129.0,2131.0,あいつ超かっこよくない
2131.0,2133.0,西島秀俊
2133.0,2135.0,画像見せるか
2137.0,2139.0,あいつ超かっこいいよね
2139.0,2141.0,チームバチスタか
2141.0,2143.0,なんかさ
2143.0,2145.0,あいつ白線流しから出てたんだよな
2145.0,2147.0,その時超キメえから
2147.0,2149.0,やっぱ男って
2149.0,2151.0,なんかさ突然イケメンになるってからか
2151.0,2153.0,歳とってからかっこいいなってやついっぱいいるよね
2155.0,2157.0,西島
2163.0,2165.0,秀俊
2167.0,2169.0,すっげえかっこいいんだよ
2171.0,2173.0,ほら
2179.0,2181.0,この人かっこいいだろ
2183.0,2185.0,西島秀俊
2185.0,2187.0,ちょっと待って漢字がわかんねえ
2189.0,2191.0,偽物の西島秀俊が出てきた
2193.0,2195.0,そこまで来たらさ
2195.0,2197.0,テイストでわかるじゃん
2197.0,2199.0,そこまで来たらさ
2203.0,2205.0,西島秀俊いねえんだけど
2205.0,2207.0,こっちか
2207.0,2209.0,西島秀
2209.0,2211.0,もしかしてで出てきてくれや
2213.0,2215.0,秀
2215.0,2217.0,よしこれだ
2217.0,2219.0,映画俳優
2219.0,2221.0,アスナルハクション出てたよな
2221.0,2223.0,こいつめっちゃかっこよくない
2225.0,2227.0,待ってねえ
2229.0,2231.0,俺ねえ
2231.0,2233.0,はっきりとこいつめっちゃ
2233.0,2235.0,好きだわ
2235.0,2237.0,こんななんかかっこいいと思う大人
2237.0,2239.0,久しぶりに久方ぶりに出てきた
2239.0,2241.0,こいつこいつ
2241.0,2243.0,こいつ超かっこよくない
2243.0,2245.0,今の西島秀俊
2245.0,2247.0,こっちも西島秀俊
2247.0,2249.0,こいつ超かっこよくない
2249.0,2251.0,しかもさ
2251.0,2253.0,映像で見るともっとかっこいいんだよね
2253.0,2255.0,かっこいいよなあ
2255.0,2257.0,今さらか
2257.0,2259.0,マジで
2259.0,2261.0,アスナロ
2261.0,2263.0,これ超きめえよ
2265.0,2267.0,これだぞお前
2267.0,2269.0,お前
2269.0,2271.0,どういう暮らししてたらさ
2271.0,2273.0,どういう暮らししてたらさ
2273.0,2275.0,こいつさ
2275.0,2277.0,これだぞ
2283.0,2285.0,これだぞ
2287.0,2289.0,何が操作したんだろうね
2289.0,2291.0,いつ
2293.0,2295.0,面影はあるけどさ
2295.0,2297.0,今のほうが全然かっこいいじゃん
2299.0,2301.0,この人も最近ねえ
2301.0,2303.0,めっちゃ好きだ
2303.0,2305.0,こういうおっさんになりてえ
2305.0,2307.0,マジで
2309.0,2311.0,バチスタっての出てんだ
2311.0,2313.0,俺すげえバカにしてただろ
2313.0,2315.0,この人30代にしては
2315.0,2317.0,老けてないみたいな
2317.0,2319.0,この人も40超えてるよって言われて
2319.0,2321.0,それで一気に好きだった
2321.0,2323.0,超若いじゃんみたいな
2323.0,2325.0,こういうおっさん
2325.0,2327.0,俺32くらいかと思ってた
2327.0,2329.0,これかと思ってた
2331.0,2333.0,かっこいい
2333.0,2335.0,銅眼だよな
2335.0,2337.0,銅眼って意外に歳とってから
2337.0,2339.0,もういけるのかな
2341.0,2343.0,俺結構どっちかっていうとね
2343.0,2345.0,あの若い頃から老けてみられてるから
2345.0,2347.0,羨ましい
2347.0,2349.0,銅眼の人って
2349.0,2351.0,ただでも28になってそんなに
2351.0,2353.0,あんまり若くみられすぎてもやだけど
2353.0,2355.0,若い頃はやっぱ若くみられたいな
2355.0,2357.0,年層にみられたいなって
2359.0,2361.0,思ったけど
2361.0,2363.0,安部寛氏はもっと上じゃねえ
2365.0,2367.0,俺最近ようやくね
2367.0,2369.0,年層に言われる
2369.0,2371.0,年よりちょっと低く言われるぐらいの感じ
2371.0,2373.0,20くらいの頃ずっと26とか言われてた
2373.0,2375.0,すげえやだったんだけど
2375.0,2377.0,最近26ぐらい
2377.0,2379.0,中村徹もかっこいいよね
2379.0,2381.0,中村徹とか
2381.0,2383.0,最近の若いのは
2383.0,2385.0,渋さんにならないよ
2385.0,2387.0,何目線なんだよ
2389.0,2391.0,あの小栗旬がCMやってるの
2391.0,2393.0,コーラの
2393.0,2395.0,あの小栗旬超かっこよくない
2399.0,2401.0,あの小栗旬超かっこよくない
2401.0,2403.0,俺小栗旬も結構好きなんだけど
2403.0,2405.0,俺の好きな人分かるでしょ
2405.0,2407.0,ペプシペプシ
2407.0,2409.0,男くせえ感じが好きなんだよね
2411.0,2413.0,そう桃太郎のやつあれよくない
2415.0,2417.0,あれ映画で見てるよな普通に
2417.0,2419.0,映画で見てるよな
2419.0,2421.0,嵐とかあんま好きじゃないんだよね
2421.0,2423.0,美形なんだろうけど
2423.0,2425.0,あんまり良さがわかんない
2425.0,2427.0,小栗旬とかさ
2427.0,2429.0,生田東馬も好きなんだけど
2429.0,2431.0,それかっこいい男好きでさ
2431.0,2433.0,めっちゃ
2435.0,2437.0,クローズとかの小栗かっこいいよね
2437.0,2439.0,ソリマチ昔好きだったよ
2439.0,2441.0,ガキの頃
2441.0,2443.0,今のソリマチわかんない
2443.0,2445.0,ドーベルマンでなんか人髪砕いたぐらいしかわかんない
2451.0,2453.0,ちょっと待ってな
2453.0,2455.0,鼻をちょっと
2455.0,2457.0,徳山秀典で画像検索してみてくれかっこいいの
2459.0,2461.0,見てえなそれはイケメン
2461.0,2463.0,山田孝之もかっこいいもんな
2463.0,2465.0,俺山田孝之めっちゃ好きだから俳優の中で一番好きだよ
2465.0,2467.0,えー
2467.0,2469.0,徳山
2473.0,2475.0,俺結構男のねイケメンの
2475.0,2477.0,ハードル低いんだよねすっげー
2477.0,2479.0,みんなかっこよく見えちゃうんだよな
2485.0,2487.0,あんまり好きじゃねー
2487.0,2489.0,あんまり好きじゃねーな
2489.0,2491.0,この人徳山なんとかっていう人
2491.0,2493.0,かっこいいんだろうけどすごい
2493.0,2495.0,女の子
2495.0,2497.0,アヒルグチ男でアヒルグチ
2497.0,2499.0,みたいなのあんまり好きじゃないんだよな
2505.0,2507.0,正直僕を見てて思ったら全然高青年だと思ったよ
2507.0,2509.0,全然高青年だと思った
2509.0,2511.0,普通に
2511.0,2513.0,俺言っちゃったもん俺牛魔王みたいな顔してるかと思って
2513.0,2515.0,すげー高青年じゃん
2515.0,2517.0,おーおー
2517.0,2519.0,あれさ
2519.0,2521.0,俺普通さ
2521.0,2523.0,すごいさ
2523.0,2525.0,キャラクター作ってんのね
2525.0,2527.0,日常生活とかあんま喋ったりしないんだけど
2527.0,2529.0,結構寡黙な人間なんだけど
2529.0,2531.0,もうほんと廃止のまんまなんだよね
2531.0,2533.0,はーはーみたいな
2533.0,2535.0,あいつ
2535.0,2537.0,よくも悪くも裏表がないと思う
2537.0,2539.0,あの人
2539.0,2541.0,高田賢士見てどういうところだ
2541.0,2543.0,賢士見てわかんない忘れちゃったよ初めて会った時
2543.0,2545.0,23とかだったかな
2545.0,2547.0,覚えてねーわ
2551.0,2553.0,ポケモンパンの動画あげてるよ
2553.0,2555.0,ポケモンパン知らない
2555.0,2557.0,東出
2557.0,2559.0,マサヒロかっこいいぞ
2559.0,2561.0,ちょっと見てみるわ
2563.0,2565.0,見てみる
2567.0,2569.0,賢士が言ってたな
2569.0,2571.0,うんこちゃんはお前らの想像を
2573.0,2575.0,想像以上に喋らないと
2575.0,2577.0,俺喋んねーぞほんとに
2577.0,2579.0,高田賢士がいる時とかずーっと一人で映画見てたもん
2579.0,2581.0,映画なんかネットやっててゲーム
2581.0,2583.0,ずーっと一人で映画見てた
2583.0,2585.0,趣味が俺さもうちょっとダメじゃん
2585.0,2587.0,映画鑑賞とかって
2589.0,2591.0,高田賢士が隣に泊まりに来てるのに
2591.0,2593.0,映画2本見たからだ俺
2595.0,2597.0,映画1本見終わった後にロンハーのDVDを
2597.0,2599.0,一人で見てくすって笑ってた
2601.0,2603.0,それ二人でいる必要あるの
2603.0,2605.0,もう別に
2605.0,2607.0,なんか寂しいじゃん
2607.0,2609.0,いや楽しいじゃん
2609.0,2611.0,やっぱ多少テンション上がるじゃん
2611.0,2613.0,もだぞ俺
2613.0,2615.0,マジで
2615.0,2617.0,もだぞ本気で
2617.0,2619.0,まぁ布団とかよっちゃんとか
2619.0,2621.0,いやでもね俺正直ね
2621.0,2623.0,布団とかよっちゃんとかといる時も
2623.0,2625.0,喋んないあんまり
2625.0,2627.0,なんか俺とわっちゃんは後ろでニヤニヤしてるっていう
2627.0,2629.0,ほんとそんな感じ
2629.0,2631.0,やっぱ酔っ払えばそれガーってなるけど
2631.0,2633.0,基本俺携帯いじってるぜ
2633.0,2635.0,ふふって
2637.0,2639.0,疲れちゃうね
2641.0,2643.0,わっちゃんは笑うね
2643.0,2645.0,でもねどっちかっていうとわっちゃんは和に入るっていうか
2645.0,2647.0,そんな喋ったりしない
2647.0,2649.0,俺とわっちゃんが
2649.0,2651.0,SE
2651.0,2653.0,わーって
2653.0,2655.0,配信モードは別人格でやっぱ
2655.0,2657.0,あれだよ
2657.0,2659.0,普段喋らない分さ
2659.0,2661.0,ここでバランスとってんじゃないかな
2661.0,2663.0,んでさ
2663.0,2665.0,もともと大して喋んないし
2665.0,2667.0,そんな明るい方でもないんだけど
2667.0,2669.0,暗くねえんだけど明るい方でもないの
2669.0,2671.0,どっちかと和に入れないタイプなんだけど
2671.0,2673.0,配信やめて
2673.0,2675.0,よっちゃんと布団ちゃんが配信やってた
2675.0,2677.0,俺が配信やめてる時
2677.0,2679.0,おめえ配信やめてから暗くなったよなってずーっと言われて
2679.0,2681.0,すげえうざかったわ
2681.0,2683.0,何かとさそういうのに結びつけるやついいんじゃん
2683.0,2685.0,あの時
2685.0,2687.0,俺マジで全部断ってたもん
2687.0,2689.0,うぜえからそういうのが
2691.0,2693.0,あはははは
2693.0,2695.0,うぜえだよ
2695.0,2697.0,すげえ心配してくるの全然
2697.0,2699.0,普通なのにさ
2699.0,2701.0,そのうち遊びに来てない
2701.0,2703.0,頭の中で理屈っぽいこと考えてるでしょ
2703.0,2705.0,なんかね
2705.0,2707.0,その喋る
2707.0,2709.0,あんまり
2709.0,2711.0,戦闘になって何か物事を進めたくないの
2713.0,2715.0,クラスの中心になりたくないのね
2715.0,2717.0,だからスネオ
2717.0,2719.0,一番いいのがスネオみたいなポジションがいいのね
2719.0,2721.0,だからそういう風にしてくれる連中と
2721.0,2723.0,最終的に一緒になったみたいな
2725.0,2727.0,布団でいる時はテンション高かったでしょ
2727.0,2729.0,まあでも
2729.0,2731.0,そうだね
2731.0,2733.0,でもねどっちかっていうと
2733.0,2735.0,布団で二人で遊んでる時は
2735.0,2737.0,ゲームや
2737.0,2739.0,ほんとに黙ってゲームやるか
2739.0,2741.0,ちょっとチュッ
2741.0,2743.0,みたいな
2743.0,2745.0,テンション高くキスしない
2745.0,2747.0,普通に
2747.0,2749.0,みたいな感じでやめてよ
2749.0,2751.0,決して俺はテンション高くないよ
2751.0,2753.0,普通にローテーションでキスしてる
2753.0,2755.0,ずーっと
2757.0,2759.0,イエーイみたいなことやんないよ
2759.0,2761.0,ずーっと
2763.0,2765.0,よっちゃんと布団ちゃんはね
2765.0,2767.0,ハイテンションで保護する
2767.0,2769.0,感じかな
