start,end,text
3181.0,3183.0,俺の返答が来るやん
3183.0,3185.0,難しいっすね笑って返してる
3192.0,3194.0,一応なんかバカにはしなかったわ
3194.0,3196.0,パキスタン料理ってなんだ知らねえ
3196.0,3197.0,だから俺調べるわけよ
3198.0,3200.0,新宿スペースパキスタン料理で
3201.0,3203.0,調べなきゃいけないよな
3210.0,3211.0,変わってるよね
3213.0,3215.0,普通肉食いてえとかさ
3215.0,3217.0,そういう返答来るかなって
3220.0,3221.0,思っていたのに
3223.0,3225.0,もうさ俺そういえば今コメントで思いました
3225.0,3227.0,俺もうういぽやいぽや
3227.0,3230.0,もう危うく今日ういぽ配信やりかけたわ
3230.0,3232.0,もう早くしてくれ
3233.0,3235.0,もう待てねえ
3235.0,3238.0,俺はういぽの体になってるんだ今
3238.0,3240.0,危なくマジで
3240.0,3242.0,ういぽやりかけた
3242.0,3244.0,公式前にゼンクリして
3244.0,3245.0,ゼンクリしてきたんで
3245.0,3247.0,他のやつにしましょうって
3247.0,3248.0,へこきまくって
3248.0,3250.0,欧州参加にすればよくない当日
3250.0,3251.0,なあ
3251.0,3252.0,今からさういぽで
3252.0,3253.0,凱旋盛り上げて
3253.0,3254.0,いるから
3254.0,3255.0,ブレインが
3255.0,3256.0,世界のへこき体で
3256.0,3257.0,ブレインからパクって
3257.0,3259.0,欧州参加すればいいだろうが
3262.0,3263.0,危うくやりかけたわ
3263.0,3265.0,なんとかなるんじゃねえか
3273.0,3274.0,思いましたね
3275.0,3276.0,ニックスが肌子だ
3276.0,3277.0,もう全部忘れてるわ俺
3277.0,3278.0,え、あのー
3278.0,3279.0,勉強しとこ
3284.0,3285.0,勉強しとくわ
3285.0,3286.0,ちゃんと
3286.0,3287.0,もう一度
3294.0,3295.0,もう一度
3295.0,3296.0,もう一度
3296.0,3297.0,もう一度
3297.0,3298.0,もう一度
3298.0,3299.0,もう一度
3299.0,3300.0,もう一度
3300.0,3301.0,もう一度
3301.0,3302.0,もう一度
3302.0,3303.0,もう一度
3304.0,3305.0,俺
3305.0,3307.0,凱旋盛り取れてないね
3307.0,3308.0,いやあれさ
3308.0,3309.0,正直ね
3309.0,3310.0,あの配信
3310.0,3311.0,ちょっと延長する
3311.0,3312.0,あの配信ね
3312.0,3313.0,多分
3313.0,3314.0,何回か
3314.0,3315.0,凱旋盛り挑戦すれば
3315.0,3317.0,取れそうな馬
3317.0,3318.0,可能性がある馬
3318.0,3319.0,何人かいたんだけど
3319.0,3320.0,これ取っちゃったら
3320.0,3322.0,ういぽの公式どうなるんだろうって
3322.0,3324.0,初めて計算が入ったね
3324.0,3325.0,なんか
3325.0,3326.0,違和感がなかったから
3326.0,3327.0,いや別に
3327.0,3328.0,凱旋盛り出せばいいのにって
3328.0,3329.0,俺も思ってたよ
3329.0,3331.0,凱旋盛り出せばいいのになって
3331.0,3332.0,ただもう
3332.0,3334.0,これはもう全てが破綻してしまうんじゃないか
3334.0,3336.0,全てが終わってしまうんじゃないか
3337.0,3338.0,ギリギリのところで
3338.0,3340.0,俺は踏みとどまったんだよ
3345.0,3347.0,ギリギリのところでな
3349.0,3351.0,危うくやりかけた
3363.0,3365.0,めちゃくちゃ順調だったよな
3365.0,3366.0,何時間くらいやったんだろう
3366.0,3369.0,26時間くらいやったのかな
3374.0,3375.0,いやなんかでもね
3375.0,3376.0,EXPERはね
3376.0,3378.0,ALL-Sでも勝てないらしいんだよ
3378.0,3379.0,やっぱHARDくらいがちょうどいいんだよな
3379.0,3381.0,ってかHARDでも勝てねえから
3381.0,3383.0,HARDでも勝てねえから
3383.0,3385.0,俺その全然実に
3385.0,3386.0,27時間やって
3386.0,3388.0,HARDで勝てなかったんだから
3389.0,3391.0,勝てねえんだよ
3391.0,3393.0,初見はまず
3393.0,3394.0,HARDでやるべきなんだよ
3394.0,3396.0,HARDで本当はノーマルでやらなきゃいけないんだけど
3397.0,3398.0,でもまだね
3398.0,3400.0,現実的なんだって
3400.0,3401.0,ALL-Sで勝てないってさ
3401.0,3402.0,なんか
3403.0,3405.0,納得できねえわ
3405.0,3407.0,倉本3ラウンドだと知ってるわ
3408.0,3410.0,ノーマルだったら絶対いける
3412.0,3414.0,ノーマルだったら絶対いけるわ
3416.0,3418.0,いやHARDでも24時間かかるよ
3418.0,3419.0,普通に
3420.0,3422.0,24時間は絶対かかるよ
3424.0,3426.0,なんかね
3426.0,3428.0,血が通ってない
3428.0,3430.0,ウィーポンになっちゃうんだよね
3430.0,3432.0,なんかEXPERで
3432.0,3434.0,EXPERとかもう一個上の
3434.0,3436.0,ULTIMATEで勝つには
3436.0,3439.0,毎年毎年子供20頭産ませるんだって
3439.0,3441.0,そのうちの一番強い馬を
3441.0,3443.0,育てていかなきゃいけないんだって
3443.0,3445.0,それが悲しくてしょうがない
3445.0,3447.0,19頭間引いていかなきゃいけないんだぞ
3450.0,3452.0,本当の作業になっちゃうんだって
3456.0,3458.0,一急入魂でやっぱり来たよね
3458.0,3460.0,血の通わないウィーニングポストになってしまう
3462.0,3464.0,残酷なことを強いられ
3464.0,3466.0,それでも勝てないの?
3468.0,3470.0,そうなんだ
3470.0,3472.0,攻略未来でHARD欧州3冠取れたのは
3472.0,3474.0,50年くらいプレイしてからだわ
3474.0,3476.0,やっぱそんぐらいかかるんだ
3476.0,3478.0,そんぐらいかかるんだ
3482.0,3484.0,そんぐらいかかるんだな
3484.0,3485.0,え?
3485.0,3487.0,生まれた時にすごい演出が出ると
3487.0,3489.0,強い馬ができるんだけど
3489.0,3491.0,そんな演出あるんだ
3493.0,3495.0,ふーん
3496.0,3498.0,知らなかった
3502.0,3504.0,なんかあるんだ
3504.0,3506.0,期待できますよこの子
3506.0,3508.0,なんで出なかったのこの前
3508.0,3510.0,いやそれ史実馬だからでしょ
3518.0,3520.0,史実馬だからじゃないの
3522.0,3524.0,格闘馬でも出るんだ
3526.0,3528.0,へー
3528.0,3530.0,知らなかった
3530.0,3532.0,あなんか
3532.0,3534.0,出たなものすごい勢いで
3534.0,3536.0,この馬
3536.0,3538.0,通り越しちゃったで
3538.0,3540.0,満作のあの馬鹿
3540.0,3542.0,馬鹿こと満作が言ってたよね
3544.0,3546.0,ふーん
3548.0,3550.0,言ってたよね
3550.0,3552.0,あの馬鹿
3552.0,3554.0,馬のこと何も知らない馬鹿
3562.0,3564.0,あったらしいよ脳天気馬鹿
3566.0,3568.0,マハデルピエーロ出た
3568.0,3570.0,あごめんね嘘ついてた
3570.0,3572.0,俺マハデルピエーロなんか存在しないんだよね
3572.0,3574.0,あれおぐりキャップだから
3574.0,3576.0,俺がおぐりキャップにマハデルピエーロっていう名前つけただけで
3576.0,3578.0,みんな騙されてるけど
3578.0,3580.0,あれおぐりキャップなんで
3580.0,3582.0,最強の馬なんで
3582.0,3584.0,オールSなんで
3584.0,3586.0,生まれた時からあの子
3588.0,3590.0,あの子生まれた時からオールSだったんで
3592.0,3594.0,おぐり
3594.0,3596.0,俺のおぐり
3600.0,3602.0,中川翔くんと同じことしたんだよ俺
3602.0,3604.0,コクシー上がってねぇのに
3604.0,3606.0,積んだ
3606.0,3608.0,あれは
3608.0,3610.0,おぐりをイカサマして
3610.0,3612.0,持ってきた
3614.0,3616.0,積んだんですよ
3616.0,3618.0,コクシーを
3622.0,3624.0,この場を借りて謝罪申し上げます
3624.0,3626.0,ショコタンと違うのはやはり
3626.0,3628.0,俺は素直に謝れるところだな
3628.0,3630.0,全国民に謝罪するわ
3630.0,3632.0,日本に住まう
3632.0,3634.0,全競馬ファンに謝罪申し上げます
3634.0,3636.0,大変申し訳ありませんでした
3636.0,3638.0,おぐりを積んでしまい
3642.0,3644.0,公式Cスバ縛るのか
3644.0,3646.0,いやだからあれっしょ
3646.0,3648.0,そういうのさ縛るよって言ってるとまたガチャガチャうるせぇから
3648.0,3650.0,あの縛ってない
3650.0,3652.0,縛らないっていう手で
3652.0,3654.0,あれすればいいっしょ
3654.0,3656.0,作り方がわからないんだから
3656.0,3658.0,作り方がわからないんだよ
3658.0,3660.0,俺は私立場の
3668.0,3670.0,仕方ないよ
3670.0,3672.0,子供の作り方がわからない
3672.0,3674.0,すっ
3676.0,3678.0,勝手にできたら
3678.0,3680.0,どうしようかな
3680.0,3682.0,売ろうかな
3682.0,3684.0,売る
3684.0,3686.0,売ります
3686.0,3688.0,俺競馬全然行ったことないよ
3688.0,3690.0,一回だけ見に行ったことあるのかな
3692.0,3694.0,一回だけ見に行ったことあるけど
3698.0,3700.0,わかんないわ
3700.0,3702.0,これやら面白いんだろうな
3704.0,3706.0,でもちょっとハマりそうな
3706.0,3708.0,感じがしますね
3710.0,3712.0,今作強制的に私立場持たされるじゃん
3712.0,3714.0,それとも売り飛ばせばいいだろ
3714.0,3716.0,その辺にいる馬を掛け合わせたところから
3716.0,3718.0,ちょっとずつちょっとずつ
3718.0,3720.0,血を濃くしていけばいいだろうが
3720.0,3722.0,インブリードに次ぐインブリードで
3722.0,3724.0,牧場王だって
3724.0,3726.0,緑子と野良犬の子供が
3726.0,3728.0,牧場王だぞ
3728.0,3730.0,ジャパンカップ取ってるんだぞ
3730.0,3732.0,最後カスケードと
3732.0,3734.0,争って
3738.0,3740.0,ちょっとずつちょっとずつ馬に近づけていく
3746.0,3748.0,ちょっとずつな
3754.0,3756.0,あれいつだっけあさってとかだよね
3756.0,3758.0,知識の経験値リセットされてるから
3758.0,3760.0,ちょっとなんか
3760.0,3762.0,あのへこきの動画をもう一回見直して
3764.0,3766.0,まあでも別にさ
3766.0,3768.0,まったりやれ
3768.0,3770.0,僕ら別に
3770.0,3772.0,まったりやれ
3772.0,3774.0,最悪俺帰れなくてもいいし
3774.0,3776.0,なんかそうやって脅迫されてるような体で
3776.0,3778.0,やってるけど俺別に帰れなくても問題ないし
3778.0,3780.0,一週間ぐらい別に帰れなくても
3780.0,3782.0,俺全然問題ないし
3782.0,3784.0,よく考えれば
3784.0,3786.0,もともと帰る気ないから
3786.0,3788.0,大丈夫ですよーって
3790.0,3792.0,野地浮くし
3792.0,3794.0,そのままなんか引っ越しもせずにずっと2年ぐらい住もうかなそこに
3800.0,3802.0,問題ないんですよね
3802.0,3804.0,僕別に帰れなくても
3804.0,3806.0,困らないんですよ
3806.0,3808.0,人質取ったかのように
3808.0,3810.0,歌ってますが
3814.0,3816.0,住民票もそこに早めに
3816.0,3818.0,移さなきゃダメだな
3822.0,3824.0,お前のADHD仲間の
3824.0,3826.0,万楽エネってやつが炎上してる
3826.0,3828.0,なんだADHD仲間って
3828.0,3830.0,俺ADHDじゃねえや
3830.0,3832.0,ただちょっと癖が強い大人だけです
3832.0,3834.0,というか人はみんな
3834.0,3836.0,どこかそういうこだわりってあるんですよ
3836.0,3838.0,人は
3838.0,3840.0,どこかこだわりがあるんですよ
3844.0,3846.0,ういぽで1ヶ月1万円生活
3846.0,3848.0,1ヶ月1万円生活どころか
3848.0,3850.0,1ヶ月全部タダでなおかつ
3850.0,3852.0,金ももらえるから
3852.0,3854.0,とんでもないぞ
3854.0,3856.0,濱口マサルに怒られるんじゃねえか
3856.0,3858.0,1円も使わずになおかつ
3858.0,3860.0,金もらえるんだぞ
3860.0,3862.0,そんな天国
3862.0,3864.0,天の極
3868.0,3870.0,ですね
3874.0,3876.0,なんか
3876.0,3878.0,ダクソの疲れがさ
3878.0,3880.0,ようやく抜けてきたんだよ
3880.0,3882.0,昨日とかも
3882.0,3884.0,えらい寝ちゃったんだよな
3888.0,3890.0,ようやくなんか抜けてきました
3890.0,3892.0,やっぱ30も半ばを迎えると
3892.0,3894.0,そういう蓄積ってあるんだな
3894.0,3896.0,たぶん
3898.0,3900.0,蓄積が
3900.0,3902.0,えぐかったたぶん
3902.0,3904.0,今はもういつもの
3904.0,3906.0,過渡順日に戻りました
3910.0,3912.0,なんかセキュロもたぶん
3912.0,3914.0,なんだかんだでクレできるよ
3914.0,3916.0,40時間くらいで
3916.0,3918.0,なんだかんだで4、50時間でクレできる
3918.0,3920.0,40時間でもう1回経験してんだから
3920.0,3922.0,もう大丈夫だよ
3922.0,3924.0,いけるいける
3924.0,3926.0,その頃には攻略情報出回ってるしね
3926.0,3928.0,1から全部攻略するわけじゃないし
3930.0,3932.0,そういうアドバンテージがあるんですよ
3932.0,3934.0,僕たちには
3934.0,3936.0,だから
3936.0,3938.0,攻略情報出回ってるしね
3938.0,3940.0,攻略情報出回ってるしね
3940.0,3942.0,1から全部攻略するわけじゃないし
3942.0,3944.0,そういうアドバンテージがあるんですよ
3944.0,3946.0,そういうアドバンテージがあるんですよ
3946.0,3948.0,僕たちには
3950.0,3952.0,みんなちょっとやっぱ
3952.0,3954.0,迷ってる時間とかもあるでしょ
3954.0,3956.0,うちらそういうのないから
3956.0,3958.0,単純にボス戦だけだしね
3958.0,3960.0,いやダクソ3おもろかったな
3960.0,3962.0,ダウンロードコンテンツやろっかな
3962.0,3964.0,ダクソ3の
3964.0,3966.0,ダウンロードコンテンツまでいくのに結構時間かかる?
3966.0,3968.0,どこにある?
3968.0,3970.0,どこにある?
3972.0,3974.0,ダウンロードコンテンツやろっかなダクソ3の
3976.0,3978.0,あれゼンクリしなきゃ出ない?
3980.0,3982.0,多分もう1回ゼンクリしろって言われたら
3982.0,3984.0,多分10時間でできるの
3984.0,3986.0,そういう時って普通にレベル上げるから俺
3988.0,3990.0,変なこだわり見せずに
3990.0,3992.0,黒騎士とかから武器ぶん取って
3992.0,3994.0,最強の剣とかで
3994.0,3996.0,めちゃめちゃゴリ押ししてくから
3998.0,4000.0,あゼンクリしなくてもいけるんだ
4000.0,4002.0,どっからいけんの
4002.0,4004.0,もうセスタスとかあのバカが使うような武器
4004.0,4006.0,使わねえから俺
4006.0,4008.0,バカじゃんセスタス使ってるやつみんな
4016.0,4018.0,もう
4020.0,4022.0,セスタス金は
4022.0,4024.0,使わなくていいんで
4024.0,4026.0,トイレ行ってくるわ
4030.0,4032.0,おしっこしてきまーす
4052.0,4054.0,おしっこしてきまーす
4054.0,4056.0,おしっこしてきまーす
4056.0,4058.0,おしっこしてきまーす
4058.0,4060.0,おしっこしてきまーす
4060.0,4062.0,おしっこしてきまーす
4062.0,4064.0,おしっこしてきまーす
4064.0,4066.0,おしっこしてきまーす
4066.0,4068.0,おしっこしてきまーす
4068.0,4070.0,おしっこしてきまーす
4070.0,4072.0,おしっこしてきまーす
4072.0,4074.0,おしっこしてきまーす
4074.0,4076.0,おしっこしてきまーす
4076.0,4078.0,おしっこしてきまーす
4078.0,4080.0,おしっこしてきまーす
4082.0,4084.0,おしっこしてきまーす
4084.0,4086.0,おしっこしてきまーす
4086.0,4088.0,おしっこしてきまーす
4088.0,4090.0,おしっこしてきまーす
4090.0,4092.0,おしっこしてきまーす
4092.0,4094.0,おしっこしてきまーす
4094.0,4096.0,おしっこしてきまーす
4096.0,4098.0,おしっこしてきまーす
4098.0,4100.0,おしっこしてきまーす
4100.0,4102.0,おしっこしてきまーす
4102.0,4104.0,おしっこしてきまーす
4104.0,4106.0,おしっこしてきまーす
4106.0,4108.0,おしっこしてきまーす
4108.0,4110.0,おしっこしてきまーす
4110.0,4112.0,おしっこしてきまーす
4112.0,4114.0,おしっこしてきまーす
4114.0,4116.0,おしっこしてきまーす
4116.0,4118.0,おしっこしてきまーす
4118.0,4120.0,おしっこしてきまーす
4120.0,4122.0,おしっこしてきまーす
4122.0,4124.0,おしっこしてきまーす
4124.0,4126.0,おしっこしてきまーす
4126.0,4128.0,おしっこしてきまーす
4128.0,4130.0,おしっこしてきまーす
4130.0,4132.0,おしっこしてきまーす
4132.0,4134.0,おしっこしてきまーす
4134.0,4136.0,おしっこしてきまーす
4156.0,4158.0,うるわしゅ
4158.0,4160.0,うんこしてきたわ
4161.0,4163.0,ごきげんうるわしゅ
4173.0,4175.0,やべ、なんかコメビが
4182.0,4185.0,YouTubeにダクソン700周してるやつがいる
4185.0,4187.0,やばいな
4187.0,4189.0,700周はやばいね
4189.0,4191.0,人生ダークソウル
4193.0,4196.0,でもね、これ悪口じゃないんだけど
4198.0,4200.0,ダークソウルやってる
4201.0,4204.0,スタジオにいるスタッフがみんな
4204.0,4206.0,めちゃめちゃ暗いのね
4206.0,4209.0,だから、すげえ雰囲気あってていいんだよね
4209.0,4211.0,アベマとかだとみんな明るいの
4211.0,4215.0,人生バラ色!俺たち好きなことして生きていく!みたいな
4215.0,4218.0,だけどさ、もうダークソウルやってる時はさ
4218.0,4222.0,あえてそういう雰囲気に合わせてくれてるのかわかんないけど
4222.0,4225.0,もう、みんな猛者なのね、猛者
4225.0,4227.0,全員が
4227.0,4229.0,人間性を使ってないの
4230.0,4232.0,猛者がいっぱいいるわけよ
4236.0,4239.0,全員、あれいい雰囲気なんだよな
4239.0,4243.0,すごくね、ダークソウルをやる環境が整って
4243.0,4245.0,整ってる
4246.0,4248.0,全員猛者だからな
4253.0,4255.0,奪われてるんだよ
4261.0,4266.0,ダークソウラどもがやってくれるからよ
4267.0,4269.0,最高なんだよ
4269.0,4277.0,あの人たち45時間付き合った後仕事行ってたからな
4277.0,4279.0,今から仕事行ってきますって
4279.0,4281.0,おー頑張ってねーって帰ってきたけど
4281.0,4284.0,今から仕事行ってきますって言ってた
4284.0,4287.0,猛者だからでも大丈夫っしょ、猛者なんだし
4287.0,4289.0,人間だったらさ、今日休んどきなよって言うけど
4289.0,4292.0,あいつらみんな猛者だから、いけるはずと思って
4294.0,4296.0,猛者ですね
4300.0,4302.0,寝ないから猛者は
4304.0,4307.0,多分交換してると思うんだけど
4307.0,4309.0,向こう側なんてさ、見てねーじゃん
4310.0,4312.0,そんなブラック…
4312.0,4314.0,お前だったら俺たちだってブラック…
4314.0,4317.0,俺たち45時間カメラの前に座らされ続けてたぞ
4317.0,4319.0,俺とモンゴーは
4319.0,4321.0,そりゃダメだろ
4321.0,4323.0,猛者なんだから全員が
4325.0,4328.0,何の仕事があるんだよ分かんねー
4328.0,4330.0,その辺どうなってんだろうねー
4330.0,4332.0,あのままさ
4332.0,4335.0,ずーっとやってたやつの仕事はどうなってたんだろうな
4337.0,4339.0,あのまま
4341.0,4343.0,どうなってたんだろうな
4348.0,4350.0,上手いことやってたんだろうね
4354.0,4356.0,今の頃からスタッフ暗かったの?
4356.0,4358.0,だんだん明るくなってきたんだよ
4358.0,4360.0,昔マジで
4360.0,4362.0,一人すごい仲良い作家さんいるんだけど
4362.0,4365.0,そのダクソの現場で会うときだけめっちゃ気まずいの
4365.0,4367.0,あ、どうもーみたいな
4367.0,4369.0,他のところで会うと、あーうーすみたいな感じで
4369.0,4371.0,すげー仲良く喋るのに
4371.0,4372.0,ダクソの現場で会うと
4372.0,4374.0,話したんだよ
4374.0,4376.0,なんか俺たちってダクソの現場で会うとき
4376.0,4378.0,よそよそしくないですかって話してる
4378.0,4380.0,あれ何なんすかねーって
4380.0,4382.0,猛者なんだろうね多分ね
4382.0,4384.0,不死院だからあそこ
4387.0,4389.0,それがいいじゃんでも
4389.0,4391.0,そうは変わらないでほしい
4391.0,4393.0,もっと
4393.0,4395.0,もっともっと
4395.0,4397.0,ああいう世界観に
4400.0,4402.0,なんか明るかったわ
4402.0,4404.0,今回
4410.0,4412.0,明るかったすごい
4412.0,4414.0,どうもーダクソです
4414.0,4416.0,すごい
4416.0,4418.0,どうもーみたいな感じで
4426.0,4428.0,やだよなー今思えば
4428.0,4430.0,俺とモコはさ
4430.0,4432.0,まだ美味しいじゃん
4432.0,4434.0,人前に立ってる分
4434.0,4436.0,立つこともなくひたすら画面を眺めて
4436.0,4438.0,時折来る音声チェックとか
4438.0,4440.0,時折来るアクシデントに
4440.0,4442.0,ただ45時間備えるって
4442.0,4444.0,地獄よ
4446.0,4448.0,時折来る
4452.0,4454.0,地獄だよな
4462.0,4464.0,地獄だと思うわ
4464.0,4466.0,ダクソより現実世界の方が厳しそう
4472.0,4474.0,まあいろんなお仕事があるんだな
4474.0,4476.0,と思いますね
4476.0,4478.0,今度
4478.0,4480.0,広瀬すずみたいに言ってやろう
4480.0,4482.0,お前らさずっとやってて面白いの?
4482.0,4484.0,ってこと言うわ
4484.0,4486.0,30時間ぐらい経った時に言うわ
4486.0,4488.0,俺とモコはさ出てるから
4488.0,4490.0,おもろいけどさお前らおもろいの?
4490.0,4492.0,そんなんでいいの?そんな人生でいいの?
4492.0,4494.0,すずに言わせるわ
4494.0,4496.0,電話
4496.0,4498.0,あの突擁の携帯から広瀬すずにかけて
4498.0,4500.0,すず言ってやれよ
4502.0,4504.0,お前ら
4514.0,4516.0,なんでマイクを持つ仕事をしようと思ったんだろう
4516.0,4518.0,ってそうやって考えると
4518.0,4520.0,本当に悪魔のようなセリフだよね
4522.0,4524.0,もうポンセがYouTuberになった話は
4524.0,4526.0,したよもう20分したよ
4526.0,4528.0,笠原がYouTuberになった話
4528.0,4530.0,ポンセがYouTuberになった話
4530.0,4532.0,ポンセと高木豊が今度コラボするかもしれない話
4532.0,4534.0,開始5分で
4534.0,4536.0,下押したわ
4540.0,4542.0,下押しました
4552.0,4554.0,クラウドがYouTuberになったら
4554.0,4556.0,伸びなさそう
4556.0,4558.0,YouTube
4558.0,4560.0,でも野球よりは
4560.0,4562.0,うまそうだな
4562.0,4564.0,野球よりは才能ありそう
4566.0,4568.0,頑張ってほしいけどなぁ
4568.0,4570.0,手のひら返させてほしいなぁ
4570.0,4572.0,裏元にも
4576.0,4578.0,手のひら返させてほしいね
4582.0,4584.0,甲子園全く見てないわ
4584.0,4586.0,ならしの出てるでしょ勝ってる
4586.0,4588.0,全然見てないわ
4588.0,4590.0,春光やってるねそういえばね
4592.0,4594.0,なんかさ清涼高校にえぐいピッチャーいる
4594.0,4596.0,っていうニュースは見た
4598.0,4600.0,ならしのまだなんだ
4602.0,4604.0,やばいやついるんでしょ奥川だっけ
4604.0,4606.0,清涼のなんかえぐいやついるんでしょ
4606.0,4608.0,見てみたいなぁ
4608.0,4610.0,まだ映像で見てないわ
4612.0,4614.0,17脱散死に取ったんだっけ
4614.0,4616.0,もうひと伸びしそうだね
4620.0,4622.0,横浜がサイン盗みたので援助してた
4622.0,4624.0,高校野球だったら
4624.0,4626.0,多少は多めに見てやってほしいな
4626.0,4628.0,多少はな
4628.0,4630.0,握手しないレアなんだので
4632.0,4634.0,えならしのと清涼なんだ
4634.0,4636.0,それは見よ
4636.0,4638.0,それ見ます
4644.0,4646.0,それは見させていただきます
4650.0,4652.0,あれNHKで今やってるってことだよね
4658.0,4660.0,楽しみだな
4660.0,4662.0,平成最後の選抜でしょ
4664.0,4666.0,明日見ようかな
4666.0,4668.0,今年も町会議出るわ
4668.0,4670.0,なんかどのブースに出るかちょっと
4670.0,4672.0,まだ確認してないけど
4672.0,4674.0,ニコラジブースだ
4674.0,4676.0,多分発表になってたんじゃないかな
4678.0,4680.0,そんないっぱいは出ないと思うよ
4680.0,4682.0,そこだけかな
4684.0,4686.0,それ以外には多分出ないと思うわ
4686.0,4688.0,昨日なんか発表会やってたよね
4690.0,4692.0,発表会みたいなの
4694.0,4696.0,やってましたね
4696.0,4698.0,どんな
4698.0,4700.0,今年の町会議って
4700.0,4702.0,どんなあれが
4704.0,4706.0,目玉なの
4706.0,4708.0,どうせあれだろバーチャルユーチューバーが
4708.0,4710.0,アータコーダーだろ
4710.0,4712.0,だよね多分ね
4712.0,4714.0,バーチャルユーチューバーが
4714.0,4716.0,アータコーダー
4718.0,4720.0,だよね多分ね
4724.0,4726.0,おそらくなんかそんな感じなんだろうなとは
4730.0,4732.0,いつまで続くかわかんないよな
4732.0,4734.0,正直結構
4734.0,4736.0,厳しい戦い続いてるでしょ
4736.0,4738.0,竹田哲也来るの
4738.0,4740.0,絶対写真撮ってもらおう
4742.0,4744.0,すげえキレられそう
4744.0,4746.0,めちゃめちゃ怒りそう
4746.0,4748.0,すげえ冷たそうじゃない
4748.0,4750.0,カメラ回ってなかったら
4752.0,4754.0,俺キレよ
4754.0,4756.0,人間じゃないからな
4756.0,4758.0,遠くからキレるわ
4758.0,4760.0,哲也に
4760.0,4762.0,そこで俺が哲也と入れ替わる
4762.0,4764.0,俺が竹田哲也の名を
4764.0,4766.0,修名します
4768.0,4770.0,絶対撮ってくれないから
4770.0,4772.0,遠近法でうまく二人で撮るわ
4772.0,4774.0,竹田哲也が向こう側にいるときに
4774.0,4776.0,番長角度で
4776.0,4778.0,いじでも
4778.0,4780.0,たまたま自撮りしたら哲也映ってたよーって
4780.0,4782.0,あいつ哲也って呼び捨てすると
4782.0,4784.0,怒るぞ
