start,end,text
4784.0,4786.0,いいじゃん一郎みたいな
4786.0,4788.0,雲の上の存在なんだから呼び捨てさせてよ
4788.0,4790.0,なんだ俺こんなところで
4790.0,4792.0,竹田哲也さんってさ
4792.0,4794.0,友達じゃない
4794.0,4796.0,雲の上なんだからいいじゃん
4796.0,4798.0,直接会ったら敬語で喋るに決まってんじゃん
4798.0,4800.0,俺が松井の話するとき
4800.0,4802.0,松井さん松井さんって言ったらおかしいだろ
4806.0,4808.0,なあ
4808.0,4810.0,松井さん松井さんって
4812.0,4814.0,いいじゃねえかよ
4818.0,4820.0,おめえと写真撮るために来たんじゃねえんだこの野郎
4820.0,4822.0,言いそうだな
4822.0,4824.0,ダンってあの
4824.0,4826.0,机をバンって叩きそうだな
4826.0,4828.0,北斗明とほとんど変わんねえな
4828.0,4830.0,北斗明でもいい
4838.0,4840.0,いいよね
4840.0,4842.0,撮らせてほしいんだ
4842.0,4844.0,ファンなんだもう本当に
4844.0,4846.0,俺3年B組金髪先生ずっと見てたんだって
4850.0,4852.0,ファンなのに
4856.0,4858.0,写真撮ってほしい
4858.0,4860.0,竹田哲也と喧嘩したら勝てる自信ある?
4860.0,4862.0,勝てる自信ない
4862.0,4864.0,確かあの人中学高校の柔道部で
4864.0,4866.0,強いから
4866.0,4868.0,柔道部なんだよ
4868.0,4870.0,めちゃくちゃ強いからな
4874.0,4876.0,金髪のどの人が好きだ
4876.0,4878.0,やっぱなんだろうな
4882.0,4884.0,俺と同い年の
4884.0,4886.0,金瀬健次郎とタメなんだけど
4886.0,4888.0,設定上ね俺が中3の時金瀬健次郎やってたんだけど
4888.0,4890.0,やっぱそれの
4890.0,4892.0,健次郎!
4892.0,4894.0,のとこじゃないやっぱ
4894.0,4896.0,みんな健次郎を
4896.0,4898.0,省いてるのに
4898.0,4900.0,親ですら健次郎と向き合うことしなかったのに
4900.0,4902.0,わざわざ家まで赴いて
4902.0,4904.0,あなたたちが
4904.0,4906.0,あなたたちが
4906.0,4908.0,ちゃんとしないから健次郎!
4908.0,4910.0,ってところかな
4912.0,4914.0,あれのシーンはやっぱもう
4914.0,4916.0,親に説教する金髪
4916.0,4918.0,最高だよね
4926.0,4928.0,いやでもそんなこと言ってたんだって
4936.0,4938.0,絶対できない!
4938.0,4940.0,絶対できない!
4940.0,4942.0,あれすごくない?
4942.0,4944.0,あれさモノマネ芸人とか
4944.0,4946.0,本人登場してさ
4946.0,4948.0,モノマネすんのすげえ恥ずかしくない?
4948.0,4950.0,絶対できないわ!
4950.0,4952.0,1億もらってもやりたくないわ
4952.0,4954.0,武田哲也の前で
4954.0,4956.0,武田哲也のモノマネしろって
4956.0,4958.0,絶対無理だね
4958.0,4960.0,絶対に無理
4964.0,4966.0,無理無理無理無理無理
4966.0,4968.0,ぶん殴られそう
4968.0,4970.0,精神力が
4970.0,4972.0,やっぱ必要だよな
4972.0,4974.0,やっぱ必要だよな
4976.0,4978.0,無理だよ
4980.0,4982.0,できねえ
4990.0,4992.0,恥ずかしい
4992.0,4994.0,藤原達也も無理だな
4994.0,4996.0,藤原達也だったら笑って許してくれそう
4996.0,4998.0,藤原達也だったら笑って許してくれそう
5002.0,5004.0,藤原達也の
5004.0,5006.0,名シーンをあんまり
5006.0,5008.0,覚えてないんだよな
5008.0,5010.0,例えば武田哲也だったら
5010.0,5012.0,僕は死にましえん
5012.0,5014.0,藤原達也の
5014.0,5016.0,名言
5020.0,5022.0,あいつ怒るぞ
5022.0,5024.0,みんな怒るんじゃん
5024.0,5026.0,みんな怒るんじゃねえかよ
5026.0,5028.0,結局
5030.0,5032.0,全員怒るじゃん
5036.0,5038.0,僕はキラなんかじゃない
5038.0,5040.0,信じてくれよ
5040.0,5042.0,言ってるね
5042.0,5044.0,僕はキラだ
5044.0,5046.0,もっと上手かったんだよ
5046.0,5048.0,不駄い不駄い不駄い
5048.0,5050.0,みたいなのできたんだけどな
5050.0,5052.0,一時期極めかかってたんだけど
5052.0,5054.0,だくそで喉焼かれてから
5054.0,5056.0,こういうところに弊害が出てきた
5056.0,5058.0,不駄い
5062.0,5064.0,どうしても北斗のキラに
5064.0,5066.0,吸収されていってしまう
5070.0,5072.0,俺も正直ちょっと嬉しいけど
5072.0,5074.0,だってモノマネされるってさ
5074.0,5076.0,ちょっと
5076.0,5078.0,トップ芸能人とかになってくると
5078.0,5080.0,鬱陶しいんだろうね
5080.0,5082.0,そんな奴だらけになって
5082.0,5084.0,俺ですらさ
5084.0,5086.0,なんの面識もない俺ですらさ
5086.0,5088.0,藤原達也のモノマネとかしてんのにさ
5088.0,5090.0,そんな奴たぶん10万人くらいいるじゃん
5090.0,5092.0,それがさ
5092.0,5094.0,鬱陶しいだろうな
5096.0,5098.0,鬱陶しいだろうね
5106.0,5108.0,うざってなるんだろうな
5108.0,5110.0,めんどくせえ奴ら
5110.0,5112.0,それして俺なんて言えばいいんだよ
5112.0,5114.0,俺もだってやだもんな
5114.0,5116.0,直接今から
5116.0,5118.0,うんこちゃんのモノマネしていいですかって言われたら
5118.0,5120.0,あ、ごめんちょっと今
5120.0,5122.0,またあれメールで送っといて
5122.0,5124.0,俺鳴らすかもしれない
5124.0,5126.0,やだもん寒いもん
5126.0,5128.0,俺のいないところでやってくれる分にはいいけど
5128.0,5130.0,面と向かっちゃできねえよ
5132.0,5134.0,無理だ
5138.0,5140.0,なんかちょっと毛恥ずかしさがあるよね
5144.0,5146.0,鳥肌が立っちゃう
5150.0,5152.0,いや先輩が大石さんとかに
5152.0,5154.0,モノマネされたら楽じゃん
5154.0,5156.0,目上の人だったら
5156.0,5158.0,すげえ楽だけど
5158.0,5160.0,対等の人間にされるとさ
5160.0,5162.0,切れるわけにもいかねえじゃん
5162.0,5164.0,似てねえよバカとか言えねえじゃん
5164.0,5166.0,やばいっすね
5166.0,5168.0,やばいっすねみたいなこと言わなきゃいけないでしょ
5168.0,5170.0,悪優みたいな顔しなきゃいけないでしょ
5170.0,5172.0,カンナ好きのがモノマネしてるさ
5172.0,5174.0,その聞いてるときの顔
5174.0,5176.0,さらに俺が悪優のモノマネして
5176.0,5178.0,待たなきゃいけないわけでしょ
5178.0,5180.0,えぐいぞ弊害が
5188.0,5190.0,いやだわ
5190.0,5192.0,会話の達人って
5192.0,5194.0,会話のモノマネの達人がいるの
5198.0,5200.0,誰お前
5200.0,5202.0,俺の許可なく
5202.0,5204.0,てめえ会話の達人
5204.0,5206.0,名乗ってんじゃねえぞ
5206.0,5208.0,俺の許可なく
5208.0,5210.0,誰が俺に勝ったって
5210.0,5212.0,誰が決めたんだ
5212.0,5214.0,誰が俺に勝ったって
5214.0,5216.0,誰が決めたんだ
5224.0,5226.0,俺が言ってた金髪のシーンがあるらしいから
5226.0,5228.0,みんな見てみてくれ
5228.0,5230.0,ちゃんと捉えてるからな
5232.0,5234.0,こうするべき
5234.0,5236.0,っていうのはちゃんと捉えてるから
5236.0,5238.0,俺もモコのモノマネしたら
5238.0,5240.0,スルーされた
5240.0,5242.0,あいつ放送界じゃほとんどしゃべんねえのにさ
5242.0,5244.0,そんなモノマネされたら
5244.0,5246.0,どういう対応するんだろう
5248.0,5250.0,チョコボール向かいがセックスするときの
5250.0,5252.0,スーが出るだろうな
5252.0,5254.0,一番聞きたくない後輩のスー
5254.0,5256.0,やめてやってくれよ
5256.0,5258.0,やめてやってくれよ
5268.0,5270.0,見たくないわそんなところ
5272.0,5274.0,そんなシーン
5282.0,5284.0,遊戯王のモノマネバズって人気になってる配信社
5284.0,5286.0,べー
5286.0,5288.0,いいところに目をつけた
5288.0,5290.0,遊戯王人気だしね
5294.0,5296.0,寝強いよな
5298.0,5300.0,寝強くない
5302.0,5304.0,母親から35歳でいいよ
5304.0,5306.0,俺も34だから変わんねえじゃねえか
5306.0,5308.0,悲しむことじゃねえ
5308.0,5310.0,まだ埋めるだろ
5315.0,5317.0,40なったらちょっときちいけど
5317.0,5319.0,35だったらいるんじゃねえの
5319.0,5321.0,お前産んでるということは
5321.0,5323.0,計算部だから
5323.0,5325.0,リスク下がるんじゃねえの
5325.0,5327.0,産み算だとリスク高いんだよな
5327.0,5329.0,確かな
5329.0,5331.0,一度妊娠出産を経験してる人って
5331.0,5333.0,体が対応できるんだって
5333.0,5335.0,歳とっても結構
5337.0,5339.0,うちのお母ちゃん40
5339.0,5341.0,うちのお母ちゃん41ぐらいで産んだぞ
5341.0,5343.0,お前産んだってことか
5344.0,5346.0,45でだめだな
5346.0,5348.0,35までにしよう
5349.0,5351.0,今ものすごいちゃんとした
5351.0,5353.0,ソースが
5361.0,5363.0,確かなるソースが今
5363.0,5365.0,俺の目の前に
5367.0,5369.0,現れました
5374.0,5376.0,実際のところさ
5376.0,5378.0,何歳で産むのが
5378.0,5380.0,ベストなんだろう
5380.0,5382.0,22ぐらいかな
5384.0,5386.0,ちくのぼの視聴者99%
5386.0,5388.0,絶対関係ねえから
5388.0,5390.0,多分
5390.0,5392.0,俺が話題に出す前は
5392.0,5394.0,1000人ぐらいいたんだけど
5394.0,5396.0,おそらくじゃあ990人入れ替わっただけだな
5396.0,5398.0,今あいつの配信1000人ぐらい見てるから
5398.0,5400.0,ちくのぼの
5400.0,5402.0,元からいた
5402.0,5404.0,1000人のうち
5404.0,5406.0,990人が
5406.0,5408.0,変な鬱陶しい奴が入ってきたと思っていなくなって
5408.0,5410.0,そこにそっくりそのまま990人埋まったんだろうな
5414.0,5416.0,ただ単純に客層が変わっただけ
5420.0,5422.0,20代後半がベストなのか
5426.0,5428.0,俺が見たとき2000人ぐらいいたよ
5432.0,5434.0,ちく伸びてきたなと思った記憶があったんだよな
5434.0,5436.0,2000人ぐらい
5436.0,5438.0,なんか企画やってたのかな
5442.0,5444.0,2000人ぐらいいたイメージが
5448.0,5450.0,あったけど
5450.0,5452.0,たまたまいたのかな
5456.0,5458.0,顔立ちしたら減った
5458.0,5460.0,顔立ちしたら減ったらしい
5460.0,5462.0,お前それ
5462.0,5464.0,コウスケ理論が起きてんじゃねーかよ
5464.0,5466.0,可愛い顔してんだろ
5466.0,5468.0,やっぱ女って
5468.0,5470.0,本当に元気んだよね
5470.0,5472.0,自分のさ
5472.0,5474.0,想像とかけ離れた顔してるとさ
5474.0,5476.0,まるでちくのぼがブスみたいに
5476.0,5478.0,言ってんじゃねーか今まさに俺が
5480.0,5482.0,顔立ちした瞬間に
5482.0,5484.0,クモの子散らすようにシューって
5484.0,5486.0,いなくなったんだろうね
5486.0,5488.0,でもいずれ訪れるじゃん
5488.0,5490.0,そんな時期って早い方がいいよ
5490.0,5492.0,だったら
5492.0,5494.0,ずーっと顔隠してさ
5494.0,5496.0,なんか期待持たしてさ
5496.0,5498.0,そういう人いっぱいいるけどさ
5498.0,5500.0,早い方がいいよ
5500.0,5502.0,あいつ若いんだし
5502.0,5504.0,23ぐらいだろ
5504.0,5506.0,こっから男一人集めていけんじゃねーかよ
5510.0,5512.0,顔立ちした途端
5512.0,5514.0,急に声も受け付けなくなったらしい
5516.0,5518.0,いきなり無理になったら
5518.0,5520.0,生理的に
5520.0,5522.0,なにこの顔
5522.0,5524.0,この顔から馳せられるこの声も
5524.0,5526.0,キモいってなったってこと
5526.0,5528.0,突如として声も吐き気模様したってこと
5528.0,5530.0,ひどくないか
5532.0,5534.0,なにその現象
5538.0,5540.0,なにその相談
5540.0,5542.0,相談
5546.0,5548.0,男と男だったら別に見た目
5548.0,5550.0,大した気にしねーだろ
5550.0,5552.0,大した気にしねーよ
5552.0,5554.0,ゲーム実況がおもろいとかさ
5554.0,5556.0,その人の生活に興味があるとか
5556.0,5558.0,かっこいいから見てるって
5558.0,5560.0,見てくれだけじゃない気がするわ
5564.0,5566.0,あんま気にしないよね
5566.0,5568.0,俺もだって
5568.0,5570.0,これ実況者誰だろうな
5574.0,5576.0,パッと思いつかないけど
5576.0,5578.0,そんな顔とか興味ない
5578.0,5580.0,むしろツアースとか可愛げのある顔してるなと思ったしな
5586.0,5588.0,あんま気にしねーよ
5588.0,5590.0,女は気にするでしょ
5592.0,5594.0,女は気にするって
5594.0,5596.0,間違いなく
5598.0,5600.0,だってもうそれはもうさ
5600.0,5602.0,どんな
5602.0,5604.0,言い訳をしても
5604.0,5606.0,別に
5606.0,5608.0,その人のことを
5608.0,5610.0,性的に見てないって言っても
5610.0,5612.0,異性ってだけで
5612.0,5614.0,セックス以外では分かり合えないから
5614.0,5616.0,絶対に
5618.0,5620.0,セックスできるかできないかで見てるから
5620.0,5622.0,結局
5622.0,5624.0,間違いないよ
5629.0,5631.0,男子と女子はもう
5631.0,5633.0,絶対に分かり合えないからね
5633.0,5635.0,セックスできるかできないかっていうのを潜在的に
5635.0,5637.0,そこで判断してファンになってるって
5640.0,5642.0,すげーブスだけど
5642.0,5644.0,女の子のファンがいるっていうのはもう歌が上手い以外
5644.0,5646.0,俺ないと思うもん
5646.0,5648.0,あと芸事
5648.0,5650.0,才能に惚れてるみたいなさ
5652.0,5654.0,デッドファイディファイト上手くたってさ
5654.0,5656.0,別にそんな
5656.0,5658.0,そんなだしね
5658.0,5660.0,あれ芸事じゃねーしな
5662.0,5664.0,なんなら世間一般だとマイナスだしね
5668.0,5670.0,キモいしねむしろ
5674.0,5676.0,まるで畜の森抱かれる女
5676.0,5678.0,いるよ
5678.0,5680.0,文房が多いから1000人2000人見てたらさ
5680.0,5682.0,文房多いからさ中には物好きな畜みたいなやつにも
5682.0,5684.0,抱かれてて物好きな女いるけど
5684.0,5686.0,やっぱパイは少ないでしょ
5686.0,5688.0,ヨネズ行っちゃうでしょ
5688.0,5690.0,そりゃあ
5690.0,5692.0,行っちゃうだろ
5698.0,5700.0,勝てないってそんなの
5708.0,5710.0,行っちゃうわけよ
5710.0,5712.0,初恋の彼女は畜の森を狙ってたみたいな
5712.0,5714.0,それ信じない
5714.0,5716.0,それはもし畜から言ったら
5716.0,5718.0,あいつは童貞特有の勘違いしてるわ
5718.0,5720.0,隣に座った女の子が僕のこと好きになっちゃった
5720.0,5722.0,畜の森は童貞だから
5722.0,5724.0,勘違いしてるわけで
5724.0,5726.0,女は畜の森のこと好きにならないから
5726.0,5728.0,俺断言できる
5728.0,5730.0,女は畜の森のこと好きにならないから
5730.0,5732.0,おそらくそれは勘違いだと思う
5732.0,5734.0,知ってるから
5734.0,5736.0,あいつより10年生きてるから俺
5742.0,5744.0,俺はな
5744.0,5746.0,そう思います
5746.0,5748.0,畜の森は
5748.0,5750.0,お母さんの胸しか見たことないって言ってた
5750.0,5752.0,気持ち悪い
5752.0,5754.0,気持ち悪いこと言うんじゃねえ
5756.0,5758.0,気色悪いこと
5758.0,5760.0,言いふらしやがって
5764.0,5766.0,人気出るといいよな
5772.0,5774.0,人気出るといいですね
5776.0,5778.0,そんな苦労してる奴がさ
5778.0,5780.0,なあ
5780.0,5782.0,人気出てさ
5782.0,5784.0,女はべらしてる姿
5784.0,5786.0,見てえじゃん
5786.0,5788.0,角さん楽勝っすね
5788.0,5790.0,人生って楽勝っすね
5790.0,5792.0,って
5792.0,5794.0,調子こいて女の子見て炎上して
5794.0,5796.0,やっぱそのね
5796.0,5798.0,地獄に叩き落とされるぐらいのところまで
5798.0,5800.0,見届けたいじゃん
5800.0,5802.0,そういううちに
5804.0,5806.0,なるからみんなそうやって
5806.0,5808.0,若い頃に女遊びしてない奴って
5808.0,5810.0,みんな女に溺れるから
5810.0,5812.0,もう地区なんか5秒で女に溺れると思うよ
5812.0,5814.0,ちょっとなんかチャンネル登録者数10万人ぐらい
5814.0,5816.0,いったら絶対どんなブスでもチェフされるから
5816.0,5818.0,絶対女なんて腐るほど出てくるわけよ
5818.0,5820.0,それで
5820.0,5822.0,ぐちゃぐちゃになってすぐ
5822.0,5824.0,こいつだけは違うんすよって
5824.0,5826.0,よりにもよってゴミみたいな
5826.0,5828.0,女に捕まるわけよ
5828.0,5830.0,女から叩き落とされてからがようやく始まりじゃねえか
5832.0,5834.0,まだ始まってすらない
5836.0,5838.0,女もうみんなそうでしょ
5838.0,5840.0,みんなそうでしょ
5840.0,5842.0,あいつだけじゃなくてさ
5842.0,5844.0,みんなそうだって
5848.0,5850.0,男なんてそうでしょ
5850.0,5852.0,そうあるべきだよ
5852.0,5854.0,なきゃおかしいよ
5854.0,5856.0,俺信じないぞ
5856.0,5858.0,信じません
5858.0,5860.0,そうあるべきですね
5862.0,5864.0,僕はそういう人たちの味方です
5864.0,5866.0,ようやく始まったなって
5876.0,5878.0,女に限らず叩き落とされた人は割といい感じ
5878.0,5880.0,やっぱ打たれ強くなるからね
5886.0,5888.0,人気者と付き合いたい女のシーンでわからんわ
5888.0,5890.0,あれはやっぱ特有なんだろうな
5896.0,5898.0,なんかさ男の場合さ
5898.0,5900.0,例えばさ芸能人と付き合いたいっていうのはさ
5902.0,5904.0,結局テレビに出てるやつって
5906.0,5908.0,普通にさ街歩いてるやつよりとびきりかわいい
5908.0,5910.0,尺度ものさしでしかないじゃん
5910.0,5912.0,あいつらってさもうそれが中身になるよな
5912.0,5914.0,ほんとにな
5916.0,5918.0,さのひなごってたぶんさ
5918.0,5920.0,テレビ出てるから抱きたいんじゃなくて
5920.0,5922.0,テレビ出れるほどかわいいからやりたい
5922.0,5924.0,ってなるじゃん
5924.0,5926.0,あいつ違うんだよテレビ出てれば誰でもいいんだよ
5926.0,5928.0,ものさしでしかないのにさ
5928.0,5930.0,男性が異性を見るときの
5932.0,5934.0,別に
5934.0,5936.0,ユリアンレトリーバーとは
5936.0,5938.0,セックスしたくないでしょ別に
5940.0,5942.0,女って違うんだよな
5942.0,5944.0,中身になっちゃうんだよな
5944.0,5946.0,それが
5946.0,5948.0,有名だからとかじゃないんだよ
5948.0,5950.0,テレビ出れるくらい見た目で見てくれて
5950.0,5952.0,テレビ出れるくらいかわいい女
5952.0,5954.0,抱きたいっていうさ
5960.0,5962.0,なんかちょっと
5962.0,5964.0,わからない
5964.0,5966.0,感想だわ
5968.0,5970.0,女児特有の
5974.0,5976.0,キンバエとか野田通りとか
5976.0,5978.0,エッチできないでしょ普通
5978.0,5980.0,普通の感覚してたら
5980.0,5982.0,でも配信で人気だからって言うだけで
5982.0,5984.0,あんだけ女にモテるんだよ
5984.0,5986.0,おかしくね
5990.0,5992.0,もう三代
5992.0,5994.0,やめよそこに
5994.0,5996.0,キンバエ野田通り
5996.0,5998.0,畜の坊って言おうと思ったけど
5998.0,6000.0,別に畜の坊そんなブッスンじゃねえわ
6000.0,6002.0,ほんとはなあ
6002.0,6004.0,ほんとはなあ
6004.0,6006.0,そこに入り込んでほしいんだけどなあ
6006.0,6008.0,俺の気持ちとしては
6008.0,6010.0,そこにやっぱ割って入ってほしいんだけどね
6010.0,6012.0,グーっつって
6012.0,6014.0,兄貴ーっつって
6014.0,6016.0,あいつ別にブスじゃねえしな
6016.0,6018.0,爽やかだしな
6020.0,6022.0,そこはちょっと違ったわ
6024.0,6026.0,でもモテるじゃん
6026.0,6028.0,それ言ったら
6028.0,6030.0,ウキョチとかかわいらしいんじゃねえの
6030.0,6032.0,知らねえけど
6032.0,6034.0,声が
6036.0,6038.0,かわいんじゃねえの
6042.0,6044.0,まあでも男性もいるのかそういう人
6048.0,6050.0,男性もいるんだろうね
6050.0,6052.0,気づいてないだけで
6052.0,6054.0,俺ちょっとそういうの全くないからなあ
6056.0,6058.0,友達になるとかさ
6058.0,6060.0,付き合いをするっていう
6060.0,6062.0,のにも
6062.0,6064.0,あんまり全然関係ねえなあ
6064.0,6066.0,だってさ
6066.0,6068.0,大石さんってさ
6068.0,6070.0,アニソン業界だったら
6070.0,6072.0,トップクラスじゃん
6072.0,6074.0,でも別に
6074.0,6076.0,歌手だから
6076.0,6078.0,好きってわけじゃないしな別に
6080.0,6082.0,かと思えば
6082.0,6084.0,ねえ
6084.0,6086.0,みどりさんみたいなちょっときわ者ども
6086.0,6088.0,男性ってやっぱ
6088.0,6090.0,そういうの薄いんだろうね
6090.0,6092.0,その人の持ってるステータスとかには惚れないよなあ
6094.0,6096.0,人間性が
6096.0,6098.0,みんなそうなんじゃない
6098.0,6100.0,人間性重視なんじゃない
6102.0,6104.0,どうでもいいよなあ
6106.0,6108.0,女は
6108.0,6110.0,まあやっぱ気にするよね
6110.0,6112.0,そのへんねえ
6112.0,6114.0,まあ気にするわ
6116.0,6118.0,別にちょっと
6118.0,6120.0,今すぐ芸能人やめたとしても
6120.0,6122.0,別にそれ時点で
6122.0,6124.0,友達ありませんなんてこと絶対ないしなあ
6128.0,6130.0,女性は面倒だよねえ
6130.0,6132.0,長いものに
6134.0,6136.0,松井が結婚できたのもそのおかげだよな
6136.0,6138.0,もうはっきり言ってさ
6138.0,6140.0,俺松井大好きだから言うてけど
6140.0,6142.0,見てくれは
6142.0,6144.0,まあこんなこと言ったら失礼だけど
6144.0,6146.0,ゴミなわけよ松井って
6146.0,6148.0,ゴジラに似てるって言ってるけど
6148.0,6150.0,顔がゴジラに似てるんじゃなくて
6150.0,6152.0,肌質がゴジラに似てるんだよ
6152.0,6154.0,ねえ
6154.0,6156.0,やばいだろ
6156.0,6158.0,顔がゴジラに似てるんじゃないんだよ
6158.0,6160.0,ゴジラの肌ってボッコボコじゃん
6160.0,6162.0,それに似てるって言われてんだよ
6162.0,6164.0,だからゴジラって言われてんだよ
6166.0,6168.0,肌質ゴジラだよ
6168.0,6170.0,でもあんだけキャーキャー言われてんだぜ
6174.0,6176.0,初めてだよ
6178.0,6180.0,顔自体はブスではないだろ松井
6180.0,6182.0,だからもうそれ
6182.0,6184.0,俺もそう思ってるよ
6184.0,6186.0,それは
6186.0,6188.0,ヤンキースで呼ばうってだから
6188.0,6190.0,全然ブスじゃねえだろ
6190.0,6192.0,あれお前コンビニで働いてたらレジ避けるからな
6192.0,6194.0,わけわかんねえ
6194.0,6196.0,190くらいの変な顔がゴジラみたいなやつらが
6196.0,6198.0,レジ打ってたら
6198.0,6200.0,うわあ
6200.0,6202.0,絶対ここ並ばないの
6202.0,6204.0,なるよ
6204.0,6206.0,プロ野球選手だから
6206.0,6208.0,すげえかっこいい
6208.0,6210.0,なんであんな髪の毛ツヤツヤなんだ
6210.0,6212.0,ゴンだったら怒っただろうな
6212.0,6214.0,そのツヤツヤを
6214.0,6216.0,なんで肌に分けてあげなかったんだ
6216.0,6218.0,ゴンが怒ってるの俺聞いたのね
6218.0,6220.0,松井の髪に
6220.0,6222.0,あいつ髪の毛サラッサラだのに
6222.0,6224.0,肌ボッコボコじゃん
6224.0,6226.0,クソキレてたよゴンが
6226.0,6228.0,両男にいたときな松井がまだ
6232.0,6234.0,でもやっぱ
6234.0,6236.0,プロ野球選手だからっていうな
6236.0,6238.0,ものすごくかっこいい
6238.0,6240.0,世界で一番かっこいいからね松井が
6244.0,6246.0,だからね
6246.0,6248.0,よく見えるんだろうな男はよく見えるんだろうな
6248.0,6250.0,男の俺からしてみても
6250.0,6252.0,男は
6252.0,6254.0,かっこいいなって
6256.0,6258.0,思うもん
6260.0,6262.0,あ
6262.0,6264.0,藤井颯太とかもそうじゃん
6264.0,6266.0,あの子まだまだ若いからこれからかっこよくなるだろうけどさ
6266.0,6268.0,めちゃくちゃ女にモテてんだろう
6268.0,6270.0,俺から言わせてみれば
6270.0,6272.0,羽生くんだって気持ち悪いよ
6272.0,6274.0,羽生くんモグラみたいな顔してんじゃん
6274.0,6276.0,でも
6276.0,6278.0,今なんなら一番モテるだろう
6278.0,6280.0,綺麗なモグラじゃん
6280.0,6282.0,綺麗なモグラみたいな顔してんのにさ
6282.0,6284.0,めちゃくちゃモテるだろう
6284.0,6286.0,俺も羽生くんかっこいいなって思うの
6286.0,6288.0,ゾドタウンの社長の
6288.0,6290.0,アッシュでしょ羽生くんで
6290.0,6292.0,でもめちゃくちゃかっこよく見えんじゃん
6292.0,6294.0,あれはやっぱり
6294.0,6296.0,フィギュアスケートという衣まといし羽生が
6298.0,6300.0,めちゃくちゃかっこよく見えるよね
6304.0,6306.0,でもさセブンイレブンでレジ売ってたと思うみんな
6306.0,6308.0,うわぁこれモグラが売ってるよ
6308.0,6310.0,ってなるだろう
6310.0,6312.0,ニコ生で言われちゃうだろう
6312.0,6314.0,今日やぁ
6314.0,6316.0,セブンイレブン行ったらモグラがレジ売ってる
6316.0,6318.0,クソビビったんだけどってなるだろう
6320.0,6322.0,でも俺から見てもやっぱ羽生くんかっこよく見えるんだよ
6322.0,6324.0,めっちゃくちゃ
6326.0,6328.0,めちゃくちゃかっこよく見えるんだよ
6328.0,6330.0,あれはやっぱ男性って
